11:40:09.545148 IP vagrant-ubuntu-trusty-64.60172 > 10.0.0.1.8882: Flags [P.], seq 499441422:499441586, ack 2113429343, win 58, options [nop,nop,TS val 4294713162 ecr 4294713131], length 164
11:40:09.547156 IP 10.0.0.1.8882 > vagrant-ubuntu-trusty-64.60172: Flags [.], ack 499441422, win 63, options [nop,nop,TS val 4294713154 ecr 4294713143], length 0
11:40:09.564304 IP vagrant-ubuntu-trusty-64.60172 > 10.0.0.1.8882: Flags [P.], seq 499441586:499441750, ack 2113429343, win 58, options [nop,nop,TS val 4294713181 ecr 4294713154], length 164
11:40:09.565340 IP 10.0.0.1.8882 > vagrant-ubuntu-trusty-64.60172: Flags [.], ack 499441586, win 65, options [nop,nop,TS val 4294713172 ecr 4294713162], length 0
11:40:09.584996 IP 10.0.0.1.8882 > vagrant-ubuntu-trusty-64.60172: Flags [.], ack 499441750, win 68, options [nop,nop,TS val 4294713192 ecr 4294713181], length 0
11:40:09.585139 IP vagrant-ubuntu-trusty-64.60172 > 10.0.0.1.8882: Flags [P.], seq 499441750:499441914, ack 2113429343, win 58, options [nop,nop,TS val 4294713202 ecr 4294713192], length 164
11:40:09.604997 IP vagrant-ubuntu-trusty-64.60172 > 10.0.0.1.8882: Flags [P.], seq 499441914:499442078, ack 2113429343, win 58, options [nop,nop,TS val 4294713222 ecr 4294713192], length 164
11:40:09.606014 IP 10.0.0.1.8882 > vagrant-ubuntu-trusty-64.60172: Flags [.], ack 499441914, win 70, options [nop,nop,TS val 4294713212 ecr 4294713202], length 0
11:40:09.624784 IP vagrant-ubuntu-trusty-64.60172 > 10.0.0.1.8882: Flags [P.], seq 499442078:499442242, ack 2113429343, win 58, options [nop,nop,TS val 4294713242 ecr 4294713212], length 164
11:40:09.625195 IP 10.0.0.1.8882 > vagrant-ubuntu-trusty-64.60172: Flags [.], ack 499442078, win 72, options [nop,nop,TS val 4294713232 ecr 4294713222], length 0
11:40:09.644428 IP vagrant-ubuntu-trusty-64.60172 > 10.0.0.1.8882: Flags [P.], seq 499442242:499442406, ack 2113429343, win 58, options [nop,nop,TS val 4294713261 ecr 4294713232], length 164
11:40:09.644971 IP 10.0.0.1.8882 > vagrant-ubuntu-trusty-64.60172: Flags [.], ack 499442242, win 74, options [nop,nop,TS val 4294713252 ecr 4294713242], length 0
11:40:09.665099 IP vagrant-ubuntu-trusty-64.60172 > 10.0.0.1.8882: Flags [P.], seq 499442406:499442570, ack 2113429343, win 58, options [nop,nop,TS val 4294713282 ecr 4294713252], length 164
11:40:09.665313 IP 10.0.0.1.8882 > vagrant-ubuntu-trusty-64.60172: Flags [.], ack 499442406, win 76, options [nop,nop,TS val 4294713271 ecr 4294713261], length 0
11:40:09.684461 IP vagrant-ubuntu-trusty-64.60172 > 10.0.0.1.8882: Flags [P.], seq 499442570:499442734, ack 2113429343, win 58, options [nop,nop,TS val 4294713301 ecr 4294713271], length 164
11:40:09.694441 IP 10.0.0.1.8882 > vagrant-ubuntu-trusty-64.60172: Flags [.], ack 499442570, win 78, options [nop,nop,TS val 4294713301 ecr 4294713282], length 0
11:40:09.704473 IP vagrant-ubuntu-trusty-64.60172 > 10.0.0.1.8882: Flags [P.], seq 499442734:499442898, ack 2113429343, win 58, options [nop,nop,TS val 4294713321 ecr 4294713301], length 164
11:40:09.724278 IP vagrant-ubuntu-trusty-64.60172 > 10.0.0.1.8882: Flags [P.], seq 499442898:499443062, ack 2113429343, win 58, options [nop,nop,TS val 4294713341 ecr 4294713301], length 164
11:40:09.732215 IP 10.0.0.1.8882 > vagrant-ubuntu-trusty-64.60172: Flags [.], ack 499442734, win 80, options [nop,nop,TS val 4294713338 ecr 4294713301], length 0
11:40:09.744401 IP vagrant-ubuntu-trusty-64.60172 > 10.0.0.1.8882: Flags [P.], seq 499443062:499443226, ack 2113429343, win 58, options [nop,nop,TS val 4294713361 ecr 4294713338], length 164
11:40:09.764394 IP vagrant-ubuntu-trusty-64.60172 > 10.0.0.1.8882: Flags [P.], seq 499443226:499443390, ack 2113429343, win 58, options [nop,nop,TS val 4294713381 ecr 4294713338], length 164
11:40:09.774242 IP 10.0.0.1.8882 > vagrant-ubuntu-trusty-64.60172: Flags [.], ack 499442734, win 82, options [nop,nop,TS val 4294713380 ecr 4294713301,nop,nop,sack 1 {499442898:499443062}], length 0
11:40:09.784380 IP vagrant-ubuntu-trusty-64.60172 > 10.0.0.1.8882: Flags [P.], seq 499443390:499443554, ack 2113429343, win 58, options [nop,nop,TS val 4294713401 ecr 4294713380], length 164
11:40:09.794919 IP 10.0.0.1.8882 > vagrant-ubuntu-trusty-64.60172: Flags [.], ack 499442734, win 84, options [nop,nop,TS val 4294713402 ecr 4294713301,nop,nop,sack 2 {499443226:499443390}{499442898:499443062}], length 0
11:40:09.795003 IP vagrant-ubuntu-trusty-64.60172 > 10.0.0.1.8882: Flags [P.], seq 499442734:499442898, ack 2113429343, win 58, options [nop,nop,TS val 4294713412 ecr 4294713402], length 164
11:40:09.795036 IP vagrant-ubuntu-trusty-64.60172 > 10.0.0.1.8882: Flags [P.], seq 499443062:499443226, ack 2113429343, win 58, options [nop,nop,TS val 4294713412 ecr 4294713402], length 164
11:40:09.813469 IP 10.0.0.1.8882 > vagrant-ubuntu-trusty-64.60172: Flags [.], ack 499442734, win 86, options [nop,nop,TS val 4294713420 ecr 4294713301,nop,nop,sack 2 {499443226:499443554}{499442898:499443062}], length 0
11:40:09.813510 IP vagrant-ubuntu-trusty-64.60172 > 10.0.0.1.8882: Flags [P.], seq 499443554:499443718, ack 2113429343, win 58, options [nop,nop,TS val 4294713429 ecr 4294713420], length 164
11:40:09.824317 IP 10.0.0.1.8882 > vagrant-ubuntu-trusty-64.60172: Flags [.], ack 499443062, win 88, options [nop,nop,TS val 4294713429 ecr 4294713412,nop,nop,sack 1 {499443226:499443554}], length 0
11:40:09.824321 IP 10.0.0.1.8882 > vagrant-ubuntu-trusty-64.60172: Flags [.], ack 499443554, win 91, options [nop,nop,TS val 4294713429 ecr 4294713412], length 0
11:40:09.824446 IP vagrant-ubuntu-trusty-64.60172 > 10.0.0.1.8882: Flags [P.], seq 499443718:499443882, ack 2113429343, win 58, options [nop,nop,TS val 4294713441 ecr 4294713420], length 164
11:40:09.844572 IP 10.0.0.1.8882 > vagrant-ubuntu-trusty-64.60172: Flags [.], ack 499443718, win 93, options [nop,nop,TS val 4294713450 ecr 4294713429], length 0
11:40:09.844782 IP vagrant-ubuntu-trusty-64.60172 > 10.0.0.1.8882: Flags [P.], seq 499443882:499444046, ack 2113429343, win 58, options [nop,nop,TS val 4294713462 ecr 4294713429], length 164
11:40:09.864254 IP vagrant-ubuntu-trusty-64.60172 > 10.0.0.1.8882: Flags [P.], seq 499444046:499444210, ack 2113429343, win 58, options [nop,nop,TS val 4294713481 ecr 4294713450], length 164
11:40:09.884433 IP vagrant-ubuntu-trusty-64.60172 > 10.0.0.1.8882: Flags [P.], seq 499444210:499444374, ack 2113429343, win 58, options [nop,nop,TS val 4294713501 ecr 4294713450], length 164
11:40:09.886034 IP 10.0.0.1.8882 > vagrant-ubuntu-trusty-64.60172: Flags [.], ack 499443718, win 95, options [nop,nop,TS val 4294713492 ecr 4294713429,nop,nop,sack 1 {499443882:499444046}], length 0
11:40:09.896274 IP 10.0.0.1.8882 > vagrant-ubuntu-trusty-64.60172: Flags [.], ack 499443718, win 97, options [nop,nop,TS val 4294713503 ecr 4294713429,nop,nop,sack 1 {499443882:499444210}], length 0
11:40:09.904538 IP vagrant-ubuntu-trusty-64.60172 > 10.0.0.1.8882: Flags [P.], seq 499444374:499444538, ack 2113429343, win 58, options [nop,nop,TS val 4294713521 ecr 4294713503], length 164
11:40:09.904637 IP 10.0.0.1.8882 > vagrant-ubuntu-trusty-64.60172: Flags [.], ack 499443718, win 99, options [nop,nop,TS val 4294713511 ecr 4294713429,nop,nop,sack 1 {499443882:499444374}], length 0
11:40:09.904677 IP vagrant-ubuntu-trusty-64.60172 > 10.0.0.1.8882: Flags [P.], seq 499443718:499443882, ack 2113429343, win 58, options [nop,nop,TS val 4294713522 ecr 4294713511], length 164
11:40:09.924282 IP vagrant-ubuntu-trusty-64.60172 > 10.0.0.1.8882: Flags [P.], seq 499444538:499444702, ack 2113429343, win 58, options [nop,nop,TS val 4294713541 ecr 4294713511], length 164
11:40:09.925625 IP 10.0.0.1.8882 > vagrant-ubuntu-trusty-64.60172: Flags [.], ack 499443718, win 101, options [nop,nop,TS val 4294713532 ecr 4294713429,nop,nop,sack 1 {499443882:499444538}], length 0
11:40:09.925629 IP 10.0.0.1.8882 > vagrant-ubuntu-trusty-64.60172: Flags [.], ack 499444538, win 103, options [nop,nop,TS val 4294713532 ecr 4294713522], length 0
11:40:09.944349 IP vagrant-ubuntu-trusty-64.60172 > 10.0.0.1.8882: Flags [P.], seq 499444702:499444866, ack 2113429343, win 58, options [nop,nop,TS val 4294713561 ecr 4294713532], length 164
11:40:09.944440 IP 10.0.0.1.8882 > vagrant-ubuntu-trusty-64.60172: Flags [.], ack 499444702, win 105, options [nop,nop,TS val 4294713551 ecr 4294713541], length 0
11:40:09.964278 IP vagrant-ubuntu-trusty-64.60172 > 10.0.0.1.8882: Flags [P.], seq 499444866:499445030, ack 2113429343, win 58, options [nop,nop,TS val 4294713581 ecr 4294713551], length 164
11:40:09.965246 IP 10.0.0.1.8882 > vagrant-ubuntu-trusty-64.60172: Flags [.], ack 499444866, win 107, options [nop,nop,TS val 4294713571 ecr 4294713561], length 0
11:40:09.985098 IP 10.0.0.1.8882 > vagrant-ubuntu-trusty-64.60172: Flags [.], ack 499445030, win 109, options [nop,nop,TS val 4294713591 ecr 4294713581], length 0
11:40:09.985221 IP vagrant-ubuntu-trusty-64.60172 > 10.0.0.1.8882: Flags [P.], seq 499445030:499445194, ack 2113429343, win 58, options [nop,nop,TS val 4294713602 ecr 4294713591], length 164
11:40:10.004446 IP vagrant-ubuntu-trusty-64.60172 > 10.0.0.1.8882: Flags [P.], seq 499445194:499445358, ack 2113429343, win 58, options [nop,nop,TS val 4294713621 ecr 4294713591], length 164
11:40:10.005880 IP 10.0.0.1.8882 > vagrant-ubuntu-trusty-64.60172: Flags [.], ack 499445194, win 111, options [nop,nop,TS val 4294713612 ecr 4294713602], length 0
11:40:10.024255 IP vagrant-ubuntu-trusty-64.60172 > 10.0.0.1.8882: Flags [P.], seq 499445358:499445522, ack 2113429343, win 58, options [nop,nop,TS val 4294713641 ecr 4294713612], length 164
11:40:10.025680 IP 10.0.0.1.8882 > vagrant-ubuntu-trusty-64.60172: Flags [.], ack 499445358, win 114, options [nop,nop,TS val 4294713632 ecr 4294713621], length 0
11:40:10.044383 IP 10.0.0.1.8882 > vagrant-ubuntu-trusty-64.60172: Flags [.], ack 499445522, win 116, options [nop,nop,TS val 4294713651 ecr 4294713641], length 0
11:40:10.044426 IP vagrant-ubuntu-trusty-64.60172 > 10.0.0.1.8882: Flags [P.], seq 499445522:499445686, ack 2113429343, win 58, options [nop,nop,TS val 4294713661 ecr 4294713632], length 164
11:40:10.064484 IP vagrant-ubuntu-trusty-64.60172 > 10.0.0.1.8882: Flags [P.], seq 499445686:499445850, ack 2113429343, win 58, options [nop,nop,TS val 4294713681 ecr 4294713651], length 164
11:40:10.064666 IP 10.0.0.1.8882 > vagrant-ubuntu-trusty-64.60172: Flags [.], ack 499445686, win 118, options [nop,nop,TS val 4294713671 ecr 4294713661], length 0
11:40:10.084396 IP vagrant-ubuntu-trusty-64.60172 > 10.0.0.1.8882: Flags [P.], seq 499445850:499446014, ack 2113429343, win 58, options [nop,nop,TS val 4294713701 ecr 4294713671], length 164
11:40:10.085344 IP 10.0.0.1.8882 > vagrant-ubuntu-trusty-64.60172: Flags [.], ack 499445850, win 120, options [nop,nop,TS val 4294713692 ecr 4294713681], length 0
11:40:10.104670 IP 10.0.0.1.8882 > vagrant-ubuntu-trusty-64.60172: Flags [.], ack 499446014, win 122, options [nop,nop,TS val 4294713711 ecr 4294713701], length 0
11:40:10.104697 IP vagrant-ubuntu-trusty-64.60172 > 10.0.0.1.8882: Flags [P.], seq 499446014:499446178, ack 2113429343, win 58, options [nop,nop,TS val 4294713721 ecr 4294713692], length 164
11:40:10.124350 IP vagrant-ubuntu-trusty-64.60172 > 10.0.0.1.8882: Flags [P.], seq 499446178:499446342, ack 2113429343, win 58, options [nop,nop,TS val 4294713741 ecr 4294713711], length 164
11:40:10.125464 IP 10.0.0.1.8882 > vagrant-ubuntu-trusty-64.60172: Flags [.], ack 499446178, win 124, options [nop,nop,TS val 4294713732 ecr 4294713721], length 0
11:40:10.144567 IP 10.0.0.1.8882 > vagrant-ubuntu-trusty-64.60172: Flags [.], ack 499446342, win 126, options [nop,nop,TS val 4294713751 ecr 4294713741], length 0
11:40:10.144620 IP vagrant-ubuntu-trusty-64.60172 > 10.0.0.1.8882: Flags [P.], seq 499446342:499446506, ack 2113429343, win 58, options [nop,nop,TS val 4294713761 ecr 4294713732], length 164
11:40:10.164399 IP vagrant-ubuntu-trusty-64.60172 > 10.0.0.1.8882: Flags [P.], seq 499446506:499446670, ack 2113429343, win 58, options [nop,nop,TS val 4294713781 ecr 4294713751], length 164
11:40:10.165659 IP 10.0.0.1.8882 > vagrant-ubuntu-trusty-64.60172: Flags [.], ack 499446506, win 128, options [nop,nop,TS val 4294713772 ecr 4294713761], length 0
11:40:10.185330 IP 10.0.0.1.8882 > vagrant-ubuntu-trusty-64.60172: Flags [.], ack 499446670, win 130, options [nop,nop,TS val 4294713791 ecr 4294713781], length 0
11:40:10.185590 IP vagrant-ubuntu-trusty-64.60172 > 10.0.0.1.8882: Flags [P.], seq 499446670:499446834, ack 2113429343, win 58, options [nop,nop,TS val 4294713802 ecr 4294713791], length 164
11:40:10.204633 IP vagrant-ubuntu-trusty-64.60172 > 10.0.0.1.8882: Flags [P.], seq 499446834:499446998, ack 2113429343, win 58, options [nop,nop,TS val 4294713821 ecr 4294713791], length 164
11:40:10.211630 IP 10.0.0.1.8882 > vagrant-ubuntu-trusty-64.60172: Flags [.], ack 499446834, win 132, options [nop,nop,TS val 4294713818 ecr 4294713802], length 0
11:40:10.224646 IP vagrant-ubuntu-trusty-64.60172 > 10.0.0.1.8882: Flags [P.], seq 499446998:499447162, ack 2113429343, win 58, options [nop,nop,TS val 4294713841 ecr 4294713818], length 164
11:40:10.234690 IP 10.0.0.1.8882 > vagrant-ubuntu-trusty-64.60172: Flags [.], ack 499446998, win 135, options [nop,nop,TS val 4294713841 ecr 4294713821], length 0
11:40:10.244335 IP vagrant-ubuntu-trusty-64.60172 > 10.0.0.1.8882: Flags [P.], seq 499447162:499447326, ack 2113429343, win 58, options [nop,nop,TS val 4294713861 ecr 4294713841], length 164
11:40:10.264841 IP vagrant-ubuntu-trusty-64.60172 > 10.0.0.1.8882: Flags [P.], seq 499447326:499447490, ack 2113429343, win 58, options [nop,nop,TS val 4294713882 ecr 4294713841], length 164
11:40:10.274757 IP 10.0.0.1.8882 > vagrant-ubuntu-trusty-64.60172: Flags [.], ack 499446998, win 137, options [nop,nop,TS val 4294713882 ecr 4294713821,nop,nop,sack 1 {499447162:499447326}], length 0
11:40:10.282176 IP vagrant-ubuntu-trusty-64.60172 > 10.0.0.1.8882: Flags [P.], seq 499446998:499447162, ack 2113429343, win 58, options [nop,nop,TS val 4294713899 ecr 4294713882], length 164
11:40:10.284405 IP vagrant-ubuntu-trusty-64.60172 > 10.0.0.1.8882: Flags [P.], seq 499447490:499447654, ack 2113429343, win 58, options [nop,nop,TS val 4294713901 ecr 4294713882], length 164
11:40:10.304436 IP vagrant-ubuntu-trusty-64.60172 > 10.0.0.1.8882: Flags [P.], seq 499447654:499447818, ack 2113429343, win 58, options [nop,nop,TS val 4294713921 ecr 4294713882], length 164
11:40:10.319832 IP 10.0.0.1.8882 > vagrant-ubuntu-trusty-64.60172: Flags [.], ack 499447326, win 139, options [nop,nop,TS val 4294713926 ecr 4294713899], length 0
11:40:10.321408 IP 10.0.0.1.8882 > vagrant-ubuntu-trusty-64.60172: Flags [.], ack 499447326, win 141, options [nop,nop,TS val 4294713928 ecr 4294713899,nop,nop,sack 1 {499447490:499447654}], length 0
11:40:10.321461 IP vagrant-ubuntu-trusty-64.60172 > 10.0.0.1.8882: Flags [P.], seq 499447326:499447490, ack 2113429343, win 58, options [nop,nop,TS val 4294713938 ecr 4294713928], length 164
11:40:10.353511 IP 10.0.0.1.8882 > vagrant-ubuntu-trusty-64.60172: Flags [.], ack 499447654, win 143, options [nop,nop,TS val 4294713959 ecr 4294713938], length 0
11:40:10.353631 IP vagrant-ubuntu-trusty-64.60172 > 10.0.0.1.8882: Flags [P.], seq 499447818:499448146, ack 2113429343, win 58, options [nop,nop,TS val 4294713969 ecr 4294713959], length 328
11:40:10.364325 IP vagrant-ubuntu-trusty-64.60172 > 10.0.0.1.8882: Flags [P.], seq 499448146:499448310, ack 2113429343, win 58, options [nop,nop,TS val 4294713981 ecr 4294713959], length 164
11:40:10.384600 IP 10.0.0.1.8882 > vagrant-ubuntu-trusty-64.60172: Flags [.], ack 499447654, win 145, options [nop,nop,TS val 4294713991 ecr 4294713938,nop,nop,sack 1 {499447818:499448146}], length 0
11:40:10.384764 IP vagrant-ubuntu-trusty-64.60172 > 10.0.0.1.8882: Flags [P.], seq 499448310:499448474, ack 2113429343, win 58, options [nop,nop,TS val 4294714002 ecr 4294713991], length 164
11:40:10.417764 IP 10.0.0.1.8882 > vagrant-ubuntu-trusty-64.60172: Flags [.], ack 499447654, win 147, options [nop,nop,TS val 4294714024 ecr 4294713938,nop,nop,sack 2 {499448310:499448474}{499447818:499448146}], length 0
11:40:10.417917 IP vagrant-ubuntu-trusty-64.60172 > 10.0.0.1.8882: Flags [P.], seq 499447654:499447818, ack 2113429343, win 58, options [nop,nop,TS val 4294714034 ecr 4294714024], length 164
11:40:10.446528 IP 10.0.0.1.8882 > vagrant-ubuntu-trusty-64.60172: Flags [.], ack 499448146, win 149, options [nop,nop,TS val 4294714053 ecr 4294714034,nop,nop,sack 1 {499448310:499448474}], length 0
11:40:10.446634 IP vagrant-ubuntu-trusty-64.60172 > 10.0.0.1.8882: Flags [P.], seq 499448474:499448966, ack 2113429343, win 58, options [nop,nop,TS val 4294714063 ecr 4294714053], length 492
11:40:10.475683 IP 10.0.0.1.8882 > vagrant-ubuntu-trusty-64.60172: Flags [.], ack 499448146, win 151, options [nop,nop,TS val 4294714081 ecr 4294714034,nop,nop,sack 1 {499448310:499448966}], length 0
11:40:10.475747 IP vagrant-ubuntu-trusty-64.60172 > 10.0.0.1.8882: Flags [P.], seq 499448966:499449130, ack 2113429343, win 58, options [nop,nop,TS val 4294714093 ecr 4294714081], length 164
11:40:10.505953 IP 10.0.0.1.8882 > vagrant-ubuntu-trusty-64.60172: Flags [.], ack 499448146, win 153, options [nop,nop,TS val 4294714112 ecr 4294714034,nop,nop,sack 1 {499448310:499449130}], length 0
11:40:10.506029 IP vagrant-ubuntu-trusty-64.60172 > 10.0.0.1.8882: Flags [P.], seq 499448146:499448310, ack 2113429343, win 58, options [nop,nop,TS val 4294714123 ecr 4294714112], length 164
11:40:10.506076 IP vagrant-ubuntu-trusty-64.60172 > 10.0.0.1.8882: Flags [P.], seq 499449130:499449458, ack 2113429343, win 58, options [nop,nop,TS val 4294714123 ecr 4294714112], length 328
11:40:10.533837 IP 10.0.0.1.8882 > vagrant-ubuntu-trusty-64.60172: Flags [.], ack 499449130, win 155, options [nop,nop,TS val 4294714141 ecr 4294714123], length 0
11:40:10.533887 IP vagrant-ubuntu-trusty-64.60172 > 10.0.0.1.8882: Flags [P.], seq 499449458:499449622, ack 2113429343, win 58, options [nop,nop,TS val 4294714151 ecr 4294714141], length 164
11:40:10.534022 IP 10.0.0.1.8882 > vagrant-ubuntu-trusty-64.60172: Flags [.], ack 499449458, win 158, options [nop,nop,TS val 4294714141 ecr 4294714123], length 0
11:40:10.545248 IP vagrant-ubuntu-trusty-64.60172 > 10.0.0.1.8882: Flags [P.], seq 499449622:499449786, ack 2113429343, win 58, options [nop,nop,TS val 4294714162 ecr 4294714141], length 164
11:40:10.555905 IP 10.0.0.1.8882 > vagrant-ubuntu-trusty-64.60172: Flags [.], ack 499449622, win 160, options [nop,nop,TS val 4294714163 ecr 4294714151], length 0
11:40:10.565036 IP vagrant-ubuntu-trusty-64.60172 > 10.0.0.1.8882: Flags [P.], seq 499449786:499449950, ack 2113429343, win 58, options [nop,nop,TS val 4294714182 ecr 4294714163], length 164
11:40:10.569840 IP 10.0.0.1.8882 > vagrant-ubuntu-trusty-64.60172: Flags [.], ack 499449786, win 162, options [nop,nop,TS val 4294714175 ecr 4294714162], length 0
11:40:10.584889 IP vagrant-ubuntu-trusty-64.60172 > 10.0.0.1.8882: Flags [P.], seq 499449950:499450114, ack 2113429343, win 58, options [nop,nop,TS val 4294714202 ecr 4294714175], length 164
11:40:10.585777 IP 10.0.0.1.8882 > vagrant-ubuntu-trusty-64.60172: Flags [.], ack 499449950, win 164, options [nop,nop,TS val 4294714193 ecr 4294714182], length 0
11:40:10.604951 IP vagrant-ubuntu-trusty-64.60172 > 10.0.0.1.8882: Flags [P.], seq 499450114:499450278, ack 2113429343, win 58, options [nop,nop,TS val 4294714222 ecr 4294714193], length 164
11:40:10.609684 IP 10.0.0.1.8882 > vagrant-ubuntu-trusty-64.60172: Flags [.], ack 499450114, win 166, options [nop,nop,TS val 4294714215 ecr 4294714202], length 0
11:40:10.624879 IP vagrant-ubuntu-trusty-64.60172 > 10.0.0.1.8882: Flags [P.], seq 499450278:499450442, ack 2113429343, win 58, options [nop,nop,TS val 4294714241 ecr 4294714215], length 164
11:40:10.629836 IP 10.0.0.1.8882 > vagrant-ubuntu-trusty-64.60172: Flags [.], ack 499450278, win 168, options [nop,nop,TS val 4294714236 ecr 4294714222], length 0
11:40:10.644981 IP vagrant-ubuntu-trusty-64.60172 > 10.0.0.1.8882: Flags [P.], seq 499450442:499450606, ack 2113429343, win 58, options [nop,nop,TS val 4294714262 ecr 4294714236], length 164
11:40:10.648904 IP 10.0.0.1.8882 > vagrant-ubuntu-trusty-64.60172: Flags [.], ack 499450442, win 170, options [nop,nop,TS val 4294714255 ecr 4294714241], length 0
11:40:10.664809 IP vagrant-ubuntu-trusty-64.60172 > 10.0.0.1.8882: Flags [P.], seq 499450606:499450770, ack 2113429343, win 58, options [nop,nop,TS val 4294714282 ecr 4294714255], length 164
11:40:10.669938 IP 10.0.0.1.8882 > vagrant-ubuntu-trusty-64.60172: Flags [.], ack 499450606, win 172, options [nop,nop,TS val 4294714276 ecr 4294714262], length 0
11:40:10.685087 IP vagrant-ubuntu-trusty-64.60172 > 10.0.0.1.8882: Flags [P.], seq 499450770:499450934, ack 2113429343, win 58, options [nop,nop,TS val 4294714302 ecr 4294714276], length 164
11:40:10.691390 IP 10.0.0.1.8882 > vagrant-ubuntu-trusty-64.60172: Flags [.], ack 499450770, win 174, options [nop,nop,TS val 4294714298 ecr 4294714282], length 0
11:40:10.705037 IP vagrant-ubuntu-trusty-64.60172 > 10.0.0.1.8882: Flags [P.], seq 499450934:499451098, ack 2113429343, win 58, options [nop,nop,TS val 4294714322 ecr 4294714298], length 164
11:40:10.709660 IP 10.0.0.1.8882 > vagrant-ubuntu-trusty-64.60172: Flags [.], ack 499450934, win 176, options [nop,nop,TS val 4294714316 ecr 4294714302], length 0
11:40:10.724812 IP vagrant-ubuntu-trusty-64.60172 > 10.0.0.1.8882: Flags [P.], seq 499451098:499451262, ack 2113429343, win 58, options [nop,nop,TS val 4294714342 ecr 4294714316], length 164
11:40:10.731517 IP 10.0.0.1.8882 > vagrant-ubuntu-trusty-64.60172: Flags [.], ack 499451098, win 178, options [nop,nop,TS val 4294714338 ecr 4294714322], length 0
11:40:10.744722 IP vagrant-ubuntu-trusty-64.60172 > 10.0.0.1.8882: Flags [P.], seq 499451262:499451426, ack 2113429343, win 58, options [nop,nop,TS val 4294714362 ecr 4294714338], length 164
11:40:10.749858 IP 10.0.0.1.8882 > vagrant-ubuntu-trusty-64.60172: Flags [.], ack 499451262, win 181, options [nop,nop,TS val 4294714356 ecr 4294714342], length 0
11:40:10.764904 IP vagrant-ubuntu-trusty-64.60172 > 10.0.0.1.8882: Flags [P.], seq 499451426:499451590, ack 2113429343, win 58, options [nop,nop,TS val 4294714382 ecr 4294714356], length 164
11:40:10.771465 IP 10.0.0.1.8882 > vagrant-ubuntu-trusty-64.60172: Flags [.], ack 499451426, win 183, options [nop,nop,TS val 4294714377 ecr 4294714362], length 0
11:40:10.784659 IP vagrant-ubuntu-trusty-64.60172 > 10.0.0.1.8882: Flags [P.], seq 499451590:499451754, ack 2113429343, win 58, options [nop,nop,TS val 4294714401 ecr 4294714377], length 164
11:40:10.793755 IP 10.0.0.1.8882 > vagrant-ubuntu-trusty-64.60172: Flags [.], ack 499451590, win 185, options [nop,nop,TS val 4294714400 ecr 4294714382], length 0
11:40:10.804759 IP vagrant-ubuntu-trusty-64.60172 > 10.0.0.1.8882: Flags [P.], seq 499451754:499451918, ack 2113429343, win 58, options [nop,nop,TS val 4294714422 ecr 4294714400], length 164
11:40:10.811716 IP 10.0.0.1.8882 > vagrant-ubuntu-trusty-64.60172: Flags [.], ack 499451754, win 187, options [nop,nop,TS val 4294714418 ecr 4294714401], length 0
11:40:10.825229 IP 10.0.0.1.8882 > vagrant-ubuntu-trusty-64.60172: Flags [.], ack 499451918, win 189, options [nop,nop,TS val 4294714432 ecr 4294714422], length 0
11:40:10.825314 IP vagrant-ubuntu-trusty-64.60172 > 10.0.0.1.8882: Flags [P.], seq 499451918:499452082, ack 2113429343, win 58, options [nop,nop,TS val 4294714442 ecr 4294714432], length 164
11:40:10.845054 IP vagrant-ubuntu-trusty-64.60172 > 10.0.0.1.8882: Flags [P.], seq 499452082:499452246, ack 2113429343, win 58, options [nop,nop,TS val 4294714462 ecr 4294714432], length 164
11:40:10.846077 IP 10.0.0.1.8882 > vagrant-ubuntu-trusty-64.60172: Flags [.], ack 499452082, win 191, options [nop,nop,TS val 4294714453 ecr 4294714442], length 0
11:40:10.865027 IP vagrant-ubuntu-trusty-64.60172 > 10.0.0.1.8882: Flags [P.], seq 499452246:499452410, ack 2113429343, win 58, options [nop,nop,TS val 4294714482 ecr 4294714453], length 164
11:40:10.866661 IP 10.0.0.1.8882 > vagrant-ubuntu-trusty-64.60172: Flags [.], ack 499452246, win 193, options [nop,nop,TS val 4294714472 ecr 4294714462], length 0
11:40:10.885104 IP vagrant-ubuntu-trusty-64.60172 > 10.0.0.1.8882: Flags [P.], seq 499452410:499452574, ack 2113429343, win 58, options [nop,nop,TS val 4294714502 ecr 4294714472], length 164
11:40:10.886059 IP 10.0.0.1.8882 > vagrant-ubuntu-trusty-64.60172: Flags [.], ack 499452410, win 195, options [nop,nop,TS val 4294714493 ecr 4294714482], length 0
11:40:10.904425 IP vagrant-ubuntu-trusty-64.60172 > 10.0.0.1.8882: Flags [P.], seq 499452574:499452738, ack 2113429343, win 58, options [nop,nop,TS val 4294714521 ecr 4294714493], length 164
11:40:10.905738 IP 10.0.0.1.8882 > vagrant-ubuntu-trusty-64.60172: Flags [.], ack 499452574, win 197, options [nop,nop,TS val 4294714512 ecr 4294714502], length 0
11:40:10.925005 IP 10.0.0.1.8882 > vagrant-ubuntu-trusty-64.60172: Flags [.], ack 499452738, win 199, options [nop,nop,TS val 4294714531 ecr 4294714521], length 0
11:40:10.925063 IP vagrant-ubuntu-trusty-64.60172 > 10.0.0.1.8882: Flags [P.], seq 499452738:499452902, ack 2113429343, win 58, options [nop,nop,TS val 4294714542 ecr 4294714512], length 164
11:40:10.944985 IP vagrant-ubuntu-trusty-64.60172 > 10.0.0.1.8882: Flags [P.], seq 499452902:499453066, ack 2113429343, win 58, options [nop,nop,TS val 4294714562 ecr 4294714531], length 164
11:40:10.946020 IP 10.0.0.1.8882 > vagrant-ubuntu-trusty-64.60172: Flags [.], ack 499452902, win 202, options [nop,nop,TS val 4294714553 ecr 4294714542], length 0
11:40:10.964913 IP vagrant-ubuntu-trusty-64.60172 > 10.0.0.1.8882: Flags [P.], seq 499453066:499453230, ack 2113429343, win 58, options [nop,nop,TS val 4294714582 ecr 4294714553], length 164
11:40:10.971862 IP 10.0.0.1.8882 > vagrant-ubuntu-trusty-64.60172: Flags [.], ack 499453066, win 204, options [nop,nop,TS val 4294714578 ecr 4294714562], length 0
11:40:10.985098 IP vagrant-ubuntu-trusty-64.60172 > 10.0.0.1.8882: Flags [P.], seq 499453230:499453394, ack 2113429343, win 58, options [nop,nop,TS val 4294714602 ecr 4294714578], length 164
11:40:10.985177 IP 10.0.0.1.8882 > vagrant-ubuntu-trusty-64.60172: Flags [.], ack 499453230, win 206, options [nop,nop,TS val 4294714592 ecr 4294714582], length 0
11:40:11.005017 IP vagrant-ubuntu-trusty-64.60172 > 10.0.0.1.8882: Flags [P.], seq 499453394:499453558, ack 2113429343, win 58, options [nop,nop,TS val 4294714622 ecr 4294714592], length 164
11:40:11.006116 IP 10.0.0.1.8882 > vagrant-ubuntu-trusty-64.60172: Flags [.], ack 499453394, win 208, options [nop,nop,TS val 4294714613 ecr 4294714602], length 0
11:40:11.025013 IP vagrant-ubuntu-trusty-64.60172 > 10.0.0.1.8882: Flags [P.], seq 499453558:499453722, ack 2113429343, win 58, options [nop,nop,TS val 4294714642 ecr 4294714613], length 164
11:40:11.025963 IP 10.0.0.1.8882 > vagrant-ubuntu-trusty-64.60172: Flags [.], ack 499453558, win 210, options [nop,nop,TS val 4294714632 ecr 4294714622], length 0
11:40:11.045196 IP vagrant-ubuntu-trusty-64.60172 > 10.0.0.1.8882: Flags [P.], seq 499453722:499453886, ack 2113429343, win 58, options [nop,nop,TS val 4294714662 ecr 4294714632], length 164
11:40:11.045846 IP 10.0.0.1.8882 > vagrant-ubuntu-trusty-64.60172: Flags [.], ack 499453722, win 212, options [nop,nop,TS val 4294714652 ecr 4294714642], length 0
11:40:11.065102 IP vagrant-ubuntu-trusty-64.60172 > 10.0.0.1.8882: Flags [P.], seq 499453886:499454050, ack 2113429343, win 58, options [nop,nop,TS val 4294714682 ecr 4294714652], length 164
11:40:11.065404 IP 10.0.0.1.8882 > vagrant-ubuntu-trusty-64.60172: Flags [.], ack 499453886, win 214, options [nop,nop,TS val 4294714672 ecr 4294714662], length 0
11:40:11.085115 IP vagrant-ubuntu-trusty-64.60172 > 10.0.0.1.8882: Flags [P.], seq 499454050:499454214, ack 2113429343, win 58, options [nop,nop,TS val 4294714702 ecr 4294714672], length 164
11:40:11.085270 IP 10.0.0.1.8882 > vagrant-ubuntu-trusty-64.60172: Flags [.], ack 499454050, win 216, options [nop,nop,TS val 4294714692 ecr 4294714682], length 0
11:40:11.104273 IP vagrant-ubuntu-trusty-64.60172 > 10.0.0.1.8882: Flags [P.], seq 499454214:499454378, ack 2113429343, win 58, options [nop,nop,TS val 4294714721 ecr 4294714692], length 164
11:40:11.106483 IP 10.0.0.1.8882 > vagrant-ubuntu-trusty-64.60172: Flags [.], ack 499454214, win 218, options [nop,nop,TS val 4294714712 ecr 4294714702], length 0
11:40:11.124959 IP 10.0.0.1.8882 > vagrant-ubuntu-trusty-64.60172: Flags [.], ack 499454378, win 220, options [nop,nop,TS val 4294714731 ecr 4294714721], length 0
11:40:11.125357 IP vagrant-ubuntu-trusty-64.60172 > 10.0.0.1.8882: Flags [P.], seq 499454378:499454542, ack 2113429343, win 58, options [nop,nop,TS val 4294714742 ecr 4294714731], length 164
11:40:11.145008 IP vagrant-ubuntu-trusty-64.60172 > 10.0.0.1.8882: Flags [P.], seq 499454542:499454706, ack 2113429343, win 58, options [nop,nop,TS val 4294714762 ecr 4294714731], length 164
11:40:11.146374 IP 10.0.0.1.8882 > vagrant-ubuntu-trusty-64.60172: Flags [.], ack 499454542, win 222, options [nop,nop,TS val 4294714753 ecr 4294714742], length 0
11:40:11.164906 IP vagrant-ubuntu-trusty-64.60172 > 10.0.0.1.8882: Flags [P.], seq 499454706:499454870, ack 2113429343, win 58, options [nop,nop,TS val 4294714782 ecr 4294714753], length 164
11:40:11.165193 IP 10.0.0.1.8882 > vagrant-ubuntu-trusty-64.60172: Flags [.], ack 499454706, win 225, options [nop,nop,TS val 4294714772 ecr 4294714762], length 0
11:40:11.184879 IP vagrant-ubuntu-trusty-64.60172 > 10.0.0.1.8882: Flags [P.], seq 499454870:499455034, ack 2113429343, win 58, options [nop,nop,TS val 4294714802 ecr 4294714772], length 164
11:40:11.185195 IP 10.0.0.1.8882 > vagrant-ubuntu-trusty-64.60172: Flags [.], ack 499454870, win 227, options [nop,nop,TS val 4294714792 ecr 4294714782], length 0
11:40:11.205100 IP vagrant-ubuntu-trusty-64.60172 > 10.0.0.1.8882: Flags [P.], seq 499455034:499455198, ack 2113429343, win 58, options [nop,nop,TS val 4294714822 ecr 4294714792], length 164
11:40:11.206069 IP 10.0.0.1.8882 > vagrant-ubuntu-trusty-64.60172: Flags [.], ack 499455034, win 229, options [nop,nop,TS val 4294714812 ecr 4294714802], length 0
11:40:11.225071 IP vagrant-ubuntu-trusty-64.60172 > 10.0.0.1.8882: Flags [P.], seq 499455198:499455362, ack 2113429343, win 58, options [nop,nop,TS val 4294714842 ecr 4294714812], length 164
11:40:11.225927 IP 10.0.0.1.8882 > vagrant-ubuntu-trusty-64.60172: Flags [.], ack 499455198, win 231, options [nop,nop,TS val 4294714832 ecr 4294714822], length 0
11:40:11.244256 IP vagrant-ubuntu-trusty-64.60172 > 10.0.0.1.8882: Flags [P.], seq 499455362:499455526, ack 2113429343, win 58, options [nop,nop,TS val 4294714861 ecr 4294714832], length 164
11:40:11.253849 IP 10.0.0.1.8882 > vagrant-ubuntu-trusty-64.60172: Flags [.], ack 499455362, win 233, options [nop,nop,TS val 4294714859 ecr 4294714842], length 0
11:40:11.264873 IP 10.0.0.1.8882 > vagrant-ubuntu-trusty-64.60172: Flags [.], ack 499455526, win 235, options [nop,nop,TS val 4294714871 ecr 4294714861], length 0
11:40:11.264951 IP vagrant-ubuntu-trusty-64.60172 > 10.0.0.1.8882: Flags [P.], seq 499455526:499455690, ack 2113429343, win 58, options [nop,nop,TS val 4294714882 ecr 4294714859], length 164
11:40:11.284993 IP vagrant-ubuntu-trusty-64.60172 > 10.0.0.1.8882: Flags [P.], seq 499455690:499455854, ack 2113429343, win 58, options [nop,nop,TS val 4294714902 ecr 4294714871], length 164
11:40:11.285183 IP 10.0.0.1.8882 > vagrant-ubuntu-trusty-64.60172: Flags [.], ack 499455690, win 237, options [nop,nop,TS val 4294714892 ecr 4294714882], length 0
11:40:11.305089 IP vagrant-ubuntu-trusty-64.60172 > 10.0.0.1.8882: Flags [P.], seq 499455854:499456018, ack 2113429343, win 58, options [nop,nop,TS val 4294714922 ecr 4294714892], length 164
11:40:11.306490 IP 10.0.0.1.8882 > vagrant-ubuntu-trusty-64.60172: Flags [.], ack 499455854, win 239, options [nop,nop,TS val 4294714912 ecr 4294714902], length 0
11:40:11.324320 IP vagrant-ubuntu-trusty-64.60172 > 10.0.0.1.8882: Flags [P.], seq 499456018:499456182, ack 2113429343, win 58, options [nop,nop,TS val 4294714941 ecr 4294714912], length 164
11:40:11.336147 IP 10.0.0.1.8882 > vagrant-ubuntu-trusty-64.60172: Flags [.], ack 499456018, win 241, options [nop,nop,TS val 4294714942 ecr 4294714922], length 0
11:40:11.344260 IP vagrant-ubuntu-trusty-64.60172 > 10.0.0.1.8882: Flags [P.], seq 499456182:499456346, ack 2113429343, win 58, options [nop,nop,TS val 4294714961 ecr 4294714942], length 164
11:40:11.346248 IP 10.0.0.1.8882 > vagrant-ubuntu-trusty-64.60172: Flags [.], ack 499456182, win 243, options [nop,nop,TS val 4294714951 ecr 4294714941], length 0
11:40:11.365099 IP vagrant-ubuntu-trusty-64.60172 > 10.0.0.1.8882: Flags [P.], seq 499456346:499456510, ack 2113429343, win 58, options [nop,nop,TS val 4294714982 ecr 4294714951], length 164
11:40:11.365150 IP 10.0.0.1.8882 > vagrant-ubuntu-trusty-64.60172: Flags [.], ack 499456346, win 245, options [nop,nop,TS val 4294714971 ecr 4294714961], length 0
11:40:11.384270 IP vagrant-ubuntu-trusty-64.60172 > 10.0.0.1.8882: Flags [P.], seq 499456510:499456674, ack 2113429343, win 58, options [nop,nop,TS val 4294715001 ecr 4294714971], length 164
11:40:11.385908 IP 10.0.0.1.8882 > vagrant-ubuntu-trusty-64.60172: Flags [.], ack 499456510, win 248, options [nop,nop,TS val 4294714992 ecr 4294714982], length 0
11:40:11.405181 IP 10.0.0.1.8882 > vagrant-ubuntu-trusty-64.60172: Flags [.], ack 499456674, win 250, options [nop,nop,TS val 4294715011 ecr 4294715001], length 0
11:40:11.405228 IP vagrant-ubuntu-trusty-64.60172 > 10.0.0.1.8882: Flags [P.], seq 499456674:499456838, ack 2113429343, win 58, options [nop,nop,TS val 4294715022 ecr 4294714992], length 164
11:40:11.424995 IP vagrant-ubuntu-trusty-64.60172 > 10.0.0.1.8882: Flags [P.], seq 499456838:499457002, ack 2113429343, win 58, options [nop,nop,TS val 4294715042 ecr 4294715011], length 164
11:40:11.426218 IP 10.0.0.1.8882 > vagrant-ubuntu-trusty-64.60172: Flags [.], ack 499456838, win 252, options [nop,nop,TS val 4294715032 ecr 4294715022], length 0
11:40:11.445019 IP vagrant-ubuntu-trusty-64.60172 > 10.0.0.1.8882: Flags [P.], seq 499457002:499457166, ack 2113429343, win 58, options [nop,nop,TS val 4294715062 ecr 4294715032], length 164
11:40:11.446477 IP 10.0.0.1.8882 > vagrant-ubuntu-trusty-64.60172: Flags [.], ack 499457002, win 254, options [nop,nop,TS val 4294715052 ecr 4294715042], length 0
11:40:11.464457 IP vagrant-ubuntu-trusty-64.60172 > 10.0.0.1.8882: Flags [P.], seq 499457166:499457330, ack 2113429343, win 58, options [nop,nop,TS val 4294715081 ecr 4294715052], length 164
11:40:11.465210 IP 10.0.0.1.8882 > vagrant-ubuntu-trusty-64.60172: Flags [.], ack 499457166, win 256, options [nop,nop,TS val 4294715072 ecr 4294715062], length 0
11:40:11.484982 IP vagrant-ubuntu-trusty-64.60172 > 10.0.0.1.8882: Flags [P.], seq 499457330:499457494, ack 2113429343, win 58, options [nop,nop,TS val 4294715102 ecr 4294715072], length 164
11:40:11.485113 IP 10.0.0.1.8882 > vagrant-ubuntu-trusty-64.60172: Flags [.], ack 499457330, win 258, options [nop,nop,TS val 4294715092 ecr 4294715081], length 0
11:40:11.504347 IP vagrant-ubuntu-trusty-64.60172 > 10.0.0.1.8882: Flags [P.], seq 499457494:499457658, ack 2113429343, win 58, options [nop,nop,TS val 4294715121 ecr 4294715092], length 164
11:40:11.505329 IP 10.0.0.1.8882 > vagrant-ubuntu-trusty-64.60172: Flags [.], ack 499457494, win 260, options [nop,nop,TS val 4294715112 ecr 4294715102], length 0
11:40:11.524387 IP vagrant-ubuntu-trusty-64.60172 > 10.0.0.1.8882: Flags [P.], seq 499457658:499457822, ack 2113429343, win 58, options [nop,nop,TS val 4294715141 ecr 4294715112], length 164
11:40:11.525016 IP 10.0.0.1.8882 > vagrant-ubuntu-trusty-64.60172: Flags [.], ack 499457658, win 262, options [nop,nop,TS val 4294715131 ecr 4294715121], length 0
11:40:11.545056 IP vagrant-ubuntu-trusty-64.60172 > 10.0.0.1.8882: Flags [P.], seq 499457822:499457986, ack 2113429343, win 58, options [nop,nop,TS val 4294715162 ecr 4294715131], length 164
11:40:11.545286 IP 10.0.0.1.8882 > vagrant-ubuntu-trusty-64.60172: Flags [.], ack 499457822, win 264, options [nop,nop,TS val 4294715151 ecr 4294715141], length 0
11:40:11.564394 IP vagrant-ubuntu-trusty-64.60172 > 10.0.0.1.8882: Flags [P.], seq 499457986:499458150, ack 2113429343, win 58, options [nop,nop,TS val 4294715181 ecr 4294715151], length 164
11:40:11.565417 IP 10.0.0.1.8882 > vagrant-ubuntu-trusty-64.60172: Flags [.], ack 499457986, win 266, options [nop,nop,TS val 4294715172 ecr 4294715162], length 0
11:40:11.584317 IP vagrant-ubuntu-trusty-64.60172 > 10.0.0.1.8882: Flags [P.], seq 499458150:499458314, ack 2113429343, win 58, options [nop,nop,TS val 4294715201 ecr 4294715172], length 164
11:40:11.585425 IP 10.0.0.1.8882 > vagrant-ubuntu-trusty-64.60172: Flags [.], ack 499458150, win 269, options [nop,nop,TS val 4294715192 ecr 4294715181], length 0
11:40:11.605064 IP vagrant-ubuntu-trusty-64.60172 > 10.0.0.1.8882: Flags [P.], seq 499458314:499458478, ack 2113429343, win 58, options [nop,nop,TS val 4294715222 ecr 4294715192], length 164
11:40:11.605380 IP 10.0.0.1.8882 > vagrant-ubuntu-trusty-64.60172: Flags [.], ack 499458314, win 271, options [nop,nop,TS val 4294715212 ecr 4294715201], length 0
11:40:11.625287 IP vagrant-ubuntu-trusty-64.60172 > 10.0.0.1.8882: Flags [P.], seq 499458478:499458642, ack 2113429343, win 58, options [nop,nop,TS val 4294715242 ecr 4294715212], length 164
11:40:11.625424 IP 10.0.0.1.8882 > vagrant-ubuntu-trusty-64.60172: Flags [.], ack 499458478, win 273, options [nop,nop,TS val 4294715232 ecr 4294715222], length 0
11:40:11.644374 IP vagrant-ubuntu-trusty-64.60172 > 10.0.0.1.8882: Flags [P.], seq 499458642:499458806, ack 2113429343, win 58, options [nop,nop,TS val 4294715261 ecr 4294715232], length 164
11:40:11.645620 IP 10.0.0.1.8882 > vagrant-ubuntu-trusty-64.60172: Flags [.], ack 499458642, win 275, options [nop,nop,TS val 4294715252 ecr 4294715242], length 0
11:40:11.664423 IP vagrant-ubuntu-trusty-64.60172 > 10.0.0.1.8882: Flags [P.], seq 499458806:499458970, ack 2113429343, win 58, options [nop,nop,TS val 4294715281 ecr 4294715252], length 164
11:40:11.664535 IP 10.0.0.1.8882 > vagrant-ubuntu-trusty-64.60172: Flags [.], ack 499458806, win 277, options [nop,nop,TS val 4294715271 ecr 4294715261], length 0
11:40:11.685215 IP vagrant-ubuntu-trusty-64.60172 > 10.0.0.1.8882: Flags [P.], seq 499458970:499459134, ack 2113429343, win 58, options [nop,nop,TS val 4294715302 ecr 4294715271], length 164
11:40:11.685521 IP 10.0.0.1.8882 > vagrant-ubuntu-trusty-64.60172: Flags [.], ack 499458970, win 279, options [nop,nop,TS val 4294715292 ecr 4294715281], length 0
11:40:11.704314 IP vagrant-ubuntu-trusty-64.60172 > 10.0.0.1.8882: Flags [P.], seq 499459134:499459298, ack 2113429343, win 58, options [nop,nop,TS val 4294715321 ecr 4294715292], length 164
11:40:11.706186 IP 10.0.0.1.8882 > vagrant-ubuntu-trusty-64.60172: Flags [.], ack 499459134, win 281, options [nop,nop,TS val 4294715313 ecr 4294715302], length 0
11:40:11.724896 IP 10.0.0.1.8882 > vagrant-ubuntu-trusty-64.60172: Flags [.], ack 499459298, win 283, options [nop,nop,TS val 4294715331 ecr 4294715321], length 0
11:40:11.725133 IP vagrant-ubuntu-trusty-64.60172 > 10.0.0.1.8882: Flags [P.], seq 499459298:499459462, ack 2113429343, win 58, options [nop,nop,TS val 4294715342 ecr 4294715331], length 164
11:40:11.744975 IP vagrant-ubuntu-trusty-64.60172 > 10.0.0.1.8882: Flags [P.], seq 499459462:499459626, ack 2113429343, win 58, options [nop,nop,TS val 4294715362 ecr 4294715331], length 164
11:40:11.745372 IP 10.0.0.1.8882 > vagrant-ubuntu-trusty-64.60172: Flags [.], ack 499459462, win 285, options [nop,nop,TS val 4294715352 ecr 4294715342], length 0
