11:00:30.830080 IP 10.0.0.1.8882 > 10.0.0.2.34761: Flags [.], ack 106096566, win 80, options [nop,nop,TS val 4294759070 ecr 4294759059], length 0
11:00:30.830142 IP 10.0.0.2.34761 > 10.0.0.1.8882: Flags [P.], seq 106096566:106096730, ack 3820139477, win 58, options [nop,nop,TS val 4294759080 ecr 4294759050], length 164
11:00:30.849452 IP 10.0.0.2.34761 > 10.0.0.1.8882: Flags [P.], seq 106096730:106096894, ack 3820139477, win 58, options [nop,nop,TS val 4294759099 ecr 4294759070], length 164
11:00:30.850540 IP 10.0.0.1.8882 > 10.0.0.2.34761: Flags [.], ack 106096730, win 82, options [nop,nop,TS val 4294759090 ecr 4294759080], length 0
11:00:30.869727 IP 10.0.0.1.8882 > 10.0.0.2.34761: Flags [.], ack 106096894, win 84, options [nop,nop,TS val 4294759110 ecr 4294759099], length 0
11:00:30.869936 IP 10.0.0.2.34761 > 10.0.0.1.8882: Flags [P.], seq 106096894:106097058, ack 3820139477, win 58, options [nop,nop,TS val 4294759120 ecr 4294759110], length 164
11:00:30.889706 IP 10.0.0.2.34761 > 10.0.0.1.8882: Flags [P.], seq 106097058:106097222, ack 3820139477, win 58, options [nop,nop,TS val 4294759139 ecr 4294759110], length 164
11:00:30.890242 IP 10.0.0.1.8882 > 10.0.0.2.34761: Flags [.], ack 106097058, win 86, options [nop,nop,TS val 4294759130 ecr 4294759120], length 0
11:00:30.909428 IP 10.0.0.2.34761 > 10.0.0.1.8882: Flags [P.], seq 106097222:106097386, ack 3820139477, win 58, options [nop,nop,TS val 4294759159 ecr 4294759130], length 164
11:00:30.910184 IP 10.0.0.1.8882 > 10.0.0.2.34761: Flags [.], ack 106097222, win 88, options [nop,nop,TS val 4294759150 ecr 4294759139], length 0
11:00:30.929774 IP 10.0.0.1.8882 > 10.0.0.2.34761: Flags [.], ack 106097386, win 91, options [nop,nop,TS val 4294759170 ecr 4294759159], length 0
11:00:30.929827 IP 10.0.0.2.34761 > 10.0.0.1.8882: Flags [P.], seq 106097386:106097550, ack 3820139477, win 58, options [nop,nop,TS val 4294759180 ecr 4294759150], length 164
11:00:30.949390 IP 10.0.0.2.34761 > 10.0.0.1.8882: Flags [P.], seq 106097550:106097714, ack 3820139477, win 58, options [nop,nop,TS val 4294759199 ecr 4294759170], length 164
11:00:30.951550 IP 10.0.0.1.8882 > 10.0.0.2.34761: Flags [.], ack 106097550, win 93, options [nop,nop,TS val 4294759191 ecr 4294759180], length 0
11:00:30.969325 IP 10.0.0.2.34761 > 10.0.0.1.8882: Flags [P.], seq 106097714:106097878, ack 3820139477, win 58, options [nop,nop,TS val 4294759219 ecr 4294759191], length 164
11:00:30.970240 IP 10.0.0.1.8882 > 10.0.0.2.34761: Flags [.], ack 106097714, win 95, options [nop,nop,TS val 4294759210 ecr 4294759199], length 0
11:00:30.989488 IP 10.0.0.2.34761 > 10.0.0.1.8882: Flags [P.], seq 106097878:106098042, ack 3820139477, win 58, options [nop,nop,TS val 4294759239 ecr 4294759210], length 164
11:00:30.989851 IP 10.0.0.1.8882 > 10.0.0.2.34761: Flags [.], ack 106097878, win 97, options [nop,nop,TS val 4294759229 ecr 4294759219], length 0
11:00:31.009429 IP 10.0.0.2.34761 > 10.0.0.1.8882: Flags [P.], seq 106098042:106098206, ack 3820139477, win 58, options [nop,nop,TS val 4294759259 ecr 4294759229], length 164
11:00:31.009714 IP 10.0.0.1.8882 > 10.0.0.2.34761: Flags [.], ack 106098042, win 99, options [nop,nop,TS val 4294759250 ecr 4294759239], length 0
11:00:31.029345 IP 10.0.0.2.34761 > 10.0.0.1.8882: Flags [P.], seq 106098206:106098370, ack 3820139477, win 58, options [nop,nop,TS val 4294759279 ecr 4294759250], length 164
11:00:31.029863 IP 10.0.0.1.8882 > 10.0.0.2.34761: Flags [.], ack 106098206, win 101, options [nop,nop,TS val 4294759270 ecr 4294759259], length 0
11:00:31.049325 IP 10.0.0.2.34761 > 10.0.0.1.8882: Flags [P.], seq 106098370:106098534, ack 3820139477, win 58, options [nop,nop,TS val 4294759299 ecr 4294759270], length 164
11:00:31.049676 IP 10.0.0.1.8882 > 10.0.0.2.34761: Flags [.], ack 106098370, win 103, options [nop,nop,TS val 4294759289 ecr 4294759279], length 0
11:00:31.069769 IP 10.0.0.1.8882 > 10.0.0.2.34761: Flags [.], ack 106098534, win 105, options [nop,nop,TS val 4294759310 ecr 4294759299], length 0
11:00:31.070752 IP 10.0.0.2.34761 > 10.0.0.1.8882: Flags [P.], seq 106098534:106098698, ack 3820139477, win 58, options [nop,nop,TS val 4294759321 ecr 4294759310], length 164
11:00:31.089479 IP 10.0.0.2.34761 > 10.0.0.1.8882: Flags [P.], seq 106098698:106098862, ack 3820139477, win 58, options [nop,nop,TS val 4294759339 ecr 4294759310], length 164
11:00:31.090914 IP 10.0.0.1.8882 > 10.0.0.2.34761: Flags [.], ack 106098698, win 107, options [nop,nop,TS val 4294759331 ecr 4294759321], length 0
11:00:31.109534 IP 10.0.0.2.34761 > 10.0.0.1.8882: Flags [P.], seq 106098862:106099026, ack 3820139477, win 58, options [nop,nop,TS val 4294759359 ecr 4294759331], length 164
11:00:31.109643 IP 10.0.0.1.8882 > 10.0.0.2.34761: Flags [.], ack 106098862, win 109, options [nop,nop,TS val 4294759350 ecr 4294759339], length 0
11:00:31.131020 IP 10.0.0.1.8882 > 10.0.0.2.34761: Flags [.], ack 106099026, win 111, options [nop,nop,TS val 4294759370 ecr 4294759359], length 0
11:00:31.131095 IP 10.0.0.2.34761 > 10.0.0.1.8882: Flags [P.], seq 106099026:106099190, ack 3820139477, win 58, options [nop,nop,TS val 4294759381 ecr 4294759350], length 164
11:00:31.149354 IP 10.0.0.2.34761 > 10.0.0.1.8882: Flags [P.], seq 106099190:106099354, ack 3820139477, win 58, options [nop,nop,TS val 4294759399 ecr 4294759370], length 164
11:00:31.151635 IP 10.0.0.1.8882 > 10.0.0.2.34761: Flags [.], ack 106099190, win 114, options [nop,nop,TS val 4294759391 ecr 4294759381], length 0
11:00:31.170728 IP 10.0.0.1.8882 > 10.0.0.2.34761: Flags [.], ack 106099354, win 116, options [nop,nop,TS val 4294759410 ecr 4294759399], length 0
11:00:31.172008 IP 10.0.0.2.34761 > 10.0.0.1.8882: Flags [P.], seq 106099354:106099518, ack 3820139477, win 58, options [nop,nop,TS val 4294759422 ecr 4294759410], length 164
11:00:31.189423 IP 10.0.0.2.34761 > 10.0.0.1.8882: Flags [P.], seq 106099518:106099682, ack 3820139477, win 58, options [nop,nop,TS val 4294759439 ecr 4294759410], length 164
11:00:31.193110 IP 10.0.0.1.8882 > 10.0.0.2.34761: Flags [.], ack 106099518, win 118, options [nop,nop,TS val 4294759433 ecr 4294759422], length 0
11:00:31.209499 IP 10.0.0.2.34761 > 10.0.0.1.8882: Flags [P.], seq 106099682:106099846, ack 3820139477, win 58, options [nop,nop,TS val 4294759459 ecr 4294759433], length 164
11:00:31.209710 IP 10.0.0.1.8882 > 10.0.0.2.34761: Flags [.], ack 106099682, win 120, options [nop,nop,TS val 4294759450 ecr 4294759439], length 0
11:00:31.229768 IP 10.0.0.2.34761 > 10.0.0.1.8882: Flags [P.], seq 106099846:106100010, ack 3820139477, win 58, options [nop,nop,TS val 4294759479 ecr 4294759450], length 164
11:00:31.230101 IP 10.0.0.1.8882 > 10.0.0.2.34761: Flags [.], ack 106099846, win 122, options [nop,nop,TS val 4294759470 ecr 4294759459], length 0
11:00:31.249490 IP 10.0.0.2.34761 > 10.0.0.1.8882: Flags [P.], seq 106100010:106100174, ack 3820139477, win 58, options [nop,nop,TS val 4294759499 ecr 4294759470], length 164
11:00:31.250088 IP 10.0.0.1.8882 > 10.0.0.2.34761: Flags [.], ack 106100010, win 124, options [nop,nop,TS val 4294759490 ecr 4294759479], length 0
11:00:31.269328 IP 10.0.0.2.34761 > 10.0.0.1.8882: Flags [P.], seq 106100174:106100338, ack 3820139477, win 58, options [nop,nop,TS val 4294759519 ecr 4294759490], length 164
11:00:31.269703 IP 10.0.0.1.8882 > 10.0.0.2.34761: Flags [.], ack 106100174, win 126, options [nop,nop,TS val 4294759510 ecr 4294759499], length 0
11:00:31.289592 IP 10.0.0.1.8882 > 10.0.0.2.34761: Flags [.], ack 106100338, win 128, options [nop,nop,TS val 4294759530 ecr 4294759519], length 0
11:00:31.290751 IP 10.0.0.2.34761 > 10.0.0.1.8882: Flags [P.], seq 106100338:106100502, ack 3820139477, win 58, options [nop,nop,TS val 4294759541 ecr 4294759530], length 164
11:00:31.309438 IP 10.0.0.2.34761 > 10.0.0.1.8882: Flags [P.], seq 106100502:106100666, ack 3820139477, win 58, options [nop,nop,TS val 4294759559 ecr 4294759530], length 164
11:00:31.311219 IP 10.0.0.1.8882 > 10.0.0.2.34761: Flags [.], ack 106100502, win 130, options [nop,nop,TS val 4294759551 ecr 4294759541], length 0
11:00:31.330014 IP 10.0.0.1.8882 > 10.0.0.2.34761: Flags [.], ack 106100666, win 132, options [nop,nop,TS val 4294759570 ecr 4294759559], length 0
11:00:31.330052 IP 10.0.0.2.34761 > 10.0.0.1.8882: Flags [P.], seq 106100666:106100830, ack 3820139477, win 58, options [nop,nop,TS val 4294759580 ecr 4294759551], length 164
11:00:31.349315 IP 10.0.0.2.34761 > 10.0.0.1.8882: Flags [P.], seq 106100830:106100994, ack 3820139477, win 58, options [nop,nop,TS val 4294759599 ecr 4294759570], length 164
11:00:31.350529 IP 10.0.0.1.8882 > 10.0.0.2.34761: Flags [.], ack 106100830, win 135, options [nop,nop,TS val 4294759590 ecr 4294759580], length 0
11:00:31.369720 IP 10.0.0.2.34761 > 10.0.0.1.8882: Flags [P.], seq 106100994:106101158, ack 3820139477, win 58, options [nop,nop,TS val 4294759620 ecr 4294759590], length 164
11:00:31.370842 IP 10.0.0.1.8882 > 10.0.0.2.34761: Flags [.], ack 106100994, win 137, options [nop,nop,TS val 4294759610 ecr 4294759599], length 0
11:00:31.389444 IP 10.0.0.2.34761 > 10.0.0.1.8882: Flags [P.], seq 106101158:106101322, ack 3820139477, win 58, options [nop,nop,TS val 4294759639 ecr 4294759610], length 164
11:00:31.390523 IP 10.0.0.1.8882 > 10.0.0.2.34761: Flags [.], ack 106101158, win 139, options [nop,nop,TS val 4294759630 ecr 4294759620], length 0
11:00:31.409329 IP 10.0.0.2.34761 > 10.0.0.1.8882: Flags [P.], seq 106101322:106101486, ack 3820139477, win 58, options [nop,nop,TS val 4294759659 ecr 4294759630], length 164
11:00:31.410272 IP 10.0.0.1.8882 > 10.0.0.2.34761: Flags [.], ack 106101322, win 141, options [nop,nop,TS val 4294759650 ecr 4294759639], length 0
11:00:31.429694 IP 10.0.0.2.34761 > 10.0.0.1.8882: Flags [P.], seq 106101486:106101650, ack 3820139477, win 58, options [nop,nop,TS val 4294759680 ecr 4294759650], length 164
11:00:31.429786 IP 10.0.0.1.8882 > 10.0.0.2.34761: Flags [.], ack 106101486, win 143, options [nop,nop,TS val 4294759670 ecr 4294759659], length 0
11:00:31.449706 IP 10.0.0.2.34761 > 10.0.0.1.8882: Flags [P.], seq 106101650:106101814, ack 3820139477, win 58, options [nop,nop,TS val 4294759700 ecr 4294759670], length 164
11:00:31.449948 IP 10.0.0.1.8882 > 10.0.0.2.34761: Flags [.], ack 106101650, win 145, options [nop,nop,TS val 4294759690 ecr 4294759680], length 0
11:00:31.469609 IP 10.0.0.2.34761 > 10.0.0.1.8882: Flags [P.], seq 106101814:106101978, ack 3820139477, win 58, options [nop,nop,TS val 4294759720 ecr 4294759690], length 164
11:00:31.470204 IP 10.0.0.1.8882 > 10.0.0.2.34761: Flags [.], ack 106101814, win 147, options [nop,nop,TS val 4294759710 ecr 4294759700], length 0
11:00:31.489683 IP 10.0.0.2.34761 > 10.0.0.1.8882: Flags [P.], seq 106101978:106102142, ack 3820139477, win 58, options [nop,nop,TS val 4294759740 ecr 4294759710], length 164
11:00:31.490451 IP 10.0.0.1.8882 > 10.0.0.2.34761: Flags [.], ack 106101978, win 149, options [nop,nop,TS val 4294759730 ecr 4294759720], length 0
11:00:31.509748 IP 10.0.0.2.34761 > 10.0.0.1.8882: Flags [P.], seq 106102142:106102306, ack 3820139477, win 58, options [nop,nop,TS val 4294759760 ecr 4294759730], length 164
11:00:31.510520 IP 10.0.0.1.8882 > 10.0.0.2.34761: Flags [.], ack 106102142, win 151, options [nop,nop,TS val 4294759750 ecr 4294759740], length 0
11:00:31.529956 IP 10.0.0.2.34761 > 10.0.0.1.8882: Flags [P.], seq 106102306:106102470, ack 3820139477, win 58, options [nop,nop,TS val 4294759780 ecr 4294759750], length 164
11:00:31.530847 IP 10.0.0.1.8882 > 10.0.0.2.34761: Flags [.], ack 106102306, win 153, options [nop,nop,TS val 4294759770 ecr 4294759760], length 0
11:00:31.549504 IP 10.0.0.2.34761 > 10.0.0.1.8882: Flags [P.], seq 106102470:106102634, ack 3820139477, win 58, options [nop,nop,TS val 4294759799 ecr 4294759770], length 164
11:00:31.550653 IP 10.0.0.1.8882 > 10.0.0.2.34761: Flags [.], ack 106102470, win 155, options [nop,nop,TS val 4294759790 ecr 4294759780], length 0
11:00:31.569403 IP 10.0.0.2.34761 > 10.0.0.1.8882: Flags [P.], seq 106102634:106102798, ack 3820139477, win 58, options [nop,nop,TS val 4294759819 ecr 4294759790], length 164
11:00:31.569869 IP 10.0.0.1.8882 > 10.0.0.2.34761: Flags [.], ack 106102634, win 158, options [nop,nop,TS val 4294759810 ecr 4294759799], length 0
11:00:31.589644 IP 10.0.0.1.8882 > 10.0.0.2.34761: Flags [.], ack 106102798, win 160, options [nop,nop,TS val 4294759830 ecr 4294759819], length 0
11:00:31.589683 IP 10.0.0.2.34761 > 10.0.0.1.8882: Flags [P.], seq 106102798:106102962, ack 3820139477, win 58, options [nop,nop,TS val 4294759840 ecr 4294759810], length 164
11:00:31.609455 IP 10.0.0.2.34761 > 10.0.0.1.8882: Flags [P.], seq 106102962:106103126, ack 3820139477, win 58, options [nop,nop,TS val 4294759859 ecr 4294759830], length 164
11:00:31.610242 IP 10.0.0.1.8882 > 10.0.0.2.34761: Flags [.], ack 106102962, win 162, options [nop,nop,TS val 4294759850 ecr 4294759840], length 0
11:00:31.629785 IP 10.0.0.1.8882 > 10.0.0.2.34761: Flags [.], ack 106103126, win 164, options [nop,nop,TS val 4294759870 ecr 4294759859], length 0
11:00:31.629809 IP 10.0.0.2.34761 > 10.0.0.1.8882: Flags [P.], seq 106103126:106103290, ack 3820139477, win 58, options [nop,nop,TS val 4294759879 ecr 4294759850], length 164
11:00:31.649508 IP 10.0.0.2.34761 > 10.0.0.1.8882: Flags [P.], seq 106103290:106103454, ack 3820139477, win 58, options [nop,nop,TS val 4294759899 ecr 4294759870], length 164
11:00:31.650362 IP 10.0.0.1.8882 > 10.0.0.2.34761: Flags [.], ack 106103290, win 166, options [nop,nop,TS val 4294759890 ecr 4294759879], length 0
11:00:31.669634 IP 10.0.0.2.34761 > 10.0.0.1.8882: Flags [P.], seq 106103454:106103618, ack 3820139477, win 58, options [nop,nop,TS val 4294759919 ecr 4294759890], length 164
11:00:31.670169 IP 10.0.0.1.8882 > 10.0.0.2.34761: Flags [.], ack 106103454, win 168, options [nop,nop,TS val 4294759910 ecr 4294759899], length 0
11:00:31.689318 IP 10.0.0.2.34761 > 10.0.0.1.8882: Flags [P.], seq 106103618:106103782, ack 3820139477, win 58, options [nop,nop,TS val 4294759939 ecr 4294759910], length 164
11:00:31.690226 IP 10.0.0.1.8882 > 10.0.0.2.34761: Flags [.], ack 106103618, win 170, options [nop,nop,TS val 4294759930 ecr 4294759919], length 0
11:00:31.709585 IP 10.0.0.2.34761 > 10.0.0.1.8882: Flags [P.], seq 106103782:106103946, ack 3820139477, win 58, options [nop,nop,TS val 4294759960 ecr 4294759930], length 164
11:00:31.709858 IP 10.0.0.1.8882 > 10.0.0.2.34761: Flags [.], ack 106103782, win 172, options [nop,nop,TS val 4294759950 ecr 4294759939], length 0
11:00:31.729987 IP 10.0.0.2.34761 > 10.0.0.1.8882: Flags [P.], seq 106103946:106104110, ack 3820139477, win 58, options [nop,nop,TS val 4294759980 ecr 4294759950], length 164
11:00:31.729996 IP 10.0.0.1.8882 > 10.0.0.2.34761: Flags [.], ack 106103946, win 174, options [nop,nop,TS val 4294759970 ecr 4294759960], length 0
11:00:31.749678 IP 10.0.0.2.34761 > 10.0.0.1.8882: Flags [P.], seq 106104110:106104274, ack 3820139477, win 58, options [nop,nop,TS val 4294759999 ecr 4294759970], length 164
11:00:31.750627 IP 10.0.0.1.8882 > 10.0.0.2.34761: Flags [.], ack 106104110, win 176, options [nop,nop,TS val 4294759990 ecr 4294759980], length 0
11:00:31.769606 IP 10.0.0.2.34761 > 10.0.0.1.8882: Flags [P.], seq 106104274:106104438, ack 3820139477, win 58, options [nop,nop,TS val 4294760020 ecr 4294759990], length 164
11:00:31.770601 IP 10.0.0.1.8882 > 10.0.0.2.34761: Flags [.], ack 106104274, win 178, options [nop,nop,TS val 4294760010 ecr 4294759999], length 0
11:00:31.789933 IP 10.0.0.2.34761 > 10.0.0.1.8882: Flags [P.], seq 106104438:106104602, ack 3820139477, win 58, options [nop,nop,TS val 4294760040 ecr 4294760010], length 164
11:00:31.790037 IP 10.0.0.1.8882 > 10.0.0.2.34761: Flags [.], ack 106104438, win 181, options [nop,nop,TS val 4294760030 ecr 4294760020], length 0
11:00:31.809581 IP 10.0.0.2.34761 > 10.0.0.1.8882: Flags [P.], seq 106104602:106104766, ack 3820139477, win 58, options [nop,nop,TS val 4294760060 ecr 4294760030], length 164
11:00:31.810698 IP 10.0.0.1.8882 > 10.0.0.2.34761: Flags [.], ack 106104602, win 183, options [nop,nop,TS val 4294760050 ecr 4294760040], length 0
11:00:31.829470 IP 10.0.0.2.34761 > 10.0.0.1.8882: Flags [P.], seq 106104766:106104930, ack 3820139477, win 58, options [nop,nop,TS val 4294760079 ecr 4294760050], length 164
11:00:31.830710 IP 10.0.0.1.8882 > 10.0.0.2.34761: Flags [.], ack 106104766, win 185, options [nop,nop,TS val 4294760070 ecr 4294760060], length 0
11:00:31.849496 IP 10.0.0.2.34761 > 10.0.0.1.8882: Flags [P.], seq 106104930:106105094, ack 3820139477, win 58, options [nop,nop,TS val 4294760099 ecr 4294760070], length 164
11:00:31.850571 IP 10.0.0.1.8882 > 10.0.0.2.34761: Flags [.], ack 106104930, win 187, options [nop,nop,TS val 4294760090 ecr 4294760079], length 0
11:00:31.869366 IP 10.0.0.2.34761 > 10.0.0.1.8882: Flags [P.], seq 106105094:106105258, ack 3820139477, win 58, options [nop,nop,TS val 4294760119 ecr 4294760090], length 164
11:00:31.869695 IP 10.0.0.1.8882 > 10.0.0.2.34761: Flags [.], ack 106105094, win 189, options [nop,nop,TS val 4294760110 ecr 4294760099], length 0
11:00:31.889570 IP 10.0.0.2.34761 > 10.0.0.1.8882: Flags [P.], seq 106105258:106105422, ack 3820139477, win 58, options [nop,nop,TS val 4294760140 ecr 4294760110], length 164
11:00:31.889986 IP 10.0.0.1.8882 > 10.0.0.2.34761: Flags [.], ack 106105258, win 191, options [nop,nop,TS val 4294760130 ecr 4294760119], length 0
11:00:31.909371 IP 10.0.0.2.34761 > 10.0.0.1.8882: Flags [P.], seq 106105422:106105586, ack 3820139477, win 58, options [nop,nop,TS val 4294760159 ecr 4294760130], length 164
11:00:31.910171 IP 10.0.0.1.8882 > 10.0.0.2.34761: Flags [.], ack 106105422, win 193, options [nop,nop,TS val 4294760150 ecr 4294760140], length 0
11:00:31.929378 IP 10.0.0.2.34761 > 10.0.0.1.8882: Flags [P.], seq 106105586:106105750, ack 3820139477, win 58, options [nop,nop,TS val 4294760179 ecr 4294760150], length 164
11:00:31.929931 IP 10.0.0.1.8882 > 10.0.0.2.34761: Flags [.], ack 106105586, win 195, options [nop,nop,TS val 4294760170 ecr 4294760159], length 0
11:00:31.949439 IP 10.0.0.2.34761 > 10.0.0.1.8882: Flags [P.], seq 106105750:106105914, ack 3820139477, win 58, options [nop,nop,TS val 4294760199 ecr 4294760170], length 164
11:00:31.949787 IP 10.0.0.1.8882 > 10.0.0.2.34761: Flags [.], ack 106105750, win 197, options [nop,nop,TS val 4294760189 ecr 4294760179], length 0
11:00:31.969407 IP 10.0.0.2.34761 > 10.0.0.1.8882: Flags [P.], seq 106105914:106106078, ack 3820139477, win 58, options [nop,nop,TS val 4294760219 ecr 4294760189], length 164
11:00:31.970191 IP 10.0.0.1.8882 > 10.0.0.2.34761: Flags [.], ack 106105914, win 199, options [nop,nop,TS val 4294760210 ecr 4294760199], length 0
11:00:31.989320 IP 10.0.0.2.34761 > 10.0.0.1.8882: Flags [P.], seq 106106078:106106242, ack 3820139477, win 58, options [nop,nop,TS val 4294760239 ecr 4294760210], length 164
11:00:31.990075 IP 10.0.0.1.8882 > 10.0.0.2.34761: Flags [.], ack 106106078, win 202, options [nop,nop,TS val 4294760229 ecr 4294760219], length 0
11:00:32.009530 IP 10.0.0.2.34761 > 10.0.0.1.8882: Flags [P.], seq 106106242:106106406, ack 3820139477, win 58, options [nop,nop,TS val 4294760259 ecr 4294760229], length 164
11:00:32.009798 IP 10.0.0.1.8882 > 10.0.0.2.34761: Flags [.], ack 106106242, win 204, options [nop,nop,TS val 4294760250 ecr 4294760239], length 0
11:00:32.029452 IP 10.0.0.2.34761 > 10.0.0.1.8882: Flags [P.], seq 106106406:106106570, ack 3820139477, win 58, options [nop,nop,TS val 4294760279 ecr 4294760250], length 164
11:00:32.029909 IP 10.0.0.1.8882 > 10.0.0.2.34761: Flags [.], ack 106106406, win 206, options [nop,nop,TS val 4294760270 ecr 4294760259], length 0
11:00:32.049501 IP 10.0.0.2.34761 > 10.0.0.1.8882: Flags [P.], seq 106106570:106106734, ack 3820139477, win 58, options [nop,nop,TS val 4294760299 ecr 4294760270], length 164
11:00:32.050408 IP 10.0.0.1.8882 > 10.0.0.2.34761: Flags [.], ack 106106570, win 208, options [nop,nop,TS val 4294760290 ecr 4294760279], length 0
11:00:32.074015 IP 10.0.0.1.8882 > 10.0.0.2.34761: Flags [.], ack 106106734, win 210, options [nop,nop,TS val 4294760310 ecr 4294760299], length 0
11:00:32.074184 IP 10.0.0.2.34761 > 10.0.0.1.8882: Flags [P.], seq 106106734:106106898, ack 3820139477, win 58, options [nop,nop,TS val 4294760324 ecr 4294760310], length 164
11:00:32.089675 IP 10.0.0.2.34761 > 10.0.0.1.8882: Flags [P.], seq 106106898:106107062, ack 3820139477, win 58, options [nop,nop,TS val 4294760340 ecr 4294760310], length 164
11:00:32.094582 IP 10.0.0.1.8882 > 10.0.0.2.34761: Flags [.], ack 106106898, win 212, options [nop,nop,TS val 4294760334 ecr 4294760324], length 0
11:00:32.109405 IP 10.0.0.2.34761 > 10.0.0.1.8882: Flags [P.], seq 106107062:106107226, ack 3820139477, win 58, options [nop,nop,TS val 4294760359 ecr 4294760334], length 164
11:00:32.110024 IP 10.0.0.1.8882 > 10.0.0.2.34761: Flags [.], ack 106107062, win 214, options [nop,nop,TS val 4294760350 ecr 4294760340], length 0
11:00:32.131030 IP 10.0.0.1.8882 > 10.0.0.2.34761: Flags [.], ack 106107226, win 216, options [nop,nop,TS val 4294760370 ecr 4294760359], length 0
11:00:32.131129 IP 10.0.0.2.34761 > 10.0.0.1.8882: Flags [P.], seq 106107226:106107390, ack 3820139477, win 58, options [nop,nop,TS val 4294760381 ecr 4294760350], length 164
11:00:32.149573 IP 10.0.0.2.34761 > 10.0.0.1.8882: Flags [P.], seq 106107390:106107554, ack 3820139477, win 58, options [nop,nop,TS val 4294760400 ecr 4294760370], length 164
11:00:32.155622 IP 10.0.0.1.8882 > 10.0.0.2.34761: Flags [.], ack 106107390, win 218, options [nop,nop,TS val 4294760395 ecr 4294760381], length 0
11:00:32.169936 IP 10.0.0.2.34761 > 10.0.0.1.8882: Flags [P.], seq 106107554:106107718, ack 3820139477, win 58, options [nop,nop,TS val 4294760420 ecr 4294760395], length 164
11:00:32.171118 IP 10.0.0.1.8882 > 10.0.0.2.34761: Flags [.], ack 106107554, win 220, options [nop,nop,TS val 4294760411 ecr 4294760400], length 0
11:00:32.189705 IP 10.0.0.2.34761 > 10.0.0.1.8882: Flags [P.], seq 106107718:106107882, ack 3820139477, win 58, options [nop,nop,TS val 4294760440 ecr 4294760411], length 164
11:00:32.190506 IP 10.0.0.1.8882 > 10.0.0.2.34761: Flags [.], ack 106107718, win 222, options [nop,nop,TS val 4294760430 ecr 4294760420], length 0
11:00:32.209616 IP 10.0.0.2.34761 > 10.0.0.1.8882: Flags [P.], seq 106107882:106108046, ack 3820139477, win 58, options [nop,nop,TS val 4294760460 ecr 4294760430], length 164
11:00:32.210828 IP 10.0.0.1.8882 > 10.0.0.2.34761: Flags [.], ack 106107882, win 225, options [nop,nop,TS val 4294760450 ecr 4294760440], length 0
11:00:32.229619 IP 10.0.0.2.34761 > 10.0.0.1.8882: Flags [P.], seq 106108046:106108210, ack 3820139477, win 58, options [nop,nop,TS val 4294760480 ecr 4294760450], length 164
11:00:32.230462 IP 10.0.0.1.8882 > 10.0.0.2.34761: Flags [.], ack 106108046, win 227, options [nop,nop,TS val 4294760470 ecr 4294760460], length 0
11:00:32.249757 IP 10.0.0.1.8882 > 10.0.0.2.34761: Flags [.], ack 106108210, win 229, options [nop,nop,TS val 4294760490 ecr 4294760480], length 0
11:00:32.250216 IP 10.0.0.2.34761 > 10.0.0.1.8882: Flags [P.], seq 106108210:106108374, ack 3820139477, win 58, options [nop,nop,TS val 4294760500 ecr 4294760490], length 164
11:00:32.269800 IP 10.0.0.2.34761 > 10.0.0.1.8882: Flags [P.], seq 106108374:106108538, ack 3820139477, win 58, options [nop,nop,TS val 4294760520 ecr 4294760490], length 164
11:00:32.289318 IP 10.0.0.2.34761 > 10.0.0.1.8882: Flags [P.], seq 106108538:106108702, ack 3820139477, win 58, options [nop,nop,TS val 4294760539 ecr 4294760490], length 164
11:00:32.304584 IP 10.0.0.1.8882 > 10.0.0.2.34761: Flags [.], ack 106108210, win 231, options [nop,nop,TS val 4294760544 ecr 4294760480,nop,nop,sack 1 {106108374:106108538}], length 0
11:00:32.309648 IP 10.0.0.2.34761 > 10.0.0.1.8882: Flags [P.], seq 106108702:106108866, ack 3820139477, win 58, options [nop,nop,TS val 4294760560 ecr 4294760544], length 164
11:00:32.319595 IP 10.0.0.1.8882 > 10.0.0.2.34761: Flags [.], ack 106108210, win 233, options [nop,nop,TS val 4294760559 ecr 4294760480,nop,nop,sack 1 {106108374:106108702}], length 0
11:00:32.329498 IP 10.0.0.2.34761 > 10.0.0.1.8882: Flags [P.], seq 106108866:106109030, ack 3820139477, win 58, options [nop,nop,TS val 4294760579 ecr 4294760559], length 164
11:00:32.349609 IP 10.0.0.2.34761 > 10.0.0.1.8882: Flags [P.], seq 106109030:106109194, ack 3820139477, win 58, options [nop,nop,TS val 4294760600 ecr 4294760559], length 164
11:00:32.359254 IP 10.0.0.1.8882 > 10.0.0.2.34761: Flags [.], ack 106108210, win 235, options [nop,nop,TS val 4294760599 ecr 4294760480,nop,nop,sack 1 {106108374:106108866}], length 0
11:00:32.359340 IP 10.0.0.2.34761 > 10.0.0.1.8882: Flags [P.], seq 106108210:106108374, ack 3820139477, win 58, options [nop,nop,TS val 4294760609 ecr 4294760599], length 164
11:00:32.369482 IP 10.0.0.2.34761 > 10.0.0.1.8882: Flags [P.], seq 106109194:106109358, ack 3820139477, win 58, options [nop,nop,TS val 4294760619 ecr 4294760599], length 164
11:00:32.398635 IP 10.0.0.1.8882 > 10.0.0.2.34761: Flags [.], ack 106108210, win 237, options [nop,nop,TS val 4294760638 ecr 4294760480,nop,nop,sack 2 {106109030:106109194}{106108374:106108866}], length 0
11:00:32.398709 IP 10.0.0.2.34761 > 10.0.0.1.8882: Flags [P.], seq 106109358:106109522, ack 3820139477, win 58, options [nop,nop,TS val 4294760649 ecr 4294760638], length 164
11:00:32.406845 IP 10.0.0.1.8882 > 10.0.0.2.34761: Flags [.], ack 106108866, win 239, options [nop,nop,TS val 4294760647 ecr 4294760609,nop,nop,sack 1 {106109030:106109194}], length 0
11:00:32.406953 IP 10.0.0.2.34761 > 10.0.0.1.8882: Flags [P.], seq 106108866:106109030, ack 3820139477, win 58, options [nop,nop,TS val 4294760657 ecr 4294760647], length 164
11:00:32.409431 IP 10.0.0.2.34761 > 10.0.0.1.8882: Flags [P.], seq 106109522:106109686, ack 3820139477, win 58, options [nop,nop,TS val 4294760659 ecr 4294760647], length 164
11:00:32.426496 IP 10.0.0.1.8882 > 10.0.0.2.34761: Flags [.], ack 106108866, win 241, options [nop,nop,TS val 4294760666 ecr 4294760609,nop,nop,sack 2 {106109358:106109522}{106109030:106109194}], length 0
11:00:32.426534 IP 10.0.0.2.34761 > 10.0.0.1.8882: Flags [P.], seq 106109194:106109358, ack 3820139477, win 58, options [nop,nop,TS val 4294760676 ecr 4294760666], length 164
11:00:32.429470 IP 10.0.0.2.34761 > 10.0.0.1.8882: Flags [P.], seq 106109686:106109850, ack 3820139477, win 58, options [nop,nop,TS val 4294760679 ecr 4294760666], length 164
11:00:32.435736 IP 10.0.0.1.8882 > 10.0.0.2.34761: Flags [.], ack 106109194, win 243, options [nop,nop,TS val 4294760676 ecr 4294760657,nop,nop,sack 1 {106109358:106109522}], length 0
11:00:32.439038 IP 10.0.0.1.8882 > 10.0.0.2.34761: Flags [.], ack 106109194, win 245, options [nop,nop,TS val 4294760679 ecr 4294760657,nop,nop,sack 1 {106109358:106109686}], length 0
11:00:32.449424 IP 10.0.0.2.34761 > 10.0.0.1.8882: Flags [P.], seq 106109850:106110014, ack 3820139477, win 58, options [nop,nop,TS val 4294760699 ecr 4294760679], length 164
11:00:32.454350 IP 10.0.0.1.8882 > 10.0.0.2.34761: Flags [.], ack 106109686, win 248, options [nop,nop,TS val 4294760694 ecr 4294760676], length 0
11:00:32.457754 IP 10.0.0.1.8882 > 10.0.0.2.34761: Flags [.], ack 106109850, win 250, options [nop,nop,TS val 4294760697 ecr 4294760679], length 0
11:00:32.469508 IP 10.0.0.2.34761 > 10.0.0.1.8882: Flags [P.], seq 106110014:106110178, ack 3820139477, win 58, options [nop,nop,TS val 4294760719 ecr 4294760697], length 164
11:00:32.482121 IP 10.0.0.1.8882 > 10.0.0.2.34761: Flags [.], ack 106110014, win 252, options [nop,nop,TS val 4294760722 ecr 4294760699], length 0
11:00:32.489723 IP 10.0.0.2.34761 > 10.0.0.1.8882: Flags [P.], seq 106110178:106110342, ack 3820139477, win 58, options [nop,nop,TS val 4294760740 ecr 4294760722], length 164
11:00:32.509565 IP 10.0.0.2.34761 > 10.0.0.1.8882: Flags [P.], seq 106110342:106110506, ack 3820139477, win 58, options [nop,nop,TS val 4294760759 ecr 4294760722], length 164
11:00:32.516264 IP 10.0.0.1.8882 > 10.0.0.2.34761: Flags [.], ack 106110178, win 254, options [nop,nop,TS val 4294760756 ecr 4294760719], length 0
11:00:32.529737 IP 10.0.0.2.34761 > 10.0.0.1.8882: Flags [P.], seq 106110506:106110670, ack 3820139477, win 58, options [nop,nop,TS val 4294760780 ecr 4294760756], length 164
11:00:32.529895 IP 10.0.0.1.8882 > 10.0.0.2.34761: Flags [.], ack 106110178, win 256, options [nop,nop,TS val 4294760770 ecr 4294760719,nop,nop,sack 1 {106110342:106110506}], length 0
11:00:32.537612 IP 10.0.0.2.34761 > 10.0.0.1.8882: Flags [P.], seq 106110178:106110342, ack 3820139477, win 58, options [nop,nop,TS val 4294760788 ecr 4294760770], length 164
11:00:32.549486 IP 10.0.0.2.34761 > 10.0.0.1.8882: Flags [P.], seq 106110670:106110834, ack 3820139477, win 58, options [nop,nop,TS val 4294760799 ecr 4294760770], length 164
11:00:32.553735 IP 10.0.0.1.8882 > 10.0.0.2.34761: Flags [.], ack 106110178, win 258, options [nop,nop,TS val 4294760793 ecr 4294760719,nop,nop,sack 1 {106110342:106110670}], length 0
11:00:32.562652 IP 10.0.0.1.8882 > 10.0.0.2.34761: Flags [.], ack 106110670, win 260, options [nop,nop,TS val 4294760802 ecr 4294760788], length 0
11:00:32.570141 IP 10.0.0.2.34761 > 10.0.0.1.8882: Flags [P.], seq 106110834:106110998, ack 3820139477, win 58, options [nop,nop,TS val 4294760820 ecr 4294760802], length 164
11:00:32.570995 IP 10.0.0.1.8882 > 10.0.0.2.34761: Flags [.], ack 106110834, win 262, options [nop,nop,TS val 4294760811 ecr 4294760799], length 0
11:00:32.589766 IP 10.0.0.2.34761 > 10.0.0.1.8882: Flags [P.], seq 106110998:106111162, ack 3820139477, win 58, options [nop,nop,TS val 4294760840 ecr 4294760811], length 164
11:00:32.609377 IP 10.0.0.2.34761 > 10.0.0.1.8882: Flags [P.], seq 106111162:106111326, ack 3820139477, win 58, options [nop,nop,TS val 4294760859 ecr 4294760811], length 164
11:00:32.613551 IP 10.0.0.1.8882 > 10.0.0.2.34761: Flags [.], ack 106110998, win 264, options [nop,nop,TS val 4294760853 ecr 4294760820], length 0
11:00:32.629362 IP 10.0.0.2.34761 > 10.0.0.1.8882: Flags [P.], seq 106111326:106111490, ack 3820139477, win 58, options [nop,nop,TS val 4294760879 ecr 4294760853], length 164
11:00:32.634788 IP 10.0.0.1.8882 > 10.0.0.2.34761: Flags [.], ack 106111162, win 266, options [nop,nop,TS val 4294760875 ecr 4294760840], length 0
11:00:32.649956 IP 10.0.0.2.34761 > 10.0.0.1.8882: Flags [P.], seq 106111490:106111654, ack 3820139477, win 58, options [nop,nop,TS val 4294760900 ecr 4294760875], length 164
11:00:32.653421 IP 10.0.0.1.8882 > 10.0.0.2.34761: Flags [.], ack 106111326, win 269, options [nop,nop,TS val 4294760893 ecr 4294760859], length 0
11:00:32.669379 IP 10.0.0.2.34761 > 10.0.0.1.8882: Flags [P.], seq 106111654:106111818, ack 3820139477, win 58, options [nop,nop,TS val 4294760919 ecr 4294760893], length 164
11:00:32.678295 IP 10.0.0.1.8882 > 10.0.0.2.34761: Flags [.], ack 106111490, win 271, options [nop,nop,TS val 4294760918 ecr 4294760879], length 0
11:00:32.689903 IP 10.0.0.2.34761 > 10.0.0.1.8882: Flags [P.], seq 106111818:106111982, ack 3820139477, win 58, options [nop,nop,TS val 4294760940 ecr 4294760918], length 164
11:00:32.696121 IP 10.0.0.1.8882 > 10.0.0.2.34761: Flags [.], ack 106111654, win 273, options [nop,nop,TS val 4294760936 ecr 4294760900], length 0
11:00:32.709697 IP 10.0.0.2.34761 > 10.0.0.1.8882: Flags [P.], seq 106111982:106112146, ack 3820139477, win 58, options [nop,nop,TS val 4294760960 ecr 4294760936], length 164
11:00:32.717844 IP 10.0.0.1.8882 > 10.0.0.2.34761: Flags [.], ack 106111818, win 275, options [nop,nop,TS val 4294760958 ecr 4294760919], length 0
11:00:32.729676 IP 10.0.0.2.34761 > 10.0.0.1.8882: Flags [P.], seq 106112146:106112310, ack 3820139477, win 58, options [nop,nop,TS val 4294760980 ecr 4294760958], length 164
11:00:32.736569 IP 10.0.0.1.8882 > 10.0.0.2.34761: Flags [.], ack 106111982, win 277, options [nop,nop,TS val 4294760976 ecr 4294760940], length 0
11:00:32.749294 IP 10.0.0.2.34761 > 10.0.0.1.8882: Flags [P.], seq 106112310:106112474, ack 3820139477, win 58, options [nop,nop,TS val 4294760999 ecr 4294760976], length 164
11:00:32.757420 IP 10.0.0.1.8882 > 10.0.0.2.34761: Flags [.], ack 106112146, win 279, options [nop,nop,TS val 4294760997 ecr 4294760960], length 0
11:00:32.769901 IP 10.0.0.2.34761 > 10.0.0.1.8882: Flags [P.], seq 106112474:106112638, ack 3820139477, win 58, options [nop,nop,TS val 4294761019 ecr 4294760997], length 164
11:00:32.775639 IP 10.0.0.1.8882 > 10.0.0.2.34761: Flags [.], ack 106112310, win 281, options [nop,nop,TS val 4294761015 ecr 4294760980], length 0
11:00:32.789520 IP 10.0.0.2.34761 > 10.0.0.1.8882: Flags [P.], seq 106112638:106112802, ack 3820139477, win 58, options [nop,nop,TS val 4294761039 ecr 4294761015], length 164
11:00:32.797429 IP 10.0.0.1.8882 > 10.0.0.2.34761: Flags [.], ack 106112474, win 283, options [nop,nop,TS val 4294761037 ecr 4294760999], length 0
11:00:32.809779 IP 10.0.0.2.34761 > 10.0.0.1.8882: Flags [P.], seq 106112802:106112966, ack 3820139477, win 58, options [nop,nop,TS val 4294761059 ecr 4294761037], length 164
11:00:32.815541 IP 10.0.0.1.8882 > 10.0.0.2.34761: Flags [.], ack 106112638, win 285, options [nop,nop,TS val 4294761055 ecr 4294761019], length 0
11:00:32.829393 IP 10.0.0.2.34761 > 10.0.0.1.8882: Flags [P.], seq 106112966:106113130, ack 3820139477, win 58, options [nop,nop,TS val 4294761079 ecr 4294761055], length 164
11:00:32.836925 IP 10.0.0.1.8882 > 10.0.0.2.34761: Flags [.], ack 106112802, win 287, options [nop,nop,TS val 4294761077 ecr 4294761039], length 0
11:00:32.849835 IP 10.0.0.2.34761 > 10.0.0.1.8882: Flags [P.], seq 106113130:106113294, ack 3820139477, win 58, options [nop,nop,TS val 4294761099 ecr 4294761077], length 164
11:00:32.858709 IP 10.0.0.1.8882 > 10.0.0.2.34761: Flags [.], ack 106112966, win 289, options [nop,nop,TS val 4294761099 ecr 4294761059], length 0
11:00:32.869385 IP 10.0.0.2.34761 > 10.0.0.1.8882: Flags [P.], seq 106113294:106113458, ack 3820139477, win 58, options [nop,nop,TS val 4294761119 ecr 4294761099], length 164
11:00:32.877502 IP 10.0.0.1.8882 > 10.0.0.2.34761: Flags [.], ack 106113130, win 292, options [nop,nop,TS val 4294761117 ecr 4294761079], length 0
11:00:32.890170 IP 10.0.0.2.34761 > 10.0.0.1.8882: Flags [P.], seq 106113458:106113622, ack 3820139477, win 58, options [nop,nop,TS val 4294761140 ecr 4294761117], length 164
11:00:32.893553 IP 10.0.0.1.8882 > 10.0.0.2.34761: Flags [.], ack 106113294, win 294, options [nop,nop,TS val 4294761133 ecr 4294761099], length 0
11:00:32.909304 IP 10.0.0.2.34761 > 10.0.0.1.8882: Flags [P.], seq 106113622:106113786, ack 3820139477, win 58, options [nop,nop,TS val 4294761159 ecr 4294761133], length 164
11:00:32.915054 IP 10.0.0.1.8882 > 10.0.0.2.34761: Flags [.], ack 106113458, win 296, options [nop,nop,TS val 4294761155 ecr 4294761119], length 0
11:00:32.929506 IP 10.0.0.2.34761 > 10.0.0.1.8882: Flags [P.], seq 106113786:106113950, ack 3820139477, win 58, options [nop,nop,TS val 4294761179 ecr 4294761155], length 164
11:00:32.933339 IP 10.0.0.1.8882 > 10.0.0.2.34761: Flags [.], ack 106113622, win 298, options [nop,nop,TS val 4294761173 ecr 4294761140], length 0
11:00:32.949494 IP 10.0.0.2.34761 > 10.0.0.1.8882: Flags [P.], seq 106113950:106114114, ack 3820139477, win 58, options [nop,nop,TS val 4294761199 ecr 4294761173], length 164
11:00:32.952112 IP 10.0.0.1.8882 > 10.0.0.2.34761: Flags [.], ack 106113786, win 300, options [nop,nop,TS val 4294761192 ecr 4294761159], length 0
11:00:32.961197 IP 10.0.0.1.8882 > 10.0.0.2.34761: Flags [.], ack 106113950, win 302, options [nop,nop,TS val 4294761201 ecr 4294761179], length 0
11:00:32.969960 IP 10.0.0.2.34761 > 10.0.0.1.8882: Flags [P.], seq 106114114:106114278, ack 3820139477, win 58, options [nop,nop,TS val 4294761220 ecr 4294761201], length 164
11:00:32.979972 IP 10.0.0.1.8882 > 10.0.0.2.34761: Flags [.], ack 106114114, win 304, options [nop,nop,TS val 4294761220 ecr 4294761199], length 0
11:00:32.989950 IP 10.0.0.2.34761 > 10.0.0.1.8882: Flags [P.], seq 106114278:106114442, ack 3820139477, win 58, options [nop,nop,TS val 4294761240 ecr 4294761220], length 164
11:00:32.992423 IP 10.0.0.1.8882 > 10.0.0.2.34761: Flags [.], ack 106114278, win 306, options [nop,nop,TS val 4294761232 ecr 4294761220], length 0
11:00:33.009529 IP 10.0.0.2.34761 > 10.0.0.1.8882: Flags [P.], seq 106114442:106114606, ack 3820139477, win 58, options [nop,nop,TS val 4294761259 ecr 4294761232], length 164
11:00:33.015618 IP 10.0.0.1.8882 > 10.0.0.2.34761: Flags [.], ack 106114442, win 308, options [nop,nop,TS val 4294761255 ecr 4294761240], length 0
11:00:33.029705 IP 10.0.0.2.34761 > 10.0.0.1.8882: Flags [P.], seq 106114606:106114770, ack 3820139477, win 58, options [nop,nop,TS val 4294761280 ecr 4294761255], length 164
11:00:33.036267 IP 10.0.0.1.8882 > 10.0.0.2.34761: Flags [.], ack 106114606, win 310, options [nop,nop,TS val 4294761276 ecr 4294761259], length 0
11:00:33.049565 IP 10.0.0.2.34761 > 10.0.0.1.8882: Flags [P.], seq 106114770:106114934, ack 3820139477, win 58, options [nop,nop,TS val 4294761299 ecr 4294761276], length 164
11:00:33.054902 IP 10.0.0.1.8882 > 10.0.0.2.34761: Flags [.], ack 106114770, win 312, options [nop,nop,TS val 4294761295 ecr 4294761280], length 0
11:00:33.069493 IP 10.0.0.2.34761 > 10.0.0.1.8882: Flags [P.], seq 106114934:106115098, ack 3820139477, win 58, options [nop,nop,TS val 4294761319 ecr 4294761295], length 164
11:00:33.076474 IP 10.0.0.1.8882 > 10.0.0.2.34761: Flags [.], ack 106114934, win 315, options [nop,nop,TS val 4294761316 ecr 4294761299], length 0
11:00:33.089507 IP 10.0.0.2.34761 > 10.0.0.1.8882: Flags [P.], seq 106115098:106115262, ack 3820139477, win 58, options [nop,nop,TS val 4294761339 ecr 4294761316], length 164
11:00:33.094845 IP 10.0.0.1.8882 > 10.0.0.2.34761: Flags [.], ack 106115098, win 317, options [nop,nop,TS val 4294761335 ecr 4294761319], length 0
11:00:33.109587 IP 10.0.0.2.34761 > 10.0.0.1.8882: Flags [P.], seq 106115262:106115426, ack 3820139477, win 58, options [nop,nop,TS val 4294761359 ecr 4294761335], length 164
11:00:33.115881 IP 10.0.0.1.8882 > 10.0.0.2.34761: Flags [.], ack 106115262, win 319, options [nop,nop,TS val 4294761356 ecr 4294761339], length 0
11:00:33.129390 IP 10.0.0.2.34761 > 10.0.0.1.8882: Flags [P.], seq 106115426:106115590, ack 3820139477, win 58, options [nop,nop,TS val 4294761379 ecr 4294761356], length 164
11:00:33.134378 IP 10.0.0.1.8882 > 10.0.0.2.34761: Flags [.], ack 106115426, win 321, options [nop,nop,TS val 4294761374 ecr 4294761359], length 0
11:00:33.149569 IP 10.0.0.2.34761 > 10.0.0.1.8882: Flags [P.], seq 106115590:106115754, ack 3820139477, win 58, options [nop,nop,TS val 4294761400 ecr 4294761374], length 164
11:00:33.155956 IP 10.0.0.1.8882 > 10.0.0.2.34761: Flags [.], ack 106115590, win 323, options [nop,nop,TS val 4294761396 ecr 4294761379], length 0
11:00:33.169727 IP 10.0.0.2.34761 > 10.0.0.1.8882: Flags [P.], seq 106115754:106115918, ack 3820139477, win 58, options [nop,nop,TS val 4294761420 ecr 4294761396], length 164
11:00:33.174418 IP 10.0.0.1.8882 > 10.0.0.2.34761: Flags [.], ack 106115754, win 325, options [nop,nop,TS val 4294761414 ecr 4294761400], length 0
11:00:33.189869 IP 10.0.0.2.34761 > 10.0.0.1.8882: Flags [P.], seq 106115918:106116082, ack 3820139477, win 58, options [nop,nop,TS val 4294761440 ecr 4294761414], length 164
11:00:33.196099 IP 10.0.0.1.8882 > 10.0.0.2.34761: Flags [.], ack 106115918, win 327, options [nop,nop,TS val 4294761436 ecr 4294761420], length 0
11:00:33.209614 IP 10.0.0.2.34761 > 10.0.0.1.8882: Flags [P.], seq 106116082:106116246, ack 3820139477, win 58, options [nop,nop,TS val 4294761460 ecr 4294761436], length 164
11:00:33.217433 IP 10.0.0.1.8882 > 10.0.0.2.34761: Flags [.], ack 106116082, win 329, options [nop,nop,TS val 4294761457 ecr 4294761440], length 0
11:00:33.229509 IP 10.0.0.2.34761 > 10.0.0.1.8882: Flags [P.], seq 106116246:106116410, ack 3820139477, win 58, options [nop,nop,TS val 4294761479 ecr 4294761457], length 164
