11:27:53.420856 IP 10.0.0.2.40848 > vagrant-ubuntu-trusty-64.8882: Flags [P.], seq 2839601861:2839602025, ack 779302498, win 58, options [nop,nop,TS val 4294713041 ecr 4294713030], length 164
11:27:53.420926 IP vagrant-ubuntu-trusty-64.8882 > 10.0.0.2.40848: Flags [.], ack 2839602025, win 63, options [nop,nop,TS val 4294713051 ecr 4294713041], length 0
11:27:53.441173 IP 10.0.0.2.40848 > vagrant-ubuntu-trusty-64.8882: Flags [P.], seq 2839602025:2839602189, ack 779302498, win 58, options [nop,nop,TS val 4294713061 ecr 4294713030], length 164
11:27:53.441222 IP vagrant-ubuntu-trusty-64.8882 > 10.0.0.2.40848: Flags [.], ack 2839602189, win 65, options [nop,nop,TS val 4294713072 ecr 4294713061], length 0
11:27:53.460091 IP 10.0.0.2.40848 > vagrant-ubuntu-trusty-64.8882: Flags [P.], seq 2839602189:2839602353, ack 779302498, win 58, options [nop,nop,TS val 4294713080 ecr 4294713051], length 164
11:27:53.460164 IP vagrant-ubuntu-trusty-64.8882 > 10.0.0.2.40848: Flags [.], ack 2839602353, win 68, options [nop,nop,TS val 4294713090 ecr 4294713080], length 0
11:27:53.479858 IP 10.0.0.2.40848 > vagrant-ubuntu-trusty-64.8882: Flags [P.], seq 2839602353:2839602517, ack 779302498, win 58, options [nop,nop,TS val 4294713100 ecr 4294713072], length 164
11:27:53.479943 IP vagrant-ubuntu-trusty-64.8882 > 10.0.0.2.40848: Flags [.], ack 2839602517, win 70, options [nop,nop,TS val 4294713110 ecr 4294713100], length 0
11:27:53.499846 IP 10.0.0.2.40848 > vagrant-ubuntu-trusty-64.8882: Flags [P.], seq 2839602517:2839602681, ack 779302498, win 58, options [nop,nop,TS val 4294713120 ecr 4294713090], length 164
11:27:53.499909 IP vagrant-ubuntu-trusty-64.8882 > 10.0.0.2.40848: Flags [.], ack 2839602681, win 72, options [nop,nop,TS val 4294713130 ecr 4294713120], length 0
11:27:53.520216 IP 10.0.0.2.40848 > vagrant-ubuntu-trusty-64.8882: Flags [P.], seq 2839602681:2839602845, ack 779302498, win 58, options [nop,nop,TS val 4294713140 ecr 4294713110], length 164
11:27:53.520260 IP vagrant-ubuntu-trusty-64.8882 > 10.0.0.2.40848: Flags [.], ack 2839602845, win 74, options [nop,nop,TS val 4294713151 ecr 4294713140], length 0
11:27:53.539446 IP 10.0.0.2.40848 > vagrant-ubuntu-trusty-64.8882: Flags [P.], seq 2839602845:2839603009, ack 779302498, win 58, options [nop,nop,TS val 4294713160 ecr 4294713130], length 164
11:27:53.539490 IP vagrant-ubuntu-trusty-64.8882 > 10.0.0.2.40848: Flags [.], ack 2839603009, win 76, options [nop,nop,TS val 4294713170 ecr 4294713160], length 0
11:27:53.560072 IP 10.0.0.2.40848 > vagrant-ubuntu-trusty-64.8882: Flags [P.], seq 2839603009:2839603173, ack 779302498, win 58, options [nop,nop,TS val 4294713180 ecr 4294713151], length 164
11:27:53.560116 IP vagrant-ubuntu-trusty-64.8882 > 10.0.0.2.40848: Flags [.], ack 2839603173, win 78, options [nop,nop,TS val 4294713190 ecr 4294713180], length 0
11:27:53.580058 IP 10.0.0.2.40848 > vagrant-ubuntu-trusty-64.8882: Flags [P.], seq 2839603173:2839603337, ack 779302498, win 58, options [nop,nop,TS val 4294713200 ecr 4294713170], length 164
11:27:53.580076 IP vagrant-ubuntu-trusty-64.8882 > 10.0.0.2.40848: Flags [.], ack 2839603337, win 80, options [nop,nop,TS val 4294713211 ecr 4294713200], length 0
11:27:53.599735 IP 10.0.0.2.40848 > vagrant-ubuntu-trusty-64.8882: Flags [P.], seq 2839603337:2839603501, ack 779302498, win 58, options [nop,nop,TS val 4294713220 ecr 4294713190], length 164
11:27:53.599757 IP vagrant-ubuntu-trusty-64.8882 > 10.0.0.2.40848: Flags [.], ack 2839603501, win 82, options [nop,nop,TS val 4294713230 ecr 4294713220], length 0
11:27:53.638290 IP 10.0.0.2.40848 > vagrant-ubuntu-trusty-64.8882: Flags [P.], seq 2839603501:2839603665, ack 779302498, win 58, options [nop,nop,TS val 4294713240 ecr 4294713211], length 164
11:27:53.638369 IP vagrant-ubuntu-trusty-64.8882 > 10.0.0.2.40848: Flags [.], ack 2839603665, win 84, options [nop,nop,TS val 4294713268 ecr 4294713240], length 0
11:27:53.662247 IP 10.0.0.2.40848 > vagrant-ubuntu-trusty-64.8882: Flags [P.], seq 2839603665:2839603829, ack 779302498, win 58, options [nop,nop,TS val 4294713260 ecr 4294713230], length 164
11:27:53.662283 IP vagrant-ubuntu-trusty-64.8882 > 10.0.0.2.40848: Flags [.], ack 2839603829, win 86, options [nop,nop,TS val 4294713293 ecr 4294713260], length 0
11:27:53.748735 IP 10.0.0.2.40848 > vagrant-ubuntu-trusty-64.8882: Flags [P.], seq 2839604485:2839604649, ack 779302498, win 58, options [nop,nop,TS val 4294713360 ecr 4294713293], length 164
11:27:53.748749 IP vagrant-ubuntu-trusty-64.8882 > 10.0.0.2.40848: Flags [.], ack 2839603829, win 88, options [nop,nop,TS val 4294713379 ecr 4294713260,nop,nop,sack 1 {2839604485:2839604649}], length 0
11:27:53.769251 IP 10.0.0.2.40848 > vagrant-ubuntu-trusty-64.8882: Flags [P.], seq 2839604649:2839604813, ack 779302498, win 58, options [nop,nop,TS val 4294713380 ecr 4294713293], length 164
11:27:53.769312 IP vagrant-ubuntu-trusty-64.8882 > 10.0.0.2.40848: Flags [.], ack 2839603829, win 91, options [nop,nop,TS val 4294713399 ecr 4294713260,nop,nop,sack 1 {2839604485:2839604813}], length 0
11:27:53.777944 IP 10.0.0.2.40848 > vagrant-ubuntu-trusty-64.8882: Flags [P.], seq 2839603829:2839604485, ack 779302498, win 58, options [nop,nop,TS val 4294713389 ecr 4294713379], length 656
11:27:53.777960 IP vagrant-ubuntu-trusty-64.8882 > 10.0.0.2.40848: Flags [.], ack 2839604813, win 93, options [nop,nop,TS val 4294713408 ecr 4294713389], length 0
11:27:53.788487 IP 10.0.0.2.40848 > vagrant-ubuntu-trusty-64.8882: Flags [P.], seq 2839604813:2839604977, ack 779302498, win 58, options [nop,nop,TS val 4294713400 ecr 4294713379], length 164
11:27:53.788554 IP vagrant-ubuntu-trusty-64.8882 > 10.0.0.2.40848: Flags [.], ack 2839604977, win 96, options [nop,nop,TS val 4294713419 ecr 4294713400], length 0
11:27:53.814320 IP 10.0.0.2.40848 > vagrant-ubuntu-trusty-64.8882: Flags [P.], seq 2839604977:2839605141, ack 779302498, win 58, options [nop,nop,TS val 4294713420 ecr 4294713408], length 164
11:27:53.814440 IP vagrant-ubuntu-trusty-64.8882 > 10.0.0.2.40848: Flags [.], ack 2839605141, win 98, options [nop,nop,TS val 4294713444 ecr 4294713420], length 0
11:27:53.829249 IP 10.0.0.2.40848 > vagrant-ubuntu-trusty-64.8882: Flags [P.], seq 2839605141:2839605305, ack 779302498, win 58, options [nop,nop,TS val 4294713440 ecr 4294713419], length 164
11:27:53.829261 IP vagrant-ubuntu-trusty-64.8882 > 10.0.0.2.40848: Flags [.], ack 2839605305, win 101, options [nop,nop,TS val 4294713459 ecr 4294713440], length 0
11:27:53.857676 IP 10.0.0.2.40848 > vagrant-ubuntu-trusty-64.8882: Flags [P.], seq 2839605305:2839605469, ack 779302498, win 58, options [nop,nop,TS val 4294713460 ecr 4294713444], length 164
11:27:53.857719 IP vagrant-ubuntu-trusty-64.8882 > 10.0.0.2.40848: Flags [.], ack 2839605469, win 103, options [nop,nop,TS val 4294713488 ecr 4294713460], length 0
11:27:53.888677 IP 10.0.0.2.40848 > vagrant-ubuntu-trusty-64.8882: Flags [P.], seq 2839605633:2839605797, ack 779302498, win 58, options [nop,nop,TS val 4294713500 ecr 4294713488], length 164
11:27:53.888710 IP vagrant-ubuntu-trusty-64.8882 > 10.0.0.2.40848: Flags [.], ack 2839605469, win 106, options [nop,nop,TS val 4294713519 ecr 4294713460,nop,nop,sack 1 {2839605633:2839605797}], length 0
11:27:53.910161 IP 10.0.0.2.40848 > vagrant-ubuntu-trusty-64.8882: Flags [P.], seq 2839605797:2839605961, ack 779302498, win 58, options [nop,nop,TS val 4294713520 ecr 4294713488], length 164
11:27:53.910189 IP vagrant-ubuntu-trusty-64.8882 > 10.0.0.2.40848: Flags [.], ack 2839605469, win 108, options [nop,nop,TS val 4294713541 ecr 4294713460,nop,nop,sack 1 {2839605633:2839605961}], length 0
11:27:53.930161 IP 10.0.0.2.40848 > vagrant-ubuntu-trusty-64.8882: Flags [P.], seq 2839605469:2839605633, ack 779302498, win 58, options [nop,nop,TS val 4294713537 ecr 4294713519], length 164
11:27:53.930183 IP vagrant-ubuntu-trusty-64.8882 > 10.0.0.2.40848: Flags [.], ack 2839605961, win 111, options [nop,nop,TS val 4294713561 ecr 4294713537], length 0
11:27:53.950010 IP 10.0.0.2.40848 > vagrant-ubuntu-trusty-64.8882: Flags [P.], seq 2839606125:2839606289, ack 779302498, win 58, options [nop,nop,TS val 4294713560 ecr 4294713541], length 164
11:27:53.950060 IP vagrant-ubuntu-trusty-64.8882 > 10.0.0.2.40848: Flags [.], ack 2839605961, win 114, options [nop,nop,TS val 4294713580 ecr 4294713537,nop,nop,sack 1 {2839606125:2839606289}], length 0
11:27:53.968307 IP 10.0.0.2.40848 > vagrant-ubuntu-trusty-64.8882: Flags [P.], seq 2839606289:2839606453, ack 779302498, win 58, options [nop,nop,TS val 4294713580 ecr 4294713561], length 164
11:27:53.968321 IP vagrant-ubuntu-trusty-64.8882 > 10.0.0.2.40848: Flags [.], ack 2839605961, win 116, options [nop,nop,TS val 4294713599 ecr 4294713537,nop,nop,sack 1 {2839606125:2839606453}], length 0
11:27:53.990347 IP 10.0.0.2.40848 > vagrant-ubuntu-trusty-64.8882: Flags [P.], seq 2839605961:2839606125, ack 779302498, win 58, options [nop,nop,TS val 4294713599 ecr 4294713580], length 164
11:27:53.990397 IP vagrant-ubuntu-trusty-64.8882 > 10.0.0.2.40848: Flags [.], ack 2839606453, win 119, options [nop,nop,TS val 4294713620 ecr 4294713599], length 0
11:27:53.992234 IP 10.0.0.2.40848 > vagrant-ubuntu-trusty-64.8882: Flags [P.], seq 2839606453:2839606617, ack 779302498, win 58, options [nop,nop,TS val 4294713600 ecr 4294713580], length 164
11:27:53.992322 IP vagrant-ubuntu-trusty-64.8882 > 10.0.0.2.40848: Flags [.], ack 2839606617, win 121, options [nop,nop,TS val 4294713622 ecr 4294713600], length 0
11:27:54.010584 IP 10.0.0.2.40848 > vagrant-ubuntu-trusty-64.8882: Flags [P.], seq 2839606617:2839606781, ack 779302498, win 58, options [nop,nop,TS val 4294713631 ecr 4294713620], length 164
11:27:54.010598 IP vagrant-ubuntu-trusty-64.8882 > 10.0.0.2.40848: Flags [.], ack 2839606781, win 124, options [nop,nop,TS val 4294713641 ecr 4294713631], length 0
11:27:54.019610 IP 10.0.0.2.40848 > vagrant-ubuntu-trusty-64.8882: Flags [P.], seq 2839606781:2839606945, ack 779302498, win 58, options [nop,nop,TS val 4294713640 ecr 4294713622], length 164
11:27:54.019651 IP vagrant-ubuntu-trusty-64.8882 > 10.0.0.2.40848: Flags [.], ack 2839606945, win 126, options [nop,nop,TS val 4294713650 ecr 4294713640], length 0
11:27:54.039538 IP 10.0.0.2.40848 > vagrant-ubuntu-trusty-64.8882: Flags [P.], seq 2839606945:2839607109, ack 779302498, win 58, options [nop,nop,TS val 4294713660 ecr 4294713641], length 164
11:27:54.039568 IP vagrant-ubuntu-trusty-64.8882 > 10.0.0.2.40848: Flags [.], ack 2839607109, win 129, options [nop,nop,TS val 4294713670 ecr 4294713660], length 0
11:27:54.059507 IP 10.0.0.2.40848 > vagrant-ubuntu-trusty-64.8882: Flags [P.], seq 2839607109:2839607273, ack 779302498, win 58, options [nop,nop,TS val 4294713680 ecr 4294713650], length 164
11:27:54.059530 IP vagrant-ubuntu-trusty-64.8882 > 10.0.0.2.40848: Flags [.], ack 2839607273, win 132, options [nop,nop,TS val 4294713690 ecr 4294713680], length 0
11:27:54.091647 IP 10.0.0.2.40848 > vagrant-ubuntu-trusty-64.8882: Flags [P.], seq 2839607273:2839607437, ack 779302498, win 58, options [nop,nop,TS val 4294713700 ecr 4294713670], length 164
11:27:54.091702 IP vagrant-ubuntu-trusty-64.8882 > 10.0.0.2.40848: Flags [.], ack 2839607437, win 134, options [nop,nop,TS val 4294713722 ecr 4294713700], length 0
11:27:54.112730 IP 10.0.0.2.40848 > vagrant-ubuntu-trusty-64.8882: Flags [P.], seq 2839607437:2839607601, ack 779302498, win 58, options [nop,nop,TS val 4294713721 ecr 4294713690], length 164
11:27:54.112765 IP vagrant-ubuntu-trusty-64.8882 > 10.0.0.2.40848: Flags [.], ack 2839607601, win 137, options [nop,nop,TS val 4294713743 ecr 4294713721], length 0
11:27:54.131624 IP 10.0.0.2.40848 > vagrant-ubuntu-trusty-64.8882: Flags [P.], seq 2839607601:2839607765, ack 779302498, win 58, options [nop,nop,TS val 4294713740 ecr 4294713722], length 164
11:27:54.131680 IP vagrant-ubuntu-trusty-64.8882 > 10.0.0.2.40848: Flags [.], ack 2839607765, win 139, options [nop,nop,TS val 4294713762 ecr 4294713740], length 0
11:27:54.152562 IP 10.0.0.2.40848 > vagrant-ubuntu-trusty-64.8882: Flags [P.], seq 2839607765:2839607929, ack 779302498, win 58, options [nop,nop,TS val 4294713761 ecr 4294713743], length 164
11:27:54.152594 IP vagrant-ubuntu-trusty-64.8882 > 10.0.0.2.40848: Flags [.], ack 2839607929, win 142, options [nop,nop,TS val 4294713783 ecr 4294713761], length 0
11:27:54.171584 IP 10.0.0.2.40848 > vagrant-ubuntu-trusty-64.8882: Flags [P.], seq 2839607929:2839608093, ack 779302498, win 58, options [nop,nop,TS val 4294713780 ecr 4294713762], length 164
11:27:54.171656 IP vagrant-ubuntu-trusty-64.8882 > 10.0.0.2.40848: Flags [.], ack 2839608093, win 144, options [nop,nop,TS val 4294713802 ecr 4294713780], length 0
11:27:54.189774 IP 10.0.0.2.40848 > vagrant-ubuntu-trusty-64.8882: Flags [P.], seq 2839608093:2839608257, ack 779302498, win 58, options [nop,nop,TS val 4294713800 ecr 4294713783], length 164
11:27:54.189820 IP vagrant-ubuntu-trusty-64.8882 > 10.0.0.2.40848: Flags [.], ack 2839608257, win 147, options [nop,nop,TS val 4294713820 ecr 4294713800], length 0
11:27:54.211318 IP 10.0.0.2.40848 > vagrant-ubuntu-trusty-64.8882: Flags [P.], seq 2839608257:2839608421, ack 779302498, win 58, options [nop,nop,TS val 4294713820 ecr 4294713802], length 164
11:27:54.211387 IP vagrant-ubuntu-trusty-64.8882 > 10.0.0.2.40848: Flags [.], ack 2839608421, win 149, options [nop,nop,TS val 4294713841 ecr 4294713820], length 0
11:27:54.232540 IP 10.0.0.2.40848 > vagrant-ubuntu-trusty-64.8882: Flags [P.], seq 2839608421:2839608585, ack 779302498, win 58, options [nop,nop,TS val 4294713840 ecr 4294713820], length 164
11:27:54.232573 IP vagrant-ubuntu-trusty-64.8882 > 10.0.0.2.40848: Flags [.], ack 2839608585, win 152, options [nop,nop,TS val 4294713863 ecr 4294713840], length 0
11:27:54.251467 IP 10.0.0.2.40848 > vagrant-ubuntu-trusty-64.8882: Flags [P.], seq 2839608585:2839608749, ack 779302498, win 58, options [nop,nop,TS val 4294713860 ecr 4294713841], length 164
11:27:54.251561 IP vagrant-ubuntu-trusty-64.8882 > 10.0.0.2.40848: Flags [.], ack 2839608749, win 155, options [nop,nop,TS val 4294713881 ecr 4294713860], length 0
11:27:54.272793 IP 10.0.0.2.40848 > vagrant-ubuntu-trusty-64.8882: Flags [P.], seq 2839608749:2839608913, ack 779302498, win 58, options [nop,nop,TS val 4294713880 ecr 4294713863], length 164
11:27:54.272842 IP vagrant-ubuntu-trusty-64.8882 > 10.0.0.2.40848: Flags [.], ack 2839608913, win 157, options [nop,nop,TS val 4294713903 ecr 4294713880], length 0
11:27:54.290664 IP 10.0.0.2.40848 > vagrant-ubuntu-trusty-64.8882: Flags [P.], seq 2839608913:2839609077, ack 779302498, win 58, options [nop,nop,TS val 4294713900 ecr 4294713881], length 164
11:27:54.290682 IP vagrant-ubuntu-trusty-64.8882 > 10.0.0.2.40848: Flags [.], ack 2839609077, win 160, options [nop,nop,TS val 4294713921 ecr 4294713900], length 0
11:27:54.312750 IP 10.0.0.2.40848 > vagrant-ubuntu-trusty-64.8882: Flags [P.], seq 2839609077:2839609241, ack 779302498, win 58, options [nop,nop,TS val 4294713920 ecr 4294713903], length 164
11:27:54.312803 IP vagrant-ubuntu-trusty-64.8882 > 10.0.0.2.40848: Flags [.], ack 2839609241, win 162, options [nop,nop,TS val 4294713943 ecr 4294713920], length 0
11:27:54.333611 IP 10.0.0.2.40848 > vagrant-ubuntu-trusty-64.8882: Flags [P.], seq 2839609241:2839609405, ack 779302498, win 58, options [nop,nop,TS val 4294713940 ecr 4294713921], length 164
11:27:54.333644 IP vagrant-ubuntu-trusty-64.8882 > 10.0.0.2.40848: Flags [.], ack 2839609405, win 165, options [nop,nop,TS val 4294713964 ecr 4294713940], length 0
11:27:54.355583 IP 10.0.0.2.40848 > vagrant-ubuntu-trusty-64.8882: Flags [P.], seq 2839609405:2839609569, ack 779302498, win 58, options [nop,nop,TS val 4294713960 ecr 4294713943], length 164
11:27:54.355638 IP vagrant-ubuntu-trusty-64.8882 > 10.0.0.2.40848: Flags [.], ack 2839609569, win 167, options [nop,nop,TS val 4294713986 ecr 4294713960], length 0
11:27:54.373894 IP 10.0.0.2.40848 > vagrant-ubuntu-trusty-64.8882: Flags [P.], seq 2839609569:2839609733, ack 779302498, win 58, options [nop,nop,TS val 4294713980 ecr 4294713964], length 164
11:27:54.373966 IP vagrant-ubuntu-trusty-64.8882 > 10.0.0.2.40848: Flags [.], ack 2839609733, win 170, options [nop,nop,TS val 4294714004 ecr 4294713980], length 0
11:27:54.395495 IP 10.0.0.2.40848 > vagrant-ubuntu-trusty-64.8882: Flags [P.], seq 2839609733:2839609897, ack 779302498, win 58, options [nop,nop,TS val 4294714000 ecr 4294713986], length 164
11:27:54.395561 IP vagrant-ubuntu-trusty-64.8882 > 10.0.0.2.40848: Flags [.], ack 2839609897, win 173, options [nop,nop,TS val 4294714026 ecr 4294714000], length 0
11:27:54.413855 IP 10.0.0.2.40848 > vagrant-ubuntu-trusty-64.8882: Flags [P.], seq 2839609897:2839610061, ack 779302498, win 58, options [nop,nop,TS val 4294714020 ecr 4294714004], length 164
11:27:54.413903 IP vagrant-ubuntu-trusty-64.8882 > 10.0.0.2.40848: Flags [.], ack 2839610061, win 175, options [nop,nop,TS val 4294714044 ecr 4294714020], length 0
11:27:54.434936 IP 10.0.0.2.40848 > vagrant-ubuntu-trusty-64.8882: Flags [P.], seq 2839610061:2839610225, ack 779302498, win 58, options [nop,nop,TS val 4294714040 ecr 4294714026], length 164
11:27:54.435011 IP vagrant-ubuntu-trusty-64.8882 > 10.0.0.2.40848: Flags [.], ack 2839610225, win 178, options [nop,nop,TS val 4294714065 ecr 4294714040], length 0
11:27:54.453680 IP 10.0.0.2.40848 > vagrant-ubuntu-trusty-64.8882: Flags [P.], seq 2839610225:2839610389, ack 779302498, win 58, options [nop,nop,TS val 4294714060 ecr 4294714044], length 164
11:27:54.453755 IP vagrant-ubuntu-trusty-64.8882 > 10.0.0.2.40848: Flags [.], ack 2839610389, win 180, options [nop,nop,TS val 4294714084 ecr 4294714060], length 0
11:27:54.474759 IP 10.0.0.2.40848 > vagrant-ubuntu-trusty-64.8882: Flags [P.], seq 2839610389:2839610553, ack 779302498, win 58, options [nop,nop,TS val 4294714080 ecr 4294714065], length 164
11:27:54.474770 IP vagrant-ubuntu-trusty-64.8882 > 10.0.0.2.40848: Flags [.], ack 2839610553, win 183, options [nop,nop,TS val 4294714104 ecr 4294714080], length 0
11:27:54.493672 IP 10.0.0.2.40848 > vagrant-ubuntu-trusty-64.8882: Flags [P.], seq 2839610553:2839610717, ack 779302498, win 58, options [nop,nop,TS val 4294714100 ecr 4294714084], length 164
11:27:54.493750 IP vagrant-ubuntu-trusty-64.8882 > 10.0.0.2.40848: Flags [.], ack 2839610717, win 185, options [nop,nop,TS val 4294714124 ecr 4294714100], length 0
11:27:54.514624 IP 10.0.0.2.40848 > vagrant-ubuntu-trusty-64.8882: Flags [P.], seq 2839610717:2839610881, ack 779302498, win 58, options [nop,nop,TS val 4294714120 ecr 4294714104], length 164
11:27:54.514654 IP vagrant-ubuntu-trusty-64.8882 > 10.0.0.2.40848: Flags [.], ack 2839610881, win 188, options [nop,nop,TS val 4294714145 ecr 4294714120], length 0
11:27:54.533606 IP 10.0.0.2.40848 > vagrant-ubuntu-trusty-64.8882: Flags [P.], seq 2839610881:2839611045, ack 779302498, win 58, options [nop,nop,TS val 4294714140 ecr 4294714124], length 164
11:27:54.533673 IP vagrant-ubuntu-trusty-64.8882 > 10.0.0.2.40848: Flags [.], ack 2839611045, win 190, options [nop,nop,TS val 4294714164 ecr 4294714140], length 0
11:27:54.554861 IP 10.0.0.2.40848 > vagrant-ubuntu-trusty-64.8882: Flags [P.], seq 2839611045:2839611209, ack 779302498, win 58, options [nop,nop,TS val 4294714160 ecr 4294714145], length 164
11:27:54.554923 IP vagrant-ubuntu-trusty-64.8882 > 10.0.0.2.40848: Flags [.], ack 2839611209, win 193, options [nop,nop,TS val 4294714185 ecr 4294714160], length 0
11:27:54.573499 IP 10.0.0.2.40848 > vagrant-ubuntu-trusty-64.8882: Flags [P.], seq 2839611209:2839611373, ack 779302498, win 58, options [nop,nop,TS val 4294714180 ecr 4294714164], length 164
11:27:54.573601 IP vagrant-ubuntu-trusty-64.8882 > 10.0.0.2.40848: Flags [.], ack 2839611373, win 196, options [nop,nop,TS val 4294714203 ecr 4294714180], length 0
11:27:54.597810 IP 10.0.0.2.40848 > vagrant-ubuntu-trusty-64.8882: Flags [P.], seq 2839611373:2839611537, ack 779302498, win 58, options [nop,nop,TS val 4294714200 ecr 4294714185], length 164
11:27:54.597881 IP vagrant-ubuntu-trusty-64.8882 > 10.0.0.2.40848: Flags [.], ack 2839611537, win 198, options [nop,nop,TS val 4294714228 ecr 4294714200], length 0
11:27:54.615769 IP 10.0.0.2.40848 > vagrant-ubuntu-trusty-64.8882: Flags [P.], seq 2839611537:2839611701, ack 779302498, win 58, options [nop,nop,TS val 4294714220 ecr 4294714203], length 164
11:27:54.615799 IP vagrant-ubuntu-trusty-64.8882 > 10.0.0.2.40848: Flags [.], ack 2839611701, win 201, options [nop,nop,TS val 4294714246 ecr 4294714220], length 0
11:27:54.637761 IP 10.0.0.2.40848 > vagrant-ubuntu-trusty-64.8882: Flags [P.], seq 2839611701:2839611865, ack 779302498, win 58, options [nop,nop,TS val 4294714240 ecr 4294714228], length 164
11:27:54.637838 IP vagrant-ubuntu-trusty-64.8882 > 10.0.0.2.40848: Flags [.], ack 2839611865, win 203, options [nop,nop,TS val 4294714268 ecr 4294714240], length 0
11:27:54.658924 IP 10.0.0.2.40848 > vagrant-ubuntu-trusty-64.8882: Flags [P.], seq 2839611865:2839612029, ack 779302498, win 58, options [nop,nop,TS val 4294714260 ecr 4294714246], length 164
11:27:54.658977 IP vagrant-ubuntu-trusty-64.8882 > 10.0.0.2.40848: Flags [.], ack 2839612029, win 206, options [nop,nop,TS val 4294714289 ecr 4294714260], length 0
11:27:54.677757 IP 10.0.0.2.40848 > vagrant-ubuntu-trusty-64.8882: Flags [P.], seq 2839612029:2839612193, ack 779302498, win 58, options [nop,nop,TS val 4294714280 ecr 4294714268], length 164
11:27:54.677836 IP vagrant-ubuntu-trusty-64.8882 > 10.0.0.2.40848: Flags [.], ack 2839612193, win 208, options [nop,nop,TS val 4294714308 ecr 4294714280], length 0
11:27:54.698835 IP 10.0.0.2.40848 > vagrant-ubuntu-trusty-64.8882: Flags [P.], seq 2839612193:2839612357, ack 779302498, win 58, options [nop,nop,TS val 4294714301 ecr 4294714268], length 164
11:27:54.698909 IP vagrant-ubuntu-trusty-64.8882 > 10.0.0.2.40848: Flags [.], ack 2839612357, win 211, options [nop,nop,TS val 4294714329 ecr 4294714301], length 0
11:27:54.716770 IP 10.0.0.2.40848 > vagrant-ubuntu-trusty-64.8882: Flags [P.], seq 2839612357:2839612521, ack 779302498, win 58, options [nop,nop,TS val 4294714320 ecr 4294714308], length 164
11:27:54.716787 IP vagrant-ubuntu-trusty-64.8882 > 10.0.0.2.40848: Flags [.], ack 2839612521, win 214, options [nop,nop,TS val 4294714347 ecr 4294714320], length 0
11:27:54.738692 IP 10.0.0.2.40848 > vagrant-ubuntu-trusty-64.8882: Flags [P.], seq 2839612521:2839612685, ack 779302498, win 58, options [nop,nop,TS val 4294714340 ecr 4294714308], length 164
11:27:54.738748 IP vagrant-ubuntu-trusty-64.8882 > 10.0.0.2.40848: Flags [.], ack 2839612685, win 216, options [nop,nop,TS val 4294714369 ecr 4294714340], length 0
11:27:54.756601 IP 10.0.0.2.40848 > vagrant-ubuntu-trusty-64.8882: Flags [P.], seq 2839612685:2839612849, ack 779302498, win 58, options [nop,nop,TS val 4294714360 ecr 4294714347], length 164
11:27:54.756618 IP vagrant-ubuntu-trusty-64.8882 > 10.0.0.2.40848: Flags [.], ack 2839612849, win 219, options [nop,nop,TS val 4294714387 ecr 4294714360], length 0
11:27:54.778023 IP 10.0.0.2.40848 > vagrant-ubuntu-trusty-64.8882: Flags [P.], seq 2839612849:2839613013, ack 779302498, win 58, options [nop,nop,TS val 4294714381 ecr 4294714347], length 164
11:27:54.778034 IP vagrant-ubuntu-trusty-64.8882 > 10.0.0.2.40848: Flags [.], ack 2839613013, win 221, options [nop,nop,TS val 4294714409 ecr 4294714381], length 0
11:27:54.796806 IP 10.0.0.2.40848 > vagrant-ubuntu-trusty-64.8882: Flags [P.], seq 2839613013:2839613177, ack 779302498, win 58, options [nop,nop,TS val 4294714400 ecr 4294714387], length 164
11:27:54.796863 IP vagrant-ubuntu-trusty-64.8882 > 10.0.0.2.40848: Flags [.], ack 2839613177, win 224, options [nop,nop,TS val 4294714427 ecr 4294714400], length 0
11:27:54.817932 IP 10.0.0.2.40848 > vagrant-ubuntu-trusty-64.8882: Flags [P.], seq 2839613177:2839613341, ack 779302498, win 58, options [nop,nop,TS val 4294714420 ecr 4294714409], length 164
11:27:54.817962 IP vagrant-ubuntu-trusty-64.8882 > 10.0.0.2.40848: Flags [.], ack 2839613341, win 226, options [nop,nop,TS val 4294714448 ecr 4294714420], length 0
11:27:54.836793 IP 10.0.0.2.40848 > vagrant-ubuntu-trusty-64.8882: Flags [P.], seq 2839613341:2839613505, ack 779302498, win 58, options [nop,nop,TS val 4294714440 ecr 4294714427], length 164
11:27:54.836856 IP vagrant-ubuntu-trusty-64.8882 > 10.0.0.2.40848: Flags [.], ack 2839613505, win 229, options [nop,nop,TS val 4294714467 ecr 4294714440], length 0
11:27:54.857665 IP 10.0.0.2.40848 > vagrant-ubuntu-trusty-64.8882: Flags [P.], seq 2839613505:2839613669, ack 779302498, win 58, options [nop,nop,TS val 4294714460 ecr 4294714448], length 164
11:27:54.857677 IP vagrant-ubuntu-trusty-64.8882 > 10.0.0.2.40848: Flags [.], ack 2839613669, win 231, options [nop,nop,TS val 4294714488 ecr 4294714460], length 0
11:27:54.882821 IP 10.0.0.2.40848 > vagrant-ubuntu-trusty-64.8882: Flags [P.], seq 2839613669:2839613833, ack 779302498, win 58, options [nop,nop,TS val 4294714481 ecr 4294714467], length 164
11:27:54.882906 IP vagrant-ubuntu-trusty-64.8882 > 10.0.0.2.40848: Flags [.], ack 2839613833, win 234, options [nop,nop,TS val 4294714513 ecr 4294714481], length 0
11:27:54.900599 IP 10.0.0.2.40848 > vagrant-ubuntu-trusty-64.8882: Flags [P.], seq 2839613833:2839613997, ack 779302498, win 58, options [nop,nop,TS val 4294714500 ecr 4294714488], length 164
11:27:54.900630 IP vagrant-ubuntu-trusty-64.8882 > 10.0.0.2.40848: Flags [.], ack 2839613997, win 237, options [nop,nop,TS val 4294714531 ecr 4294714500], length 0
11:27:54.918882 IP 10.0.0.2.40848 > vagrant-ubuntu-trusty-64.8882: Flags [P.], seq 2839613997:2839614161, ack 779302498, win 58, options [nop,nop,TS val 4294714520 ecr 4294714488], length 164
11:27:54.918892 IP vagrant-ubuntu-trusty-64.8882 > 10.0.0.2.40848: Flags [.], ack 2839614161, win 239, options [nop,nop,TS val 4294714549 ecr 4294714520], length 0
11:27:54.940861 IP 10.0.0.2.40848 > vagrant-ubuntu-trusty-64.8882: Flags [P.], seq 2839614161:2839614325, ack 779302498, win 58, options [nop,nop,TS val 4294714540 ecr 4294714513], length 164
11:27:54.940920 IP vagrant-ubuntu-trusty-64.8882 > 10.0.0.2.40848: Flags [.], ack 2839614325, win 242, options [nop,nop,TS val 4294714571 ecr 4294714540], length 0
11:27:54.961785 IP 10.0.0.2.40848 > vagrant-ubuntu-trusty-64.8882: Flags [P.], seq 2839614325:2839614489, ack 779302498, win 58, options [nop,nop,TS val 4294714560 ecr 4294714549], length 164
11:27:54.961801 IP vagrant-ubuntu-trusty-64.8882 > 10.0.0.2.40848: Flags [.], ack 2839614489, win 244, options [nop,nop,TS val 4294714592 ecr 4294714560], length 0
11:27:54.980768 IP 10.0.0.2.40848 > vagrant-ubuntu-trusty-64.8882: Flags [P.], seq 2839614489:2839614653, ack 779302498, win 58, options [nop,nop,TS val 4294714580 ecr 4294714549], length 164
11:27:54.980826 IP vagrant-ubuntu-trusty-64.8882 > 10.0.0.2.40848: Flags [.], ack 2839614653, win 247, options [nop,nop,TS val 4294714611 ecr 4294714580], length 0
11:27:55.002014 IP 10.0.0.2.40848 > vagrant-ubuntu-trusty-64.8882: Flags [P.], seq 2839614653:2839614817, ack 779302498, win 58, options [nop,nop,TS val 4294714600 ecr 4294714571], length 164
11:27:55.002075 IP vagrant-ubuntu-trusty-64.8882 > 10.0.0.2.40848: Flags [.], ack 2839614817, win 249, options [nop,nop,TS val 4294714633 ecr 4294714600], length 0
11:27:55.020998 IP 10.0.0.2.40848 > vagrant-ubuntu-trusty-64.8882: Flags [P.], seq 2839614817:2839614981, ack 779302498, win 58, options [nop,nop,TS val 4294714620 ecr 4294714592], length 164
11:27:55.021061 IP vagrant-ubuntu-trusty-64.8882 > 10.0.0.2.40848: Flags [.], ack 2839614981, win 252, options [nop,nop,TS val 4294714652 ecr 4294714620], length 0
11:27:55.041990 IP 10.0.0.2.40848 > vagrant-ubuntu-trusty-64.8882: Flags [P.], seq 2839614981:2839615145, ack 779302498, win 58, options [nop,nop,TS val 4294714640 ecr 4294714611], length 164
11:27:55.042057 IP vagrant-ubuntu-trusty-64.8882 > 10.0.0.2.40848: Flags [.], ack 2839615145, win 255, options [nop,nop,TS val 4294714673 ecr 4294714640], length 0
11:27:55.059921 IP 10.0.0.2.40848 > vagrant-ubuntu-trusty-64.8882: Flags [P.], seq 2839615145:2839615309, ack 779302498, win 58, options [nop,nop,TS val 4294714660 ecr 4294714633], length 164
11:27:55.059938 IP vagrant-ubuntu-trusty-64.8882 > 10.0.0.2.40848: Flags [.], ack 2839615309, win 257, options [nop,nop,TS val 4294714690 ecr 4294714660], length 0
11:27:55.081801 IP 10.0.0.2.40848 > vagrant-ubuntu-trusty-64.8882: Flags [P.], seq 2839615309:2839615473, ack 779302498, win 58, options [nop,nop,TS val 4294714681 ecr 4294714652], length 164
11:27:55.081854 IP vagrant-ubuntu-trusty-64.8882 > 10.0.0.2.40848: Flags [.], ack 2839615473, win 260, options [nop,nop,TS val 4294714712 ecr 4294714681], length 0
11:27:55.100003 IP 10.0.0.2.40848 > vagrant-ubuntu-trusty-64.8882: Flags [P.], seq 2839615473:2839615637, ack 779302498, win 58, options [nop,nop,TS val 4294714700 ecr 4294714673], length 164
11:27:55.100054 IP vagrant-ubuntu-trusty-64.8882 > 10.0.0.2.40848: Flags [.], ack 2839615637, win 262, options [nop,nop,TS val 4294714731 ecr 4294714700], length 0
11:27:55.121900 IP 10.0.0.2.40848 > vagrant-ubuntu-trusty-64.8882: Flags [P.], seq 2839615637:2839615801, ack 779302498, win 58, options [nop,nop,TS val 4294714720 ecr 4294714690], length 164
11:27:55.121989 IP vagrant-ubuntu-trusty-64.8882 > 10.0.0.2.40848: Flags [.], ack 2839615801, win 265, options [nop,nop,TS val 4294714752 ecr 4294714720], length 0
11:27:55.140163 IP 10.0.0.2.40848 > vagrant-ubuntu-trusty-64.8882: Flags [P.], seq 2839615801:2839615965, ack 779302498, win 58, options [nop,nop,TS val 4294714740 ecr 4294714712], length 164
11:27:55.140223 IP vagrant-ubuntu-trusty-64.8882 > 10.0.0.2.40848: Flags [.], ack 2839615965, win 267, options [nop,nop,TS val 4294714770 ecr 4294714740], length 0
11:27:55.161156 IP 10.0.0.2.40848 > vagrant-ubuntu-trusty-64.8882: Flags [P.], seq 2839615965:2839616129, ack 779302498, win 58, options [nop,nop,TS val 4294714760 ecr 4294714731], length 164
11:27:55.161187 IP vagrant-ubuntu-trusty-64.8882 > 10.0.0.2.40848: Flags [.], ack 2839616129, win 270, options [nop,nop,TS val 4294714792 ecr 4294714760], length 0
11:27:55.180072 IP 10.0.0.2.40848 > vagrant-ubuntu-trusty-64.8882: Flags [P.], seq 2839616129:2839616293, ack 779302498, win 58, options [nop,nop,TS val 4294714780 ecr 4294714752], length 164
11:27:55.180093 IP vagrant-ubuntu-trusty-64.8882 > 10.0.0.2.40848: Flags [.], ack 2839616293, win 272, options [nop,nop,TS val 4294714811 ecr 4294714780], length 0
11:27:55.203985 IP 10.0.0.2.40848 > vagrant-ubuntu-trusty-64.8882: Flags [P.], seq 2839616293:2839616457, ack 779302498, win 58, options [nop,nop,TS val 4294714800 ecr 4294714770], length 164
11:27:55.204049 IP vagrant-ubuntu-trusty-64.8882 > 10.0.0.2.40848: Flags [.], ack 2839616457, win 275, options [nop,nop,TS val 4294714835 ecr 4294714800], length 0
11:27:55.223008 IP 10.0.0.2.40848 > vagrant-ubuntu-trusty-64.8882: Flags [P.], seq 2839616457:2839616621, ack 779302498, win 58, options [nop,nop,TS val 4294714820 ecr 4294714792], length 164
11:27:55.223101 IP vagrant-ubuntu-trusty-64.8882 > 10.0.0.2.40848: Flags [.], ack 2839616621, win 278, options [nop,nop,TS val 4294714853 ecr 4294714820], length 0
11:27:55.244159 IP 10.0.0.2.40848 > vagrant-ubuntu-trusty-64.8882: Flags [P.], seq 2839616621:2839616785, ack 779302498, win 58, options [nop,nop,TS val 4294714840 ecr 4294714811], length 164
11:27:55.244228 IP vagrant-ubuntu-trusty-64.8882 > 10.0.0.2.40848: Flags [.], ack 2839616785, win 280, options [nop,nop,TS val 4294714874 ecr 4294714840], length 0
11:27:55.262151 IP 10.0.0.2.40848 > vagrant-ubuntu-trusty-64.8882: Flags [P.], seq 2839616785:2839616949, ack 779302498, win 58, options [nop,nop,TS val 4294714860 ecr 4294714835], length 164
11:27:55.262168 IP vagrant-ubuntu-trusty-64.8882 > 10.0.0.2.40848: Flags [.], ack 2839616949, win 283, options [nop,nop,TS val 4294714893 ecr 4294714860], length 0
11:27:55.284003 IP 10.0.0.2.40848 > vagrant-ubuntu-trusty-64.8882: Flags [P.], seq 2839616949:2839617113, ack 779302498, win 58, options [nop,nop,TS val 4294714880 ecr 4294714853], length 164
11:27:55.284057 IP vagrant-ubuntu-trusty-64.8882 > 10.0.0.2.40848: Flags [.], ack 2839617113, win 285, options [nop,nop,TS val 4294714914 ecr 4294714880], length 0
11:27:55.305110 IP 10.0.0.2.40848 > vagrant-ubuntu-trusty-64.8882: Flags [P.], seq 2839617113:2839617277, ack 779302498, win 58, options [nop,nop,TS val 4294714900 ecr 4294714874], length 164
11:27:55.305127 IP vagrant-ubuntu-trusty-64.8882 > 10.0.0.2.40848: Flags [.], ack 2839617277, win 288, options [nop,nop,TS val 4294714936 ecr 4294714900], length 0
11:27:55.324065 IP 10.0.0.2.40848 > vagrant-ubuntu-trusty-64.8882: Flags [P.], seq 2839617277:2839617441, ack 779302498, win 58, options [nop,nop,TS val 4294714920 ecr 4294714893], length 164
11:27:55.324147 IP vagrant-ubuntu-trusty-64.8882 > 10.0.0.2.40848: Flags [.], ack 2839617441, win 290, options [nop,nop,TS val 4294714954 ecr 4294714920], length 0
11:27:55.344899 IP 10.0.0.2.40848 > vagrant-ubuntu-trusty-64.8882: Flags [P.], seq 2839617441:2839617605, ack 779302498, win 58, options [nop,nop,TS val 4294714940 ecr 4294714914], length 164
11:27:55.344930 IP vagrant-ubuntu-trusty-64.8882 > 10.0.0.2.40848: Flags [.], ack 2839617605, win 293, options [nop,nop,TS val 4294714975 ecr 4294714940], length 0
11:27:55.363990 IP 10.0.0.2.40848 > vagrant-ubuntu-trusty-64.8882: Flags [P.], seq 2839617605:2839617769, ack 779302498, win 58, options [nop,nop,TS val 4294714960 ecr 4294714936], length 164
11:27:55.364082 IP vagrant-ubuntu-trusty-64.8882 > 10.0.0.2.40848: Flags [.], ack 2839617769, win 296, options [nop,nop,TS val 4294714994 ecr 4294714960], length 0
11:27:55.385121 IP 10.0.0.2.40848 > vagrant-ubuntu-trusty-64.8882: Flags [P.], seq 2839617769:2839617933, ack 779302498, win 58, options [nop,nop,TS val 4294714981 ecr 4294714954], length 164
11:27:55.385178 IP vagrant-ubuntu-trusty-64.8882 > 10.0.0.2.40848: Flags [.], ack 2839617933, win 298, options [nop,nop,TS val 4294715015 ecr 4294714981], length 0
11:27:55.403115 IP 10.0.0.2.40848 > vagrant-ubuntu-trusty-64.8882: Flags [P.], seq 2839617933:2839618097, ack 779302498, win 58, options [nop,nop,TS val 4294715001 ecr 4294714975], length 164
11:27:55.403148 IP vagrant-ubuntu-trusty-64.8882 > 10.0.0.2.40848: Flags [.], ack 2839618097, win 301, options [nop,nop,TS val 4294715034 ecr 4294715001], length 0
11:27:55.424999 IP 10.0.0.2.40848 > vagrant-ubuntu-trusty-64.8882: Flags [P.], seq 2839618097:2839618261, ack 779302498, win 58, options [nop,nop,TS val 4294715021 ecr 4294714994], length 164
11:27:55.425058 IP vagrant-ubuntu-trusty-64.8882 > 10.0.0.2.40848: Flags [.], ack 2839618261, win 303, options [nop,nop,TS val 4294715055 ecr 4294715021], length 0
11:27:55.442860 IP 10.0.0.2.40848 > vagrant-ubuntu-trusty-64.8882: Flags [P.], seq 2839618261:2839618425, ack 779302498, win 58, options [nop,nop,TS val 4294715040 ecr 4294715015], length 164
11:27:55.442876 IP vagrant-ubuntu-trusty-64.8882 > 10.0.0.2.40848: Flags [.], ack 2839618425, win 306, options [nop,nop,TS val 4294715073 ecr 4294715040], length 0
11:27:55.464408 IP 10.0.0.2.40848 > vagrant-ubuntu-trusty-64.8882: Flags [P.], seq 2839618425:2839618589, ack 779302498, win 58, options [nop,nop,TS val 4294715060 ecr 4294715034], length 164
11:27:55.464440 IP vagrant-ubuntu-trusty-64.8882 > 10.0.0.2.40848: Flags [.], ack 2839618589, win 308, options [nop,nop,TS val 4294715095 ecr 4294715060], length 0
11:27:55.486133 IP 10.0.0.2.40848 > vagrant-ubuntu-trusty-64.8882: Flags [P.], seq 2839618589:2839618753, ack 779302498, win 58, options [nop,nop,TS val 4294715081 ecr 4294715055], length 164
11:27:55.486191 IP vagrant-ubuntu-trusty-64.8882 > 10.0.0.2.40848: Flags [.], ack 2839618753, win 311, options [nop,nop,TS val 4294715116 ecr 4294715081], length 0
11:27:55.504149 IP 10.0.0.2.40848 > vagrant-ubuntu-trusty-64.8882: Flags [P.], seq 2839618753:2839618917, ack 779302498, win 58, options [nop,nop,TS val 4294715100 ecr 4294715073], length 164
11:27:55.504167 IP vagrant-ubuntu-trusty-64.8882 > 10.0.0.2.40848: Flags [.], ack 2839618917, win 313, options [nop,nop,TS val 4294715135 ecr 4294715100], length 0
11:27:55.523109 IP 10.0.0.2.40848 > vagrant-ubuntu-trusty-64.8882: Flags [P.], seq 2839618917:2839619081, ack 779302498, win 58, options [nop,nop,TS val 4294715120 ecr 4294715095], length 164
11:27:55.523172 IP vagrant-ubuntu-trusty-64.8882 > 10.0.0.2.40848: Flags [.], ack 2839619081, win 316, options [nop,nop,TS val 4294715153 ecr 4294715120], length 0
11:27:55.547362 IP 10.0.0.2.40848 > vagrant-ubuntu-trusty-64.8882: Flags [P.], seq 2839619081:2839619245, ack 779302498, win 58, options [nop,nop,TS val 4294715140 ecr 4294715116], length 164
11:27:55.547432 IP vagrant-ubuntu-trusty-64.8882 > 10.0.0.2.40848: Flags [.], ack 2839619245, win 319, options [nop,nop,TS val 4294715178 ecr 4294715140], length 0
11:27:55.566264 IP 10.0.0.2.40848 > vagrant-ubuntu-trusty-64.8882: Flags [P.], seq 2839619245:2839619409, ack 779302498, win 58, options [nop,nop,TS val 4294715160 ecr 4294715135], length 164
11:27:55.566314 IP vagrant-ubuntu-trusty-64.8882 > 10.0.0.2.40848: Flags [.], ack 2839619409, win 321, options [nop,nop,TS val 4294715197 ecr 4294715160], length 0
11:27:55.586911 IP 10.0.0.2.40848 > vagrant-ubuntu-trusty-64.8882: Flags [P.], seq 2839619409:2839619573, ack 779302498, win 58, options [nop,nop,TS val 4294715180 ecr 4294715153], length 164
11:27:55.586942 IP vagrant-ubuntu-trusty-64.8882 > 10.0.0.2.40848: Flags [.], ack 2839619573, win 324, options [nop,nop,TS val 4294715217 ecr 4294715180], length 0
11:27:55.605260 IP 10.0.0.2.40848 > vagrant-ubuntu-trusty-64.8882: Flags [P.], seq 2839619573:2839619737, ack 779302498, win 58, options [nop,nop,TS val 4294715200 ecr 4294715178], length 164
11:27:55.605277 IP vagrant-ubuntu-trusty-64.8882 > 10.0.0.2.40848: Flags [.], ack 2839619737, win 326, options [nop,nop,TS val 4294715236 ecr 4294715200], length 0
11:27:55.627059 IP 10.0.0.2.40848 > vagrant-ubuntu-trusty-64.8882: Flags [P.], seq 2839619737:2839619901, ack 779302498, win 58, options [nop,nop,TS val 4294715220 ecr 4294715197], length 164
11:27:55.627079 IP vagrant-ubuntu-trusty-64.8882 > 10.0.0.2.40848: Flags [.], ack 2839619901, win 329, options [nop,nop,TS val 4294715258 ecr 4294715220], length 0
11:27:55.645142 IP 10.0.0.2.40848 > vagrant-ubuntu-trusty-64.8882: Flags [P.], seq 2839619901:2839620065, ack 779302498, win 58, options [nop,nop,TS val 4294715240 ecr 4294715217], length 164
11:27:55.645173 IP vagrant-ubuntu-trusty-64.8882 > 10.0.0.2.40848: Flags [.], ack 2839620065, win 331, options [nop,nop,TS val 4294715276 ecr 4294715240], length 0
11:27:55.667352 IP 10.0.0.2.40848 > vagrant-ubuntu-trusty-64.8882: Flags [P.], seq 2839620065:2839620229, ack 779302498, win 58, options [nop,nop,TS val 4294715260 ecr 4294715236], length 164
11:27:55.667412 IP vagrant-ubuntu-trusty-64.8882 > 10.0.0.2.40848: Flags [.], ack 2839620229, win 334, options [nop,nop,TS val 4294715298 ecr 4294715260], length 0
11:27:55.687902 IP 10.0.0.2.40848 > vagrant-ubuntu-trusty-64.8882: Flags [P.], seq 2839620229:2839620393, ack 779302498, win 58, options [nop,nop,TS val 4294715280 ecr 4294715258], length 164
11:27:55.687919 IP vagrant-ubuntu-trusty-64.8882 > 10.0.0.2.40848: Flags [.], ack 2839620393, win 337, options [nop,nop,TS val 4294715318 ecr 4294715280], length 0
11:27:55.707162 IP 10.0.0.2.40848 > vagrant-ubuntu-trusty-64.8882: Flags [P.], seq 2839620393:2839620557, ack 779302498, win 58, options [nop,nop,TS val 4294715300 ecr 4294715276], length 164
11:27:55.707253 IP vagrant-ubuntu-trusty-64.8882 > 10.0.0.2.40848: Flags [.], ack 2839620557, win 339, options [nop,nop,TS val 4294715337 ecr 4294715300], length 0
11:27:55.728197 IP 10.0.0.2.40848 > vagrant-ubuntu-trusty-64.8882: Flags [P.], seq 2839620557:2839620721, ack 779302498, win 58, options [nop,nop,TS val 4294715321 ecr 4294715298], length 164
