11:32:01.127271 IP 10.0.0.1.8882 > vagrant-ubuntu-trusty-64.48182: Flags [.], ack 13616101, win 63, options [nop,nop,TS val 4294713776 ecr 4294713766], length 0
11:32:01.127539 IP vagrant-ubuntu-trusty-64.48182 > 10.0.0.1.8882: Flags [P.], seq 13616101:13616265, ack 2937995557, win 58, options [nop,nop,TS val 4294713787 ecr 4294713757], length 164
11:32:01.146332 IP vagrant-ubuntu-trusty-64.48182 > 10.0.0.1.8882: Flags [P.], seq 13616265:13616429, ack 2937995557, win 58, options [nop,nop,TS val 4294713806 ecr 4294713776], length 164
11:32:01.149337 IP 10.0.0.1.8882 > vagrant-ubuntu-trusty-64.48182: Flags [.], ack 13616265, win 65, options [nop,nop,TS val 4294713798 ecr 4294713787], length 0
11:32:01.166374 IP vagrant-ubuntu-trusty-64.48182 > 10.0.0.1.8882: Flags [P.], seq 13616429:13616593, ack 2937995557, win 58, options [nop,nop,TS val 4294713826 ecr 4294713798], length 164
11:32:01.167430 IP 10.0.0.1.8882 > vagrant-ubuntu-trusty-64.48182: Flags [.], ack 13616429, win 68, options [nop,nop,TS val 4294713816 ecr 4294713806], length 0
11:32:01.186447 IP vagrant-ubuntu-trusty-64.48182 > 10.0.0.1.8882: Flags [P.], seq 13616593:13616757, ack 2937995557, win 58, options [nop,nop,TS val 4294713846 ecr 4294713816], length 164
11:32:01.186649 IP 10.0.0.1.8882 > vagrant-ubuntu-trusty-64.48182: Flags [.], ack 13616593, win 70, options [nop,nop,TS val 4294713836 ecr 4294713826], length 0
11:32:01.206339 IP vagrant-ubuntu-trusty-64.48182 > 10.0.0.1.8882: Flags [P.], seq 13616757:13616921, ack 2937995557, win 58, options [nop,nop,TS val 4294713866 ecr 4294713836], length 164
11:32:01.208056 IP 10.0.0.1.8882 > vagrant-ubuntu-trusty-64.48182: Flags [.], ack 13616757, win 72, options [nop,nop,TS val 4294713856 ecr 4294713846], length 0
11:32:01.226442 IP vagrant-ubuntu-trusty-64.48182 > 10.0.0.1.8882: Flags [P.], seq 13616921:13617085, ack 2937995557, win 58, options [nop,nop,TS val 4294713886 ecr 4294713856], length 164
11:32:01.228064 IP 10.0.0.1.8882 > vagrant-ubuntu-trusty-64.48182: Flags [.], ack 13616921, win 74, options [nop,nop,TS val 4294713876 ecr 4294713866], length 0
11:32:01.246706 IP vagrant-ubuntu-trusty-64.48182 > 10.0.0.1.8882: Flags [P.], seq 13617085:13617249, ack 2937995557, win 58, options [nop,nop,TS val 4294713906 ecr 4294713876], length 164
11:32:01.246763 IP 10.0.0.1.8882 > vagrant-ubuntu-trusty-64.48182: Flags [.], ack 13617085, win 76, options [nop,nop,TS val 4294713896 ecr 4294713886], length 0
11:32:01.266708 IP vagrant-ubuntu-trusty-64.48182 > 10.0.0.1.8882: Flags [P.], seq 13617249:13617413, ack 2937995557, win 58, options [nop,nop,TS val 4294713926 ecr 4294713896], length 164
11:32:01.267969 IP 10.0.0.1.8882 > vagrant-ubuntu-trusty-64.48182: Flags [.], ack 13617249, win 78, options [nop,nop,TS val 4294713916 ecr 4294713906], length 0
11:32:01.286720 IP vagrant-ubuntu-trusty-64.48182 > 10.0.0.1.8882: Flags [P.], seq 13617413:13617577, ack 2937995557, win 58, options [nop,nop,TS val 4294713946 ecr 4294713916], length 164
11:32:01.286940 IP 10.0.0.1.8882 > vagrant-ubuntu-trusty-64.48182: Flags [.], ack 13617413, win 80, options [nop,nop,TS val 4294713936 ecr 4294713926], length 0
11:32:01.308124 IP vagrant-ubuntu-trusty-64.48182 > 10.0.0.1.8882: Flags [P.], seq 13617577:13617741, ack 2937995557, win 58, options [nop,nop,TS val 4294713967 ecr 4294713936], length 164
11:32:01.310710 IP 10.0.0.1.8882 > vagrant-ubuntu-trusty-64.48182: Flags [.], ack 13617577, win 82, options [nop,nop,TS val 4294713960 ecr 4294713946], length 0
11:32:01.326339 IP vagrant-ubuntu-trusty-64.48182 > 10.0.0.1.8882: Flags [P.], seq 13617741:13617905, ack 2937995557, win 58, options [nop,nop,TS val 4294713986 ecr 4294713960], length 164
11:32:01.346454 IP vagrant-ubuntu-trusty-64.48182 > 10.0.0.1.8882: Flags [P.], seq 13617905:13618069, ack 2937995557, win 58, options [nop,nop,TS val 4294714006 ecr 4294713960], length 164
11:32:01.347586 IP 10.0.0.1.8882 > vagrant-ubuntu-trusty-64.48182: Flags [.], ack 13617741, win 84, options [nop,nop,TS val 4294713995 ecr 4294713967], length 0
11:32:01.366356 IP vagrant-ubuntu-trusty-64.48182 > 10.0.0.1.8882: Flags [P.], seq 13618069:13618233, ack 2937995557, win 58, options [nop,nop,TS val 4294714026 ecr 4294713995], length 164
11:32:01.367953 IP 10.0.0.1.8882 > vagrant-ubuntu-trusty-64.48182: Flags [.], ack 13617905, win 86, options [nop,nop,TS val 4294714017 ecr 4294713986], length 0
11:32:01.386901 IP vagrant-ubuntu-trusty-64.48182 > 10.0.0.1.8882: Flags [P.], seq 13618233:13618397, ack 2937995557, win 58, options [nop,nop,TS val 4294714046 ecr 4294714017], length 164
11:32:01.395580 IP 10.0.0.1.8882 > vagrant-ubuntu-trusty-64.48182: Flags [.], ack 13618069, win 88, options [nop,nop,TS val 4294714044 ecr 4294714006], length 0
11:32:01.406333 IP vagrant-ubuntu-trusty-64.48182 > 10.0.0.1.8882: Flags [P.], seq 13618397:13618561, ack 2937995557, win 58, options [nop,nop,TS val 4294714066 ecr 4294714044], length 164
11:32:01.426324 IP vagrant-ubuntu-trusty-64.48182 > 10.0.0.1.8882: Flags [P.], seq 13618561:13618725, ack 2937995557, win 58, options [nop,nop,TS val 4294714086 ecr 4294714044], length 164
11:32:01.434575 IP 10.0.0.1.8882 > vagrant-ubuntu-trusty-64.48182: Flags [.], ack 13618069, win 91, options [nop,nop,TS val 4294714084 ecr 4294714006,nop,nop,sack 1 {13618233:13618397}], length 0
11:32:01.443959 IP 10.0.0.1.8882 > vagrant-ubuntu-trusty-64.48182: Flags [.], ack 13618069, win 93, options [nop,nop,TS val 4294714093 ecr 4294714006,nop,nop,sack 1 {13618233:13618561}], length 0
11:32:01.447106 IP vagrant-ubuntu-trusty-64.48182 > 10.0.0.1.8882: Flags [P.], seq 13618725:13618889, ack 2937995557, win 58, options [nop,nop,TS val 4294714106 ecr 4294714093], length 164
11:32:01.457021 IP 10.0.0.1.8882 > vagrant-ubuntu-trusty-64.48182: Flags [.], ack 13618069, win 95, options [nop,nop,TS val 4294714106 ecr 4294714006,nop,nop,sack 1 {13618233:13618725}], length 0
11:32:01.457084 IP vagrant-ubuntu-trusty-64.48182 > 10.0.0.1.8882: Flags [P.], seq 13618069:13618233, ack 2937995557, win 58, options [nop,nop,TS val 4294714116 ecr 4294714106], length 164
11:32:01.467315 IP vagrant-ubuntu-trusty-64.48182 > 10.0.0.1.8882: Flags [P.], seq 13618889:13619053, ack 2937995557, win 58, options [nop,nop,TS val 4294714127 ecr 4294714106], length 164
11:32:01.477218 IP 10.0.0.1.8882 > vagrant-ubuntu-trusty-64.48182: Flags [.], ack 13618069, win 97, options [nop,nop,TS val 4294714127 ecr 4294714006,nop,nop,sack 1 {13618233:13618889}], length 0
11:32:01.486907 IP 10.0.0.1.8882 > vagrant-ubuntu-trusty-64.48182: Flags [.], ack 13618889, win 99, options [nop,nop,TS val 4294714136 ecr 4294714116], length 0
11:32:01.486984 IP vagrant-ubuntu-trusty-64.48182 > 10.0.0.1.8882: Flags [P.], seq 13619053:13619217, ack 2937995557, win 58, options [nop,nop,TS val 4294714146 ecr 4294714136], length 164
11:32:01.506459 IP vagrant-ubuntu-trusty-64.48182 > 10.0.0.1.8882: Flags [P.], seq 13619217:13619381, ack 2937995557, win 58, options [nop,nop,TS val 4294714166 ecr 4294714136], length 164
11:32:01.526467 IP vagrant-ubuntu-trusty-64.48182 > 10.0.0.1.8882: Flags [P.], seq 13619381:13619545, ack 2937995557, win 58, options [nop,nop,TS val 4294714186 ecr 4294714136], length 164
11:32:01.532825 IP 10.0.0.1.8882 > vagrant-ubuntu-trusty-64.48182: Flags [.], ack 13618889, win 101, options [nop,nop,TS val 4294714180 ecr 4294714116,nop,nop,sack 1 {13619053:13619217}], length 0
11:32:01.545801 IP 10.0.0.1.8882 > vagrant-ubuntu-trusty-64.48182: Flags [.], ack 13618889, win 103, options [nop,nop,TS val 4294714194 ecr 4294714116,nop,nop,sack 1 {13619053:13619381}], length 0
11:32:01.546318 IP vagrant-ubuntu-trusty-64.48182 > 10.0.0.1.8882: Flags [P.], seq 13619545:13619709, ack 2937995557, win 58, options [nop,nop,TS val 4294714206 ecr 4294714194], length 164
11:32:01.566310 IP vagrant-ubuntu-trusty-64.48182 > 10.0.0.1.8882: Flags [P.], seq 13619709:13619873, ack 2937995557, win 58, options [nop,nop,TS val 4294714226 ecr 4294714194], length 164
11:32:01.573780 IP 10.0.0.1.8882 > vagrant-ubuntu-trusty-64.48182: Flags [.], ack 13618889, win 105, options [nop,nop,TS val 4294714222 ecr 4294714116,nop,nop,sack 2 {13619545:13619709}{13619053:13619381}], length 0
11:32:01.573918 IP vagrant-ubuntu-trusty-64.48182 > 10.0.0.1.8882: Flags [P.], seq 13618889:13619053, ack 2937995557, win 58, options [nop,nop,TS val 4294714233 ecr 4294714222], length 164
11:32:01.573974 IP vagrant-ubuntu-trusty-64.48182 > 10.0.0.1.8882: Flags [P.], seq 13619381:13619545, ack 2937995557, win 58, options [nop,nop,TS val 4294714233 ecr 4294714222], length 164
11:32:01.592258 IP 10.0.0.1.8882 > vagrant-ubuntu-trusty-64.48182: Flags [.], ack 13618889, win 107, options [nop,nop,TS val 4294714242 ecr 4294714116,nop,nop,sack 2 {13619545:13619873}{13619053:13619381}], length 0
11:32:01.592335 IP vagrant-ubuntu-trusty-64.48182 > 10.0.0.1.8882: Flags [P.], seq 13619873:13620037, ack 2937995557, win 58, options [nop,nop,TS val 4294714252 ecr 4294714242], length 164
11:32:01.594785 IP 10.0.0.1.8882 > vagrant-ubuntu-trusty-64.48182: Flags [.], ack 13619381, win 109, options [nop,nop,TS val 4294714244 ecr 4294714233,nop,nop,sack 1 {13619545:13619873}], length 0
11:32:01.594955 IP 10.0.0.1.8882 > vagrant-ubuntu-trusty-64.48182: Flags [.], ack 13619873, win 111, options [nop,nop,TS val 4294714244 ecr 4294714233], length 0
11:32:01.606336 IP vagrant-ubuntu-trusty-64.48182 > 10.0.0.1.8882: Flags [P.], seq 13620037:13620201, ack 2937995557, win 58, options [nop,nop,TS val 4294714266 ecr 4294714244], length 164
11:32:01.626833 IP vagrant-ubuntu-trusty-64.48182 > 10.0.0.1.8882: Flags [P.], seq 13620201:13620365, ack 2937995557, win 58, options [nop,nop,TS val 4294714286 ecr 4294714244], length 164
11:32:01.630049 IP 10.0.0.1.8882 > vagrant-ubuntu-trusty-64.48182: Flags [.], ack 13620037, win 114, options [nop,nop,TS val 4294714278 ecr 4294714252], length 0
11:32:01.642790 IP 10.0.0.1.8882 > vagrant-ubuntu-trusty-64.48182: Flags [.], ack 13620201, win 116, options [nop,nop,TS val 4294714291 ecr 4294714266], length 0
11:32:01.646822 IP vagrant-ubuntu-trusty-64.48182 > 10.0.0.1.8882: Flags [P.], seq 13620365:13620529, ack 2937995557, win 58, options [nop,nop,TS val 4294714306 ecr 4294714291], length 164
11:32:01.657641 IP 10.0.0.1.8882 > vagrant-ubuntu-trusty-64.48182: Flags [.], ack 13620365, win 118, options [nop,nop,TS val 4294714307 ecr 4294714286], length 0
11:32:01.666404 IP vagrant-ubuntu-trusty-64.48182 > 10.0.0.1.8882: Flags [P.], seq 13620529:13620693, ack 2937995557, win 58, options [nop,nop,TS val 4294714326 ecr 4294714307], length 164
11:32:01.676083 IP 10.0.0.1.8882 > vagrant-ubuntu-trusty-64.48182: Flags [.], ack 13620529, win 120, options [nop,nop,TS val 4294714325 ecr 4294714306], length 0
11:32:01.686309 IP vagrant-ubuntu-trusty-64.48182 > 10.0.0.1.8882: Flags [P.], seq 13620693:13620857, ack 2937995557, win 58, options [nop,nop,TS val 4294714346 ecr 4294714325], length 164
11:32:01.695902 IP 10.0.0.1.8882 > vagrant-ubuntu-trusty-64.48182: Flags [.], ack 13620693, win 122, options [nop,nop,TS val 4294714344 ecr 4294714326], length 0
11:32:01.707116 IP vagrant-ubuntu-trusty-64.48182 > 10.0.0.1.8882: Flags [P.], seq 13620857:13621021, ack 2937995557, win 58, options [nop,nop,TS val 4294714367 ecr 4294714344], length 164
11:32:01.714632 IP 10.0.0.1.8882 > vagrant-ubuntu-trusty-64.48182: Flags [.], ack 13620857, win 124, options [nop,nop,TS val 4294714363 ecr 4294714346], length 0
11:32:01.726325 IP vagrant-ubuntu-trusty-64.48182 > 10.0.0.1.8882: Flags [P.], seq 13621021:13621185, ack 2937995557, win 58, options [nop,nop,TS val 4294714386 ecr 4294714363], length 164
11:32:01.729988 IP 10.0.0.1.8882 > vagrant-ubuntu-trusty-64.48182: Flags [.], ack 13621021, win 126, options [nop,nop,TS val 4294714379 ecr 4294714367], length 0
11:32:01.747184 IP vagrant-ubuntu-trusty-64.48182 > 10.0.0.1.8882: Flags [P.], seq 13621185:13621349, ack 2937995557, win 58, options [nop,nop,TS val 4294714407 ecr 4294714379], length 164
11:32:01.750687 IP 10.0.0.1.8882 > vagrant-ubuntu-trusty-64.48182: Flags [.], ack 13621185, win 128, options [nop,nop,TS val 4294714399 ecr 4294714386], length 0
11:32:01.767048 IP vagrant-ubuntu-trusty-64.48182 > 10.0.0.1.8882: Flags [P.], seq 13621349:13621513, ack 2937995557, win 58, options [nop,nop,TS val 4294714426 ecr 4294714399], length 164
11:32:01.776062 IP 10.0.0.1.8882 > vagrant-ubuntu-trusty-64.48182: Flags [.], ack 13621349, win 130, options [nop,nop,TS val 4294714424 ecr 4294714407], length 0
11:32:01.787153 IP vagrant-ubuntu-trusty-64.48182 > 10.0.0.1.8882: Flags [P.], seq 13621513:13621677, ack 2937995557, win 58, options [nop,nop,TS val 4294714447 ecr 4294714424], length 164
11:32:01.793168 IP 10.0.0.1.8882 > vagrant-ubuntu-trusty-64.48182: Flags [.], ack 13621513, win 132, options [nop,nop,TS val 4294714442 ecr 4294714426], length 0
11:32:01.807067 IP vagrant-ubuntu-trusty-64.48182 > 10.0.0.1.8882: Flags [P.], seq 13621677:13621841, ack 2937995557, win 58, options [nop,nop,TS val 4294714466 ecr 4294714442], length 164
11:32:01.815845 IP 10.0.0.1.8882 > vagrant-ubuntu-trusty-64.48182: Flags [.], ack 13621677, win 135, options [nop,nop,TS val 4294714464 ecr 4294714447], length 0
11:32:01.826330 IP vagrant-ubuntu-trusty-64.48182 > 10.0.0.1.8882: Flags [P.], seq 13621841:13622005, ack 2937995557, win 58, options [nop,nop,TS val 4294714486 ecr 4294714464], length 164
11:32:01.833807 IP 10.0.0.1.8882 > vagrant-ubuntu-trusty-64.48182: Flags [.], ack 13621841, win 137, options [nop,nop,TS val 4294714482 ecr 4294714466], length 0
11:32:01.846885 IP vagrant-ubuntu-trusty-64.48182 > 10.0.0.1.8882: Flags [P.], seq 13622005:13622169, ack 2937995557, win 58, options [nop,nop,TS val 4294714506 ecr 4294714482], length 164
11:32:01.851002 IP 10.0.0.1.8882 > vagrant-ubuntu-trusty-64.48182: Flags [.], ack 13622005, win 139, options [nop,nop,TS val 4294714500 ecr 4294714486], length 0
11:32:01.866886 IP vagrant-ubuntu-trusty-64.48182 > 10.0.0.1.8882: Flags [P.], seq 13622169:13622333, ack 2937995557, win 58, options [nop,nop,TS val 4294714526 ecr 4294714500], length 164
11:32:01.873628 IP 10.0.0.1.8882 > vagrant-ubuntu-trusty-64.48182: Flags [.], ack 13622169, win 141, options [nop,nop,TS val 4294714522 ecr 4294714506], length 0
11:32:01.886941 IP vagrant-ubuntu-trusty-64.48182 > 10.0.0.1.8882: Flags [P.], seq 13622333:13622497, ack 2937995557, win 58, options [nop,nop,TS val 4294714546 ecr 4294714522], length 164
11:32:01.890819 IP 10.0.0.1.8882 > vagrant-ubuntu-trusty-64.48182: Flags [.], ack 13622333, win 143, options [nop,nop,TS val 4294714540 ecr 4294714526], length 0
11:32:01.906321 IP vagrant-ubuntu-trusty-64.48182 > 10.0.0.1.8882: Flags [P.], seq 13622497:13622661, ack 2937995557, win 58, options [nop,nop,TS val 4294714566 ecr 4294714540], length 164
11:32:01.913746 IP 10.0.0.1.8882 > vagrant-ubuntu-trusty-64.48182: Flags [.], ack 13622497, win 145, options [nop,nop,TS val 4294714562 ecr 4294714546], length 0
11:32:01.927112 IP vagrant-ubuntu-trusty-64.48182 > 10.0.0.1.8882: Flags [P.], seq 13622661:13622825, ack 2937995557, win 58, options [nop,nop,TS val 4294714586 ecr 4294714562], length 164
11:32:01.931878 IP 10.0.0.1.8882 > vagrant-ubuntu-trusty-64.48182: Flags [.], ack 13622661, win 147, options [nop,nop,TS val 4294714580 ecr 4294714566], length 0
11:32:01.946332 IP vagrant-ubuntu-trusty-64.48182 > 10.0.0.1.8882: Flags [P.], seq 13622825:13622989, ack 2937995557, win 58, options [nop,nop,TS val 4294714606 ecr 4294714580], length 164
11:32:01.952127 IP 10.0.0.1.8882 > vagrant-ubuntu-trusty-64.48182: Flags [.], ack 13622825, win 149, options [nop,nop,TS val 4294714601 ecr 4294714586], length 0
11:32:01.967163 IP vagrant-ubuntu-trusty-64.48182 > 10.0.0.1.8882: Flags [P.], seq 13622989:13623153, ack 2937995557, win 58, options [nop,nop,TS val 4294714627 ecr 4294714601], length 164
11:32:01.973944 IP 10.0.0.1.8882 > vagrant-ubuntu-trusty-64.48182: Flags [.], ack 13622989, win 151, options [nop,nop,TS val 4294714623 ecr 4294714606], length 0
11:32:01.986312 IP vagrant-ubuntu-trusty-64.48182 > 10.0.0.1.8882: Flags [P.], seq 13623153:13623317, ack 2937995557, win 58, options [nop,nop,TS val 4294714646 ecr 4294714623], length 164
11:32:01.992121 IP 10.0.0.1.8882 > vagrant-ubuntu-trusty-64.48182: Flags [.], ack 13623153, win 153, options [nop,nop,TS val 4294714641 ecr 4294714627], length 0
11:32:02.007147 IP vagrant-ubuntu-trusty-64.48182 > 10.0.0.1.8882: Flags [P.], seq 13623317:13623481, ack 2937995557, win 58, options [nop,nop,TS val 4294714667 ecr 4294714641], length 164
11:32:02.014756 IP 10.0.0.1.8882 > vagrant-ubuntu-trusty-64.48182: Flags [.], ack 13623317, win 155, options [nop,nop,TS val 4294714663 ecr 4294714646], length 0
11:32:02.027155 IP vagrant-ubuntu-trusty-64.48182 > 10.0.0.1.8882: Flags [P.], seq 13623481:13623645, ack 2937995557, win 58, options [nop,nop,TS val 4294714687 ecr 4294714663], length 164
11:32:02.032856 IP 10.0.0.1.8882 > vagrant-ubuntu-trusty-64.48182: Flags [.], ack 13623481, win 158, options [nop,nop,TS val 4294714681 ecr 4294714667], length 0
11:32:02.047236 IP vagrant-ubuntu-trusty-64.48182 > 10.0.0.1.8882: Flags [P.], seq 13623645:13623809, ack 2937995557, win 58, options [nop,nop,TS val 4294714707 ecr 4294714681], length 164
11:32:02.057951 IP 10.0.0.1.8882 > vagrant-ubuntu-trusty-64.48182: Flags [.], ack 13623645, win 160, options [nop,nop,TS val 4294714707 ecr 4294714687], length 0
11:32:02.066383 IP vagrant-ubuntu-trusty-64.48182 > 10.0.0.1.8882: Flags [P.], seq 13623809:13623973, ack 2937995557, win 58, options [nop,nop,TS val 4294714726 ecr 4294714707], length 164
11:32:02.077933 IP 10.0.0.1.8882 > vagrant-ubuntu-trusty-64.48182: Flags [.], ack 13623809, win 162, options [nop,nop,TS val 4294714727 ecr 4294714707], length 0
11:32:02.086311 IP vagrant-ubuntu-trusty-64.48182 > 10.0.0.1.8882: Flags [P.], seq 13623973:13624137, ack 2937995557, win 58, options [nop,nop,TS val 4294714746 ecr 4294714727], length 164
11:32:02.096226 IP 10.0.0.1.8882 > vagrant-ubuntu-trusty-64.48182: Flags [.], ack 13623973, win 164, options [nop,nop,TS val 4294714745 ecr 4294714726], length 0
11:32:02.107140 IP vagrant-ubuntu-trusty-64.48182 > 10.0.0.1.8882: Flags [P.], seq 13624137:13624301, ack 2937995557, win 58, options [nop,nop,TS val 4294714767 ecr 4294714745], length 164
11:32:02.115574 IP 10.0.0.1.8882 > vagrant-ubuntu-trusty-64.48182: Flags [.], ack 13624137, win 166, options [nop,nop,TS val 4294714764 ecr 4294714746], length 0
11:32:02.126306 IP vagrant-ubuntu-trusty-64.48182 > 10.0.0.1.8882: Flags [P.], seq 13624301:13624465, ack 2937995557, win 58, options [nop,nop,TS val 4294714786 ecr 4294714764], length 164
11:32:02.136101 IP 10.0.0.1.8882 > vagrant-ubuntu-trusty-64.48182: Flags [.], ack 13624301, win 168, options [nop,nop,TS val 4294714785 ecr 4294714767], length 0
11:32:02.146364 IP vagrant-ubuntu-trusty-64.48182 > 10.0.0.1.8882: Flags [P.], seq 13624465:13624629, ack 2937995557, win 58, options [nop,nop,TS val 4294714806 ecr 4294714785], length 164
11:32:02.155990 IP 10.0.0.1.8882 > vagrant-ubuntu-trusty-64.48182: Flags [.], ack 13624465, win 170, options [nop,nop,TS val 4294714804 ecr 4294714786], length 0
11:32:02.166313 IP vagrant-ubuntu-trusty-64.48182 > 10.0.0.1.8882: Flags [P.], seq 13624629:13624793, ack 2937995557, win 58, options [nop,nop,TS val 4294714826 ecr 4294714804], length 164
11:32:02.175935 IP 10.0.0.1.8882 > vagrant-ubuntu-trusty-64.48182: Flags [.], ack 13624629, win 172, options [nop,nop,TS val 4294714825 ecr 4294714806], length 0
11:32:02.186972 IP vagrant-ubuntu-trusty-64.48182 > 10.0.0.1.8882: Flags [P.], seq 13624793:13624957, ack 2937995557, win 58, options [nop,nop,TS val 4294714846 ecr 4294714825], length 164
11:32:02.194321 IP 10.0.0.1.8882 > vagrant-ubuntu-trusty-64.48182: Flags [.], ack 13624793, win 174, options [nop,nop,TS val 4294714844 ecr 4294714826], length 0
11:32:02.206362 IP vagrant-ubuntu-trusty-64.48182 > 10.0.0.1.8882: Flags [P.], seq 13624957:13625121, ack 2937995557, win 58, options [nop,nop,TS val 4294714866 ecr 4294714844], length 164
11:32:02.213235 IP 10.0.0.1.8882 > vagrant-ubuntu-trusty-64.48182: Flags [.], ack 13624957, win 176, options [nop,nop,TS val 4294714862 ecr 4294714846], length 0
11:32:02.226366 IP vagrant-ubuntu-trusty-64.48182 > 10.0.0.1.8882: Flags [P.], seq 13625121:13625285, ack 2937995557, win 58, options [nop,nop,TS val 4294714886 ecr 4294714862], length 164
11:32:02.234114 IP 10.0.0.1.8882 > vagrant-ubuntu-trusty-64.48182: Flags [.], ack 13625121, win 178, options [nop,nop,TS val 4294714883 ecr 4294714866], length 0
11:32:02.246348 IP vagrant-ubuntu-trusty-64.48182 > 10.0.0.1.8882: Flags [P.], seq 13625285:13625449, ack 2937995557, win 58, options [nop,nop,TS val 4294714906 ecr 4294714883], length 164
11:32:02.259331 IP 10.0.0.1.8882 > vagrant-ubuntu-trusty-64.48182: Flags [.], ack 13625285, win 181, options [nop,nop,TS val 4294714909 ecr 4294714886], length 0
11:32:02.267476 IP vagrant-ubuntu-trusty-64.48182 > 10.0.0.1.8882: Flags [P.], seq 13625449:13625613, ack 2937995557, win 58, options [nop,nop,TS val 4294714927 ecr 4294714909], length 164
11:32:02.278094 IP 10.0.0.1.8882 > vagrant-ubuntu-trusty-64.48182: Flags [.], ack 13625449, win 183, options [nop,nop,TS val 4294714927 ecr 4294714906], length 0
11:32:02.286806 IP vagrant-ubuntu-trusty-64.48182 > 10.0.0.1.8882: Flags [P.], seq 13625613:13625777, ack 2937995557, win 58, options [nop,nop,TS val 4294714946 ecr 4294714927], length 164
11:32:02.298531 IP 10.0.0.1.8882 > vagrant-ubuntu-trusty-64.48182: Flags [.], ack 13625613, win 185, options [nop,nop,TS val 4294714948 ecr 4294714927], length 0
11:32:02.306543 IP vagrant-ubuntu-trusty-64.48182 > 10.0.0.1.8882: Flags [P.], seq 13625777:13625941, ack 2937995557, win 58, options [nop,nop,TS val 4294714966 ecr 4294714948], length 164
11:32:02.320249 IP 10.0.0.1.8882 > vagrant-ubuntu-trusty-64.48182: Flags [.], ack 13625777, win 187, options [nop,nop,TS val 4294714969 ecr 4294714946], length 0
11:32:02.326396 IP vagrant-ubuntu-trusty-64.48182 > 10.0.0.1.8882: Flags [P.], seq 13625941:13626105, ack 2937995557, win 58, options [nop,nop,TS val 4294714986 ecr 4294714969], length 164
11:32:02.338176 IP 10.0.0.1.8882 > vagrant-ubuntu-trusty-64.48182: Flags [.], ack 13625941, win 189, options [nop,nop,TS val 4294714987 ecr 4294714966], length 0
11:32:02.347425 IP vagrant-ubuntu-trusty-64.48182 > 10.0.0.1.8882: Flags [P.], seq 13626105:13626269, ack 2937995557, win 58, options [nop,nop,TS val 4294715007 ecr 4294714987], length 164
11:32:02.360945 IP 10.0.0.1.8882 > vagrant-ubuntu-trusty-64.48182: Flags [.], ack 13626105, win 191, options [nop,nop,TS val 4294715009 ecr 4294714986], length 0
11:32:02.367174 IP vagrant-ubuntu-trusty-64.48182 > 10.0.0.1.8882: Flags [P.], seq 13626269:13626433, ack 2937995557, win 58, options [nop,nop,TS val 4294715027 ecr 4294715009], length 164
11:32:02.378190 IP 10.0.0.1.8882 > vagrant-ubuntu-trusty-64.48182: Flags [.], ack 13626269, win 193, options [nop,nop,TS val 4294715027 ecr 4294715007], length 0
11:32:02.387421 IP vagrant-ubuntu-trusty-64.48182 > 10.0.0.1.8882: Flags [P.], seq 13626433:13626597, ack 2937995557, win 58, options [nop,nop,TS val 4294715047 ecr 4294715027], length 164
11:32:02.401079 IP 10.0.0.1.8882 > vagrant-ubuntu-trusty-64.48182: Flags [.], ack 13626433, win 195, options [nop,nop,TS val 4294715049 ecr 4294715027], length 0
11:32:02.406697 IP vagrant-ubuntu-trusty-64.48182 > 10.0.0.1.8882: Flags [P.], seq 13626597:13626761, ack 2937995557, win 58, options [nop,nop,TS val 4294715066 ecr 4294715049], length 164
11:32:02.417980 IP 10.0.0.1.8882 > vagrant-ubuntu-trusty-64.48182: Flags [.], ack 13626597, win 197, options [nop,nop,TS val 4294715067 ecr 4294715047], length 0
11:32:02.427588 IP vagrant-ubuntu-trusty-64.48182 > 10.0.0.1.8882: Flags [P.], seq 13626761:13626925, ack 2937995557, win 58, options [nop,nop,TS val 4294715087 ecr 4294715067], length 164
11:32:02.440426 IP 10.0.0.1.8882 > vagrant-ubuntu-trusty-64.48182: Flags [.], ack 13626761, win 199, options [nop,nop,TS val 4294715089 ecr 4294715066], length 0
11:32:02.446534 IP vagrant-ubuntu-trusty-64.48182 > 10.0.0.1.8882: Flags [P.], seq 13626925:13627089, ack 2937995557, win 58, options [nop,nop,TS val 4294715106 ecr 4294715089], length 164
11:32:02.462161 IP 10.0.0.1.8882 > vagrant-ubuntu-trusty-64.48182: Flags [.], ack 13626925, win 202, options [nop,nop,TS val 4294715110 ecr 4294715087], length 0
11:32:02.466584 IP vagrant-ubuntu-trusty-64.48182 > 10.0.0.1.8882: Flags [P.], seq 13627089:13627253, ack 2937995557, win 58, options [nop,nop,TS val 4294715126 ecr 4294715110], length 164
11:32:02.480168 IP 10.0.0.1.8882 > vagrant-ubuntu-trusty-64.48182: Flags [.], ack 13627089, win 204, options [nop,nop,TS val 4294715129 ecr 4294715106], length 0
11:32:02.486489 IP vagrant-ubuntu-trusty-64.48182 > 10.0.0.1.8882: Flags [P.], seq 13627253:13627417, ack 2937995557, win 58, options [nop,nop,TS val 4294715146 ecr 4294715129], length 164
11:32:02.502047 IP 10.0.0.1.8882 > vagrant-ubuntu-trusty-64.48182: Flags [.], ack 13627253, win 206, options [nop,nop,TS val 4294715150 ecr 4294715126], length 0
11:32:02.506317 IP vagrant-ubuntu-trusty-64.48182 > 10.0.0.1.8882: Flags [P.], seq 13627417:13627581, ack 2937995557, win 58, options [nop,nop,TS val 4294715166 ecr 4294715150], length 164
11:32:02.523427 IP 10.0.0.1.8882 > vagrant-ubuntu-trusty-64.48182: Flags [.], ack 13627417, win 208, options [nop,nop,TS val 4294715171 ecr 4294715146], length 0
11:32:02.526994 IP vagrant-ubuntu-trusty-64.48182 > 10.0.0.1.8882: Flags [P.], seq 13627581:13627745, ack 2937995557, win 58, options [nop,nop,TS val 4294715186 ecr 4294715171], length 164
11:32:02.540571 IP 10.0.0.1.8882 > vagrant-ubuntu-trusty-64.48182: Flags [.], ack 13627581, win 210, options [nop,nop,TS val 4294715190 ecr 4294715166], length 0
11:32:02.546374 IP vagrant-ubuntu-trusty-64.48182 > 10.0.0.1.8882: Flags [P.], seq 13627745:13627909, ack 2937995557, win 58, options [nop,nop,TS val 4294715206 ecr 4294715190], length 164
11:32:02.562195 IP 10.0.0.1.8882 > vagrant-ubuntu-trusty-64.48182: Flags [.], ack 13627745, win 212, options [nop,nop,TS val 4294715211 ecr 4294715186], length 0
11:32:02.567495 IP vagrant-ubuntu-trusty-64.48182 > 10.0.0.1.8882: Flags [P.], seq 13627909:13628073, ack 2937995557, win 58, options [nop,nop,TS val 4294715226 ecr 4294715211], length 164
11:32:02.581552 IP 10.0.0.1.8882 > vagrant-ubuntu-trusty-64.48182: Flags [.], ack 13627909, win 214, options [nop,nop,TS val 4294715230 ecr 4294715206], length 0
11:32:02.586475 IP vagrant-ubuntu-trusty-64.48182 > 10.0.0.1.8882: Flags [P.], seq 13628073:13628237, ack 2937995557, win 58, options [nop,nop,TS val 4294715246 ecr 4294715230], length 164
11:32:02.603113 IP 10.0.0.1.8882 > vagrant-ubuntu-trusty-64.48182: Flags [.], ack 13628073, win 216, options [nop,nop,TS val 4294715251 ecr 4294715226], length 0
11:32:02.607517 IP vagrant-ubuntu-trusty-64.48182 > 10.0.0.1.8882: Flags [P.], seq 13628237:13628401, ack 2937995557, win 58, options [nop,nop,TS val 4294715266 ecr 4294715251], length 164
11:32:02.620335 IP 10.0.0.1.8882 > vagrant-ubuntu-trusty-64.48182: Flags [.], ack 13628237, win 218, options [nop,nop,TS val 4294715270 ecr 4294715246], length 0
11:32:02.626355 IP vagrant-ubuntu-trusty-64.48182 > 10.0.0.1.8882: Flags [P.], seq 13628401:13628565, ack 2937995557, win 58, options [nop,nop,TS val 4294715286 ecr 4294715270], length 164
11:32:02.643252 IP 10.0.0.1.8882 > vagrant-ubuntu-trusty-64.48182: Flags [.], ack 13628401, win 220, options [nop,nop,TS val 4294715291 ecr 4294715266], length 0
11:32:02.647535 IP vagrant-ubuntu-trusty-64.48182 > 10.0.0.1.8882: Flags [P.], seq 13628565:13628729, ack 2937995557, win 58, options [nop,nop,TS val 4294715307 ecr 4294715291], length 164
11:32:02.661259 IP 10.0.0.1.8882 > vagrant-ubuntu-trusty-64.48182: Flags [.], ack 13628565, win 222, options [nop,nop,TS val 4294715309 ecr 4294715286], length 0
11:32:02.666513 IP vagrant-ubuntu-trusty-64.48182 > 10.0.0.1.8882: Flags [P.], seq 13628729:13628893, ack 2937995557, win 58, options [nop,nop,TS val 4294715326 ecr 4294715309], length 164
11:32:02.681552 IP 10.0.0.1.8882 > vagrant-ubuntu-trusty-64.48182: Flags [.], ack 13628729, win 225, options [nop,nop,TS val 4294715331 ecr 4294715307], length 0
11:32:02.686381 IP vagrant-ubuntu-trusty-64.48182 > 10.0.0.1.8882: Flags [P.], seq 13628893:13629057, ack 2937995557, win 58, options [nop,nop,TS val 4294715346 ecr 4294715331], length 164
11:32:02.702891 IP 10.0.0.1.8882 > vagrant-ubuntu-trusty-64.48182: Flags [.], ack 13628893, win 227, options [nop,nop,TS val 4294715352 ecr 4294715326], length 0
11:32:02.706359 IP vagrant-ubuntu-trusty-64.48182 > 10.0.0.1.8882: Flags [P.], seq 13629057:13629221, ack 2937995557, win 58, options [nop,nop,TS val 4294715366 ecr 4294715352], length 164
11:32:02.721323 IP 10.0.0.1.8882 > vagrant-ubuntu-trusty-64.48182: Flags [.], ack 13629057, win 229, options [nop,nop,TS val 4294715371 ecr 4294715346], length 0
11:32:02.726441 IP vagrant-ubuntu-trusty-64.48182 > 10.0.0.1.8882: Flags [P.], seq 13629221:13629385, ack 2937995557, win 58, options [nop,nop,TS val 4294715386 ecr 4294715371], length 164
11:32:02.747332 IP 10.0.0.1.8882 > vagrant-ubuntu-trusty-64.48182: Flags [.], ack 13629221, win 231, options [nop,nop,TS val 4294715395 ecr 4294715366], length 0
11:32:02.747615 IP vagrant-ubuntu-trusty-64.48182 > 10.0.0.1.8882: Flags [P.], seq 13629385:13629549, ack 2937995557, win 58, options [nop,nop,TS val 4294715407 ecr 4294715371], length 164
11:32:02.765240 IP 10.0.0.1.8882 > vagrant-ubuntu-trusty-64.48182: Flags [.], ack 13629385, win 233, options [nop,nop,TS val 4294715413 ecr 4294715386], length 0
11:32:02.766528 IP vagrant-ubuntu-trusty-64.48182 > 10.0.0.1.8882: Flags [P.], seq 13629549:13629713, ack 2937995557, win 58, options [nop,nop,TS val 4294715426 ecr 4294715413], length 164
11:32:02.786449 IP vagrant-ubuntu-trusty-64.48182 > 10.0.0.1.8882: Flags [P.], seq 13629713:13629877, ack 2937995557, win 58, options [nop,nop,TS val 4294715446 ecr 4294715413], length 164
11:32:02.786645 IP 10.0.0.1.8882 > vagrant-ubuntu-trusty-64.48182: Flags [.], ack 13629549, win 235, options [nop,nop,TS val 4294715436 ecr 4294715407], length 0
11:32:02.805243 IP 10.0.0.1.8882 > vagrant-ubuntu-trusty-64.48182: Flags [.], ack 13629713, win 237, options [nop,nop,TS val 4294715453 ecr 4294715426], length 0
11:32:02.806400 IP vagrant-ubuntu-trusty-64.48182 > 10.0.0.1.8882: Flags [P.], seq 13629877:13630041, ack 2937995557, win 58, options [nop,nop,TS val 4294715466 ecr 4294715453], length 164
11:32:02.822330 IP 10.0.0.1.8882 > vagrant-ubuntu-trusty-64.48182: Flags [.], ack 13629877, win 239, options [nop,nop,TS val 4294715472 ecr 4294715446], length 0
11:32:02.826338 IP vagrant-ubuntu-trusty-64.48182 > 10.0.0.1.8882: Flags [P.], seq 13630041:13630205, ack 2937995557, win 58, options [nop,nop,TS val 4294715486 ecr 4294715472], length 164
11:32:02.845224 IP 10.0.0.1.8882 > vagrant-ubuntu-trusty-64.48182: Flags [.], ack 13630041, win 241, options [nop,nop,TS val 4294715493 ecr 4294715466], length 0
11:32:02.846465 IP vagrant-ubuntu-trusty-64.48182 > 10.0.0.1.8882: Flags [P.], seq 13630205:13630369, ack 2937995557, win 58, options [nop,nop,TS val 4294715506 ecr 4294715493], length 164
11:32:02.862289 IP 10.0.0.1.8882 > vagrant-ubuntu-trusty-64.48182: Flags [.], ack 13630205, win 243, options [nop,nop,TS val 4294715512 ecr 4294715486], length 0
11:32:02.866454 IP vagrant-ubuntu-trusty-64.48182 > 10.0.0.1.8882: Flags [P.], seq 13630369:13630533, ack 2937995557, win 58, options [nop,nop,TS val 4294715526 ecr 4294715512], length 164
11:32:02.883630 IP 10.0.0.1.8882 > vagrant-ubuntu-trusty-64.48182: Flags [.], ack 13630369, win 245, options [nop,nop,TS val 4294715533 ecr 4294715506], length 0
11:32:02.886712 IP vagrant-ubuntu-trusty-64.48182 > 10.0.0.1.8882: Flags [P.], seq 13630533:13630697, ack 2937995557, win 58, options [nop,nop,TS val 4294715546 ecr 4294715533], length 164
11:32:02.906345 IP 10.0.0.1.8882 > vagrant-ubuntu-trusty-64.48182: Flags [.], ack 13630533, win 248, options [nop,nop,TS val 4294715554 ecr 4294715526], length 0
11:32:02.906428 IP vagrant-ubuntu-trusty-64.48182 > 10.0.0.1.8882: Flags [P.], seq 13630697:13630861, ack 2937995557, win 58, options [nop,nop,TS val 4294715566 ecr 4294715533], length 164
11:32:02.925217 IP 10.0.0.1.8882 > vagrant-ubuntu-trusty-64.48182: Flags [.], ack 13630697, win 250, options [nop,nop,TS val 4294715574 ecr 4294715546], length 0
11:32:02.926336 IP vagrant-ubuntu-trusty-64.48182 > 10.0.0.1.8882: Flags [P.], seq 13630861:13631025, ack 2937995557, win 58, options [nop,nop,TS val 4294715586 ecr 4294715574], length 164
11:32:02.946552 IP 10.0.0.1.8882 > vagrant-ubuntu-trusty-64.48182: Flags [.], ack 13630861, win 252, options [nop,nop,TS val 4294715594 ecr 4294715566], length 0
11:32:02.946801 IP vagrant-ubuntu-trusty-64.48182 > 10.0.0.1.8882: Flags [P.], seq 13631025:13631189, ack 2937995557, win 58, options [nop,nop,TS val 4294715606 ecr 4294715574], length 164
11:32:02.964302 IP 10.0.0.1.8882 > vagrant-ubuntu-trusty-64.48182: Flags [.], ack 13631025, win 254, options [nop,nop,TS val 4294715613 ecr 4294715586], length 0
11:32:02.966456 IP vagrant-ubuntu-trusty-64.48182 > 10.0.0.1.8882: Flags [P.], seq 13631189:13631353, ack 2937995557, win 58, options [nop,nop,TS val 4294715626 ecr 4294715613], length 164
11:32:02.985462 IP 10.0.0.1.8882 > vagrant-ubuntu-trusty-64.48182: Flags [.], ack 13631189, win 256, options [nop,nop,TS val 4294715634 ecr 4294715606], length 0
11:32:02.986453 IP vagrant-ubuntu-trusty-64.48182 > 10.0.0.1.8882: Flags [P.], seq 13631353:13631517, ack 2937995557, win 58, options [nop,nop,TS val 4294715646 ecr 4294715634], length 164
11:32:03.003202 IP 10.0.0.1.8882 > vagrant-ubuntu-trusty-64.48182: Flags [.], ack 13631353, win 258, options [nop,nop,TS val 4294715653 ecr 4294715626], length 0
11:32:03.006674 IP vagrant-ubuntu-trusty-64.48182 > 10.0.0.1.8882: Flags [P.], seq 13631517:13631681, ack 2937995557, win 58, options [nop,nop,TS val 4294715666 ecr 4294715653], length 164
11:32:03.026463 IP vagrant-ubuntu-trusty-64.48182 > 10.0.0.1.8882: Flags [P.], seq 13631681:13631845, ack 2937995557, win 58, options [nop,nop,TS val 4294715686 ecr 4294715653], length 164
11:32:03.027712 IP 10.0.0.1.8882 > vagrant-ubuntu-trusty-64.48182: Flags [.], ack 13631517, win 260, options [nop,nop,TS val 4294715676 ecr 4294715646], length 0
11:32:03.047412 IP 10.0.0.1.8882 > vagrant-ubuntu-trusty-64.48182: Flags [.], ack 13631681, win 262, options [nop,nop,TS val 4294715695 ecr 4294715666], length 0
11:32:03.047616 IP vagrant-ubuntu-trusty-64.48182 > 10.0.0.1.8882: Flags [P.], seq 13631845:13632009, ack 2937995557, win 58, options [nop,nop,TS val 4294715707 ecr 4294715676], length 164
11:32:03.066451 IP vagrant-ubuntu-trusty-64.48182 > 10.0.0.1.8882: Flags [P.], seq 13632009:13632173, ack 2937995557, win 58, options [nop,nop,TS val 4294715726 ecr 4294715695], length 164
11:32:03.067429 IP 10.0.0.1.8882 > vagrant-ubuntu-trusty-64.48182: Flags [.], ack 13631845, win 264, options [nop,nop,TS val 4294715717 ecr 4294715686], length 0
11:32:03.086663 IP vagrant-ubuntu-trusty-64.48182 > 10.0.0.1.8882: Flags [P.], seq 13632173:13632337, ack 2937995557, win 58, options [nop,nop,TS val 4294715746 ecr 4294715717], length 164
11:32:03.089714 IP 10.0.0.1.8882 > vagrant-ubuntu-trusty-64.48182: Flags [.], ack 13632009, win 266, options [nop,nop,TS val 4294715738 ecr 4294715707], length 0
11:32:03.106551 IP vagrant-ubuntu-trusty-64.48182 > 10.0.0.1.8882: Flags [P.], seq 13632337:13632501, ack 2937995557, win 58, options [nop,nop,TS val 4294715766 ecr 4294715738], length 164
11:32:03.107149 IP 10.0.0.1.8882 > vagrant-ubuntu-trusty-64.48182: Flags [.], ack 13632173, win 269, options [nop,nop,TS val 4294715756 ecr 4294715726], length 0
11:32:03.126439 IP vagrant-ubuntu-trusty-64.48182 > 10.0.0.1.8882: Flags [P.], seq 13632501:13632665, ack 2937995557, win 58, options [nop,nop,TS val 4294715786 ecr 4294715756], length 164
11:32:03.128868 IP 10.0.0.1.8882 > vagrant-ubuntu-trusty-64.48182: Flags [.], ack 13632337, win 271, options [nop,nop,TS val 4294715778 ecr 4294715746], length 0
11:32:03.146397 IP vagrant-ubuntu-trusty-64.48182 > 10.0.0.1.8882: Flags [P.], seq 13632665:13632829, ack 2937995557, win 58, options [nop,nop,TS val 4294715806 ecr 4294715778], length 164
11:32:03.147522 IP 10.0.0.1.8882 > vagrant-ubuntu-trusty-64.48182: Flags [.], ack 13632501, win 273, options [nop,nop,TS val 4294715796 ecr 4294715766], length 0
11:32:03.166686 IP vagrant-ubuntu-trusty-64.48182 > 10.0.0.1.8882: Flags [P.], seq 13632829:13632993, ack 2937995557, win 58, options [nop,nop,TS val 4294715826 ecr 4294715796], length 164
11:32:03.167511 IP 10.0.0.1.8882 > vagrant-ubuntu-trusty-64.48182: Flags [.], ack 13632665, win 275, options [nop,nop,TS val 4294715816 ecr 4294715786], length 0
11:32:03.186412 IP vagrant-ubuntu-trusty-64.48182 > 10.0.0.1.8882: Flags [P.], seq 13632993:13633157, ack 2937995557, win 58, options [nop,nop,TS val 4294715846 ecr 4294715816], length 164
11:32:03.187570 IP 10.0.0.1.8882 > vagrant-ubuntu-trusty-64.48182: Flags [.], ack 13632829, win 277, options [nop,nop,TS val 4294715836 ecr 4294715806], length 0
11:32:03.206681 IP 10.0.0.1.8882 > vagrant-ubuntu-trusty-64.48182: Flags [.], ack 13632993, win 279, options [nop,nop,TS val 4294715855 ecr 4294715826], length 0
11:32:03.206727 IP vagrant-ubuntu-trusty-64.48182 > 10.0.0.1.8882: Flags [P.], seq 13633157:13633321, ack 2937995557, win 58, options [nop,nop,TS val 4294715866 ecr 4294715836], length 164
11:32:03.226680 IP 10.0.0.1.8882 > vagrant-ubuntu-trusty-64.48182: Flags [.], ack 13633157, win 281, options [nop,nop,TS val 4294715876 ecr 4294715846], length 0
11:32:03.226728 IP vagrant-ubuntu-trusty-64.48182 > 10.0.0.1.8882: Flags [P.], seq 13633321:13633485, ack 2937995557, win 58, options [nop,nop,TS val 4294715886 ecr 4294715855], length 164
11:32:03.246347 IP vagrant-ubuntu-trusty-64.48182 > 10.0.0.1.8882: Flags [P.], seq 13633485:13633649, ack 2937995557, win 58, options [nop,nop,TS val 4294715906 ecr 4294715876], length 164
11:32:03.249550 IP 10.0.0.1.8882 > vagrant-ubuntu-trusty-64.48182: Flags [.], ack 13633321, win 283, options [nop,nop,TS val 4294715898 ecr 4294715866], length 0
11:32:03.266447 IP vagrant-ubuntu-trusty-64.48182 > 10.0.0.1.8882: Flags [P.], seq 13633649:13633813, ack 2937995557, win 58, options [nop,nop,TS val 4294715926 ecr 4294715898], length 164
11:32:03.266613 IP 10.0.0.1.8882 > vagrant-ubuntu-trusty-64.48182: Flags [.], ack 13633485, win 285, options [nop,nop,TS val 4294715916 ecr 4294715886], length 0
11:32:03.286810 IP vagrant-ubuntu-trusty-64.48182 > 10.0.0.1.8882: Flags [P.], seq 13633813:13633977, ack 2937995557, win 58, options [nop,nop,TS val 4294715946 ecr 4294715916], length 164
11:32:03.288796 IP 10.0.0.1.8882 > vagrant-ubuntu-trusty-64.48182: Flags [.], ack 13633649, win 287, options [nop,nop,TS val 4294715937 ecr 4294715906], length 0
11:32:03.306440 IP 10.0.0.1.8882 > vagrant-ubuntu-trusty-64.48182: Flags [.], ack 13633813, win 289, options [nop,nop,TS val 4294715956 ecr 4294715926], length 0
11:32:03.306528 IP vagrant-ubuntu-trusty-64.48182 > 10.0.0.1.8882: Flags [P.], seq 13633977:13634141, ack 2937995557, win 58, options [nop,nop,TS val 4294715966 ecr 4294715956], length 164
11:32:03.326897 IP vagrant-ubuntu-trusty-64.48182 > 10.0.0.1.8882: Flags [P.], seq 13634141:13634305, ack 2937995557, win 58, options [nop,nop,TS val 4294715986 ecr 4294715956], length 164
11:32:03.330806 IP 10.0.0.1.8882 > vagrant-ubuntu-trusty-64.48182: Flags [.], ack 13633977, win 292, options [nop,nop,TS val 4294715980 ecr 4294715946], length 0
11:32:03.346331 IP vagrant-ubuntu-trusty-64.48182 > 10.0.0.1.8882: Flags [P.], seq 13634305:13634469, ack 2937995557, win 58, options [nop,nop,TS val 4294716006 ecr 4294715980], length 164
