12:03:33.967660 IP 10.0.0.2.50658 > vagrant-ubuntu-trusty-64.8882: Flags [P.], seq 1087457015:1087457179, ack 433141433, win 58, options [nop,nop,TS val 4294713605 ecr 4294713576], length 164
12:03:33.967706 IP vagrant-ubuntu-trusty-64.8882 > 10.0.0.2.50658: Flags [.], ack 1087457179, win 63, options [nop,nop,TS val 4294713616 ecr 4294713605], length 0
12:03:33.987272 IP 10.0.0.2.50658 > vagrant-ubuntu-trusty-64.8882: Flags [P.], seq 1087457179:1087457343, ack 433141433, win 58, options [nop,nop,TS val 4294713625 ecr 4294713597], length 164
12:03:33.987294 IP vagrant-ubuntu-trusty-64.8882 > 10.0.0.2.50658: Flags [.], ack 1087457343, win 65, options [nop,nop,TS val 4294713636 ecr 4294713625], length 0
12:03:34.007221 IP 10.0.0.2.50658 > vagrant-ubuntu-trusty-64.8882: Flags [P.], seq 1087457343:1087457507, ack 433141433, win 58, options [nop,nop,TS val 4294713645 ecr 4294713616], length 164
12:03:34.007273 IP vagrant-ubuntu-trusty-64.8882 > 10.0.0.2.50658: Flags [.], ack 1087457507, win 68, options [nop,nop,TS val 4294713655 ecr 4294713645], length 0
12:03:34.027604 IP 10.0.0.2.50658 > vagrant-ubuntu-trusty-64.8882: Flags [P.], seq 1087457507:1087457671, ack 433141433, win 58, options [nop,nop,TS val 4294713665 ecr 4294713636], length 164
12:03:34.027649 IP vagrant-ubuntu-trusty-64.8882 > 10.0.0.2.50658: Flags [.], ack 1087457671, win 70, options [nop,nop,TS val 4294713676 ecr 4294713665], length 0
12:03:34.048054 IP 10.0.0.2.50658 > vagrant-ubuntu-trusty-64.8882: Flags [P.], seq 1087457671:1087457835, ack 433141433, win 58, options [nop,nop,TS val 4294713685 ecr 4294713655], length 164
12:03:34.048072 IP vagrant-ubuntu-trusty-64.8882 > 10.0.0.2.50658: Flags [.], ack 1087457835, win 72, options [nop,nop,TS val 4294713696 ecr 4294713685], length 0
12:03:34.068770 IP 10.0.0.2.50658 > vagrant-ubuntu-trusty-64.8882: Flags [P.], seq 1087457835:1087457999, ack 433141433, win 58, options [nop,nop,TS val 4294713706 ecr 4294713676], length 164
12:03:34.068786 IP vagrant-ubuntu-trusty-64.8882 > 10.0.0.2.50658: Flags [.], ack 1087457999, win 74, options [nop,nop,TS val 4294713717 ecr 4294713706], length 0
12:03:34.096825 IP 10.0.0.2.50658 > vagrant-ubuntu-trusty-64.8882: Flags [P.], seq 1087457999:1087458163, ack 433141433, win 58, options [nop,nop,TS val 4294713727 ecr 4294713696], length 164
12:03:34.096901 IP vagrant-ubuntu-trusty-64.8882 > 10.0.0.2.50658: Flags [.], ack 1087458163, win 76, options [nop,nop,TS val 4294713745 ecr 4294713727], length 0
12:03:34.117911 IP 10.0.0.2.50658 > vagrant-ubuntu-trusty-64.8882: Flags [P.], seq 1087458163:1087458327, ack 433141433, win 58, options [nop,nop,TS val 4294713745 ecr 4294713717], length 164
12:03:34.117971 IP vagrant-ubuntu-trusty-64.8882 > 10.0.0.2.50658: Flags [.], ack 1087458327, win 78, options [nop,nop,TS val 4294713766 ecr 4294713745], length 0
12:03:34.157195 IP 10.0.0.2.50658 > vagrant-ubuntu-trusty-64.8882: Flags [P.], seq 1087458327:1087458491, ack 433141433, win 58, options [nop,nop,TS val 4294713766 ecr 4294713745], length 164
12:03:34.157213 IP vagrant-ubuntu-trusty-64.8882 > 10.0.0.2.50658: Flags [.], ack 1087458491, win 80, options [nop,nop,TS val 4294713805 ecr 4294713766], length 0
12:03:34.257914 IP 10.0.0.2.50658 > vagrant-ubuntu-trusty-64.8882: Flags [P.], seq 1087459311:1087459475, ack 433141433, win 58, options [nop,nop,TS val 4294713885 ecr 4294713805], length 164
12:03:34.257952 IP vagrant-ubuntu-trusty-64.8882 > 10.0.0.2.50658: Flags [.], ack 1087458491, win 82, options [nop,nop,TS val 4294713906 ecr 4294713766,nop,nop,sack 1 {1087459311:1087459475}], length 0
12:03:34.281013 IP 10.0.0.2.50658 > vagrant-ubuntu-trusty-64.8882: Flags [P.], seq 1087459475:1087459639, ack 433141433, win 58, options [nop,nop,TS val 4294713906 ecr 4294713805], length 164
12:03:34.281104 IP vagrant-ubuntu-trusty-64.8882 > 10.0.0.2.50658: Flags [.], ack 1087458491, win 84, options [nop,nop,TS val 4294713929 ecr 4294713766,nop,nop,sack 1 {1087459311:1087459639}], length 0
12:03:34.296032 IP 10.0.0.2.50658 > vagrant-ubuntu-trusty-64.8882: Flags [P.], seq 1087458491:1087459311, ack 433141433, win 58, options [nop,nop,TS val 4294713916 ecr 4294713906], length 820
12:03:34.296069 IP vagrant-ubuntu-trusty-64.8882 > 10.0.0.2.50658: Flags [.], ack 1087459639, win 87, options [nop,nop,TS val 4294713944 ecr 4294713916], length 0
12:03:34.331754 IP 10.0.0.2.50658 > vagrant-ubuntu-trusty-64.8882: Flags [P.], seq 1087459967:1087460131, ack 433141433, win 58, options [nop,nop,TS val 4294713966 ecr 4294713944], length 164
12:03:34.331783 IP vagrant-ubuntu-trusty-64.8882 > 10.0.0.2.50658: Flags [.], ack 1087459639, win 91, options [nop,nop,TS val 4294713980 ecr 4294713916,nop,nop,sack 1 {1087459967:1087460131}], length 0
12:03:34.352955 IP 10.0.0.2.50658 > vagrant-ubuntu-trusty-64.8882: Flags [P.], seq 1087460131:1087460295, ack 433141433, win 58, options [nop,nop,TS val 4294713985 ecr 4294713944], length 164
12:03:34.353008 IP vagrant-ubuntu-trusty-64.8882 > 10.0.0.2.50658: Flags [.], ack 1087459639, win 94, options [nop,nop,TS val 4294714001 ecr 4294713916,nop,nop,sack 1 {1087459967:1087460295}], length 0
12:03:34.374054 IP 10.0.0.2.50658 > vagrant-ubuntu-trusty-64.8882: Flags [P.], seq 1087460295:1087460459, ack 433141433, win 58, options [nop,nop,TS val 4294714005 ecr 4294713980], length 164
12:03:34.374076 IP vagrant-ubuntu-trusty-64.8882 > 10.0.0.2.50658: Flags [.], ack 1087459639, win 97, options [nop,nop,TS val 4294714022 ecr 4294713916,nop,nop,sack 1 {1087459967:1087460459}], length 0
12:03:34.381866 IP 10.0.0.2.50658 > vagrant-ubuntu-trusty-64.8882: Flags [P.], seq 1087459639:1087459967, ack 433141433, win 58, options [nop,nop,TS val 4294714012 ecr 4294714001], length 328
12:03:34.381914 IP vagrant-ubuntu-trusty-64.8882 > 10.0.0.2.50658: Flags [.], ack 1087460459, win 100, options [nop,nop,TS val 4294714030 ecr 4294714012], length 0
12:03:34.392782 IP 10.0.0.2.50658 > vagrant-ubuntu-trusty-64.8882: Flags [P.], seq 1087460459:1087460623, ack 433141433, win 58, options [nop,nop,TS val 4294714026 ecr 4294714001], length 164
12:03:34.392792 IP vagrant-ubuntu-trusty-64.8882 > 10.0.0.2.50658: Flags [.], ack 1087460623, win 103, options [nop,nop,TS val 4294714041 ecr 4294714026], length 0
12:03:34.417569 IP 10.0.0.2.50658 > vagrant-ubuntu-trusty-64.8882: Flags [P.], seq 1087460623:1087460787, ack 433141433, win 58, options [nop,nop,TS val 4294714045 ecr 4294714030], length 164
12:03:34.417589 IP vagrant-ubuntu-trusty-64.8882 > 10.0.0.2.50658: Flags [.], ack 1087460787, win 107, options [nop,nop,TS val 4294714066 ecr 4294714045], length 0
12:03:34.436065 IP 10.0.0.2.50658 > vagrant-ubuntu-trusty-64.8882: Flags [P.], seq 1087460787:1087460951, ack 433141433, win 58, options [nop,nop,TS val 4294714065 ecr 4294714041], length 164
12:03:34.436107 IP vagrant-ubuntu-trusty-64.8882 > 10.0.0.2.50658: Flags [.], ack 1087460951, win 110, options [nop,nop,TS val 4294714084 ecr 4294714065], length 0
12:03:34.458098 IP 10.0.0.2.50658 > vagrant-ubuntu-trusty-64.8882: Flags [P.], seq 1087460951:1087461115, ack 433141433, win 58, options [nop,nop,TS val 4294714086 ecr 4294714066], length 164
12:03:34.458158 IP vagrant-ubuntu-trusty-64.8882 > 10.0.0.2.50658: Flags [.], ack 1087461115, win 113, options [nop,nop,TS val 4294714106 ecr 4294714086], length 0
12:03:34.477251 IP 10.0.0.2.50658 > vagrant-ubuntu-trusty-64.8882: Flags [P.], seq 1087461115:1087461279, ack 433141433, win 58, options [nop,nop,TS val 4294714106 ecr 4294714084], length 164
12:03:34.477308 IP vagrant-ubuntu-trusty-64.8882 > 10.0.0.2.50658: Flags [.], ack 1087461279, win 116, options [nop,nop,TS val 4294714126 ecr 4294714106], length 0
12:03:34.495214 IP 10.0.0.2.50658 > vagrant-ubuntu-trusty-64.8882: Flags [P.], seq 1087461279:1087461443, ack 433141433, win 58, options [nop,nop,TS val 4294714126 ecr 4294714106], length 164
12:03:34.495287 IP vagrant-ubuntu-trusty-64.8882 > 10.0.0.2.50658: Flags [.], ack 1087461443, win 120, options [nop,nop,TS val 4294714144 ecr 4294714126], length 0
12:03:34.507837 IP 10.0.0.2.50658 > vagrant-ubuntu-trusty-64.8882: Flags [P.], seq 1087461443:1087461607, ack 433141433, win 58, options [nop,nop,TS val 4294714145 ecr 4294714126], length 164
12:03:34.507850 IP vagrant-ubuntu-trusty-64.8882 > 10.0.0.2.50658: Flags [.], ack 1087461607, win 123, options [nop,nop,TS val 4294714156 ecr 4294714145], length 0
12:03:34.532893 IP 10.0.0.2.50658 > vagrant-ubuntu-trusty-64.8882: Flags [P.], seq 1087461607:1087461771, ack 433141433, win 58, options [nop,nop,TS val 4294714165 ecr 4294714144], length 164
12:03:34.532969 IP vagrant-ubuntu-trusty-64.8882 > 10.0.0.2.50658: Flags [.], ack 1087461771, win 126, options [nop,nop,TS val 4294714181 ecr 4294714165], length 0
12:03:34.550785 IP 10.0.0.2.50658 > vagrant-ubuntu-trusty-64.8882: Flags [P.], seq 1087461771:1087461935, ack 433141433, win 58, options [nop,nop,TS val 4294714186 ecr 4294714156], length 164
12:03:34.550819 IP vagrant-ubuntu-trusty-64.8882 > 10.0.0.2.50658: Flags [.], ack 1087461935, win 129, options [nop,nop,TS val 4294714199 ecr 4294714186], length 0
12:03:34.572913 IP 10.0.0.2.50658 > vagrant-ubuntu-trusty-64.8882: Flags [P.], seq 1087461935:1087462099, ack 433141433, win 58, options [nop,nop,TS val 4294714206 ecr 4294714181], length 164
12:03:34.572990 IP vagrant-ubuntu-trusty-64.8882 > 10.0.0.2.50658: Flags [.], ack 1087462099, win 132, options [nop,nop,TS val 4294714220 ecr 4294714206], length 0
12:03:34.594038 IP 10.0.0.2.50658 > vagrant-ubuntu-trusty-64.8882: Flags [P.], seq 1087462099:1087462263, ack 433141433, win 58, options [nop,nop,TS val 4294714225 ecr 4294714199], length 164
12:03:34.594116 IP vagrant-ubuntu-trusty-64.8882 > 10.0.0.2.50658: Flags [.], ack 1087462263, win 136, options [nop,nop,TS val 4294714242 ecr 4294714225], length 0
12:03:34.612778 IP 10.0.0.2.50658 > vagrant-ubuntu-trusty-64.8882: Flags [P.], seq 1087462263:1087462427, ack 433141433, win 58, options [nop,nop,TS val 4294714246 ecr 4294714220], length 164
12:03:34.612881 IP vagrant-ubuntu-trusty-64.8882 > 10.0.0.2.50658: Flags [.], ack 1087462427, win 139, options [nop,nop,TS val 4294714260 ecr 4294714246], length 0
12:03:34.633835 IP 10.0.0.2.50658 > vagrant-ubuntu-trusty-64.8882: Flags [P.], seq 1087462427:1087462591, ack 433141433, win 58, options [nop,nop,TS val 4294714265 ecr 4294714242], length 164
12:03:34.633907 IP vagrant-ubuntu-trusty-64.8882 > 10.0.0.2.50658: Flags [.], ack 1087462591, win 142, options [nop,nop,TS val 4294714282 ecr 4294714265], length 0
12:03:34.651850 IP 10.0.0.2.50658 > vagrant-ubuntu-trusty-64.8882: Flags [P.], seq 1087462591:1087462755, ack 433141433, win 58, options [nop,nop,TS val 4294714285 ecr 4294714260], length 164
12:03:34.651882 IP vagrant-ubuntu-trusty-64.8882 > 10.0.0.2.50658: Flags [.], ack 1087462755, win 145, options [nop,nop,TS val 4294714300 ecr 4294714285], length 0
12:03:34.673144 IP 10.0.0.2.50658 > vagrant-ubuntu-trusty-64.8882: Flags [P.], seq 1087462755:1087462919, ack 433141433, win 58, options [nop,nop,TS val 4294714305 ecr 4294714282], length 164
12:03:34.673158 IP vagrant-ubuntu-trusty-64.8882 > 10.0.0.2.50658: Flags [.], ack 1087462919, win 148, options [nop,nop,TS val 4294714321 ecr 4294714305], length 0
12:03:34.692251 IP 10.0.0.2.50658 > vagrant-ubuntu-trusty-64.8882: Flags [P.], seq 1087462919:1087463083, ack 433141433, win 58, options [nop,nop,TS val 4294714325 ecr 4294714300], length 164
12:03:34.692308 IP vagrant-ubuntu-trusty-64.8882 > 10.0.0.2.50658: Flags [.], ack 1087463083, win 152, options [nop,nop,TS val 4294714340 ecr 4294714325], length 0
12:03:34.713842 IP 10.0.0.2.50658 > vagrant-ubuntu-trusty-64.8882: Flags [P.], seq 1087463083:1087463247, ack 433141433, win 58, options [nop,nop,TS val 4294714345 ecr 4294714321], length 164
12:03:34.713924 IP vagrant-ubuntu-trusty-64.8882 > 10.0.0.2.50658: Flags [.], ack 1087463247, win 155, options [nop,nop,TS val 4294714361 ecr 4294714345], length 0
12:03:34.732093 IP 10.0.0.2.50658 > vagrant-ubuntu-trusty-64.8882: Flags [P.], seq 1087463247:1087463411, ack 433141433, win 58, options [nop,nop,TS val 4294714365 ecr 4294714340], length 164
12:03:34.732170 IP vagrant-ubuntu-trusty-64.8882 > 10.0.0.2.50658: Flags [.], ack 1087463411, win 158, options [nop,nop,TS val 4294714380 ecr 4294714365], length 0
12:03:34.753119 IP 10.0.0.2.50658 > vagrant-ubuntu-trusty-64.8882: Flags [P.], seq 1087463411:1087463575, ack 433141433, win 58, options [nop,nop,TS val 4294714385 ecr 4294714361], length 164
12:03:34.753140 IP vagrant-ubuntu-trusty-64.8882 > 10.0.0.2.50658: Flags [.], ack 1087463575, win 161, options [nop,nop,TS val 4294714401 ecr 4294714385], length 0
12:03:34.775061 IP 10.0.0.2.50658 > vagrant-ubuntu-trusty-64.8882: Flags [P.], seq 1087463575:1087463739, ack 433141433, win 58, options [nop,nop,TS val 4294714405 ecr 4294714380], length 164
12:03:34.775128 IP vagrant-ubuntu-trusty-64.8882 > 10.0.0.2.50658: Flags [.], ack 1087463739, win 164, options [nop,nop,TS val 4294714423 ecr 4294714405], length 0
12:03:34.792962 IP 10.0.0.2.50658 > vagrant-ubuntu-trusty-64.8882: Flags [P.], seq 1087463739:1087463903, ack 433141433, win 58, options [nop,nop,TS val 4294714425 ecr 4294714401], length 164
12:03:34.792975 IP vagrant-ubuntu-trusty-64.8882 > 10.0.0.2.50658: Flags [.], ack 1087463903, win 168, options [nop,nop,TS val 4294714441 ecr 4294714425], length 0
12:03:34.817390 IP 10.0.0.2.50658 > vagrant-ubuntu-trusty-64.8882: Flags [P.], seq 1087463903:1087464067, ack 433141433, win 58, options [nop,nop,TS val 4294714446 ecr 4294714423], length 164
12:03:34.817403 IP vagrant-ubuntu-trusty-64.8882 > 10.0.0.2.50658: Flags [.], ack 1087464067, win 171, options [nop,nop,TS val 4294714466 ecr 4294714446], length 0
12:03:34.836107 IP 10.0.0.2.50658 > vagrant-ubuntu-trusty-64.8882: Flags [P.], seq 1087464067:1087464231, ack 433141433, win 58, options [nop,nop,TS val 4294714466 ecr 4294714441], length 164
12:03:34.836156 IP vagrant-ubuntu-trusty-64.8882 > 10.0.0.2.50658: Flags [.], ack 1087464231, win 174, options [nop,nop,TS val 4294714484 ecr 4294714466], length 0
12:03:34.857218 IP 10.0.0.2.50658 > vagrant-ubuntu-trusty-64.8882: Flags [P.], seq 1087464231:1087464395, ack 433141433, win 58, options [nop,nop,TS val 4294714485 ecr 4294714466], length 164
12:03:34.857236 IP vagrant-ubuntu-trusty-64.8882 > 10.0.0.2.50658: Flags [.], ack 1087464395, win 177, options [nop,nop,TS val 4294714505 ecr 4294714485], length 0
12:03:34.876019 IP 10.0.0.2.50658 > vagrant-ubuntu-trusty-64.8882: Flags [P.], seq 1087464395:1087464559, ack 433141433, win 58, options [nop,nop,TS val 4294714506 ecr 4294714484], length 164
12:03:34.876078 IP vagrant-ubuntu-trusty-64.8882 > 10.0.0.2.50658: Flags [.], ack 1087464559, win 180, options [nop,nop,TS val 4294714524 ecr 4294714506], length 0
12:03:34.897121 IP 10.0.0.2.50658 > vagrant-ubuntu-trusty-64.8882: Flags [P.], seq 1087464559:1087464723, ack 433141433, win 58, options [nop,nop,TS val 4294714525 ecr 4294714505], length 164
12:03:34.897140 IP vagrant-ubuntu-trusty-64.8882 > 10.0.0.2.50658: Flags [.], ack 1087464723, win 184, options [nop,nop,TS val 4294714545 ecr 4294714525], length 0
12:03:34.916091 IP 10.0.0.2.50658 > vagrant-ubuntu-trusty-64.8882: Flags [P.], seq 1087464723:1087464887, ack 433141433, win 58, options [nop,nop,TS val 4294714545 ecr 4294714524], length 164
12:03:34.916183 IP vagrant-ubuntu-trusty-64.8882 > 10.0.0.2.50658: Flags [.], ack 1087464887, win 187, options [nop,nop,TS val 4294714564 ecr 4294714545], length 0
12:03:34.937454 IP 10.0.0.2.50658 > vagrant-ubuntu-trusty-64.8882: Flags [P.], seq 1087464887:1087465051, ack 433141433, win 58, options [nop,nop,TS val 4294714566 ecr 4294714545], length 164
12:03:34.937501 IP vagrant-ubuntu-trusty-64.8882 > 10.0.0.2.50658: Flags [.], ack 1087465051, win 190, options [nop,nop,TS val 4294714586 ecr 4294714566], length 0
12:03:34.955980 IP 10.0.0.2.50658 > vagrant-ubuntu-trusty-64.8882: Flags [P.], seq 1087465051:1087465215, ack 433141433, win 58, options [nop,nop,TS val 4294714586 ecr 4294714564], length 164
12:03:34.956047 IP vagrant-ubuntu-trusty-64.8882 > 10.0.0.2.50658: Flags [.], ack 1087465215, win 193, options [nop,nop,TS val 4294714604 ecr 4294714586], length 0
12:03:34.967363 IP 10.0.0.2.50658 > vagrant-ubuntu-trusty-64.8882: Flags [P.], seq 1087465215:1087465379, ack 433141433, win 58, options [nop,nop,TS val 4294714605 ecr 4294714586], length 164
12:03:34.967379 IP vagrant-ubuntu-trusty-64.8882 > 10.0.0.2.50658: Flags [.], ack 1087465379, win 196, options [nop,nop,TS val 4294714616 ecr 4294714605], length 0
12:03:34.988738 IP 10.0.0.2.50658 > vagrant-ubuntu-trusty-64.8882: Flags [P.], seq 1087465379:1087465543, ack 433141433, win 58, options [nop,nop,TS val 4294714627 ecr 4294714616], length 164
12:03:34.988777 IP vagrant-ubuntu-trusty-64.8882 > 10.0.0.2.50658: Flags [.], ack 1087465543, win 200, options [nop,nop,TS val 4294714637 ecr 4294714627], length 0
12:03:35.007478 IP 10.0.0.2.50658 > vagrant-ubuntu-trusty-64.8882: Flags [P.], seq 1087465543:1087465707, ack 433141433, win 58, options [nop,nop,TS val 4294714645 ecr 4294714616], length 164
12:03:35.007522 IP vagrant-ubuntu-trusty-64.8882 > 10.0.0.2.50658: Flags [.], ack 1087465707, win 203, options [nop,nop,TS val 4294714656 ecr 4294714645], length 0
12:03:35.028299 IP 10.0.0.2.50658 > vagrant-ubuntu-trusty-64.8882: Flags [P.], seq 1087465707:1087465871, ack 433141433, win 58, options [nop,nop,TS val 4294714666 ecr 4294714637], length 164
12:03:35.028351 IP vagrant-ubuntu-trusty-64.8882 > 10.0.0.2.50658: Flags [.], ack 1087465871, win 206, options [nop,nop,TS val 4294714676 ecr 4294714666], length 0
12:03:35.047354 IP 10.0.0.2.50658 > vagrant-ubuntu-trusty-64.8882: Flags [P.], seq 1087465871:1087466035, ack 433141433, win 58, options [nop,nop,TS val 4294714685 ecr 4294714656], length 164
12:03:35.047389 IP vagrant-ubuntu-trusty-64.8882 > 10.0.0.2.50658: Flags [.], ack 1087466035, win 209, options [nop,nop,TS val 4294714696 ecr 4294714685], length 0
12:03:35.069020 IP 10.0.0.2.50658 > vagrant-ubuntu-trusty-64.8882: Flags [P.], seq 1087466035:1087466199, ack 433141433, win 58, options [nop,nop,TS val 4294714707 ecr 4294714696], length 164
12:03:35.069075 IP vagrant-ubuntu-trusty-64.8882 > 10.0.0.2.50658: Flags [.], ack 1087466199, win 212, options [nop,nop,TS val 4294714717 ecr 4294714707], length 0
12:03:35.088238 IP 10.0.0.2.50658 > vagrant-ubuntu-trusty-64.8882: Flags [P.], seq 1087466199:1087466363, ack 433141433, win 58, options [nop,nop,TS val 4294714726 ecr 4294714696], length 164
12:03:35.088310 IP vagrant-ubuntu-trusty-64.8882 > 10.0.0.2.50658: Flags [.], ack 1087466363, win 216, options [nop,nop,TS val 4294714736 ecr 4294714726], length 0
12:03:35.107272 IP 10.0.0.2.50658 > vagrant-ubuntu-trusty-64.8882: Flags [P.], seq 1087466363:1087466527, ack 433141433, win 58, options [nop,nop,TS val 4294714745 ecr 4294714717], length 164
12:03:35.107289 IP vagrant-ubuntu-trusty-64.8882 > 10.0.0.2.50658: Flags [.], ack 1087466527, win 219, options [nop,nop,TS val 4294714755 ecr 4294714745], length 0
12:03:35.127282 IP 10.0.0.2.50658 > vagrant-ubuntu-trusty-64.8882: Flags [P.], seq 1087466527:1087466691, ack 433141433, win 58, options [nop,nop,TS val 4294714765 ecr 4294714736], length 164
12:03:35.127322 IP vagrant-ubuntu-trusty-64.8882 > 10.0.0.2.50658: Flags [.], ack 1087466691, win 222, options [nop,nop,TS val 4294714775 ecr 4294714765], length 0
12:03:35.147969 IP 10.0.0.2.50658 > vagrant-ubuntu-trusty-64.8882: Flags [P.], seq 1087466691:1087466855, ack 433141433, win 58, options [nop,nop,TS val 4294714786 ecr 4294714755], length 164
12:03:35.148606 IP vagrant-ubuntu-trusty-64.8882 > 10.0.0.2.50658: Flags [.], ack 1087466855, win 225, options [nop,nop,TS val 4294714796 ecr 4294714786], length 0
12:03:35.168340 IP 10.0.0.2.50658 > vagrant-ubuntu-trusty-64.8882: Flags [P.], seq 1087466855:1087467019, ack 433141433, win 58, options [nop,nop,TS val 4294714806 ecr 4294714775], length 164
12:03:35.168370 IP vagrant-ubuntu-trusty-64.8882 > 10.0.0.2.50658: Flags [.], ack 1087467019, win 228, options [nop,nop,TS val 4294714817 ecr 4294714806], length 0
12:03:35.187992 IP 10.0.0.2.50658 > vagrant-ubuntu-trusty-64.8882: Flags [P.], seq 1087467019:1087467183, ack 433141433, win 58, options [nop,nop,TS val 4294714825 ecr 4294714796], length 164
12:03:35.188050 IP vagrant-ubuntu-trusty-64.8882 > 10.0.0.2.50658: Flags [.], ack 1087467183, win 232, options [nop,nop,TS val 4294714836 ecr 4294714825], length 0
12:03:35.216273 IP 10.0.0.2.50658 > vagrant-ubuntu-trusty-64.8882: Flags [P.], seq 1087467183:1087467347, ack 433141433, win 58, options [nop,nop,TS val 4294714845 ecr 4294714817], length 164
12:03:35.216457 IP vagrant-ubuntu-trusty-64.8882 > 10.0.0.2.50658: Flags [.], ack 1087467347, win 235, options [nop,nop,TS val 4294714864 ecr 4294714845], length 0
12:03:35.227410 IP 10.0.0.2.50658 > vagrant-ubuntu-trusty-64.8882: Flags [P.], seq 1087467347:1087467511, ack 433141433, win 58, options [nop,nop,TS val 4294714865 ecr 4294714836], length 164
12:03:35.227435 IP vagrant-ubuntu-trusty-64.8882 > 10.0.0.2.50658: Flags [.], ack 1087467511, win 238, options [nop,nop,TS val 4294714876 ecr 4294714865], length 0
12:03:35.247389 IP 10.0.0.2.50658 > vagrant-ubuntu-trusty-64.8882: Flags [P.], seq 1087467511:1087467675, ack 433141433, win 58, options [nop,nop,TS val 4294714885 ecr 4294714864], length 164
12:03:35.247427 IP vagrant-ubuntu-trusty-64.8882 > 10.0.0.2.50658: Flags [.], ack 1087467675, win 241, options [nop,nop,TS val 4294714895 ecr 4294714885], length 0
12:03:35.267401 IP 10.0.0.2.50658 > vagrant-ubuntu-trusty-64.8882: Flags [P.], seq 1087467675:1087467839, ack 433141433, win 58, options [nop,nop,TS val 4294714905 ecr 4294714876], length 164
12:03:35.267422 IP vagrant-ubuntu-trusty-64.8882 > 10.0.0.2.50658: Flags [.], ack 1087467839, win 244, options [nop,nop,TS val 4294714916 ecr 4294714905], length 0
12:03:35.287155 IP 10.0.0.2.50658 > vagrant-ubuntu-trusty-64.8882: Flags [P.], seq 1087467839:1087468003, ack 433141433, win 58, options [nop,nop,TS val 4294714925 ecr 4294714895], length 164
12:03:35.287166 IP vagrant-ubuntu-trusty-64.8882 > 10.0.0.2.50658: Flags [.], ack 1087468003, win 248, options [nop,nop,TS val 4294714935 ecr 4294714925], length 0
12:03:35.310336 IP 10.0.0.2.50658 > vagrant-ubuntu-trusty-64.8882: Flags [P.], seq 1087468003:1087468167, ack 433141433, win 58, options [nop,nop,TS val 4294714946 ecr 4294714935], length 164
12:03:35.310379 IP vagrant-ubuntu-trusty-64.8882 > 10.0.0.2.50658: Flags [.], ack 1087468167, win 251, options [nop,nop,TS val 4294714958 ecr 4294714946], length 0
12:03:35.327989 IP 10.0.0.2.50658 > vagrant-ubuntu-trusty-64.8882: Flags [P.], seq 1087468167:1087468331, ack 433141433, win 58, options [nop,nop,TS val 4294714966 ecr 4294714935], length 164
12:03:35.328039 IP vagrant-ubuntu-trusty-64.8882 > 10.0.0.2.50658: Flags [.], ack 1087468331, win 254, options [nop,nop,TS val 4294714976 ecr 4294714966], length 0
12:03:35.347337 IP 10.0.0.2.50658 > vagrant-ubuntu-trusty-64.8882: Flags [P.], seq 1087468331:1087468495, ack 433141433, win 58, options [nop,nop,TS val 4294714985 ecr 4294714958], length 164
12:03:35.347355 IP vagrant-ubuntu-trusty-64.8882 > 10.0.0.2.50658: Flags [.], ack 1087468495, win 257, options [nop,nop,TS val 4294714996 ecr 4294714985], length 0
12:03:35.368409 IP 10.0.0.2.50658 > vagrant-ubuntu-trusty-64.8882: Flags [P.], seq 1087468495:1087468659, ack 433141433, win 58, options [nop,nop,TS val 4294715005 ecr 4294714976], length 164
12:03:35.368426 IP vagrant-ubuntu-trusty-64.8882 > 10.0.0.2.50658: Flags [.], ack 1087468659, win 260, options [nop,nop,TS val 4294715017 ecr 4294715005], length 0
12:03:35.387701 IP 10.0.0.2.50658 > vagrant-ubuntu-trusty-64.8882: Flags [P.], seq 1087468659:1087468823, ack 433141433, win 58, options [nop,nop,TS val 4294715025 ecr 4294714996], length 164
12:03:35.387732 IP vagrant-ubuntu-trusty-64.8882 > 10.0.0.2.50658: Flags [.], ack 1087468823, win 264, options [nop,nop,TS val 4294715036 ecr 4294715025], length 0
12:03:35.408352 IP 10.0.0.2.50658 > vagrant-ubuntu-trusty-64.8882: Flags [P.], seq 1087468823:1087468987, ack 433141433, win 58, options [nop,nop,TS val 4294715045 ecr 4294715017], length 164
12:03:35.408425 IP vagrant-ubuntu-trusty-64.8882 > 10.0.0.2.50658: Flags [.], ack 1087468987, win 267, options [nop,nop,TS val 4294715056 ecr 4294715045], length 0
12:03:35.428307 IP 10.0.0.2.50658 > vagrant-ubuntu-trusty-64.8882: Flags [P.], seq 1087468987:1087469151, ack 433141433, win 58, options [nop,nop,TS val 4294715066 ecr 4294715036], length 164
12:03:35.428367 IP vagrant-ubuntu-trusty-64.8882 > 10.0.0.2.50658: Flags [.], ack 1087469151, win 270, options [nop,nop,TS val 4294715076 ecr 4294715066], length 0
12:03:35.448652 IP 10.0.0.2.50658 > vagrant-ubuntu-trusty-64.8882: Flags [P.], seq 1087469151:1087469315, ack 433141433, win 58, options [nop,nop,TS val 4294715086 ecr 4294715056], length 164
12:03:35.448684 IP vagrant-ubuntu-trusty-64.8882 > 10.0.0.2.50658: Flags [.], ack 1087469315, win 273, options [nop,nop,TS val 4294715097 ecr 4294715086], length 0
12:03:35.467364 IP 10.0.0.2.50658 > vagrant-ubuntu-trusty-64.8882: Flags [P.], seq 1087469315:1087469479, ack 433141433, win 58, options [nop,nop,TS val 4294715105 ecr 4294715076], length 164
12:03:35.467383 IP vagrant-ubuntu-trusty-64.8882 > 10.0.0.2.50658: Flags [.], ack 1087469479, win 276, options [nop,nop,TS val 4294715116 ecr 4294715105], length 0
12:03:35.487655 IP 10.0.0.2.50658 > vagrant-ubuntu-trusty-64.8882: Flags [P.], seq 1087469479:1087469643, ack 433141433, win 58, options [nop,nop,TS val 4294715125 ecr 4294715097], length 164
12:03:35.487689 IP vagrant-ubuntu-trusty-64.8882 > 10.0.0.2.50658: Flags [.], ack 1087469643, win 280, options [nop,nop,TS val 4294715136 ecr 4294715125], length 0
12:03:35.507450 IP 10.0.0.2.50658 > vagrant-ubuntu-trusty-64.8882: Flags [P.], seq 1087469643:1087469807, ack 433141433, win 58, options [nop,nop,TS val 4294715145 ecr 4294715116], length 164
12:03:35.507485 IP vagrant-ubuntu-trusty-64.8882 > 10.0.0.2.50658: Flags [.], ack 1087469807, win 283, options [nop,nop,TS val 4294715156 ecr 4294715145], length 0
12:03:35.528377 IP 10.0.0.2.50658 > vagrant-ubuntu-trusty-64.8882: Flags [P.], seq 1087469807:1087469971, ack 433141433, win 58, options [nop,nop,TS val 4294715166 ecr 4294715136], length 164
12:03:35.528427 IP vagrant-ubuntu-trusty-64.8882 > 10.0.0.2.50658: Flags [.], ack 1087469971, win 286, options [nop,nop,TS val 4294715176 ecr 4294715166], length 0
12:03:35.547298 IP 10.0.0.2.50658 > vagrant-ubuntu-trusty-64.8882: Flags [P.], seq 1087469971:1087470135, ack 433141433, win 58, options [nop,nop,TS val 4294715185 ecr 4294715156], length 164
12:03:35.547310 IP vagrant-ubuntu-trusty-64.8882 > 10.0.0.2.50658: Flags [.], ack 1087470135, win 289, options [nop,nop,TS val 4294715196 ecr 4294715185], length 0
12:03:35.569080 IP 10.0.0.2.50658 > vagrant-ubuntu-trusty-64.8882: Flags [P.], seq 1087470135:1087470299, ack 433141433, win 58, options [nop,nop,TS val 4294715206 ecr 4294715196], length 164
12:03:35.569093 IP vagrant-ubuntu-trusty-64.8882 > 10.0.0.2.50658: Flags [.], ack 1087470299, win 292, options [nop,nop,TS val 4294715217 ecr 4294715206], length 0
12:03:35.588662 IP 10.0.0.2.50658 > vagrant-ubuntu-trusty-64.8882: Flags [P.], seq 1087470299:1087470463, ack 433141433, win 58, options [nop,nop,TS val 4294715226 ecr 4294715196], length 164
12:03:35.588706 IP vagrant-ubuntu-trusty-64.8882 > 10.0.0.2.50658: Flags [.], ack 1087470463, win 296, options [nop,nop,TS val 4294715237 ecr 4294715226], length 0
12:03:35.607835 IP 10.0.0.2.50658 > vagrant-ubuntu-trusty-64.8882: Flags [P.], seq 1087470463:1087470627, ack 433141433, win 58, options [nop,nop,TS val 4294715246 ecr 4294715217], length 164
12:03:35.607847 IP vagrant-ubuntu-trusty-64.8882 > 10.0.0.2.50658: Flags [.], ack 1087470627, win 299, options [nop,nop,TS val 4294715256 ecr 4294715246], length 0
12:03:35.628789 IP 10.0.0.2.50658 > vagrant-ubuntu-trusty-64.8882: Flags [P.], seq 1087470627:1087470791, ack 433141433, win 58, options [nop,nop,TS val 4294715267 ecr 4294715256], length 164
12:03:35.628823 IP vagrant-ubuntu-trusty-64.8882 > 10.0.0.2.50658: Flags [.], ack 1087470791, win 302, options [nop,nop,TS val 4294715277 ecr 4294715267], length 0
12:03:35.651147 IP 10.0.0.2.50658 > vagrant-ubuntu-trusty-64.8882: Flags [P.], seq 1087470791:1087470955, ack 433141433, win 58, options [nop,nop,TS val 4294715286 ecr 4294715256], length 164
12:03:35.651160 IP vagrant-ubuntu-trusty-64.8882 > 10.0.0.2.50658: Flags [.], ack 1087470955, win 305, options [nop,nop,TS val 4294715299 ecr 4294715286], length 0
12:03:35.668614 IP 10.0.0.2.50658 > vagrant-ubuntu-trusty-64.8882: Flags [P.], seq 1087470955:1087471119, ack 433141433, win 58, options [nop,nop,TS val 4294715306 ecr 4294715277], length 164
12:03:35.668664 IP vagrant-ubuntu-trusty-64.8882 > 10.0.0.2.50658: Flags [.], ack 1087471119, win 308, options [nop,nop,TS val 4294715317 ecr 4294715306], length 0
12:03:35.687548 IP 10.0.0.2.50658 > vagrant-ubuntu-trusty-64.8882: Flags [P.], seq 1087471119:1087471283, ack 433141433, win 58, options [nop,nop,TS val 4294715326 ecr 4294715299], length 164
12:03:35.687586 IP vagrant-ubuntu-trusty-64.8882 > 10.0.0.2.50658: Flags [.], ack 1087471283, win 312, options [nop,nop,TS val 4294715336 ecr 4294715326], length 0
12:03:35.708493 IP 10.0.0.2.50658 > vagrant-ubuntu-trusty-64.8882: Flags [P.], seq 1087471283:1087471447, ack 433141433, win 58, options [nop,nop,TS val 4294715346 ecr 4294715317], length 164
12:03:35.708554 IP vagrant-ubuntu-trusty-64.8882 > 10.0.0.2.50658: Flags [.], ack 1087471447, win 315, options [nop,nop,TS val 4294715356 ecr 4294715346], length 0
12:03:35.733863 IP 10.0.0.2.50658 > vagrant-ubuntu-trusty-64.8882: Flags [P.], seq 1087471447:1087471611, ack 433141433, win 58, options [nop,nop,TS val 4294715365 ecr 4294715336], length 164
12:03:35.733910 IP vagrant-ubuntu-trusty-64.8882 > 10.0.0.2.50658: Flags [.], ack 1087471611, win 318, options [nop,nop,TS val 4294715381 ecr 4294715365], length 0
12:03:35.748760 IP 10.0.0.2.50658 > vagrant-ubuntu-trusty-64.8882: Flags [P.], seq 1087471611:1087471775, ack 433141433, win 58, options [nop,nop,TS val 4294715386 ecr 4294715356], length 164
12:03:35.748795 IP vagrant-ubuntu-trusty-64.8882 > 10.0.0.2.50658: Flags [.], ack 1087471775, win 321, options [nop,nop,TS val 4294715397 ecr 4294715386], length 0
12:03:35.768427 IP 10.0.0.2.50658 > vagrant-ubuntu-trusty-64.8882: Flags [P.], seq 1087471775:1087471939, ack 433141433, win 58, options [nop,nop,TS val 4294715406 ecr 4294715381], length 164
12:03:35.768493 IP vagrant-ubuntu-trusty-64.8882 > 10.0.0.2.50658: Flags [.], ack 1087471939, win 325, options [nop,nop,TS val 4294715416 ecr 4294715406], length 0
12:03:35.788349 IP 10.0.0.2.50658 > vagrant-ubuntu-trusty-64.8882: Flags [P.], seq 1087471939:1087472103, ack 433141433, win 58, options [nop,nop,TS val 4294715426 ecr 4294715397], length 164
12:03:35.788419 IP vagrant-ubuntu-trusty-64.8882 > 10.0.0.2.50658: Flags [.], ack 1087472103, win 328, options [nop,nop,TS val 4294715436 ecr 4294715426], length 0
12:03:35.816834 IP 10.0.0.2.50658 > vagrant-ubuntu-trusty-64.8882: Flags [P.], seq 1087472103:1087472267, ack 433141433, win 58, options [nop,nop,TS val 4294715446 ecr 4294715416], length 164
12:03:35.816882 IP vagrant-ubuntu-trusty-64.8882 > 10.0.0.2.50658: Flags [.], ack 1087472267, win 331, options [nop,nop,TS val 4294715464 ecr 4294715446], length 0
12:03:35.827684 IP 10.0.0.2.50658 > vagrant-ubuntu-trusty-64.8882: Flags [P.], seq 1087472267:1087472431, ack 433141433, win 58, options [nop,nop,TS val 4294715465 ecr 4294715436], length 164
12:03:35.827810 IP vagrant-ubuntu-trusty-64.8882 > 10.0.0.2.50658: Flags [.], ack 1087472431, win 334, options [nop,nop,TS val 4294715475 ecr 4294715465], length 0
12:03:35.848877 IP 10.0.0.2.50658 > vagrant-ubuntu-trusty-64.8882: Flags [P.], seq 1087472431:1087472595, ack 433141433, win 58, options [nop,nop,TS val 4294715486 ecr 4294715464], length 164
12:03:35.848906 IP vagrant-ubuntu-trusty-64.8882 > 10.0.0.2.50658: Flags [.], ack 1087472595, win 337, options [nop,nop,TS val 4294715497 ecr 4294715486], length 0
12:03:35.867418 IP 10.0.0.2.50658 > vagrant-ubuntu-trusty-64.8882: Flags [P.], seq 1087472595:1087472759, ack 433141433, win 58, options [nop,nop,TS val 4294715505 ecr 4294715475], length 164
12:03:35.867438 IP vagrant-ubuntu-trusty-64.8882 > 10.0.0.2.50658: Flags [.], ack 1087472759, win 341, options [nop,nop,TS val 4294715516 ecr 4294715505], length 0
12:03:35.887911 IP 10.0.0.2.50658 > vagrant-ubuntu-trusty-64.8882: Flags [P.], seq 1087472759:1087472923, ack 433141433, win 58, options [nop,nop,TS val 4294715526 ecr 4294715497], length 164
12:03:35.887920 IP vagrant-ubuntu-trusty-64.8882 > 10.0.0.2.50658: Flags [.], ack 1087472923, win 344, options [nop,nop,TS val 4294715536 ecr 4294715526], length 0
12:03:35.908670 IP 10.0.0.2.50658 > vagrant-ubuntu-trusty-64.8882: Flags [P.], seq 1087472923:1087473087, ack 433141433, win 58, options [nop,nop,TS val 4294715546 ecr 4294715516], length 164
12:03:35.908705 IP vagrant-ubuntu-trusty-64.8882 > 10.0.0.2.50658: Flags [.], ack 1087473087, win 347, options [nop,nop,TS val 4294715557 ecr 4294715546], length 0
12:03:35.928827 IP 10.0.0.2.50658 > vagrant-ubuntu-trusty-64.8882: Flags [P.], seq 1087473087:1087473251, ack 433141433, win 58, options [nop,nop,TS val 4294715566 ecr 4294715536], length 164
12:03:35.928876 IP vagrant-ubuntu-trusty-64.8882 > 10.0.0.2.50658: Flags [.], ack 1087473251, win 350, options [nop,nop,TS val 4294715577 ecr 4294715566], length 0
12:03:35.948836 IP 10.0.0.2.50658 > vagrant-ubuntu-trusty-64.8882: Flags [P.], seq 1087473251:1087473415, ack 433141433, win 58, options [nop,nop,TS val 4294715586 ecr 4294715557], length 164
12:03:35.948869 IP vagrant-ubuntu-trusty-64.8882 > 10.0.0.2.50658: Flags [.], ack 1087473415, win 353, options [nop,nop,TS val 4294715597 ecr 4294715586], length 0
12:03:35.967830 IP 10.0.0.2.50658 > vagrant-ubuntu-trusty-64.8882: Flags [P.], seq 1087473415:1087473579, ack 433141433, win 58, options [nop,nop,TS val 4294715606 ecr 4294715577], length 164
12:03:35.967841 IP vagrant-ubuntu-trusty-64.8882 > 10.0.0.2.50658: Flags [.], ack 1087473579, win 357, options [nop,nop,TS val 4294715616 ecr 4294715606], length 0
12:03:35.987867 IP 10.0.0.2.50658 > vagrant-ubuntu-trusty-64.8882: Flags [P.], seq 1087473579:1087473743, ack 433141433, win 58, options [nop,nop,TS val 4294715626 ecr 4294715597], length 164
12:03:35.987908 IP vagrant-ubuntu-trusty-64.8882 > 10.0.0.2.50658: Flags [.], ack 1087473743, win 358, options [nop,nop,TS val 4294715636 ecr 4294715626], length 0
12:03:36.008633 IP 10.0.0.2.50658 > vagrant-ubuntu-trusty-64.8882: Flags [P.], seq 1087473743:1087473907, ack 433141433, win 58, options [nop,nop,TS val 4294715646 ecr 4294715616], length 164
12:03:36.008667 IP vagrant-ubuntu-trusty-64.8882 > 10.0.0.2.50658: Flags [.], ack 1087473907, win 358, options [nop,nop,TS val 4294715657 ecr 4294715646], length 0
12:03:36.028788 IP 10.0.0.2.50658 > vagrant-ubuntu-trusty-64.8882: Flags [P.], seq 1087473907:1087474071, ack 433141433, win 58, options [nop,nop,TS val 4294715666 ecr 4294715636], length 164
12:03:36.028826 IP vagrant-ubuntu-trusty-64.8882 > 10.0.0.2.50658: Flags [.], ack 1087474071, win 358, options [nop,nop,TS val 4294715677 ecr 4294715666], length 0
12:03:36.047955 IP 10.0.0.2.50658 > vagrant-ubuntu-trusty-64.8882: Flags [P.], seq 1087474071:1087474235, ack 433141433, win 58, options [nop,nop,TS val 4294715686 ecr 4294715657], length 164
12:03:36.047965 IP vagrant-ubuntu-trusty-64.8882 > 10.0.0.2.50658: Flags [.], ack 1087474235, win 358, options [nop,nop,TS val 4294715696 ecr 4294715686], length 0
12:03:36.067361 IP 10.0.0.2.50658 > vagrant-ubuntu-trusty-64.8882: Flags [P.], seq 1087474235:1087474399, ack 433141433, win 58, options [nop,nop,TS val 4294715705 ecr 4294715677], length 164
12:03:36.067379 IP vagrant-ubuntu-trusty-64.8882 > 10.0.0.2.50658: Flags [.], ack 1087474399, win 358, options [nop,nop,TS val 4294715716 ecr 4294715705], length 0
12:03:36.088422 IP 10.0.0.2.50658 > vagrant-ubuntu-trusty-64.8882: Flags [P.], seq 1087474399:1087474563, ack 433141433, win 58, options [nop,nop,TS val 4294715726 ecr 4294715696], length 164
12:03:36.088474 IP vagrant-ubuntu-trusty-64.8882 > 10.0.0.2.50658: Flags [.], ack 1087474563, win 358, options [nop,nop,TS val 4294715736 ecr 4294715726], length 0
12:03:36.107897 IP 10.0.0.2.50658 > vagrant-ubuntu-trusty-64.8882: Flags [P.], seq 1087474563:1087474727, ack 433141433, win 58, options [nop,nop,TS val 4294715746 ecr 4294715716], length 164
12:03:36.107914 IP vagrant-ubuntu-trusty-64.8882 > 10.0.0.2.50658: Flags [.], ack 1087474727, win 358, options [nop,nop,TS val 4294715756 ecr 4294715746], length 0
12:03:36.127965 IP 10.0.0.2.50658 > vagrant-ubuntu-trusty-64.8882: Flags [P.], seq 1087474727:1087474891, ack 433141433, win 58, options [nop,nop,TS val 4294715766 ecr 4294715736], length 164
12:03:36.127982 IP vagrant-ubuntu-trusty-64.8882 > 10.0.0.2.50658: Flags [.], ack 1087474891, win 358, options [nop,nop,TS val 4294715776 ecr 4294715766], length 0
12:03:36.147836 IP 10.0.0.2.50658 > vagrant-ubuntu-trusty-64.8882: Flags [P.], seq 1087474891:1087475055, ack 433141433, win 58, options [nop,nop,TS val 4294715786 ecr 4294715756], length 164
12:03:36.147853 IP vagrant-ubuntu-trusty-64.8882 > 10.0.0.2.50658: Flags [.], ack 1087475055, win 358, options [nop,nop,TS val 4294715796 ecr 4294715786], length 0
12:03:36.167375 IP 10.0.0.2.50658 > vagrant-ubuntu-trusty-64.8882: Flags [P.], seq 1087475055:1087475219, ack 433141433, win 58, options [nop,nop,TS val 4294715805 ecr 4294715776], length 164
12:03:36.167391 IP vagrant-ubuntu-trusty-64.8882 > 10.0.0.2.50658: Flags [.], ack 1087475219, win 358, options [nop,nop,TS val 4294715816 ecr 4294715805], length 0
12:03:36.188741 IP 10.0.0.2.50658 > vagrant-ubuntu-trusty-64.8882: Flags [P.], seq 1087475219:1087475383, ack 433141433, win 58, options [nop,nop,TS val 4294715826 ecr 4294715816], length 164
12:03:36.188775 IP vagrant-ubuntu-trusty-64.8882 > 10.0.0.2.50658: Flags [.], ack 1087475383, win 358, options [nop,nop,TS val 4294715837 ecr 4294715826], length 0
12:03:36.207679 IP 10.0.0.2.50658 > vagrant-ubuntu-trusty-64.8882: Flags [P.], seq 1087475383:1087475547, ack 433141433, win 58, options [nop,nop,TS val 4294715845 ecr 4294715816], length 164
12:03:36.207721 IP vagrant-ubuntu-trusty-64.8882 > 10.0.0.2.50658: Flags [.], ack 1087475547, win 358, options [nop,nop,TS val 4294715856 ecr 4294715845], length 0
12:03:36.227981 IP 10.0.0.2.50658 > vagrant-ubuntu-trusty-64.8882: Flags [P.], seq 1087475547:1087475711, ack 433141433, win 58, options [nop,nop,TS val 4294715866 ecr 4294715837], length 164
12:03:36.227997 IP vagrant-ubuntu-trusty-64.8882 > 10.0.0.2.50658: Flags [.], ack 1087475711, win 358, options [nop,nop,TS val 4294715876 ecr 4294715866], length 0
12:03:36.247847 IP 10.0.0.2.50658 > vagrant-ubuntu-trusty-64.8882: Flags [P.], seq 1087475711:1087475875, ack 433141433, win 58, options [nop,nop,TS val 4294715886 ecr 4294715856], length 164
12:03:36.247864 IP vagrant-ubuntu-trusty-64.8882 > 10.0.0.2.50658: Flags [.], ack 1087475875, win 358, options [nop,nop,TS val 4294715896 ecr 4294715886], length 0
12:03:36.268193 IP 10.0.0.2.50658 > vagrant-ubuntu-trusty-64.8882: Flags [P.], seq 1087475875:1087476039, ack 433141433, win 58, options [nop,nop,TS val 4294715906 ecr 4294715876], length 164
12:03:36.268229 IP vagrant-ubuntu-trusty-64.8882 > 10.0.0.2.50658: Flags [.], ack 1087476039, win 358, options [nop,nop,TS val 4294715916 ecr 4294715906], length 0
12:03:36.287965 IP 10.0.0.2.50658 > vagrant-ubuntu-trusty-64.8882: Flags [P.], seq 1087476039:1087476203, ack 433141433, win 58, options [nop,nop,TS val 4294715926 ecr 4294715896], length 164
