12:15:23.520250 IP 10.0.0.1.8882 > vagrant-ubuntu-trusty-64.34384: Flags [.], ack 1796359217, win 59, options [nop,nop,TS val 4294714107 ecr 4294714096], length 0
12:15:23.538816 IP vagrant-ubuntu-trusty-64.34384 > 10.0.0.1.8882: Flags [P.], seq 1796359381:1796359545, ack 1603425228, win 58, options [nop,nop,TS val 4294714136 ecr 4294714107], length 164
12:15:23.540110 IP 10.0.0.1.8882 > vagrant-ubuntu-trusty-64.34384: Flags [.], ack 1796359381, win 61, options [nop,nop,TS val 4294714127 ecr 4294714116], length 0
12:15:23.558815 IP vagrant-ubuntu-trusty-64.34384 > 10.0.0.1.8882: Flags [P.], seq 1796359545:1796359709, ack 1603425228, win 58, options [nop,nop,TS val 4294714156 ecr 4294714127], length 164
12:15:23.559870 IP 10.0.0.1.8882 > vagrant-ubuntu-trusty-64.34384: Flags [.], ack 1796359545, win 63, options [nop,nop,TS val 4294714147 ecr 4294714136], length 0
12:15:23.579125 IP vagrant-ubuntu-trusty-64.34384 > 10.0.0.1.8882: Flags [P.], seq 1796359709:1796359873, ack 1603425228, win 58, options [nop,nop,TS val 4294714176 ecr 4294714147], length 164
12:15:23.579888 IP 10.0.0.1.8882 > vagrant-ubuntu-trusty-64.34384: Flags [.], ack 1796359709, win 65, options [nop,nop,TS val 4294714167 ecr 4294714156], length 0
12:15:23.599073 IP vagrant-ubuntu-trusty-64.34384 > 10.0.0.1.8882: Flags [P.], seq 1796359873:1796360037, ack 1603425228, win 58, options [nop,nop,TS val 4294714196 ecr 4294714167], length 164
12:15:23.599586 IP 10.0.0.1.8882 > vagrant-ubuntu-trusty-64.34384: Flags [.], ack 1796359873, win 68, options [nop,nop,TS val 4294714187 ecr 4294714176], length 0
12:15:23.619468 IP vagrant-ubuntu-trusty-64.34384 > 10.0.0.1.8882: Flags [P.], seq 1796360037:1796360201, ack 1603425228, win 58, options [nop,nop,TS val 4294714217 ecr 4294714187], length 164
12:15:23.619809 IP 10.0.0.1.8882 > vagrant-ubuntu-trusty-64.34384: Flags [.], ack 1796360037, win 70, options [nop,nop,TS val 4294714207 ecr 4294714196], length 0
12:15:23.638834 IP vagrant-ubuntu-trusty-64.34384 > 10.0.0.1.8882: Flags [P.], seq 1796360201:1796360365, ack 1603425228, win 58, options [nop,nop,TS val 4294714236 ecr 4294714207], length 164
12:15:23.640299 IP 10.0.0.1.8882 > vagrant-ubuntu-trusty-64.34384: Flags [.], ack 1796360201, win 72, options [nop,nop,TS val 4294714227 ecr 4294714217], length 0
12:15:23.659771 IP vagrant-ubuntu-trusty-64.34384 > 10.0.0.1.8882: Flags [P.], seq 1796360365:1796360529, ack 1603425228, win 58, options [nop,nop,TS val 4294714257 ecr 4294714227], length 164
12:15:23.666464 IP 10.0.0.1.8882 > vagrant-ubuntu-trusty-64.34384: Flags [.], ack 1796360365, win 74, options [nop,nop,TS val 4294714252 ecr 4294714236], length 0
12:15:23.678886 IP vagrant-ubuntu-trusty-64.34384 > 10.0.0.1.8882: Flags [P.], seq 1796360529:1796360693, ack 1603425228, win 58, options [nop,nop,TS val 4294714276 ecr 4294714252], length 164
12:15:23.694612 IP 10.0.0.1.8882 > vagrant-ubuntu-trusty-64.34384: Flags [.], ack 1796360529, win 76, options [nop,nop,TS val 4294714281 ecr 4294714257], length 0
12:15:23.699225 IP vagrant-ubuntu-trusty-64.34384 > 10.0.0.1.8882: Flags [P.], seq 1796360693:1796360857, ack 1603425228, win 58, options [nop,nop,TS val 4294714297 ecr 4294714281], length 164
12:15:23.718848 IP vagrant-ubuntu-trusty-64.34384 > 10.0.0.1.8882: Flags [P.], seq 1796360857:1796361021, ack 1603425228, win 58, options [nop,nop,TS val 4294714316 ecr 4294714281], length 164
12:15:23.721578 IP 10.0.0.1.8882 > vagrant-ubuntu-trusty-64.34384: Flags [.], ack 1796360693, win 78, options [nop,nop,TS val 4294714308 ecr 4294714276], length 0
12:15:23.738812 IP vagrant-ubuntu-trusty-64.34384 > 10.0.0.1.8882: Flags [P.], seq 1796361021:1796361185, ack 1603425228, win 58, options [nop,nop,TS val 4294714336 ecr 4294714308], length 164
12:15:23.749415 IP 10.0.0.1.8882 > vagrant-ubuntu-trusty-64.34384: Flags [.], ack 1796360857, win 80, options [nop,nop,TS val 4294714336 ecr 4294714297], length 0
12:15:23.758840 IP vagrant-ubuntu-trusty-64.34384 > 10.0.0.1.8882: Flags [P.], seq 1796361185:1796361349, ack 1603425228, win 58, options [nop,nop,TS val 4294714356 ecr 4294714336], length 164
12:15:23.778938 IP vagrant-ubuntu-trusty-64.34384 > 10.0.0.1.8882: Flags [P.], seq 1796361349:1796361513, ack 1603425228, win 58, options [nop,nop,TS val 4294714376 ecr 4294714336], length 164
12:15:23.788803 IP 10.0.0.1.8882 > vagrant-ubuntu-trusty-64.34384: Flags [.], ack 1796360857, win 82, options [nop,nop,TS val 4294714375 ecr 4294714297,nop,nop,sack 1 {1796361021:1796361185}], length 0
12:15:23.799786 IP vagrant-ubuntu-trusty-64.34384 > 10.0.0.1.8882: Flags [P.], seq 1796361513:1796361677, ack 1603425228, win 58, options [nop,nop,TS val 4294714397 ecr 4294714375], length 164
12:15:23.818841 IP vagrant-ubuntu-trusty-64.34384 > 10.0.0.1.8882: Flags [P.], seq 1796361677:1796361841, ack 1603425228, win 58, options [nop,nop,TS val 4294714416 ecr 4294714375], length 164
12:15:23.834566 IP 10.0.0.1.8882 > vagrant-ubuntu-trusty-64.34384: Flags [.], ack 1796360857, win 84, options [nop,nop,TS val 4294714421 ecr 4294714297,nop,nop,sack 2 {1796361513:1796361677}{1796361021:1796361185}], length 0
12:15:23.834647 IP vagrant-ubuntu-trusty-64.34384 > 10.0.0.1.8882: Flags [P.], seq 1796360857:1796361021, ack 1603425228, win 58, options [nop,nop,TS val 4294714431 ecr 4294714421], length 164
12:15:23.834688 IP vagrant-ubuntu-trusty-64.34384 > 10.0.0.1.8882: Flags [P.], seq 1796361185:1796361513, ack 1603425228, win 58, options [nop,nop,TS val 4294714431 ecr 4294714421], length 328
12:15:23.839305 IP vagrant-ubuntu-trusty-64.34384 > 10.0.0.1.8882: Flags [P.], seq 1796361841:1796362005, ack 1603425228, win 58, options [nop,nop,TS val 4294714437 ecr 4294714421], length 164
12:15:23.869588 IP 10.0.0.1.8882 > vagrant-ubuntu-trusty-64.34384: Flags [.], ack 1796361185, win 86, options [nop,nop,TS val 4294714455 ecr 4294714431,nop,nop,sack 1 {1796361513:1796361677}], length 0
12:15:23.869624 IP vagrant-ubuntu-trusty-64.34384 > 10.0.0.1.8882: Flags [P.], seq 1796362005:1796362169, ack 1603425228, win 58, options [nop,nop,TS val 4294714466 ecr 4294714455], length 164
12:15:23.869591 IP 10.0.0.1.8882 > vagrant-ubuntu-trusty-64.34384: Flags [.], ack 1796361677, win 88, options [nop,nop,TS val 4294714455 ecr 4294714431], length 0
12:15:23.874755 IP 10.0.0.1.8882 > vagrant-ubuntu-trusty-64.34384: Flags [.], ack 1796361677, win 91, options [nop,nop,TS val 4294714461 ecr 4294714431,nop,nop,sack 1 {1796361841:1796362005}], length 0
12:15:23.874821 IP vagrant-ubuntu-trusty-64.34384 > 10.0.0.1.8882: Flags [P.], seq 1796361677:1796361841, ack 1603425228, win 58, options [nop,nop,TS val 4294714472 ecr 4294714461], length 164
12:15:23.878872 IP vagrant-ubuntu-trusty-64.34384 > 10.0.0.1.8882: Flags [P.], seq 1796362169:1796362333, ack 1603425228, win 58, options [nop,nop,TS val 4294714476 ecr 4294714461], length 164
12:15:23.899579 IP 10.0.0.1.8882 > vagrant-ubuntu-trusty-64.34384: Flags [.], ack 1796361677, win 93, options [nop,nop,TS val 4294714487 ecr 4294714431,nop,nop,sack 1 {1796361841:1796362169}], length 0
12:15:23.899664 IP vagrant-ubuntu-trusty-64.34384 > 10.0.0.1.8882: Flags [P.], seq 1796362333:1796362497, ack 1603425228, win 58, options [nop,nop,TS val 4294714497 ecr 4294714487], length 164
12:15:23.901843 IP 10.0.0.1.8882 > vagrant-ubuntu-trusty-64.34384: Flags [.], ack 1796362169, win 95, options [nop,nop,TS val 4294714488 ecr 4294714472], length 0
12:15:23.911144 IP 10.0.0.1.8882 > vagrant-ubuntu-trusty-64.34384: Flags [.], ack 1796362333, win 97, options [nop,nop,TS val 4294714498 ecr 4294714476], length 0
12:15:23.918832 IP vagrant-ubuntu-trusty-64.34384 > 10.0.0.1.8882: Flags [P.], seq 1796362497:1796362661, ack 1603425228, win 58, options [nop,nop,TS val 4294714516 ecr 4294714498], length 164
12:15:23.921639 IP 10.0.0.1.8882 > vagrant-ubuntu-trusty-64.34384: Flags [.], ack 1796362497, win 99, options [nop,nop,TS val 4294714508 ecr 4294714497], length 0
12:15:23.938915 IP vagrant-ubuntu-trusty-64.34384 > 10.0.0.1.8882: Flags [P.], seq 1796362661:1796362825, ack 1603425228, win 58, options [nop,nop,TS val 4294714536 ecr 4294714508], length 164
12:15:23.938970 IP 10.0.0.1.8882 > vagrant-ubuntu-trusty-64.34384: Flags [.], ack 1796362661, win 101, options [nop,nop,TS val 4294714526 ecr 4294714516], length 0
12:15:23.959918 IP vagrant-ubuntu-trusty-64.34384 > 10.0.0.1.8882: Flags [P.], seq 1796362825:1796362989, ack 1603425228, win 58, options [nop,nop,TS val 4294714557 ecr 4294714526], length 164
12:15:23.965569 IP 10.0.0.1.8882 > vagrant-ubuntu-trusty-64.34384: Flags [.], ack 1796362825, win 103, options [nop,nop,TS val 4294714552 ecr 4294714536], length 0
12:15:23.978989 IP vagrant-ubuntu-trusty-64.34384 > 10.0.0.1.8882: Flags [P.], seq 1796362989:1796363153, ack 1603425228, win 58, options [nop,nop,TS val 4294714576 ecr 4294714552], length 164
12:15:23.998849 IP vagrant-ubuntu-trusty-64.34384 > 10.0.0.1.8882: Flags [P.], seq 1796363153:1796363317, ack 1603425228, win 58, options [nop,nop,TS val 4294714596 ecr 4294714552], length 164
12:15:24.004750 IP 10.0.0.1.8882 > vagrant-ubuntu-trusty-64.34384: Flags [.], ack 1796362989, win 105, options [nop,nop,TS val 4294714591 ecr 4294714557], length 0
12:15:24.020056 IP vagrant-ubuntu-trusty-64.34384 > 10.0.0.1.8882: Flags [P.], seq 1796363317:1796363481, ack 1603425228, win 58, options [nop,nop,TS val 4294714617 ecr 4294714591], length 164
12:15:24.023635 IP 10.0.0.1.8882 > vagrant-ubuntu-trusty-64.34384: Flags [.], ack 1796363153, win 107, options [nop,nop,TS val 4294714610 ecr 4294714576], length 0
12:15:24.038831 IP vagrant-ubuntu-trusty-64.34384 > 10.0.0.1.8882: Flags [P.], seq 1796363481:1796363645, ack 1603425228, win 58, options [nop,nop,TS val 4294714636 ecr 4294714610], length 164
12:15:24.045533 IP 10.0.0.1.8882 > vagrant-ubuntu-trusty-64.34384: Flags [.], ack 1796363317, win 109, options [nop,nop,TS val 4294714632 ecr 4294714596], length 0
12:15:24.059471 IP vagrant-ubuntu-trusty-64.34384 > 10.0.0.1.8882: Flags [P.], seq 1796363645:1796363809, ack 1603425228, win 58, options [nop,nop,TS val 4294714657 ecr 4294714632], length 164
12:15:24.066965 IP 10.0.0.1.8882 > vagrant-ubuntu-trusty-64.34384: Flags [.], ack 1796363481, win 111, options [nop,nop,TS val 4294714653 ecr 4294714617], length 0
12:15:24.078885 IP vagrant-ubuntu-trusty-64.34384 > 10.0.0.1.8882: Flags [P.], seq 1796363809:1796363973, ack 1603425228, win 58, options [nop,nop,TS val 4294714676 ecr 4294714653], length 164
12:15:24.092920 IP 10.0.0.1.8882 > vagrant-ubuntu-trusty-64.34384: Flags [.], ack 1796363481, win 114, options [nop,nop,TS val 4294714680 ecr 4294714617,nop,nop,sack 1 {1796363645:1796363809}], length 0
12:15:24.098819 IP vagrant-ubuntu-trusty-64.34384 > 10.0.0.1.8882: Flags [P.], seq 1796363973:1796364137, ack 1603425228, win 58, options [nop,nop,TS val 4294714696 ecr 4294714680], length 164
12:15:24.109647 IP 10.0.0.1.8882 > vagrant-ubuntu-trusty-64.34384: Flags [.], ack 1796363481, win 116, options [nop,nop,TS val 4294714696 ecr 4294714617,nop,nop,sack 1 {1796363645:1796363973}], length 0
12:15:24.119451 IP vagrant-ubuntu-trusty-64.34384 > 10.0.0.1.8882: Flags [P.], seq 1796364137:1796364301, ack 1603425228, win 58, options [nop,nop,TS val 4294714717 ecr 4294714696], length 164
12:15:24.127196 IP 10.0.0.1.8882 > vagrant-ubuntu-trusty-64.34384: Flags [.], ack 1796363481, win 118, options [nop,nop,TS val 4294714714 ecr 4294714617,nop,nop,sack 1 {1796363645:1796364137}], length 0
12:15:24.127217 IP vagrant-ubuntu-trusty-64.34384 > 10.0.0.1.8882: Flags [P.], seq 1796363481:1796363645, ack 1603425228, win 58, options [nop,nop,TS val 4294714725 ecr 4294714714], length 164
12:15:24.138817 IP vagrant-ubuntu-trusty-64.34384 > 10.0.0.1.8882: Flags [P.], seq 1796364301:1796364465, ack 1603425228, win 58, options [nop,nop,TS val 4294714736 ecr 4294714714], length 164
12:15:24.142657 IP 10.0.0.1.8882 > vagrant-ubuntu-trusty-64.34384: Flags [.], ack 1796363481, win 120, options [nop,nop,TS val 4294714729 ecr 4294714617,nop,nop,sack 1 {1796363645:1796364301}], length 0
12:15:24.150935 IP 10.0.0.1.8882 > vagrant-ubuntu-trusty-64.34384: Flags [.], ack 1796364301, win 122, options [nop,nop,TS val 4294714737 ecr 4294714725], length 0
12:15:24.158903 IP vagrant-ubuntu-trusty-64.34384 > 10.0.0.1.8882: Flags [P.], seq 1796364465:1796364629, ack 1603425228, win 58, options [nop,nop,TS val 4294714756 ecr 4294714737], length 164
12:15:24.164047 IP 10.0.0.1.8882 > vagrant-ubuntu-trusty-64.34384: Flags [.], ack 1796364465, win 124, options [nop,nop,TS val 4294714751 ecr 4294714736], length 0
12:15:24.178812 IP vagrant-ubuntu-trusty-64.34384 > 10.0.0.1.8882: Flags [P.], seq 1796364629:1796364793, ack 1603425228, win 58, options [nop,nop,TS val 4294714776 ecr 4294714751], length 164
12:15:24.186662 IP 10.0.0.1.8882 > vagrant-ubuntu-trusty-64.34384: Flags [.], ack 1796364629, win 126, options [nop,nop,TS val 4294714773 ecr 4294714756], length 0
12:15:24.198878 IP vagrant-ubuntu-trusty-64.34384 > 10.0.0.1.8882: Flags [P.], seq 1796364793:1796364957, ack 1603425228, win 58, options [nop,nop,TS val 4294714796 ecr 4294714773], length 164
12:15:24.203999 IP 10.0.0.1.8882 > vagrant-ubuntu-trusty-64.34384: Flags [.], ack 1796364793, win 128, options [nop,nop,TS val 4294714791 ecr 4294714776], length 0
12:15:24.218959 IP vagrant-ubuntu-trusty-64.34384 > 10.0.0.1.8882: Flags [P.], seq 1796364957:1796365121, ack 1603425228, win 58, options [nop,nop,TS val 4294714816 ecr 4294714791], length 164
12:15:24.225096 IP 10.0.0.1.8882 > vagrant-ubuntu-trusty-64.34384: Flags [.], ack 1796364957, win 130, options [nop,nop,TS val 4294714812 ecr 4294714796], length 0
12:15:24.238821 IP vagrant-ubuntu-trusty-64.34384 > 10.0.0.1.8882: Flags [P.], seq 1796365121:1796365285, ack 1603425228, win 58, options [nop,nop,TS val 4294714836 ecr 4294714812], length 164
12:15:24.243950 IP 10.0.0.1.8882 > vagrant-ubuntu-trusty-64.34384: Flags [.], ack 1796365121, win 132, options [nop,nop,TS val 4294714831 ecr 4294714816], length 0
12:15:24.258939 IP vagrant-ubuntu-trusty-64.34384 > 10.0.0.1.8882: Flags [P.], seq 1796365285:1796365449, ack 1603425228, win 58, options [nop,nop,TS val 4294714856 ecr 4294714831], length 164
12:15:24.265689 IP 10.0.0.1.8882 > vagrant-ubuntu-trusty-64.34384: Flags [.], ack 1796365285, win 135, options [nop,nop,TS val 4294714852 ecr 4294714836], length 0
12:15:24.278798 IP vagrant-ubuntu-trusty-64.34384 > 10.0.0.1.8882: Flags [P.], seq 1796365449:1796365613, ack 1603425228, win 58, options [nop,nop,TS val 4294714876 ecr 4294714852], length 164
12:15:24.284035 IP 10.0.0.1.8882 > vagrant-ubuntu-trusty-64.34384: Flags [.], ack 1796365449, win 137, options [nop,nop,TS val 4294714871 ecr 4294714856], length 0
12:15:24.299788 IP vagrant-ubuntu-trusty-64.34384 > 10.0.0.1.8882: Flags [P.], seq 1796365613:1796365777, ack 1603425228, win 58, options [nop,nop,TS val 4294714897 ecr 4294714871], length 164
12:15:24.304960 IP 10.0.0.1.8882 > vagrant-ubuntu-trusty-64.34384: Flags [.], ack 1796365613, win 139, options [nop,nop,TS val 4294714892 ecr 4294714876], length 0
12:15:24.318903 IP vagrant-ubuntu-trusty-64.34384 > 10.0.0.1.8882: Flags [P.], seq 1796365777:1796365941, ack 1603425228, win 58, options [nop,nop,TS val 4294714916 ecr 4294714892], length 164
12:15:24.327843 IP 10.0.0.1.8882 > vagrant-ubuntu-trusty-64.34384: Flags [.], ack 1796365777, win 141, options [nop,nop,TS val 4294714914 ecr 4294714897], length 0
12:15:24.338826 IP vagrant-ubuntu-trusty-64.34384 > 10.0.0.1.8882: Flags [P.], seq 1796365941:1796366105, ack 1603425228, win 58, options [nop,nop,TS val 4294714936 ecr 4294714914], length 164
12:15:24.348847 IP 10.0.0.1.8882 > vagrant-ubuntu-trusty-64.34384: Flags [.], ack 1796365941, win 143, options [nop,nop,TS val 4294714935 ecr 4294714916], length 0
12:15:24.359085 IP vagrant-ubuntu-trusty-64.34384 > 10.0.0.1.8882: Flags [P.], seq 1796366105:1796366269, ack 1603425228, win 58, options [nop,nop,TS val 4294714957 ecr 4294714935], length 164
12:15:24.365855 IP 10.0.0.1.8882 > vagrant-ubuntu-trusty-64.34384: Flags [.], ack 1796366105, win 145, options [nop,nop,TS val 4294714953 ecr 4294714936], length 0
12:15:24.378865 IP vagrant-ubuntu-trusty-64.34384 > 10.0.0.1.8882: Flags [P.], seq 1796366269:1796366433, ack 1603425228, win 58, options [nop,nop,TS val 4294714976 ecr 4294714953], length 164
12:15:24.388601 IP 10.0.0.1.8882 > vagrant-ubuntu-trusty-64.34384: Flags [.], ack 1796366269, win 147, options [nop,nop,TS val 4294714975 ecr 4294714957], length 0
12:15:24.398877 IP vagrant-ubuntu-trusty-64.34384 > 10.0.0.1.8882: Flags [P.], seq 1796366433:1796366597, ack 1603425228, win 58, options [nop,nop,TS val 4294714996 ecr 4294714975], length 164
12:15:24.409120 IP 10.0.0.1.8882 > vagrant-ubuntu-trusty-64.34384: Flags [.], ack 1796366433, win 149, options [nop,nop,TS val 4294714996 ecr 4294714976], length 0
12:15:24.418900 IP vagrant-ubuntu-trusty-64.34384 > 10.0.0.1.8882: Flags [P.], seq 1796366597:1796366761, ack 1603425228, win 58, options [nop,nop,TS val 4294715016 ecr 4294714996], length 164
12:15:24.428888 IP 10.0.0.1.8882 > vagrant-ubuntu-trusty-64.34384: Flags [.], ack 1796366597, win 151, options [nop,nop,TS val 4294715015 ecr 4294714996], length 0
12:15:24.438971 IP vagrant-ubuntu-trusty-64.34384 > 10.0.0.1.8882: Flags [P.], seq 1796366761:1796366925, ack 1603425228, win 58, options [nop,nop,TS val 4294715036 ecr 4294715015], length 164
12:15:24.447021 IP 10.0.0.1.8882 > vagrant-ubuntu-trusty-64.34384: Flags [.], ack 1796366761, win 153, options [nop,nop,TS val 4294715033 ecr 4294715016], length 0
12:15:24.458798 IP vagrant-ubuntu-trusty-64.34384 > 10.0.0.1.8882: Flags [P.], seq 1796366925:1796367089, ack 1603425228, win 58, options [nop,nop,TS val 4294715056 ecr 4294715033], length 164
12:15:24.467180 IP 10.0.0.1.8882 > vagrant-ubuntu-trusty-64.34384: Flags [.], ack 1796366925, win 155, options [nop,nop,TS val 4294715054 ecr 4294715036], length 0
12:15:24.478872 IP vagrant-ubuntu-trusty-64.34384 > 10.0.0.1.8882: Flags [P.], seq 1796367089:1796367253, ack 1603425228, win 58, options [nop,nop,TS val 4294715076 ecr 4294715054], length 164
12:15:24.489035 IP 10.0.0.1.8882 > vagrant-ubuntu-trusty-64.34384: Flags [.], ack 1796367089, win 158, options [nop,nop,TS val 4294715076 ecr 4294715056], length 0
12:15:24.499142 IP vagrant-ubuntu-trusty-64.34384 > 10.0.0.1.8882: Flags [P.], seq 1796367253:1796367417, ack 1603425228, win 58, options [nop,nop,TS val 4294715097 ecr 4294715076], length 164
12:15:24.507231 IP 10.0.0.1.8882 > vagrant-ubuntu-trusty-64.34384: Flags [.], ack 1796367253, win 160, options [nop,nop,TS val 4294715094 ecr 4294715076], length 0
12:15:24.519182 IP vagrant-ubuntu-trusty-64.34384 > 10.0.0.1.8882: Flags [P.], seq 1796367417:1796367581, ack 1603425228, win 58, options [nop,nop,TS val 4294715117 ecr 4294715094], length 164
12:15:24.530126 IP 10.0.0.1.8882 > vagrant-ubuntu-trusty-64.34384: Flags [.], ack 1796367417, win 162, options [nop,nop,TS val 4294715117 ecr 4294715097], length 0
12:15:24.538935 IP vagrant-ubuntu-trusty-64.34384 > 10.0.0.1.8882: Flags [P.], seq 1796367581:1796367745, ack 1603425228, win 58, options [nop,nop,TS val 4294715136 ecr 4294715117], length 164
12:15:24.541250 IP 10.0.0.1.8882 > vagrant-ubuntu-trusty-64.34384: Flags [.], ack 1796367581, win 164, options [nop,nop,TS val 4294715129 ecr 4294715117], length 0
12:15:24.558928 IP vagrant-ubuntu-trusty-64.34384 > 10.0.0.1.8882: Flags [P.], seq 1796367745:1796367909, ack 1603425228, win 58, options [nop,nop,TS val 4294715156 ecr 4294715129], length 164
12:15:24.560718 IP 10.0.0.1.8882 > vagrant-ubuntu-trusty-64.34384: Flags [.], ack 1796367745, win 166, options [nop,nop,TS val 4294715147 ecr 4294715136], length 0
12:15:24.579243 IP vagrant-ubuntu-trusty-64.34384 > 10.0.0.1.8882: Flags [P.], seq 1796367909:1796368073, ack 1603425228, win 58, options [nop,nop,TS val 4294715177 ecr 4294715147], length 164
12:15:24.579330 IP 10.0.0.1.8882 > vagrant-ubuntu-trusty-64.34384: Flags [.], ack 1796367909, win 168, options [nop,nop,TS val 4294715166 ecr 4294715156], length 0
12:15:24.599064 IP vagrant-ubuntu-trusty-64.34384 > 10.0.0.1.8882: Flags [P.], seq 1796368073:1796368237, ack 1603425228, win 58, options [nop,nop,TS val 4294715196 ecr 4294715166], length 164
12:15:24.600687 IP 10.0.0.1.8882 > vagrant-ubuntu-trusty-64.34384: Flags [.], ack 1796368073, win 170, options [nop,nop,TS val 4294715187 ecr 4294715177], length 0
12:15:24.618843 IP vagrant-ubuntu-trusty-64.34384 > 10.0.0.1.8882: Flags [P.], seq 1796368237:1796368401, ack 1603425228, win 58, options [nop,nop,TS val 4294715216 ecr 4294715187], length 164
12:15:24.620040 IP 10.0.0.1.8882 > vagrant-ubuntu-trusty-64.34384: Flags [.], ack 1796368237, win 172, options [nop,nop,TS val 4294715207 ecr 4294715196], length 0
12:15:24.639119 IP 10.0.0.1.8882 > vagrant-ubuntu-trusty-64.34384: Flags [.], ack 1796368401, win 174, options [nop,nop,TS val 4294715226 ecr 4294715216], length 0
12:15:24.639137 IP vagrant-ubuntu-trusty-64.34384 > 10.0.0.1.8882: Flags [P.], seq 1796368401:1796368565, ack 1603425228, win 58, options [nop,nop,TS val 4294715237 ecr 4294715207], length 164
12:15:24.659123 IP vagrant-ubuntu-trusty-64.34384 > 10.0.0.1.8882: Flags [P.], seq 1796368565:1796368729, ack 1603425228, win 58, options [nop,nop,TS val 4294715257 ecr 4294715226], length 164
12:15:24.660091 IP 10.0.0.1.8882 > vagrant-ubuntu-trusty-64.34384: Flags [.], ack 1796368565, win 176, options [nop,nop,TS val 4294715247 ecr 4294715237], length 0
12:15:24.678917 IP vagrant-ubuntu-trusty-64.34384 > 10.0.0.1.8882: Flags [P.], seq 1796368729:1796368893, ack 1603425228, win 58, options [nop,nop,TS val 4294715276 ecr 4294715247], length 164
12:15:24.680922 IP 10.0.0.1.8882 > vagrant-ubuntu-trusty-64.34384: Flags [.], ack 1796368729, win 178, options [nop,nop,TS val 4294715267 ecr 4294715257], length 0
12:15:24.699205 IP vagrant-ubuntu-trusty-64.34384 > 10.0.0.1.8882: Flags [P.], seq 1796368893:1796369057, ack 1603425228, win 58, options [nop,nop,TS val 4294715296 ecr 4294715267], length 164
12:15:24.704844 IP 10.0.0.1.8882 > vagrant-ubuntu-trusty-64.34384: Flags [.], ack 1796368893, win 181, options [nop,nop,TS val 4294715291 ecr 4294715276], length 0
12:15:24.718848 IP vagrant-ubuntu-trusty-64.34384 > 10.0.0.1.8882: Flags [P.], seq 1796369057:1796369221, ack 1603425228, win 58, options [nop,nop,TS val 4294715316 ecr 4294715291], length 164
12:15:24.721039 IP 10.0.0.1.8882 > vagrant-ubuntu-trusty-64.34384: Flags [.], ack 1796369057, win 183, options [nop,nop,TS val 4294715307 ecr 4294715296], length 0
12:15:24.738792 IP vagrant-ubuntu-trusty-64.34384 > 10.0.0.1.8882: Flags [P.], seq 1796369221:1796369385, ack 1603425228, win 58, options [nop,nop,TS val 4294715336 ecr 4294715307], length 164
12:15:24.739091 IP 10.0.0.1.8882 > vagrant-ubuntu-trusty-64.34384: Flags [.], ack 1796369221, win 185, options [nop,nop,TS val 4294715326 ecr 4294715316], length 0
12:15:24.758926 IP vagrant-ubuntu-trusty-64.34384 > 10.0.0.1.8882: Flags [P.], seq 1796369385:1796369549, ack 1603425228, win 58, options [nop,nop,TS val 4294715356 ecr 4294715326], length 164
12:15:24.760130 IP 10.0.0.1.8882 > vagrant-ubuntu-trusty-64.34384: Flags [.], ack 1796369385, win 187, options [nop,nop,TS val 4294715347 ecr 4294715336], length 0
12:15:24.779484 IP 10.0.0.1.8882 > vagrant-ubuntu-trusty-64.34384: Flags [.], ack 1796369549, win 189, options [nop,nop,TS val 4294715366 ecr 4294715356], length 0
12:15:24.779558 IP vagrant-ubuntu-trusty-64.34384 > 10.0.0.1.8882: Flags [P.], seq 1796369549:1796369713, ack 1603425228, win 58, options [nop,nop,TS val 4294715377 ecr 4294715347], length 164
12:15:24.799290 IP vagrant-ubuntu-trusty-64.34384 > 10.0.0.1.8882: Flags [P.], seq 1796369713:1796369877, ack 1603425228, win 58, options [nop,nop,TS val 4294715397 ecr 4294715366], length 164
12:15:24.800320 IP 10.0.0.1.8882 > vagrant-ubuntu-trusty-64.34384: Flags [.], ack 1796369713, win 191, options [nop,nop,TS val 4294715387 ecr 4294715377], length 0
12:15:24.818828 IP vagrant-ubuntu-trusty-64.34384 > 10.0.0.1.8882: Flags [P.], seq 1796369877:1796370041, ack 1603425228, win 58, options [nop,nop,TS val 4294715416 ecr 4294715387], length 164
12:15:24.820173 IP 10.0.0.1.8882 > vagrant-ubuntu-trusty-64.34384: Flags [.], ack 1796369877, win 193, options [nop,nop,TS val 4294715407 ecr 4294715397], length 0
12:15:24.838824 IP vagrant-ubuntu-trusty-64.34384 > 10.0.0.1.8882: Flags [P.], seq 1796370041:1796370205, ack 1603425228, win 58, options [nop,nop,TS val 4294715436 ecr 4294715407], length 164
12:15:24.838971 IP 10.0.0.1.8882 > vagrant-ubuntu-trusty-64.34384: Flags [.], ack 1796370041, win 195, options [nop,nop,TS val 4294715426 ecr 4294715416], length 0
12:15:24.858807 IP vagrant-ubuntu-trusty-64.34384 > 10.0.0.1.8882: Flags [P.], seq 1796370205:1796370369, ack 1603425228, win 58, options [nop,nop,TS val 4294715456 ecr 4294715426], length 164
12:15:24.859000 IP 10.0.0.1.8882 > vagrant-ubuntu-trusty-64.34384: Flags [.], ack 1796370205, win 197, options [nop,nop,TS val 4294715446 ecr 4294715436], length 0
12:15:24.878814 IP vagrant-ubuntu-trusty-64.34384 > 10.0.0.1.8882: Flags [P.], seq 1796370369:1796370533, ack 1603425228, win 58, options [nop,nop,TS val 4294715476 ecr 4294715446], length 164
12:15:24.885280 IP 10.0.0.1.8882 > vagrant-ubuntu-trusty-64.34384: Flags [.], ack 1796370369, win 199, options [nop,nop,TS val 4294715473 ecr 4294715456], length 0
12:15:24.899112 IP 10.0.0.1.8882 > vagrant-ubuntu-trusty-64.34384: Flags [.], ack 1796370533, win 202, options [nop,nop,TS val 4294715486 ecr 4294715476], length 0
12:15:24.899142 IP vagrant-ubuntu-trusty-64.34384 > 10.0.0.1.8882: Flags [P.], seq 1796370533:1796370697, ack 1603425228, win 58, options [nop,nop,TS val 4294715497 ecr 4294715486], length 164
12:15:24.918824 IP vagrant-ubuntu-trusty-64.34384 > 10.0.0.1.8882: Flags [P.], seq 1796370697:1796370861, ack 1603425228, win 58, options [nop,nop,TS val 4294715516 ecr 4294715486], length 164
12:15:24.921404 IP 10.0.0.1.8882 > vagrant-ubuntu-trusty-64.34384: Flags [.], ack 1796370697, win 204, options [nop,nop,TS val 4294715507 ecr 4294715497], length 0
12:15:24.938960 IP vagrant-ubuntu-trusty-64.34384 > 10.0.0.1.8882: Flags [P.], seq 1796370861:1796371025, ack 1603425228, win 58, options [nop,nop,TS val 4294715536 ecr 4294715507], length 164
12:15:24.939380 IP 10.0.0.1.8882 > vagrant-ubuntu-trusty-64.34384: Flags [.], ack 1796370861, win 206, options [nop,nop,TS val 4294715526 ecr 4294715516], length 0
12:15:24.958815 IP vagrant-ubuntu-trusty-64.34384 > 10.0.0.1.8882: Flags [P.], seq 1796371025:1796371189, ack 1603425228, win 58, options [nop,nop,TS val 4294715556 ecr 4294715526], length 164
12:15:24.960258 IP 10.0.0.1.8882 > vagrant-ubuntu-trusty-64.34384: Flags [.], ack 1796371025, win 208, options [nop,nop,TS val 4294715547 ecr 4294715536], length 0
12:15:24.979054 IP vagrant-ubuntu-trusty-64.34384 > 10.0.0.1.8882: Flags [P.], seq 1796371189:1796371353, ack 1603425228, win 58, options [nop,nop,TS val 4294715576 ecr 4294715547], length 164
12:15:24.979120 IP 10.0.0.1.8882 > vagrant-ubuntu-trusty-64.34384: Flags [.], ack 1796371189, win 210, options [nop,nop,TS val 4294715566 ecr 4294715556], length 0
12:15:24.999282 IP vagrant-ubuntu-trusty-64.34384 > 10.0.0.1.8882: Flags [P.], seq 1796371353:1796371517, ack 1603425228, win 58, options [nop,nop,TS val 4294715596 ecr 4294715566], length 164
12:15:24.999412 IP 10.0.0.1.8882 > vagrant-ubuntu-trusty-64.34384: Flags [.], ack 1796371353, win 212, options [nop,nop,TS val 4294715587 ecr 4294715576], length 0
12:15:25.019328 IP vagrant-ubuntu-trusty-64.34384 > 10.0.0.1.8882: Flags [P.], seq 1796371517:1796371681, ack 1603425228, win 58, options [nop,nop,TS val 4294715617 ecr 4294715587], length 164
12:15:25.019493 IP 10.0.0.1.8882 > vagrant-ubuntu-trusty-64.34384: Flags [.], ack 1796371517, win 214, options [nop,nop,TS val 4294715607 ecr 4294715596], length 0
12:15:25.039282 IP vagrant-ubuntu-trusty-64.34384 > 10.0.0.1.8882: Flags [P.], seq 1796371681:1796371845, ack 1603425228, win 58, options [nop,nop,TS val 4294715637 ecr 4294715607], length 164
12:15:25.040379 IP 10.0.0.1.8882 > vagrant-ubuntu-trusty-64.34384: Flags [.], ack 1796371681, win 216, options [nop,nop,TS val 4294715627 ecr 4294715617], length 0
12:15:25.058824 IP vagrant-ubuntu-trusty-64.34384 > 10.0.0.1.8882: Flags [P.], seq 1796371845:1796372009, ack 1603425228, win 58, options [nop,nop,TS val 4294715656 ecr 4294715627], length 164
12:15:25.061625 IP 10.0.0.1.8882 > vagrant-ubuntu-trusty-64.34384: Flags [.], ack 1796371845, win 218, options [nop,nop,TS val 4294715648 ecr 4294715637], length 0
12:15:25.078812 IP vagrant-ubuntu-trusty-64.34384 > 10.0.0.1.8882: Flags [P.], seq 1796372009:1796372173, ack 1603425228, win 58, options [nop,nop,TS val 4294715676 ecr 4294715648], length 164
12:15:25.078991 IP 10.0.0.1.8882 > vagrant-ubuntu-trusty-64.34384: Flags [.], ack 1796372009, win 220, options [nop,nop,TS val 4294715666 ecr 4294715656], length 0
12:15:25.099432 IP 10.0.0.1.8882 > vagrant-ubuntu-trusty-64.34384: Flags [.], ack 1796372173, win 222, options [nop,nop,TS val 4294715686 ecr 4294715676], length 0
12:15:25.099507 IP vagrant-ubuntu-trusty-64.34384 > 10.0.0.1.8882: Flags [P.], seq 1796372173:1796372337, ack 1603425228, win 58, options [nop,nop,TS val 4294715697 ecr 4294715686], length 164
12:15:25.118775 IP vagrant-ubuntu-trusty-64.34384 > 10.0.0.1.8882: Flags [P.], seq 1796372337:1796372501, ack 1603425228, win 58, options [nop,nop,TS val 4294715716 ecr 4294715686], length 164
12:15:25.120662 IP 10.0.0.1.8882 > vagrant-ubuntu-trusty-64.34384: Flags [.], ack 1796372337, win 225, options [nop,nop,TS val 4294715708 ecr 4294715697], length 0
12:15:25.139619 IP vagrant-ubuntu-trusty-64.34384 > 10.0.0.1.8882: Flags [P.], seq 1796372501:1796372665, ack 1603425228, win 58, options [nop,nop,TS val 4294715737 ecr 4294715708], length 164
12:15:25.140408 IP 10.0.0.1.8882 > vagrant-ubuntu-trusty-64.34384: Flags [.], ack 1796372501, win 227, options [nop,nop,TS val 4294715727 ecr 4294715716], length 0
12:15:25.159512 IP vagrant-ubuntu-trusty-64.34384 > 10.0.0.1.8882: Flags [P.], seq 1796372665:1796372829, ack 1603425228, win 58, options [nop,nop,TS val 4294715757 ecr 4294715727], length 164
12:15:25.161110 IP 10.0.0.1.8882 > vagrant-ubuntu-trusty-64.34384: Flags [.], ack 1796372665, win 229, options [nop,nop,TS val 4294715748 ecr 4294715737], length 0
12:15:25.179351 IP vagrant-ubuntu-trusty-64.34384 > 10.0.0.1.8882: Flags [P.], seq 1796372829:1796372993, ack 1603425228, win 58, options [nop,nop,TS val 4294715777 ecr 4294715748], length 164
12:15:25.181175 IP 10.0.0.1.8882 > vagrant-ubuntu-trusty-64.34384: Flags [.], ack 1796372829, win 231, options [nop,nop,TS val 4294715768 ecr 4294715757], length 0
12:15:25.199207 IP vagrant-ubuntu-trusty-64.34384 > 10.0.0.1.8882: Flags [P.], seq 1796372993:1796373157, ack 1603425228, win 58, options [nop,nop,TS val 4294715797 ecr 4294715768], length 164
12:15:25.199562 IP 10.0.0.1.8882 > vagrant-ubuntu-trusty-64.34384: Flags [.], ack 1796372993, win 233, options [nop,nop,TS val 4294715787 ecr 4294715777], length 0
12:15:25.219302 IP vagrant-ubuntu-trusty-64.34384 > 10.0.0.1.8882: Flags [P.], seq 1796373157:1796373321, ack 1603425228, win 58, options [nop,nop,TS val 4294715817 ecr 4294715787], length 164
12:15:25.220915 IP 10.0.0.1.8882 > vagrant-ubuntu-trusty-64.34384: Flags [.], ack 1796373157, win 235, options [nop,nop,TS val 4294715808 ecr 4294715797], length 0
12:15:25.239201 IP vagrant-ubuntu-trusty-64.34384 > 10.0.0.1.8882: Flags [P.], seq 1796373321:1796373485, ack 1603425228, win 58, options [nop,nop,TS val 4294715837 ecr 4294715808], length 164
12:15:25.240024 IP 10.0.0.1.8882 > vagrant-ubuntu-trusty-64.34384: Flags [.], ack 1796373321, win 237, options [nop,nop,TS val 4294715827 ecr 4294715817], length 0
12:15:25.259371 IP vagrant-ubuntu-trusty-64.34384 > 10.0.0.1.8882: Flags [P.], seq 1796373485:1796373649, ack 1603425228, win 58, options [nop,nop,TS val 4294715857 ecr 4294715827], length 164
12:15:25.259433 IP 10.0.0.1.8882 > vagrant-ubuntu-trusty-64.34384: Flags [.], ack 1796373485, win 239, options [nop,nop,TS val 4294715847 ecr 4294715837], length 0
12:15:25.279392 IP vagrant-ubuntu-trusty-64.34384 > 10.0.0.1.8882: Flags [P.], seq 1796373649:1796373813, ack 1603425228, win 58, options [nop,nop,TS val 4294715877 ecr 4294715847], length 164
12:15:25.280151 IP 10.0.0.1.8882 > vagrant-ubuntu-trusty-64.34384: Flags [.], ack 1796373649, win 241, options [nop,nop,TS val 4294715867 ecr 4294715857], length 0
12:15:25.299254 IP vagrant-ubuntu-trusty-64.34384 > 10.0.0.1.8882: Flags [P.], seq 1796373813:1796373977, ack 1603425228, win 58, options [nop,nop,TS val 4294715897 ecr 4294715867], length 164
12:15:25.305135 IP 10.0.0.1.8882 > vagrant-ubuntu-trusty-64.34384: Flags [.], ack 1796373813, win 243, options [nop,nop,TS val 4294715891 ecr 4294715877], length 0
12:15:25.319573 IP vagrant-ubuntu-trusty-64.34384 > 10.0.0.1.8882: Flags [P.], seq 1796373977:1796374141, ack 1603425228, win 58, options [nop,nop,TS val 4294715917 ecr 4294715891], length 164
12:15:25.319645 IP 10.0.0.1.8882 > vagrant-ubuntu-trusty-64.34384: Flags [.], ack 1796373977, win 245, options [nop,nop,TS val 4294715907 ecr 4294715897], length 0
12:15:25.339346 IP vagrant-ubuntu-trusty-64.34384 > 10.0.0.1.8882: Flags [P.], seq 1796374141:1796374305, ack 1603425228, win 58, options [nop,nop,TS val 4294715937 ecr 4294715907], length 164
12:15:25.340392 IP 10.0.0.1.8882 > vagrant-ubuntu-trusty-64.34384: Flags [.], ack 1796374141, win 248, options [nop,nop,TS val 4294715927 ecr 4294715917], length 0
12:15:25.359619 IP 10.0.0.1.8882 > vagrant-ubuntu-trusty-64.34384: Flags [.], ack 1796374305, win 250, options [nop,nop,TS val 4294715947 ecr 4294715937], length 0
12:15:25.359661 IP vagrant-ubuntu-trusty-64.34384 > 10.0.0.1.8882: Flags [P.], seq 1796374305:1796374469, ack 1603425228, win 58, options [nop,nop,TS val 4294715957 ecr 4294715947], length 164
12:15:25.379451 IP vagrant-ubuntu-trusty-64.34384 > 10.0.0.1.8882: Flags [P.], seq 1796374469:1796374633, ack 1603425228, win 58, options [nop,nop,TS val 4294715977 ecr 4294715947], length 164
12:15:25.386588 IP 10.0.0.1.8882 > vagrant-ubuntu-trusty-64.34384: Flags [.], ack 1796374469, win 252, options [nop,nop,TS val 4294715973 ecr 4294715957], length 0
12:15:25.399277 IP vagrant-ubuntu-trusty-64.34384 > 10.0.0.1.8882: Flags [P.], seq 1796374633:1796374797, ack 1603425228, win 58, options [nop,nop,TS val 4294715997 ecr 4294715973], length 164
12:15:25.400141 IP 10.0.0.1.8882 > vagrant-ubuntu-trusty-64.34384: Flags [.], ack 1796374633, win 254, options [nop,nop,TS val 4294715987 ecr 4294715977], length 0
12:15:25.419859 IP 10.0.0.1.8882 > vagrant-ubuntu-trusty-64.34384: Flags [.], ack 1796374797, win 256, options [nop,nop,TS val 4294716007 ecr 4294715997], length 0
12:15:25.419904 IP vagrant-ubuntu-trusty-64.34384 > 10.0.0.1.8882: Flags [P.], seq 1796374797:1796374961, ack 1603425228, win 58, options [nop,nop,TS val 4294716017 ecr 4294716007], length 164
12:15:25.438918 IP vagrant-ubuntu-trusty-64.34384 > 10.0.0.1.8882: Flags [P.], seq 1796374961:1796375125, ack 1603425228, win 58, options [nop,nop,TS val 4294716036 ecr 4294716007], length 164
12:15:25.441496 IP 10.0.0.1.8882 > vagrant-ubuntu-trusty-64.34384: Flags [.], ack 1796374961, win 258, options [nop,nop,TS val 4294716028 ecr 4294716017], length 0
12:15:25.459597 IP 10.0.0.1.8882 > vagrant-ubuntu-trusty-64.34384: Flags [.], ack 1796375125, win 260, options [nop,nop,TS val 4294716046 ecr 4294716036], length 0
12:15:25.459668 IP vagrant-ubuntu-trusty-64.34384 > 10.0.0.1.8882: Flags [P.], seq 1796375125:1796375289, ack 1603425228, win 58, options [nop,nop,TS val 4294716057 ecr 4294716046], length 164
12:15:25.479587 IP vagrant-ubuntu-trusty-64.34384 > 10.0.0.1.8882: Flags [P.], seq 1796375289:1796375453, ack 1603425228, win 58, options [nop,nop,TS val 4294716077 ecr 4294716046], length 164
12:15:25.480740 IP 10.0.0.1.8882 > vagrant-ubuntu-trusty-64.34384: Flags [.], ack 1796375289, win 262, options [nop,nop,TS val 4294716068 ecr 4294716057], length 0
12:15:25.499371 IP vagrant-ubuntu-trusty-64.34384 > 10.0.0.1.8882: Flags [P.], seq 1796375453:1796375617, ack 1603425228, win 58, options [nop,nop,TS val 4294716097 ecr 4294716068], length 164
12:15:25.501293 IP 10.0.0.1.8882 > vagrant-ubuntu-trusty-64.34384: Flags [.], ack 1796375453, win 264, options [nop,nop,TS val 4294716088 ecr 4294716077], length 0
12:15:25.519514 IP vagrant-ubuntu-trusty-64.34384 > 10.0.0.1.8882: Flags [P.], seq 1796375617:1796375781, ack 1603425228, win 58, options [nop,nop,TS val 4294716117 ecr 4294716088], length 164
12:15:25.519646 IP 10.0.0.1.8882 > vagrant-ubuntu-trusty-64.34384: Flags [.], ack 1796375617, win 266, options [nop,nop,TS val 4294716107 ecr 4294716097], length 0
12:15:25.539650 IP vagrant-ubuntu-trusty-64.34384 > 10.0.0.1.8882: Flags [P.], seq 1796375781:1796375945, ack 1603425228, win 58, options [nop,nop,TS val 4294716137 ecr 4294716107], length 164
12:15:25.541197 IP 10.0.0.1.8882 > vagrant-ubuntu-trusty-64.34384: Flags [.], ack 1796375781, win 269, options [nop,nop,TS val 4294716128 ecr 4294716117], length 0
12:15:25.559414 IP vagrant-ubuntu-trusty-64.34384 > 10.0.0.1.8882: Flags [P.], seq 1796375945:1796376109, ack 1603425228, win 58, options [nop,nop,TS val 4294716157 ecr 4294716128], length 164
12:15:25.560402 IP 10.0.0.1.8882 > vagrant-ubuntu-trusty-64.34384: Flags [.], ack 1796375945, win 271, options [nop,nop,TS val 4294716147 ecr 4294716137], length 0
12:15:25.579515 IP vagrant-ubuntu-trusty-64.34384 > 10.0.0.1.8882: Flags [P.], seq 1796376109:1796376273, ack 1603425228, win 58, options [nop,nop,TS val 4294716177 ecr 4294716147], length 164
12:15:25.580545 IP 10.0.0.1.8882 > vagrant-ubuntu-trusty-64.34384: Flags [.], ack 1796376109, win 273, options [nop,nop,TS val 4294716168 ecr 4294716157], length 0
12:15:25.599947 IP 10.0.0.1.8882 > vagrant-ubuntu-trusty-64.34384: Flags [.], ack 1796376273, win 275, options [nop,nop,TS val 4294716187 ecr 4294716177], length 0
12:15:25.599993 IP vagrant-ubuntu-trusty-64.34384 > 10.0.0.1.8882: Flags [P.], seq 1796376273:1796376437, ack 1603425228, win 58, options [nop,nop,TS val 4294716197 ecr 4294716187], length 164
12:15:25.619840 IP vagrant-ubuntu-trusty-64.34384 > 10.0.0.1.8882: Flags [P.], seq 1796376437:1796376601, ack 1603425228, win 58, options [nop,nop,TS val 4294716217 ecr 4294716187], length 164
12:15:25.620496 IP 10.0.0.1.8882 > vagrant-ubuntu-trusty-64.34384: Flags [.], ack 1796376437, win 277, options [nop,nop,TS val 4294716208 ecr 4294716197], length 0
12:15:25.638916 IP vagrant-ubuntu-trusty-64.34384 > 10.0.0.1.8882: Flags [P.], seq 1796376601:1796376765, ack 1603425228, win 58, options [nop,nop,TS val 4294716236 ecr 4294716208], length 164
12:15:25.641535 IP 10.0.0.1.8882 > vagrant-ubuntu-trusty-64.34384: Flags [.], ack 1796376601, win 279, options [nop,nop,TS val 4294716228 ecr 4294716217], length 0
12:15:25.658928 IP vagrant-ubuntu-trusty-64.34384 > 10.0.0.1.8882: Flags [P.], seq 1796376765:1796376929, ack 1603425228, win 58, options [nop,nop,TS val 4294716256 ecr 4294716228], length 164
12:15:25.660500 IP 10.0.0.1.8882 > vagrant-ubuntu-trusty-64.34384: Flags [.], ack 1796376765, win 281, options [nop,nop,TS val 4294716247 ecr 4294716236], length 0
12:15:25.679506 IP 10.0.0.1.8882 > vagrant-ubuntu-trusty-64.34384: Flags [.], ack 1796376929, win 283, options [nop,nop,TS val 4294716267 ecr 4294716256], length 0
12:15:25.679562 IP vagrant-ubuntu-trusty-64.34384 > 10.0.0.1.8882: Flags [P.], seq 1796376929:1796377093, ack 1603425228, win 58, options [nop,nop,TS val 4294716277 ecr 4294716267], length 164
12:15:25.698860 IP vagrant-ubuntu-trusty-64.34384 > 10.0.0.1.8882: Flags [P.], seq 1796377093:1796377257, ack 1603425228, win 58, options [nop,nop,TS val 4294716296 ecr 4294716267], length 164
