11:27:53.409949 IP 10.0.0.1.8882 > vagrant-ubuntu-trusty-64.40848: Flags [.], ack 2839601861, win 61, options [nop,nop,TS val 4294713030 ecr 4294713020], length 0
11:27:53.410140 IP vagrant-ubuntu-trusty-64.40848 > 10.0.0.1.8882: Flags [P.], seq 2839601861:2839602025, ack 779302498, win 58, options [nop,nop,TS val 4294713041 ecr 4294713030], length 164
11:27:53.430208 IP vagrant-ubuntu-trusty-64.40848 > 10.0.0.1.8882: Flags [P.], seq 2839602025:2839602189, ack 779302498, win 58, options [nop,nop,TS val 4294713061 ecr 4294713030], length 164
11:27:53.431104 IP 10.0.0.1.8882 > vagrant-ubuntu-trusty-64.40848: Flags [.], ack 2839602025, win 63, options [nop,nop,TS val 4294713051 ecr 4294713041], length 0
11:27:53.449322 IP vagrant-ubuntu-trusty-64.40848 > 10.0.0.1.8882: Flags [P.], seq 2839602189:2839602353, ack 779302498, win 58, options [nop,nop,TS val 4294713080 ecr 4294713051], length 164
11:27:53.451975 IP 10.0.0.1.8882 > vagrant-ubuntu-trusty-64.40848: Flags [.], ack 2839602189, win 65, options [nop,nop,TS val 4294713072 ecr 4294713061], length 0
11:27:53.469233 IP vagrant-ubuntu-trusty-64.40848 > 10.0.0.1.8882: Flags [P.], seq 2839602353:2839602517, ack 779302498, win 58, options [nop,nop,TS val 4294713100 ecr 4294713072], length 164
11:27:53.470777 IP 10.0.0.1.8882 > vagrant-ubuntu-trusty-64.40848: Flags [.], ack 2839602353, win 68, options [nop,nop,TS val 4294713090 ecr 4294713080], length 0
11:27:53.489260 IP vagrant-ubuntu-trusty-64.40848 > 10.0.0.1.8882: Flags [P.], seq 2839602517:2839602681, ack 779302498, win 58, options [nop,nop,TS val 4294713120 ecr 4294713090], length 164
11:27:53.490148 IP 10.0.0.1.8882 > vagrant-ubuntu-trusty-64.40848: Flags [.], ack 2839602517, win 70, options [nop,nop,TS val 4294713110 ecr 4294713100], length 0
11:27:53.509277 IP vagrant-ubuntu-trusty-64.40848 > 10.0.0.1.8882: Flags [P.], seq 2839602681:2839602845, ack 779302498, win 58, options [nop,nop,TS val 4294713140 ecr 4294713110], length 164
11:27:53.510108 IP 10.0.0.1.8882 > vagrant-ubuntu-trusty-64.40848: Flags [.], ack 2839602681, win 72, options [nop,nop,TS val 4294713130 ecr 4294713120], length 0
11:27:53.529252 IP vagrant-ubuntu-trusty-64.40848 > 10.0.0.1.8882: Flags [P.], seq 2839602845:2839603009, ack 779302498, win 58, options [nop,nop,TS val 4294713160 ecr 4294713130], length 164
11:27:53.530393 IP 10.0.0.1.8882 > vagrant-ubuntu-trusty-64.40848: Flags [.], ack 2839602845, win 74, options [nop,nop,TS val 4294713151 ecr 4294713140], length 0
11:27:53.549619 IP 10.0.0.1.8882 > vagrant-ubuntu-trusty-64.40848: Flags [.], ack 2839603009, win 76, options [nop,nop,TS val 4294713170 ecr 4294713160], length 0
11:27:53.549639 IP vagrant-ubuntu-trusty-64.40848 > 10.0.0.1.8882: Flags [P.], seq 2839603009:2839603173, ack 779302498, win 58, options [nop,nop,TS val 4294713180 ecr 4294713151], length 164
11:27:53.569860 IP vagrant-ubuntu-trusty-64.40848 > 10.0.0.1.8882: Flags [P.], seq 2839603173:2839603337, ack 779302498, win 58, options [nop,nop,TS val 4294713200 ecr 4294713170], length 164
11:27:53.570236 IP 10.0.0.1.8882 > vagrant-ubuntu-trusty-64.40848: Flags [.], ack 2839603173, win 78, options [nop,nop,TS val 4294713190 ecr 4294713180], length 0
11:27:53.589666 IP vagrant-ubuntu-trusty-64.40848 > 10.0.0.1.8882: Flags [P.], seq 2839603337:2839603501, ack 779302498, win 58, options [nop,nop,TS val 4294713220 ecr 4294713190], length 164
11:27:53.590274 IP 10.0.0.1.8882 > vagrant-ubuntu-trusty-64.40848: Flags [.], ack 2839603337, win 80, options [nop,nop,TS val 4294713211 ecr 4294713200], length 0
11:27:53.609338 IP vagrant-ubuntu-trusty-64.40848 > 10.0.0.1.8882: Flags [P.], seq 2839603501:2839603665, ack 779302498, win 58, options [nop,nop,TS val 4294713240 ecr 4294713211], length 164
11:27:53.610248 IP 10.0.0.1.8882 > vagrant-ubuntu-trusty-64.40848: Flags [.], ack 2839603501, win 82, options [nop,nop,TS val 4294713230 ecr 4294713220], length 0
11:27:53.629234 IP vagrant-ubuntu-trusty-64.40848 > 10.0.0.1.8882: Flags [P.], seq 2839603665:2839603829, ack 779302498, win 58, options [nop,nop,TS val 4294713260 ecr 4294713230], length 164
11:27:53.648617 IP 10.0.0.1.8882 > vagrant-ubuntu-trusty-64.40848: Flags [.], ack 2839603665, win 84, options [nop,nop,TS val 4294713268 ecr 4294713240], length 0
11:27:53.649259 IP vagrant-ubuntu-trusty-64.40848 > 10.0.0.1.8882: Flags [P.], seq 2839603829:2839603993, ack 779302498, win 58, options [nop,nop,TS val 4294713280 ecr 4294713268], length 164
11:27:53.669335 IP vagrant-ubuntu-trusty-64.40848 > 10.0.0.1.8882: Flags [P.], seq 2839603993:2839604157, ack 779302498, win 58, options [nop,nop,TS val 4294713300 ecr 4294713268], length 164
11:27:53.673109 IP 10.0.0.1.8882 > vagrant-ubuntu-trusty-64.40848: Flags [.], ack 2839603829, win 86, options [nop,nop,TS val 4294713293 ecr 4294713260], length 0
11:27:53.689379 IP vagrant-ubuntu-trusty-64.40848 > 10.0.0.1.8882: Flags [P.], seq 2839604157:2839604321, ack 779302498, win 58, options [nop,nop,TS val 4294713320 ecr 4294713293], length 164
11:27:53.709498 IP vagrant-ubuntu-trusty-64.40848 > 10.0.0.1.8882: Flags [P.], seq 2839604321:2839604485, ack 779302498, win 58, options [nop,nop,TS val 4294713340 ecr 4294713293], length 164
11:27:53.729381 IP vagrant-ubuntu-trusty-64.40848 > 10.0.0.1.8882: Flags [P.], seq 2839604485:2839604649, ack 779302498, win 58, options [nop,nop,TS val 4294713360 ecr 4294713293], length 164
11:27:53.749956 IP vagrant-ubuntu-trusty-64.40848 > 10.0.0.1.8882: Flags [P.], seq 2839604649:2839604813, ack 779302498, win 58, options [nop,nop,TS val 4294713380 ecr 4294713293], length 164
11:27:53.759404 IP 10.0.0.1.8882 > vagrant-ubuntu-trusty-64.40848: Flags [.], ack 2839603829, win 88, options [nop,nop,TS val 4294713379 ecr 4294713260,nop,nop,sack 1 {2839604485:2839604649}], length 0
11:27:53.759485 IP vagrant-ubuntu-trusty-64.40848 > 10.0.0.1.8882: Flags [P.], seq 2839603829:2839604485, ack 779302498, win 58, options [nop,nop,TS val 4294713389 ecr 4294713379], length 656
11:27:53.769380 IP vagrant-ubuntu-trusty-64.40848 > 10.0.0.1.8882: Flags [P.], seq 2839604813:2839604977, ack 779302498, win 58, options [nop,nop,TS val 4294713400 ecr 4294713379], length 164
11:27:53.780581 IP 10.0.0.1.8882 > vagrant-ubuntu-trusty-64.40848: Flags [.], ack 2839603829, win 91, options [nop,nop,TS val 4294713399 ecr 4294713260,nop,nop,sack 1 {2839604485:2839604813}], length 0
11:27:53.788475 IP 10.0.0.1.8882 > vagrant-ubuntu-trusty-64.40848: Flags [.], ack 2839604813, win 93, options [nop,nop,TS val 4294713408 ecr 4294713389], length 0
11:27:53.789455 IP vagrant-ubuntu-trusty-64.40848 > 10.0.0.1.8882: Flags [P.], seq 2839604977:2839605141, ack 779302498, win 58, options [nop,nop,TS val 4294713420 ecr 4294713408], length 164
11:27:53.799427 IP 10.0.0.1.8882 > vagrant-ubuntu-trusty-64.40848: Flags [.], ack 2839604977, win 96, options [nop,nop,TS val 4294713419 ecr 4294713400], length 0
11:27:53.809455 IP vagrant-ubuntu-trusty-64.40848 > 10.0.0.1.8882: Flags [P.], seq 2839605141:2839605305, ack 779302498, win 58, options [nop,nop,TS val 4294713440 ecr 4294713419], length 164
11:27:53.825489 IP 10.0.0.1.8882 > vagrant-ubuntu-trusty-64.40848: Flags [.], ack 2839605141, win 98, options [nop,nop,TS val 4294713444 ecr 4294713420], length 0
11:27:53.829336 IP vagrant-ubuntu-trusty-64.40848 > 10.0.0.1.8882: Flags [P.], seq 2839605305:2839605469, ack 779302498, win 58, options [nop,nop,TS val 4294713460 ecr 4294713444], length 164
11:27:53.840169 IP 10.0.0.1.8882 > vagrant-ubuntu-trusty-64.40848: Flags [.], ack 2839605305, win 101, options [nop,nop,TS val 4294713459 ecr 4294713440], length 0
11:27:53.849388 IP vagrant-ubuntu-trusty-64.40848 > 10.0.0.1.8882: Flags [P.], seq 2839605469:2839605633, ack 779302498, win 58, options [nop,nop,TS val 4294713480 ecr 4294713459], length 164
11:27:53.868546 IP 10.0.0.1.8882 > vagrant-ubuntu-trusty-64.40848: Flags [.], ack 2839605469, win 103, options [nop,nop,TS val 4294713488 ecr 4294713460], length 0
11:27:53.869316 IP vagrant-ubuntu-trusty-64.40848 > 10.0.0.1.8882: Flags [P.], seq 2839605633:2839605797, ack 779302498, win 58, options [nop,nop,TS val 4294713500 ecr 4294713488], length 164
11:27:53.889254 IP vagrant-ubuntu-trusty-64.40848 > 10.0.0.1.8882: Flags [P.], seq 2839605797:2839605961, ack 779302498, win 58, options [nop,nop,TS val 4294713520 ecr 4294713488], length 164
11:27:53.899266 IP 10.0.0.1.8882 > vagrant-ubuntu-trusty-64.40848: Flags [.], ack 2839605469, win 106, options [nop,nop,TS val 4294713519 ecr 4294713460,nop,nop,sack 1 {2839605633:2839605797}], length 0
11:27:53.906397 IP vagrant-ubuntu-trusty-64.40848 > 10.0.0.1.8882: Flags [P.], seq 2839605469:2839605633, ack 779302498, win 58, options [nop,nop,TS val 4294713537 ecr 4294713519], length 164
11:27:53.909618 IP vagrant-ubuntu-trusty-64.40848 > 10.0.0.1.8882: Flags [P.], seq 2839605961:2839606125, ack 779302498, win 58, options [nop,nop,TS val 4294713540 ecr 4294713519], length 164
11:27:53.920289 IP 10.0.0.1.8882 > vagrant-ubuntu-trusty-64.40848: Flags [.], ack 2839605469, win 108, options [nop,nop,TS val 4294713541 ecr 4294713460,nop,nop,sack 1 {2839605633:2839605961}], length 0
11:27:53.929274 IP vagrant-ubuntu-trusty-64.40848 > 10.0.0.1.8882: Flags [P.], seq 2839606125:2839606289, ack 779302498, win 58, options [nop,nop,TS val 4294713560 ecr 4294713541], length 164
11:27:53.940363 IP 10.0.0.1.8882 > vagrant-ubuntu-trusty-64.40848: Flags [.], ack 2839605961, win 111, options [nop,nop,TS val 4294713561 ecr 4294713537], length 0
11:27:53.949261 IP vagrant-ubuntu-trusty-64.40848 > 10.0.0.1.8882: Flags [P.], seq 2839606289:2839606453, ack 779302498, win 58, options [nop,nop,TS val 4294713580 ecr 4294713561], length 164
11:27:53.960133 IP 10.0.0.1.8882 > vagrant-ubuntu-trusty-64.40848: Flags [.], ack 2839605961, win 114, options [nop,nop,TS val 4294713580 ecr 4294713537,nop,nop,sack 1 {2839606125:2839606289}], length 0
11:27:53.968128 IP vagrant-ubuntu-trusty-64.40848 > 10.0.0.1.8882: Flags [P.], seq 2839605961:2839606125, ack 779302498, win 58, options [nop,nop,TS val 4294713599 ecr 4294713580], length 164
11:27:53.969312 IP vagrant-ubuntu-trusty-64.40848 > 10.0.0.1.8882: Flags [P.], seq 2839606453:2839606617, ack 779302498, win 58, options [nop,nop,TS val 4294713600 ecr 4294713580], length 164
11:27:53.978699 IP 10.0.0.1.8882 > vagrant-ubuntu-trusty-64.40848: Flags [.], ack 2839605961, win 116, options [nop,nop,TS val 4294713599 ecr 4294713537,nop,nop,sack 1 {2839606125:2839606453}], length 0
11:27:54.000481 IP 10.0.0.1.8882 > vagrant-ubuntu-trusty-64.40848: Flags [.], ack 2839606453, win 119, options [nop,nop,TS val 4294713620 ecr 4294713599], length 0
11:27:54.000500 IP vagrant-ubuntu-trusty-64.40848 > 10.0.0.1.8882: Flags [P.], seq 2839606617:2839606781, ack 779302498, win 58, options [nop,nop,TS val 4294713631 ecr 4294713620], length 164
11:27:54.002480 IP 10.0.0.1.8882 > vagrant-ubuntu-trusty-64.40848: Flags [.], ack 2839606617, win 121, options [nop,nop,TS val 4294713622 ecr 4294713600], length 0
11:27:54.009404 IP vagrant-ubuntu-trusty-64.40848 > 10.0.0.1.8882: Flags [P.], seq 2839606781:2839606945, ack 779302498, win 58, options [nop,nop,TS val 4294713640 ecr 4294713622], length 164
11:27:54.021264 IP 10.0.0.1.8882 > vagrant-ubuntu-trusty-64.40848: Flags [.], ack 2839606781, win 124, options [nop,nop,TS val 4294713641 ecr 4294713631], length 0
11:27:54.029325 IP vagrant-ubuntu-trusty-64.40848 > 10.0.0.1.8882: Flags [P.], seq 2839606945:2839607109, ack 779302498, win 58, options [nop,nop,TS val 4294713660 ecr 4294713641], length 164
11:27:54.030508 IP 10.0.0.1.8882 > vagrant-ubuntu-trusty-64.40848: Flags [.], ack 2839606945, win 126, options [nop,nop,TS val 4294713650 ecr 4294713640], length 0
11:27:54.049398 IP vagrant-ubuntu-trusty-64.40848 > 10.0.0.1.8882: Flags [P.], seq 2839607109:2839607273, ack 779302498, win 58, options [nop,nop,TS val 4294713680 ecr 4294713650], length 164
11:27:54.050259 IP 10.0.0.1.8882 > vagrant-ubuntu-trusty-64.40848: Flags [.], ack 2839607109, win 129, options [nop,nop,TS val 4294713670 ecr 4294713660], length 0
11:27:54.069376 IP vagrant-ubuntu-trusty-64.40848 > 10.0.0.1.8882: Flags [P.], seq 2839607273:2839607437, ack 779302498, win 58, options [nop,nop,TS val 4294713700 ecr 4294713670], length 164
11:27:54.069967 IP 10.0.0.1.8882 > vagrant-ubuntu-trusty-64.40848: Flags [.], ack 2839607273, win 132, options [nop,nop,TS val 4294713690 ecr 4294713680], length 0
11:27:54.090312 IP vagrant-ubuntu-trusty-64.40848 > 10.0.0.1.8882: Flags [P.], seq 2839607437:2839607601, ack 779302498, win 58, options [nop,nop,TS val 4294713721 ecr 4294713690], length 164
11:27:54.102428 IP 10.0.0.1.8882 > vagrant-ubuntu-trusty-64.40848: Flags [.], ack 2839607437, win 134, options [nop,nop,TS val 4294713722 ecr 4294713700], length 0
11:27:54.109288 IP vagrant-ubuntu-trusty-64.40848 > 10.0.0.1.8882: Flags [P.], seq 2839607601:2839607765, ack 779302498, win 58, options [nop,nop,TS val 4294713740 ecr 4294713722], length 164
11:27:54.122856 IP 10.0.0.1.8882 > vagrant-ubuntu-trusty-64.40848: Flags [.], ack 2839607601, win 137, options [nop,nop,TS val 4294713743 ecr 4294713721], length 0
11:27:54.130395 IP vagrant-ubuntu-trusty-64.40848 > 10.0.0.1.8882: Flags [P.], seq 2839607765:2839607929, ack 779302498, win 58, options [nop,nop,TS val 4294713761 ecr 4294713743], length 164
11:27:54.142424 IP 10.0.0.1.8882 > vagrant-ubuntu-trusty-64.40848: Flags [.], ack 2839607765, win 139, options [nop,nop,TS val 4294713762 ecr 4294713740], length 0
11:27:54.149805 IP vagrant-ubuntu-trusty-64.40848 > 10.0.0.1.8882: Flags [P.], seq 2839607929:2839608093, ack 779302498, win 58, options [nop,nop,TS val 4294713780 ecr 4294713762], length 164
11:27:54.162692 IP 10.0.0.1.8882 > vagrant-ubuntu-trusty-64.40848: Flags [.], ack 2839607929, win 142, options [nop,nop,TS val 4294713783 ecr 4294713761], length 0
11:27:54.169586 IP vagrant-ubuntu-trusty-64.40848 > 10.0.0.1.8882: Flags [P.], seq 2839608093:2839608257, ack 779302498, win 58, options [nop,nop,TS val 4294713800 ecr 4294713783], length 164
11:27:54.181863 IP 10.0.0.1.8882 > vagrant-ubuntu-trusty-64.40848: Flags [.], ack 2839608093, win 144, options [nop,nop,TS val 4294713802 ecr 4294713780], length 0
11:27:54.189920 IP vagrant-ubuntu-trusty-64.40848 > 10.0.0.1.8882: Flags [P.], seq 2839608257:2839608421, ack 779302498, win 58, options [nop,nop,TS val 4294713820 ecr 4294713802], length 164
11:27:54.199977 IP 10.0.0.1.8882 > vagrant-ubuntu-trusty-64.40848: Flags [.], ack 2839608257, win 147, options [nop,nop,TS val 4294713820 ecr 4294713800], length 0
11:27:54.209915 IP vagrant-ubuntu-trusty-64.40848 > 10.0.0.1.8882: Flags [P.], seq 2839608421:2839608585, ack 779302498, win 58, options [nop,nop,TS val 4294713840 ecr 4294713820], length 164
11:27:54.222452 IP 10.0.0.1.8882 > vagrant-ubuntu-trusty-64.40848: Flags [.], ack 2839608421, win 149, options [nop,nop,TS val 4294713841 ecr 4294713820], length 0
11:27:54.229494 IP vagrant-ubuntu-trusty-64.40848 > 10.0.0.1.8882: Flags [P.], seq 2839608585:2839608749, ack 779302498, win 58, options [nop,nop,TS val 4294713860 ecr 4294713841], length 164
11:27:54.243287 IP 10.0.0.1.8882 > vagrant-ubuntu-trusty-64.40848: Flags [.], ack 2839608585, win 152, options [nop,nop,TS val 4294713863 ecr 4294713840], length 0
11:27:54.249683 IP vagrant-ubuntu-trusty-64.40848 > 10.0.0.1.8882: Flags [P.], seq 2839608749:2839608913, ack 779302498, win 58, options [nop,nop,TS val 4294713880 ecr 4294713863], length 164
11:27:54.262383 IP 10.0.0.1.8882 > vagrant-ubuntu-trusty-64.40848: Flags [.], ack 2839608749, win 155, options [nop,nop,TS val 4294713881 ecr 4294713860], length 0
11:27:54.269448 IP vagrant-ubuntu-trusty-64.40848 > 10.0.0.1.8882: Flags [P.], seq 2839608913:2839609077, ack 779302498, win 58, options [nop,nop,TS val 4294713900 ecr 4294713881], length 164
11:27:54.283625 IP 10.0.0.1.8882 > vagrant-ubuntu-trusty-64.40848: Flags [.], ack 2839608913, win 157, options [nop,nop,TS val 4294713903 ecr 4294713880], length 0
11:27:54.289686 IP vagrant-ubuntu-trusty-64.40848 > 10.0.0.1.8882: Flags [P.], seq 2839609077:2839609241, ack 779302498, win 58, options [nop,nop,TS val 4294713920 ecr 4294713903], length 164
11:27:54.301531 IP 10.0.0.1.8882 > vagrant-ubuntu-trusty-64.40848: Flags [.], ack 2839609077, win 160, options [nop,nop,TS val 4294713921 ecr 4294713900], length 0
11:27:54.309862 IP vagrant-ubuntu-trusty-64.40848 > 10.0.0.1.8882: Flags [P.], seq 2839609241:2839609405, ack 779302498, win 58, options [nop,nop,TS val 4294713940 ecr 4294713921], length 164
11:27:54.323415 IP 10.0.0.1.8882 > vagrant-ubuntu-trusty-64.40848: Flags [.], ack 2839609241, win 162, options [nop,nop,TS val 4294713943 ecr 4294713920], length 0
11:27:54.329849 IP vagrant-ubuntu-trusty-64.40848 > 10.0.0.1.8882: Flags [P.], seq 2839609405:2839609569, ack 779302498, win 58, options [nop,nop,TS val 4294713960 ecr 4294713943], length 164
11:27:54.343758 IP 10.0.0.1.8882 > vagrant-ubuntu-trusty-64.40848: Flags [.], ack 2839609405, win 165, options [nop,nop,TS val 4294713964 ecr 4294713940], length 0
11:27:54.349747 IP vagrant-ubuntu-trusty-64.40848 > 10.0.0.1.8882: Flags [P.], seq 2839609569:2839609733, ack 779302498, win 58, options [nop,nop,TS val 4294713980 ecr 4294713964], length 164
11:27:54.365878 IP 10.0.0.1.8882 > vagrant-ubuntu-trusty-64.40848: Flags [.], ack 2839609569, win 167, options [nop,nop,TS val 4294713986 ecr 4294713960], length 0
11:27:54.369905 IP vagrant-ubuntu-trusty-64.40848 > 10.0.0.1.8882: Flags [P.], seq 2839609733:2839609897, ack 779302498, win 58, options [nop,nop,TS val 4294714000 ecr 4294713986], length 164
11:27:54.384735 IP 10.0.0.1.8882 > vagrant-ubuntu-trusty-64.40848: Flags [.], ack 2839609733, win 170, options [nop,nop,TS val 4294714004 ecr 4294713980], length 0
11:27:54.389394 IP vagrant-ubuntu-trusty-64.40848 > 10.0.0.1.8882: Flags [P.], seq 2839609897:2839610061, ack 779302498, win 58, options [nop,nop,TS val 4294714020 ecr 4294714004], length 164
11:27:54.405712 IP 10.0.0.1.8882 > vagrant-ubuntu-trusty-64.40848: Flags [.], ack 2839609897, win 173, options [nop,nop,TS val 4294714026 ecr 4294714000], length 0
11:27:54.409338 IP vagrant-ubuntu-trusty-64.40848 > 10.0.0.1.8882: Flags [P.], seq 2839610061:2839610225, ack 779302498, win 58, options [nop,nop,TS val 4294714040 ecr 4294714026], length 164
11:27:54.424066 IP 10.0.0.1.8882 > vagrant-ubuntu-trusty-64.40848: Flags [.], ack 2839610061, win 175, options [nop,nop,TS val 4294714044 ecr 4294714020], length 0
11:27:54.429333 IP vagrant-ubuntu-trusty-64.40848 > 10.0.0.1.8882: Flags [P.], seq 2839610225:2839610389, ack 779302498, win 58, options [nop,nop,TS val 4294714060 ecr 4294714044], length 164
11:27:54.445125 IP 10.0.0.1.8882 > vagrant-ubuntu-trusty-64.40848: Flags [.], ack 2839610225, win 178, options [nop,nop,TS val 4294714065 ecr 4294714040], length 0
11:27:54.449387 IP vagrant-ubuntu-trusty-64.40848 > 10.0.0.1.8882: Flags [P.], seq 2839610389:2839610553, ack 779302498, win 58, options [nop,nop,TS val 4294714080 ecr 4294714065], length 164
11:27:54.463927 IP 10.0.0.1.8882 > vagrant-ubuntu-trusty-64.40848: Flags [.], ack 2839610389, win 180, options [nop,nop,TS val 4294714084 ecr 4294714060], length 0
11:27:54.469329 IP vagrant-ubuntu-trusty-64.40848 > 10.0.0.1.8882: Flags [P.], seq 2839610553:2839610717, ack 779302498, win 58, options [nop,nop,TS val 4294714100 ecr 4294714084], length 164
11:27:54.484902 IP 10.0.0.1.8882 > vagrant-ubuntu-trusty-64.40848: Flags [.], ack 2839610553, win 183, options [nop,nop,TS val 4294714104 ecr 4294714080], length 0
11:27:54.489381 IP vagrant-ubuntu-trusty-64.40848 > 10.0.0.1.8882: Flags [P.], seq 2839610717:2839610881, ack 779302498, win 58, options [nop,nop,TS val 4294714120 ecr 4294714104], length 164
11:27:54.504562 IP 10.0.0.1.8882 > vagrant-ubuntu-trusty-64.40848: Flags [.], ack 2839610717, win 185, options [nop,nop,TS val 4294714124 ecr 4294714100], length 0
11:27:54.509593 IP vagrant-ubuntu-trusty-64.40848 > 10.0.0.1.8882: Flags [P.], seq 2839610881:2839611045, ack 779302498, win 58, options [nop,nop,TS val 4294714140 ecr 4294714124], length 164
11:27:54.524802 IP 10.0.0.1.8882 > vagrant-ubuntu-trusty-64.40848: Flags [.], ack 2839610881, win 188, options [nop,nop,TS val 4294714145 ecr 4294714120], length 0
11:27:54.529689 IP vagrant-ubuntu-trusty-64.40848 > 10.0.0.1.8882: Flags [P.], seq 2839611045:2839611209, ack 779302498, win 58, options [nop,nop,TS val 4294714160 ecr 4294714145], length 164
11:27:54.543882 IP 10.0.0.1.8882 > vagrant-ubuntu-trusty-64.40848: Flags [.], ack 2839611045, win 190, options [nop,nop,TS val 4294714164 ecr 4294714140], length 0
11:27:54.549240 IP vagrant-ubuntu-trusty-64.40848 > 10.0.0.1.8882: Flags [P.], seq 2839611209:2839611373, ack 779302498, win 58, options [nop,nop,TS val 4294714180 ecr 4294714164], length 164
11:27:54.565059 IP 10.0.0.1.8882 > vagrant-ubuntu-trusty-64.40848: Flags [.], ack 2839611209, win 193, options [nop,nop,TS val 4294714185 ecr 4294714160], length 0
11:27:54.569685 IP vagrant-ubuntu-trusty-64.40848 > 10.0.0.1.8882: Flags [P.], seq 2839611373:2839611537, ack 779302498, win 58, options [nop,nop,TS val 4294714200 ecr 4294714185], length 164
11:27:54.583835 IP 10.0.0.1.8882 > vagrant-ubuntu-trusty-64.40848: Flags [.], ack 2839611373, win 196, options [nop,nop,TS val 4294714203 ecr 4294714180], length 0
11:27:54.589239 IP vagrant-ubuntu-trusty-64.40848 > 10.0.0.1.8882: Flags [P.], seq 2839611537:2839611701, ack 779302498, win 58, options [nop,nop,TS val 4294714220 ecr 4294714203], length 164
11:27:54.608740 IP 10.0.0.1.8882 > vagrant-ubuntu-trusty-64.40848: Flags [.], ack 2839611537, win 198, options [nop,nop,TS val 4294714228 ecr 4294714200], length 0
11:27:54.609536 IP vagrant-ubuntu-trusty-64.40848 > 10.0.0.1.8882: Flags [P.], seq 2839611701:2839611865, ack 779302498, win 58, options [nop,nop,TS val 4294714240 ecr 4294714228], length 164
11:27:54.625901 IP 10.0.0.1.8882 > vagrant-ubuntu-trusty-64.40848: Flags [.], ack 2839611701, win 201, options [nop,nop,TS val 4294714246 ecr 4294714220], length 0
11:27:54.629238 IP vagrant-ubuntu-trusty-64.40848 > 10.0.0.1.8882: Flags [P.], seq 2839611865:2839612029, ack 779302498, win 58, options [nop,nop,TS val 4294714260 ecr 4294714246], length 164
11:27:54.648077 IP 10.0.0.1.8882 > vagrant-ubuntu-trusty-64.40848: Flags [.], ack 2839611865, win 203, options [nop,nop,TS val 4294714268 ecr 4294714240], length 0
11:27:54.649998 IP vagrant-ubuntu-trusty-64.40848 > 10.0.0.1.8882: Flags [P.], seq 2839612029:2839612193, ack 779302498, win 58, options [nop,nop,TS val 4294714280 ecr 4294714268], length 164
11:27:54.669941 IP 10.0.0.1.8882 > vagrant-ubuntu-trusty-64.40848: Flags [.], ack 2839612029, win 206, options [nop,nop,TS val 4294714289 ecr 4294714260], length 0
11:27:54.670050 IP vagrant-ubuntu-trusty-64.40848 > 10.0.0.1.8882: Flags [P.], seq 2839612193:2839612357, ack 779302498, win 58, options [nop,nop,TS val 4294714301 ecr 4294714268], length 164
11:27:54.688054 IP 10.0.0.1.8882 > vagrant-ubuntu-trusty-64.40848: Flags [.], ack 2839612193, win 208, options [nop,nop,TS val 4294714308 ecr 4294714280], length 0
11:27:54.690006 IP vagrant-ubuntu-trusty-64.40848 > 10.0.0.1.8882: Flags [P.], seq 2839612357:2839612521, ack 779302498, win 58, options [nop,nop,TS val 4294714320 ecr 4294714308], length 164
11:27:54.709748 IP 10.0.0.1.8882 > vagrant-ubuntu-trusty-64.40848: Flags [.], ack 2839612357, win 211, options [nop,nop,TS val 4294714329 ecr 4294714301], length 0
11:27:54.709864 IP vagrant-ubuntu-trusty-64.40848 > 10.0.0.1.8882: Flags [P.], seq 2839612521:2839612685, ack 779302498, win 58, options [nop,nop,TS val 4294714340 ecr 4294714308], length 164
11:27:54.726887 IP 10.0.0.1.8882 > vagrant-ubuntu-trusty-64.40848: Flags [.], ack 2839612521, win 214, options [nop,nop,TS val 4294714347 ecr 4294714320], length 0
11:27:54.729914 IP vagrant-ubuntu-trusty-64.40848 > 10.0.0.1.8882: Flags [P.], seq 2839612685:2839612849, ack 779302498, win 58, options [nop,nop,TS val 4294714360 ecr 4294714347], length 164
11:27:54.750019 IP 10.0.0.1.8882 > vagrant-ubuntu-trusty-64.40848: Flags [.], ack 2839612685, win 216, options [nop,nop,TS val 4294714369 ecr 4294714340], length 0
11:27:54.750086 IP vagrant-ubuntu-trusty-64.40848 > 10.0.0.1.8882: Flags [P.], seq 2839612849:2839613013, ack 779302498, win 58, options [nop,nop,TS val 4294714381 ecr 4294714347], length 164
11:27:54.766943 IP 10.0.0.1.8882 > vagrant-ubuntu-trusty-64.40848: Flags [.], ack 2839612849, win 219, options [nop,nop,TS val 4294714387 ecr 4294714360], length 0
11:27:54.769247 IP vagrant-ubuntu-trusty-64.40848 > 10.0.0.1.8882: Flags [P.], seq 2839613013:2839613177, ack 779302498, win 58, options [nop,nop,TS val 4294714400 ecr 4294714387], length 164
11:27:54.788113 IP 10.0.0.1.8882 > vagrant-ubuntu-trusty-64.40848: Flags [.], ack 2839613013, win 221, options [nop,nop,TS val 4294714409 ecr 4294714381], length 0
11:27:54.789873 IP vagrant-ubuntu-trusty-64.40848 > 10.0.0.1.8882: Flags [P.], seq 2839613177:2839613341, ack 779302498, win 58, options [nop,nop,TS val 4294714420 ecr 4294714409], length 164
11:27:54.807775 IP 10.0.0.1.8882 > vagrant-ubuntu-trusty-64.40848: Flags [.], ack 2839613177, win 224, options [nop,nop,TS val 4294714427 ecr 4294714400], length 0
11:27:54.809575 IP vagrant-ubuntu-trusty-64.40848 > 10.0.0.1.8882: Flags [P.], seq 2839613341:2839613505, ack 779302498, win 58, options [nop,nop,TS val 4294714440 ecr 4294714427], length 164
11:27:54.828092 IP 10.0.0.1.8882 > vagrant-ubuntu-trusty-64.40848: Flags [.], ack 2839613341, win 226, options [nop,nop,TS val 4294714448 ecr 4294714420], length 0
11:27:54.829625 IP vagrant-ubuntu-trusty-64.40848 > 10.0.0.1.8882: Flags [P.], seq 2839613505:2839613669, ack 779302498, win 58, options [nop,nop,TS val 4294714460 ecr 4294714448], length 164
11:27:54.847054 IP 10.0.0.1.8882 > vagrant-ubuntu-trusty-64.40848: Flags [.], ack 2839613505, win 229, options [nop,nop,TS val 4294714467 ecr 4294714440], length 0
11:27:54.850076 IP vagrant-ubuntu-trusty-64.40848 > 10.0.0.1.8882: Flags [P.], seq 2839613669:2839613833, ack 779302498, win 58, options [nop,nop,TS val 4294714481 ecr 4294714467], length 164
11:27:54.868046 IP 10.0.0.1.8882 > vagrant-ubuntu-trusty-64.40848: Flags [.], ack 2839613669, win 231, options [nop,nop,TS val 4294714488 ecr 4294714460], length 0
11:27:54.869770 IP vagrant-ubuntu-trusty-64.40848 > 10.0.0.1.8882: Flags [P.], seq 2839613833:2839613997, ack 779302498, win 58, options [nop,nop,TS val 4294714500 ecr 4294714488], length 164
11:27:54.889266 IP vagrant-ubuntu-trusty-64.40848 > 10.0.0.1.8882: Flags [P.], seq 2839613997:2839614161, ack 779302498, win 58, options [nop,nop,TS val 4294714520 ecr 4294714488], length 164
11:27:54.893191 IP 10.0.0.1.8882 > vagrant-ubuntu-trusty-64.40848: Flags [.], ack 2839613833, win 234, options [nop,nop,TS val 4294714513 ecr 4294714481], length 0
11:27:54.909732 IP vagrant-ubuntu-trusty-64.40848 > 10.0.0.1.8882: Flags [P.], seq 2839614161:2839614325, ack 779302498, win 58, options [nop,nop,TS val 4294714540 ecr 4294714513], length 164
11:27:54.910704 IP 10.0.0.1.8882 > vagrant-ubuntu-trusty-64.40848: Flags [.], ack 2839613997, win 237, options [nop,nop,TS val 4294714531 ecr 4294714500], length 0
11:27:54.929029 IP 10.0.0.1.8882 > vagrant-ubuntu-trusty-64.40848: Flags [.], ack 2839614161, win 239, options [nop,nop,TS val 4294714549 ecr 4294714520], length 0
11:27:54.929240 IP vagrant-ubuntu-trusty-64.40848 > 10.0.0.1.8882: Flags [P.], seq 2839614325:2839614489, ack 779302498, win 58, options [nop,nop,TS val 4294714560 ecr 4294714549], length 164
11:27:54.949987 IP vagrant-ubuntu-trusty-64.40848 > 10.0.0.1.8882: Flags [P.], seq 2839614489:2839614653, ack 779302498, win 58, options [nop,nop,TS val 4294714580 ecr 4294714549], length 164
11:27:54.951724 IP 10.0.0.1.8882 > vagrant-ubuntu-trusty-64.40848: Flags [.], ack 2839614325, win 242, options [nop,nop,TS val 4294714571 ecr 4294714540], length 0
11:27:54.969723 IP vagrant-ubuntu-trusty-64.40848 > 10.0.0.1.8882: Flags [P.], seq 2839614653:2839614817, ack 779302498, win 58, options [nop,nop,TS val 4294714600 ecr 4294714571], length 164
11:27:54.971914 IP 10.0.0.1.8882 > vagrant-ubuntu-trusty-64.40848: Flags [.], ack 2839614489, win 244, options [nop,nop,TS val 4294714592 ecr 4294714560], length 0
11:27:54.990036 IP vagrant-ubuntu-trusty-64.40848 > 10.0.0.1.8882: Flags [P.], seq 2839614817:2839614981, ack 779302498, win 58, options [nop,nop,TS val 4294714620 ecr 4294714592], length 164
11:27:54.990976 IP 10.0.0.1.8882 > vagrant-ubuntu-trusty-64.40848: Flags [.], ack 2839614653, win 247, options [nop,nop,TS val 4294714611 ecr 4294714580], length 0
11:27:55.009877 IP vagrant-ubuntu-trusty-64.40848 > 10.0.0.1.8882: Flags [P.], seq 2839614981:2839615145, ack 779302498, win 58, options [nop,nop,TS val 4294714640 ecr 4294714611], length 164
11:27:55.012167 IP 10.0.0.1.8882 > vagrant-ubuntu-trusty-64.40848: Flags [.], ack 2839614817, win 249, options [nop,nop,TS val 4294714633 ecr 4294714600], length 0
11:27:55.030032 IP vagrant-ubuntu-trusty-64.40848 > 10.0.0.1.8882: Flags [P.], seq 2839615145:2839615309, ack 779302498, win 58, options [nop,nop,TS val 4294714660 ecr 4294714633], length 164
11:27:55.031195 IP 10.0.0.1.8882 > vagrant-ubuntu-trusty-64.40848: Flags [.], ack 2839614981, win 252, options [nop,nop,TS val 4294714652 ecr 4294714620], length 0
11:27:55.050068 IP vagrant-ubuntu-trusty-64.40848 > 10.0.0.1.8882: Flags [P.], seq 2839615309:2839615473, ack 779302498, win 58, options [nop,nop,TS val 4294714681 ecr 4294714652], length 164
11:27:55.052917 IP 10.0.0.1.8882 > vagrant-ubuntu-trusty-64.40848: Flags [.], ack 2839615145, win 255, options [nop,nop,TS val 4294714673 ecr 4294714640], length 0
11:27:55.069955 IP vagrant-ubuntu-trusty-64.40848 > 10.0.0.1.8882: Flags [P.], seq 2839615473:2839615637, ack 779302498, win 58, options [nop,nop,TS val 4294714700 ecr 4294714673], length 164
11:27:55.070056 IP 10.0.0.1.8882 > vagrant-ubuntu-trusty-64.40848: Flags [.], ack 2839615309, win 257, options [nop,nop,TS val 4294714690 ecr 4294714660], length 0
11:27:55.089248 IP vagrant-ubuntu-trusty-64.40848 > 10.0.0.1.8882: Flags [P.], seq 2839615637:2839615801, ack 779302498, win 58, options [nop,nop,TS val 4294714720 ecr 4294714690], length 164
11:27:55.091984 IP 10.0.0.1.8882 > vagrant-ubuntu-trusty-64.40848: Flags [.], ack 2839615473, win 260, options [nop,nop,TS val 4294714712 ecr 4294714681], length 0
11:27:55.109398 IP vagrant-ubuntu-trusty-64.40848 > 10.0.0.1.8882: Flags [P.], seq 2839615801:2839615965, ack 779302498, win 58, options [nop,nop,TS val 4294714740 ecr 4294714712], length 164
11:27:55.110133 IP 10.0.0.1.8882 > vagrant-ubuntu-trusty-64.40848: Flags [.], ack 2839615637, win 262, options [nop,nop,TS val 4294714731 ecr 4294714700], length 0
11:27:55.129254 IP vagrant-ubuntu-trusty-64.40848 > 10.0.0.1.8882: Flags [P.], seq 2839615965:2839616129, ack 779302498, win 58, options [nop,nop,TS val 4294714760 ecr 4294714731], length 164
11:27:55.132778 IP 10.0.0.1.8882 > vagrant-ubuntu-trusty-64.40848: Flags [.], ack 2839615801, win 265, options [nop,nop,TS val 4294714752 ecr 4294714720], length 0
11:27:55.149235 IP vagrant-ubuntu-trusty-64.40848 > 10.0.0.1.8882: Flags [P.], seq 2839616129:2839616293, ack 779302498, win 58, options [nop,nop,TS val 4294714780 ecr 4294714752], length 164
11:27:55.151067 IP 10.0.0.1.8882 > vagrant-ubuntu-trusty-64.40848: Flags [.], ack 2839615965, win 267, options [nop,nop,TS val 4294714770 ecr 4294714740], length 0
11:27:55.169729 IP vagrant-ubuntu-trusty-64.40848 > 10.0.0.1.8882: Flags [P.], seq 2839616293:2839616457, ack 779302498, win 58, options [nop,nop,TS val 4294714800 ecr 4294714770], length 164
11:27:55.171257 IP 10.0.0.1.8882 > vagrant-ubuntu-trusty-64.40848: Flags [.], ack 2839616129, win 270, options [nop,nop,TS val 4294714792 ecr 4294714760], length 0
11:27:55.189283 IP vagrant-ubuntu-trusty-64.40848 > 10.0.0.1.8882: Flags [P.], seq 2839616457:2839616621, ack 779302498, win 58, options [nop,nop,TS val 4294714820 ecr 4294714792], length 164
11:27:55.190956 IP 10.0.0.1.8882 > vagrant-ubuntu-trusty-64.40848: Flags [.], ack 2839616293, win 272, options [nop,nop,TS val 4294714811 ecr 4294714780], length 0
11:27:55.209376 IP vagrant-ubuntu-trusty-64.40848 > 10.0.0.1.8882: Flags [P.], seq 2839616621:2839616785, ack 779302498, win 58, options [nop,nop,TS val 4294714840 ecr 4294714811], length 164
11:27:55.214195 IP 10.0.0.1.8882 > vagrant-ubuntu-trusty-64.40848: Flags [.], ack 2839616457, win 275, options [nop,nop,TS val 4294714835 ecr 4294714800], length 0
11:27:55.229265 IP vagrant-ubuntu-trusty-64.40848 > 10.0.0.1.8882: Flags [P.], seq 2839616785:2839616949, ack 779302498, win 58, options [nop,nop,TS val 4294714860 ecr 4294714835], length 164
11:27:55.233260 IP 10.0.0.1.8882 > vagrant-ubuntu-trusty-64.40848: Flags [.], ack 2839616621, win 278, options [nop,nop,TS val 4294714853 ecr 4294714820], length 0
11:27:55.249792 IP vagrant-ubuntu-trusty-64.40848 > 10.0.0.1.8882: Flags [P.], seq 2839616949:2839617113, ack 779302498, win 58, options [nop,nop,TS val 4294714880 ecr 4294714853], length 164
11:27:55.255070 IP 10.0.0.1.8882 > vagrant-ubuntu-trusty-64.40848: Flags [.], ack 2839616785, win 280, options [nop,nop,TS val 4294714874 ecr 4294714840], length 0
11:27:55.269327 IP vagrant-ubuntu-trusty-64.40848 > 10.0.0.1.8882: Flags [P.], seq 2839617113:2839617277, ack 779302498, win 58, options [nop,nop,TS val 4294714900 ecr 4294714874], length 164
11:27:55.272235 IP 10.0.0.1.8882 > vagrant-ubuntu-trusty-64.40848: Flags [.], ack 2839616949, win 283, options [nop,nop,TS val 4294714893 ecr 4294714860], length 0
11:27:55.289796 IP vagrant-ubuntu-trusty-64.40848 > 10.0.0.1.8882: Flags [P.], seq 2839617277:2839617441, ack 779302498, win 58, options [nop,nop,TS val 4294714920 ecr 4294714893], length 164
11:27:55.295005 IP 10.0.0.1.8882 > vagrant-ubuntu-trusty-64.40848: Flags [.], ack 2839617113, win 285, options [nop,nop,TS val 4294714914 ecr 4294714880], length 0
11:27:55.309255 IP vagrant-ubuntu-trusty-64.40848 > 10.0.0.1.8882: Flags [P.], seq 2839617441:2839617605, ack 779302498, win 58, options [nop,nop,TS val 4294714940 ecr 4294714914], length 164
11:27:55.315229 IP 10.0.0.1.8882 > vagrant-ubuntu-trusty-64.40848: Flags [.], ack 2839617277, win 288, options [nop,nop,TS val 4294714936 ecr 4294714900], length 0
11:27:55.329380 IP vagrant-ubuntu-trusty-64.40848 > 10.0.0.1.8882: Flags [P.], seq 2839617605:2839617769, ack 779302498, win 58, options [nop,nop,TS val 4294714960 ecr 4294714936], length 164
11:27:55.334406 IP 10.0.0.1.8882 > vagrant-ubuntu-trusty-64.40848: Flags [.], ack 2839617441, win 290, options [nop,nop,TS val 4294714954 ecr 4294714920], length 0
11:27:55.350327 IP vagrant-ubuntu-trusty-64.40848 > 10.0.0.1.8882: Flags [P.], seq 2839617769:2839617933, ack 779302498, win 58, options [nop,nop,TS val 4294714981 ecr 4294714954], length 164
11:27:55.355055 IP 10.0.0.1.8882 > vagrant-ubuntu-trusty-64.40848: Flags [.], ack 2839617605, win 293, options [nop,nop,TS val 4294714975 ecr 4294714940], length 0
11:27:55.370084 IP vagrant-ubuntu-trusty-64.40848 > 10.0.0.1.8882: Flags [P.], seq 2839617933:2839618097, ack 779302498, win 58, options [nop,nop,TS val 4294715001 ecr 4294714975], length 164
11:27:55.374321 IP 10.0.0.1.8882 > vagrant-ubuntu-trusty-64.40848: Flags [.], ack 2839617769, win 296, options [nop,nop,TS val 4294714994 ecr 4294714960], length 0
11:27:55.390342 IP vagrant-ubuntu-trusty-64.40848 > 10.0.0.1.8882: Flags [P.], seq 2839618097:2839618261, ack 779302498, win 58, options [nop,nop,TS val 4294715021 ecr 4294714994], length 164
11:27:55.396086 IP 10.0.0.1.8882 > vagrant-ubuntu-trusty-64.40848: Flags [.], ack 2839617933, win 298, options [nop,nop,TS val 4294715015 ecr 4294714981], length 0
11:27:55.409519 IP vagrant-ubuntu-trusty-64.40848 > 10.0.0.1.8882: Flags [P.], seq 2839618261:2839618425, ack 779302498, win 58, options [nop,nop,TS val 4294715040 ecr 4294715015], length 164
11:27:55.413219 IP 10.0.0.1.8882 > vagrant-ubuntu-trusty-64.40848: Flags [.], ack 2839618097, win 301, options [nop,nop,TS val 4294715034 ecr 4294715001], length 0
11:27:55.429312 IP vagrant-ubuntu-trusty-64.40848 > 10.0.0.1.8882: Flags [P.], seq 2839618425:2839618589, ack 779302498, win 58, options [nop,nop,TS val 4294715060 ecr 4294715034], length 164
11:27:55.435203 IP 10.0.0.1.8882 > vagrant-ubuntu-trusty-64.40848: Flags [.], ack 2839618261, win 303, options [nop,nop,TS val 4294715055 ecr 4294715021], length 0
11:27:55.450383 IP vagrant-ubuntu-trusty-64.40848 > 10.0.0.1.8882: Flags [P.], seq 2839618589:2839618753, ack 779302498, win 58, options [nop,nop,TS val 4294715081 ecr 4294715055], length 164
11:27:55.453329 IP 10.0.0.1.8882 > vagrant-ubuntu-trusty-64.40848: Flags [.], ack 2839618425, win 306, options [nop,nop,TS val 4294715073 ecr 4294715040], length 0
11:27:55.469331 IP vagrant-ubuntu-trusty-64.40848 > 10.0.0.1.8882: Flags [P.], seq 2839618753:2839618917, ack 779302498, win 58, options [nop,nop,TS val 4294715100 ecr 4294715073], length 164
11:27:55.474540 IP 10.0.0.1.8882 > vagrant-ubuntu-trusty-64.40848: Flags [.], ack 2839618589, win 308, options [nop,nop,TS val 4294715095 ecr 4294715060], length 0
11:27:55.489244 IP vagrant-ubuntu-trusty-64.40848 > 10.0.0.1.8882: Flags [P.], seq 2839618917:2839619081, ack 779302498, win 58, options [nop,nop,TS val 4294715120 ecr 4294715095], length 164
11:27:55.497001 IP 10.0.0.1.8882 > vagrant-ubuntu-trusty-64.40848: Flags [.], ack 2839618753, win 311, options [nop,nop,TS val 4294715116 ecr 4294715081], length 0
11:27:55.509978 IP vagrant-ubuntu-trusty-64.40848 > 10.0.0.1.8882: Flags [P.], seq 2839619081:2839619245, ack 779302498, win 58, options [nop,nop,TS val 4294715140 ecr 4294715116], length 164
11:27:55.514282 IP 10.0.0.1.8882 > vagrant-ubuntu-trusty-64.40848: Flags [.], ack 2839618917, win 313, options [nop,nop,TS val 4294715135 ecr 4294715100], length 0
11:27:55.529290 IP vagrant-ubuntu-trusty-64.40848 > 10.0.0.1.8882: Flags [P.], seq 2839619245:2839619409, ack 779302498, win 58, options [nop,nop,TS val 4294715160 ecr 4294715135], length 164
11:27:55.533406 IP 10.0.0.1.8882 > vagrant-ubuntu-trusty-64.40848: Flags [.], ack 2839619081, win 316, options [nop,nop,TS val 4294715153 ecr 4294715120], length 0
11:27:55.549981 IP vagrant-ubuntu-trusty-64.40848 > 10.0.0.1.8882: Flags [P.], seq 2839619409:2839619573, ack 779302498, win 58, options [nop,nop,TS val 4294715180 ecr 4294715153], length 164
11:27:55.558225 IP 10.0.0.1.8882 > vagrant-ubuntu-trusty-64.40848: Flags [.], ack 2839619245, win 319, options [nop,nop,TS val 4294715178 ecr 4294715140], length 0
11:27:55.569292 IP vagrant-ubuntu-trusty-64.40848 > 10.0.0.1.8882: Flags [P.], seq 2839619573:2839619737, ack 779302498, win 58, options [nop,nop,TS val 4294715200 ecr 4294715178], length 164
11:27:55.576407 IP 10.0.0.1.8882 > vagrant-ubuntu-trusty-64.40848: Flags [.], ack 2839619409, win 321, options [nop,nop,TS val 4294715197 ecr 4294715160], length 0
11:27:55.589307 IP vagrant-ubuntu-trusty-64.40848 > 10.0.0.1.8882: Flags [P.], seq 2839619737:2839619901, ack 779302498, win 58, options [nop,nop,TS val 4294715220 ecr 4294715197], length 164
11:27:55.597027 IP 10.0.0.1.8882 > vagrant-ubuntu-trusty-64.40848: Flags [.], ack 2839619573, win 324, options [nop,nop,TS val 4294715217 ecr 4294715180], length 0
11:27:55.609282 IP vagrant-ubuntu-trusty-64.40848 > 10.0.0.1.8882: Flags [P.], seq 2839619901:2839620065, ack 779302498, win 58, options [nop,nop,TS val 4294715240 ecr 4294715217], length 164
11:27:55.615372 IP 10.0.0.1.8882 > vagrant-ubuntu-trusty-64.40848: Flags [.], ack 2839619737, win 326, options [nop,nop,TS val 4294715236 ecr 4294715200], length 0
11:27:55.629302 IP vagrant-ubuntu-trusty-64.40848 > 10.0.0.1.8882: Flags [P.], seq 2839620065:2839620229, ack 779302498, win 58, options [nop,nop,TS val 4294715260 ecr 4294715236], length 164
