11:52:34.978466 IP 10.0.0.2.54912 > vagrant-ubuntu-trusty-64.8882: Flags [P.], seq 1869047370:1869047534, ack 3256007303, win 58, options [nop,nop,TS val 4294713556 ecr 4294713526], length 164
11:52:34.978542 IP vagrant-ubuntu-trusty-64.8882 > 10.0.0.2.54912: Flags [.], ack 1869047534, win 63, options [nop,nop,TS val 4294713566 ecr 4294713556], length 0
11:52:34.998100 IP 10.0.0.2.54912 > vagrant-ubuntu-trusty-64.8882: Flags [P.], seq 1869047534:1869047698, ack 3256007303, win 58, options [nop,nop,TS val 4294713576 ecr 4294713546], length 164
11:52:34.998141 IP vagrant-ubuntu-trusty-64.8882 > 10.0.0.2.54912: Flags [.], ack 1869047698, win 65, options [nop,nop,TS val 4294713586 ecr 4294713576], length 0
11:52:35.018112 IP 10.0.0.2.54912 > vagrant-ubuntu-trusty-64.8882: Flags [P.], seq 1869047698:1869047862, ack 3256007303, win 58, options [nop,nop,TS val 4294713596 ecr 4294713566], length 164
11:52:35.018131 IP vagrant-ubuntu-trusty-64.8882 > 10.0.0.2.54912: Flags [.], ack 1869047862, win 68, options [nop,nop,TS val 4294713607 ecr 4294713596], length 0
11:52:35.039109 IP 10.0.0.2.54912 > vagrant-ubuntu-trusty-64.8882: Flags [P.], seq 1869047862:1869048026, ack 3256007303, win 58, options [nop,nop,TS val 4294713616 ecr 4294713586], length 164
11:52:35.039172 IP vagrant-ubuntu-trusty-64.8882 > 10.0.0.2.54912: Flags [.], ack 1869048026, win 70, options [nop,nop,TS val 4294713627 ecr 4294713616], length 0
11:52:35.058003 IP 10.0.0.2.54912 > vagrant-ubuntu-trusty-64.8882: Flags [P.], seq 1869048026:1869048190, ack 3256007303, win 58, options [nop,nop,TS val 4294713636 ecr 4294713607], length 164
11:52:35.058064 IP vagrant-ubuntu-trusty-64.8882 > 10.0.0.2.54912: Flags [.], ack 1869048190, win 72, options [nop,nop,TS val 4294713646 ecr 4294713636], length 0
11:52:35.078788 IP 10.0.0.2.54912 > vagrant-ubuntu-trusty-64.8882: Flags [P.], seq 1869048190:1869048354, ack 3256007303, win 58, options [nop,nop,TS val 4294713656 ecr 4294713627], length 164
11:52:35.078845 IP vagrant-ubuntu-trusty-64.8882 > 10.0.0.2.54912: Flags [.], ack 1869048354, win 74, options [nop,nop,TS val 4294713667 ecr 4294713656], length 0
11:52:35.097363 IP 10.0.0.2.54912 > vagrant-ubuntu-trusty-64.8882: Flags [P.], seq 1869048354:1869048518, ack 3256007303, win 58, options [nop,nop,TS val 4294713676 ecr 4294713646], length 164
11:52:35.097381 IP vagrant-ubuntu-trusty-64.8882 > 10.0.0.2.54912: Flags [.], ack 1869048518, win 76, options [nop,nop,TS val 4294713686 ecr 4294713676], length 0
11:52:35.118379 IP 10.0.0.2.54912 > vagrant-ubuntu-trusty-64.8882: Flags [P.], seq 1869048518:1869048682, ack 3256007303, win 58, options [nop,nop,TS val 4294713696 ecr 4294713667], length 164
11:52:35.118437 IP vagrant-ubuntu-trusty-64.8882 > 10.0.0.2.54912: Flags [.], ack 1869048682, win 78, options [nop,nop,TS val 4294713707 ecr 4294713696], length 0
11:52:35.137837 IP 10.0.0.2.54912 > vagrant-ubuntu-trusty-64.8882: Flags [P.], seq 1869048682:1869048846, ack 3256007303, win 58, options [nop,nop,TS val 4294713716 ecr 4294713686], length 164
11:52:35.137881 IP vagrant-ubuntu-trusty-64.8882 > 10.0.0.2.54912: Flags [.], ack 1869048846, win 80, options [nop,nop,TS val 4294713726 ecr 4294713716], length 0
11:52:35.157499 IP 10.0.0.2.54912 > vagrant-ubuntu-trusty-64.8882: Flags [P.], seq 1869048846:1869049010, ack 3256007303, win 58, options [nop,nop,TS val 4294713736 ecr 4294713707], length 164
11:52:35.157541 IP vagrant-ubuntu-trusty-64.8882 > 10.0.0.2.54912: Flags [.], ack 1869049010, win 82, options [nop,nop,TS val 4294713746 ecr 4294713736], length 0
11:52:35.181180 IP 10.0.0.2.54912 > vagrant-ubuntu-trusty-64.8882: Flags [P.], seq 1869049010:1869049174, ack 3256007303, win 58, options [nop,nop,TS val 4294713756 ecr 4294713726], length 164
11:52:35.181209 IP vagrant-ubuntu-trusty-64.8882 > 10.0.0.2.54912: Flags [.], ack 1869049174, win 84, options [nop,nop,TS val 4294713770 ecr 4294713756], length 0
11:52:35.213142 IP 10.0.0.2.54912 > vagrant-ubuntu-trusty-64.8882: Flags [P.], seq 1869049174:1869049338, ack 3256007303, win 58, options [nop,nop,TS val 4294713776 ecr 4294713746], length 164
11:52:35.213166 IP vagrant-ubuntu-trusty-64.8882 > 10.0.0.2.54912: Flags [.], ack 1869049338, win 86, options [nop,nop,TS val 4294713802 ecr 4294713776], length 0
11:52:35.238190 IP 10.0.0.2.54912 > vagrant-ubuntu-trusty-64.8882: Flags [P.], seq 1869049338:1869049502, ack 3256007303, win 58, options [nop,nop,TS val 4294713796 ecr 4294713770], length 164
11:52:35.238275 IP vagrant-ubuntu-trusty-64.8882 > 10.0.0.2.54912: Flags [.], ack 1869049502, win 88, options [nop,nop,TS val 4294713826 ecr 4294713796], length 0
11:52:35.290125 IP 10.0.0.2.54912 > vagrant-ubuntu-trusty-64.8882: Flags [P.], seq 1869049666:1869049830, ack 3256007303, win 58, options [nop,nop,TS val 4294713836 ecr 4294713802], length 164
11:52:35.290277 IP vagrant-ubuntu-trusty-64.8882 > 10.0.0.2.54912: Flags [.], ack 1869049502, win 91, options [nop,nop,TS val 4294713878 ecr 4294713796,nop,nop,sack 1 {1869049666:1869049830}], length 0
11:52:35.309238 IP 10.0.0.2.54912 > vagrant-ubuntu-trusty-64.8882: Flags [P.], seq 1869049994:1869050158, ack 3256007303, win 58, options [nop,nop,TS val 4294713876 ecr 4294713826], length 164
11:52:35.309260 IP vagrant-ubuntu-trusty-64.8882 > 10.0.0.2.54912: Flags [.], ack 1869049502, win 93, options [nop,nop,TS val 4294713898 ecr 4294713796,nop,nop,sack 2 {1869049994:1869050158}{1869049666:1869049830}], length 0
11:52:35.344277 IP 10.0.0.2.54912 > vagrant-ubuntu-trusty-64.8882: Flags [P.], seq 1869049502:1869049666, ack 3256007303, win 58, options [nop,nop,TS val 4294713907 ecr 4294713898], length 164
11:52:35.344294 IP vagrant-ubuntu-trusty-64.8882 > 10.0.0.2.54912: Flags [.], ack 1869049830, win 95, options [nop,nop,TS val 4294713933 ecr 4294713907,nop,nop,sack 1 {1869049994:1869050158}], length 0
11:52:35.373388 IP 10.0.0.2.54912 > vagrant-ubuntu-trusty-64.8882: Flags [P.], seq 1869050322:1869050650, ack 3256007303, win 58, options [nop,nop,TS val 4294713943 ecr 4294713933], length 328
11:52:35.373410 IP vagrant-ubuntu-trusty-64.8882 > 10.0.0.2.54912: Flags [.], ack 1869049830, win 97, options [nop,nop,TS val 4294713962 ecr 4294713907,nop,nop,sack 2 {1869050322:1869050650}{1869049994:1869050158}], length 0
11:52:35.388234 IP 10.0.0.2.54912 > vagrant-ubuntu-trusty-64.8882: Flags [P.], seq 1869050650:1869050814, ack 3256007303, win 58, options [nop,nop,TS val 4294713957 ecr 4294713933], length 164
11:52:35.388261 IP vagrant-ubuntu-trusty-64.8882 > 10.0.0.2.54912: Flags [.], ack 1869049830, win 99, options [nop,nop,TS val 4294713977 ecr 4294713907,nop,nop,sack 2 {1869050322:1869050814}{1869049994:1869050158}], length 0
11:52:35.422553 IP 10.0.0.2.54912 > vagrant-ubuntu-trusty-64.8882: Flags [P.], seq 1869050814:1869050978, ack 3256007303, win 58, options [nop,nop,TS val 4294713987 ecr 4294713977], length 164
11:52:35.422596 IP vagrant-ubuntu-trusty-64.8882 > 10.0.0.2.54912: Flags [.], ack 1869049830, win 101, options [nop,nop,TS val 4294714011 ecr 4294713907,nop,nop,sack 2 {1869050322:1869050978}{1869049994:1869050158}], length 0
11:52:35.431811 IP 10.0.0.2.54912 > vagrant-ubuntu-trusty-64.8882: Flags [P.], seq 1869050978:1869051142, ack 3256007303, win 58, options [nop,nop,TS val 4294713996 ecr 4294713977], length 164
11:52:35.431829 IP vagrant-ubuntu-trusty-64.8882 > 10.0.0.2.54912: Flags [.], ack 1869049830, win 103, options [nop,nop,TS val 4294714020 ecr 4294713907,nop,nop,sack 2 {1869050322:1869051142}{1869049994:1869050158}], length 0
11:52:35.453384 IP 10.0.0.2.54912 > vagrant-ubuntu-trusty-64.8882: Flags [P.], seq 1869049830:1869049994, ack 3256007303, win 58, options [nop,nop,TS val 4294714021 ecr 4294714011], length 164
11:52:35.453401 IP vagrant-ubuntu-trusty-64.8882 > 10.0.0.2.54912: Flags [.], ack 1869050158, win 105, options [nop,nop,TS val 4294714041 ecr 4294714021,nop,nop,sack 1 {1869050322:1869051142}], length 0
11:52:35.453560 IP 10.0.0.2.54912 > vagrant-ubuntu-trusty-64.8882: Flags [P.], seq 1869050158:1869050322, ack 3256007303, win 58, options [nop,nop,TS val 4294714021 ecr 4294714011], length 164
11:52:35.453570 IP vagrant-ubuntu-trusty-64.8882 > 10.0.0.2.54912: Flags [.], ack 1869051142, win 107, options [nop,nop,TS val 4294714042 ecr 4294714021], length 0
11:52:35.469280 IP 10.0.0.2.54912 > vagrant-ubuntu-trusty-64.8882: Flags [P.], seq 1869051306:1869051470, ack 3256007303, win 58, options [nop,nop,TS val 4294714036 ecr 4294714020], length 164
11:52:35.469442 IP vagrant-ubuntu-trusty-64.8882 > 10.0.0.2.54912: Flags [.], ack 1869051142, win 109, options [nop,nop,TS val 4294714057 ecr 4294714021,nop,nop,sack 1 {1869051306:1869051470}], length 0
11:52:35.491344 IP 10.0.0.2.54912 > vagrant-ubuntu-trusty-64.8882: Flags [P.], seq 1869051470:1869051634, ack 3256007303, win 58, options [nop,nop,TS val 4294714056 ecr 4294714042], length 164
11:52:35.491467 IP vagrant-ubuntu-trusty-64.8882 > 10.0.0.2.54912: Flags [.], ack 1869051142, win 111, options [nop,nop,TS val 4294714079 ecr 4294714021,nop,nop,sack 1 {1869051306:1869051634}], length 0
11:52:35.507297 IP 10.0.0.2.54912 > vagrant-ubuntu-trusty-64.8882: Flags [P.], seq 1869051142:1869051306, ack 3256007303, win 58, options [nop,nop,TS val 4294714076 ecr 4294714057], length 164
11:52:35.507317 IP vagrant-ubuntu-trusty-64.8882 > 10.0.0.2.54912: Flags [.], ack 1869051634, win 114, options [nop,nop,TS val 4294714096 ecr 4294714076], length 0
11:52:35.517428 IP 10.0.0.2.54912 > vagrant-ubuntu-trusty-64.8882: Flags [P.], seq 1869051798:1869051962, ack 3256007303, win 58, options [nop,nop,TS val 4294714096 ecr 4294714079], length 164
11:52:35.517465 IP vagrant-ubuntu-trusty-64.8882 > 10.0.0.2.54912: Flags [.], ack 1869051634, win 116, options [nop,nop,TS val 4294714106 ecr 4294714076,nop,nop,sack 1 {1869051798:1869051962}], length 0
11:52:35.560303 IP 10.0.0.2.54912 > vagrant-ubuntu-trusty-64.8882: Flags [P.], seq 1869051634:1869051798, ack 3256007303, win 58, options [nop,nop,TS val 4294714125 ecr 4294714106], length 164
11:52:35.560390 IP vagrant-ubuntu-trusty-64.8882 > 10.0.0.2.54912: Flags [.], ack 1869051962, win 118, options [nop,nop,TS val 4294714148 ecr 4294714125], length 0
11:52:35.590291 IP 10.0.0.2.54912 > vagrant-ubuntu-trusty-64.8882: Flags [P.], seq 1869052290:1869052454, ack 3256007303, win 58, options [nop,nop,TS val 4294714157 ecr 4294714106], length 164
11:52:35.590331 IP vagrant-ubuntu-trusty-64.8882 > 10.0.0.2.54912: Flags [.], ack 1869051962, win 120, options [nop,nop,TS val 4294714179 ecr 4294714125,nop,nop,sack 1 {1869052290:1869052454}], length 0
11:52:35.822411 IP 10.0.0.2.54912 > vagrant-ubuntu-trusty-64.8882: Flags [P.], seq 1869051962:1869052290, ack 3256007303, win 58, options [nop,nop,TS val 4294714390 ecr 4294714179], length 328
11:52:35.822448 IP vagrant-ubuntu-trusty-64.8882 > 10.0.0.2.54912: Flags [.], ack 1869052454, win 122, options [nop,nop,TS val 4294714411 ecr 4294714390], length 0
11:52:35.853365 IP 10.0.0.2.54912 > vagrant-ubuntu-trusty-64.8882: Flags [P.], seq 1869052454:1869054586, ack 3256007303, win 58, options [nop,nop,TS val 4294714420 ecr 4294714411], length 2132
11:52:35.853413 IP vagrant-ubuntu-trusty-64.8882 > 10.0.0.2.54912: Flags [.], ack 1869054586, win 130, options [nop,nop,TS val 4294714441 ecr 4294714420], length 0
11:52:35.870490 IP 10.0.0.2.54912 > vagrant-ubuntu-trusty-64.8882: Flags [P.], seq 1869054586:1869054750, ack 3256007303, win 58, options [nop,nop,TS val 4294714436 ecr 4294714411], length 164
11:52:35.870528 IP vagrant-ubuntu-trusty-64.8882 > 10.0.0.2.54912: Flags [.], ack 1869054750, win 136, options [nop,nop,TS val 4294714459 ecr 4294714436], length 0
11:52:35.888797 IP 10.0.0.2.54912 > vagrant-ubuntu-trusty-64.8882: Flags [P.], seq 1869054750:1869054914, ack 3256007303, win 58, options [nop,nop,TS val 4294714456 ecr 4294714441], length 164
11:52:35.888811 IP vagrant-ubuntu-trusty-64.8882 > 10.0.0.2.54912: Flags [.], ack 1869054914, win 142, options [nop,nop,TS val 4294714477 ecr 4294714456], length 0
11:52:35.910329 IP 10.0.0.2.54912 > vagrant-ubuntu-trusty-64.8882: Flags [P.], seq 1869054914:1869055078, ack 3256007303, win 58, options [nop,nop,TS val 4294714476 ecr 4294714459], length 164
11:52:35.910349 IP vagrant-ubuntu-trusty-64.8882 > 10.0.0.2.54912: Flags [.], ack 1869055078, win 147, options [nop,nop,TS val 4294714499 ecr 4294714476], length 0
11:52:35.928767 IP 10.0.0.2.54912 > vagrant-ubuntu-trusty-64.8882: Flags [P.], seq 1869055078:1869055242, ack 3256007303, win 58, options [nop,nop,TS val 4294714496 ecr 4294714477], length 164
11:52:35.928797 IP vagrant-ubuntu-trusty-64.8882 > 10.0.0.2.54912: Flags [.], ack 1869055242, win 153, options [nop,nop,TS val 4294714517 ecr 4294714496], length 0
11:52:35.947135 IP 10.0.0.2.54912 > vagrant-ubuntu-trusty-64.8882: Flags [P.], seq 1869055242:1869055406, ack 3256007303, win 58, options [nop,nop,TS val 4294714516 ecr 4294714499], length 164
11:52:35.947170 IP vagrant-ubuntu-trusty-64.8882 > 10.0.0.2.54912: Flags [.], ack 1869055406, win 159, options [nop,nop,TS val 4294714536 ecr 4294714516], length 0
11:52:35.968724 IP 10.0.0.2.54912 > vagrant-ubuntu-trusty-64.8882: Flags [P.], seq 1869055406:1869055570, ack 3256007303, win 58, options [nop,nop,TS val 4294714536 ecr 4294714517], length 164
11:52:35.968762 IP vagrant-ubuntu-trusty-64.8882 > 10.0.0.2.54912: Flags [.], ack 1869055570, win 164, options [nop,nop,TS val 4294714557 ecr 4294714536], length 0
11:52:35.990405 IP 10.0.0.2.54912 > vagrant-ubuntu-trusty-64.8882: Flags [P.], seq 1869055570:1869055734, ack 3256007303, win 58, options [nop,nop,TS val 4294714556 ecr 4294714536], length 164
11:52:35.990465 IP vagrant-ubuntu-trusty-64.8882 > 10.0.0.2.54912: Flags [.], ack 1869055734, win 170, options [nop,nop,TS val 4294714578 ecr 4294714556], length 0
11:52:36.008575 IP 10.0.0.2.54912 > vagrant-ubuntu-trusty-64.8882: Flags [P.], seq 1869055734:1869055898, ack 3256007303, win 58, options [nop,nop,TS val 4294714576 ecr 4294714557], length 164
11:52:36.008606 IP vagrant-ubuntu-trusty-64.8882 > 10.0.0.2.54912: Flags [.], ack 1869055898, win 176, options [nop,nop,TS val 4294714597 ecr 4294714576], length 0
11:52:36.033478 IP 10.0.0.2.54912 > vagrant-ubuntu-trusty-64.8882: Flags [P.], seq 1869055898:1869056062, ack 3256007303, win 58, options [nop,nop,TS val 4294714596 ecr 4294714578], length 164
11:52:36.033548 IP vagrant-ubuntu-trusty-64.8882 > 10.0.0.2.54912: Flags [.], ack 1869056062, win 181, options [nop,nop,TS val 4294714621 ecr 4294714596], length 0
11:52:36.051232 IP 10.0.0.2.54912 > vagrant-ubuntu-trusty-64.8882: Flags [P.], seq 1869056062:1869056226, ack 3256007303, win 58, options [nop,nop,TS val 4294714616 ecr 4294714597], length 164
11:52:36.051248 IP vagrant-ubuntu-trusty-64.8882 > 10.0.0.2.54912: Flags [.], ack 1869056226, win 187, options [nop,nop,TS val 4294714640 ecr 4294714616], length 0
11:52:36.073413 IP 10.0.0.2.54912 > vagrant-ubuntu-trusty-64.8882: Flags [P.], seq 1869056226:1869056390, ack 3256007303, win 58, options [nop,nop,TS val 4294714636 ecr 4294714621], length 164
11:52:36.073492 IP vagrant-ubuntu-trusty-64.8882 > 10.0.0.2.54912: Flags [.], ack 1869056390, win 193, options [nop,nop,TS val 4294714661 ecr 4294714636], length 0
11:52:36.091610 IP 10.0.0.2.54912 > vagrant-ubuntu-trusty-64.8882: Flags [P.], seq 1869056390:1869056554, ack 3256007303, win 58, options [nop,nop,TS val 4294714656 ecr 4294714640], length 164
11:52:36.091670 IP vagrant-ubuntu-trusty-64.8882 > 10.0.0.2.54912: Flags [.], ack 1869056554, win 198, options [nop,nop,TS val 4294714680 ecr 4294714656], length 0
11:52:36.112613 IP 10.0.0.2.54912 > vagrant-ubuntu-trusty-64.8882: Flags [P.], seq 1869056554:1869056718, ack 3256007303, win 58, options [nop,nop,TS val 4294714676 ecr 4294714661], length 164
11:52:36.112643 IP vagrant-ubuntu-trusty-64.8882 > 10.0.0.2.54912: Flags [.], ack 1869056718, win 204, options [nop,nop,TS val 4294714701 ecr 4294714676], length 0
11:52:36.134541 IP 10.0.0.2.54912 > vagrant-ubuntu-trusty-64.8882: Flags [P.], seq 1869056718:1869056882, ack 3256007303, win 58, options [nop,nop,TS val 4294714696 ecr 4294714680], length 164
11:52:36.134609 IP vagrant-ubuntu-trusty-64.8882 > 10.0.0.2.54912: Flags [.], ack 1869056882, win 209, options [nop,nop,TS val 4294714722 ecr 4294714696], length 0
11:52:36.152770 IP 10.0.0.2.54912 > vagrant-ubuntu-trusty-64.8882: Flags [P.], seq 1869056882:1869057046, ack 3256007303, win 58, options [nop,nop,TS val 4294714716 ecr 4294714701], length 164
11:52:36.152839 IP vagrant-ubuntu-trusty-64.8882 > 10.0.0.2.54912: Flags [.], ack 1869057046, win 215, options [nop,nop,TS val 4294714741 ecr 4294714716], length 0
11:52:36.174458 IP 10.0.0.2.54912 > vagrant-ubuntu-trusty-64.8882: Flags [P.], seq 1869057046:1869057210, ack 3256007303, win 58, options [nop,nop,TS val 4294714736 ecr 4294714722], length 164
11:52:36.174536 IP vagrant-ubuntu-trusty-64.8882 > 10.0.0.2.54912: Flags [.], ack 1869057210, win 221, options [nop,nop,TS val 4294714762 ecr 4294714736], length 0
11:52:36.192627 IP 10.0.0.2.54912 > vagrant-ubuntu-trusty-64.8882: Flags [P.], seq 1869057210:1869057374, ack 3256007303, win 58, options [nop,nop,TS val 4294714756 ecr 4294714741], length 164
11:52:36.192675 IP vagrant-ubuntu-trusty-64.8882 > 10.0.0.2.54912: Flags [.], ack 1869057374, win 226, options [nop,nop,TS val 4294714781 ecr 4294714756], length 0
11:52:36.210664 IP 10.0.0.2.54912 > vagrant-ubuntu-trusty-64.8882: Flags [P.], seq 1869057374:1869057538, ack 3256007303, win 58, options [nop,nop,TS val 4294714776 ecr 4294714762], length 164
11:52:36.210691 IP vagrant-ubuntu-trusty-64.8882 > 10.0.0.2.54912: Flags [.], ack 1869057538, win 232, options [nop,nop,TS val 4294714799 ecr 4294714776], length 0
11:52:36.232615 IP 10.0.0.2.54912 > vagrant-ubuntu-trusty-64.8882: Flags [P.], seq 1869057538:1869057702, ack 3256007303, win 58, options [nop,nop,TS val 4294714796 ecr 4294714781], length 164
11:52:36.232702 IP vagrant-ubuntu-trusty-64.8882 > 10.0.0.2.54912: Flags [.], ack 1869057702, win 238, options [nop,nop,TS val 4294714820 ecr 4294714796], length 0
11:52:36.250472 IP 10.0.0.2.54912 > vagrant-ubuntu-trusty-64.8882: Flags [P.], seq 1869057702:1869057866, ack 3256007303, win 58, options [nop,nop,TS val 4294714816 ecr 4294714799], length 164
11:52:36.250502 IP vagrant-ubuntu-trusty-64.8882 > 10.0.0.2.54912: Flags [.], ack 1869057866, win 243, options [nop,nop,TS val 4294714839 ecr 4294714816], length 0
11:52:36.275769 IP 10.0.0.2.54912 > vagrant-ubuntu-trusty-64.8882: Flags [P.], seq 1869057866:1869058030, ack 3256007303, win 58, options [nop,nop,TS val 4294714836 ecr 4294714820], length 164
11:52:36.275808 IP vagrant-ubuntu-trusty-64.8882 > 10.0.0.2.54912: Flags [.], ack 1869058030, win 249, options [nop,nop,TS val 4294714864 ecr 4294714836], length 0
11:52:36.293734 IP 10.0.0.2.54912 > vagrant-ubuntu-trusty-64.8882: Flags [P.], seq 1869058030:1869058194, ack 3256007303, win 58, options [nop,nop,TS val 4294714856 ecr 4294714839], length 164
11:52:36.293791 IP vagrant-ubuntu-trusty-64.8882 > 10.0.0.2.54912: Flags [.], ack 1869058194, win 255, options [nop,nop,TS val 4294714882 ecr 4294714856], length 0
11:52:36.314766 IP 10.0.0.2.54912 > vagrant-ubuntu-trusty-64.8882: Flags [P.], seq 1869058194:1869058358, ack 3256007303, win 58, options [nop,nop,TS val 4294714876 ecr 4294714864], length 164
11:52:36.314782 IP vagrant-ubuntu-trusty-64.8882 > 10.0.0.2.54912: Flags [.], ack 1869058358, win 260, options [nop,nop,TS val 4294714903 ecr 4294714876], length 0
11:52:36.336804 IP 10.0.0.2.54912 > vagrant-ubuntu-trusty-64.8882: Flags [P.], seq 1869058358:1869058522, ack 3256007303, win 58, options [nop,nop,TS val 4294714896 ecr 4294714882], length 164
11:52:36.336880 IP vagrant-ubuntu-trusty-64.8882 > 10.0.0.2.54912: Flags [.], ack 1869058522, win 266, options [nop,nop,TS val 4294714925 ecr 4294714896], length 0
11:52:36.354580 IP 10.0.0.2.54912 > vagrant-ubuntu-trusty-64.8882: Flags [P.], seq 1869058522:1869058686, ack 3256007303, win 58, options [nop,nop,TS val 4294714916 ecr 4294714903], length 164
11:52:36.354597 IP vagrant-ubuntu-trusty-64.8882 > 10.0.0.2.54912: Flags [.], ack 1869058686, win 272, options [nop,nop,TS val 4294714943 ecr 4294714916], length 0
11:52:36.375986 IP 10.0.0.2.54912 > vagrant-ubuntu-trusty-64.8882: Flags [P.], seq 1869058686:1869058850, ack 3256007303, win 58, options [nop,nop,TS val 4294714936 ecr 4294714903], length 164
11:52:36.376002 IP vagrant-ubuntu-trusty-64.8882 > 10.0.0.2.54912: Flags [.], ack 1869058850, win 277, options [nop,nop,TS val 4294714964 ecr 4294714936], length 0
11:52:36.394379 IP 10.0.0.2.54912 > vagrant-ubuntu-trusty-64.8882: Flags [P.], seq 1869058850:1869059014, ack 3256007303, win 58, options [nop,nop,TS val 4294714956 ecr 4294714943], length 164
11:52:36.394389 IP vagrant-ubuntu-trusty-64.8882 > 10.0.0.2.54912: Flags [.], ack 1869059014, win 283, options [nop,nop,TS val 4294714983 ecr 4294714956], length 0
11:52:36.415912 IP 10.0.0.2.54912 > vagrant-ubuntu-trusty-64.8882: Flags [P.], seq 1869059014:1869059178, ack 3256007303, win 58, options [nop,nop,TS val 4294714976 ecr 4294714964], length 164
11:52:36.415943 IP vagrant-ubuntu-trusty-64.8882 > 10.0.0.2.54912: Flags [.], ack 1869059178, win 289, options [nop,nop,TS val 4294715004 ecr 4294714976], length 0
11:52:36.434762 IP 10.0.0.2.54912 > vagrant-ubuntu-trusty-64.8882: Flags [P.], seq 1869059178:1869059342, ack 3256007303, win 58, options [nop,nop,TS val 4294714996 ecr 4294714983], length 164
11:52:36.434824 IP vagrant-ubuntu-trusty-64.8882 > 10.0.0.2.54912: Flags [.], ack 1869059342, win 294, options [nop,nop,TS val 4294715023 ecr 4294714996], length 0
11:52:36.455827 IP 10.0.0.2.54912 > vagrant-ubuntu-trusty-64.8882: Flags [P.], seq 1869059342:1869059506, ack 3256007303, win 58, options [nop,nop,TS val 4294715016 ecr 4294715004], length 164
11:52:36.455858 IP vagrant-ubuntu-trusty-64.8882 > 10.0.0.2.54912: Flags [.], ack 1869059506, win 300, options [nop,nop,TS val 4294715044 ecr 4294715016], length 0
11:52:36.477652 IP 10.0.0.2.54912 > vagrant-ubuntu-trusty-64.8882: Flags [P.], seq 1869059506:1869059670, ack 3256007303, win 58, options [nop,nop,TS val 4294715036 ecr 4294715023], length 164
11:52:36.477716 IP vagrant-ubuntu-trusty-64.8882 > 10.0.0.2.54912: Flags [.], ack 1869059670, win 306, options [nop,nop,TS val 4294715066 ecr 4294715036], length 0
11:52:36.496103 IP 10.0.0.2.54912 > vagrant-ubuntu-trusty-64.8882: Flags [P.], seq 1869059670:1869059834, ack 3256007303, win 58, options [nop,nop,TS val 4294715056 ecr 4294715044], length 164
11:52:36.496120 IP vagrant-ubuntu-trusty-64.8882 > 10.0.0.2.54912: Flags [.], ack 1869059834, win 311, options [nop,nop,TS val 4294715085 ecr 4294715056], length 0
11:52:36.513885 IP 10.0.0.2.54912 > vagrant-ubuntu-trusty-64.8882: Flags [P.], seq 1869059834:1869059998, ack 3256007303, win 58, options [nop,nop,TS val 4294715076 ecr 4294715044], length 164
11:52:36.513902 IP vagrant-ubuntu-trusty-64.8882 > 10.0.0.2.54912: Flags [.], ack 1869059998, win 317, options [nop,nop,TS val 4294715102 ecr 4294715076], length 0
11:52:36.535961 IP 10.0.0.2.54912 > vagrant-ubuntu-trusty-64.8882: Flags [P.], seq 1869059998:1869060162, ack 3256007303, win 58, options [nop,nop,TS val 4294715096 ecr 4294715085], length 164
11:52:36.536031 IP vagrant-ubuntu-trusty-64.8882 > 10.0.0.2.54912: Flags [.], ack 1869060162, win 323, options [nop,nop,TS val 4294715124 ecr 4294715096], length 0
11:52:36.553788 IP 10.0.0.2.54912 > vagrant-ubuntu-trusty-64.8882: Flags [P.], seq 1869060162:1869060326, ack 3256007303, win 58, options [nop,nop,TS val 4294715116 ecr 4294715102], length 164
11:52:36.553804 IP vagrant-ubuntu-trusty-64.8882 > 10.0.0.2.54912: Flags [.], ack 1869060326, win 328, options [nop,nop,TS val 4294715142 ecr 4294715116], length 0
11:52:36.576088 IP 10.0.0.2.54912 > vagrant-ubuntu-trusty-64.8882: Flags [P.], seq 1869060326:1869060490, ack 3256007303, win 58, options [nop,nop,TS val 4294715136 ecr 4294715124], length 164
11:52:36.576110 IP vagrant-ubuntu-trusty-64.8882 > 10.0.0.2.54912: Flags [.], ack 1869060490, win 334, options [nop,nop,TS val 4294715165 ecr 4294715136], length 0
11:52:36.596720 IP 10.0.0.2.54912 > vagrant-ubuntu-trusty-64.8882: Flags [P.], seq 1869060490:1869060654, ack 3256007303, win 58, options [nop,nop,TS val 4294715156 ecr 4294715142], length 164
11:52:36.596754 IP vagrant-ubuntu-trusty-64.8882 > 10.0.0.2.54912: Flags [.], ack 1869060654, win 340, options [nop,nop,TS val 4294715185 ecr 4294715156], length 0
11:52:36.618666 IP 10.0.0.2.54912 > vagrant-ubuntu-trusty-64.8882: Flags [P.], seq 1869060654:1869060818, ack 3256007303, win 58, options [nop,nop,TS val 4294715176 ecr 4294715165], length 164
11:52:36.618731 IP vagrant-ubuntu-trusty-64.8882 > 10.0.0.2.54912: Flags [.], ack 1869060818, win 345, options [nop,nop,TS val 4294715207 ecr 4294715176], length 0
11:52:36.640017 IP 10.0.0.2.54912 > vagrant-ubuntu-trusty-64.8882: Flags [P.], seq 1869060818:1869060982, ack 3256007303, win 58, options [nop,nop,TS val 4294715196 ecr 4294715185], length 164
11:52:36.640087 IP vagrant-ubuntu-trusty-64.8882 > 10.0.0.2.54912: Flags [.], ack 1869060982, win 351, options [nop,nop,TS val 4294715228 ecr 4294715196], length 0
11:52:36.657893 IP 10.0.0.2.54912 > vagrant-ubuntu-trusty-64.8882: Flags [P.], seq 1869060982:1869061146, ack 3256007303, win 58, options [nop,nop,TS val 4294715216 ecr 4294715185], length 164
11:52:36.657905 IP vagrant-ubuntu-trusty-64.8882 > 10.0.0.2.54912: Flags [.], ack 1869061146, win 357, options [nop,nop,TS val 4294715246 ecr 4294715216], length 0
11:52:36.679960 IP 10.0.0.2.54912 > vagrant-ubuntu-trusty-64.8882: Flags [P.], seq 1869061146:1869061310, ack 3256007303, win 58, options [nop,nop,TS val 4294715236 ecr 4294715207], length 164
11:52:36.680037 IP vagrant-ubuntu-trusty-64.8882 > 10.0.0.2.54912: Flags [.], ack 1869061310, win 358, options [nop,nop,TS val 4294715268 ecr 4294715236], length 0
11:52:36.699216 IP 10.0.0.2.54912 > vagrant-ubuntu-trusty-64.8882: Flags [P.], seq 1869061310:1869061474, ack 3256007303, win 58, options [nop,nop,TS val 4294715256 ecr 4294715228], length 164
11:52:36.699302 IP vagrant-ubuntu-trusty-64.8882 > 10.0.0.2.54912: Flags [.], ack 1869061474, win 358, options [nop,nop,TS val 4294715286 ecr 4294715256], length 0
11:52:36.719876 IP 10.0.0.2.54912 > vagrant-ubuntu-trusty-64.8882: Flags [P.], seq 1869061474:1869061638, ack 3256007303, win 58, options [nop,nop,TS val 4294715276 ecr 4294715246], length 164
11:52:36.719964 IP vagrant-ubuntu-trusty-64.8882 > 10.0.0.2.54912: Flags [.], ack 1869061638, win 358, options [nop,nop,TS val 4294715308 ecr 4294715276], length 0
11:52:36.738109 IP 10.0.0.2.54912 > vagrant-ubuntu-trusty-64.8882: Flags [P.], seq 1869061638:1869061802, ack 3256007303, win 58, options [nop,nop,TS val 4294715296 ecr 4294715268], length 164
11:52:36.738162 IP vagrant-ubuntu-trusty-64.8882 > 10.0.0.2.54912: Flags [.], ack 1869061802, win 358, options [nop,nop,TS val 4294715326 ecr 4294715296], length 0
11:52:36.759064 IP 10.0.0.2.54912 > vagrant-ubuntu-trusty-64.8882: Flags [P.], seq 1869061802:1869061966, ack 3256007303, win 58, options [nop,nop,TS val 4294715316 ecr 4294715286], length 164
11:52:36.759094 IP vagrant-ubuntu-trusty-64.8882 > 10.0.0.2.54912: Flags [.], ack 1869061966, win 358, options [nop,nop,TS val 4294715347 ecr 4294715316], length 0
11:52:36.777933 IP 10.0.0.2.54912 > vagrant-ubuntu-trusty-64.8882: Flags [P.], seq 1869061966:1869062130, ack 3256007303, win 58, options [nop,nop,TS val 4294715336 ecr 4294715308], length 164
11:52:36.777998 IP vagrant-ubuntu-trusty-64.8882 > 10.0.0.2.54912: Flags [.], ack 1869062130, win 358, options [nop,nop,TS val 4294715366 ecr 4294715336], length 0
11:52:36.798787 IP 10.0.0.2.54912 > vagrant-ubuntu-trusty-64.8882: Flags [P.], seq 1869062130:1869062294, ack 3256007303, win 58, options [nop,nop,TS val 4294715356 ecr 4294715326], length 164
11:52:36.798804 IP vagrant-ubuntu-trusty-64.8882 > 10.0.0.2.54912: Flags [.], ack 1869062294, win 358, options [nop,nop,TS val 4294715387 ecr 4294715356], length 0
11:52:36.817801 IP 10.0.0.2.54912 > vagrant-ubuntu-trusty-64.8882: Flags [P.], seq 1869062294:1869062458, ack 3256007303, win 58, options [nop,nop,TS val 4294715376 ecr 4294715347], length 164
11:52:36.817869 IP vagrant-ubuntu-trusty-64.8882 > 10.0.0.2.54912: Flags [.], ack 1869062458, win 358, options [nop,nop,TS val 4294715406 ecr 4294715376], length 0
11:52:36.838592 IP 10.0.0.2.54912 > vagrant-ubuntu-trusty-64.8882: Flags [P.], seq 1869062458:1869062622, ack 3256007303, win 58, options [nop,nop,TS val 4294715396 ecr 4294715366], length 164
11:52:36.838604 IP vagrant-ubuntu-trusty-64.8882 > 10.0.0.2.54912: Flags [.], ack 1869062622, win 358, options [nop,nop,TS val 4294715427 ecr 4294715396], length 0
11:52:36.857095 IP 10.0.0.2.54912 > vagrant-ubuntu-trusty-64.8882: Flags [P.], seq 1869062622:1869062786, ack 3256007303, win 58, options [nop,nop,TS val 4294715416 ecr 4294715387], length 164
11:52:36.857125 IP vagrant-ubuntu-trusty-64.8882 > 10.0.0.2.54912: Flags [.], ack 1869062786, win 358, options [nop,nop,TS val 4294715445 ecr 4294715416], length 0
11:52:36.881949 IP 10.0.0.2.54912 > vagrant-ubuntu-trusty-64.8882: Flags [P.], seq 1869062786:1869062950, ack 3256007303, win 58, options [nop,nop,TS val 4294715436 ecr 4294715406], length 164
11:52:36.882006 IP vagrant-ubuntu-trusty-64.8882 > 10.0.0.2.54912: Flags [.], ack 1869062950, win 358, options [nop,nop,TS val 4294715470 ecr 4294715436], length 0
11:52:36.899843 IP 10.0.0.2.54912 > vagrant-ubuntu-trusty-64.8882: Flags [P.], seq 1869062950:1869063114, ack 3256007303, win 58, options [nop,nop,TS val 4294715456 ecr 4294715427], length 164
11:52:36.899857 IP vagrant-ubuntu-trusty-64.8882 > 10.0.0.2.54912: Flags [.], ack 1869063114, win 358, options [nop,nop,TS val 4294715488 ecr 4294715456], length 0
11:52:36.921918 IP 10.0.0.2.54912 > vagrant-ubuntu-trusty-64.8882: Flags [P.], seq 1869063114:1869063278, ack 3256007303, win 58, options [nop,nop,TS val 4294715477 ecr 4294715445], length 164
11:52:36.921988 IP vagrant-ubuntu-trusty-64.8882 > 10.0.0.2.54912: Flags [.], ack 1869063278, win 358, options [nop,nop,TS val 4294715510 ecr 4294715477], length 0
11:52:36.940139 IP 10.0.0.2.54912 > vagrant-ubuntu-trusty-64.8882: Flags [P.], seq 1869063278:1869063442, ack 3256007303, win 58, options [nop,nop,TS val 4294715496 ecr 4294715470], length 164
11:52:36.940211 IP vagrant-ubuntu-trusty-64.8882 > 10.0.0.2.54912: Flags [.], ack 1869063442, win 358, options [nop,nop,TS val 4294715528 ecr 4294715496], length 0
11:52:36.961843 IP 10.0.0.2.54912 > vagrant-ubuntu-trusty-64.8882: Flags [P.], seq 1869063442:1869063606, ack 3256007303, win 58, options [nop,nop,TS val 4294715517 ecr 4294715488], length 164
11:52:36.961923 IP vagrant-ubuntu-trusty-64.8882 > 10.0.0.2.54912: Flags [.], ack 1869063606, win 358, options [nop,nop,TS val 4294715550 ecr 4294715517], length 0
11:52:36.982494 IP 10.0.0.2.54912 > vagrant-ubuntu-trusty-64.8882: Flags [P.], seq 1869063606:1869063770, ack 3256007303, win 58, options [nop,nop,TS val 4294715536 ecr 4294715510], length 164
11:52:36.982505 IP vagrant-ubuntu-trusty-64.8882 > 10.0.0.2.54912: Flags [.], ack 1869063770, win 358, options [nop,nop,TS val 4294715571 ecr 4294715536], length 0
11:52:37.000919 IP 10.0.0.2.54912 > vagrant-ubuntu-trusty-64.8882: Flags [P.], seq 1869063770:1869063934, ack 3256007303, win 58, options [nop,nop,TS val 4294715557 ecr 4294715528], length 164
11:52:37.000935 IP vagrant-ubuntu-trusty-64.8882 > 10.0.0.2.54912: Flags [.], ack 1869063934, win 358, options [nop,nop,TS val 4294715589 ecr 4294715557], length 0
11:52:37.022952 IP 10.0.0.2.54912 > vagrant-ubuntu-trusty-64.8882: Flags [P.], seq 1869063934:1869064098, ack 3256007303, win 58, options [nop,nop,TS val 4294715576 ecr 4294715550], length 164
11:52:37.023144 IP vagrant-ubuntu-trusty-64.8882 > 10.0.0.2.54912: Flags [.], ack 1869064098, win 358, options [nop,nop,TS val 4294715612 ecr 4294715576], length 0
11:52:37.040857 IP 10.0.0.2.54912 > vagrant-ubuntu-trusty-64.8882: Flags [P.], seq 1869064098:1869064262, ack 3256007303, win 58, options [nop,nop,TS val 4294715597 ecr 4294715571], length 164
11:52:37.041029 IP vagrant-ubuntu-trusty-64.8882 > 10.0.0.2.54912: Flags [.], ack 1869064262, win 358, options [nop,nop,TS val 4294715629 ecr 4294715597], length 0
11:52:37.062866 IP 10.0.0.2.54912 > vagrant-ubuntu-trusty-64.8882: Flags [P.], seq 1869064262:1869064426, ack 3256007303, win 58, options [nop,nop,TS val 4294715616 ecr 4294715589], length 164
11:52:37.063203 IP vagrant-ubuntu-trusty-64.8882 > 10.0.0.2.54912: Flags [.], ack 1869064426, win 358, options [nop,nop,TS val 4294715652 ecr 4294715616], length 0
11:52:37.081055 IP 10.0.0.2.54912 > vagrant-ubuntu-trusty-64.8882: Flags [P.], seq 1869064426:1869064590, ack 3256007303, win 58, options [nop,nop,TS val 4294715636 ecr 4294715612], length 164
11:52:37.081250 IP vagrant-ubuntu-trusty-64.8882 > 10.0.0.2.54912: Flags [.], ack 1869064590, win 358, options [nop,nop,TS val 4294715670 ecr 4294715636], length 0
11:52:37.102775 IP 10.0.0.2.54912 > vagrant-ubuntu-trusty-64.8882: Flags [P.], seq 1869064590:1869064754, ack 3256007303, win 58, options [nop,nop,TS val 4294715656 ecr 4294715629], length 164
11:52:37.103060 IP vagrant-ubuntu-trusty-64.8882 > 10.0.0.2.54912: Flags [.], ack 1869064754, win 358, options [nop,nop,TS val 4294715691 ecr 4294715656], length 0
11:52:37.121105 IP 10.0.0.2.54912 > vagrant-ubuntu-trusty-64.8882: Flags [P.], seq 1869064754:1869064918, ack 3256007303, win 58, options [nop,nop,TS val 4294715676 ecr 4294715652], length 164
11:52:37.121157 IP vagrant-ubuntu-trusty-64.8882 > 10.0.0.2.54912: Flags [.], ack 1869064918, win 358, options [nop,nop,TS val 4294715710 ecr 4294715676], length 0
11:52:37.142192 IP 10.0.0.2.54912 > vagrant-ubuntu-trusty-64.8882: Flags [P.], seq 1869064918:1869065082, ack 3256007303, win 58, options [nop,nop,TS val 4294715696 ecr 4294715670], length 164
11:52:37.142382 IP vagrant-ubuntu-trusty-64.8882 > 10.0.0.2.54912: Flags [.], ack 1869065082, win 358, options [nop,nop,TS val 4294715731 ecr 4294715696], length 0
11:52:37.160275 IP 10.0.0.2.54912 > vagrant-ubuntu-trusty-64.8882: Flags [P.], seq 1869065082:1869065246, ack 3256007303, win 58, options [nop,nop,TS val 4294715716 ecr 4294715691], length 164
11:52:37.160317 IP vagrant-ubuntu-trusty-64.8882 > 10.0.0.2.54912: Flags [.], ack 1869065246, win 358, options [nop,nop,TS val 4294715749 ecr 4294715716], length 0
11:52:37.182181 IP 10.0.0.2.54912 > vagrant-ubuntu-trusty-64.8882: Flags [P.], seq 1869065246:1869065410, ack 3256007303, win 58, options [nop,nop,TS val 4294715736 ecr 4294715710], length 164
11:52:37.182386 IP vagrant-ubuntu-trusty-64.8882 > 10.0.0.2.54912: Flags [.], ack 1869065410, win 358, options [nop,nop,TS val 4294715771 ecr 4294715736], length 0
11:52:37.200094 IP 10.0.0.2.54912 > vagrant-ubuntu-trusty-64.8882: Flags [P.], seq 1869065410:1869065574, ack 3256007303, win 58, options [nop,nop,TS val 4294715756 ecr 4294715731], length 164
11:52:37.200134 IP vagrant-ubuntu-trusty-64.8882 > 10.0.0.2.54912: Flags [.], ack 1869065574, win 358, options [nop,nop,TS val 4294715789 ecr 4294715756], length 0
11:52:37.225128 IP 10.0.0.2.54912 > vagrant-ubuntu-trusty-64.8882: Flags [P.], seq 1869065574:1869065738, ack 3256007303, win 58, options [nop,nop,TS val 4294715776 ecr 4294715749], length 164
11:52:37.225321 IP vagrant-ubuntu-trusty-64.8882 > 10.0.0.2.54912: Flags [.], ack 1869065738, win 358, options [nop,nop,TS val 4294715814 ecr 4294715776], length 0
11:52:37.245926 IP 10.0.0.2.54912 > vagrant-ubuntu-trusty-64.8882: Flags [P.], seq 1869065738:1869065902, ack 3256007303, win 58, options [nop,nop,TS val 4294715796 ecr 4294715771], length 164
11:52:37.246121 IP vagrant-ubuntu-trusty-64.8882 > 10.0.0.2.54912: Flags [.], ack 1869065902, win 358, options [nop,nop,TS val 4294715835 ecr 4294715796], length 0
11:52:37.265030 IP 10.0.0.2.54912 > vagrant-ubuntu-trusty-64.8882: Flags [P.], seq 1869065902:1869066066, ack 3256007303, win 58, options [nop,nop,TS val 4294715816 ecr 4294715789], length 164
11:52:37.265259 IP vagrant-ubuntu-trusty-64.8882 > 10.0.0.2.54912: Flags [.], ack 1869066066, win 358, options [nop,nop,TS val 4294715854 ecr 4294715816], length 0
11:52:37.286255 IP 10.0.0.2.54912 > vagrant-ubuntu-trusty-64.8882: Flags [P.], seq 1869066066:1869066230, ack 3256007303, win 58, options [nop,nop,TS val 4294715836 ecr 4294715814], length 164
11:52:37.286451 IP vagrant-ubuntu-trusty-64.8882 > 10.0.0.2.54912: Flags [.], ack 1869066230, win 358, options [nop,nop,TS val 4294715875 ecr 4294715836], length 0
11:52:37.304194 IP 10.0.0.2.54912 > vagrant-ubuntu-trusty-64.8882: Flags [P.], seq 1869066230:1869066394, ack 3256007303, win 58, options [nop,nop,TS val 4294715856 ecr 4294715835], length 164
11:52:37.304235 IP vagrant-ubuntu-trusty-64.8882 > 10.0.0.2.54912: Flags [.], ack 1869066394, win 358, options [nop,nop,TS val 4294715893 ecr 4294715856], length 0
11:52:37.326493 IP 10.0.0.2.54912 > vagrant-ubuntu-trusty-64.8882: Flags [P.], seq 1869066394:1869066558, ack 3256007303, win 58, options [nop,nop,TS val 4294715876 ecr 4294715854], length 164
11:52:37.326614 IP vagrant-ubuntu-trusty-64.8882 > 10.0.0.2.54912: Flags [.], ack 1869066558, win 358, options [nop,nop,TS val 4294715915 ecr 4294715876], length 0
11:52:37.344024 IP 10.0.0.2.54912 > vagrant-ubuntu-trusty-64.8882: Flags [P.], seq 1869066558:1869066722, ack 3256007303, win 58, options [nop,nop,TS val 4294715897 ecr 4294715875], length 164
11:52:37.344068 IP vagrant-ubuntu-trusty-64.8882 > 10.0.0.2.54912: Flags [.], ack 1869066722, win 358, options [nop,nop,TS val 4294715933 ecr 4294715897], length 0
11:52:37.366123 IP 10.0.0.2.54912 > vagrant-ubuntu-trusty-64.8882: Flags [P.], seq 1869066722:1869066886, ack 3256007303, win 58, options [nop,nop,TS val 4294715916 ecr 4294715893], length 164
11:52:37.366379 IP vagrant-ubuntu-trusty-64.8882 > 10.0.0.2.54912: Flags [.], ack 1869066886, win 358, options [nop,nop,TS val 4294715955 ecr 4294715916], length 0
11:52:37.384388 IP 10.0.0.2.54912 > vagrant-ubuntu-trusty-64.8882: Flags [P.], seq 1869066886:1869067050, ack 3256007303, win 58, options [nop,nop,TS val 4294715936 ecr 4294715915], length 164
11:52:37.384598 IP vagrant-ubuntu-trusty-64.8882 > 10.0.0.2.54912: Flags [.], ack 1869067050, win 358, options [nop,nop,TS val 4294715973 ecr 4294715936], length 0
11:52:37.405347 IP 10.0.0.2.54912 > vagrant-ubuntu-trusty-64.8882: Flags [P.], seq 1869067050:1869067214, ack 3256007303, win 58, options [nop,nop,TS val 4294715956 ecr 4294715933], length 164
11:52:37.405401 IP vagrant-ubuntu-trusty-64.8882 > 10.0.0.2.54912: Flags [.], ack 1869067214, win 358, options [nop,nop,TS val 4294715994 ecr 4294715956], length 0
11:52:37.424320 IP 10.0.0.2.54912 > vagrant-ubuntu-trusty-64.8882: Flags [P.], seq 1869067214:1869067378, ack 3256007303, win 58, options [nop,nop,TS val 4294715976 ecr 4294715955], length 164
11:52:37.424561 IP vagrant-ubuntu-trusty-64.8882 > 10.0.0.2.54912: Flags [.], ack 1869067378, win 358, options [nop,nop,TS val 4294716013 ecr 4294715976], length 0
11:52:37.445471 IP 10.0.0.2.54912 > vagrant-ubuntu-trusty-64.8882: Flags [P.], seq 1869067378:1869067542, ack 3256007303, win 58, options [nop,nop,TS val 4294715996 ecr 4294715973], length 164
11:52:37.445622 IP vagrant-ubuntu-trusty-64.8882 > 10.0.0.2.54912: Flags [.], ack 1869067542, win 358, options [nop,nop,TS val 4294716034 ecr 4294715996], length 0
11:52:37.464052 IP 10.0.0.2.54912 > vagrant-ubuntu-trusty-64.8882: Flags [P.], seq 1869067542:1869067706, ack 3256007303, win 58, options [nop,nop,TS val 4294716016 ecr 4294715994], length 164
11:52:37.464344 IP vagrant-ubuntu-trusty-64.8882 > 10.0.0.2.54912: Flags [.], ack 1869067706, win 358, options [nop,nop,TS val 4294716053 ecr 4294716016], length 0
