11:14:48.312161 IP 10.0.0.2.55576 > 10.0.0.1.8882: Flags [P.], seq 4291580672:4291580836, ack 2539468977, win 58, options [nop,nop,TS val 4294837577 ecr 4294837548], length 164
11:14:48.313435 IP 10.0.0.1.8882 > 10.0.0.2.55576: Flags [.], ack 4291580672, win 80, options [nop,nop,TS val 4294837568 ecr 4294837557], length 0
11:14:48.332217 IP 10.0.0.2.55576 > 10.0.0.1.8882: Flags [P.], seq 4291580836:4291581000, ack 2539468977, win 58, options [nop,nop,TS val 4294837597 ecr 4294837568], length 164
11:14:48.332660 IP 10.0.0.1.8882 > 10.0.0.2.55576: Flags [.], ack 4291580836, win 82, options [nop,nop,TS val 4294837588 ecr 4294837577], length 0
11:14:48.353848 IP 10.0.0.2.55576 > 10.0.0.1.8882: Flags [P.], seq 4291581000:4291581164, ack 2539468977, win 58, options [nop,nop,TS val 4294837619 ecr 4294837588], length 164
11:14:48.354568 IP 10.0.0.1.8882 > 10.0.0.2.55576: Flags [.], ack 4291581000, win 84, options [nop,nop,TS val 4294837610 ecr 4294837597], length 0
11:14:48.374019 IP 10.0.0.2.55576 > 10.0.0.1.8882: Flags [P.], seq 4291581164:4291581328, ack 2539468977, win 58, options [nop,nop,TS val 4294837639 ecr 4294837610], length 164
11:14:48.375877 IP 10.0.0.1.8882 > 10.0.0.2.55576: Flags [.], ack 4291581164, win 86, options [nop,nop,TS val 4294837630 ecr 4294837619], length 0
11:14:48.392246 IP 10.0.0.2.55576 > 10.0.0.1.8882: Flags [P.], seq 4291581328:4291581492, ack 2539468977, win 58, options [nop,nop,TS val 4294837657 ecr 4294837630], length 164
11:14:48.394645 IP 10.0.0.1.8882 > 10.0.0.2.55576: Flags [.], ack 4291581328, win 88, options [nop,nop,TS val 4294837649 ecr 4294837639], length 0
11:14:48.412278 IP 10.0.0.2.55576 > 10.0.0.1.8882: Flags [P.], seq 4291581492:4291581656, ack 2539468977, win 58, options [nop,nop,TS val 4294837677 ecr 4294837649], length 164
11:14:48.412433 IP 10.0.0.1.8882 > 10.0.0.2.55576: Flags [.], ack 4291581492, win 91, options [nop,nop,TS val 4294837667 ecr 4294837657], length 0
11:14:48.432422 IP 10.0.0.2.55576 > 10.0.0.1.8882: Flags [P.], seq 4291581656:4291581820, ack 2539468977, win 58, options [nop,nop,TS val 4294837697 ecr 4294837667], length 164
11:14:48.432688 IP 10.0.0.1.8882 > 10.0.0.2.55576: Flags [.], ack 4291581656, win 93, options [nop,nop,TS val 4294837687 ecr 4294837677], length 0
11:14:48.452324 IP 10.0.0.2.55576 > 10.0.0.1.8882: Flags [P.], seq 4291581820:4291581984, ack 2539468977, win 58, options [nop,nop,TS val 4294837717 ecr 4294837687], length 164
11:14:48.452595 IP 10.0.0.1.8882 > 10.0.0.2.55576: Flags [.], ack 4291581820, win 95, options [nop,nop,TS val 4294837708 ecr 4294837697], length 0
11:14:48.472255 IP 10.0.0.2.55576 > 10.0.0.1.8882: Flags [P.], seq 4291581984:4291582148, ack 2539468977, win 58, options [nop,nop,TS val 4294837737 ecr 4294837708], length 164
11:14:48.472651 IP 10.0.0.1.8882 > 10.0.0.2.55576: Flags [.], ack 4291581984, win 97, options [nop,nop,TS val 4294837728 ecr 4294837717], length 0
11:14:48.492292 IP 10.0.0.2.55576 > 10.0.0.1.8882: Flags [P.], seq 4291582148:4291582312, ack 2539468977, win 58, options [nop,nop,TS val 4294837757 ecr 4294837728], length 164
11:14:48.493304 IP 10.0.0.1.8882 > 10.0.0.2.55576: Flags [.], ack 4291582148, win 99, options [nop,nop,TS val 4294837748 ecr 4294837737], length 0
11:14:48.512129 IP 10.0.0.2.55576 > 10.0.0.1.8882: Flags [P.], seq 4291582312:4291582476, ack 2539468977, win 58, options [nop,nop,TS val 4294837777 ecr 4294837748], length 164
11:14:48.512560 IP 10.0.0.1.8882 > 10.0.0.2.55576: Flags [.], ack 4291582312, win 101, options [nop,nop,TS val 4294837767 ecr 4294837757], length 0
11:14:48.532198 IP 10.0.0.2.55576 > 10.0.0.1.8882: Flags [P.], seq 4291582476:4291582640, ack 2539468977, win 58, options [nop,nop,TS val 4294837797 ecr 4294837767], length 164
11:14:48.532562 IP 10.0.0.1.8882 > 10.0.0.2.55576: Flags [.], ack 4291582476, win 103, options [nop,nop,TS val 4294837787 ecr 4294837777], length 0
11:14:48.552446 IP 10.0.0.2.55576 > 10.0.0.1.8882: Flags [P.], seq 4291582640:4291582804, ack 2539468977, win 58, options [nop,nop,TS val 4294837817 ecr 4294837787], length 164
11:14:48.552760 IP 10.0.0.1.8882 > 10.0.0.2.55576: Flags [.], ack 4291582640, win 105, options [nop,nop,TS val 4294837808 ecr 4294837797], length 0
11:14:48.572981 IP 10.0.0.1.8882 > 10.0.0.2.55576: Flags [.], ack 4291582804, win 107, options [nop,nop,TS val 4294837828 ecr 4294837817], length 0
11:14:48.573007 IP 10.0.0.2.55576 > 10.0.0.1.8882: Flags [P.], seq 4291582804:4291582968, ack 2539468977, win 58, options [nop,nop,TS val 4294837838 ecr 4294837808], length 164
11:14:48.592350 IP 10.0.0.2.55576 > 10.0.0.1.8882: Flags [P.], seq 4291582968:4291583132, ack 2539468977, win 58, options [nop,nop,TS val 4294837857 ecr 4294837828], length 164
11:14:48.593597 IP 10.0.0.1.8882 > 10.0.0.2.55576: Flags [.], ack 4291582968, win 109, options [nop,nop,TS val 4294837848 ecr 4294837838], length 0
11:14:48.612312 IP 10.0.0.2.55576 > 10.0.0.1.8882: Flags [P.], seq 4291583132:4291583296, ack 2539468977, win 58, options [nop,nop,TS val 4294837877 ecr 4294837848], length 164
11:14:48.612661 IP 10.0.0.1.8882 > 10.0.0.2.55576: Flags [.], ack 4291583132, win 111, options [nop,nop,TS val 4294837868 ecr 4294837857], length 0
11:14:48.632143 IP 10.0.0.2.55576 > 10.0.0.1.8882: Flags [P.], seq 4291583296:4291583460, ack 2539468977, win 58, options [nop,nop,TS val 4294837897 ecr 4294837868], length 164
11:14:48.632456 IP 10.0.0.1.8882 > 10.0.0.2.55576: Flags [.], ack 4291583296, win 114, options [nop,nop,TS val 4294837887 ecr 4294837877], length 0
11:14:48.652287 IP 10.0.0.2.55576 > 10.0.0.1.8882: Flags [P.], seq 4291583460:4291583624, ack 2539468977, win 58, options [nop,nop,TS val 4294837917 ecr 4294837887], length 164
11:14:48.653681 IP 10.0.0.1.8882 > 10.0.0.2.55576: Flags [.], ack 4291583460, win 116, options [nop,nop,TS val 4294837907 ecr 4294837897], length 0
11:14:48.674854 IP 10.0.0.1.8882 > 10.0.0.2.55576: Flags [.], ack 4291583624, win 118, options [nop,nop,TS val 4294837927 ecr 4294837917], length 0
11:14:48.675071 IP 10.0.0.2.55576 > 10.0.0.1.8882: Flags [P.], seq 4291583624:4291583788, ack 2539468977, win 58, options [nop,nop,TS val 4294837940 ecr 4294837927], length 164
11:14:48.692546 IP 10.0.0.2.55576 > 10.0.0.1.8882: Flags [P.], seq 4291583788:4291583952, ack 2539468977, win 58, options [nop,nop,TS val 4294837958 ecr 4294837927], length 164
11:14:48.696569 IP 10.0.0.1.8882 > 10.0.0.2.55576: Flags [.], ack 4291583788, win 120, options [nop,nop,TS val 4294837950 ecr 4294837940], length 0
11:14:48.712398 IP 10.0.0.2.55576 > 10.0.0.1.8882: Flags [P.], seq 4291583952:4291584116, ack 2539468977, win 58, options [nop,nop,TS val 4294837977 ecr 4294837950], length 164
11:14:48.712945 IP 10.0.0.1.8882 > 10.0.0.2.55576: Flags [.], ack 4291583952, win 122, options [nop,nop,TS val 4294837968 ecr 4294837958], length 0
11:14:48.733083 IP 10.0.0.1.8882 > 10.0.0.2.55576: Flags [.], ack 4291584116, win 124, options [nop,nop,TS val 4294837988 ecr 4294837977], length 0
11:14:48.733785 IP 10.0.0.2.55576 > 10.0.0.1.8882: Flags [P.], seq 4291584116:4291584280, ack 2539468977, win 58, options [nop,nop,TS val 4294837999 ecr 4294837988], length 164
11:14:48.752238 IP 10.0.0.2.55576 > 10.0.0.1.8882: Flags [P.], seq 4291584280:4291584444, ack 2539468977, win 58, options [nop,nop,TS val 4294838017 ecr 4294837988], length 164
11:14:48.755184 IP 10.0.0.1.8882 > 10.0.0.2.55576: Flags [.], ack 4291584280, win 126, options [nop,nop,TS val 4294838010 ecr 4294837999], length 0
11:14:48.772488 IP 10.0.0.2.55576 > 10.0.0.1.8882: Flags [P.], seq 4291584444:4291584608, ack 2539468977, win 58, options [nop,nop,TS val 4294838037 ecr 4294838010], length 164
11:14:48.773542 IP 10.0.0.1.8882 > 10.0.0.2.55576: Flags [.], ack 4291584444, win 128, options [nop,nop,TS val 4294838028 ecr 4294838017], length 0
11:14:48.792791 IP 10.0.0.2.55576 > 10.0.0.1.8882: Flags [P.], seq 4291584608:4291584772, ack 2539468977, win 58, options [nop,nop,TS val 4294838057 ecr 4294838028], length 164
11:14:48.793175 IP 10.0.0.1.8882 > 10.0.0.2.55576: Flags [.], ack 4291584608, win 130, options [nop,nop,TS val 4294838048 ecr 4294838037], length 0
11:14:48.813010 IP 10.0.0.1.8882 > 10.0.0.2.55576: Flags [.], ack 4291584772, win 132, options [nop,nop,TS val 4294838068 ecr 4294838057], length 0
11:14:48.814301 IP 10.0.0.2.55576 > 10.0.0.1.8882: Flags [P.], seq 4291584772:4291584936, ack 2539468977, win 58, options [nop,nop,TS val 4294838079 ecr 4294838068], length 164
11:14:48.832460 IP 10.0.0.2.55576 > 10.0.0.1.8882: Flags [P.], seq 4291584936:4291585100, ack 2539468977, win 58, options [nop,nop,TS val 4294838097 ecr 4294838068], length 164
11:14:48.834956 IP 10.0.0.1.8882 > 10.0.0.2.55576: Flags [.], ack 4291584936, win 135, options [nop,nop,TS val 4294838090 ecr 4294838079], length 0
11:14:48.852547 IP 10.0.0.2.55576 > 10.0.0.1.8882: Flags [P.], seq 4291585100:4291585264, ack 2539468977, win 58, options [nop,nop,TS val 4294838118 ecr 4294838090], length 164
11:14:48.853634 IP 10.0.0.1.8882 > 10.0.0.2.55576: Flags [.], ack 4291585100, win 137, options [nop,nop,TS val 4294838108 ecr 4294838097], length 0
11:14:48.872197 IP 10.0.0.2.55576 > 10.0.0.1.8882: Flags [P.], seq 4291585264:4291585428, ack 2539468977, win 58, options [nop,nop,TS val 4294838137 ecr 4294838108], length 164
11:14:48.874790 IP 10.0.0.1.8882 > 10.0.0.2.55576: Flags [.], ack 4291585264, win 139, options [nop,nop,TS val 4294838129 ecr 4294838118], length 0
11:14:48.892733 IP 10.0.0.1.8882 > 10.0.0.2.55576: Flags [.], ack 4291585428, win 141, options [nop,nop,TS val 4294838148 ecr 4294838137], length 0
11:14:48.892784 IP 10.0.0.2.55576 > 10.0.0.1.8882: Flags [P.], seq 4291585428:4291585592, ack 2539468977, win 58, options [nop,nop,TS val 4294838158 ecr 4294838148], length 164
11:14:48.912198 IP 10.0.0.2.55576 > 10.0.0.1.8882: Flags [P.], seq 4291585592:4291585756, ack 2539468977, win 58, options [nop,nop,TS val 4294838177 ecr 4294838148], length 164
11:14:48.913089 IP 10.0.0.1.8882 > 10.0.0.2.55576: Flags [.], ack 4291585592, win 143, options [nop,nop,TS val 4294838168 ecr 4294838158], length 0
11:14:48.932151 IP 10.0.0.2.55576 > 10.0.0.1.8882: Flags [P.], seq 4291585756:4291585920, ack 2539468977, win 58, options [nop,nop,TS val 4294838197 ecr 4294838168], length 164
11:14:48.934923 IP 10.0.0.1.8882 > 10.0.0.2.55576: Flags [.], ack 4291585756, win 145, options [nop,nop,TS val 4294838188 ecr 4294838177], length 0
11:14:48.952644 IP 10.0.0.2.55576 > 10.0.0.1.8882: Flags [P.], seq 4291585920:4291586084, ack 2539468977, win 58, options [nop,nop,TS val 4294838218 ecr 4294838188], length 164
11:14:48.953525 IP 10.0.0.1.8882 > 10.0.0.2.55576: Flags [.], ack 4291585920, win 147, options [nop,nop,TS val 4294838208 ecr 4294838197], length 0
11:14:48.972280 IP 10.0.0.2.55576 > 10.0.0.1.8882: Flags [P.], seq 4291586084:4291586248, ack 2539468977, win 58, options [nop,nop,TS val 4294838237 ecr 4294838208], length 164
11:14:48.973497 IP 10.0.0.1.8882 > 10.0.0.2.55576: Flags [.], ack 4291586084, win 149, options [nop,nop,TS val 4294838228 ecr 4294838218], length 0
11:14:48.992271 IP 10.0.0.2.55576 > 10.0.0.1.8882: Flags [P.], seq 4291586248:4291586412, ack 2539468977, win 58, options [nop,nop,TS val 4294838257 ecr 4294838228], length 164
11:14:48.993029 IP 10.0.0.1.8882 > 10.0.0.2.55576: Flags [.], ack 4291586248, win 151, options [nop,nop,TS val 4294838248 ecr 4294838237], length 0
11:14:49.012678 IP 10.0.0.1.8882 > 10.0.0.2.55576: Flags [.], ack 4291586412, win 153, options [nop,nop,TS val 4294838267 ecr 4294838257], length 0
11:14:49.012708 IP 10.0.0.2.55576 > 10.0.0.1.8882: Flags [P.], seq 4291586412:4291586576, ack 2539468977, win 58, options [nop,nop,TS val 4294838278 ecr 4294838248], length 164
11:14:49.032538 IP 10.0.0.2.55576 > 10.0.0.1.8882: Flags [P.], seq 4291586576:4291586740, ack 2539468977, win 58, options [nop,nop,TS val 4294838298 ecr 4294838267], length 164
11:14:49.033140 IP 10.0.0.1.8882 > 10.0.0.2.55576: Flags [.], ack 4291586576, win 155, options [nop,nop,TS val 4294838288 ecr 4294838278], length 0
11:14:49.052446 IP 10.0.0.2.55576 > 10.0.0.1.8882: Flags [P.], seq 4291586740:4291586904, ack 2539468977, win 58, options [nop,nop,TS val 4294838317 ecr 4294838288], length 164
11:14:49.053058 IP 10.0.0.1.8882 > 10.0.0.2.55576: Flags [.], ack 4291586740, win 158, options [nop,nop,TS val 4294838308 ecr 4294838298], length 0
11:14:49.072826 IP 10.0.0.1.8882 > 10.0.0.2.55576: Flags [.], ack 4291586904, win 160, options [nop,nop,TS val 4294838328 ecr 4294838317], length 0
11:14:49.072889 IP 10.0.0.2.55576 > 10.0.0.1.8882: Flags [P.], seq 4291586904:4291587068, ack 2539468977, win 58, options [nop,nop,TS val 4294838338 ecr 4294838328], length 164
11:14:49.092247 IP 10.0.0.2.55576 > 10.0.0.1.8882: Flags [P.], seq 4291587068:4291587232, ack 2539468977, win 58, options [nop,nop,TS val 4294838357 ecr 4294838328], length 164
11:14:49.093324 IP 10.0.0.1.8882 > 10.0.0.2.55576: Flags [.], ack 4291587068, win 162, options [nop,nop,TS val 4294838348 ecr 4294838338], length 0
11:14:49.112315 IP 10.0.0.2.55576 > 10.0.0.1.8882: Flags [P.], seq 4291587232:4291587396, ack 2539468977, win 58, options [nop,nop,TS val 4294838377 ecr 4294838348], length 164
11:14:49.112519 IP 10.0.0.1.8882 > 10.0.0.2.55576: Flags [.], ack 4291587232, win 164, options [nop,nop,TS val 4294838367 ecr 4294838357], length 0
11:14:49.132634 IP 10.0.0.1.8882 > 10.0.0.2.55576: Flags [.], ack 4291587396, win 166, options [nop,nop,TS val 4294838387 ecr 4294838377], length 0
11:14:49.132652 IP 10.0.0.2.55576 > 10.0.0.1.8882: Flags [P.], seq 4291587396:4291587560, ack 2539468977, win 58, options [nop,nop,TS val 4294838398 ecr 4294838367], length 164
11:14:49.153036 IP 10.0.0.2.55576 > 10.0.0.1.8882: Flags [P.], seq 4291587560:4291587724, ack 2539468977, win 58, options [nop,nop,TS val 4294838418 ecr 4294838387], length 164
11:14:49.153298 IP 10.0.0.1.8882 > 10.0.0.2.55576: Flags [.], ack 4291587560, win 168, options [nop,nop,TS val 4294838408 ecr 4294838398], length 0
11:14:49.172151 IP 10.0.0.2.55576 > 10.0.0.1.8882: Flags [P.], seq 4291587724:4291587888, ack 2539468977, win 58, options [nop,nop,TS val 4294838437 ecr 4294838408], length 164
11:14:49.173323 IP 10.0.0.1.8882 > 10.0.0.2.55576: Flags [.], ack 4291587724, win 170, options [nop,nop,TS val 4294838428 ecr 4294838418], length 0
11:14:49.192283 IP 10.0.0.2.55576 > 10.0.0.1.8882: Flags [P.], seq 4291587888:4291588052, ack 2539468977, win 58, options [nop,nop,TS val 4294838457 ecr 4294838428], length 164
11:14:49.192528 IP 10.0.0.1.8882 > 10.0.0.2.55576: Flags [.], ack 4291587888, win 172, options [nop,nop,TS val 4294838447 ecr 4294838437], length 0
11:14:49.212161 IP 10.0.0.2.55576 > 10.0.0.1.8882: Flags [P.], seq 4291588052:4291588216, ack 2539468977, win 58, options [nop,nop,TS val 4294838477 ecr 4294838447], length 164
11:14:49.212795 IP 10.0.0.1.8882 > 10.0.0.2.55576: Flags [.], ack 4291588052, win 174, options [nop,nop,TS val 4294838468 ecr 4294838457], length 0
11:14:49.232282 IP 10.0.0.2.55576 > 10.0.0.1.8882: Flags [P.], seq 4291588216:4291588380, ack 2539468977, win 58, options [nop,nop,TS val 4294838497 ecr 4294838468], length 164
11:14:49.232364 IP 10.0.0.1.8882 > 10.0.0.2.55576: Flags [.], ack 4291588216, win 176, options [nop,nop,TS val 4294838487 ecr 4294838477], length 0
11:14:49.252248 IP 10.0.0.2.55576 > 10.0.0.1.8882: Flags [P.], seq 4291588380:4291588544, ack 2539468977, win 58, options [nop,nop,TS val 4294838517 ecr 4294838487], length 164
11:14:49.253120 IP 10.0.0.1.8882 > 10.0.0.2.55576: Flags [.], ack 4291588380, win 178, options [nop,nop,TS val 4294838508 ecr 4294838497], length 0
11:14:49.272539 IP 10.0.0.1.8882 > 10.0.0.2.55576: Flags [.], ack 4291588544, win 181, options [nop,nop,TS val 4294838527 ecr 4294838517], length 0
11:14:49.273668 IP 10.0.0.2.55576 > 10.0.0.1.8882: Flags [P.], seq 4291588544:4291588708, ack 2539468977, win 58, options [nop,nop,TS val 4294838539 ecr 4294838527], length 164
11:14:49.292757 IP 10.0.0.2.55576 > 10.0.0.1.8882: Flags [P.], seq 4291588708:4291588872, ack 2539468977, win 58, options [nop,nop,TS val 4294838558 ecr 4294838527], length 164
11:14:49.294101 IP 10.0.0.1.8882 > 10.0.0.2.55576: Flags [.], ack 4291588708, win 183, options [nop,nop,TS val 4294838549 ecr 4294838539], length 0
11:14:49.312277 IP 10.0.0.2.55576 > 10.0.0.1.8882: Flags [P.], seq 4291588872:4291589036, ack 2539468977, win 58, options [nop,nop,TS val 4294838577 ecr 4294838549], length 164
11:14:49.313069 IP 10.0.0.1.8882 > 10.0.0.2.55576: Flags [.], ack 4291588872, win 185, options [nop,nop,TS val 4294838568 ecr 4294838558], length 0
11:14:49.333242 IP 10.0.0.1.8882 > 10.0.0.2.55576: Flags [.], ack 4291589036, win 187, options [nop,nop,TS val 4294838587 ecr 4294838577], length 0
11:14:49.333282 IP 10.0.0.2.55576 > 10.0.0.1.8882: Flags [P.], seq 4291589036:4291589200, ack 2539468977, win 58, options [nop,nop,TS val 4294838598 ecr 4294838587], length 164
11:14:49.352138 IP 10.0.0.2.55576 > 10.0.0.1.8882: Flags [P.], seq 4291589200:4291589364, ack 2539468977, win 58, options [nop,nop,TS val 4294838617 ecr 4294838587], length 164
11:14:49.354297 IP 10.0.0.1.8882 > 10.0.0.2.55576: Flags [.], ack 4291589200, win 189, options [nop,nop,TS val 4294838609 ecr 4294838598], length 0
11:14:49.372181 IP 10.0.0.2.55576 > 10.0.0.1.8882: Flags [P.], seq 4291589364:4291589528, ack 2539468977, win 58, options [nop,nop,TS val 4294838637 ecr 4294838609], length 164
11:14:49.372633 IP 10.0.0.1.8882 > 10.0.0.2.55576: Flags [.], ack 4291589364, win 191, options [nop,nop,TS val 4294838627 ecr 4294838617], length 0
11:14:49.393199 IP 10.0.0.1.8882 > 10.0.0.2.55576: Flags [.], ack 4291589528, win 193, options [nop,nop,TS val 4294838647 ecr 4294838637], length 0
11:14:49.393704 IP 10.0.0.2.55576 > 10.0.0.1.8882: Flags [P.], seq 4291589528:4291589692, ack 2539468977, win 58, options [nop,nop,TS val 4294838659 ecr 4294838627], length 164
11:14:49.412238 IP 10.0.0.2.55576 > 10.0.0.1.8882: Flags [P.], seq 4291589692:4291589856, ack 2539468977, win 58, options [nop,nop,TS val 4294838677 ecr 4294838647], length 164
11:14:49.414422 IP 10.0.0.1.8882 > 10.0.0.2.55576: Flags [.], ack 4291589692, win 195, options [nop,nop,TS val 4294838669 ecr 4294838659], length 0
11:14:49.432311 IP 10.0.0.2.55576 > 10.0.0.1.8882: Flags [P.], seq 4291589856:4291590020, ack 2539468977, win 58, options [nop,nop,TS val 4294838697 ecr 4294838669], length 164
11:14:49.433023 IP 10.0.0.1.8882 > 10.0.0.2.55576: Flags [.], ack 4291589856, win 197, options [nop,nop,TS val 4294838688 ecr 4294838677], length 0
11:14:49.452242 IP 10.0.0.2.55576 > 10.0.0.1.8882: Flags [P.], seq 4291590020:4291590184, ack 2539468977, win 58, options [nop,nop,TS val 4294838717 ecr 4294838688], length 164
11:14:49.452767 IP 10.0.0.1.8882 > 10.0.0.2.55576: Flags [.], ack 4291590020, win 199, options [nop,nop,TS val 4294838708 ecr 4294838697], length 0
11:14:49.472252 IP 10.0.0.2.55576 > 10.0.0.1.8882: Flags [P.], seq 4291590184:4291590348, ack 2539468977, win 58, options [nop,nop,TS val 4294838737 ecr 4294838708], length 164
11:14:49.472565 IP 10.0.0.1.8882 > 10.0.0.2.55576: Flags [.], ack 4291590184, win 202, options [nop,nop,TS val 4294838727 ecr 4294838717], length 0
11:14:49.492510 IP 10.0.0.1.8882 > 10.0.0.2.55576: Flags [.], ack 4291590348, win 204, options [nop,nop,TS val 4294838747 ecr 4294838737], length 0
11:14:49.492566 IP 10.0.0.2.55576 > 10.0.0.1.8882: Flags [P.], seq 4291590348:4291590512, ack 2539468977, win 58, options [nop,nop,TS val 4294838758 ecr 4294838747], length 164
11:14:49.512423 IP 10.0.0.2.55576 > 10.0.0.1.8882: Flags [P.], seq 4291590512:4291590676, ack 2539468977, win 58, options [nop,nop,TS val 4294838777 ecr 4294838747], length 164
11:14:49.512972 IP 10.0.0.1.8882 > 10.0.0.2.55576: Flags [.], ack 4291590512, win 206, options [nop,nop,TS val 4294838768 ecr 4294838758], length 0
11:14:49.532471 IP 10.0.0.2.55576 > 10.0.0.1.8882: Flags [P.], seq 4291590676:4291590840, ack 2539468977, win 58, options [nop,nop,TS val 4294838797 ecr 4294838768], length 164
11:14:49.532869 IP 10.0.0.1.8882 > 10.0.0.2.55576: Flags [.], ack 4291590676, win 208, options [nop,nop,TS val 4294838788 ecr 4294838777], length 0
11:14:49.552657 IP 10.0.0.1.8882 > 10.0.0.2.55576: Flags [.], ack 4291590840, win 210, options [nop,nop,TS val 4294838808 ecr 4294838797], length 0
11:14:49.552683 IP 10.0.0.2.55576 > 10.0.0.1.8882: Flags [P.], seq 4291590840:4291591004, ack 2539468977, win 58, options [nop,nop,TS val 4294838818 ecr 4294838788], length 164
11:14:49.572464 IP 10.0.0.2.55576 > 10.0.0.1.8882: Flags [P.], seq 4291591004:4291591168, ack 2539468977, win 58, options [nop,nop,TS val 4294838837 ecr 4294838808], length 164
11:14:49.573666 IP 10.0.0.1.8882 > 10.0.0.2.55576: Flags [.], ack 4291591004, win 212, options [nop,nop,TS val 4294838828 ecr 4294838818], length 0
11:14:49.592171 IP 10.0.0.2.55576 > 10.0.0.1.8882: Flags [P.], seq 4291591168:4291591332, ack 2539468977, win 58, options [nop,nop,TS val 4294838857 ecr 4294838828], length 164
11:14:49.593145 IP 10.0.0.1.8882 > 10.0.0.2.55576: Flags [.], ack 4291591168, win 214, options [nop,nop,TS val 4294838848 ecr 4294838837], length 0
11:14:49.613420 IP 10.0.0.2.55576 > 10.0.0.1.8882: Flags [P.], seq 4291591332:4291591496, ack 2539468977, win 58, options [nop,nop,TS val 4294838878 ecr 4294838848], length 164
11:14:49.613802 IP 10.0.0.1.8882 > 10.0.0.2.55576: Flags [.], ack 4291591332, win 216, options [nop,nop,TS val 4294838868 ecr 4294838857], length 0
11:14:49.632836 IP 10.0.0.2.55576 > 10.0.0.1.8882: Flags [P.], seq 4291591496:4291591660, ack 2539468977, win 58, options [nop,nop,TS val 4294838898 ecr 4294838868], length 164
11:14:49.633768 IP 10.0.0.1.8882 > 10.0.0.2.55576: Flags [.], ack 4291591496, win 218, options [nop,nop,TS val 4294838889 ecr 4294838878], length 0
11:14:49.652693 IP 10.0.0.2.55576 > 10.0.0.1.8882: Flags [P.], seq 4291591660:4291591824, ack 2539468977, win 58, options [nop,nop,TS val 4294838918 ecr 4294838889], length 164
11:14:49.653271 IP 10.0.0.1.8882 > 10.0.0.2.55576: Flags [.], ack 4291591660, win 220, options [nop,nop,TS val 4294838908 ecr 4294838898], length 0
11:14:49.674539 IP 10.0.0.1.8882 > 10.0.0.2.55576: Flags [.], ack 4291591824, win 222, options [nop,nop,TS val 4294838928 ecr 4294838918], length 0
11:14:49.674586 IP 10.0.0.2.55576 > 10.0.0.1.8882: Flags [P.], seq 4291591824:4291591988, ack 2539468977, win 58, options [nop,nop,TS val 4294838940 ecr 4294838928], length 164
11:14:49.692395 IP 10.0.0.2.55576 > 10.0.0.1.8882: Flags [P.], seq 4291591988:4291592152, ack 2539468977, win 58, options [nop,nop,TS val 4294838957 ecr 4294838928], length 164
11:14:49.694734 IP 10.0.0.1.8882 > 10.0.0.2.55576: Flags [.], ack 4291591988, win 225, options [nop,nop,TS val 4294838950 ecr 4294838940], length 0
11:14:49.712383 IP 10.0.0.2.55576 > 10.0.0.1.8882: Flags [P.], seq 4291592152:4291592316, ack 2539468977, win 58, options [nop,nop,TS val 4294838977 ecr 4294838950], length 164
11:14:49.712857 IP 10.0.0.1.8882 > 10.0.0.2.55576: Flags [.], ack 4291592152, win 227, options [nop,nop,TS val 4294838968 ecr 4294838957], length 0
11:14:49.732905 IP 10.0.0.1.8882 > 10.0.0.2.55576: Flags [.], ack 4291592316, win 229, options [nop,nop,TS val 4294838988 ecr 4294838977], length 0
11:14:49.733087 IP 10.0.0.2.55576 > 10.0.0.1.8882: Flags [P.], seq 4291592316:4291592480, ack 2539468977, win 58, options [nop,nop,TS val 4294838998 ecr 4294838988], length 164
11:14:49.752445 IP 10.0.0.2.55576 > 10.0.0.1.8882: Flags [P.], seq 4291592480:4291592644, ack 2539468977, win 58, options [nop,nop,TS val 4294839017 ecr 4294838988], length 164
11:14:49.754590 IP 10.0.0.1.8882 > 10.0.0.2.55576: Flags [.], ack 4291592480, win 231, options [nop,nop,TS val 4294839009 ecr 4294838998], length 0
11:14:49.773037 IP 10.0.0.2.55576 > 10.0.0.1.8882: Flags [P.], seq 4291592644:4291592808, ack 2539468977, win 58, options [nop,nop,TS val 4294839038 ecr 4294839009], length 164
11:14:49.774216 IP 10.0.0.1.8882 > 10.0.0.2.55576: Flags [.], ack 4291592644, win 233, options [nop,nop,TS val 4294839028 ecr 4294839017], length 0
11:14:49.793128 IP 10.0.0.2.55576 > 10.0.0.1.8882: Flags [P.], seq 4291592808:4291592972, ack 2539468977, win 58, options [nop,nop,TS val 4294839058 ecr 4294839028], length 164
11:14:49.806629 IP 10.0.0.1.8882 > 10.0.0.2.55576: Flags [.], ack 4291592808, win 235, options [nop,nop,TS val 4294839058 ecr 4294839038], length 0
11:14:49.814019 IP 10.0.0.2.55576 > 10.0.0.1.8882: Flags [P.], seq 4291592972:4291593136, ack 2539468977, win 58, options [nop,nop,TS val 4294839079 ecr 4294839058], length 164
11:14:49.826017 IP 10.0.0.1.8882 > 10.0.0.2.55576: Flags [.], ack 4291592972, win 237, options [nop,nop,TS val 4294839080 ecr 4294839058], length 0
11:14:49.832636 IP 10.0.0.2.55576 > 10.0.0.1.8882: Flags [P.], seq 4291593136:4291593300, ack 2539468977, win 58, options [nop,nop,TS val 4294839098 ecr 4294839080], length 164
11:14:49.853485 IP 10.0.0.2.55576 > 10.0.0.1.8882: Flags [P.], seq 4291593300:4291593464, ack 2539468977, win 58, options [nop,nop,TS val 4294839118 ecr 4294839080], length 164
11:14:49.857413 IP 10.0.0.1.8882 > 10.0.0.2.55576: Flags [.], ack 4291593136, win 239, options [nop,nop,TS val 4294839111 ecr 4294839079], length 0
11:14:49.872280 IP 10.0.0.2.55576 > 10.0.0.1.8882: Flags [P.], seq 4291593464:4291593628, ack 2539468977, win 58, options [nop,nop,TS val 4294839137 ecr 4294839111], length 164
11:14:49.881671 IP 10.0.0.1.8882 > 10.0.0.2.55576: Flags [.], ack 4291593300, win 241, options [nop,nop,TS val 4294839136 ecr 4294839098], length 0
11:14:49.892170 IP 10.0.0.2.55576 > 10.0.0.1.8882: Flags [P.], seq 4291593628:4291593792, ack 2539468977, win 58, options [nop,nop,TS val 4294839157 ecr 4294839136], length 164
11:14:49.918232 IP 10.0.0.2.55576 > 10.0.0.1.8882: Flags [P.], seq 4291593792:4291593956, ack 2539468977, win 58, options [nop,nop,TS val 4294839183 ecr 4294839136], length 164
11:14:49.933143 IP 10.0.0.1.8882 > 10.0.0.2.55576: Flags [.], ack 4291593300, win 243, options [nop,nop,TS val 4294839184 ecr 4294839098,nop,nop,sack 1 {4291593464:4291593628}], length 0
11:14:49.934716 IP 10.0.0.2.55576 > 10.0.0.1.8882: Flags [P.], seq 4291593956:4291594120, ack 2539468977, win 58, options [nop,nop,TS val 4294839200 ecr 4294839184], length 164
11:14:49.943763 IP 10.0.0.1.8882 > 10.0.0.2.55576: Flags [.], ack 4291593300, win 245, options [nop,nop,TS val 4294839198 ecr 4294839098,nop,nop,sack 1 {4291593464:4291593792}], length 0
11:14:49.952772 IP 10.0.0.2.55576 > 10.0.0.1.8882: Flags [P.], seq 4291594120:4291594284, ack 2539468977, win 58, options [nop,nop,TS val 4294839218 ecr 4294839198], length 164
11:14:49.973509 IP 10.0.0.2.55576 > 10.0.0.1.8882: Flags [P.], seq 4291594284:4291594448, ack 2539468977, win 58, options [nop,nop,TS val 4294839238 ecr 4294839198], length 164
11:14:49.985904 IP 10.0.0.1.8882 > 10.0.0.2.55576: Flags [.], ack 4291593300, win 248, options [nop,nop,TS val 4294839240 ecr 4294839098,nop,nop,sack 2 {4291594120:4291594284}{4291593464:4291593792}], length 0
11:14:49.985941 IP 10.0.0.2.55576 > 10.0.0.1.8882: Flags [P.], seq 4291593300:4291593464, ack 2539468977, win 58, options [nop,nop,TS val 4294839251 ecr 4294839240], length 164
11:14:49.985963 IP 10.0.0.2.55576 > 10.0.0.1.8882: Flags [P.], seq 4291593792:4291594120, ack 2539468977, win 58, options [nop,nop,TS val 4294839251 ecr 4294839240], length 328
11:14:49.992235 IP 10.0.0.2.55576 > 10.0.0.1.8882: Flags [P.], seq 4291594448:4291594612, ack 2539468977, win 58, options [nop,nop,TS val 4294839257 ecr 4294839240], length 164
11:14:50.026653 IP 10.0.0.1.8882 > 10.0.0.2.55576: Flags [.], ack 4291593792, win 250, options [nop,nop,TS val 4294839281 ecr 4294839251,nop,nop,sack 1 {4291594120:4291594284}], length 0
11:14:50.026747 IP 10.0.0.2.55576 > 10.0.0.1.8882: Flags [P.], seq 4291594612:4291594776, ack 2539468977, win 58, options [nop,nop,TS val 4294839292 ecr 4294839281], length 164
11:14:50.026655 IP 10.0.0.1.8882 > 10.0.0.2.55576: Flags [.], ack 4291594284, win 252, options [nop,nop,TS val 4294839281 ecr 4294839251], length 0
11:14:50.032168 IP 10.0.0.2.55576 > 10.0.0.1.8882: Flags [P.], seq 4291594776:4291594940, ack 2539468977, win 58, options [nop,nop,TS val 4294839297 ecr 4294839281], length 164
11:14:50.041021 IP 10.0.0.1.8882 > 10.0.0.2.55576: Flags [.], ack 4291594284, win 254, options [nop,nop,TS val 4294839296 ecr 4294839251,nop,nop,sack 1 {4291594448:4291594612}], length 0
11:14:50.041091 IP 10.0.0.2.55576 > 10.0.0.1.8882: Flags [P.], seq 4291594284:4291594448, ack 2539468977, win 58, options [nop,nop,TS val 4294839306 ecr 4294839296], length 164
11:14:50.052310 IP 10.0.0.2.55576 > 10.0.0.1.8882: Flags [P.], seq 4291594940:4291595104, ack 2539468977, win 58, options [nop,nop,TS val 4294839317 ecr 4294839296], length 164
11:14:50.065088 IP 10.0.0.1.8882 > 10.0.0.2.55576: Flags [.], ack 4291594284, win 256, options [nop,nop,TS val 4294839320 ecr 4294839251,nop,nop,sack 2 {4291594776:4291594940}{4291594448:4291594612}], length 0
11:14:50.065136 IP 10.0.0.2.55576 > 10.0.0.1.8882: Flags [P.], seq 4291594612:4291594776, ack 2539468977, win 58, options [nop,nop,TS val 4294839330 ecr 4294839320], length 164
11:14:50.070344 IP 10.0.0.1.8882 > 10.0.0.2.55576: Flags [.], ack 4291594612, win 258, options [nop,nop,TS val 4294839325 ecr 4294839306,nop,nop,sack 1 {4291594776:4291594940}], length 0
11:14:50.072457 IP 10.0.0.2.55576 > 10.0.0.1.8882: Flags [P.], seq 4291595104:4291595268, ack 2539468977, win 58, options [nop,nop,TS val 4294839337 ecr 4294839325], length 164
11:14:50.072685 IP 10.0.0.1.8882 > 10.0.0.2.55576: Flags [.], ack 4291594612, win 260, options [nop,nop,TS val 4294839328 ecr 4294839306,nop,nop,sack 1 {4291594776:4291595104}], length 0
11:14:50.091730 IP 10.0.0.1.8882 > 10.0.0.2.55576: Flags [.], ack 4291595104, win 262, options [nop,nop,TS val 4294839347 ecr 4294839330], length 0
11:14:50.092270 IP 10.0.0.2.55576 > 10.0.0.1.8882: Flags [P.], seq 4291595268:4291595432, ack 2539468977, win 58, options [nop,nop,TS val 4294839357 ecr 4294839347], length 164
11:14:50.095793 IP 10.0.0.1.8882 > 10.0.0.2.55576: Flags [.], ack 4291595268, win 264, options [nop,nop,TS val 4294839350 ecr 4294839337], length 0
11:14:50.114860 IP 10.0.0.2.55576 > 10.0.0.1.8882: Flags [P.], seq 4291595432:4291595596, ack 2539468977, win 58, options [nop,nop,TS val 4294839380 ecr 4294839350], length 164
11:14:50.128410 IP 10.0.0.1.8882 > 10.0.0.2.55576: Flags [.], ack 4291595432, win 266, options [nop,nop,TS val 4294839383 ecr 4294839357], length 0
11:14:50.133531 IP 10.0.0.2.55576 > 10.0.0.1.8882: Flags [P.], seq 4291595596:4291595760, ack 2539468977, win 58, options [nop,nop,TS val 4294839399 ecr 4294839383], length 164
11:14:50.152230 IP 10.0.0.2.55576 > 10.0.0.1.8882: Flags [P.], seq 4291595760:4291595924, ack 2539468977, win 58, options [nop,nop,TS val 4294839417 ecr 4294839383], length 164
11:14:50.161771 IP 10.0.0.1.8882 > 10.0.0.2.55576: Flags [.], ack 4291595596, win 269, options [nop,nop,TS val 4294839417 ecr 4294839380], length 0
11:14:50.172424 IP 10.0.0.2.55576 > 10.0.0.1.8882: Flags [P.], seq 4291595924:4291596088, ack 2539468977, win 58, options [nop,nop,TS val 4294839437 ecr 4294839417], length 164
11:14:50.180905 IP 10.0.0.1.8882 > 10.0.0.2.55576: Flags [.], ack 4291595760, win 271, options [nop,nop,TS val 4294839436 ecr 4294839399], length 0
11:14:50.194218 IP 10.0.0.2.55576 > 10.0.0.1.8882: Flags [P.], seq 4291596088:4291596252, ack 2539468977, win 58, options [nop,nop,TS val 4294839459 ecr 4294839436], length 164
11:14:50.195538 IP 10.0.0.1.8882 > 10.0.0.2.55576: Flags [.], ack 4291595924, win 273, options [nop,nop,TS val 4294839451 ecr 4294839417], length 0
11:14:50.212997 IP 10.0.0.2.55576 > 10.0.0.1.8882: Flags [P.], seq 4291596252:4291596416, ack 2539468977, win 58, options [nop,nop,TS val 4294839478 ecr 4294839451], length 164
11:14:50.222111 IP 10.0.0.1.8882 > 10.0.0.2.55576: Flags [.], ack 4291596088, win 275, options [nop,nop,TS val 4294839477 ecr 4294839437], length 0
11:14:50.232638 IP 10.0.0.2.55576 > 10.0.0.1.8882: Flags [P.], seq 4291596416:4291596580, ack 2539468977, win 58, options [nop,nop,TS val 4294839498 ecr 4294839477], length 164
11:14:50.243031 IP 10.0.0.1.8882 > 10.0.0.2.55576: Flags [.], ack 4291596252, win 277, options [nop,nop,TS val 4294839498 ecr 4294839459], length 0
11:14:50.252371 IP 10.0.0.2.55576 > 10.0.0.1.8882: Flags [P.], seq 4291596580:4291596744, ack 2539468977, win 58, options [nop,nop,TS val 4294839517 ecr 4294839498], length 164
11:14:50.261249 IP 10.0.0.1.8882 > 10.0.0.2.55576: Flags [.], ack 4291596416, win 279, options [nop,nop,TS val 4294839516 ecr 4294839478], length 0
11:14:50.272353 IP 10.0.0.2.55576 > 10.0.0.1.8882: Flags [P.], seq 4291596744:4291596908, ack 2539468977, win 58, options [nop,nop,TS val 4294839537 ecr 4294839516], length 164
11:14:50.280057 IP 10.0.0.1.8882 > 10.0.0.2.55576: Flags [.], ack 4291596580, win 281, options [nop,nop,TS val 4294839534 ecr 4294839498], length 0
11:14:50.295484 IP 10.0.0.2.55576 > 10.0.0.1.8882: Flags [P.], seq 4291596908:4291597072, ack 2539468977, win 58, options [nop,nop,TS val 4294839560 ecr 4294839534], length 164
11:14:50.306263 IP 10.0.0.1.8882 > 10.0.0.2.55576: Flags [.], ack 4291596744, win 283, options [nop,nop,TS val 4294839560 ecr 4294839517], length 0
11:14:50.312555 IP 10.0.0.2.55576 > 10.0.0.1.8882: Flags [P.], seq 4291597072:4291597236, ack 2539468977, win 58, options [nop,nop,TS val 4294839578 ecr 4294839560], length 164
11:14:50.320412 IP 10.0.0.1.8882 > 10.0.0.2.55576: Flags [.], ack 4291596908, win 285, options [nop,nop,TS val 4294839575 ecr 4294839537], length 0
11:14:50.332452 IP 10.0.0.2.55576 > 10.0.0.1.8882: Flags [P.], seq 4291597236:4291597400, ack 2539468977, win 58, options [nop,nop,TS val 4294839597 ecr 4294839575], length 164
11:14:50.344021 IP 10.0.0.1.8882 > 10.0.0.2.55576: Flags [.], ack 4291597072, win 287, options [nop,nop,TS val 4294839599 ecr 4294839560], length 0
11:14:50.352598 IP 10.0.0.2.55576 > 10.0.0.1.8882: Flags [P.], seq 4291597400:4291597564, ack 2539468977, win 58, options [nop,nop,TS val 4294839618 ecr 4294839599], length 164
11:14:50.359934 IP 10.0.0.1.8882 > 10.0.0.2.55576: Flags [.], ack 4291597236, win 289, options [nop,nop,TS val 4294839615 ecr 4294839578], length 0
11:14:50.373256 IP 10.0.0.2.55576 > 10.0.0.1.8882: Flags [P.], seq 4291597564:4291597728, ack 2539468977, win 58, options [nop,nop,TS val 4294839638 ecr 4294839615], length 164
11:14:50.381759 IP 10.0.0.1.8882 > 10.0.0.2.55576: Flags [.], ack 4291597400, win 292, options [nop,nop,TS val 4294839637 ecr 4294839597], length 0
11:14:50.392303 IP 10.0.0.2.55576 > 10.0.0.1.8882: Flags [P.], seq 4291597728:4291597892, ack 2539468977, win 58, options [nop,nop,TS val 4294839657 ecr 4294839637], length 164
11:14:50.402504 IP 10.0.0.1.8882 > 10.0.0.2.55576: Flags [.], ack 4291597564, win 294, options [nop,nop,TS val 4294839655 ecr 4294839618], length 0
11:14:50.412396 IP 10.0.0.2.55576 > 10.0.0.1.8882: Flags [P.], seq 4291597892:4291598056, ack 2539468977, win 58, options [nop,nop,TS val 4294839677 ecr 4294839655], length 164
11:14:50.420481 IP 10.0.0.1.8882 > 10.0.0.2.55576: Flags [.], ack 4291597728, win 296, options [nop,nop,TS val 4294839675 ecr 4294839638], length 0
11:14:50.432348 IP 10.0.0.2.55576 > 10.0.0.1.8882: Flags [P.], seq 4291598056:4291598220, ack 2539468977, win 58, options [nop,nop,TS val 4294839697 ecr 4294839675], length 164
11:14:50.432632 IP 10.0.0.1.8882 > 10.0.0.2.55576: Flags [.], ack 4291597892, win 298, options [nop,nop,TS val 4294839688 ecr 4294839657], length 0
11:14:50.443536 IP 10.0.0.1.8882 > 10.0.0.2.55576: Flags [.], ack 4291598056, win 300, options [nop,nop,TS val 4294839698 ecr 4294839677], length 0
11:14:50.453318 IP 10.0.0.2.55576 > 10.0.0.1.8882: Flags [P.], seq 4291598220:4291598384, ack 2539468977, win 58, options [nop,nop,TS val 4294839718 ecr 4294839698], length 164
11:14:50.462900 IP 10.0.0.1.8882 > 10.0.0.2.55576: Flags [.], ack 4291598220, win 302, options [nop,nop,TS val 4294839718 ecr 4294839697], length 0
11:14:50.472606 IP 10.0.0.2.55576 > 10.0.0.1.8882: Flags [P.], seq 4291598384:4291598548, ack 2539468977, win 58, options [nop,nop,TS val 4294839738 ecr 4294839718], length 164
11:14:50.475996 IP 10.0.0.1.8882 > 10.0.0.2.55576: Flags [.], ack 4291598384, win 304, options [nop,nop,TS val 4294839731 ecr 4294839718], length 0
11:14:50.492166 IP 10.0.0.2.55576 > 10.0.0.1.8882: Flags [P.], seq 4291598548:4291598712, ack 2539468977, win 58, options [nop,nop,TS val 4294839757 ecr 4294839731], length 164
11:14:50.495286 IP 10.0.0.1.8882 > 10.0.0.2.55576: Flags [.], ack 4291598548, win 306, options [nop,nop,TS val 4294839750 ecr 4294839738], length 0
11:14:50.514098 IP 10.0.0.2.55576 > 10.0.0.1.8882: Flags [P.], seq 4291598712:4291598876, ack 2539468977, win 58, options [nop,nop,TS val 4294839779 ecr 4294839750], length 164
11:14:50.520355 IP 10.0.0.1.8882 > 10.0.0.2.55576: Flags [.], ack 4291598712, win 308, options [nop,nop,TS val 4294839775 ecr 4294839757], length 0
11:14:50.532151 IP 10.0.0.2.55576 > 10.0.0.1.8882: Flags [P.], seq 4291598876:4291599040, ack 2539468977, win 58, options [nop,nop,TS val 4294839797 ecr 4294839775], length 164
11:14:50.541508 IP 10.0.0.1.8882 > 10.0.0.2.55576: Flags [.], ack 4291598876, win 310, options [nop,nop,TS val 4294839796 ecr 4294839779], length 0
11:14:50.553073 IP 10.0.0.2.55576 > 10.0.0.1.8882: Flags [P.], seq 4291599040:4291599204, ack 2539468977, win 58, options [nop,nop,TS val 4294839818 ecr 4294839796], length 164
11:14:50.557936 IP 10.0.0.1.8882 > 10.0.0.2.55576: Flags [.], ack 4291599040, win 312, options [nop,nop,TS val 4294839813 ecr 4294839797], length 0
11:14:50.573653 IP 10.0.0.2.55576 > 10.0.0.1.8882: Flags [P.], seq 4291599204:4291599368, ack 2539468977, win 58, options [nop,nop,TS val 4294839839 ecr 4294839813], length 164
11:14:50.583143 IP 10.0.0.1.8882 > 10.0.0.2.55576: Flags [.], ack 4291599204, win 315, options [nop,nop,TS val 4294839838 ecr 4294839818], length 0
11:14:50.593531 IP 10.0.0.2.55576 > 10.0.0.1.8882: Flags [P.], seq 4291599368:4291599532, ack 2539468977, win 58, options [nop,nop,TS val 4294839859 ecr 4294839838], length 164
11:14:50.604134 IP 10.0.0.1.8882 > 10.0.0.2.55576: Flags [.], ack 4291599368, win 317, options [nop,nop,TS val 4294839859 ecr 4294839839], length 0
11:14:50.612966 IP 10.0.0.2.55576 > 10.0.0.1.8882: Flags [P.], seq 4291599532:4291599696, ack 2539468977, win 58, options [nop,nop,TS val 4294839878 ecr 4294839859], length 164
11:14:50.624534 IP 10.0.0.1.8882 > 10.0.0.2.55576: Flags [.], ack 4291599532, win 319, options [nop,nop,TS val 4294839878 ecr 4294839859], length 0
11:14:50.632406 IP 10.0.0.2.55576 > 10.0.0.1.8882: Flags [P.], seq 4291599696:4291599860, ack 2539468977, win 58, options [nop,nop,TS val 4294839897 ecr 4294839878], length 164
11:14:50.639788 IP 10.0.0.1.8882 > 10.0.0.2.55576: Flags [.], ack 4291599696, win 321, options [nop,nop,TS val 4294839895 ecr 4294839878], length 0
11:14:50.652238 IP 10.0.0.2.55576 > 10.0.0.1.8882: Flags [P.], seq 4291599860:4291600024, ack 2539468977, win 58, options [nop,nop,TS val 4294839917 ecr 4294839895], length 164
11:14:50.658209 IP 10.0.0.1.8882 > 10.0.0.2.55576: Flags [.], ack 4291599860, win 323, options [nop,nop,TS val 4294839913 ecr 4294839897], length 0
11:14:50.672211 IP 10.0.0.2.55576 > 10.0.0.1.8882: Flags [P.], seq 4291600024:4291600188, ack 2539468977, win 58, options [nop,nop,TS val 4294839937 ecr 4294839913], length 164
11:14:50.679856 IP 10.0.0.1.8882 > 10.0.0.2.55576: Flags [.], ack 4291600024, win 325, options [nop,nop,TS val 4294839934 ecr 4294839917], length 0
11:14:50.692187 IP 10.0.0.2.55576 > 10.0.0.1.8882: Flags [P.], seq 4291600188:4291600352, ack 2539468977, win 58, options [nop,nop,TS val 4294839957 ecr 4294839934], length 164
11:14:50.701257 IP 10.0.0.1.8882 > 10.0.0.2.55576: Flags [.], ack 4291600188, win 327, options [nop,nop,TS val 4294839956 ecr 4294839937], length 0
