11:40:09.536966 IP 10.0.0.2.60172 > vagrant-ubuntu-trusty-64.8882: Flags [P.], seq 499441258:499441422, ack 2113429343, win 58, options [nop,nop,TS val 4294713143 ecr 4294713131], length 164
11:40:09.537024 IP vagrant-ubuntu-trusty-64.8882 > 10.0.0.2.60172: Flags [.], ack 499441422, win 63, options [nop,nop,TS val 4294713154 ecr 4294713143], length 0
11:40:09.555269 IP 10.0.0.2.60172 > vagrant-ubuntu-trusty-64.8882: Flags [P.], seq 499441422:499441586, ack 2113429343, win 58, options [nop,nop,TS val 4294713162 ecr 4294713131], length 164
11:40:09.555287 IP vagrant-ubuntu-trusty-64.8882 > 10.0.0.2.60172: Flags [.], ack 499441586, win 65, options [nop,nop,TS val 4294713172 ecr 4294713162], length 0
11:40:09.574730 IP 10.0.0.2.60172 > vagrant-ubuntu-trusty-64.8882: Flags [P.], seq 499441586:499441750, ack 2113429343, win 58, options [nop,nop,TS val 4294713181 ecr 4294713154], length 164
11:40:09.574762 IP vagrant-ubuntu-trusty-64.8882 > 10.0.0.2.60172: Flags [.], ack 499441750, win 68, options [nop,nop,TS val 4294713192 ecr 4294713181], length 0
11:40:09.595258 IP 10.0.0.2.60172 > vagrant-ubuntu-trusty-64.8882: Flags [P.], seq 499441750:499441914, ack 2113429343, win 58, options [nop,nop,TS val 4294713202 ecr 4294713192], length 164
11:40:09.595286 IP vagrant-ubuntu-trusty-64.8882 > 10.0.0.2.60172: Flags [.], ack 499441914, win 70, options [nop,nop,TS val 4294713212 ecr 4294713202], length 0
11:40:09.615133 IP 10.0.0.2.60172 > vagrant-ubuntu-trusty-64.8882: Flags [P.], seq 499441914:499442078, ack 2113429343, win 58, options [nop,nop,TS val 4294713222 ecr 4294713192], length 164
11:40:09.615149 IP vagrant-ubuntu-trusty-64.8882 > 10.0.0.2.60172: Flags [.], ack 499442078, win 72, options [nop,nop,TS val 4294713232 ecr 4294713222], length 0
11:40:09.634849 IP 10.0.0.2.60172 > vagrant-ubuntu-trusty-64.8882: Flags [P.], seq 499442078:499442242, ack 2113429343, win 58, options [nop,nop,TS val 4294713242 ecr 4294713212], length 164
11:40:09.634896 IP vagrant-ubuntu-trusty-64.8882 > 10.0.0.2.60172: Flags [.], ack 499442242, win 74, options [nop,nop,TS val 4294713252 ecr 4294713242], length 0
11:40:09.655105 IP 10.0.0.2.60172 > vagrant-ubuntu-trusty-64.8882: Flags [P.], seq 499442242:499442406, ack 2113429343, win 58, options [nop,nop,TS val 4294713261 ecr 4294713232], length 164
11:40:09.655170 IP vagrant-ubuntu-trusty-64.8882 > 10.0.0.2.60172: Flags [.], ack 499442406, win 76, options [nop,nop,TS val 4294713271 ecr 4294713261], length 0
11:40:09.684297 IP 10.0.0.2.60172 > vagrant-ubuntu-trusty-64.8882: Flags [P.], seq 499442406:499442570, ack 2113429343, win 58, options [nop,nop,TS val 4294713282 ecr 4294713252], length 164
11:40:09.684316 IP vagrant-ubuntu-trusty-64.8882 > 10.0.0.2.60172: Flags [.], ack 499442570, win 78, options [nop,nop,TS val 4294713301 ecr 4294713282], length 0
11:40:09.721304 IP 10.0.0.2.60172 > vagrant-ubuntu-trusty-64.8882: Flags [P.], seq 499442570:499442734, ack 2113429343, win 58, options [nop,nop,TS val 4294713301 ecr 4294713271], length 164
11:40:09.721353 IP vagrant-ubuntu-trusty-64.8882 > 10.0.0.2.60172: Flags [.], ack 499442734, win 80, options [nop,nop,TS val 4294713338 ecr 4294713301], length 0
11:40:09.763714 IP 10.0.0.2.60172 > vagrant-ubuntu-trusty-64.8882: Flags [P.], seq 499442898:499443062, ack 2113429343, win 58, options [nop,nop,TS val 4294713341 ecr 4294713301], length 164
11:40:09.763801 IP vagrant-ubuntu-trusty-64.8882 > 10.0.0.2.60172: Flags [.], ack 499442734, win 82, options [nop,nop,TS val 4294713380 ecr 4294713301,nop,nop,sack 1 {499442898:499443062}], length 0
11:40:09.784823 IP 10.0.0.2.60172 > vagrant-ubuntu-trusty-64.8882: Flags [P.], seq 499443226:499443390, ack 2113429343, win 58, options [nop,nop,TS val 4294713381 ecr 4294713338], length 164
11:40:09.784842 IP vagrant-ubuntu-trusty-64.8882 > 10.0.0.2.60172: Flags [.], ack 499442734, win 84, options [nop,nop,TS val 4294713402 ecr 4294713301,nop,nop,sack 2 {499443226:499443390}{499442898:499443062}], length 0
11:40:09.803230 IP 10.0.0.2.60172 > vagrant-ubuntu-trusty-64.8882: Flags [P.], seq 499443390:499443554, ack 2113429343, win 58, options [nop,nop,TS val 4294713401 ecr 4294713380], length 164
11:40:09.803256 IP vagrant-ubuntu-trusty-64.8882 > 10.0.0.2.60172: Flags [.], ack 499442734, win 86, options [nop,nop,TS val 4294713420 ecr 4294713301,nop,nop,sack 2 {499443226:499443554}{499442898:499443062}], length 0
11:40:09.813295 IP 10.0.0.2.60172 > vagrant-ubuntu-trusty-64.8882: Flags [P.], seq 499442734:499442898, ack 2113429343, win 58, options [nop,nop,TS val 4294713412 ecr 4294713402], length 164
11:40:09.813367 IP vagrant-ubuntu-trusty-64.8882 > 10.0.0.2.60172: Flags [.], ack 499443062, win 88, options [nop,nop,TS val 4294713429 ecr 4294713412,nop,nop,sack 1 {499443226:499443554}], length 0
11:40:09.813319 IP 10.0.0.2.60172 > vagrant-ubuntu-trusty-64.8882: Flags [P.], seq 499443062:499443226, ack 2113429343, win 58, options [nop,nop,TS val 4294713412 ecr 4294713402], length 164
11:40:09.813378 IP vagrant-ubuntu-trusty-64.8882 > 10.0.0.2.60172: Flags [.], ack 499443554, win 91, options [nop,nop,TS val 4294713429 ecr 4294713412], length 0
11:40:09.833330 IP 10.0.0.2.60172 > vagrant-ubuntu-trusty-64.8882: Flags [P.], seq 499443554:499443718, ack 2113429343, win 58, options [nop,nop,TS val 4294713429 ecr 4294713420], length 164
11:40:09.833392 IP vagrant-ubuntu-trusty-64.8882 > 10.0.0.2.60172: Flags [.], ack 499443718, win 93, options [nop,nop,TS val 4294713450 ecr 4294713429], length 0
11:40:09.875302 IP 10.0.0.2.60172 > vagrant-ubuntu-trusty-64.8882: Flags [P.], seq 499443882:499444046, ack 2113429343, win 58, options [nop,nop,TS val 4294713462 ecr 4294713429], length 164
11:40:09.875322 IP vagrant-ubuntu-trusty-64.8882 > 10.0.0.2.60172: Flags [.], ack 499443718, win 95, options [nop,nop,TS val 4294713492 ecr 4294713429,nop,nop,sack 1 {499443882:499444046}], length 0
11:40:09.886186 IP 10.0.0.2.60172 > vagrant-ubuntu-trusty-64.8882: Flags [P.], seq 499444046:499444210, ack 2113429343, win 58, options [nop,nop,TS val 4294713481 ecr 4294713450], length 164
11:40:09.886206 IP vagrant-ubuntu-trusty-64.8882 > 10.0.0.2.60172: Flags [.], ack 499443718, win 97, options [nop,nop,TS val 4294713503 ecr 4294713429,nop,nop,sack 1 {499443882:499444210}], length 0
11:40:09.894525 IP 10.0.0.2.60172 > vagrant-ubuntu-trusty-64.8882: Flags [P.], seq 499444210:499444374, ack 2113429343, win 58, options [nop,nop,TS val 4294713501 ecr 4294713450], length 164
11:40:09.894548 IP vagrant-ubuntu-trusty-64.8882 > 10.0.0.2.60172: Flags [.], ack 499443718, win 99, options [nop,nop,TS val 4294713511 ecr 4294713429,nop,nop,sack 1 {499443882:499444374}], length 0
11:40:09.915288 IP 10.0.0.2.60172 > vagrant-ubuntu-trusty-64.8882: Flags [P.], seq 499444374:499444538, ack 2113429343, win 58, options [nop,nop,TS val 4294713521 ecr 4294713503], length 164
11:40:09.915422 IP vagrant-ubuntu-trusty-64.8882 > 10.0.0.2.60172: Flags [.], ack 499443718, win 101, options [nop,nop,TS val 4294713532 ecr 4294713429,nop,nop,sack 1 {499443882:499444538}], length 0
11:40:09.915328 IP 10.0.0.2.60172 > vagrant-ubuntu-trusty-64.8882: Flags [P.], seq 499443718:499443882, ack 2113429343, win 58, options [nop,nop,TS val 4294713522 ecr 4294713511], length 164
11:40:09.915474 IP vagrant-ubuntu-trusty-64.8882 > 10.0.0.2.60172: Flags [.], ack 499444538, win 103, options [nop,nop,TS val 4294713532 ecr 4294713522], length 0
11:40:09.934359 IP 10.0.0.2.60172 > vagrant-ubuntu-trusty-64.8882: Flags [P.], seq 499444538:499444702, ack 2113429343, win 58, options [nop,nop,TS val 4294713541 ecr 4294713511], length 164
11:40:09.934379 IP vagrant-ubuntu-trusty-64.8882 > 10.0.0.2.60172: Flags [.], ack 499444702, win 105, options [nop,nop,TS val 4294713551 ecr 4294713541], length 0
11:40:09.954507 IP 10.0.0.2.60172 > vagrant-ubuntu-trusty-64.8882: Flags [P.], seq 499444702:499444866, ack 2113429343, win 58, options [nop,nop,TS val 4294713561 ecr 4294713532], length 164
11:40:09.954555 IP vagrant-ubuntu-trusty-64.8882 > 10.0.0.2.60172: Flags [.], ack 499444866, win 107, options [nop,nop,TS val 4294713571 ecr 4294713561], length 0
11:40:09.974514 IP 10.0.0.2.60172 > vagrant-ubuntu-trusty-64.8882: Flags [P.], seq 499444866:499445030, ack 2113429343, win 58, options [nop,nop,TS val 4294713581 ecr 4294713551], length 164
11:40:09.974532 IP vagrant-ubuntu-trusty-64.8882 > 10.0.0.2.60172: Flags [.], ack 499445030, win 109, options [nop,nop,TS val 4294713591 ecr 4294713581], length 0
11:40:09.995305 IP 10.0.0.2.60172 > vagrant-ubuntu-trusty-64.8882: Flags [P.], seq 499445030:499445194, ack 2113429343, win 58, options [nop,nop,TS val 4294713602 ecr 4294713591], length 164
11:40:09.995325 IP vagrant-ubuntu-trusty-64.8882 > 10.0.0.2.60172: Flags [.], ack 499445194, win 111, options [nop,nop,TS val 4294713612 ecr 4294713602], length 0
11:40:10.015236 IP 10.0.0.2.60172 > vagrant-ubuntu-trusty-64.8882: Flags [P.], seq 499445194:499445358, ack 2113429343, win 58, options [nop,nop,TS val 4294713621 ecr 4294713591], length 164
11:40:10.015287 IP vagrant-ubuntu-trusty-64.8882 > 10.0.0.2.60172: Flags [.], ack 499445358, win 114, options [nop,nop,TS val 4294713632 ecr 4294713621], length 0
11:40:10.034312 IP 10.0.0.2.60172 > vagrant-ubuntu-trusty-64.8882: Flags [P.], seq 499445358:499445522, ack 2113429343, win 58, options [nop,nop,TS val 4294713641 ecr 4294713612], length 164
11:40:10.034327 IP vagrant-ubuntu-trusty-64.8882 > 10.0.0.2.60172: Flags [.], ack 499445522, win 116, options [nop,nop,TS val 4294713651 ecr 4294713641], length 0
11:40:10.054572 IP 10.0.0.2.60172 > vagrant-ubuntu-trusty-64.8882: Flags [P.], seq 499445522:499445686, ack 2113429343, win 58, options [nop,nop,TS val 4294713661 ecr 4294713632], length 164
11:40:10.054620 IP vagrant-ubuntu-trusty-64.8882 > 10.0.0.2.60172: Flags [.], ack 499445686, win 118, options [nop,nop,TS val 4294713671 ecr 4294713661], length 0
11:40:10.075187 IP 10.0.0.2.60172 > vagrant-ubuntu-trusty-64.8882: Flags [P.], seq 499445686:499445850, ack 2113429343, win 58, options [nop,nop,TS val 4294713681 ecr 4294713651], length 164
11:40:10.075237 IP vagrant-ubuntu-trusty-64.8882 > 10.0.0.2.60172: Flags [.], ack 499445850, win 120, options [nop,nop,TS val 4294713692 ecr 4294713681], length 0
11:40:10.094554 IP 10.0.0.2.60172 > vagrant-ubuntu-trusty-64.8882: Flags [P.], seq 499445850:499446014, ack 2113429343, win 58, options [nop,nop,TS val 4294713701 ecr 4294713671], length 164
11:40:10.094592 IP vagrant-ubuntu-trusty-64.8882 > 10.0.0.2.60172: Flags [.], ack 499446014, win 122, options [nop,nop,TS val 4294713711 ecr 4294713701], length 0
11:40:10.115300 IP 10.0.0.2.60172 > vagrant-ubuntu-trusty-64.8882: Flags [P.], seq 499446014:499446178, ack 2113429343, win 58, options [nop,nop,TS val 4294713721 ecr 4294713692], length 164
11:40:10.115345 IP vagrant-ubuntu-trusty-64.8882 > 10.0.0.2.60172: Flags [.], ack 499446178, win 124, options [nop,nop,TS val 4294713732 ecr 4294713721], length 0
11:40:10.134460 IP 10.0.0.2.60172 > vagrant-ubuntu-trusty-64.8882: Flags [P.], seq 499446178:499446342, ack 2113429343, win 58, options [nop,nop,TS val 4294713741 ecr 4294713711], length 164
11:40:10.134480 IP vagrant-ubuntu-trusty-64.8882 > 10.0.0.2.60172: Flags [.], ack 499446342, win 126, options [nop,nop,TS val 4294713751 ecr 4294713741], length 0
11:40:10.154701 IP 10.0.0.2.60172 > vagrant-ubuntu-trusty-64.8882: Flags [P.], seq 499446342:499446506, ack 2113429343, win 58, options [nop,nop,TS val 4294713761 ecr 4294713732], length 164
11:40:10.154720 IP vagrant-ubuntu-trusty-64.8882 > 10.0.0.2.60172: Flags [.], ack 499446506, win 128, options [nop,nop,TS val 4294713772 ecr 4294713761], length 0
11:40:10.174534 IP 10.0.0.2.60172 > vagrant-ubuntu-trusty-64.8882: Flags [P.], seq 499446506:499446670, ack 2113429343, win 58, options [nop,nop,TS val 4294713781 ecr 4294713751], length 164
11:40:10.174552 IP vagrant-ubuntu-trusty-64.8882 > 10.0.0.2.60172: Flags [.], ack 499446670, win 130, options [nop,nop,TS val 4294713791 ecr 4294713781], length 0
11:40:10.201301 IP 10.0.0.2.60172 > vagrant-ubuntu-trusty-64.8882: Flags [P.], seq 499446670:499446834, ack 2113429343, win 58, options [nop,nop,TS val 4294713802 ecr 4294713791], length 164
11:40:10.201315 IP vagrant-ubuntu-trusty-64.8882 > 10.0.0.2.60172: Flags [.], ack 499446834, win 132, options [nop,nop,TS val 4294713818 ecr 4294713802], length 0
11:40:10.224439 IP 10.0.0.2.60172 > vagrant-ubuntu-trusty-64.8882: Flags [P.], seq 499446834:499446998, ack 2113429343, win 58, options [nop,nop,TS val 4294713821 ecr 4294713791], length 164
11:40:10.224487 IP vagrant-ubuntu-trusty-64.8882 > 10.0.0.2.60172: Flags [.], ack 499446998, win 135, options [nop,nop,TS val 4294713841 ecr 4294713821], length 0
11:40:10.264606 IP 10.0.0.2.60172 > vagrant-ubuntu-trusty-64.8882: Flags [P.], seq 499447162:499447326, ack 2113429343, win 58, options [nop,nop,TS val 4294713861 ecr 4294713841], length 164
11:40:10.264683 IP vagrant-ubuntu-trusty-64.8882 > 10.0.0.2.60172: Flags [.], ack 499446998, win 137, options [nop,nop,TS val 4294713882 ecr 4294713821,nop,nop,sack 1 {499447162:499447326}], length 0
11:40:10.309589 IP 10.0.0.2.60172 > vagrant-ubuntu-trusty-64.8882: Flags [P.], seq 499446998:499447162, ack 2113429343, win 58, options [nop,nop,TS val 4294713899 ecr 4294713882], length 164
11:40:10.309634 IP vagrant-ubuntu-trusty-64.8882 > 10.0.0.2.60172: Flags [.], ack 499447326, win 139, options [nop,nop,TS val 4294713926 ecr 4294713899], length 0
11:40:10.311233 IP 10.0.0.2.60172 > vagrant-ubuntu-trusty-64.8882: Flags [P.], seq 499447490:499447654, ack 2113429343, win 58, options [nop,nop,TS val 4294713901 ecr 4294713882], length 164
11:40:10.311270 IP vagrant-ubuntu-trusty-64.8882 > 10.0.0.2.60172: Flags [.], ack 499447326, win 141, options [nop,nop,TS val 4294713928 ecr 4294713899,nop,nop,sack 1 {499447490:499447654}], length 0
11:40:10.342380 IP 10.0.0.2.60172 > vagrant-ubuntu-trusty-64.8882: Flags [P.], seq 499447326:499447490, ack 2113429343, win 58, options [nop,nop,TS val 4294713938 ecr 4294713928], length 164
11:40:10.342460 IP vagrant-ubuntu-trusty-64.8882 > 10.0.0.2.60172: Flags [.], ack 499447654, win 143, options [nop,nop,TS val 4294713959 ecr 4294713938], length 0
11:40:10.373714 IP 10.0.0.2.60172 > vagrant-ubuntu-trusty-64.8882: Flags [P.], seq 499447818:499448146, ack 2113429343, win 58, options [nop,nop,TS val 4294713969 ecr 4294713959], length 328
11:40:10.373734 IP vagrant-ubuntu-trusty-64.8882 > 10.0.0.2.60172: Flags [.], ack 499447654, win 145, options [nop,nop,TS val 4294713991 ecr 4294713938,nop,nop,sack 1 {499447818:499448146}], length 0
11:40:10.406650 IP 10.0.0.2.60172 > vagrant-ubuntu-trusty-64.8882: Flags [P.], seq 499448310:499448474, ack 2113429343, win 58, options [nop,nop,TS val 4294714002 ecr 4294713991], length 164
11:40:10.406678 IP vagrant-ubuntu-trusty-64.8882 > 10.0.0.2.60172: Flags [.], ack 499447654, win 147, options [nop,nop,TS val 4294714024 ecr 4294713938,nop,nop,sack 2 {499448310:499448474}{499447818:499448146}], length 0
11:40:10.436449 IP 10.0.0.2.60172 > vagrant-ubuntu-trusty-64.8882: Flags [P.], seq 499447654:499447818, ack 2113429343, win 58, options [nop,nop,TS val 4294714034 ecr 4294714024], length 164
11:40:10.436472 IP vagrant-ubuntu-trusty-64.8882 > 10.0.0.2.60172: Flags [.], ack 499448146, win 149, options [nop,nop,TS val 4294714053 ecr 4294714034,nop,nop,sack 1 {499448310:499448474}], length 0
11:40:10.464854 IP 10.0.0.2.60172 > vagrant-ubuntu-trusty-64.8882: Flags [P.], seq 499448474:499448966, ack 2113429343, win 58, options [nop,nop,TS val 4294714063 ecr 4294714053], length 492
11:40:10.464958 IP vagrant-ubuntu-trusty-64.8882 > 10.0.0.2.60172: Flags [.], ack 499448146, win 151, options [nop,nop,TS val 4294714081 ecr 4294714034,nop,nop,sack 1 {499448310:499448966}], length 0
11:40:10.495687 IP 10.0.0.2.60172 > vagrant-ubuntu-trusty-64.8882: Flags [P.], seq 499448966:499449130, ack 2113429343, win 58, options [nop,nop,TS val 4294714093 ecr 4294714081], length 164
11:40:10.495804 IP vagrant-ubuntu-trusty-64.8882 > 10.0.0.2.60172: Flags [.], ack 499448146, win 153, options [nop,nop,TS val 4294714112 ecr 4294714034,nop,nop,sack 1 {499448310:499449130}], length 0
11:40:10.523727 IP 10.0.0.2.60172 > vagrant-ubuntu-trusty-64.8882: Flags [P.], seq 499448146:499448310, ack 2113429343, win 58, options [nop,nop,TS val 4294714123 ecr 4294714112], length 164
11:40:10.523741 IP vagrant-ubuntu-trusty-64.8882 > 10.0.0.2.60172: Flags [.], ack 499449130, win 155, options [nop,nop,TS val 4294714141 ecr 4294714123], length 0
11:40:10.523955 IP 10.0.0.2.60172 > vagrant-ubuntu-trusty-64.8882: Flags [P.], seq 499449130:499449458, ack 2113429343, win 58, options [nop,nop,TS val 4294714123 ecr 4294714112], length 328
11:40:10.523963 IP vagrant-ubuntu-trusty-64.8882 > 10.0.0.2.60172: Flags [.], ack 499449458, win 158, options [nop,nop,TS val 4294714141 ecr 4294714123], length 0
11:40:10.545788 IP 10.0.0.2.60172 > vagrant-ubuntu-trusty-64.8882: Flags [P.], seq 499449458:499449622, ack 2113429343, win 58, options [nop,nop,TS val 4294714151 ecr 4294714141], length 164
11:40:10.545808 IP vagrant-ubuntu-trusty-64.8882 > 10.0.0.2.60172: Flags [.], ack 499449622, win 160, options [nop,nop,TS val 4294714163 ecr 4294714151], length 0
11:40:10.558745 IP 10.0.0.2.60172 > vagrant-ubuntu-trusty-64.8882: Flags [P.], seq 499449622:499449786, ack 2113429343, win 58, options [nop,nop,TS val 4294714162 ecr 4294714141], length 164
11:40:10.558818 IP vagrant-ubuntu-trusty-64.8882 > 10.0.0.2.60172: Flags [.], ack 499449786, win 162, options [nop,nop,TS val 4294714175 ecr 4294714162], length 0
11:40:10.575677 IP 10.0.0.2.60172 > vagrant-ubuntu-trusty-64.8882: Flags [P.], seq 499449786:499449950, ack 2113429343, win 58, options [nop,nop,TS val 4294714182 ecr 4294714163], length 164
11:40:10.575706 IP vagrant-ubuntu-trusty-64.8882 > 10.0.0.2.60172: Flags [.], ack 499449950, win 164, options [nop,nop,TS val 4294714193 ecr 4294714182], length 0
11:40:10.598658 IP 10.0.0.2.60172 > vagrant-ubuntu-trusty-64.8882: Flags [P.], seq 499449950:499450114, ack 2113429343, win 58, options [nop,nop,TS val 4294714202 ecr 4294714175], length 164
11:40:10.598741 IP vagrant-ubuntu-trusty-64.8882 > 10.0.0.2.60172: Flags [.], ack 499450114, win 166, options [nop,nop,TS val 4294714215 ecr 4294714202], length 0
11:40:10.619621 IP 10.0.0.2.60172 > vagrant-ubuntu-trusty-64.8882: Flags [P.], seq 499450114:499450278, ack 2113429343, win 58, options [nop,nop,TS val 4294714222 ecr 4294714193], length 164
11:40:10.619657 IP vagrant-ubuntu-trusty-64.8882 > 10.0.0.2.60172: Flags [.], ack 499450278, win 168, options [nop,nop,TS val 4294714236 ecr 4294714222], length 0
11:40:10.638656 IP 10.0.0.2.60172 > vagrant-ubuntu-trusty-64.8882: Flags [P.], seq 499450278:499450442, ack 2113429343, win 58, options [nop,nop,TS val 4294714241 ecr 4294714215], length 164
11:40:10.638728 IP vagrant-ubuntu-trusty-64.8882 > 10.0.0.2.60172: Flags [.], ack 499450442, win 170, options [nop,nop,TS val 4294714255 ecr 4294714241], length 0
11:40:10.659448 IP 10.0.0.2.60172 > vagrant-ubuntu-trusty-64.8882: Flags [P.], seq 499450442:499450606, ack 2113429343, win 58, options [nop,nop,TS val 4294714262 ecr 4294714236], length 164
11:40:10.659482 IP vagrant-ubuntu-trusty-64.8882 > 10.0.0.2.60172: Flags [.], ack 499450606, win 172, options [nop,nop,TS val 4294714276 ecr 4294714262], length 0
11:40:10.681204 IP 10.0.0.2.60172 > vagrant-ubuntu-trusty-64.8882: Flags [P.], seq 499450606:499450770, ack 2113429343, win 58, options [nop,nop,TS val 4294714282 ecr 4294714255], length 164
11:40:10.681246 IP vagrant-ubuntu-trusty-64.8882 > 10.0.0.2.60172: Flags [.], ack 499450770, win 174, options [nop,nop,TS val 4294714298 ecr 4294714282], length 0
11:40:10.699470 IP 10.0.0.2.60172 > vagrant-ubuntu-trusty-64.8882: Flags [P.], seq 499450770:499450934, ack 2113429343, win 58, options [nop,nop,TS val 4294714302 ecr 4294714276], length 164
11:40:10.699487 IP vagrant-ubuntu-trusty-64.8882 > 10.0.0.2.60172: Flags [.], ack 499450934, win 176, options [nop,nop,TS val 4294714316 ecr 4294714302], length 0
11:40:10.720877 IP 10.0.0.2.60172 > vagrant-ubuntu-trusty-64.8882: Flags [P.], seq 499450934:499451098, ack 2113429343, win 58, options [nop,nop,TS val 4294714322 ecr 4294714298], length 164
11:40:10.720895 IP vagrant-ubuntu-trusty-64.8882 > 10.0.0.2.60172: Flags [.], ack 499451098, win 178, options [nop,nop,TS val 4294714338 ecr 4294714322], length 0
11:40:10.739651 IP 10.0.0.2.60172 > vagrant-ubuntu-trusty-64.8882: Flags [P.], seq 499451098:499451262, ack 2113429343, win 58, options [nop,nop,TS val 4294714342 ecr 4294714316], length 164
11:40:10.739708 IP vagrant-ubuntu-trusty-64.8882 > 10.0.0.2.60172: Flags [.], ack 499451262, win 181, options [nop,nop,TS val 4294714356 ecr 4294714342], length 0
11:40:10.760949 IP 10.0.0.2.60172 > vagrant-ubuntu-trusty-64.8882: Flags [P.], seq 499451262:499451426, ack 2113429343, win 58, options [nop,nop,TS val 4294714362 ecr 4294714338], length 164
11:40:10.761007 IP vagrant-ubuntu-trusty-64.8882 > 10.0.0.2.60172: Flags [.], ack 499451426, win 183, options [nop,nop,TS val 4294714377 ecr 4294714362], length 0
11:40:10.782924 IP 10.0.0.2.60172 > vagrant-ubuntu-trusty-64.8882: Flags [P.], seq 499451426:499451590, ack 2113429343, win 58, options [nop,nop,TS val 4294714382 ecr 4294714356], length 164
11:40:10.782972 IP vagrant-ubuntu-trusty-64.8882 > 10.0.0.2.60172: Flags [.], ack 499451590, win 185, options [nop,nop,TS val 4294714400 ecr 4294714382], length 0
11:40:10.801584 IP 10.0.0.2.60172 > vagrant-ubuntu-trusty-64.8882: Flags [P.], seq 499451590:499451754, ack 2113429343, win 58, options [nop,nop,TS val 4294714401 ecr 4294714377], length 164
11:40:10.801645 IP vagrant-ubuntu-trusty-64.8882 > 10.0.0.2.60172: Flags [.], ack 499451754, win 187, options [nop,nop,TS val 4294714418 ecr 4294714401], length 0
11:40:10.814836 IP 10.0.0.2.60172 > vagrant-ubuntu-trusty-64.8882: Flags [P.], seq 499451754:499451918, ack 2113429343, win 58, options [nop,nop,TS val 4294714422 ecr 4294714400], length 164
11:40:10.814855 IP vagrant-ubuntu-trusty-64.8882 > 10.0.0.2.60172: Flags [.], ack 499451918, win 189, options [nop,nop,TS val 4294714432 ecr 4294714422], length 0
11:40:10.835983 IP 10.0.0.2.60172 > vagrant-ubuntu-trusty-64.8882: Flags [P.], seq 499451918:499452082, ack 2113429343, win 58, options [nop,nop,TS val 4294714442 ecr 4294714432], length 164
11:40:10.836008 IP vagrant-ubuntu-trusty-64.8882 > 10.0.0.2.60172: Flags [.], ack 499452082, win 191, options [nop,nop,TS val 4294714453 ecr 4294714442], length 0
11:40:10.856381 IP 10.0.0.2.60172 > vagrant-ubuntu-trusty-64.8882: Flags [P.], seq 499452082:499452246, ack 2113429343, win 58, options [nop,nop,TS val 4294714462 ecr 4294714432], length 164
11:40:10.856476 IP vagrant-ubuntu-trusty-64.8882 > 10.0.0.2.60172: Flags [.], ack 499452246, win 193, options [nop,nop,TS val 4294714472 ecr 4294714462], length 0
11:40:10.875928 IP 10.0.0.2.60172 > vagrant-ubuntu-trusty-64.8882: Flags [P.], seq 499452246:499452410, ack 2113429343, win 58, options [nop,nop,TS val 4294714482 ecr 4294714453], length 164
11:40:10.875964 IP vagrant-ubuntu-trusty-64.8882 > 10.0.0.2.60172: Flags [.], ack 499452410, win 195, options [nop,nop,TS val 4294714493 ecr 4294714482], length 0
11:40:10.895581 IP 10.0.0.2.60172 > vagrant-ubuntu-trusty-64.8882: Flags [P.], seq 499452410:499452574, ack 2113429343, win 58, options [nop,nop,TS val 4294714502 ecr 4294714472], length 164
11:40:10.895628 IP vagrant-ubuntu-trusty-64.8882 > 10.0.0.2.60172: Flags [.], ack 499452574, win 197, options [nop,nop,TS val 4294714512 ecr 4294714502], length 0
11:40:10.914498 IP 10.0.0.2.60172 > vagrant-ubuntu-trusty-64.8882: Flags [P.], seq 499452574:499452738, ack 2113429343, win 58, options [nop,nop,TS val 4294714521 ecr 4294714493], length 164
11:40:10.914515 IP vagrant-ubuntu-trusty-64.8882 > 10.0.0.2.60172: Flags [.], ack 499452738, win 199, options [nop,nop,TS val 4294714531 ecr 4294714521], length 0
11:40:10.935885 IP 10.0.0.2.60172 > vagrant-ubuntu-trusty-64.8882: Flags [P.], seq 499452738:499452902, ack 2113429343, win 58, options [nop,nop,TS val 4294714542 ecr 4294714512], length 164
11:40:10.935918 IP vagrant-ubuntu-trusty-64.8882 > 10.0.0.2.60172: Flags [.], ack 499452902, win 202, options [nop,nop,TS val 4294714553 ecr 4294714542], length 0
11:40:10.961045 IP 10.0.0.2.60172 > vagrant-ubuntu-trusty-64.8882: Flags [P.], seq 499452902:499453066, ack 2113429343, win 58, options [nop,nop,TS val 4294714562 ecr 4294714531], length 164
11:40:10.961058 IP vagrant-ubuntu-trusty-64.8882 > 10.0.0.2.60172: Flags [.], ack 499453066, win 204, options [nop,nop,TS val 4294714578 ecr 4294714562], length 0
11:40:10.975088 IP 10.0.0.2.60172 > vagrant-ubuntu-trusty-64.8882: Flags [P.], seq 499453066:499453230, ack 2113429343, win 58, options [nop,nop,TS val 4294714582 ecr 4294714553], length 164
11:40:10.975103 IP vagrant-ubuntu-trusty-64.8882 > 10.0.0.2.60172: Flags [.], ack 499453230, win 206, options [nop,nop,TS val 4294714592 ecr 4294714582], length 0
11:40:10.995984 IP 10.0.0.2.60172 > vagrant-ubuntu-trusty-64.8882: Flags [P.], seq 499453230:499453394, ack 2113429343, win 58, options [nop,nop,TS val 4294714602 ecr 4294714578], length 164
11:40:10.996014 IP vagrant-ubuntu-trusty-64.8882 > 10.0.0.2.60172: Flags [.], ack 499453394, win 208, options [nop,nop,TS val 4294714613 ecr 4294714602], length 0
11:40:11.015827 IP 10.0.0.2.60172 > vagrant-ubuntu-trusty-64.8882: Flags [P.], seq 499453394:499453558, ack 2113429343, win 58, options [nop,nop,TS val 4294714622 ecr 4294714592], length 164
11:40:11.015866 IP vagrant-ubuntu-trusty-64.8882 > 10.0.0.2.60172: Flags [.], ack 499453558, win 210, options [nop,nop,TS val 4294714632 ecr 4294714622], length 0
11:40:11.035684 IP 10.0.0.2.60172 > vagrant-ubuntu-trusty-64.8882: Flags [P.], seq 499453558:499453722, ack 2113429343, win 58, options [nop,nop,TS val 4294714642 ecr 4294714613], length 164
11:40:11.035730 IP vagrant-ubuntu-trusty-64.8882 > 10.0.0.2.60172: Flags [.], ack 499453722, win 212, options [nop,nop,TS val 4294714652 ecr 4294714642], length 0
11:40:11.055336 IP 10.0.0.2.60172 > vagrant-ubuntu-trusty-64.8882: Flags [P.], seq 499453722:499453886, ack 2113429343, win 58, options [nop,nop,TS val 4294714662 ecr 4294714632], length 164
11:40:11.055347 IP vagrant-ubuntu-trusty-64.8882 > 10.0.0.2.60172: Flags [.], ack 499453886, win 214, options [nop,nop,TS val 4294714672 ecr 4294714662], length 0
11:40:11.075178 IP 10.0.0.2.60172 > vagrant-ubuntu-trusty-64.8882: Flags [P.], seq 499453886:499454050, ack 2113429343, win 58, options [nop,nop,TS val 4294714682 ecr 4294714652], length 164
11:40:11.075190 IP vagrant-ubuntu-trusty-64.8882 > 10.0.0.2.60172: Flags [.], ack 499454050, win 216, options [nop,nop,TS val 4294714692 ecr 4294714682], length 0
11:40:11.095732 IP 10.0.0.2.60172 > vagrant-ubuntu-trusty-64.8882: Flags [P.], seq 499454050:499454214, ack 2113429343, win 58, options [nop,nop,TS val 4294714702 ecr 4294714672], length 164
11:40:11.095777 IP vagrant-ubuntu-trusty-64.8882 > 10.0.0.2.60172: Flags [.], ack 499454214, win 218, options [nop,nop,TS val 4294714712 ecr 4294714702], length 0
11:40:11.114320 IP 10.0.0.2.60172 > vagrant-ubuntu-trusty-64.8882: Flags [P.], seq 499454214:499454378, ack 2113429343, win 58, options [nop,nop,TS val 4294714721 ecr 4294714692], length 164
11:40:11.114335 IP vagrant-ubuntu-trusty-64.8882 > 10.0.0.2.60172: Flags [.], ack 499454378, win 220, options [nop,nop,TS val 4294714731 ecr 4294714721], length 0
11:40:11.136244 IP 10.0.0.2.60172 > vagrant-ubuntu-trusty-64.8882: Flags [P.], seq 499454378:499454542, ack 2113429343, win 58, options [nop,nop,TS val 4294714742 ecr 4294714731], length 164
11:40:11.136279 IP vagrant-ubuntu-trusty-64.8882 > 10.0.0.2.60172: Flags [.], ack 499454542, win 222, options [nop,nop,TS val 4294714753 ecr 4294714742], length 0
11:40:11.155098 IP 10.0.0.2.60172 > vagrant-ubuntu-trusty-64.8882: Flags [P.], seq 499454542:499454706, ack 2113429343, win 58, options [nop,nop,TS val 4294714762 ecr 4294714731], length 164
11:40:11.155111 IP vagrant-ubuntu-trusty-64.8882 > 10.0.0.2.60172: Flags [.], ack 499454706, win 225, options [nop,nop,TS val 4294714772 ecr 4294714762], length 0
11:40:11.175081 IP 10.0.0.2.60172 > vagrant-ubuntu-trusty-64.8882: Flags [P.], seq 499454706:499454870, ack 2113429343, win 58, options [nop,nop,TS val 4294714782 ecr 4294714753], length 164
11:40:11.175097 IP vagrant-ubuntu-trusty-64.8882 > 10.0.0.2.60172: Flags [.], ack 499454870, win 227, options [nop,nop,TS val 4294714792 ecr 4294714782], length 0
11:40:11.195882 IP 10.0.0.2.60172 > vagrant-ubuntu-trusty-64.8882: Flags [P.], seq 499454870:499455034, ack 2113429343, win 58, options [nop,nop,TS val 4294714802 ecr 4294714772], length 164
11:40:11.195951 IP vagrant-ubuntu-trusty-64.8882 > 10.0.0.2.60172: Flags [.], ack 499455034, win 229, options [nop,nop,TS val 4294714812 ecr 4294714802], length 0
11:40:11.215774 IP 10.0.0.2.60172 > vagrant-ubuntu-trusty-64.8882: Flags [P.], seq 499455034:499455198, ack 2113429343, win 58, options [nop,nop,TS val 4294714822 ecr 4294714792], length 164
11:40:11.215815 IP vagrant-ubuntu-trusty-64.8882 > 10.0.0.2.60172: Flags [.], ack 499455198, win 231, options [nop,nop,TS val 4294714832 ecr 4294714822], length 0
11:40:11.243311 IP 10.0.0.2.60172 > vagrant-ubuntu-trusty-64.8882: Flags [P.], seq 499455198:499455362, ack 2113429343, win 58, options [nop,nop,TS val 4294714842 ecr 4294714812], length 164
11:40:11.243357 IP vagrant-ubuntu-trusty-64.8882 > 10.0.0.2.60172: Flags [.], ack 499455362, win 233, options [nop,nop,TS val 4294714859 ecr 4294714842], length 0
11:40:11.254348 IP 10.0.0.2.60172 > vagrant-ubuntu-trusty-64.8882: Flags [P.], seq 499455362:499455526, ack 2113429343, win 58, options [nop,nop,TS val 4294714861 ecr 4294714832], length 164
11:40:11.254358 IP vagrant-ubuntu-trusty-64.8882 > 10.0.0.2.60172: Flags [.], ack 499455526, win 235, options [nop,nop,TS val 4294714871 ecr 4294714861], length 0
11:40:11.275071 IP 10.0.0.2.60172 > vagrant-ubuntu-trusty-64.8882: Flags [P.], seq 499455526:499455690, ack 2113429343, win 58, options [nop,nop,TS val 4294714882 ecr 4294714859], length 164
11:40:11.275088 IP vagrant-ubuntu-trusty-64.8882 > 10.0.0.2.60172: Flags [.], ack 499455690, win 237, options [nop,nop,TS val 4294714892 ecr 4294714882], length 0
11:40:11.295745 IP 10.0.0.2.60172 > vagrant-ubuntu-trusty-64.8882: Flags [P.], seq 499455690:499455854, ack 2113429343, win 58, options [nop,nop,TS val 4294714902 ecr 4294714871], length 164
11:40:11.295818 IP vagrant-ubuntu-trusty-64.8882 > 10.0.0.2.60172: Flags [.], ack 499455854, win 239, options [nop,nop,TS val 4294714912 ecr 4294714902], length 0
11:40:11.325906 IP 10.0.0.2.60172 > vagrant-ubuntu-trusty-64.8882: Flags [P.], seq 499455854:499456018, ack 2113429343, win 58, options [nop,nop,TS val 4294714922 ecr 4294714892], length 164
11:40:11.326037 IP vagrant-ubuntu-trusty-64.8882 > 10.0.0.2.60172: Flags [.], ack 499456018, win 241, options [nop,nop,TS val 4294714942 ecr 4294714922], length 0
11:40:11.335252 IP 10.0.0.2.60172 > vagrant-ubuntu-trusty-64.8882: Flags [P.], seq 499456018:499456182, ack 2113429343, win 58, options [nop,nop,TS val 4294714941 ecr 4294714912], length 164
11:40:11.335306 IP vagrant-ubuntu-trusty-64.8882 > 10.0.0.2.60172: Flags [.], ack 499456182, win 243, options [nop,nop,TS val 4294714951 ecr 4294714941], length 0
11:40:11.354918 IP 10.0.0.2.60172 > vagrant-ubuntu-trusty-64.8882: Flags [P.], seq 499456182:499456346, ack 2113429343, win 58, options [nop,nop,TS val 4294714961 ecr 4294714942], length 164
11:40:11.354982 IP vagrant-ubuntu-trusty-64.8882 > 10.0.0.2.60172: Flags [.], ack 499456346, win 245, options [nop,nop,TS val 4294714971 ecr 4294714961], length 0
11:40:11.375751 IP 10.0.0.2.60172 > vagrant-ubuntu-trusty-64.8882: Flags [P.], seq 499456346:499456510, ack 2113429343, win 58, options [nop,nop,TS val 4294714982 ecr 4294714951], length 164
11:40:11.375793 IP vagrant-ubuntu-trusty-64.8882 > 10.0.0.2.60172: Flags [.], ack 499456510, win 248, options [nop,nop,TS val 4294714992 ecr 4294714982], length 0
11:40:11.394970 IP 10.0.0.2.60172 > vagrant-ubuntu-trusty-64.8882: Flags [P.], seq 499456510:499456674, ack 2113429343, win 58, options [nop,nop,TS val 4294715001 ecr 4294714971], length 164
11:40:11.395027 IP vagrant-ubuntu-trusty-64.8882 > 10.0.0.2.60172: Flags [.], ack 499456674, win 250, options [nop,nop,TS val 4294715011 ecr 4294715001], length 0
11:40:11.416088 IP 10.0.0.2.60172 > vagrant-ubuntu-trusty-64.8882: Flags [P.], seq 499456674:499456838, ack 2113429343, win 58, options [nop,nop,TS val 4294715022 ecr 4294714992], length 164
11:40:11.416131 IP vagrant-ubuntu-trusty-64.8882 > 10.0.0.2.60172: Flags [.], ack 499456838, win 252, options [nop,nop,TS val 4294715032 ecr 4294715022], length 0
11:40:11.435403 IP 10.0.0.2.60172 > vagrant-ubuntu-trusty-64.8882: Flags [P.], seq 499456838:499457002, ack 2113429343, win 58, options [nop,nop,TS val 4294715042 ecr 4294715011], length 164
11:40:11.435429 IP vagrant-ubuntu-trusty-64.8882 > 10.0.0.2.60172: Flags [.], ack 499457002, win 254, options [nop,nop,TS val 4294715052 ecr 4294715042], length 0
11:40:11.455132 IP 10.0.0.2.60172 > vagrant-ubuntu-trusty-64.8882: Flags [P.], seq 499457002:499457166, ack 2113429343, win 58, options [nop,nop,TS val 4294715062 ecr 4294715032], length 164
11:40:11.455146 IP vagrant-ubuntu-trusty-64.8882 > 10.0.0.2.60172: Flags [.], ack 499457166, win 256, options [nop,nop,TS val 4294715072 ecr 4294715062], length 0
11:40:11.474997 IP 10.0.0.2.60172 > vagrant-ubuntu-trusty-64.8882: Flags [P.], seq 499457166:499457330, ack 2113429343, win 58, options [nop,nop,TS val 4294715081 ecr 4294715052], length 164
11:40:11.475010 IP vagrant-ubuntu-trusty-64.8882 > 10.0.0.2.60172: Flags [.], ack 499457330, win 258, options [nop,nop,TS val 4294715092 ecr 4294715081], length 0
11:40:11.495214 IP 10.0.0.2.60172 > vagrant-ubuntu-trusty-64.8882: Flags [P.], seq 499457330:499457494, ack 2113429343, win 58, options [nop,nop,TS val 4294715102 ecr 4294715072], length 164
11:40:11.495243 IP vagrant-ubuntu-trusty-64.8882 > 10.0.0.2.60172: Flags [.], ack 499457494, win 260, options [nop,nop,TS val 4294715112 ecr 4294715102], length 0
11:40:11.514846 IP 10.0.0.2.60172 > vagrant-ubuntu-trusty-64.8882: Flags [P.], seq 499457494:499457658, ack 2113429343, win 58, options [nop,nop,TS val 4294715121 ecr 4294715092], length 164
11:40:11.514903 IP vagrant-ubuntu-trusty-64.8882 > 10.0.0.2.60172: Flags [.], ack 499457658, win 262, options [nop,nop,TS val 4294715131 ecr 4294715121], length 0
11:40:11.535074 IP 10.0.0.2.60172 > vagrant-ubuntu-trusty-64.8882: Flags [P.], seq 499457658:499457822, ack 2113429343, win 58, options [nop,nop,TS val 4294715141 ecr 4294715112], length 164
11:40:11.535131 IP vagrant-ubuntu-trusty-64.8882 > 10.0.0.2.60172: Flags [.], ack 499457822, win 264, options [nop,nop,TS val 4294715151 ecr 4294715141], length 0
11:40:11.555301 IP 10.0.0.2.60172 > vagrant-ubuntu-trusty-64.8882: Flags [P.], seq 499457822:499457986, ack 2113429343, win 58, options [nop,nop,TS val 4294715162 ecr 4294715131], length 164
11:40:11.555328 IP vagrant-ubuntu-trusty-64.8882 > 10.0.0.2.60172: Flags [.], ack 499457986, win 266, options [nop,nop,TS val 4294715172 ecr 4294715162], length 0
11:40:11.575257 IP 10.0.0.2.60172 > vagrant-ubuntu-trusty-64.8882: Flags [P.], seq 499457986:499458150, ack 2113429343, win 58, options [nop,nop,TS val 4294715181 ecr 4294715151], length 164
11:40:11.575300 IP vagrant-ubuntu-trusty-64.8882 > 10.0.0.2.60172: Flags [.], ack 499458150, win 269, options [nop,nop,TS val 4294715192 ecr 4294715181], length 0
11:40:11.595194 IP 10.0.0.2.60172 > vagrant-ubuntu-trusty-64.8882: Flags [P.], seq 499458150:499458314, ack 2113429343, win 58, options [nop,nop,TS val 4294715201 ecr 4294715172], length 164
11:40:11.595233 IP vagrant-ubuntu-trusty-64.8882 > 10.0.0.2.60172: Flags [.], ack 499458314, win 271, options [nop,nop,TS val 4294715212 ecr 4294715201], length 0
11:40:11.615323 IP 10.0.0.2.60172 > vagrant-ubuntu-trusty-64.8882: Flags [P.], seq 499458314:499458478, ack 2113429343, win 58, options [nop,nop,TS val 4294715222 ecr 4294715192], length 164
11:40:11.615339 IP vagrant-ubuntu-trusty-64.8882 > 10.0.0.2.60172: Flags [.], ack 499458478, win 273, options [nop,nop,TS val 4294715232 ecr 4294715222], length 0
11:40:11.635494 IP 10.0.0.2.60172 > vagrant-ubuntu-trusty-64.8882: Flags [P.], seq 499458478:499458642, ack 2113429343, win 58, options [nop,nop,TS val 4294715242 ecr 4294715212], length 164
11:40:11.635530 IP vagrant-ubuntu-trusty-64.8882 > 10.0.0.2.60172: Flags [.], ack 499458642, win 275, options [nop,nop,TS val 4294715252 ecr 4294715242], length 0
11:40:11.654469 IP 10.0.0.2.60172 > vagrant-ubuntu-trusty-64.8882: Flags [P.], seq 499458642:499458806, ack 2113429343, win 58, options [nop,nop,TS val 4294715261 ecr 4294715232], length 164
11:40:11.654481 IP vagrant-ubuntu-trusty-64.8882 > 10.0.0.2.60172: Flags [.], ack 499458806, win 277, options [nop,nop,TS val 4294715271 ecr 4294715261], length 0
11:40:11.675364 IP 10.0.0.2.60172 > vagrant-ubuntu-trusty-64.8882: Flags [P.], seq 499458806:499458970, ack 2113429343, win 58, options [nop,nop,TS val 4294715281 ecr 4294715252], length 164
11:40:11.675398 IP vagrant-ubuntu-trusty-64.8882 > 10.0.0.2.60172: Flags [.], ack 499458970, win 279, options [nop,nop,TS val 4294715292 ecr 4294715281], length 0
11:40:11.696052 IP 10.0.0.2.60172 > vagrant-ubuntu-trusty-64.8882: Flags [P.], seq 499458970:499459134, ack 2113429343, win 58, options [nop,nop,TS val 4294715302 ecr 4294715271], length 164
11:40:11.696091 IP vagrant-ubuntu-trusty-64.8882 > 10.0.0.2.60172: Flags [.], ack 499459134, win 281, options [nop,nop,TS val 4294715313 ecr 4294715302], length 0
11:40:11.714386 IP 10.0.0.2.60172 > vagrant-ubuntu-trusty-64.8882: Flags [P.], seq 499459134:499459298, ack 2113429343, win 58, options [nop,nop,TS val 4294715321 ecr 4294715292], length 164
11:40:11.714403 IP vagrant-ubuntu-trusty-64.8882 > 10.0.0.2.60172: Flags [.], ack 499459298, win 283, options [nop,nop,TS val 4294715331 ecr 4294715321], length 0
11:40:11.735245 IP 10.0.0.2.60172 > vagrant-ubuntu-trusty-64.8882: Flags [P.], seq 499459298:499459462, ack 2113429343, win 58, options [nop,nop,TS val 4294715342 ecr 4294715331], length 164
11:40:11.735262 IP vagrant-ubuntu-trusty-64.8882 > 10.0.0.2.60172: Flags [.], ack 499459462, win 285, options [nop,nop,TS val 4294715352 ecr 4294715342], length 0
11:40:11.755147 IP 10.0.0.2.60172 > vagrant-ubuntu-trusty-64.8882: Flags [P.], seq 499459462:499459626, ack 2113429343, win 58, options [nop,nop,TS val 4294715362 ecr 4294715331], length 164
11:40:11.755170 IP vagrant-ubuntu-trusty-64.8882 > 10.0.0.2.60172: Flags [.], ack 499459626, win 287, options [nop,nop,TS val 4294715372 ecr 4294715362], length 0
11:40:11.774422 IP 10.0.0.2.60172 > vagrant-ubuntu-trusty-64.8882: Flags [P.], seq 499459626:499459790, ack 2113429343, win 58, options [nop,nop,TS val 4294715381 ecr 4294715352], length 164
11:40:11.774439 IP vagrant-ubuntu-trusty-64.8882 > 10.0.0.2.60172: Flags [.], ack 499459790, win 289, options [nop,nop,TS val 4294715391 ecr 4294715381], length 0
11:40:11.795129 IP 10.0.0.2.60172 > vagrant-ubuntu-trusty-64.8882: Flags [P.], seq 499459790:499459954, ack 2113429343, win 58, options [nop,nop,TS val 4294715402 ecr 4294715391], length 164
11:40:11.795146 IP vagrant-ubuntu-trusty-64.8882 > 10.0.0.2.60172: Flags [.], ack 499459954, win 292, options [nop,nop,TS val 4294715412 ecr 4294715402], length 0
11:40:11.814483 IP 10.0.0.2.60172 > vagrant-ubuntu-trusty-64.8882: Flags [P.], seq 499459954:499460118, ack 2113429343, win 58, options [nop,nop,TS val 4294715421 ecr 4294715391], length 164
11:40:11.814525 IP vagrant-ubuntu-trusty-64.8882 > 10.0.0.2.60172: Flags [.], ack 499460118, win 294, options [nop,nop,TS val 4294715431 ecr 4294715421], length 0
