11:03:54.177267 IP 10.0.0.2.55980 > 10.0.0.1.8882: Flags [P.], seq 1834329987:1834330151, ack 524811720, win 58, options [nop,nop,TS val 4294723425 ecr 4294723396], length 164
11:03:54.177324 IP 10.0.0.1.8882 > 10.0.0.2.55980: Flags [.], ack 1834330151, win 82, options [nop,nop,TS val 4294723435 ecr 4294723425], length 0
11:03:54.198230 IP 10.0.0.2.55980 > 10.0.0.1.8882: Flags [P.], seq 1834330151:1834330315, ack 524811720, win 58, options [nop,nop,TS val 4294723446 ecr 4294723415], length 164
11:03:54.198274 IP 10.0.0.1.8882 > 10.0.0.2.55980: Flags [.], ack 1834330315, win 84, options [nop,nop,TS val 4294723456 ecr 4294723446], length 0
11:03:54.217781 IP 10.0.0.2.55980 > 10.0.0.1.8882: Flags [P.], seq 1834330315:1834330479, ack 524811720, win 58, options [nop,nop,TS val 4294723465 ecr 4294723435], length 164
11:03:54.217816 IP 10.0.0.1.8882 > 10.0.0.2.55980: Flags [.], ack 1834330479, win 86, options [nop,nop,TS val 4294723476 ecr 4294723465], length 0
11:03:54.237420 IP 10.0.0.2.55980 > 10.0.0.1.8882: Flags [P.], seq 1834330479:1834330643, ack 524811720, win 58, options [nop,nop,TS val 4294723485 ecr 4294723456], length 164
11:03:54.237446 IP 10.0.0.1.8882 > 10.0.0.2.55980: Flags [.], ack 1834330643, win 88, options [nop,nop,TS val 4294723495 ecr 4294723485], length 0
11:03:54.257560 IP 10.0.0.2.55980 > 10.0.0.1.8882: Flags [P.], seq 1834330643:1834330807, ack 524811720, win 58, options [nop,nop,TS val 4294723505 ecr 4294723476], length 164
11:03:54.257943 IP 10.0.0.1.8882 > 10.0.0.2.55980: Flags [.], ack 1834330807, win 91, options [nop,nop,TS val 4294723515 ecr 4294723505], length 0
11:03:54.278440 IP 10.0.0.2.55980 > 10.0.0.1.8882: Flags [P.], seq 1834330807:1834330971, ack 524811720, win 58, options [nop,nop,TS val 4294723525 ecr 4294723495], length 164
11:03:54.278468 IP 10.0.0.1.8882 > 10.0.0.2.55980: Flags [.], ack 1834330971, win 93, options [nop,nop,TS val 4294723536 ecr 4294723525], length 0
11:03:54.297538 IP 10.0.0.2.55980 > 10.0.0.1.8882: Flags [P.], seq 1834330971:1834331135, ack 524811720, win 58, options [nop,nop,TS val 4294723545 ecr 4294723515], length 164
11:03:54.297593 IP 10.0.0.1.8882 > 10.0.0.2.55980: Flags [.], ack 1834331135, win 95, options [nop,nop,TS val 4294723555 ecr 4294723545], length 0
11:03:54.318039 IP 10.0.0.2.55980 > 10.0.0.1.8882: Flags [P.], seq 1834331135:1834331299, ack 524811720, win 58, options [nop,nop,TS val 4294723565 ecr 4294723536], length 164
11:03:54.318081 IP 10.0.0.1.8882 > 10.0.0.2.55980: Flags [.], ack 1834331299, win 97, options [nop,nop,TS val 4294723576 ecr 4294723565], length 0
11:03:54.337815 IP 10.0.0.2.55980 > 10.0.0.1.8882: Flags [P.], seq 1834331299:1834331463, ack 524811720, win 58, options [nop,nop,TS val 4294723586 ecr 4294723555], length 164
11:03:54.337851 IP 10.0.0.1.8882 > 10.0.0.2.55980: Flags [.], ack 1834331463, win 99, options [nop,nop,TS val 4294723596 ecr 4294723586], length 0
11:03:54.358011 IP 10.0.0.2.55980 > 10.0.0.1.8882: Flags [P.], seq 1834331463:1834331627, ack 524811720, win 58, options [nop,nop,TS val 4294723606 ecr 4294723576], length 164
11:03:54.358061 IP 10.0.0.1.8882 > 10.0.0.2.55980: Flags [.], ack 1834331627, win 101, options [nop,nop,TS val 4294723616 ecr 4294723606], length 0
11:03:54.377589 IP 10.0.0.2.55980 > 10.0.0.1.8882: Flags [P.], seq 1834331627:1834331791, ack 524811720, win 58, options [nop,nop,TS val 4294723625 ecr 4294723596], length 164
11:03:54.377658 IP 10.0.0.1.8882 > 10.0.0.2.55980: Flags [.], ack 1834331791, win 103, options [nop,nop,TS val 4294723636 ecr 4294723625], length 0
11:03:54.397432 IP 10.0.0.2.55980 > 10.0.0.1.8882: Flags [P.], seq 1834331791:1834331955, ack 524811720, win 58, options [nop,nop,TS val 4294723645 ecr 4294723616], length 164
11:03:54.397468 IP 10.0.0.1.8882 > 10.0.0.2.55980: Flags [.], ack 1834331955, win 105, options [nop,nop,TS val 4294723655 ecr 4294723645], length 0
11:03:54.417410 IP 10.0.0.2.55980 > 10.0.0.1.8882: Flags [P.], seq 1834331955:1834332119, ack 524811720, win 58, options [nop,nop,TS val 4294723665 ecr 4294723636], length 164
11:03:54.417466 IP 10.0.0.1.8882 > 10.0.0.2.55980: Flags [.], ack 1834332119, win 107, options [nop,nop,TS val 4294723675 ecr 4294723665], length 0
11:03:54.438540 IP 10.0.0.2.55980 > 10.0.0.1.8882: Flags [P.], seq 1834332119:1834332283, ack 524811720, win 58, options [nop,nop,TS val 4294723686 ecr 4294723675], length 164
11:03:54.438633 IP 10.0.0.1.8882 > 10.0.0.2.55980: Flags [.], ack 1834332283, win 109, options [nop,nop,TS val 4294723696 ecr 4294723686], length 0
11:03:54.457566 IP 10.0.0.2.55980 > 10.0.0.1.8882: Flags [P.], seq 1834332283:1834332447, ack 524811720, win 58, options [nop,nop,TS val 4294723705 ecr 4294723675], length 164
11:03:54.457665 IP 10.0.0.1.8882 > 10.0.0.2.55980: Flags [.], ack 1834332447, win 111, options [nop,nop,TS val 4294723716 ecr 4294723705], length 0
11:03:54.477577 IP 10.0.0.2.55980 > 10.0.0.1.8882: Flags [P.], seq 1834332447:1834332611, ack 524811720, win 58, options [nop,nop,TS val 4294723725 ecr 4294723696], length 164
11:03:54.477672 IP 10.0.0.1.8882 > 10.0.0.2.55980: Flags [.], ack 1834332611, win 114, options [nop,nop,TS val 4294723736 ecr 4294723725], length 0
11:03:54.497751 IP 10.0.0.2.55980 > 10.0.0.1.8882: Flags [P.], seq 1834332611:1834332775, ack 524811720, win 58, options [nop,nop,TS val 4294723745 ecr 4294723716], length 164
11:03:54.497844 IP 10.0.0.1.8882 > 10.0.0.2.55980: Flags [.], ack 1834332775, win 116, options [nop,nop,TS val 4294723756 ecr 4294723745], length 0
11:03:54.518374 IP 10.0.0.2.55980 > 10.0.0.1.8882: Flags [P.], seq 1834332775:1834332939, ack 524811720, win 58, options [nop,nop,TS val 4294723766 ecr 4294723736], length 164
11:03:54.518399 IP 10.0.0.1.8882 > 10.0.0.2.55980: Flags [.], ack 1834332939, win 118, options [nop,nop,TS val 4294723776 ecr 4294723766], length 0
11:03:54.538237 IP 10.0.0.2.55980 > 10.0.0.1.8882: Flags [P.], seq 1834332939:1834333103, ack 524811720, win 58, options [nop,nop,TS val 4294723786 ecr 4294723756], length 164
11:03:54.538299 IP 10.0.0.1.8882 > 10.0.0.2.55980: Flags [.], ack 1834333103, win 120, options [nop,nop,TS val 4294723796 ecr 4294723786], length 0
11:03:54.557723 IP 10.0.0.2.55980 > 10.0.0.1.8882: Flags [P.], seq 1834333103:1834333267, ack 524811720, win 58, options [nop,nop,TS val 4294723805 ecr 4294723776], length 164
11:03:54.557744 IP 10.0.0.1.8882 > 10.0.0.2.55980: Flags [.], ack 1834333267, win 122, options [nop,nop,TS val 4294723816 ecr 4294723805], length 0
11:03:54.577927 IP 10.0.0.2.55980 > 10.0.0.1.8882: Flags [P.], seq 1834333267:1834333431, ack 524811720, win 58, options [nop,nop,TS val 4294723826 ecr 4294723796], length 164
11:03:54.577951 IP 10.0.0.1.8882 > 10.0.0.2.55980: Flags [.], ack 1834333431, win 124, options [nop,nop,TS val 4294723836 ecr 4294723826], length 0
11:03:54.597656 IP 10.0.0.2.55980 > 10.0.0.1.8882: Flags [P.], seq 1834333431:1834333595, ack 524811720, win 58, options [nop,nop,TS val 4294723845 ecr 4294723816], length 164
11:03:54.597923 IP 10.0.0.1.8882 > 10.0.0.2.55980: Flags [.], ack 1834333595, win 126, options [nop,nop,TS val 4294723856 ecr 4294723845], length 0
11:03:54.617525 IP 10.0.0.2.55980 > 10.0.0.1.8882: Flags [P.], seq 1834333595:1834333759, ack 524811720, win 58, options [nop,nop,TS val 4294723865 ecr 4294723836], length 164
11:03:54.618242 IP 10.0.0.1.8882 > 10.0.0.2.55980: Flags [.], ack 1834333759, win 128, options [nop,nop,TS val 4294723876 ecr 4294723865], length 0
11:03:54.637723 IP 10.0.0.2.55980 > 10.0.0.1.8882: Flags [P.], seq 1834333759:1834333923, ack 524811720, win 58, options [nop,nop,TS val 4294723885 ecr 4294723856], length 164
11:03:54.637772 IP 10.0.0.1.8882 > 10.0.0.2.55980: Flags [.], ack 1834333923, win 130, options [nop,nop,TS val 4294723896 ecr 4294723885], length 0
11:03:54.657464 IP 10.0.0.2.55980 > 10.0.0.1.8882: Flags [P.], seq 1834333923:1834334087, ack 524811720, win 58, options [nop,nop,TS val 4294723905 ecr 4294723876], length 164
11:03:54.657488 IP 10.0.0.1.8882 > 10.0.0.2.55980: Flags [.], ack 1834334087, win 132, options [nop,nop,TS val 4294723915 ecr 4294723905], length 0
11:03:54.677555 IP 10.0.0.2.55980 > 10.0.0.1.8882: Flags [P.], seq 1834334087:1834334251, ack 524811720, win 58, options [nop,nop,TS val 4294723925 ecr 4294723896], length 164
11:03:54.677613 IP 10.0.0.1.8882 > 10.0.0.2.55980: Flags [.], ack 1834334251, win 135, options [nop,nop,TS val 4294723935 ecr 4294723925], length 0
11:03:54.697356 IP 10.0.0.2.55980 > 10.0.0.1.8882: Flags [P.], seq 1834334251:1834334415, ack 524811720, win 58, options [nop,nop,TS val 4294723945 ecr 4294723915], length 164
11:03:54.697394 IP 10.0.0.1.8882 > 10.0.0.2.55980: Flags [.], ack 1834334415, win 137, options [nop,nop,TS val 4294723955 ecr 4294723945], length 0
11:03:54.717739 IP 10.0.0.2.55980 > 10.0.0.1.8882: Flags [P.], seq 1834334415:1834334579, ack 524811720, win 58, options [nop,nop,TS val 4294723965 ecr 4294723935], length 164
11:03:54.717988 IP 10.0.0.1.8882 > 10.0.0.2.55980: Flags [.], ack 1834334579, win 139, options [nop,nop,TS val 4294723976 ecr 4294723965], length 0
11:03:54.737330 IP 10.0.0.2.55980 > 10.0.0.1.8882: Flags [P.], seq 1834334579:1834334743, ack 524811720, win 58, options [nop,nop,TS val 4294723985 ecr 4294723955], length 164
11:03:54.737378 IP 10.0.0.1.8882 > 10.0.0.2.55980: Flags [.], ack 1834334743, win 141, options [nop,nop,TS val 4294723995 ecr 4294723985], length 0
11:03:54.758063 IP 10.0.0.2.55980 > 10.0.0.1.8882: Flags [P.], seq 1834334743:1834334907, ack 524811720, win 58, options [nop,nop,TS val 4294724006 ecr 4294723976], length 164
11:03:54.758113 IP 10.0.0.1.8882 > 10.0.0.2.55980: Flags [.], ack 1834334907, win 143, options [nop,nop,TS val 4294724016 ecr 4294724006], length 0
11:03:54.777351 IP 10.0.0.2.55980 > 10.0.0.1.8882: Flags [P.], seq 1834334907:1834335071, ack 524811720, win 58, options [nop,nop,TS val 4294724025 ecr 4294723995], length 164
11:03:54.777516 IP 10.0.0.1.8882 > 10.0.0.2.55980: Flags [.], ack 1834335071, win 145, options [nop,nop,TS val 4294724035 ecr 4294724025], length 0
11:03:54.797525 IP 10.0.0.2.55980 > 10.0.0.1.8882: Flags [P.], seq 1834335071:1834335235, ack 524811720, win 58, options [nop,nop,TS val 4294724045 ecr 4294724016], length 164
11:03:54.797624 IP 10.0.0.1.8882 > 10.0.0.2.55980: Flags [.], ack 1834335235, win 147, options [nop,nop,TS val 4294724055 ecr 4294724045], length 0
11:03:54.818046 IP 10.0.0.2.55980 > 10.0.0.1.8882: Flags [P.], seq 1834335235:1834335399, ack 524811720, win 58, options [nop,nop,TS val 4294724065 ecr 4294724035], length 164
11:03:54.818544 IP 10.0.0.1.8882 > 10.0.0.2.55980: Flags [.], ack 1834335399, win 149, options [nop,nop,TS val 4294724076 ecr 4294724065], length 0
11:03:54.837711 IP 10.0.0.2.55980 > 10.0.0.1.8882: Flags [P.], seq 1834335399:1834335563, ack 524811720, win 58, options [nop,nop,TS val 4294724085 ecr 4294724055], length 164
11:03:54.837783 IP 10.0.0.1.8882 > 10.0.0.2.55980: Flags [.], ack 1834335563, win 151, options [nop,nop,TS val 4294724096 ecr 4294724085], length 0
11:03:54.857565 IP 10.0.0.2.55980 > 10.0.0.1.8882: Flags [P.], seq 1834335563:1834335727, ack 524811720, win 58, options [nop,nop,TS val 4294724105 ecr 4294724076], length 164
11:03:54.857635 IP 10.0.0.1.8882 > 10.0.0.2.55980: Flags [.], ack 1834335727, win 153, options [nop,nop,TS val 4294724115 ecr 4294724105], length 0
11:03:54.877478 IP 10.0.0.2.55980 > 10.0.0.1.8882: Flags [P.], seq 1834335727:1834335891, ack 524811720, win 58, options [nop,nop,TS val 4294724125 ecr 4294724096], length 164
11:03:54.877513 IP 10.0.0.1.8882 > 10.0.0.2.55980: Flags [.], ack 1834335891, win 155, options [nop,nop,TS val 4294724135 ecr 4294724125], length 0
11:03:54.897617 IP 10.0.0.2.55980 > 10.0.0.1.8882: Flags [P.], seq 1834335891:1834336055, ack 524811720, win 58, options [nop,nop,TS val 4294724145 ecr 4294724115], length 164
11:03:54.897667 IP 10.0.0.1.8882 > 10.0.0.2.55980: Flags [.], ack 1834336055, win 158, options [nop,nop,TS val 4294724156 ecr 4294724145], length 0
11:03:54.917609 IP 10.0.0.2.55980 > 10.0.0.1.8882: Flags [P.], seq 1834336055:1834336219, ack 524811720, win 58, options [nop,nop,TS val 4294724165 ecr 4294724135], length 164
11:03:54.917922 IP 10.0.0.1.8882 > 10.0.0.2.55980: Flags [.], ack 1834336219, win 160, options [nop,nop,TS val 4294724176 ecr 4294724165], length 0
11:03:54.937305 IP 10.0.0.2.55980 > 10.0.0.1.8882: Flags [P.], seq 1834336219:1834336383, ack 524811720, win 58, options [nop,nop,TS val 4294724185 ecr 4294724156], length 164
11:03:54.937385 IP 10.0.0.1.8882 > 10.0.0.2.55980: Flags [.], ack 1834336383, win 162, options [nop,nop,TS val 4294724195 ecr 4294724185], length 0
11:03:54.957377 IP 10.0.0.2.55980 > 10.0.0.1.8882: Flags [P.], seq 1834336383:1834336547, ack 524811720, win 58, options [nop,nop,TS val 4294724205 ecr 4294724176], length 164
11:03:54.957410 IP 10.0.0.1.8882 > 10.0.0.2.55980: Flags [.], ack 1834336547, win 164, options [nop,nop,TS val 4294724215 ecr 4294724205], length 0
11:03:54.977484 IP 10.0.0.2.55980 > 10.0.0.1.8882: Flags [P.], seq 1834336547:1834336711, ack 524811720, win 58, options [nop,nop,TS val 4294724225 ecr 4294724195], length 164
11:03:54.977513 IP 10.0.0.1.8882 > 10.0.0.2.55980: Flags [.], ack 1834336711, win 166, options [nop,nop,TS val 4294724235 ecr 4294724225], length 0
11:03:54.997391 IP 10.0.0.2.55980 > 10.0.0.1.8882: Flags [P.], seq 1834336711:1834336875, ack 524811720, win 58, options [nop,nop,TS val 4294724245 ecr 4294724215], length 164
11:03:54.997489 IP 10.0.0.1.8882 > 10.0.0.2.55980: Flags [.], ack 1834336875, win 168, options [nop,nop,TS val 4294724255 ecr 4294724245], length 0
11:03:55.017788 IP 10.0.0.2.55980 > 10.0.0.1.8882: Flags [P.], seq 1834336875:1834337039, ack 524811720, win 58, options [nop,nop,TS val 4294724265 ecr 4294724235], length 164
11:03:55.017871 IP 10.0.0.1.8882 > 10.0.0.2.55980: Flags [.], ack 1834337039, win 170, options [nop,nop,TS val 4294724276 ecr 4294724265], length 0
11:03:55.037357 IP 10.0.0.2.55980 > 10.0.0.1.8882: Flags [P.], seq 1834337039:1834337203, ack 524811720, win 58, options [nop,nop,TS val 4294724285 ecr 4294724255], length 164
11:03:55.037452 IP 10.0.0.1.8882 > 10.0.0.2.55980: Flags [.], ack 1834337203, win 172, options [nop,nop,TS val 4294724295 ecr 4294724285], length 0
11:03:55.057528 IP 10.0.0.2.55980 > 10.0.0.1.8882: Flags [P.], seq 1834337203:1834337367, ack 524811720, win 58, options [nop,nop,TS val 4294724305 ecr 4294724276], length 164
11:03:55.057609 IP 10.0.0.1.8882 > 10.0.0.2.55980: Flags [.], ack 1834337367, win 174, options [nop,nop,TS val 4294724315 ecr 4294724305], length 0
11:03:55.077609 IP 10.0.0.2.55980 > 10.0.0.1.8882: Flags [P.], seq 1834337367:1834337531, ack 524811720, win 58, options [nop,nop,TS val 4294724325 ecr 4294724295], length 164
11:03:55.077627 IP 10.0.0.1.8882 > 10.0.0.2.55980: Flags [.], ack 1834337531, win 176, options [nop,nop,TS val 4294724335 ecr 4294724325], length 0
11:03:55.099788 IP 10.0.0.2.55980 > 10.0.0.1.8882: Flags [P.], seq 1834337531:1834337695, ack 524811720, win 58, options [nop,nop,TS val 4294724346 ecr 4294724335], length 164
11:03:55.099827 IP 10.0.0.1.8882 > 10.0.0.2.55980: Flags [.], ack 1834337695, win 178, options [nop,nop,TS val 4294724358 ecr 4294724346], length 0
11:03:55.117532 IP 10.0.0.2.55980 > 10.0.0.1.8882: Flags [P.], seq 1834337695:1834337859, ack 524811720, win 58, options [nop,nop,TS val 4294724365 ecr 4294724335], length 164
11:03:55.117644 IP 10.0.0.1.8882 > 10.0.0.2.55980: Flags [.], ack 1834337859, win 181, options [nop,nop,TS val 4294724375 ecr 4294724365], length 0
11:03:55.137845 IP 10.0.0.2.55980 > 10.0.0.1.8882: Flags [P.], seq 1834337859:1834338023, ack 524811720, win 58, options [nop,nop,TS val 4294724386 ecr 4294724358], length 164
11:03:55.137906 IP 10.0.0.1.8882 > 10.0.0.2.55980: Flags [.], ack 1834338023, win 183, options [nop,nop,TS val 4294724396 ecr 4294724386], length 0
11:03:55.157746 IP 10.0.0.2.55980 > 10.0.0.1.8882: Flags [P.], seq 1834338023:1834338187, ack 524811720, win 58, options [nop,nop,TS val 4294724405 ecr 4294724375], length 164
11:03:55.157808 IP 10.0.0.1.8882 > 10.0.0.2.55980: Flags [.], ack 1834338187, win 185, options [nop,nop,TS val 4294724416 ecr 4294724405], length 0
11:03:55.177246 IP 10.0.0.2.55980 > 10.0.0.1.8882: Flags [P.], seq 1834338187:1834338351, ack 524811720, win 58, options [nop,nop,TS val 4294724425 ecr 4294724396], length 164
11:03:55.177355 IP 10.0.0.1.8882 > 10.0.0.2.55980: Flags [.], ack 1834338351, win 187, options [nop,nop,TS val 4294724435 ecr 4294724425], length 0
11:03:55.198217 IP 10.0.0.2.55980 > 10.0.0.1.8882: Flags [P.], seq 1834338351:1834338515, ack 524811720, win 58, options [nop,nop,TS val 4294724446 ecr 4294724416], length 164
11:03:55.198244 IP 10.0.0.1.8882 > 10.0.0.2.55980: Flags [.], ack 1834338515, win 189, options [nop,nop,TS val 4294724456 ecr 4294724446], length 0
11:03:55.217473 IP 10.0.0.2.55980 > 10.0.0.1.8882: Flags [P.], seq 1834338515:1834338679, ack 524811720, win 58, options [nop,nop,TS val 4294724465 ecr 4294724435], length 164
11:03:55.217534 IP 10.0.0.1.8882 > 10.0.0.2.55980: Flags [.], ack 1834338679, win 191, options [nop,nop,TS val 4294724475 ecr 4294724465], length 0
11:03:55.237507 IP 10.0.0.2.55980 > 10.0.0.1.8882: Flags [P.], seq 1834338679:1834338843, ack 524811720, win 58, options [nop,nop,TS val 4294724485 ecr 4294724456], length 164
11:03:55.237546 IP 10.0.0.1.8882 > 10.0.0.2.55980: Flags [.], ack 1834338843, win 193, options [nop,nop,TS val 4294724495 ecr 4294724485], length 0
11:03:55.257686 IP 10.0.0.2.55980 > 10.0.0.1.8882: Flags [P.], seq 1834338843:1834339007, ack 524811720, win 58, options [nop,nop,TS val 4294724505 ecr 4294724475], length 164
11:03:55.257713 IP 10.0.0.1.8882 > 10.0.0.2.55980: Flags [.], ack 1834339007, win 195, options [nop,nop,TS val 4294724516 ecr 4294724505], length 0
11:03:55.277214 IP 10.0.0.2.55980 > 10.0.0.1.8882: Flags [P.], seq 1834339007:1834339171, ack 524811720, win 58, options [nop,nop,TS val 4294724525 ecr 4294724495], length 164
11:03:55.277241 IP 10.0.0.1.8882 > 10.0.0.2.55980: Flags [.], ack 1834339171, win 197, options [nop,nop,TS val 4294724535 ecr 4294724525], length 0
11:03:55.298142 IP 10.0.0.2.55980 > 10.0.0.1.8882: Flags [P.], seq 1834339171:1834339335, ack 524811720, win 58, options [nop,nop,TS val 4294724546 ecr 4294724516], length 164
11:03:55.298166 IP 10.0.0.1.8882 > 10.0.0.2.55980: Flags [.], ack 1834339335, win 199, options [nop,nop,TS val 4294724556 ecr 4294724546], length 0
11:03:55.318452 IP 10.0.0.2.55980 > 10.0.0.1.8882: Flags [P.], seq 1834339335:1834339499, ack 524811720, win 58, options [nop,nop,TS val 4294724566 ecr 4294724535], length 164
11:03:55.318503 IP 10.0.0.1.8882 > 10.0.0.2.55980: Flags [.], ack 1834339499, win 202, options [nop,nop,TS val 4294724576 ecr 4294724566], length 0
11:03:55.338001 IP 10.0.0.2.55980 > 10.0.0.1.8882: Flags [P.], seq 1834339499:1834339663, ack 524811720, win 58, options [nop,nop,TS val 4294724585 ecr 4294724556], length 164
11:03:55.338045 IP 10.0.0.1.8882 > 10.0.0.2.55980: Flags [.], ack 1834339663, win 204, options [nop,nop,TS val 4294724596 ecr 4294724585], length 0
11:03:55.359226 IP 10.0.0.2.55980 > 10.0.0.1.8882: Flags [P.], seq 1834339663:1834339827, ack 524811720, win 58, options [nop,nop,TS val 4294724606 ecr 4294724596], length 164
11:03:55.359276 IP 10.0.0.1.8882 > 10.0.0.2.55980: Flags [.], ack 1834339827, win 206, options [nop,nop,TS val 4294724617 ecr 4294724606], length 0
11:03:55.377894 IP 10.0.0.2.55980 > 10.0.0.1.8882: Flags [P.], seq 1834339827:1834339991, ack 524811720, win 58, options [nop,nop,TS val 4294724626 ecr 4294724596], length 164
11:03:55.377940 IP 10.0.0.1.8882 > 10.0.0.2.55980: Flags [.], ack 1834339991, win 208, options [nop,nop,TS val 4294724636 ecr 4294724626], length 0
11:03:55.397353 IP 10.0.0.2.55980 > 10.0.0.1.8882: Flags [P.], seq 1834339991:1834340155, ack 524811720, win 58, options [nop,nop,TS val 4294724645 ecr 4294724617], length 164
11:03:55.397378 IP 10.0.0.1.8882 > 10.0.0.2.55980: Flags [.], ack 1834340155, win 210, options [nop,nop,TS val 4294724655 ecr 4294724645], length 0
11:03:55.418322 IP 10.0.0.2.55980 > 10.0.0.1.8882: Flags [P.], seq 1834340155:1834340319, ack 524811720, win 58, options [nop,nop,TS val 4294724666 ecr 4294724636], length 164
11:03:55.418369 IP 10.0.0.1.8882 > 10.0.0.2.55980: Flags [.], ack 1834340319, win 212, options [nop,nop,TS val 4294724676 ecr 4294724666], length 0
11:03:55.437398 IP 10.0.0.2.55980 > 10.0.0.1.8882: Flags [P.], seq 1834340319:1834340483, ack 524811720, win 58, options [nop,nop,TS val 4294724685 ecr 4294724655], length 164
11:03:55.437431 IP 10.0.0.1.8882 > 10.0.0.2.55980: Flags [.], ack 1834340483, win 214, options [nop,nop,TS val 4294724695 ecr 4294724685], length 0
11:03:55.457879 IP 10.0.0.2.55980 > 10.0.0.1.8882: Flags [P.], seq 1834340483:1834340647, ack 524811720, win 58, options [nop,nop,TS val 4294724705 ecr 4294724676], length 164
11:03:55.458008 IP 10.0.0.1.8882 > 10.0.0.2.55980: Flags [.], ack 1834340647, win 216, options [nop,nop,TS val 4294724716 ecr 4294724705], length 0
11:03:55.477461 IP 10.0.0.2.55980 > 10.0.0.1.8882: Flags [P.], seq 1834340647:1834340811, ack 524811720, win 58, options [nop,nop,TS val 4294724725 ecr 4294724695], length 164
11:03:55.477736 IP 10.0.0.1.8882 > 10.0.0.2.55980: Flags [.], ack 1834340811, win 218, options [nop,nop,TS val 4294724736 ecr 4294724725], length 0
11:03:55.497710 IP 10.0.0.2.55980 > 10.0.0.1.8882: Flags [P.], seq 1834340811:1834340975, ack 524811720, win 58, options [nop,nop,TS val 4294724745 ecr 4294724716], length 164
11:03:55.498014 IP 10.0.0.1.8882 > 10.0.0.2.55980: Flags [.], ack 1834340975, win 220, options [nop,nop,TS val 4294724756 ecr 4294724745], length 0
11:03:55.518149 IP 10.0.0.2.55980 > 10.0.0.1.8882: Flags [P.], seq 1834340975:1834341139, ack 524811720, win 58, options [nop,nop,TS val 4294724766 ecr 4294724736], length 164
11:03:55.518250 IP 10.0.0.1.8882 > 10.0.0.2.55980: Flags [.], ack 1834341139, win 222, options [nop,nop,TS val 4294724776 ecr 4294724766], length 0
11:03:55.555424 IP 10.0.0.2.55980 > 10.0.0.1.8882: Flags [P.], seq 1834341139:1834341303, ack 524811720, win 58, options [nop,nop,TS val 4294724785 ecr 4294724756], length 164
11:03:55.555613 IP 10.0.0.1.8882 > 10.0.0.2.55980: Flags [.], ack 1834341303, win 225, options [nop,nop,TS val 4294724813 ecr 4294724785], length 0
11:03:55.591292 IP 10.0.0.2.55980 > 10.0.0.1.8882: Flags [P.], seq 1834341303:1834341467, ack 524811720, win 58, options [nop,nop,TS val 4294724805 ecr 4294724776], length 164
11:03:55.591402 IP 10.0.0.1.8882 > 10.0.0.2.55980: Flags [.], ack 1834341467, win 227, options [nop,nop,TS val 4294724849 ecr 4294724805], length 0
11:03:55.606786 IP 10.0.0.2.55980 > 10.0.0.1.8882: Flags [P.], seq 1834341467:1834341631, ack 524811720, win 58, options [nop,nop,TS val 4294724825 ecr 4294724813], length 164
11:03:55.606921 IP 10.0.0.1.8882 > 10.0.0.2.55980: Flags [.], ack 1834341631, win 229, options [nop,nop,TS val 4294724865 ecr 4294724825], length 0
11:03:55.647314 IP 10.0.0.2.55980 > 10.0.0.1.8882: Flags [P.], seq 1834341795:1834341959, ack 524811720, win 58, options [nop,nop,TS val 4294724865 ecr 4294724849], length 164
11:03:55.647440 IP 10.0.0.1.8882 > 10.0.0.2.55980: Flags [.], ack 1834341631, win 231, options [nop,nop,TS val 4294724905 ecr 4294724825,nop,nop,sack 1 {1834341795:1834341959}], length 0
11:03:55.673863 IP 10.0.0.2.55980 > 10.0.0.1.8882: Flags [P.], seq 1834342123:1834342287, ack 524811720, win 58, options [nop,nop,TS val 4294724905 ecr 4294724865], length 164
11:03:55.673909 IP 10.0.0.1.8882 > 10.0.0.2.55980: Flags [.], ack 1834341631, win 233, options [nop,nop,TS val 4294724932 ecr 4294724825,nop,nop,sack 2 {1834342123:1834342287}{1834341795:1834341959}], length 0
11:03:55.708931 IP 10.0.0.2.55980 > 10.0.0.1.8882: Flags [P.], seq 1834341631:1834341795, ack 524811720, win 58, options [nop,nop,TS val 4294724943 ecr 4294724932], length 164
11:03:55.709061 IP 10.0.0.1.8882 > 10.0.0.2.55980: Flags [.], ack 1834341959, win 235, options [nop,nop,TS val 4294724967 ecr 4294724943,nop,nop,sack 1 {1834342123:1834342287}], length 0
11:03:55.709191 IP 10.0.0.2.55980 > 10.0.0.1.8882: Flags [P.], seq 1834341959:1834342123, ack 524811720, win 58, options [nop,nop,TS val 4294724943 ecr 4294724932], length 164
11:03:55.709253 IP 10.0.0.1.8882 > 10.0.0.2.55980: Flags [.], ack 1834342287, win 237, options [nop,nop,TS val 4294724967 ecr 4294724943], length 0
11:03:55.745273 IP 10.0.0.2.55980 > 10.0.0.1.8882: Flags [P.], seq 1834342451:1834342779, ack 524811720, win 58, options [nop,nop,TS val 4294724978 ecr 4294724967], length 328
11:03:55.745382 IP 10.0.0.1.8882 > 10.0.0.2.55980: Flags [.], ack 1834342287, win 239, options [nop,nop,TS val 4294725003 ecr 4294724943,nop,nop,sack 1 {1834342451:1834342779}], length 0
11:03:55.753409 IP 10.0.0.2.55980 > 10.0.0.1.8882: Flags [P.], seq 1834342779:1834342943, ack 524811720, win 58, options [nop,nop,TS val 4294724989 ecr 4294724967], length 164
11:03:55.753563 IP 10.0.0.1.8882 > 10.0.0.2.55980: Flags [.], ack 1834342287, win 241, options [nop,nop,TS val 4294725011 ecr 4294724943,nop,nop,sack 1 {1834342451:1834342943}], length 0
11:03:55.779707 IP 10.0.0.2.55980 > 10.0.0.1.8882: Flags [P.], seq 1834342287:1834342451, ack 524811720, win 58, options [nop,nop,TS val 4294725015 ecr 4294725003], length 164
11:03:55.779731 IP 10.0.0.1.8882 > 10.0.0.2.55980: Flags [.], ack 1834342943, win 243, options [nop,nop,TS val 4294725038 ecr 4294725015], length 0
11:03:55.786018 IP 10.0.0.2.55980 > 10.0.0.1.8882: Flags [P.], seq 1834343107:1834343271, ack 524811720, win 58, options [nop,nop,TS val 4294725025 ecr 4294725011], length 164
11:03:55.786046 IP 10.0.0.1.8882 > 10.0.0.2.55980: Flags [.], ack 1834342943, win 245, options [nop,nop,TS val 4294725044 ecr 4294725015,nop,nop,sack 1 {1834343107:1834343271}], length 0
11:03:55.802575 IP 10.0.0.2.55980 > 10.0.0.1.8882: Flags [P.], seq 1834343271:1834343435, ack 524811720, win 58, options [nop,nop,TS val 4294725045 ecr 4294725011], length 164
11:03:55.802618 IP 10.0.0.1.8882 > 10.0.0.2.55980: Flags [.], ack 1834342943, win 248, options [nop,nop,TS val 4294725060 ecr 4294725015,nop,nop,sack 1 {1834343107:1834343435}], length 0
11:03:55.814749 IP 10.0.0.2.55980 > 10.0.0.1.8882: Flags [P.], seq 1834342943:1834343107, ack 524811720, win 58, options [nop,nop,TS val 4294725063 ecr 4294725044], length 164
11:03:55.814824 IP 10.0.0.1.8882 > 10.0.0.2.55980: Flags [.], ack 1834343435, win 250, options [nop,nop,TS val 4294725073 ecr 4294725063], length 0
11:03:55.823847 IP 10.0.0.2.55980 > 10.0.0.1.8882: Flags [P.], seq 1834343435:1834343599, ack 524811720, win 58, options [nop,nop,TS val 4294725065 ecr 4294725044], length 164
11:03:55.824016 IP 10.0.0.1.8882 > 10.0.0.2.55980: Flags [.], ack 1834343599, win 252, options [nop,nop,TS val 4294725082 ecr 4294725065], length 0
11:03:55.847958 IP 10.0.0.2.55980 > 10.0.0.1.8882: Flags [P.], seq 1834343599:1834343763, ack 524811720, win 58, options [nop,nop,TS val 4294725085 ecr 4294725073], length 164
11:03:55.847984 IP 10.0.0.1.8882 > 10.0.0.2.55980: Flags [.], ack 1834343763, win 254, options [nop,nop,TS val 4294725106 ecr 4294725085], length 0
11:03:55.866442 IP 10.0.0.2.55980 > 10.0.0.1.8882: Flags [P.], seq 1834343763:1834343927, ack 524811720, win 58, options [nop,nop,TS val 4294725105 ecr 4294725082], length 164
11:03:55.866474 IP 10.0.0.1.8882 > 10.0.0.2.55980: Flags [.], ack 1834343927, win 256, options [nop,nop,TS val 4294725124 ecr 4294725105], length 0
11:03:55.891053 IP 10.0.0.2.55980 > 10.0.0.1.8882: Flags [P.], seq 1834343927:1834344091, ack 524811720, win 58, options [nop,nop,TS val 4294725126 ecr 4294725106], length 164
11:03:55.891134 IP 10.0.0.1.8882 > 10.0.0.2.55980: Flags [.], ack 1834344091, win 258, options [nop,nop,TS val 4294725149 ecr 4294725126], length 0
11:03:55.909500 IP 10.0.0.2.55980 > 10.0.0.1.8882: Flags [P.], seq 1834344091:1834344255, ack 524811720, win 58, options [nop,nop,TS val 4294725145 ecr 4294725124], length 164
11:03:55.909587 IP 10.0.0.1.8882 > 10.0.0.2.55980: Flags [.], ack 1834344255, win 260, options [nop,nop,TS val 4294725167 ecr 4294725145], length 0
11:03:55.930797 IP 10.0.0.2.55980 > 10.0.0.1.8882: Flags [P.], seq 1834344255:1834344419, ack 524811720, win 58, options [nop,nop,TS val 4294725165 ecr 4294725149], length 164
11:03:55.930838 IP 10.0.0.1.8882 > 10.0.0.2.55980: Flags [.], ack 1834344419, win 262, options [nop,nop,TS val 4294725189 ecr 4294725165], length 0
11:03:55.949146 IP 10.0.0.2.55980 > 10.0.0.1.8882: Flags [P.], seq 1834344419:1834344583, ack 524811720, win 58, options [nop,nop,TS val 4294725185 ecr 4294725167], length 164
11:03:55.949195 IP 10.0.0.1.8882 > 10.0.0.2.55980: Flags [.], ack 1834344583, win 264, options [nop,nop,TS val 4294725207 ecr 4294725185], length 0
11:03:55.970655 IP 10.0.0.2.55980 > 10.0.0.1.8882: Flags [P.], seq 1834344583:1834344747, ack 524811720, win 58, options [nop,nop,TS val 4294725205 ecr 4294725189], length 164
11:03:55.970788 IP 10.0.0.1.8882 > 10.0.0.2.55980: Flags [.], ack 1834344747, win 266, options [nop,nop,TS val 4294725229 ecr 4294725205], length 0
11:03:55.990297 IP 10.0.0.2.55980 > 10.0.0.1.8882: Flags [P.], seq 1834344747:1834344911, ack 524811720, win 58, options [nop,nop,TS val 4294725226 ecr 4294725207], length 164
11:03:55.990410 IP 10.0.0.1.8882 > 10.0.0.2.55980: Flags [.], ack 1834344911, win 269, options [nop,nop,TS val 4294725248 ecr 4294725226], length 0
11:03:56.010400 IP 10.0.0.2.55980 > 10.0.0.1.8882: Flags [P.], seq 1834344911:1834345075, ack 524811720, win 58, options [nop,nop,TS val 4294725245 ecr 4294725229], length 164
11:03:56.010432 IP 10.0.0.1.8882 > 10.0.0.2.55980: Flags [.], ack 1834345075, win 271, options [nop,nop,TS val 4294725268 ecr 4294725245], length 0
11:03:56.029192 IP 10.0.0.2.55980 > 10.0.0.1.8882: Flags [P.], seq 1834345075:1834345239, ack 524811720, win 58, options [nop,nop,TS val 4294725266 ecr 4294725248], length 164
11:03:56.029275 IP 10.0.0.1.8882 > 10.0.0.2.55980: Flags [.], ack 1834345239, win 273, options [nop,nop,TS val 4294725287 ecr 4294725266], length 0
11:03:56.047256 IP 10.0.0.2.55980 > 10.0.0.1.8882: Flags [P.], seq 1834345239:1834345403, ack 524811720, win 58, options [nop,nop,TS val 4294725285 ecr 4294725268], length 164
11:03:56.047291 IP 10.0.0.1.8882 > 10.0.0.2.55980: Flags [.], ack 1834345403, win 275, options [nop,nop,TS val 4294725305 ecr 4294725285], length 0
11:03:56.068520 IP 10.0.0.2.55980 > 10.0.0.1.8882: Flags [P.], seq 1834345403:1834345567, ack 524811720, win 58, options [nop,nop,TS val 4294725305 ecr 4294725287], length 164
11:03:56.068576 IP 10.0.0.1.8882 > 10.0.0.2.55980: Flags [.], ack 1834345567, win 277, options [nop,nop,TS val 4294725326 ecr 4294725305], length 0
11:03:56.090001 IP 10.0.0.2.55980 > 10.0.0.1.8882: Flags [P.], seq 1834345567:1834345731, ack 524811720, win 58, options [nop,nop,TS val 4294725325 ecr 4294725305], length 164
11:03:56.090041 IP 10.0.0.1.8882 > 10.0.0.2.55980: Flags [.], ack 1834345731, win 279, options [nop,nop,TS val 4294725348 ecr 4294725325], length 0
11:03:56.108309 IP 10.0.0.2.55980 > 10.0.0.1.8882: Flags [P.], seq 1834345731:1834345895, ack 524811720, win 58, options [nop,nop,TS val 4294725345 ecr 4294725326], length 164
11:03:56.108334 IP 10.0.0.1.8882 > 10.0.0.2.55980: Flags [.], ack 1834345895, win 281, options [nop,nop,TS val 4294725366 ecr 4294725345], length 0
11:03:56.129958 IP 10.0.0.2.55980 > 10.0.0.1.8882: Flags [P.], seq 1834345895:1834346059, ack 524811720, win 58, options [nop,nop,TS val 4294725365 ecr 4294725348], length 164
11:03:56.130039 IP 10.0.0.1.8882 > 10.0.0.2.55980: Flags [.], ack 1834346059, win 283, options [nop,nop,TS val 4294725388 ecr 4294725365], length 0
11:03:56.148689 IP 10.0.0.2.55980 > 10.0.0.1.8882: Flags [P.], seq 1834346059:1834346223, ack 524811720, win 58, options [nop,nop,TS val 4294725385 ecr 4294725366], length 164
11:03:56.148743 IP 10.0.0.1.8882 > 10.0.0.2.55980: Flags [.], ack 1834346223, win 285, options [nop,nop,TS val 4294725407 ecr 4294725385], length 0
11:03:56.169732 IP 10.0.0.2.55980 > 10.0.0.1.8882: Flags [P.], seq 1834346223:1834346387, ack 524811720, win 58, options [nop,nop,TS val 4294725405 ecr 4294725388], length 164
11:03:56.169766 IP 10.0.0.1.8882 > 10.0.0.2.55980: Flags [.], ack 1834346387, win 287, options [nop,nop,TS val 4294725428 ecr 4294725405], length 0
11:03:56.188475 IP 10.0.0.2.55980 > 10.0.0.1.8882: Flags [P.], seq 1834346387:1834346551, ack 524811720, win 58, options [nop,nop,TS val 4294725425 ecr 4294725407], length 164
11:03:56.188520 IP 10.0.0.1.8882 > 10.0.0.2.55980: Flags [.], ack 1834346551, win 289, options [nop,nop,TS val 4294725446 ecr 4294725425], length 0
11:03:56.209758 IP 10.0.0.2.55980 > 10.0.0.1.8882: Flags [P.], seq 1834346551:1834346715, ack 524811720, win 58, options [nop,nop,TS val 4294725445 ecr 4294725428], length 164
11:03:56.209805 IP 10.0.0.1.8882 > 10.0.0.2.55980: Flags [.], ack 1834346715, win 292, options [nop,nop,TS val 4294725468 ecr 4294725445], length 0
11:03:56.231303 IP 10.0.0.2.55980 > 10.0.0.1.8882: Flags [P.], seq 1834346715:1834346879, ack 524811720, win 58, options [nop,nop,TS val 4294725465 ecr 4294725446], length 164
11:03:56.231368 IP 10.0.0.1.8882 > 10.0.0.2.55980: Flags [.], ack 1834346879, win 294, options [nop,nop,TS val 4294725489 ecr 4294725465], length 0
11:03:56.252705 IP 10.0.0.2.55980 > 10.0.0.1.8882: Flags [P.], seq 1834346879:1834347043, ack 524811720, win 58, options [nop,nop,TS val 4294725485 ecr 4294725468], length 164
11:03:56.252763 IP 10.0.0.1.8882 > 10.0.0.2.55980: Flags [.], ack 1834347043, win 296, options [nop,nop,TS val 4294725511 ecr 4294725485], length 0
11:03:56.270948 IP 10.0.0.2.55980 > 10.0.0.1.8882: Flags [P.], seq 1834347043:1834347207, ack 524811720, win 58, options [nop,nop,TS val 4294725505 ecr 4294725489], length 164
11:03:56.270985 IP 10.0.0.1.8882 > 10.0.0.2.55980: Flags [.], ack 1834347207, win 298, options [nop,nop,TS val 4294725529 ecr 4294725505], length 0
11:03:56.292385 IP 10.0.0.2.55980 > 10.0.0.1.8882: Flags [P.], seq 1834347207:1834347371, ack 524811720, win 58, options [nop,nop,TS val 4294725525 ecr 4294725511], length 164
11:03:56.292426 IP 10.0.0.1.8882 > 10.0.0.2.55980: Flags [.], ack 1834347371, win 300, options [nop,nop,TS val 4294725550 ecr 4294725525], length 0
11:03:56.310759 IP 10.0.0.2.55980 > 10.0.0.1.8882: Flags [P.], seq 1834347371:1834347535, ack 524811720, win 58, options [nop,nop,TS val 4294725545 ecr 4294725529], length 164
11:03:56.310796 IP 10.0.0.1.8882 > 10.0.0.2.55980: Flags [.], ack 1834347535, win 302, options [nop,nop,TS val 4294725569 ecr 4294725545], length 0
11:03:56.332788 IP 10.0.0.2.55980 > 10.0.0.1.8882: Flags [P.], seq 1834347535:1834347699, ack 524811720, win 58, options [nop,nop,TS val 4294725565 ecr 4294725550], length 164
11:03:56.333180 IP 10.0.0.1.8882 > 10.0.0.2.55980: Flags [.], ack 1834347699, win 304, options [nop,nop,TS val 4294725591 ecr 4294725565], length 0
11:03:56.353723 IP 10.0.0.2.55980 > 10.0.0.1.8882: Flags [P.], seq 1834347699:1834347863, ack 524811720, win 58, options [nop,nop,TS val 4294725585 ecr 4294725569], length 164
11:03:56.353777 IP 10.0.0.1.8882 > 10.0.0.2.55980: Flags [.], ack 1834347863, win 306, options [nop,nop,TS val 4294725612 ecr 4294725585], length 0
11:03:56.372215 IP 10.0.0.2.55980 > 10.0.0.1.8882: Flags [P.], seq 1834347863:1834348027, ack 524811720, win 58, options [nop,nop,TS val 4294725605 ecr 4294725591], length 164
11:03:56.372269 IP 10.0.0.1.8882 > 10.0.0.2.55980: Flags [.], ack 1834348027, win 308, options [nop,nop,TS val 4294725630 ecr 4294725605], length 0
11:03:56.394139 IP 10.0.0.2.55980 > 10.0.0.1.8882: Flags [P.], seq 1834348027:1834348191, ack 524811720, win 58, options [nop,nop,TS val 4294725625 ecr 4294725612], length 164
11:03:56.394200 IP 10.0.0.1.8882 > 10.0.0.2.55980: Flags [.], ack 1834348191, win 310, options [nop,nop,TS val 4294725652 ecr 4294725625], length 0
11:03:56.412289 IP 10.0.0.2.55980 > 10.0.0.1.8882: Flags [P.], seq 1834348191:1834348355, ack 524811720, win 58, options [nop,nop,TS val 4294725645 ecr 4294725630], length 164
11:03:56.412326 IP 10.0.0.1.8882 > 10.0.0.2.55980: Flags [.], ack 1834348355, win 312, options [nop,nop,TS val 4294725670 ecr 4294725645], length 0
11:03:56.430774 IP 10.0.0.2.55980 > 10.0.0.1.8882: Flags [P.], seq 1834348355:1834348519, ack 524811720, win 58, options [nop,nop,TS val 4294725665 ecr 4294725652], length 164
11:03:56.430898 IP 10.0.0.1.8882 > 10.0.0.2.55980: Flags [.], ack 1834348519, win 315, options [nop,nop,TS val 4294725689 ecr 4294725665], length 0
11:03:56.452099 IP 10.0.0.2.55980 > 10.0.0.1.8882: Flags [P.], seq 1834348519:1834348683, ack 524811720, win 58, options [nop,nop,TS val 4294725685 ecr 4294725670], length 164
11:03:56.452143 IP 10.0.0.1.8882 > 10.0.0.2.55980: Flags [.], ack 1834348683, win 317, options [nop,nop,TS val 4294725710 ecr 4294725685], length 0
11:03:56.478105 IP 10.0.0.2.55980 > 10.0.0.1.8882: Flags [P.], seq 1834348683:1834348847, ack 524811720, win 58, options [nop,nop,TS val 4294725705 ecr 4294725689], length 164
11:03:56.478182 IP 10.0.0.1.8882 > 10.0.0.2.55980: Flags [.], ack 1834348847, win 319, options [nop,nop,TS val 4294725736 ecr 4294725705], length 0
11:03:56.495129 IP 10.0.0.2.55980 > 10.0.0.1.8882: Flags [P.], seq 1834348847:1834349011, ack 524811720, win 58, options [nop,nop,TS val 4294725725 ecr 4294725710], length 164
11:03:56.495189 IP 10.0.0.1.8882 > 10.0.0.2.55980: Flags [.], ack 1834349011, win 321, options [nop,nop,TS val 4294725753 ecr 4294725725], length 0
11:03:56.516848 IP 10.0.0.2.55980 > 10.0.0.1.8882: Flags [P.], seq 1834349011:1834349175, ack 524811720, win 58, options [nop,nop,TS val 4294725747 ecr 4294725710], length 164
11:03:56.516928 IP 10.0.0.1.8882 > 10.0.0.2.55980: Flags [.], ack 1834349175, win 323, options [nop,nop,TS val 4294725775 ecr 4294725747], length 0
11:03:56.535093 IP 10.0.0.2.55980 > 10.0.0.1.8882: Flags [P.], seq 1834349175:1834349339, ack 524811720, win 58, options [nop,nop,TS val 4294725765 ecr 4294725753], length 164
11:03:56.535150 IP 10.0.0.1.8882 > 10.0.0.2.55980: Flags [.], ack 1834349339, win 325, options [nop,nop,TS val 4294725793 ecr 4294725765], length 0
11:03:56.556640 IP 10.0.0.2.55980 > 10.0.0.1.8882: Flags [P.], seq 1834349339:1834349503, ack 524811720, win 58, options [nop,nop,TS val 4294725785 ecr 4294725753], length 164
11:03:56.556692 IP 10.0.0.1.8882 > 10.0.0.2.55980: Flags [.], ack 1834349503, win 327, options [nop,nop,TS val 4294725814 ecr 4294725785], length 0
11:03:56.574843 IP 10.0.0.2.55980 > 10.0.0.1.8882: Flags [P.], seq 1834349503:1834349667, ack 524811720, win 58, options [nop,nop,TS val 4294725805 ecr 4294725793], length 164
11:03:56.574875 IP 10.0.0.1.8882 > 10.0.0.2.55980: Flags [.], ack 1834349667, win 329, options [nop,nop,TS val 4294725833 ecr 4294725805], length 0
11:03:56.596365 IP 10.0.0.2.55980 > 10.0.0.1.8882: Flags [P.], seq 1834349667:1834349831, ack 524811720, win 58, options [nop,nop,TS val 4294725825 ecr 4294725814], length 164
11:03:56.596477 IP 10.0.0.1.8882 > 10.0.0.2.55980: Flags [.], ack 1834349831, win 331, options [nop,nop,TS val 4294725854 ecr 4294725825], length 0
11:03:56.614800 IP 10.0.0.2.55980 > 10.0.0.1.8882: Flags [P.], seq 1834349831:1834349995, ack 524811720, win 58, options [nop,nop,TS val 4294725845 ecr 4294725833], length 164
11:03:56.614902 IP 10.0.0.1.8882 > 10.0.0.2.55980: Flags [.], ack 1834349995, win 333, options [nop,nop,TS val 4294725873 ecr 4294725845], length 0
11:03:56.636204 IP 10.0.0.2.55980 > 10.0.0.1.8882: Flags [P.], seq 1834349995:1834350159, ack 524811720, win 58, options [nop,nop,TS val 4294725865 ecr 4294725854], length 164
11:03:56.636311 IP 10.0.0.1.8882 > 10.0.0.2.55980: Flags [.], ack 1834350159, win 336, options [nop,nop,TS val 4294725894 ecr 4294725865], length 0
11:03:56.654640 IP 10.0.0.2.55980 > 10.0.0.1.8882: Flags [P.], seq 1834350159:1834350323, ack 524811720, win 58, options [nop,nop,TS val 4294725885 ecr 4294725873], length 164
