12:19:18.697541 IP 10.0.0.2.47555 > vagrant-ubuntu-trusty-64.8882: Flags [P.], seq 386551188:386551352, ack 572292655, win 58, options [nop,nop,TS val 4294714297 ecr 4294714268], length 164
12:19:18.697586 IP vagrant-ubuntu-trusty-64.8882 > 10.0.0.2.47555: Flags [.], ack 386551352, win 63, options [nop,nop,TS val 4294714308 ecr 4294714297], length 0
12:19:18.718784 IP 10.0.0.2.47555 > vagrant-ubuntu-trusty-64.8882: Flags [P.], seq 386551352:386551516, ack 572292655, win 58, options [nop,nop,TS val 4294714318 ecr 4294714288], length 164
12:19:18.718828 IP vagrant-ubuntu-trusty-64.8882 > 10.0.0.2.47555: Flags [.], ack 386551516, win 65, options [nop,nop,TS val 4294714329 ecr 4294714318], length 0
12:19:18.737721 IP 10.0.0.2.47555 > vagrant-ubuntu-trusty-64.8882: Flags [P.], seq 386551516:386551680, ack 572292655, win 58, options [nop,nop,TS val 4294714338 ecr 4294714308], length 164
12:19:18.737745 IP vagrant-ubuntu-trusty-64.8882 > 10.0.0.2.47555: Flags [.], ack 386551680, win 68, options [nop,nop,TS val 4294714348 ecr 4294714338], length 0
12:19:18.757126 IP 10.0.0.2.47555 > vagrant-ubuntu-trusty-64.8882: Flags [P.], seq 386551680:386551844, ack 572292655, win 58, options [nop,nop,TS val 4294714357 ecr 4294714329], length 164
12:19:18.757148 IP vagrant-ubuntu-trusty-64.8882 > 10.0.0.2.47555: Flags [.], ack 386551844, win 70, options [nop,nop,TS val 4294714367 ecr 4294714357], length 0
12:19:18.778073 IP 10.0.0.2.47555 > vagrant-ubuntu-trusty-64.8882: Flags [P.], seq 386551844:386552008, ack 572292655, win 58, options [nop,nop,TS val 4294714378 ecr 4294714348], length 164
12:19:18.778086 IP vagrant-ubuntu-trusty-64.8882 > 10.0.0.2.47555: Flags [.], ack 386552008, win 72, options [nop,nop,TS val 4294714388 ecr 4294714378], length 0
12:19:18.797826 IP 10.0.0.2.47555 > vagrant-ubuntu-trusty-64.8882: Flags [P.], seq 386552008:386552172, ack 572292655, win 58, options [nop,nop,TS val 4294714398 ecr 4294714367], length 164
12:19:18.797865 IP vagrant-ubuntu-trusty-64.8882 > 10.0.0.2.47555: Flags [.], ack 386552172, win 74, options [nop,nop,TS val 4294714408 ecr 4294714398], length 0
12:19:18.817864 IP 10.0.0.2.47555 > vagrant-ubuntu-trusty-64.8882: Flags [P.], seq 386552172:386552336, ack 572292655, win 58, options [nop,nop,TS val 4294714417 ecr 4294714388], length 164
12:19:18.817926 IP vagrant-ubuntu-trusty-64.8882 > 10.0.0.2.47555: Flags [.], ack 386552336, win 76, options [nop,nop,TS val 4294714428 ecr 4294714417], length 0
12:19:18.851429 IP 10.0.0.2.47555 > vagrant-ubuntu-trusty-64.8882: Flags [P.], seq 386552336:386552500, ack 572292655, win 58, options [nop,nop,TS val 4294714437 ecr 4294714408], length 164
12:19:18.851508 IP vagrant-ubuntu-trusty-64.8882 > 10.0.0.2.47555: Flags [.], ack 386552500, win 78, options [nop,nop,TS val 4294714461 ecr 4294714437], length 0
12:19:18.908851 IP 10.0.0.2.47555 > vagrant-ubuntu-trusty-64.8882: Flags [P.], seq 386552664:386552828, ack 572292655, win 58, options [nop,nop,TS val 4294714477 ecr 4294714461], length 164
12:19:18.908930 IP vagrant-ubuntu-trusty-64.8882 > 10.0.0.2.47555: Flags [.], ack 386552500, win 80, options [nop,nop,TS val 4294714519 ecr 4294714437,nop,nop,sack 1 {386552664:386552828}], length 0
12:19:18.927683 IP 10.0.0.2.47555 > vagrant-ubuntu-trusty-64.8882: Flags [P.], seq 386552828:386552992, ack 572292655, win 58, options [nop,nop,TS val 4294714498 ecr 4294714461], length 164
12:19:18.927778 IP vagrant-ubuntu-trusty-64.8882 > 10.0.0.2.47555: Flags [.], ack 386552500, win 82, options [nop,nop,TS val 4294714538 ecr 4294714437,nop,nop,sack 1 {386552664:386552992}], length 0
12:19:18.951608 IP 10.0.0.2.47555 > vagrant-ubuntu-trusty-64.8882: Flags [P.], seq 386553156:386553320, ack 572292655, win 58, options [nop,nop,TS val 4294714538 ecr 4294714519], length 164
12:19:18.951650 IP vagrant-ubuntu-trusty-64.8882 > 10.0.0.2.47555: Flags [.], ack 386552500, win 84, options [nop,nop,TS val 4294714562 ecr 4294714437,nop,nop,sack 2 {386553156:386553320}{386552664:386552992}], length 0
12:19:18.970726 IP 10.0.0.2.47555 > vagrant-ubuntu-trusty-64.8882: Flags [P.], seq 386553320:386553484, ack 572292655, win 58, options [nop,nop,TS val 4294714558 ecr 4294714538], length 164
12:19:18.970836 IP vagrant-ubuntu-trusty-64.8882 > 10.0.0.2.47555: Flags [.], ack 386552500, win 86, options [nop,nop,TS val 4294714580 ecr 4294714437,nop,nop,sack 2 {386553156:386553484}{386552664:386552992}], length 0
12:19:18.986929 IP 10.0.0.2.47555 > vagrant-ubuntu-trusty-64.8882: Flags [P.], seq 386552500:386552664, ack 572292655, win 58, options [nop,nop,TS val 4294714572 ecr 4294714562], length 164
12:19:18.986987 IP vagrant-ubuntu-trusty-64.8882 > 10.0.0.2.47555: Flags [.], ack 386552992, win 88, options [nop,nop,TS val 4294714597 ecr 4294714572,nop,nop,sack 1 {386553156:386553484}], length 0
12:19:18.987030 IP 10.0.0.2.47555 > vagrant-ubuntu-trusty-64.8882: Flags [P.], seq 386552992:386553156, ack 572292655, win 58, options [nop,nop,TS val 4294714572 ecr 4294714562], length 164
12:19:18.987038 IP vagrant-ubuntu-trusty-64.8882 > 10.0.0.2.47555: Flags [.], ack 386553484, win 91, options [nop,nop,TS val 4294714597 ecr 4294714572], length 0
12:19:18.997824 IP 10.0.0.2.47555 > vagrant-ubuntu-trusty-64.8882: Flags [P.], seq 386553484:386553648, ack 572292655, win 58, options [nop,nop,TS val 4294714591 ecr 4294714580], length 164
12:19:18.997835 IP vagrant-ubuntu-trusty-64.8882 > 10.0.0.2.47555: Flags [.], ack 386553648, win 93, options [nop,nop,TS val 4294714608 ecr 4294714591], length 0
12:19:19.007759 IP 10.0.0.2.47555 > vagrant-ubuntu-trusty-64.8882: Flags [P.], seq 386553648:386553812, ack 572292655, win 58, options [nop,nop,TS val 4294714597 ecr 4294714580], length 164
12:19:19.007823 IP vagrant-ubuntu-trusty-64.8882 > 10.0.0.2.47555: Flags [.], ack 386553812, win 95, options [nop,nop,TS val 4294714618 ecr 4294714597], length 0
12:19:19.031632 IP 10.0.0.2.47555 > vagrant-ubuntu-trusty-64.8882: Flags [P.], seq 386553812:386553976, ack 572292655, win 58, options [nop,nop,TS val 4294714618 ecr 4294714608], length 164
12:19:19.031646 IP vagrant-ubuntu-trusty-64.8882 > 10.0.0.2.47555: Flags [.], ack 386553976, win 97, options [nop,nop,TS val 4294714642 ecr 4294714618], length 0
12:19:19.068291 IP 10.0.0.2.47555 > vagrant-ubuntu-trusty-64.8882: Flags [P.], seq 386554140:386554304, ack 572292655, win 58, options [nop,nop,TS val 4294714657 ecr 4294714642], length 164
12:19:19.068329 IP vagrant-ubuntu-trusty-64.8882 > 10.0.0.2.47555: Flags [.], ack 386553976, win 99, options [nop,nop,TS val 4294714679 ecr 4294714618,nop,nop,sack 1 {386554140:386554304}], length 0
12:19:19.084839 IP 10.0.0.2.47555 > vagrant-ubuntu-trusty-64.8882: Flags [P.], seq 386554304:386554468, ack 572292655, win 58, options [nop,nop,TS val 4294714678 ecr 4294714642], length 164
12:19:19.084958 IP vagrant-ubuntu-trusty-64.8882 > 10.0.0.2.47555: Flags [.], ack 386553976, win 101, options [nop,nop,TS val 4294714695 ecr 4294714618,nop,nop,sack 1 {386554140:386554468}], length 0
12:19:19.099218 IP 10.0.0.2.47555 > vagrant-ubuntu-trusty-64.8882: Flags [P.], seq 386553976:386554140, ack 572292655, win 58, options [nop,nop,TS val 4294714696 ecr 4294714679], length 164
12:19:19.099258 IP vagrant-ubuntu-trusty-64.8882 > 10.0.0.2.47555: Flags [.], ack 386554468, win 103, options [nop,nop,TS val 4294714710 ecr 4294714696], length 0
12:19:19.099303 IP 10.0.0.2.47555 > vagrant-ubuntu-trusty-64.8882: Flags [P.], seq 386554468:386554632, ack 572292655, win 58, options [nop,nop,TS val 4294714698 ecr 4294714679], length 164
12:19:19.099310 IP vagrant-ubuntu-trusty-64.8882 > 10.0.0.2.47555: Flags [.], ack 386554632, win 105, options [nop,nop,TS val 4294714710 ecr 4294714698], length 0
12:19:19.138938 IP 10.0.0.2.47555 > vagrant-ubuntu-trusty-64.8882: Flags [P.], seq 386554632:386554796, ack 572292655, win 58, options [nop,nop,TS val 4294714718 ecr 4294714695], length 164
12:19:19.138957 IP vagrant-ubuntu-trusty-64.8882 > 10.0.0.2.47555: Flags [.], ack 386554796, win 107, options [nop,nop,TS val 4294714749 ecr 4294714718], length 0
12:19:19.160368 IP 10.0.0.2.47555 > vagrant-ubuntu-trusty-64.8882: Flags [P.], seq 386554796:386554960, ack 572292655, win 58, options [nop,nop,TS val 4294714737 ecr 4294714710], length 164
12:19:19.160386 IP vagrant-ubuntu-trusty-64.8882 > 10.0.0.2.47555: Flags [.], ack 386554960, win 109, options [nop,nop,TS val 4294714771 ecr 4294714737], length 0
12:19:19.182104 IP 10.0.0.2.47555 > vagrant-ubuntu-trusty-64.8882: Flags [P.], seq 386554960:386555124, ack 572292655, win 58, options [nop,nop,TS val 4294714757 ecr 4294714710], length 164
12:19:19.182158 IP vagrant-ubuntu-trusty-64.8882 > 10.0.0.2.47555: Flags [.], ack 386555124, win 111, options [nop,nop,TS val 4294714792 ecr 4294714757], length 0
12:19:19.203885 IP 10.0.0.2.47555 > vagrant-ubuntu-trusty-64.8882: Flags [P.], seq 386555124:386555288, ack 572292655, win 58, options [nop,nop,TS val 4294714777 ecr 4294714749], length 164
12:19:19.203965 IP vagrant-ubuntu-trusty-64.8882 > 10.0.0.2.47555: Flags [.], ack 386555288, win 114, options [nop,nop,TS val 4294714814 ecr 4294714777], length 0
12:19:19.225035 IP 10.0.0.2.47555 > vagrant-ubuntu-trusty-64.8882: Flags [P.], seq 386555288:386555452, ack 572292655, win 58, options [nop,nop,TS val 4294714797 ecr 4294714771], length 164
12:19:19.225105 IP vagrant-ubuntu-trusty-64.8882 > 10.0.0.2.47555: Flags [.], ack 386555452, win 116, options [nop,nop,TS val 4294714835 ecr 4294714797], length 0
12:19:19.243049 IP 10.0.0.2.47555 > vagrant-ubuntu-trusty-64.8882: Flags [P.], seq 386555452:386555616, ack 572292655, win 58, options [nop,nop,TS val 4294714817 ecr 4294714792], length 164
12:19:19.243070 IP vagrant-ubuntu-trusty-64.8882 > 10.0.0.2.47555: Flags [.], ack 386555616, win 118, options [nop,nop,TS val 4294714853 ecr 4294714817], length 0
12:19:19.264999 IP 10.0.0.2.47555 > vagrant-ubuntu-trusty-64.8882: Flags [P.], seq 386555616:386555780, ack 572292655, win 58, options [nop,nop,TS val 4294714837 ecr 4294714814], length 164
12:19:19.265073 IP vagrant-ubuntu-trusty-64.8882 > 10.0.0.2.47555: Flags [.], ack 386555780, win 120, options [nop,nop,TS val 4294714875 ecr 4294714837], length 0
12:19:19.282896 IP 10.0.0.2.47555 > vagrant-ubuntu-trusty-64.8882: Flags [P.], seq 386555780:386555944, ack 572292655, win 58, options [nop,nop,TS val 4294714857 ecr 4294714835], length 164
12:19:19.282911 IP vagrant-ubuntu-trusty-64.8882 > 10.0.0.2.47555: Flags [.], ack 386555944, win 122, options [nop,nop,TS val 4294714893 ecr 4294714857], length 0
12:19:19.304940 IP 10.0.0.2.47555 > vagrant-ubuntu-trusty-64.8882: Flags [P.], seq 386555944:386556108, ack 572292655, win 58, options [nop,nop,TS val 4294714877 ecr 4294714853], length 164
12:19:19.305023 IP vagrant-ubuntu-trusty-64.8882 > 10.0.0.2.47555: Flags [.], ack 386556108, win 124, options [nop,nop,TS val 4294714915 ecr 4294714877], length 0
12:19:19.325764 IP 10.0.0.2.47555 > vagrant-ubuntu-trusty-64.8882: Flags [P.], seq 386556108:386556272, ack 572292655, win 58, options [nop,nop,TS val 4294714897 ecr 4294714875], length 164
12:19:19.325784 IP vagrant-ubuntu-trusty-64.8882 > 10.0.0.2.47555: Flags [.], ack 386556272, win 126, options [nop,nop,TS val 4294714936 ecr 4294714897], length 0
12:19:19.344764 IP 10.0.0.2.47555 > vagrant-ubuntu-trusty-64.8882: Flags [P.], seq 386556272:386556436, ack 572292655, win 58, options [nop,nop,TS val 4294714918 ecr 4294714893], length 164
12:19:19.344867 IP vagrant-ubuntu-trusty-64.8882 > 10.0.0.2.47555: Flags [.], ack 386556436, win 128, options [nop,nop,TS val 4294714954 ecr 4294714918], length 0
12:19:19.366090 IP 10.0.0.2.47555 > vagrant-ubuntu-trusty-64.8882: Flags [P.], seq 386556436:386556600, ack 572292655, win 58, options [nop,nop,TS val 4294714937 ecr 4294714915], length 164
12:19:19.366160 IP vagrant-ubuntu-trusty-64.8882 > 10.0.0.2.47555: Flags [.], ack 386556600, win 130, options [nop,nop,TS val 4294714976 ecr 4294714937], length 0
12:19:19.384035 IP 10.0.0.2.47555 > vagrant-ubuntu-trusty-64.8882: Flags [P.], seq 386556600:386556764, ack 572292655, win 58, options [nop,nop,TS val 4294714957 ecr 4294714936], length 164
12:19:19.384069 IP vagrant-ubuntu-trusty-64.8882 > 10.0.0.2.47555: Flags [.], ack 386556764, win 132, options [nop,nop,TS val 4294714994 ecr 4294714957], length 0
12:19:19.406095 IP 10.0.0.2.47555 > vagrant-ubuntu-trusty-64.8882: Flags [P.], seq 386556764:386556928, ack 572292655, win 58, options [nop,nop,TS val 4294714977 ecr 4294714954], length 164
12:19:19.406155 IP vagrant-ubuntu-trusty-64.8882 > 10.0.0.2.47555: Flags [.], ack 386556928, win 135, options [nop,nop,TS val 4294715016 ecr 4294714977], length 0
12:19:19.424146 IP 10.0.0.2.47555 > vagrant-ubuntu-trusty-64.8882: Flags [P.], seq 386556928:386557092, ack 572292655, win 58, options [nop,nop,TS val 4294714997 ecr 4294714976], length 164
12:19:19.424213 IP vagrant-ubuntu-trusty-64.8882 > 10.0.0.2.47555: Flags [.], ack 386557092, win 137, options [nop,nop,TS val 4294715034 ecr 4294714997], length 0
12:19:19.445863 IP 10.0.0.2.47555 > vagrant-ubuntu-trusty-64.8882: Flags [P.], seq 386557092:386557256, ack 572292655, win 58, options [nop,nop,TS val 4294715017 ecr 4294714994], length 164
12:19:19.445959 IP vagrant-ubuntu-trusty-64.8882 > 10.0.0.2.47555: Flags [.], ack 386557256, win 139, options [nop,nop,TS val 4294715056 ecr 4294715017], length 0
12:19:19.464072 IP 10.0.0.2.47555 > vagrant-ubuntu-trusty-64.8882: Flags [P.], seq 386557256:386557420, ack 572292655, win 58, options [nop,nop,TS val 4294715038 ecr 4294715016], length 164
12:19:19.464147 IP vagrant-ubuntu-trusty-64.8882 > 10.0.0.2.47555: Flags [.], ack 386557420, win 141, options [nop,nop,TS val 4294715074 ecr 4294715038], length 0
12:19:19.485255 IP 10.0.0.2.47555 > vagrant-ubuntu-trusty-64.8882: Flags [P.], seq 386557420:386557584, ack 572292655, win 58, options [nop,nop,TS val 4294715057 ecr 4294715034], length 164
12:19:19.485301 IP vagrant-ubuntu-trusty-64.8882 > 10.0.0.2.47555: Flags [.], ack 386557584, win 143, options [nop,nop,TS val 4294715094 ecr 4294715057], length 0
12:19:19.503850 IP 10.0.0.2.47555 > vagrant-ubuntu-trusty-64.8882: Flags [P.], seq 386557584:386557748, ack 572292655, win 58, options [nop,nop,TS val 4294715077 ecr 4294715056], length 164
12:19:19.503919 IP vagrant-ubuntu-trusty-64.8882 > 10.0.0.2.47555: Flags [.], ack 386557748, win 145, options [nop,nop,TS val 4294715114 ecr 4294715077], length 0
12:19:19.525172 IP 10.0.0.2.47555 > vagrant-ubuntu-trusty-64.8882: Flags [P.], seq 386557748:386557912, ack 572292655, win 58, options [nop,nop,TS val 4294715097 ecr 4294715074], length 164
12:19:19.525237 IP vagrant-ubuntu-trusty-64.8882 > 10.0.0.2.47555: Flags [.], ack 386557912, win 147, options [nop,nop,TS val 4294715135 ecr 4294715097], length 0
12:19:19.543237 IP 10.0.0.2.47555 > vagrant-ubuntu-trusty-64.8882: Flags [P.], seq 386557912:386558076, ack 572292655, win 58, options [nop,nop,TS val 4294715117 ecr 4294715094], length 164
12:19:19.543252 IP vagrant-ubuntu-trusty-64.8882 > 10.0.0.2.47555: Flags [.], ack 386558076, win 149, options [nop,nop,TS val 4294715154 ecr 4294715117], length 0
12:19:19.554104 IP 10.0.0.2.47555 > vagrant-ubuntu-trusty-64.8882: Flags [P.], seq 386558076:386558240, ack 572292655, win 58, options [nop,nop,TS val 4294715137 ecr 4294715114], length 164
12:19:19.554165 IP vagrant-ubuntu-trusty-64.8882 > 10.0.0.2.47555: Flags [.], ack 386558240, win 151, options [nop,nop,TS val 4294715164 ecr 4294715137], length 0
12:19:19.565285 IP 10.0.0.2.47555 > vagrant-ubuntu-trusty-64.8882: Flags [P.], seq 386558240:386558404, ack 572292655, win 58, options [nop,nop,TS val 4294715157 ecr 4294715135], length 164
12:19:19.565402 IP vagrant-ubuntu-trusty-64.8882 > 10.0.0.2.47555: Flags [.], ack 386558404, win 153, options [nop,nop,TS val 4294715175 ecr 4294715157], length 0
12:19:19.584069 IP 10.0.0.2.47555 > vagrant-ubuntu-trusty-64.8882: Flags [P.], seq 386558404:386558568, ack 572292655, win 58, options [nop,nop,TS val 4294715177 ecr 4294715164], length 164
12:19:19.584133 IP vagrant-ubuntu-trusty-64.8882 > 10.0.0.2.47555: Flags [.], ack 386558568, win 155, options [nop,nop,TS val 4294715194 ecr 4294715177], length 0
12:19:19.600855 IP 10.0.0.2.47555 > vagrant-ubuntu-trusty-64.8882: Flags [P.], seq 386558568:386558732, ack 572292655, win 58, options [nop,nop,TS val 4294715197 ecr 4294715175], length 164
12:19:19.600918 IP vagrant-ubuntu-trusty-64.8882 > 10.0.0.2.47555: Flags [.], ack 386558732, win 158, options [nop,nop,TS val 4294715211 ecr 4294715197], length 0
12:19:19.620799 IP 10.0.0.2.47555 > vagrant-ubuntu-trusty-64.8882: Flags [P.], seq 386558732:386558896, ack 572292655, win 58, options [nop,nop,TS val 4294715217 ecr 4294715194], length 164
12:19:19.620879 IP vagrant-ubuntu-trusty-64.8882 > 10.0.0.2.47555: Flags [.], ack 386558896, win 160, options [nop,nop,TS val 4294715231 ecr 4294715217], length 0
12:19:19.645110 IP 10.0.0.2.47555 > vagrant-ubuntu-trusty-64.8882: Flags [P.], seq 386558896:386559060, ack 572292655, win 58, options [nop,nop,TS val 4294715238 ecr 4294715211], length 164
12:19:19.645179 IP vagrant-ubuntu-trusty-64.8882 > 10.0.0.2.47555: Flags [.], ack 386559060, win 162, options [nop,nop,TS val 4294715255 ecr 4294715238], length 0
12:19:19.663264 IP 10.0.0.2.47555 > vagrant-ubuntu-trusty-64.8882: Flags [P.], seq 386559060:386559224, ack 572292655, win 58, options [nop,nop,TS val 4294715257 ecr 4294715231], length 164
12:19:19.663272 IP vagrant-ubuntu-trusty-64.8882 > 10.0.0.2.47555: Flags [.], ack 386559224, win 164, options [nop,nop,TS val 4294715274 ecr 4294715257], length 0
12:19:19.682021 IP 10.0.0.2.47555 > vagrant-ubuntu-trusty-64.8882: Flags [P.], seq 386559224:386559388, ack 572292655, win 58, options [nop,nop,TS val 4294715277 ecr 4294715255], length 164
12:19:19.682091 IP vagrant-ubuntu-trusty-64.8882 > 10.0.0.2.47555: Flags [.], ack 386559388, win 166, options [nop,nop,TS val 4294715292 ecr 4294715277], length 0
12:19:19.697142 IP 10.0.0.2.47555 > vagrant-ubuntu-trusty-64.8882: Flags [P.], seq 386559388:386559552, ack 572292655, win 58, options [nop,nop,TS val 4294715297 ecr 4294715274], length 164
12:19:19.697159 IP vagrant-ubuntu-trusty-64.8882 > 10.0.0.2.47555: Flags [.], ack 386559552, win 168, options [nop,nop,TS val 4294715307 ecr 4294715297], length 0
12:19:19.717763 IP 10.0.0.2.47555 > vagrant-ubuntu-trusty-64.8882: Flags [P.], seq 386559552:386559716, ack 572292655, win 58, options [nop,nop,TS val 4294715317 ecr 4294715292], length 164
12:19:19.717837 IP vagrant-ubuntu-trusty-64.8882 > 10.0.0.2.47555: Flags [.], ack 386559716, win 170, options [nop,nop,TS val 4294715328 ecr 4294715317], length 0
12:19:19.738118 IP 10.0.0.2.47555 > vagrant-ubuntu-trusty-64.8882: Flags [P.], seq 386559716:386559880, ack 572292655, win 58, options [nop,nop,TS val 4294715337 ecr 4294715307], length 164
12:19:19.738175 IP vagrant-ubuntu-trusty-64.8882 > 10.0.0.2.47555: Flags [.], ack 386559880, win 172, options [nop,nop,TS val 4294715348 ecr 4294715337], length 0
12:19:19.757804 IP 10.0.0.2.47555 > vagrant-ubuntu-trusty-64.8882: Flags [P.], seq 386559880:386560044, ack 572292655, win 58, options [nop,nop,TS val 4294715357 ecr 4294715328], length 164
12:19:19.757838 IP vagrant-ubuntu-trusty-64.8882 > 10.0.0.2.47555: Flags [.], ack 386560044, win 174, options [nop,nop,TS val 4294715368 ecr 4294715357], length 0
12:19:19.777330 IP 10.0.0.2.47555 > vagrant-ubuntu-trusty-64.8882: Flags [P.], seq 386560044:386560208, ack 572292655, win 58, options [nop,nop,TS val 4294715377 ecr 4294715348], length 164
12:19:19.777347 IP vagrant-ubuntu-trusty-64.8882 > 10.0.0.2.47555: Flags [.], ack 386560208, win 176, options [nop,nop,TS val 4294715388 ecr 4294715377], length 0
12:19:19.797208 IP 10.0.0.2.47555 > vagrant-ubuntu-trusty-64.8882: Flags [P.], seq 386560208:386560372, ack 572292655, win 58, options [nop,nop,TS val 4294715397 ecr 4294715368], length 164
12:19:19.797225 IP vagrant-ubuntu-trusty-64.8882 > 10.0.0.2.47555: Flags [.], ack 386560372, win 178, options [nop,nop,TS val 4294715408 ecr 4294715397], length 0
12:19:19.817325 IP 10.0.0.2.47555 > vagrant-ubuntu-trusty-64.8882: Flags [P.], seq 386560372:386560536, ack 572292655, win 58, options [nop,nop,TS val 4294715417 ecr 4294715388], length 164
12:19:19.817342 IP vagrant-ubuntu-trusty-64.8882 > 10.0.0.2.47555: Flags [.], ack 386560536, win 181, options [nop,nop,TS val 4294715428 ecr 4294715417], length 0
12:19:19.848568 IP 10.0.0.2.47555 > vagrant-ubuntu-trusty-64.8882: Flags [P.], seq 386560536:386560700, ack 572292655, win 58, options [nop,nop,TS val 4294715437 ecr 4294715408], length 164
12:19:19.848581 IP vagrant-ubuntu-trusty-64.8882 > 10.0.0.2.47555: Flags [.], ack 386560700, win 183, options [nop,nop,TS val 4294715459 ecr 4294715437], length 0
12:19:19.858670 IP 10.0.0.2.47555 > vagrant-ubuntu-trusty-64.8882: Flags [P.], seq 386560700:386560864, ack 572292655, win 58, options [nop,nop,TS val 4294715458 ecr 4294715428], length 164
12:19:19.858700 IP vagrant-ubuntu-trusty-64.8882 > 10.0.0.2.47555: Flags [.], ack 386560864, win 185, options [nop,nop,TS val 4294715469 ecr 4294715458], length 0
12:19:19.877274 IP 10.0.0.2.47555 > vagrant-ubuntu-trusty-64.8882: Flags [P.], seq 386560864:386561028, ack 572292655, win 58, options [nop,nop,TS val 4294715477 ecr 4294715459], length 164
12:19:19.877291 IP vagrant-ubuntu-trusty-64.8882 > 10.0.0.2.47555: Flags [.], ack 386561028, win 187, options [nop,nop,TS val 4294715488 ecr 4294715477], length 0
12:19:19.897191 IP 10.0.0.2.47555 > vagrant-ubuntu-trusty-64.8882: Flags [P.], seq 386561028:386561192, ack 572292655, win 58, options [nop,nop,TS val 4294715497 ecr 4294715469], length 164
12:19:19.897203 IP vagrant-ubuntu-trusty-64.8882 > 10.0.0.2.47555: Flags [.], ack 386561192, win 189, options [nop,nop,TS val 4294715507 ecr 4294715497], length 0
12:19:19.917444 IP 10.0.0.2.47555 > vagrant-ubuntu-trusty-64.8882: Flags [P.], seq 386561192:386561356, ack 572292655, win 58, options [nop,nop,TS val 4294715518 ecr 4294715507], length 164
12:19:19.917459 IP vagrant-ubuntu-trusty-64.8882 > 10.0.0.2.47555: Flags [.], ack 386561356, win 191, options [nop,nop,TS val 4294715528 ecr 4294715518], length 0
12:19:19.942250 IP 10.0.0.2.47555 > vagrant-ubuntu-trusty-64.8882: Flags [P.], seq 386561356:386561520, ack 572292655, win 58, options [nop,nop,TS val 4294715537 ecr 4294715507], length 164
12:19:19.942275 IP vagrant-ubuntu-trusty-64.8882 > 10.0.0.2.47555: Flags [.], ack 386561520, win 193, options [nop,nop,TS val 4294715552 ecr 4294715537], length 0
12:19:19.958380 IP 10.0.0.2.47555 > vagrant-ubuntu-trusty-64.8882: Flags [P.], seq 386561520:386561684, ack 572292655, win 58, options [nop,nop,TS val 4294715558 ecr 4294715528], length 164
12:19:19.958418 IP vagrant-ubuntu-trusty-64.8882 > 10.0.0.2.47555: Flags [.], ack 386561684, win 195, options [nop,nop,TS val 4294715569 ecr 4294715558], length 0
12:19:19.978192 IP 10.0.0.2.47555 > vagrant-ubuntu-trusty-64.8882: Flags [P.], seq 386561684:386561848, ack 572292655, win 58, options [nop,nop,TS val 4294715578 ecr 4294715552], length 164
12:19:19.978200 IP vagrant-ubuntu-trusty-64.8882 > 10.0.0.2.47555: Flags [.], ack 386561848, win 197, options [nop,nop,TS val 4294715588 ecr 4294715578], length 0
12:19:19.997311 IP 10.0.0.2.47555 > vagrant-ubuntu-trusty-64.8882: Flags [P.], seq 386561848:386562012, ack 572292655, win 58, options [nop,nop,TS val 4294715597 ecr 4294715569], length 164
12:19:19.997346 IP vagrant-ubuntu-trusty-64.8882 > 10.0.0.2.47555: Flags [.], ack 386562012, win 199, options [nop,nop,TS val 4294715608 ecr 4294715597], length 0
12:19:20.018195 IP 10.0.0.2.47555 > vagrant-ubuntu-trusty-64.8882: Flags [P.], seq 386562012:386562176, ack 572292655, win 58, options [nop,nop,TS val 4294715618 ecr 4294715588], length 164
12:19:20.018262 IP vagrant-ubuntu-trusty-64.8882 > 10.0.0.2.47555: Flags [.], ack 386562176, win 202, options [nop,nop,TS val 4294715628 ecr 4294715618], length 0
12:19:20.037476 IP 10.0.0.2.47555 > vagrant-ubuntu-trusty-64.8882: Flags [P.], seq 386562176:386562340, ack 572292655, win 58, options [nop,nop,TS val 4294715637 ecr 4294715608], length 164
12:19:20.037501 IP vagrant-ubuntu-trusty-64.8882 > 10.0.0.2.47555: Flags [.], ack 386562340, win 204, options [nop,nop,TS val 4294715648 ecr 4294715637], length 0
12:19:20.057509 IP 10.0.0.2.47555 > vagrant-ubuntu-trusty-64.8882: Flags [P.], seq 386562340:386562504, ack 572292655, win 58, options [nop,nop,TS val 4294715658 ecr 4294715628], length 164
12:19:20.057520 IP vagrant-ubuntu-trusty-64.8882 > 10.0.0.2.47555: Flags [.], ack 386562504, win 206, options [nop,nop,TS val 4294715667 ecr 4294715658], length 0
12:19:20.077308 IP 10.0.0.2.47555 > vagrant-ubuntu-trusty-64.8882: Flags [P.], seq 386562504:386562668, ack 572292655, win 58, options [nop,nop,TS val 4294715677 ecr 4294715648], length 164
12:19:20.077351 IP vagrant-ubuntu-trusty-64.8882 > 10.0.0.2.47555: Flags [.], ack 386562668, win 208, options [nop,nop,TS val 4294715688 ecr 4294715677], length 0
12:19:20.097211 IP 10.0.0.2.47555 > vagrant-ubuntu-trusty-64.8882: Flags [P.], seq 386562668:386562832, ack 572292655, win 58, options [nop,nop,TS val 4294715697 ecr 4294715667], length 164
12:19:20.097223 IP vagrant-ubuntu-trusty-64.8882 > 10.0.0.2.47555: Flags [.], ack 386562832, win 210, options [nop,nop,TS val 4294715708 ecr 4294715697], length 0
12:19:20.118562 IP 10.0.0.2.47555 > vagrant-ubuntu-trusty-64.8882: Flags [P.], seq 386562832:386562996, ack 572292655, win 58, options [nop,nop,TS val 4294715718 ecr 4294715708], length 164
12:19:20.118606 IP vagrant-ubuntu-trusty-64.8882 > 10.0.0.2.47555: Flags [.], ack 386562996, win 212, options [nop,nop,TS val 4294715729 ecr 4294715718], length 0
12:19:20.137577 IP 10.0.0.2.47555 > vagrant-ubuntu-trusty-64.8882: Flags [P.], seq 386562996:386563160, ack 572292655, win 58, options [nop,nop,TS val 4294715737 ecr 4294715708], length 164
12:19:20.137614 IP vagrant-ubuntu-trusty-64.8882 > 10.0.0.2.47555: Flags [.], ack 386563160, win 214, options [nop,nop,TS val 4294715748 ecr 4294715737], length 0
12:19:20.157292 IP 10.0.0.2.47555 > vagrant-ubuntu-trusty-64.8882: Flags [P.], seq 386563160:386563324, ack 572292655, win 58, options [nop,nop,TS val 4294715757 ecr 4294715729], length 164
12:19:20.157322 IP vagrant-ubuntu-trusty-64.8882 > 10.0.0.2.47555: Flags [.], ack 386563324, win 216, options [nop,nop,TS val 4294715768 ecr 4294715757], length 0
12:19:20.177294 IP 10.0.0.2.47555 > vagrant-ubuntu-trusty-64.8882: Flags [P.], seq 386563324:386563488, ack 572292655, win 58, options [nop,nop,TS val 4294715777 ecr 4294715748], length 164
12:19:20.177332 IP vagrant-ubuntu-trusty-64.8882 > 10.0.0.2.47555: Flags [.], ack 386563488, win 218, options [nop,nop,TS val 4294715788 ecr 4294715777], length 0
12:19:20.197331 IP 10.0.0.2.47555 > vagrant-ubuntu-trusty-64.8882: Flags [P.], seq 386563488:386563652, ack 572292655, win 58, options [nop,nop,TS val 4294715797 ecr 4294715768], length 164
12:19:20.197351 IP vagrant-ubuntu-trusty-64.8882 > 10.0.0.2.47555: Flags [.], ack 386563652, win 220, options [nop,nop,TS val 4294715808 ecr 4294715797], length 0
12:19:20.218520 IP 10.0.0.2.47555 > vagrant-ubuntu-trusty-64.8882: Flags [P.], seq 386563652:386563816, ack 572292655, win 58, options [nop,nop,TS val 4294715818 ecr 4294715808], length 164
12:19:20.218582 IP vagrant-ubuntu-trusty-64.8882 > 10.0.0.2.47555: Flags [.], ack 386563816, win 222, options [nop,nop,TS val 4294715828 ecr 4294715818], length 0
12:19:20.237987 IP 10.0.0.2.47555 > vagrant-ubuntu-trusty-64.8882: Flags [P.], seq 386563816:386563980, ack 572292655, win 58, options [nop,nop,TS val 4294715838 ecr 4294715808], length 164
12:19:20.238042 IP vagrant-ubuntu-trusty-64.8882 > 10.0.0.2.47555: Flags [.], ack 386563980, win 225, options [nop,nop,TS val 4294715848 ecr 4294715838], length 0
12:19:20.258231 IP 10.0.0.2.47555 > vagrant-ubuntu-trusty-64.8882: Flags [P.], seq 386563980:386564144, ack 572292655, win 58, options [nop,nop,TS val 4294715858 ecr 4294715828], length 164
12:19:20.258248 IP vagrant-ubuntu-trusty-64.8882 > 10.0.0.2.47555: Flags [.], ack 386564144, win 227, options [nop,nop,TS val 4294715869 ecr 4294715858], length 0
12:19:20.278566 IP 10.0.0.2.47555 > vagrant-ubuntu-trusty-64.8882: Flags [P.], seq 386564144:386564308, ack 572292655, win 58, options [nop,nop,TS val 4294715878 ecr 4294715848], length 164
12:19:20.278600 IP vagrant-ubuntu-trusty-64.8882 > 10.0.0.2.47555: Flags [.], ack 386564308, win 229, options [nop,nop,TS val 4294715889 ecr 4294715878], length 0
12:19:20.297672 IP 10.0.0.2.47555 > vagrant-ubuntu-trusty-64.8882: Flags [P.], seq 386564308:386564472, ack 572292655, win 58, options [nop,nop,TS val 4294715898 ecr 4294715869], length 164
12:19:20.297699 IP vagrant-ubuntu-trusty-64.8882 > 10.0.0.2.47555: Flags [.], ack 386564472, win 231, options [nop,nop,TS val 4294715908 ecr 4294715898], length 0
12:19:20.317585 IP 10.0.0.2.47555 > vagrant-ubuntu-trusty-64.8882: Flags [P.], seq 386564472:386564636, ack 572292655, win 58, options [nop,nop,TS val 4294715918 ecr 4294715889], length 164
12:19:20.317597 IP vagrant-ubuntu-trusty-64.8882 > 10.0.0.2.47555: Flags [.], ack 386564636, win 233, options [nop,nop,TS val 4294715928 ecr 4294715918], length 0
12:19:20.338610 IP 10.0.0.2.47555 > vagrant-ubuntu-trusty-64.8882: Flags [P.], seq 386564636:386564800, ack 572292655, win 58, options [nop,nop,TS val 4294715938 ecr 4294715908], length 164
12:19:20.338643 IP vagrant-ubuntu-trusty-64.8882 > 10.0.0.2.47555: Flags [.], ack 386564800, win 235, options [nop,nop,TS val 4294715949 ecr 4294715938], length 0
12:19:20.358676 IP 10.0.0.2.47555 > vagrant-ubuntu-trusty-64.8882: Flags [P.], seq 386564800:386564964, ack 572292655, win 58, options [nop,nop,TS val 4294715958 ecr 4294715928], length 164
12:19:20.358707 IP vagrant-ubuntu-trusty-64.8882 > 10.0.0.2.47555: Flags [.], ack 386564964, win 237, options [nop,nop,TS val 4294715969 ecr 4294715958], length 0
12:19:20.379712 IP 10.0.0.2.47555 > vagrant-ubuntu-trusty-64.8882: Flags [P.], seq 386564964:386565128, ack 572292655, win 58, options [nop,nop,TS val 4294715978 ecr 4294715949], length 164
12:19:20.379760 IP vagrant-ubuntu-trusty-64.8882 > 10.0.0.2.47555: Flags [.], ack 386565128, win 239, options [nop,nop,TS val 4294715990 ecr 4294715978], length 0
12:19:20.398590 IP 10.0.0.2.47555 > vagrant-ubuntu-trusty-64.8882: Flags [P.], seq 386565128:386565292, ack 572292655, win 58, options [nop,nop,TS val 4294715998 ecr 4294715969], length 164
12:19:20.398657 IP vagrant-ubuntu-trusty-64.8882 > 10.0.0.2.47555: Flags [.], ack 386565292, win 241, options [nop,nop,TS val 4294716009 ecr 4294715998], length 0
12:19:20.417641 IP 10.0.0.2.47555 > vagrant-ubuntu-trusty-64.8882: Flags [P.], seq 386565292:386565456, ack 572292655, win 58, options [nop,nop,TS val 4294716018 ecr 4294715990], length 164
12:19:20.417651 IP vagrant-ubuntu-trusty-64.8882 > 10.0.0.2.47555: Flags [.], ack 386565456, win 243, options [nop,nop,TS val 4294716028 ecr 4294716018], length 0
12:19:20.438334 IP 10.0.0.2.47555 > vagrant-ubuntu-trusty-64.8882: Flags [P.], seq 386565456:386565620, ack 572292655, win 58, options [nop,nop,TS val 4294716038 ecr 4294716028], length 164
12:19:20.438402 IP vagrant-ubuntu-trusty-64.8882 > 10.0.0.2.47555: Flags [.], ack 386565620, win 245, options [nop,nop,TS val 4294716048 ecr 4294716038], length 0
12:19:20.462133 IP 10.0.0.2.47555 > vagrant-ubuntu-trusty-64.8882: Flags [P.], seq 386565620:386565784, ack 572292655, win 58, options [nop,nop,TS val 4294716058 ecr 4294716028], length 164
12:19:20.462177 IP vagrant-ubuntu-trusty-64.8882 > 10.0.0.2.47555: Flags [.], ack 386565784, win 248, options [nop,nop,TS val 4294716072 ecr 4294716058], length 0
12:19:20.478574 IP 10.0.0.2.47555 > vagrant-ubuntu-trusty-64.8882: Flags [P.], seq 386565784:386565948, ack 572292655, win 58, options [nop,nop,TS val 4294716078 ecr 4294716048], length 164
12:19:20.478625 IP vagrant-ubuntu-trusty-64.8882 > 10.0.0.2.47555: Flags [.], ack 386565948, win 250, options [nop,nop,TS val 4294716089 ecr 4294716078], length 0
12:19:20.497715 IP 10.0.0.2.47555 > vagrant-ubuntu-trusty-64.8882: Flags [P.], seq 386565948:386566112, ack 572292655, win 58, options [nop,nop,TS val 4294716097 ecr 4294716072], length 164
12:19:20.497762 IP vagrant-ubuntu-trusty-64.8882 > 10.0.0.2.47555: Flags [.], ack 386566112, win 252, options [nop,nop,TS val 4294716108 ecr 4294716097], length 0
12:19:20.518419 IP 10.0.0.2.47555 > vagrant-ubuntu-trusty-64.8882: Flags [P.], seq 386566112:386566276, ack 572292655, win 58, options [nop,nop,TS val 4294716118 ecr 4294716089], length 164
12:19:20.518489 IP vagrant-ubuntu-trusty-64.8882 > 10.0.0.2.47555: Flags [.], ack 386566276, win 254, options [nop,nop,TS val 4294716128 ecr 4294716118], length 0
12:19:20.545909 IP 10.0.0.2.47555 > vagrant-ubuntu-trusty-64.8882: Flags [P.], seq 386566276:386566440, ack 572292655, win 58, options [nop,nop,TS val 4294716138 ecr 4294716108], length 164
12:19:20.545953 IP vagrant-ubuntu-trusty-64.8882 > 10.0.0.2.47555: Flags [.], ack 386566440, win 256, options [nop,nop,TS val 4294716155 ecr 4294716138], length 0
12:19:20.557673 IP 10.0.0.2.47555 > vagrant-ubuntu-trusty-64.8882: Flags [P.], seq 386566440:386566604, ack 572292655, win 58, options [nop,nop,TS val 4294716158 ecr 4294716128], length 164
12:19:20.557685 IP vagrant-ubuntu-trusty-64.8882 > 10.0.0.2.47555: Flags [.], ack 386566604, win 258, options [nop,nop,TS val 4294716168 ecr 4294716158], length 0
12:19:20.577750 IP 10.0.0.2.47555 > vagrant-ubuntu-trusty-64.8882: Flags [P.], seq 386566604:386566768, ack 572292655, win 58, options [nop,nop,TS val 4294716177 ecr 4294716155], length 164
12:19:20.577795 IP vagrant-ubuntu-trusty-64.8882 > 10.0.0.2.47555: Flags [.], ack 386566768, win 260, options [nop,nop,TS val 4294716188 ecr 4294716177], length 0
12:19:20.597736 IP 10.0.0.2.47555 > vagrant-ubuntu-trusty-64.8882: Flags [P.], seq 386566768:386566932, ack 572292655, win 58, options [nop,nop,TS val 4294716198 ecr 4294716168], length 164
12:19:20.597752 IP vagrant-ubuntu-trusty-64.8882 > 10.0.0.2.47555: Flags [.], ack 386566932, win 262, options [nop,nop,TS val 4294716208 ecr 4294716198], length 0
12:19:20.618272 IP 10.0.0.2.47555 > vagrant-ubuntu-trusty-64.8882: Flags [P.], seq 386566932:386567096, ack 572292655, win 58, options [nop,nop,TS val 4294716218 ecr 4294716188], length 164
12:19:20.618343 IP vagrant-ubuntu-trusty-64.8882 > 10.0.0.2.47555: Flags [.], ack 386567096, win 264, options [nop,nop,TS val 4294716228 ecr 4294716218], length 0
12:19:20.638402 IP 10.0.0.2.47555 > vagrant-ubuntu-trusty-64.8882: Flags [P.], seq 386567096:386567260, ack 572292655, win 58, options [nop,nop,TS val 4294716238 ecr 4294716208], length 164
12:19:20.638475 IP vagrant-ubuntu-trusty-64.8882 > 10.0.0.2.47555: Flags [.], ack 386567260, win 266, options [nop,nop,TS val 4294716248 ecr 4294716238], length 0
12:19:20.658531 IP 10.0.0.2.47555 > vagrant-ubuntu-trusty-64.8882: Flags [P.], seq 386567260:386567424, ack 572292655, win 58, options [nop,nop,TS val 4294716258 ecr 4294716228], length 164
12:19:20.658611 IP vagrant-ubuntu-trusty-64.8882 > 10.0.0.2.47555: Flags [.], ack 386567424, win 269, options [nop,nop,TS val 4294716269 ecr 4294716258], length 0
12:19:20.678800 IP 10.0.0.2.47555 > vagrant-ubuntu-trusty-64.8882: Flags [P.], seq 386567424:386567588, ack 572292655, win 58, options [nop,nop,TS val 4294716278 ecr 4294716248], length 164
12:19:20.678817 IP vagrant-ubuntu-trusty-64.8882 > 10.0.0.2.47555: Flags [.], ack 386567588, win 271, options [nop,nop,TS val 4294716289 ecr 4294716278], length 0
12:19:20.698614 IP 10.0.0.2.47555 > vagrant-ubuntu-trusty-64.8882: Flags [P.], seq 386567588:386567752, ack 572292655, win 58, options [nop,nop,TS val 4294716298 ecr 4294716269], length 164
12:19:20.698671 IP vagrant-ubuntu-trusty-64.8882 > 10.0.0.2.47555: Flags [.], ack 386567752, win 273, options [nop,nop,TS val 4294716309 ecr 4294716298], length 0
12:19:20.718579 IP 10.0.0.2.47555 > vagrant-ubuntu-trusty-64.8882: Flags [P.], seq 386567752:386567916, ack 572292655, win 58, options [nop,nop,TS val 4294716318 ecr 4294716289], length 164
12:19:20.718638 IP vagrant-ubuntu-trusty-64.8882 > 10.0.0.2.47555: Flags [.], ack 386567916, win 275, options [nop,nop,TS val 4294716329 ecr 4294716318], length 0
12:19:20.738108 IP 10.0.0.2.47555 > vagrant-ubuntu-trusty-64.8882: Flags [P.], seq 386567916:386568080, ack 572292655, win 58, options [nop,nop,TS val 4294716338 ecr 4294716309], length 164
12:19:20.738147 IP vagrant-ubuntu-trusty-64.8882 > 10.0.0.2.47555: Flags [.], ack 386568080, win 277, options [nop,nop,TS val 4294716348 ecr 4294716338], length 0
12:19:20.758498 IP 10.0.0.2.47555 > vagrant-ubuntu-trusty-64.8882: Flags [P.], seq 386568080:386568244, ack 572292655, win 58, options [nop,nop,TS val 4294716358 ecr 4294716329], length 164
12:19:20.758547 IP vagrant-ubuntu-trusty-64.8882 > 10.0.0.2.47555: Flags [.], ack 386568244, win 279, options [nop,nop,TS val 4294716369 ecr 4294716358], length 0
12:19:20.778129 IP 10.0.0.2.47555 > vagrant-ubuntu-trusty-64.8882: Flags [P.], seq 386568244:386568408, ack 572292655, win 58, options [nop,nop,TS val 4294716378 ecr 4294716348], length 164
12:19:20.778167 IP vagrant-ubuntu-trusty-64.8882 > 10.0.0.2.47555: Flags [.], ack 386568408, win 281, options [nop,nop,TS val 4294716388 ecr 4294716378], length 0
12:19:20.798336 IP 10.0.0.2.47555 > vagrant-ubuntu-trusty-64.8882: Flags [P.], seq 386568408:386568572, ack 572292655, win 58, options [nop,nop,TS val 4294716398 ecr 4294716369], length 164
12:19:20.798409 IP vagrant-ubuntu-trusty-64.8882 > 10.0.0.2.47555: Flags [.], ack 386568572, win 283, options [nop,nop,TS val 4294716408 ecr 4294716398], length 0
12:19:20.817738 IP 10.0.0.2.47555 > vagrant-ubuntu-trusty-64.8882: Flags [P.], seq 386568572:386568736, ack 572292655, win 58, options [nop,nop,TS val 4294716418 ecr 4294716388], length 164
12:19:20.817754 IP vagrant-ubuntu-trusty-64.8882 > 10.0.0.2.47555: Flags [.], ack 386568736, win 285, options [nop,nop,TS val 4294716428 ecr 4294716418], length 0
12:19:20.837840 IP 10.0.0.2.47555 > vagrant-ubuntu-trusty-64.8882: Flags [P.], seq 386568736:386568900, ack 572292655, win 58, options [nop,nop,TS val 4294716438 ecr 4294716408], length 164
12:19:20.837882 IP vagrant-ubuntu-trusty-64.8882 > 10.0.0.2.47555: Flags [.], ack 386568900, win 287, options [nop,nop,TS val 4294716448 ecr 4294716438], length 0
12:19:20.857737 IP 10.0.0.2.47555 > vagrant-ubuntu-trusty-64.8882: Flags [P.], seq 386568900:386569064, ack 572292655, win 58, options [nop,nop,TS val 4294716457 ecr 4294716428], length 164
12:19:20.857802 IP vagrant-ubuntu-trusty-64.8882 > 10.0.0.2.47555: Flags [.], ack 386569064, win 289, options [nop,nop,TS val 4294716468 ecr 4294716457], length 0
12:19:20.877429 IP 10.0.0.2.47555 > vagrant-ubuntu-trusty-64.8882: Flags [P.], seq 386569064:386569228, ack 572292655, win 58, options [nop,nop,TS val 4294716477 ecr 4294716448], length 164
12:19:20.877471 IP vagrant-ubuntu-trusty-64.8882 > 10.0.0.2.47555: Flags [.], ack 386569228, win 292, options [nop,nop,TS val 4294716488 ecr 4294716477], length 0
12:19:20.898837 IP 10.0.0.2.47555 > vagrant-ubuntu-trusty-64.8882: Flags [P.], seq 386569228:386569392, ack 572292655, win 58, options [nop,nop,TS val 4294716498 ecr 4294716468], length 164
12:19:20.898854 IP vagrant-ubuntu-trusty-64.8882 > 10.0.0.2.47555: Flags [.], ack 386569392, win 294, options [nop,nop,TS val 4294716509 ecr 4294716498], length 0
12:19:20.918335 IP 10.0.0.2.47555 > vagrant-ubuntu-trusty-64.8882: Flags [P.], seq 386569392:386569556, ack 572292655, win 58, options [nop,nop,TS val 4294716518 ecr 4294716488], length 164
12:19:20.918416 IP vagrant-ubuntu-trusty-64.8882 > 10.0.0.2.47555: Flags [.], ack 386569556, win 296, options [nop,nop,TS val 4294716528 ecr 4294716518], length 0
