11:44:05.110137 IP 10.0.0.2.37651 > vagrant-ubuntu-trusty-64.8882: Flags [P.], seq 295520768:295520932, ack 564117090, win 58, options [nop,nop,TS val 4294711757 ecr 4294711728], length 164
11:44:05.110153 IP vagrant-ubuntu-trusty-64.8882 > 10.0.0.2.37651: Flags [.], ack 295520932, win 65, options [nop,nop,TS val 4294711768 ecr 4294711757], length 0
11:44:05.131105 IP 10.0.0.2.37651 > vagrant-ubuntu-trusty-64.8882: Flags [P.], seq 295520932:295521096, ack 564117090, win 58, options [nop,nop,TS val 4294711778 ecr 4294711748], length 164
11:44:05.131151 IP vagrant-ubuntu-trusty-64.8882 > 10.0.0.2.37651: Flags [.], ack 295521096, win 68, options [nop,nop,TS val 4294711788 ecr 4294711778], length 0
11:44:05.150068 IP 10.0.0.2.37651 > vagrant-ubuntu-trusty-64.8882: Flags [P.], seq 295521096:295521260, ack 564117090, win 58, options [nop,nop,TS val 4294711797 ecr 4294711768], length 164
11:44:05.150097 IP vagrant-ubuntu-trusty-64.8882 > 10.0.0.2.37651: Flags [.], ack 295521260, win 70, options [nop,nop,TS val 4294711807 ecr 4294711797], length 0
11:44:05.170484 IP 10.0.0.2.37651 > vagrant-ubuntu-trusty-64.8882: Flags [P.], seq 295521260:295521424, ack 564117090, win 58, options [nop,nop,TS val 4294711817 ecr 4294711788], length 164
11:44:05.170537 IP vagrant-ubuntu-trusty-64.8882 > 10.0.0.2.37651: Flags [.], ack 295521424, win 72, options [nop,nop,TS val 4294711828 ecr 4294711817], length 0
11:44:05.190102 IP 10.0.0.2.37651 > vagrant-ubuntu-trusty-64.8882: Flags [P.], seq 295521424:295521588, ack 564117090, win 58, options [nop,nop,TS val 4294711837 ecr 4294711807], length 164
11:44:05.190164 IP vagrant-ubuntu-trusty-64.8882 > 10.0.0.2.37651: Flags [.], ack 295521588, win 74, options [nop,nop,TS val 4294711847 ecr 4294711837], length 0
11:44:05.210292 IP 10.0.0.2.37651 > vagrant-ubuntu-trusty-64.8882: Flags [P.], seq 295521588:295521752, ack 564117090, win 58, options [nop,nop,TS val 4294711858 ecr 4294711828], length 164
11:44:05.210310 IP vagrant-ubuntu-trusty-64.8882 > 10.0.0.2.37651: Flags [.], ack 295521752, win 76, options [nop,nop,TS val 4294711868 ecr 4294711858], length 0
11:44:05.230074 IP 10.0.0.2.37651 > vagrant-ubuntu-trusty-64.8882: Flags [P.], seq 295521752:295521916, ack 564117090, win 58, options [nop,nop,TS val 4294711877 ecr 4294711847], length 164
11:44:05.230095 IP vagrant-ubuntu-trusty-64.8882 > 10.0.0.2.37651: Flags [.], ack 295521916, win 78, options [nop,nop,TS val 4294711887 ecr 4294711877], length 0
11:44:05.250204 IP 10.0.0.2.37651 > vagrant-ubuntu-trusty-64.8882: Flags [P.], seq 295521916:295522080, ack 564117090, win 58, options [nop,nop,TS val 4294711897 ecr 4294711868], length 164
11:44:05.250218 IP vagrant-ubuntu-trusty-64.8882 > 10.0.0.2.37651: Flags [.], ack 295522080, win 80, options [nop,nop,TS val 4294711908 ecr 4294711897], length 0
11:44:05.274849 IP 10.0.0.2.37651 > vagrant-ubuntu-trusty-64.8882: Flags [P.], seq 295522080:295522244, ack 564117090, win 58, options [nop,nop,TS val 4294711917 ecr 4294711887], length 164
11:44:05.274868 IP vagrant-ubuntu-trusty-64.8882 > 10.0.0.2.37651: Flags [.], ack 295522244, win 82, options [nop,nop,TS val 4294711932 ecr 4294711917], length 0
11:44:05.303159 IP 10.0.0.2.37651 > vagrant-ubuntu-trusty-64.8882: Flags [P.], seq 295522244:295522408, ack 564117090, win 58, options [nop,nop,TS val 4294711937 ecr 4294711908], length 164
11:44:05.303248 IP vagrant-ubuntu-trusty-64.8882 > 10.0.0.2.37651: Flags [.], ack 295522408, win 84, options [nop,nop,TS val 4294711960 ecr 4294711937], length 0
11:44:05.330067 IP 10.0.0.2.37651 > vagrant-ubuntu-trusty-64.8882: Flags [P.], seq 295522408:295522572, ack 564117090, win 58, options [nop,nop,TS val 4294711957 ecr 4294711932], length 164
11:44:05.330082 IP vagrant-ubuntu-trusty-64.8882 > 10.0.0.2.37651: Flags [.], ack 295522572, win 86, options [nop,nop,TS val 4294711987 ecr 4294711957], length 0
11:44:05.382163 IP 10.0.0.2.37651 > vagrant-ubuntu-trusty-64.8882: Flags [P.], seq 295522736:295522900, ack 564117090, win 58, options [nop,nop,TS val 4294711997 ecr 4294711960], length 164
11:44:05.382186 IP vagrant-ubuntu-trusty-64.8882 > 10.0.0.2.37651: Flags [.], ack 295522572, win 88, options [nop,nop,TS val 4294712040 ecr 4294711957,nop,nop,sack 1 {295522736:295522900}], length 0
11:44:05.409274 IP 10.0.0.2.37651 > vagrant-ubuntu-trusty-64.8882: Flags [P.], seq 295523064:295523228, ack 564117090, win 58, options [nop,nop,TS val 4294712037 ecr 4294711987], length 164
11:44:05.409291 IP vagrant-ubuntu-trusty-64.8882 > 10.0.0.2.37651: Flags [.], ack 295522572, win 91, options [nop,nop,TS val 4294712067 ecr 4294711957,nop,nop,sack 2 {295523064:295523228}{295522736:295522900}], length 0
11:44:05.420501 IP 10.0.0.2.37651 > vagrant-ubuntu-trusty-64.8882: Flags [P.], seq 295523228:295523392, ack 564117090, win 58, options [nop,nop,TS val 4294712058 ecr 4294712040], length 164
11:44:05.420563 IP vagrant-ubuntu-trusty-64.8882 > 10.0.0.2.37651: Flags [.], ack 295522572, win 93, options [nop,nop,TS val 4294712078 ecr 4294711957,nop,nop,sack 2 {295523064:295523392}{295522736:295522900}], length 0
11:44:05.443401 IP 10.0.0.2.37651 > vagrant-ubuntu-trusty-64.8882: Flags [P.], seq 295522572:295522736, ack 564117090, win 58, options [nop,nop,TS val 4294712076 ecr 4294712067], length 164
11:44:05.443470 IP vagrant-ubuntu-trusty-64.8882 > 10.0.0.2.37651: Flags [.], ack 295522900, win 95, options [nop,nop,TS val 4294712100 ecr 4294712076,nop,nop,sack 1 {295523064:295523392}], length 0
11:44:05.443416 IP 10.0.0.2.37651 > vagrant-ubuntu-trusty-64.8882: Flags [P.], seq 295522900:295523064, ack 564117090, win 58, options [nop,nop,TS val 4294712076 ecr 4294712067], length 164
11:44:05.443482 IP vagrant-ubuntu-trusty-64.8882 > 10.0.0.2.37651: Flags [.], ack 295523392, win 97, options [nop,nop,TS val 4294712100 ecr 4294712076], length 0
11:44:05.457131 IP 10.0.0.2.37651 > vagrant-ubuntu-trusty-64.8882: Flags [P.], seq 295523556:295523720, ack 564117090, win 58, options [nop,nop,TS val 4294712098 ecr 4294712078], length 164
11:44:05.457143 IP vagrant-ubuntu-trusty-64.8882 > 10.0.0.2.37651: Flags [.], ack 295523392, win 99, options [nop,nop,TS val 4294712114 ecr 4294712076,nop,nop,sack 1 {295523556:295523720}], length 0
11:44:05.492153 IP 10.0.0.2.37651 > vagrant-ubuntu-trusty-64.8882: Flags [P.], seq 295523720:295523884, ack 564117090, win 58, options [nop,nop,TS val 4294712117 ecr 4294712100], length 164
11:44:05.492167 IP vagrant-ubuntu-trusty-64.8882 > 10.0.0.2.37651: Flags [.], ack 295523392, win 101, options [nop,nop,TS val 4294712150 ecr 4294712076,nop,nop,sack 1 {295523556:295523884}], length 0
11:44:05.512148 IP 10.0.0.2.37651 > vagrant-ubuntu-trusty-64.8882: Flags [P.], seq 295523884:295524048, ack 564117090, win 58, options [nop,nop,TS val 4294712138 ecr 4294712114], length 164
11:44:05.512169 IP vagrant-ubuntu-trusty-64.8882 > 10.0.0.2.37651: Flags [.], ack 295523392, win 103, options [nop,nop,TS val 4294712170 ecr 4294712076,nop,nop,sack 1 {295523556:295524048}], length 0
11:44:05.531213 IP 10.0.0.2.37651 > vagrant-ubuntu-trusty-64.8882: Flags [P.], seq 295524212:295524376, ack 564117090, win 58, options [nop,nop,TS val 4294712178 ecr 4294712150], length 164
11:44:05.531301 IP vagrant-ubuntu-trusty-64.8882 > 10.0.0.2.37651: Flags [.], ack 295523392, win 105, options [nop,nop,TS val 4294712188 ecr 4294712076,nop,nop,sack 2 {295524212:295524376}{295523556:295524048}], length 0
11:44:05.532366 IP 10.0.0.2.37651 > vagrant-ubuntu-trusty-64.8882: Flags [P.], seq 295523392:295523556, ack 564117090, win 58, options [nop,nop,TS val 4294712180 ecr 4294712170], length 164
11:44:05.532389 IP vagrant-ubuntu-trusty-64.8882 > 10.0.0.2.37651: Flags [.], ack 295524048, win 107, options [nop,nop,TS val 4294712190 ecr 4294712180,nop,nop,sack 1 {295524212:295524376}], length 0
11:44:05.553270 IP 10.0.0.2.37651 > vagrant-ubuntu-trusty-64.8882: Flags [P.], seq 295524376:295524540, ack 564117090, win 58, options [nop,nop,TS val 4294712197 ecr 4294712170], length 164
11:44:05.553345 IP vagrant-ubuntu-trusty-64.8882 > 10.0.0.2.37651: Flags [.], ack 295524048, win 109, options [nop,nop,TS val 4294712210 ecr 4294712180,nop,nop,sack 1 {295524212:295524540}], length 0
11:44:05.555962 IP 10.0.0.2.37651 > vagrant-ubuntu-trusty-64.8882: Flags [P.], seq 295524048:295524212, ack 564117090, win 58, options [nop,nop,TS val 4294712199 ecr 4294712188], length 164
11:44:05.555979 IP vagrant-ubuntu-trusty-64.8882 > 10.0.0.2.37651: Flags [.], ack 295524540, win 111, options [nop,nop,TS val 4294712213 ecr 4294712199], length 0
11:44:05.578331 IP 10.0.0.2.37651 > vagrant-ubuntu-trusty-64.8882: Flags [P.], seq 295524540:295524704, ack 564117090, win 58, options [nop,nop,TS val 4294712218 ecr 4294712190], length 164
11:44:05.578379 IP vagrant-ubuntu-trusty-64.8882 > 10.0.0.2.37651: Flags [.], ack 295524704, win 114, options [nop,nop,TS val 4294712235 ecr 4294712218], length 0
11:44:05.625322 IP 10.0.0.2.37651 > vagrant-ubuntu-trusty-64.8882: Flags [P.], seq 295524868:295525032, ack 564117090, win 58, options [nop,nop,TS val 4294712257 ecr 4294712235], length 164
11:44:05.625356 IP vagrant-ubuntu-trusty-64.8882 > 10.0.0.2.37651: Flags [.], ack 295524704, win 116, options [nop,nop,TS val 4294712283 ecr 4294712218,nop,nop,sack 1 {295524868:295525032}], length 0
11:44:05.645441 IP 10.0.0.2.37651 > vagrant-ubuntu-trusty-64.8882: Flags [P.], seq 295525032:295525196, ack 564117090, win 58, options [nop,nop,TS val 4294712278 ecr 4294712235], length 164
11:44:05.645496 IP vagrant-ubuntu-trusty-64.8882 > 10.0.0.2.37651: Flags [.], ack 295524704, win 118, options [nop,nop,TS val 4294712303 ecr 4294712218,nop,nop,sack 1 {295524868:295525196}], length 0
11:44:05.664166 IP 10.0.0.2.37651 > vagrant-ubuntu-trusty-64.8882: Flags [P.], seq 295525196:295525360, ack 564117090, win 58, options [nop,nop,TS val 4294712298 ecr 4294712283], length 164
11:44:05.664247 IP vagrant-ubuntu-trusty-64.8882 > 10.0.0.2.37651: Flags [.], ack 295524704, win 120, options [nop,nop,TS val 4294712321 ecr 4294712218,nop,nop,sack 1 {295524868:295525360}], length 0
11:44:05.678884 IP 10.0.0.2.37651 > vagrant-ubuntu-trusty-64.8882: Flags [P.], seq 295525360:295525524, ack 564117090, win 58, options [nop,nop,TS val 4294712317 ecr 4294712303], length 164
11:44:05.678896 IP vagrant-ubuntu-trusty-64.8882 > 10.0.0.2.37651: Flags [.], ack 295524704, win 122, options [nop,nop,TS val 4294712336 ecr 4294712218,nop,nop,sack 1 {295524868:295525524}], length 0
11:44:05.692759 IP 10.0.0.2.37651 > vagrant-ubuntu-trusty-64.8882: Flags [P.], seq 295524704:295524868, ack 564117090, win 58, options [nop,nop,TS val 4294712332 ecr 4294712321], length 164
11:44:05.692777 IP vagrant-ubuntu-trusty-64.8882 > 10.0.0.2.37651: Flags [.], ack 295525524, win 124, options [nop,nop,TS val 4294712350 ecr 4294712332], length 0
11:44:05.699109 IP 10.0.0.2.37651 > vagrant-ubuntu-trusty-64.8882: Flags [P.], seq 295525524:295525688, ack 564117090, win 58, options [nop,nop,TS val 4294712338 ecr 4294712321], length 164
11:44:05.699137 IP vagrant-ubuntu-trusty-64.8882 > 10.0.0.2.37651: Flags [.], ack 295525688, win 126, options [nop,nop,TS val 4294712356 ecr 4294712338], length 0
11:44:05.714652 IP 10.0.0.2.37651 > vagrant-ubuntu-trusty-64.8882: Flags [P.], seq 295525688:295525852, ack 564117090, win 58, options [nop,nop,TS val 4294712358 ecr 4294712336], length 164
11:44:05.714704 IP vagrant-ubuntu-trusty-64.8882 > 10.0.0.2.37651: Flags [.], ack 295525852, win 128, options [nop,nop,TS val 4294712372 ecr 4294712358], length 0
11:44:05.733686 IP 10.0.0.2.37651 > vagrant-ubuntu-trusty-64.8882: Flags [P.], seq 295525852:295526016, ack 564117090, win 58, options [nop,nop,TS val 4294712378 ecr 4294712356], length 164
11:44:05.733731 IP vagrant-ubuntu-trusty-64.8882 > 10.0.0.2.37651: Flags [.], ack 295526016, win 130, options [nop,nop,TS val 4294712391 ecr 4294712378], length 0
11:44:05.755491 IP 10.0.0.2.37651 > vagrant-ubuntu-trusty-64.8882: Flags [P.], seq 295526016:295526180, ack 564117090, win 58, options [nop,nop,TS val 4294712397 ecr 4294712372], length 164
11:44:05.755546 IP vagrant-ubuntu-trusty-64.8882 > 10.0.0.2.37651: Flags [.], ack 295526180, win 132, options [nop,nop,TS val 4294712413 ecr 4294712397], length 0
11:44:05.776367 IP 10.0.0.2.37651 > vagrant-ubuntu-trusty-64.8882: Flags [P.], seq 295526180:295526344, ack 564117090, win 58, options [nop,nop,TS val 4294712418 ecr 4294712391], length 164
11:44:05.776420 IP vagrant-ubuntu-trusty-64.8882 > 10.0.0.2.37651: Flags [.], ack 295526344, win 135, options [nop,nop,TS val 4294712433 ecr 4294712418], length 0
11:44:05.794488 IP 10.0.0.2.37651 > vagrant-ubuntu-trusty-64.8882: Flags [P.], seq 295526344:295526508, ack 564117090, win 58, options [nop,nop,TS val 4294712438 ecr 4294712413], length 164
11:44:05.794509 IP vagrant-ubuntu-trusty-64.8882 > 10.0.0.2.37651: Flags [.], ack 295526508, win 137, options [nop,nop,TS val 4294712452 ecr 4294712438], length 0
11:44:05.816460 IP 10.0.0.2.37651 > vagrant-ubuntu-trusty-64.8882: Flags [P.], seq 295526508:295526672, ack 564117090, win 58, options [nop,nop,TS val 4294712458 ecr 4294712433], length 164
11:44:05.816482 IP vagrant-ubuntu-trusty-64.8882 > 10.0.0.2.37651: Flags [.], ack 295526672, win 139, options [nop,nop,TS val 4294712474 ecr 4294712458], length 0
11:44:05.835226 IP 10.0.0.2.37651 > vagrant-ubuntu-trusty-64.8882: Flags [P.], seq 295526672:295526836, ack 564117090, win 58, options [nop,nop,TS val 4294712478 ecr 4294712452], length 164
11:44:05.835310 IP vagrant-ubuntu-trusty-64.8882 > 10.0.0.2.37651: Flags [.], ack 295526836, win 141, options [nop,nop,TS val 4294712492 ecr 4294712478], length 0
11:44:05.856350 IP 10.0.0.2.37651 > vagrant-ubuntu-trusty-64.8882: Flags [P.], seq 295526836:295527000, ack 564117090, win 58, options [nop,nop,TS val 4294712498 ecr 4294712474], length 164
11:44:05.856412 IP vagrant-ubuntu-trusty-64.8882 > 10.0.0.2.37651: Flags [.], ack 295527000, win 143, options [nop,nop,TS val 4294712513 ecr 4294712498], length 0
11:44:05.874371 IP 10.0.0.2.37651 > vagrant-ubuntu-trusty-64.8882: Flags [P.], seq 295527000:295527164, ack 564117090, win 58, options [nop,nop,TS val 4294712517 ecr 4294712492], length 164
11:44:05.874411 IP vagrant-ubuntu-trusty-64.8882 > 10.0.0.2.37651: Flags [.], ack 295527164, win 145, options [nop,nop,TS val 4294712532 ecr 4294712517], length 0
11:44:05.896433 IP 10.0.0.2.37651 > vagrant-ubuntu-trusty-64.8882: Flags [P.], seq 295527164:295527328, ack 564117090, win 58, options [nop,nop,TS val 4294712538 ecr 4294712513], length 164
11:44:05.896523 IP vagrant-ubuntu-trusty-64.8882 > 10.0.0.2.37651: Flags [.], ack 295527328, win 147, options [nop,nop,TS val 4294712553 ecr 4294712538], length 0
11:44:05.914572 IP 10.0.0.2.37651 > vagrant-ubuntu-trusty-64.8882: Flags [P.], seq 295527328:295527492, ack 564117090, win 58, options [nop,nop,TS val 4294712557 ecr 4294712532], length 164
11:44:05.914650 IP vagrant-ubuntu-trusty-64.8882 > 10.0.0.2.37651: Flags [.], ack 295527492, win 149, options [nop,nop,TS val 4294712572 ecr 4294712557], length 0
11:44:05.935531 IP 10.0.0.2.37651 > vagrant-ubuntu-trusty-64.8882: Flags [P.], seq 295527492:295527656, ack 564117090, win 58, options [nop,nop,TS val 4294712578 ecr 4294712553], length 164
11:44:05.935546 IP vagrant-ubuntu-trusty-64.8882 > 10.0.0.2.37651: Flags [.], ack 295527656, win 151, options [nop,nop,TS val 4294712593 ecr 4294712578], length 0
11:44:05.957595 IP 10.0.0.2.37651 > vagrant-ubuntu-trusty-64.8882: Flags [P.], seq 295527656:295527820, ack 564117090, win 58, options [nop,nop,TS val 4294712597 ecr 4294712572], length 164
11:44:05.957659 IP vagrant-ubuntu-trusty-64.8882 > 10.0.0.2.37651: Flags [.], ack 295527820, win 153, options [nop,nop,TS val 4294712614 ecr 4294712597], length 0
11:44:05.975380 IP 10.0.0.2.37651 > vagrant-ubuntu-trusty-64.8882: Flags [P.], seq 295527820:295527984, ack 564117090, win 58, options [nop,nop,TS val 4294712618 ecr 4294712593], length 164
11:44:05.975400 IP vagrant-ubuntu-trusty-64.8882 > 10.0.0.2.37651: Flags [.], ack 295527984, win 155, options [nop,nop,TS val 4294712633 ecr 4294712618], length 0
11:44:05.997502 IP 10.0.0.2.37651 > vagrant-ubuntu-trusty-64.8882: Flags [P.], seq 295527984:295528148, ack 564117090, win 58, options [nop,nop,TS val 4294712638 ecr 4294712614], length 164
11:44:05.997589 IP vagrant-ubuntu-trusty-64.8882 > 10.0.0.2.37651: Flags [.], ack 295528148, win 158, options [nop,nop,TS val 4294712654 ecr 4294712638], length 0
11:44:06.015610 IP 10.0.0.2.37651 > vagrant-ubuntu-trusty-64.8882: Flags [P.], seq 295528148:295528312, ack 564117090, win 58, options [nop,nop,TS val 4294712658 ecr 4294712633], length 164
11:44:06.015668 IP vagrant-ubuntu-trusty-64.8882 > 10.0.0.2.37651: Flags [.], ack 295528312, win 160, options [nop,nop,TS val 4294712673 ecr 4294712658], length 0
11:44:06.040608 IP 10.0.0.2.37651 > vagrant-ubuntu-trusty-64.8882: Flags [P.], seq 295528312:295528476, ack 564117090, win 58, options [nop,nop,TS val 4294712678 ecr 4294712654], length 164
11:44:06.040676 IP vagrant-ubuntu-trusty-64.8882 > 10.0.0.2.37651: Flags [.], ack 295528476, win 162, options [nop,nop,TS val 4294712698 ecr 4294712678], length 0
11:44:06.061664 IP 10.0.0.2.37651 > vagrant-ubuntu-trusty-64.8882: Flags [P.], seq 295528476:295528640, ack 564117090, win 58, options [nop,nop,TS val 4294712698 ecr 4294712673], length 164
11:44:06.061686 IP vagrant-ubuntu-trusty-64.8882 > 10.0.0.2.37651: Flags [.], ack 295528640, win 164, options [nop,nop,TS val 4294712719 ecr 4294712698], length 0
11:44:06.079546 IP 10.0.0.2.37651 > vagrant-ubuntu-trusty-64.8882: Flags [P.], seq 295528640:295528804, ack 564117090, win 58, options [nop,nop,TS val 4294712717 ecr 4294712698], length 164
11:44:06.079580 IP vagrant-ubuntu-trusty-64.8882 > 10.0.0.2.37651: Flags [.], ack 295528804, win 166, options [nop,nop,TS val 4294712737 ecr 4294712717], length 0
11:44:06.098555 IP 10.0.0.2.37651 > vagrant-ubuntu-trusty-64.8882: Flags [P.], seq 295528804:295528968, ack 564117090, win 58, options [nop,nop,TS val 4294712737 ecr 4294712719], length 164
11:44:06.098644 IP vagrant-ubuntu-trusty-64.8882 > 10.0.0.2.37651: Flags [.], ack 295528968, win 168, options [nop,nop,TS val 4294712755 ecr 4294712737], length 0
11:44:06.119829 IP 10.0.0.2.37651 > vagrant-ubuntu-trusty-64.8882: Flags [P.], seq 295528968:295529132, ack 564117090, win 58, options [nop,nop,TS val 4294712758 ecr 4294712737], length 164
11:44:06.119858 IP vagrant-ubuntu-trusty-64.8882 > 10.0.0.2.37651: Flags [.], ack 295529132, win 170, options [nop,nop,TS val 4294712777 ecr 4294712758], length 0
11:44:06.137700 IP 10.0.0.2.37651 > vagrant-ubuntu-trusty-64.8882: Flags [P.], seq 295529132:295529296, ack 564117090, win 58, options [nop,nop,TS val 4294712777 ecr 4294712755], length 164
11:44:06.137708 IP vagrant-ubuntu-trusty-64.8882 > 10.0.0.2.37651: Flags [.], ack 295529296, win 172, options [nop,nop,TS val 4294712795 ecr 4294712777], length 0
11:44:06.159702 IP 10.0.0.2.37651 > vagrant-ubuntu-trusty-64.8882: Flags [P.], seq 295529296:295529460, ack 564117090, win 58, options [nop,nop,TS val 4294712798 ecr 4294712777], length 164
11:44:06.159762 IP vagrant-ubuntu-trusty-64.8882 > 10.0.0.2.37651: Flags [.], ack 295529460, win 174, options [nop,nop,TS val 4294712817 ecr 4294712798], length 0
11:44:06.177720 IP 10.0.0.2.37651 > vagrant-ubuntu-trusty-64.8882: Flags [P.], seq 295529460:295529624, ack 564117090, win 58, options [nop,nop,TS val 4294712817 ecr 4294712795], length 164
11:44:06.177750 IP vagrant-ubuntu-trusty-64.8882 > 10.0.0.2.37651: Flags [.], ack 295529624, win 176, options [nop,nop,TS val 4294712835 ecr 4294712817], length 0
11:44:06.199540 IP 10.0.0.2.37651 > vagrant-ubuntu-trusty-64.8882: Flags [P.], seq 295529624:295529788, ack 564117090, win 58, options [nop,nop,TS val 4294712838 ecr 4294712817], length 164
11:44:06.199594 IP vagrant-ubuntu-trusty-64.8882 > 10.0.0.2.37651: Flags [.], ack 295529788, win 178, options [nop,nop,TS val 4294712857 ecr 4294712838], length 0
11:44:06.217828 IP 10.0.0.2.37651 > vagrant-ubuntu-trusty-64.8882: Flags [P.], seq 295529788:295529952, ack 564117090, win 58, options [nop,nop,TS val 4294712857 ecr 4294712835], length 164
11:44:06.217892 IP vagrant-ubuntu-trusty-64.8882 > 10.0.0.2.37651: Flags [.], ack 295529952, win 181, options [nop,nop,TS val 4294712875 ecr 4294712857], length 0
11:44:06.241913 IP 10.0.0.2.37651 > vagrant-ubuntu-trusty-64.8882: Flags [P.], seq 295529952:295530116, ack 564117090, win 58, options [nop,nop,TS val 4294712878 ecr 4294712857], length 164
11:44:06.241931 IP vagrant-ubuntu-trusty-64.8882 > 10.0.0.2.37651: Flags [.], ack 295530116, win 183, options [nop,nop,TS val 4294712899 ecr 4294712878], length 0
11:44:06.260818 IP 10.0.0.2.37651 > vagrant-ubuntu-trusty-64.8882: Flags [P.], seq 295530116:295530280, ack 564117090, win 58, options [nop,nop,TS val 4294712897 ecr 4294712875], length 164
11:44:06.260871 IP vagrant-ubuntu-trusty-64.8882 > 10.0.0.2.37651: Flags [.], ack 295530280, win 185, options [nop,nop,TS val 4294712918 ecr 4294712897], length 0
11:44:06.282676 IP 10.0.0.2.37651 > vagrant-ubuntu-trusty-64.8882: Flags [P.], seq 295530280:295530444, ack 564117090, win 58, options [nop,nop,TS val 4294712918 ecr 4294712899], length 164
11:44:06.282758 IP vagrant-ubuntu-trusty-64.8882 > 10.0.0.2.37651: Flags [.], ack 295530444, win 187, options [nop,nop,TS val 4294712940 ecr 4294712918], length 0
11:44:06.300637 IP 10.0.0.2.37651 > vagrant-ubuntu-trusty-64.8882: Flags [P.], seq 295530444:295530608, ack 564117090, win 58, options [nop,nop,TS val 4294712937 ecr 4294712918], length 164
11:44:06.300668 IP vagrant-ubuntu-trusty-64.8882 > 10.0.0.2.37651: Flags [.], ack 295530608, win 189, options [nop,nop,TS val 4294712958 ecr 4294712937], length 0
11:44:06.322723 IP 10.0.0.2.37651 > vagrant-ubuntu-trusty-64.8882: Flags [P.], seq 295530608:295530772, ack 564117090, win 58, options [nop,nop,TS val 4294712957 ecr 4294712940], length 164
11:44:06.322781 IP vagrant-ubuntu-trusty-64.8882 > 10.0.0.2.37651: Flags [.], ack 295530772, win 191, options [nop,nop,TS val 4294712980 ecr 4294712957], length 0
11:44:06.340526 IP 10.0.0.2.37651 > vagrant-ubuntu-trusty-64.8882: Flags [P.], seq 295530772:295530936, ack 564117090, win 58, options [nop,nop,TS val 4294712977 ecr 4294712958], length 164
11:44:06.340558 IP vagrant-ubuntu-trusty-64.8882 > 10.0.0.2.37651: Flags [.], ack 295530936, win 193, options [nop,nop,TS val 4294712998 ecr 4294712977], length 0
11:44:06.362641 IP 10.0.0.2.37651 > vagrant-ubuntu-trusty-64.8882: Flags [P.], seq 295530936:295531100, ack 564117090, win 58, options [nop,nop,TS val 4294712997 ecr 4294712980], length 164
11:44:06.362733 IP vagrant-ubuntu-trusty-64.8882 > 10.0.0.2.37651: Flags [.], ack 295531100, win 195, options [nop,nop,TS val 4294713019 ecr 4294712997], length 0
11:44:06.380229 IP 10.0.0.2.37651 > vagrant-ubuntu-trusty-64.8882: Flags [P.], seq 295531100:295531264, ack 564117090, win 58, options [nop,nop,TS val 4294713017 ecr 4294712998], length 164
11:44:06.380239 IP vagrant-ubuntu-trusty-64.8882 > 10.0.0.2.37651: Flags [.], ack 295531264, win 197, options [nop,nop,TS val 4294713038 ecr 4294713017], length 0
11:44:06.401741 IP 10.0.0.2.37651 > vagrant-ubuntu-trusty-64.8882: Flags [P.], seq 295531264:295531428, ack 564117090, win 58, options [nop,nop,TS val 4294713037 ecr 4294713019], length 164
11:44:06.401758 IP vagrant-ubuntu-trusty-64.8882 > 10.0.0.2.37651: Flags [.], ack 295531428, win 199, options [nop,nop,TS val 4294713059 ecr 4294713037], length 0
11:44:06.423610 IP 10.0.0.2.37651 > vagrant-ubuntu-trusty-64.8882: Flags [P.], seq 295531428:295531592, ack 564117090, win 58, options [nop,nop,TS val 4294713057 ecr 4294713038], length 164
11:44:06.423679 IP vagrant-ubuntu-trusty-64.8882 > 10.0.0.2.37651: Flags [.], ack 295531592, win 202, options [nop,nop,TS val 4294713081 ecr 4294713057], length 0
11:44:06.441907 IP 10.0.0.2.37651 > vagrant-ubuntu-trusty-64.8882: Flags [P.], seq 295531592:295531756, ack 564117090, win 58, options [nop,nop,TS val 4294713077 ecr 4294713059], length 164
11:44:06.441945 IP vagrant-ubuntu-trusty-64.8882 > 10.0.0.2.37651: Flags [.], ack 295531756, win 204, options [nop,nop,TS val 4294713099 ecr 4294713077], length 0
11:44:06.463562 IP 10.0.0.2.37651 > vagrant-ubuntu-trusty-64.8882: Flags [P.], seq 295531756:295531920, ack 564117090, win 58, options [nop,nop,TS val 4294713097 ecr 4294713081], length 164
11:44:06.463605 IP vagrant-ubuntu-trusty-64.8882 > 10.0.0.2.37651: Flags [.], ack 295531920, win 206, options [nop,nop,TS val 4294713121 ecr 4294713097], length 0
11:44:06.484920 IP 10.0.0.2.37651 > vagrant-ubuntu-trusty-64.8882: Flags [P.], seq 295531920:295532084, ack 564117090, win 58, options [nop,nop,TS val 4294713117 ecr 4294713099], length 164
11:44:06.484985 IP vagrant-ubuntu-trusty-64.8882 > 10.0.0.2.37651: Flags [.], ack 295532084, win 208, options [nop,nop,TS val 4294713142 ecr 4294713117], length 0
11:44:06.502830 IP 10.0.0.2.37651 > vagrant-ubuntu-trusty-64.8882: Flags [P.], seq 295532084:295532248, ack 564117090, win 58, options [nop,nop,TS val 4294713137 ecr 4294713121], length 164
11:44:06.502868 IP vagrant-ubuntu-trusty-64.8882 > 10.0.0.2.37651: Flags [.], ack 295532248, win 210, options [nop,nop,TS val 4294713160 ecr 4294713137], length 0
11:44:06.524790 IP 10.0.0.2.37651 > vagrant-ubuntu-trusty-64.8882: Flags [P.], seq 295532248:295532412, ack 564117090, win 58, options [nop,nop,TS val 4294713157 ecr 4294713142], length 164
11:44:06.524858 IP vagrant-ubuntu-trusty-64.8882 > 10.0.0.2.37651: Flags [.], ack 295532412, win 212, options [nop,nop,TS val 4294713182 ecr 4294713157], length 0
11:44:06.542883 IP 10.0.0.2.37651 > vagrant-ubuntu-trusty-64.8882: Flags [P.], seq 295532412:295532576, ack 564117090, win 58, options [nop,nop,TS val 4294713177 ecr 4294713160], length 164
11:44:06.542933 IP vagrant-ubuntu-trusty-64.8882 > 10.0.0.2.37651: Flags [.], ack 295532576, win 214, options [nop,nop,TS val 4294713200 ecr 4294713177], length 0
11:44:06.564733 IP 10.0.0.2.37651 > vagrant-ubuntu-trusty-64.8882: Flags [P.], seq 295532576:295532740, ack 564117090, win 58, options [nop,nop,TS val 4294713197 ecr 4294713182], length 164
11:44:06.564890 IP vagrant-ubuntu-trusty-64.8882 > 10.0.0.2.37651: Flags [.], ack 295532740, win 216, options [nop,nop,TS val 4294713222 ecr 4294713197], length 0
11:44:06.585540 IP 10.0.0.2.37651 > vagrant-ubuntu-trusty-64.8882: Flags [P.], seq 295532740:295532904, ack 564117090, win 58, options [nop,nop,TS val 4294713217 ecr 4294713200], length 164
11:44:06.585570 IP vagrant-ubuntu-trusty-64.8882 > 10.0.0.2.37651: Flags [.], ack 295532904, win 218, options [nop,nop,TS val 4294713243 ecr 4294713217], length 0
11:44:06.603845 IP 10.0.0.2.37651 > vagrant-ubuntu-trusty-64.8882: Flags [P.], seq 295532904:295533068, ack 564117090, win 58, options [nop,nop,TS val 4294713237 ecr 4294713222], length 164
11:44:06.603857 IP vagrant-ubuntu-trusty-64.8882 > 10.0.0.2.37651: Flags [.], ack 295533068, win 220, options [nop,nop,TS val 4294713261 ecr 4294713237], length 0
11:44:06.625483 IP 10.0.0.2.37651 > vagrant-ubuntu-trusty-64.8882: Flags [P.], seq 295533068:295533232, ack 564117090, win 58, options [nop,nop,TS val 4294713257 ecr 4294713243], length 164
11:44:06.625522 IP vagrant-ubuntu-trusty-64.8882 > 10.0.0.2.37651: Flags [.], ack 295533232, win 222, options [nop,nop,TS val 4294713283 ecr 4294713257], length 0
11:44:06.643671 IP 10.0.0.2.37651 > vagrant-ubuntu-trusty-64.8882: Flags [P.], seq 295533232:295533396, ack 564117090, win 58, options [nop,nop,TS val 4294713277 ecr 4294713261], length 164
11:44:06.643687 IP vagrant-ubuntu-trusty-64.8882 > 10.0.0.2.37651: Flags [.], ack 295533396, win 225, options [nop,nop,TS val 4294713301 ecr 4294713277], length 0
11:44:06.665658 IP 10.0.0.2.37651 > vagrant-ubuntu-trusty-64.8882: Flags [P.], seq 295533396:295533560, ack 564117090, win 58, options [nop,nop,TS val 4294713297 ecr 4294713283], length 164
11:44:06.665717 IP vagrant-ubuntu-trusty-64.8882 > 10.0.0.2.37651: Flags [.], ack 295533560, win 227, options [nop,nop,TS val 4294713323 ecr 4294713297], length 0
11:44:06.683867 IP 10.0.0.2.37651 > vagrant-ubuntu-trusty-64.8882: Flags [P.], seq 295533560:295533724, ack 564117090, win 58, options [nop,nop,TS val 4294713317 ecr 4294713301], length 164
11:44:06.683914 IP vagrant-ubuntu-trusty-64.8882 > 10.0.0.2.37651: Flags [.], ack 295533724, win 229, options [nop,nop,TS val 4294713341 ecr 4294713317], length 0
11:44:06.705019 IP 10.0.0.2.37651 > vagrant-ubuntu-trusty-64.8882: Flags [P.], seq 295533724:295533888, ack 564117090, win 58, options [nop,nop,TS val 4294713337 ecr 4294713323], length 164
11:44:06.705050 IP vagrant-ubuntu-trusty-64.8882 > 10.0.0.2.37651: Flags [.], ack 295533888, win 231, options [nop,nop,TS val 4294713362 ecr 4294713337], length 0
11:44:06.726959 IP 10.0.0.2.37651 > vagrant-ubuntu-trusty-64.8882: Flags [P.], seq 295533888:295534052, ack 564117090, win 58, options [nop,nop,TS val 4294713357 ecr 4294713341], length 164
11:44:06.727036 IP vagrant-ubuntu-trusty-64.8882 > 10.0.0.2.37651: Flags [.], ack 295534052, win 233, options [nop,nop,TS val 4294713384 ecr 4294713357], length 0
11:44:06.747868 IP 10.0.0.2.37651 > vagrant-ubuntu-trusty-64.8882: Flags [P.], seq 295534052:295534216, ack 564117090, win 58, options [nop,nop,TS val 4294713377 ecr 4294713362], length 164
11:44:06.747899 IP vagrant-ubuntu-trusty-64.8882 > 10.0.0.2.37651: Flags [.], ack 295534216, win 235, options [nop,nop,TS val 4294713405 ecr 4294713377], length 0
11:44:06.767074 IP 10.0.0.2.37651 > vagrant-ubuntu-trusty-64.8882: Flags [P.], seq 295534216:295534380, ack 564117090, win 58, options [nop,nop,TS val 4294713397 ecr 4294713384], length 164
11:44:06.767161 IP vagrant-ubuntu-trusty-64.8882 > 10.0.0.2.37651: Flags [.], ack 295534380, win 237, options [nop,nop,TS val 4294713424 ecr 4294713397], length 0
11:44:06.788030 IP 10.0.0.2.37651 > vagrant-ubuntu-trusty-64.8882: Flags [P.], seq 295534380:295534544, ack 564117090, win 58, options [nop,nop,TS val 4294713417 ecr 4294713405], length 164
11:44:06.788103 IP vagrant-ubuntu-trusty-64.8882 > 10.0.0.2.37651: Flags [.], ack 295534544, win 239, options [nop,nop,TS val 4294713445 ecr 4294713417], length 0
11:44:06.806080 IP 10.0.0.2.37651 > vagrant-ubuntu-trusty-64.8882: Flags [P.], seq 295534544:295534708, ack 564117090, win 58, options [nop,nop,TS val 4294713437 ecr 4294713424], length 164
11:44:06.806112 IP vagrant-ubuntu-trusty-64.8882 > 10.0.0.2.37651: Flags [.], ack 295534708, win 241, options [nop,nop,TS val 4294713463 ecr 4294713437], length 0
11:44:06.831028 IP 10.0.0.2.37651 > vagrant-ubuntu-trusty-64.8882: Flags [P.], seq 295534708:295534872, ack 564117090, win 58, options [nop,nop,TS val 4294713459 ecr 4294713445], length 164
11:44:06.831102 IP vagrant-ubuntu-trusty-64.8882 > 10.0.0.2.37651: Flags [.], ack 295534872, win 243, options [nop,nop,TS val 4294713488 ecr 4294713459], length 0
11:44:06.845899 IP 10.0.0.2.37651 > vagrant-ubuntu-trusty-64.8882: Flags [P.], seq 295534872:295535036, ack 564117090, win 58, options [nop,nop,TS val 4294713477 ecr 4294713463], length 164
11:44:06.845930 IP vagrant-ubuntu-trusty-64.8882 > 10.0.0.2.37651: Flags [.], ack 295535036, win 245, options [nop,nop,TS val 4294713503 ecr 4294713477], length 0
11:44:06.867878 IP 10.0.0.2.37651 > vagrant-ubuntu-trusty-64.8882: Flags [P.], seq 295535036:295535200, ack 564117090, win 58, options [nop,nop,TS val 4294713497 ecr 4294713463], length 164
11:44:06.867967 IP vagrant-ubuntu-trusty-64.8882 > 10.0.0.2.37651: Flags [.], ack 295535200, win 248, options [nop,nop,TS val 4294713525 ecr 4294713497], length 0
11:44:06.888747 IP 10.0.0.2.37651 > vagrant-ubuntu-trusty-64.8882: Flags [P.], seq 295535200:295535364, ack 564117090, win 58, options [nop,nop,TS val 4294713517 ecr 4294713503], length 164
11:44:06.888777 IP vagrant-ubuntu-trusty-64.8882 > 10.0.0.2.37651: Flags [.], ack 295535364, win 250, options [nop,nop,TS val 4294713546 ecr 4294713517], length 0
11:44:06.907145 IP 10.0.0.2.37651 > vagrant-ubuntu-trusty-64.8882: Flags [P.], seq 295535364:295535528, ack 564117090, win 58, options [nop,nop,TS val 4294713538 ecr 4294713525], length 164
11:44:06.907177 IP vagrant-ubuntu-trusty-64.8882 > 10.0.0.2.37651: Flags [.], ack 295535528, win 252, options [nop,nop,TS val 4294713564 ecr 4294713538], length 0
11:44:06.928945 IP 10.0.0.2.37651 > vagrant-ubuntu-trusty-64.8882: Flags [P.], seq 295535528:295535692, ack 564117090, win 58, options [nop,nop,TS val 4294713557 ecr 4294713546], length 164
11:44:06.929000 IP vagrant-ubuntu-trusty-64.8882 > 10.0.0.2.37651: Flags [.], ack 295535692, win 254, options [nop,nop,TS val 4294713586 ecr 4294713557], length 0
11:44:06.946991 IP 10.0.0.2.37651 > vagrant-ubuntu-trusty-64.8882: Flags [P.], seq 295535692:295535856, ack 564117090, win 58, options [nop,nop,TS val 4294713578 ecr 4294713564], length 164
11:44:06.947023 IP vagrant-ubuntu-trusty-64.8882 > 10.0.0.2.37651: Flags [.], ack 295535856, win 256, options [nop,nop,TS val 4294713604 ecr 4294713578], length 0
11:44:06.968935 IP 10.0.0.2.37651 > vagrant-ubuntu-trusty-64.8882: Flags [P.], seq 295535856:295536020, ack 564117090, win 58, options [nop,nop,TS val 4294713597 ecr 4294713586], length 164
11:44:06.969026 IP vagrant-ubuntu-trusty-64.8882 > 10.0.0.2.37651: Flags [.], ack 295536020, win 258, options [nop,nop,TS val 4294713626 ecr 4294713597], length 0
11:44:06.986775 IP 10.0.0.2.37651 > vagrant-ubuntu-trusty-64.8882: Flags [P.], seq 295536020:295536184, ack 564117090, win 58, options [nop,nop,TS val 4294713618 ecr 4294713604], length 164
11:44:06.986790 IP vagrant-ubuntu-trusty-64.8882 > 10.0.0.2.37651: Flags [.], ack 295536184, win 260, options [nop,nop,TS val 4294713644 ecr 4294713618], length 0
11:44:07.011992 IP 10.0.0.2.37651 > vagrant-ubuntu-trusty-64.8882: Flags [P.], seq 295536184:295536348, ack 564117090, win 58, options [nop,nop,TS val 4294713637 ecr 4294713626], length 164
11:44:07.012079 IP vagrant-ubuntu-trusty-64.8882 > 10.0.0.2.37651: Flags [.], ack 295536348, win 262, options [nop,nop,TS val 4294713669 ecr 4294713637], length 0
11:44:07.030183 IP 10.0.0.2.37651 > vagrant-ubuntu-trusty-64.8882: Flags [P.], seq 295536348:295536512, ack 564117090, win 58, options [nop,nop,TS val 4294713657 ecr 4294713644], length 164
11:44:07.030251 IP vagrant-ubuntu-trusty-64.8882 > 10.0.0.2.37651: Flags [.], ack 295536512, win 264, options [nop,nop,TS val 4294713687 ecr 4294713657], length 0
11:44:07.051181 IP 10.0.0.2.37651 > vagrant-ubuntu-trusty-64.8882: Flags [P.], seq 295536512:295536676, ack 564117090, win 58, options [nop,nop,TS val 4294713677 ecr 4294713644], length 164
11:44:07.051213 IP vagrant-ubuntu-trusty-64.8882 > 10.0.0.2.37651: Flags [.], ack 295536676, win 266, options [nop,nop,TS val 4294713708 ecr 4294713677], length 0
11:44:07.070049 IP 10.0.0.2.37651 > vagrant-ubuntu-trusty-64.8882: Flags [P.], seq 295536676:295536840, ack 564117090, win 58, options [nop,nop,TS val 4294713697 ecr 4294713669], length 164
11:44:07.070128 IP vagrant-ubuntu-trusty-64.8882 > 10.0.0.2.37651: Flags [.], ack 295536840, win 269, options [nop,nop,TS val 4294713727 ecr 4294713697], length 0
11:44:07.090980 IP 10.0.0.2.37651 > vagrant-ubuntu-trusty-64.8882: Flags [P.], seq 295536840:295537004, ack 564117090, win 58, options [nop,nop,TS val 4294713717 ecr 4294713687], length 164
11:44:07.091005 IP vagrant-ubuntu-trusty-64.8882 > 10.0.0.2.37651: Flags [.], ack 295537004, win 271, options [nop,nop,TS val 4294713748 ecr 4294713717], length 0
11:44:07.110008 IP 10.0.0.2.37651 > vagrant-ubuntu-trusty-64.8882: Flags [P.], seq 295537004:295537168, ack 564117090, win 58, options [nop,nop,TS val 4294713737 ecr 4294713708], length 164
11:44:07.110093 IP vagrant-ubuntu-trusty-64.8882 > 10.0.0.2.37651: Flags [.], ack 295537168, win 273, options [nop,nop,TS val 4294713767 ecr 4294713737], length 0
11:44:07.131196 IP 10.0.0.2.37651 > vagrant-ubuntu-trusty-64.8882: Flags [P.], seq 295537168:295537332, ack 564117090, win 58, options [nop,nop,TS val 4294713757 ecr 4294713727], length 164
11:44:07.131217 IP vagrant-ubuntu-trusty-64.8882 > 10.0.0.2.37651: Flags [.], ack 295537332, win 275, options [nop,nop,TS val 4294713789 ecr 4294713757], length 0
11:44:07.149351 IP 10.0.0.2.37651 > vagrant-ubuntu-trusty-64.8882: Flags [P.], seq 295537332:295537496, ack 564117090, win 58, options [nop,nop,TS val 4294713777 ecr 4294713748], length 164
11:44:07.149378 IP vagrant-ubuntu-trusty-64.8882 > 10.0.0.2.37651: Flags [.], ack 295537496, win 277, options [nop,nop,TS val 4294713807 ecr 4294713777], length 0
11:44:07.170686 IP 10.0.0.2.37651 > vagrant-ubuntu-trusty-64.8882: Flags [P.], seq 295537496:295537660, ack 564117090, win 58, options [nop,nop,TS val 4294713798 ecr 4294713767], length 164
11:44:07.170702 IP vagrant-ubuntu-trusty-64.8882 > 10.0.0.2.37651: Flags [.], ack 295537660, win 279, options [nop,nop,TS val 4294713828 ecr 4294713798], length 0
11:44:07.192816 IP 10.0.0.2.37651 > vagrant-ubuntu-trusty-64.8882: Flags [P.], seq 295537660:295537824, ack 564117090, win 58, options [nop,nop,TS val 4294713817 ecr 4294713807], length 164
11:44:07.192905 IP vagrant-ubuntu-trusty-64.8882 > 10.0.0.2.37651: Flags [.], ack 295537824, win 281, options [nop,nop,TS val 4294713850 ecr 4294713817], length 0
11:44:07.210491 IP 10.0.0.2.37651 > vagrant-ubuntu-trusty-64.8882: Flags [P.], seq 295537824:295537988, ack 564117090, win 58, options [nop,nop,TS val 4294713837 ecr 4294713807], length 164
11:44:07.210501 IP vagrant-ubuntu-trusty-64.8882 > 10.0.0.2.37651: Flags [.], ack 295537988, win 283, options [nop,nop,TS val 4294713868 ecr 4294713837], length 0
11:44:07.232025 IP 10.0.0.2.37651 > vagrant-ubuntu-trusty-64.8882: Flags [P.], seq 295537988:295538152, ack 564117090, win 58, options [nop,nop,TS val 4294713857 ecr 4294713828], length 164
11:44:07.232052 IP vagrant-ubuntu-trusty-64.8882 > 10.0.0.2.37651: Flags [.], ack 295538152, win 285, options [nop,nop,TS val 4294713889 ecr 4294713857], length 0
11:44:07.250407 IP 10.0.0.2.37651 > vagrant-ubuntu-trusty-64.8882: Flags [P.], seq 295538152:295538316, ack 564117090, win 58, options [nop,nop,TS val 4294713877 ecr 4294713850], length 164
11:44:07.250434 IP vagrant-ubuntu-trusty-64.8882 > 10.0.0.2.37651: Flags [.], ack 295538316, win 287, options [nop,nop,TS val 4294713908 ecr 4294713877], length 0
11:44:07.272283 IP 10.0.0.2.37651 > vagrant-ubuntu-trusty-64.8882: Flags [P.], seq 295538316:295538480, ack 564117090, win 58, options [nop,nop,TS val 4294713897 ecr 4294713868], length 164
11:44:07.272352 IP vagrant-ubuntu-trusty-64.8882 > 10.0.0.2.37651: Flags [.], ack 295538480, win 289, options [nop,nop,TS val 4294713929 ecr 4294713897], length 0
11:44:07.291094 IP 10.0.0.2.37651 > vagrant-ubuntu-trusty-64.8882: Flags [P.], seq 295538480:295538644, ack 564117090, win 58, options [nop,nop,TS val 4294713918 ecr 4294713889], length 164
11:44:07.291181 IP vagrant-ubuntu-trusty-64.8882 > 10.0.0.2.37651: Flags [.], ack 295538644, win 292, options [nop,nop,TS val 4294713948 ecr 4294713918], length 0
11:44:07.315371 IP 10.0.0.2.37651 > vagrant-ubuntu-trusty-64.8882: Flags [P.], seq 295538644:295538808, ack 564117090, win 58, options [nop,nop,TS val 4294713938 ecr 4294713908], length 164
11:44:07.315425 IP vagrant-ubuntu-trusty-64.8882 > 10.0.0.2.37651: Flags [.], ack 295538808, win 294, options [nop,nop,TS val 4294713973 ecr 4294713938], length 0
11:44:07.333014 IP 10.0.0.2.37651 > vagrant-ubuntu-trusty-64.8882: Flags [P.], seq 295538808:295538972, ack 564117090, win 58, options [nop,nop,TS val 4294713958 ecr 4294713929], length 164
11:44:07.333030 IP vagrant-ubuntu-trusty-64.8882 > 10.0.0.2.37651: Flags [.], ack 295538972, win 296, options [nop,nop,TS val 4294713990 ecr 4294713958], length 0
11:44:07.355167 IP 10.0.0.2.37651 > vagrant-ubuntu-trusty-64.8882: Flags [P.], seq 295538972:295539136, ack 564117090, win 58, options [nop,nop,TS val 4294713978 ecr 4294713948], length 164
