11:56:33.154838 IP vagrant-ubuntu-trusty-64.54459 > 10.0.0.1.8882: Flags [P.], seq 1882962278:1882962442, ack 3008757535, win 58, options [nop,nop,TS val 4294712751 ecr 4294712721], length 164
11:56:33.155061 IP 10.0.0.1.8882 > vagrant-ubuntu-trusty-64.54459: Flags [.], ack 1882962278, win 61, options [nop,nop,TS val 4294712741 ecr 4294712731], length 0
11:56:33.174877 IP vagrant-ubuntu-trusty-64.54459 > 10.0.0.1.8882: Flags [P.], seq 1882962442:1882962606, ack 3008757535, win 58, options [nop,nop,TS val 4294712771 ecr 4294712741], length 164
11:56:33.175275 IP 10.0.0.1.8882 > vagrant-ubuntu-trusty-64.54459: Flags [.], ack 1882962442, win 63, options [nop,nop,TS val 4294712761 ecr 4294712751], length 0
11:56:33.194496 IP vagrant-ubuntu-trusty-64.54459 > 10.0.0.1.8882: Flags [P.], seq 1882962606:1882962770, ack 3008757535, win 58, options [nop,nop,TS val 4294712791 ecr 4294712761], length 164
11:56:33.195839 IP 10.0.0.1.8882 > vagrant-ubuntu-trusty-64.54459: Flags [.], ack 1882962606, win 65, options [nop,nop,TS val 4294712781 ecr 4294712771], length 0
11:56:33.214740 IP vagrant-ubuntu-trusty-64.54459 > 10.0.0.1.8882: Flags [P.], seq 1882962770:1882962934, ack 3008757535, win 58, options [nop,nop,TS val 4294712811 ecr 4294712781], length 164
11:56:33.215285 IP 10.0.0.1.8882 > vagrant-ubuntu-trusty-64.54459: Flags [.], ack 1882962770, win 68, options [nop,nop,TS val 4294712801 ecr 4294712791], length 0
11:56:33.235255 IP 10.0.0.1.8882 > vagrant-ubuntu-trusty-64.54459: Flags [.], ack 1882962934, win 70, options [nop,nop,TS val 4294712821 ecr 4294712811], length 0
11:56:33.235470 IP vagrant-ubuntu-trusty-64.54459 > 10.0.0.1.8882: Flags [P.], seq 1882962934:1882963098, ack 3008757535, win 58, options [nop,nop,TS val 4294712832 ecr 4294712821], length 164
11:56:33.255098 IP vagrant-ubuntu-trusty-64.54459 > 10.0.0.1.8882: Flags [P.], seq 1882963098:1882963262, ack 3008757535, win 58, options [nop,nop,TS val 4294712851 ecr 4294712821], length 164
11:56:33.256023 IP 10.0.0.1.8882 > vagrant-ubuntu-trusty-64.54459: Flags [.], ack 1882963098, win 72, options [nop,nop,TS val 4294712842 ecr 4294712832], length 0
11:56:33.274935 IP vagrant-ubuntu-trusty-64.54459 > 10.0.0.1.8882: Flags [P.], seq 1882963262:1882963426, ack 3008757535, win 58, options [nop,nop,TS val 4294712871 ecr 4294712842], length 164
11:56:33.275480 IP 10.0.0.1.8882 > vagrant-ubuntu-trusty-64.54459: Flags [.], ack 1882963262, win 74, options [nop,nop,TS val 4294712862 ecr 4294712851], length 0
11:56:33.294621 IP vagrant-ubuntu-trusty-64.54459 > 10.0.0.1.8882: Flags [P.], seq 1882963426:1882963590, ack 3008757535, win 58, options [nop,nop,TS val 4294712891 ecr 4294712862], length 164
11:56:33.297442 IP 10.0.0.1.8882 > vagrant-ubuntu-trusty-64.54459: Flags [.], ack 1882963426, win 76, options [nop,nop,TS val 4294712882 ecr 4294712871], length 0
11:56:33.314508 IP vagrant-ubuntu-trusty-64.54459 > 10.0.0.1.8882: Flags [P.], seq 1882963590:1882963754, ack 3008757535, win 58, options [nop,nop,TS val 4294712911 ecr 4294712882], length 164
11:56:33.331175 IP 10.0.0.1.8882 > vagrant-ubuntu-trusty-64.54459: Flags [.], ack 1882963590, win 78, options [nop,nop,TS val 4294712916 ecr 4294712891], length 0
11:56:33.334544 IP vagrant-ubuntu-trusty-64.54459 > 10.0.0.1.8882: Flags [P.], seq 1882963754:1882963918, ack 3008757535, win 58, options [nop,nop,TS val 4294712931 ecr 4294712916], length 164
11:56:33.354828 IP vagrant-ubuntu-trusty-64.54459 > 10.0.0.1.8882: Flags [P.], seq 1882963918:1882964082, ack 3008757535, win 58, options [nop,nop,TS val 4294712951 ecr 4294712916], length 164
11:56:33.362123 IP 10.0.0.1.8882 > vagrant-ubuntu-trusty-64.54459: Flags [.], ack 1882963754, win 80, options [nop,nop,TS val 4294712947 ecr 4294712911], length 0
11:56:33.374537 IP vagrant-ubuntu-trusty-64.54459 > 10.0.0.1.8882: Flags [P.], seq 1882964082:1882964246, ack 3008757535, win 58, options [nop,nop,TS val 4294712971 ecr 4294712947], length 164
11:56:33.394722 IP vagrant-ubuntu-trusty-64.54459 > 10.0.0.1.8882: Flags [P.], seq 1882964246:1882964410, ack 3008757535, win 58, options [nop,nop,TS val 4294712991 ecr 4294712947], length 164
11:56:33.406407 IP 10.0.0.1.8882 > vagrant-ubuntu-trusty-64.54459: Flags [.], ack 1882963754, win 82, options [nop,nop,TS val 4294712992 ecr 4294712911,nop,nop,sack 1 {1882963918:1882964082}], length 0
11:56:33.414750 IP vagrant-ubuntu-trusty-64.54459 > 10.0.0.1.8882: Flags [P.], seq 1882964410:1882964574, ack 3008757535, win 58, options [nop,nop,TS val 4294713011 ecr 4294712992], length 164
11:56:33.434566 IP vagrant-ubuntu-trusty-64.54459 > 10.0.0.1.8882: Flags [P.], seq 1882964574:1882964738, ack 3008757535, win 58, options [nop,nop,TS val 4294713031 ecr 4294712992], length 164
11:56:33.455747 IP vagrant-ubuntu-trusty-64.54459 > 10.0.0.1.8882: Flags [P.], seq 1882964738:1882964902, ack 3008757535, win 58, options [nop,nop,TS val 4294713052 ecr 4294712992], length 164
11:56:33.468558 IP 10.0.0.1.8882 > vagrant-ubuntu-trusty-64.54459: Flags [.], ack 1882963754, win 84, options [nop,nop,TS val 4294713053 ecr 4294712911,nop,nop,sack 2 {1882964574:1882964738}{1882963918:1882964082}], length 0
11:56:33.468642 IP vagrant-ubuntu-trusty-64.54459 > 10.0.0.1.8882: Flags [P.], seq 1882963754:1882963918, ack 3008757535, win 58, options [nop,nop,TS val 4294713064 ecr 4294713053], length 164
11:56:33.468685 IP vagrant-ubuntu-trusty-64.54459 > 10.0.0.1.8882: Flags [P.], seq 1882964082:1882964574, ack 3008757535, win 58, options [nop,nop,TS val 4294713064 ecr 4294713053], length 492
11:56:33.474570 IP vagrant-ubuntu-trusty-64.54459 > 10.0.0.1.8882: Flags [P.], seq 1882964902:1882965066, ack 3008757535, win 58, options [nop,nop,TS val 4294713071 ecr 4294713053], length 164
11:56:33.488676 IP 10.0.0.1.8882 > vagrant-ubuntu-trusty-64.54459: Flags [.], ack 1882963754, win 86, options [nop,nop,TS val 4294713074 ecr 4294712911,nop,nop,sack 2 {1882964574:1882964902}{1882963918:1882964082}], length 0
11:56:33.494633 IP vagrant-ubuntu-trusty-64.54459 > 10.0.0.1.8882: Flags [P.], seq 1882965066:1882965230, ack 3008757535, win 58, options [nop,nop,TS val 4294713091 ecr 4294713074], length 164
11:56:33.499414 IP 10.0.0.1.8882 > vagrant-ubuntu-trusty-64.54459: Flags [.], ack 1882964082, win 88, options [nop,nop,TS val 4294713085 ecr 4294713064,nop,nop,sack 1 {1882964574:1882964902}], length 0
11:56:33.499572 IP 10.0.0.1.8882 > vagrant-ubuntu-trusty-64.54459: Flags [.], ack 1882964902, win 91, options [nop,nop,TS val 4294713086 ecr 4294713064], length 0
11:56:33.514968 IP vagrant-ubuntu-trusty-64.54459 > 10.0.0.1.8882: Flags [P.], seq 1882965230:1882965394, ack 3008757535, win 58, options [nop,nop,TS val 4294713111 ecr 4294713086], length 164
11:56:33.527500 IP 10.0.0.1.8882 > vagrant-ubuntu-trusty-64.54459: Flags [.], ack 1882964902, win 93, options [nop,nop,TS val 4294713114 ecr 4294713064,nop,nop,sack 1 {1882965066:1882965230}], length 0
11:56:33.534889 IP vagrant-ubuntu-trusty-64.54459 > 10.0.0.1.8882: Flags [P.], seq 1882965394:1882965558, ack 3008757535, win 58, options [nop,nop,TS val 4294713131 ecr 4294713114], length 164
11:56:33.544920 IP 10.0.0.1.8882 > vagrant-ubuntu-trusty-64.54459: Flags [.], ack 1882964902, win 95, options [nop,nop,TS val 4294713131 ecr 4294713064,nop,nop,sack 1 {1882965066:1882965394}], length 0
11:56:33.555870 IP vagrant-ubuntu-trusty-64.54459 > 10.0.0.1.8882: Flags [P.], seq 1882965558:1882965722, ack 3008757535, win 58, options [nop,nop,TS val 4294713152 ecr 4294713131], length 164
11:56:33.559841 IP 10.0.0.1.8882 > vagrant-ubuntu-trusty-64.54459: Flags [.], ack 1882964902, win 97, options [nop,nop,TS val 4294713146 ecr 4294713064,nop,nop,sack 1 {1882965066:1882965558}], length 0
11:56:33.559860 IP vagrant-ubuntu-trusty-64.54459 > 10.0.0.1.8882: Flags [P.], seq 1882964902:1882965066, ack 3008757535, win 58, options [nop,nop,TS val 4294713155 ecr 4294713146], length 164
11:56:33.574578 IP vagrant-ubuntu-trusty-64.54459 > 10.0.0.1.8882: Flags [P.], seq 1882965722:1882965886, ack 3008757535, win 58, options [nop,nop,TS val 4294713171 ecr 4294713146], length 164
11:56:33.585756 IP 10.0.0.1.8882 > vagrant-ubuntu-trusty-64.54459: Flags [.], ack 1882964902, win 99, options [nop,nop,TS val 4294713172 ecr 4294713064,nop,nop,sack 1 {1882965066:1882965722}], length 0
11:56:33.594762 IP vagrant-ubuntu-trusty-64.54459 > 10.0.0.1.8882: Flags [P.], seq 1882965886:1882966050, ack 3008757535, win 58, options [nop,nop,TS val 4294713191 ecr 4294713172], length 164
11:56:33.605513 IP 10.0.0.1.8882 > vagrant-ubuntu-trusty-64.54459: Flags [.], ack 1882964902, win 101, options [nop,nop,TS val 4294713191 ecr 4294713064,nop,nop,sack 1 {1882965066:1882965886}], length 0
11:56:33.605598 IP vagrant-ubuntu-trusty-64.54459 > 10.0.0.1.8882: Flags [P.], seq 1882964902:1882965066, ack 3008757535, win 58, options [nop,nop,TS val 4294713201 ecr 4294713191], length 164
11:56:33.614786 IP vagrant-ubuntu-trusty-64.54459 > 10.0.0.1.8882: Flags [P.], seq 1882966050:1882966214, ack 3008757535, win 58, options [nop,nop,TS val 4294713211 ecr 4294713191], length 164
11:56:33.625970 IP 10.0.0.1.8882 > vagrant-ubuntu-trusty-64.54459: Flags [.], ack 1882964902, win 103, options [nop,nop,TS val 4294713212 ecr 4294713064,nop,nop,sack 1 {1882965066:1882966050}], length 0
11:56:33.634498 IP vagrant-ubuntu-trusty-64.54459 > 10.0.0.1.8882: Flags [P.], seq 1882966214:1882966378, ack 3008757535, win 58, options [nop,nop,TS val 4294713231 ecr 4294713212], length 164
11:56:33.636566 IP 10.0.0.1.8882 > vagrant-ubuntu-trusty-64.54459: Flags [.], ack 1882966050, win 105, options [nop,nop,TS val 4294713221 ecr 4294713201], length 0
11:56:33.643680 IP 10.0.0.1.8882 > vagrant-ubuntu-trusty-64.54459: Flags [.], ack 1882966214, win 107, options [nop,nop,TS val 4294713229 ecr 4294713211], length 0
11:56:33.654550 IP vagrant-ubuntu-trusty-64.54459 > 10.0.0.1.8882: Flags [P.], seq 1882966378:1882966542, ack 3008757535, win 58, options [nop,nop,TS val 4294713251 ecr 4294713229], length 164
11:56:33.656539 IP 10.0.0.1.8882 > vagrant-ubuntu-trusty-64.54459: Flags [.], ack 1882966378, win 109, options [nop,nop,TS val 4294713243 ecr 4294713231], length 0
11:56:33.674481 IP vagrant-ubuntu-trusty-64.54459 > 10.0.0.1.8882: Flags [P.], seq 1882966542:1882966706, ack 3008757535, win 58, options [nop,nop,TS val 4294713271 ecr 4294713243], length 164
11:56:33.684600 IP 10.0.0.1.8882 > vagrant-ubuntu-trusty-64.54459: Flags [.], ack 1882966542, win 111, options [nop,nop,TS val 4294713270 ecr 4294713251], length 0
11:56:33.694564 IP vagrant-ubuntu-trusty-64.54459 > 10.0.0.1.8882: Flags [P.], seq 1882966706:1882966870, ack 3008757535, win 58, options [nop,nop,TS val 4294713291 ecr 4294713270], length 164
11:56:33.703761 IP 10.0.0.1.8882 > vagrant-ubuntu-trusty-64.54459: Flags [.], ack 1882966706, win 114, options [nop,nop,TS val 4294713288 ecr 4294713271], length 0
11:56:33.714918 IP 10.0.0.1.8882 > vagrant-ubuntu-trusty-64.54459: Flags [.], ack 1882966870, win 116, options [nop,nop,TS val 4294713301 ecr 4294713291], length 0
11:56:33.715017 IP vagrant-ubuntu-trusty-64.54459 > 10.0.0.1.8882: Flags [P.], seq 1882966870:1882967034, ack 3008757535, win 58, options [nop,nop,TS val 4294713311 ecr 4294713301], length 164
11:56:33.734612 IP vagrant-ubuntu-trusty-64.54459 > 10.0.0.1.8882: Flags [P.], seq 1882967034:1882967198, ack 3008757535, win 58, options [nop,nop,TS val 4294713331 ecr 4294713301], length 164
11:56:33.739865 IP 10.0.0.1.8882 > vagrant-ubuntu-trusty-64.54459: Flags [.], ack 1882967034, win 118, options [nop,nop,TS val 4294713325 ecr 4294713311], length 0
11:56:33.755031 IP vagrant-ubuntu-trusty-64.54459 > 10.0.0.1.8882: Flags [P.], seq 1882967198:1882967362, ack 3008757535, win 58, options [nop,nop,TS val 4294713351 ecr 4294713325], length 164
11:56:33.758753 IP 10.0.0.1.8882 > vagrant-ubuntu-trusty-64.54459: Flags [.], ack 1882967198, win 120, options [nop,nop,TS val 4294713343 ecr 4294713331], length 0
11:56:33.774513 IP vagrant-ubuntu-trusty-64.54459 > 10.0.0.1.8882: Flags [P.], seq 1882967362:1882967526, ack 3008757535, win 58, options [nop,nop,TS val 4294713371 ecr 4294713343], length 164
11:56:33.779825 IP 10.0.0.1.8882 > vagrant-ubuntu-trusty-64.54459: Flags [.], ack 1882967362, win 122, options [nop,nop,TS val 4294713365 ecr 4294713351], length 0
11:56:33.794686 IP vagrant-ubuntu-trusty-64.54459 > 10.0.0.1.8882: Flags [P.], seq 1882967526:1882967690, ack 3008757535, win 58, options [nop,nop,TS val 4294713391 ecr 4294713365], length 164
11:56:33.798113 IP 10.0.0.1.8882 > vagrant-ubuntu-trusty-64.54459: Flags [.], ack 1882967526, win 124, options [nop,nop,TS val 4294713384 ecr 4294713371], length 0
11:56:33.815938 IP vagrant-ubuntu-trusty-64.54459 > 10.0.0.1.8882: Flags [P.], seq 1882967690:1882967854, ack 3008757535, win 58, options [nop,nop,TS val 4294713412 ecr 4294713384], length 164
11:56:33.820569 IP 10.0.0.1.8882 > vagrant-ubuntu-trusty-64.54459: Flags [.], ack 1882967690, win 126, options [nop,nop,TS val 4294713405 ecr 4294713391], length 0
11:56:33.834906 IP vagrant-ubuntu-trusty-64.54459 > 10.0.0.1.8882: Flags [P.], seq 1882967854:1882968018, ack 3008757535, win 58, options [nop,nop,TS val 4294713431 ecr 4294713405], length 164
11:56:33.841869 IP 10.0.0.1.8882 > vagrant-ubuntu-trusty-64.54459: Flags [.], ack 1882967854, win 128, options [nop,nop,TS val 4294713427 ecr 4294713412], length 0
11:56:33.854507 IP vagrant-ubuntu-trusty-64.54459 > 10.0.0.1.8882: Flags [P.], seq 1882968018:1882968182, ack 3008757535, win 58, options [nop,nop,TS val 4294713451 ecr 4294713427], length 164
11:56:33.857502 IP 10.0.0.1.8882 > vagrant-ubuntu-trusty-64.54459: Flags [.], ack 1882968018, win 130, options [nop,nop,TS val 4294713442 ecr 4294713431], length 0
11:56:33.874559 IP vagrant-ubuntu-trusty-64.54459 > 10.0.0.1.8882: Flags [P.], seq 1882968182:1882968346, ack 3008757535, win 58, options [nop,nop,TS val 4294713471 ecr 4294713442], length 164
11:56:33.878184 IP 10.0.0.1.8882 > vagrant-ubuntu-trusty-64.54459: Flags [.], ack 1882968182, win 132, options [nop,nop,TS val 4294713464 ecr 4294713451], length 0
11:56:33.894631 IP vagrant-ubuntu-trusty-64.54459 > 10.0.0.1.8882: Flags [P.], seq 1882968346:1882968510, ack 3008757535, win 58, options [nop,nop,TS val 4294713491 ecr 4294713464], length 164
11:56:33.896480 IP 10.0.0.1.8882 > vagrant-ubuntu-trusty-64.54459: Flags [.], ack 1882968346, win 135, options [nop,nop,TS val 4294713482 ecr 4294713471], length 0
11:56:33.914480 IP vagrant-ubuntu-trusty-64.54459 > 10.0.0.1.8882: Flags [P.], seq 1882968510:1882968674, ack 3008757535, win 58, options [nop,nop,TS val 4294713511 ecr 4294713482], length 164
11:56:33.921467 IP 10.0.0.1.8882 > vagrant-ubuntu-trusty-64.54459: Flags [.], ack 1882968510, win 137, options [nop,nop,TS val 4294713507 ecr 4294713491], length 0
11:56:33.934611 IP vagrant-ubuntu-trusty-64.54459 > 10.0.0.1.8882: Flags [P.], seq 1882968674:1882968838, ack 3008757535, win 58, options [nop,nop,TS val 4294713531 ecr 4294713507], length 164
11:56:33.938904 IP 10.0.0.1.8882 > vagrant-ubuntu-trusty-64.54459: Flags [.], ack 1882968674, win 139, options [nop,nop,TS val 4294713525 ecr 4294713511], length 0
11:56:33.954771 IP vagrant-ubuntu-trusty-64.54459 > 10.0.0.1.8882: Flags [P.], seq 1882968838:1882969002, ack 3008757535, win 58, options [nop,nop,TS val 4294713551 ecr 4294713525], length 164
11:56:33.961695 IP 10.0.0.1.8882 > vagrant-ubuntu-trusty-64.54459: Flags [.], ack 1882968838, win 141, options [nop,nop,TS val 4294713547 ecr 4294713531], length 0
11:56:33.974662 IP vagrant-ubuntu-trusty-64.54459 > 10.0.0.1.8882: Flags [P.], seq 1882969002:1882969166, ack 3008757535, win 58, options [nop,nop,TS val 4294713571 ecr 4294713547], length 164
11:56:33.978822 IP 10.0.0.1.8882 > vagrant-ubuntu-trusty-64.54459: Flags [.], ack 1882969002, win 143, options [nop,nop,TS val 4294713565 ecr 4294713551], length 0
11:56:33.995047 IP vagrant-ubuntu-trusty-64.54459 > 10.0.0.1.8882: Flags [P.], seq 1882969166:1882969330, ack 3008757535, win 58, options [nop,nop,TS val 4294713591 ecr 4294713565], length 164
11:56:34.001695 IP 10.0.0.1.8882 > vagrant-ubuntu-trusty-64.54459: Flags [.], ack 1882969166, win 145, options [nop,nop,TS val 4294713586 ecr 4294713571], length 0
11:56:34.014613 IP vagrant-ubuntu-trusty-64.54459 > 10.0.0.1.8882: Flags [P.], seq 1882969330:1882969494, ack 3008757535, win 58, options [nop,nop,TS val 4294713611 ecr 4294713586], length 164
11:56:34.021873 IP 10.0.0.1.8882 > vagrant-ubuntu-trusty-64.54459: Flags [.], ack 1882969330, win 147, options [nop,nop,TS val 4294713608 ecr 4294713591], length 0
11:56:34.035053 IP vagrant-ubuntu-trusty-64.54459 > 10.0.0.1.8882: Flags [P.], seq 1882969494:1882969658, ack 3008757535, win 58, options [nop,nop,TS val 4294713631 ecr 4294713608], length 164
11:56:34.040033 IP 10.0.0.1.8882 > vagrant-ubuntu-trusty-64.54459: Flags [.], ack 1882969494, win 149, options [nop,nop,TS val 4294713626 ecr 4294713611], length 0
11:56:34.054966 IP vagrant-ubuntu-trusty-64.54459 > 10.0.0.1.8882: Flags [P.], seq 1882969658:1882969822, ack 3008757535, win 58, options [nop,nop,TS val 4294713651 ecr 4294713626], length 164
11:56:34.061596 IP 10.0.0.1.8882 > vagrant-ubuntu-trusty-64.54459: Flags [.], ack 1882969658, win 151, options [nop,nop,TS val 4294713648 ecr 4294713631], length 0
11:56:34.074834 IP vagrant-ubuntu-trusty-64.54459 > 10.0.0.1.8882: Flags [P.], seq 1882969822:1882969986, ack 3008757535, win 58, options [nop,nop,TS val 4294713671 ecr 4294713648], length 164
11:56:34.083030 IP 10.0.0.1.8882 > vagrant-ubuntu-trusty-64.54459: Flags [.], ack 1882969822, win 153, options [nop,nop,TS val 4294713669 ecr 4294713651], length 0
11:56:34.094938 IP vagrant-ubuntu-trusty-64.54459 > 10.0.0.1.8882: Flags [P.], seq 1882969986:1882970150, ack 3008757535, win 58, options [nop,nop,TS val 4294713691 ecr 4294713669], length 164
11:56:34.105657 IP 10.0.0.1.8882 > vagrant-ubuntu-trusty-64.54459: Flags [.], ack 1882969986, win 155, options [nop,nop,TS val 4294713691 ecr 4294713671], length 0
11:56:34.114632 IP vagrant-ubuntu-trusty-64.54459 > 10.0.0.1.8882: Flags [P.], seq 1882970150:1882970314, ack 3008757535, win 58, options [nop,nop,TS val 4294713711 ecr 4294713691], length 164
11:56:34.123742 IP 10.0.0.1.8882 > vagrant-ubuntu-trusty-64.54459: Flags [.], ack 1882970150, win 158, options [nop,nop,TS val 4294713709 ecr 4294713691], length 0
11:56:34.135087 IP vagrant-ubuntu-trusty-64.54459 > 10.0.0.1.8882: Flags [P.], seq 1882970314:1882970478, ack 3008757535, win 58, options [nop,nop,TS val 4294713731 ecr 4294713709], length 164
11:56:34.145731 IP 10.0.0.1.8882 > vagrant-ubuntu-trusty-64.54459: Flags [.], ack 1882970314, win 160, options [nop,nop,TS val 4294713731 ecr 4294713711], length 0
11:56:34.154500 IP vagrant-ubuntu-trusty-64.54459 > 10.0.0.1.8882: Flags [P.], seq 1882970478:1882970642, ack 3008757535, win 58, options [nop,nop,TS val 4294713751 ecr 4294713731], length 164
11:56:34.162963 IP 10.0.0.1.8882 > vagrant-ubuntu-trusty-64.54459: Flags [.], ack 1882970478, win 162, options [nop,nop,TS val 4294713749 ecr 4294713731], length 0
11:56:34.174958 IP 10.0.0.1.8882 > vagrant-ubuntu-trusty-64.54459: Flags [.], ack 1882970642, win 164, options [nop,nop,TS val 4294713761 ecr 4294713751], length 0
11:56:34.174994 IP vagrant-ubuntu-trusty-64.54459 > 10.0.0.1.8882: Flags [P.], seq 1882970642:1882970806, ack 3008757535, win 58, options [nop,nop,TS val 4294713771 ecr 4294713749], length 164
11:56:34.194895 IP vagrant-ubuntu-trusty-64.54459 > 10.0.0.1.8882: Flags [P.], seq 1882970806:1882970970, ack 3008757535, win 58, options [nop,nop,TS val 4294713791 ecr 4294713761], length 164
11:56:34.195720 IP 10.0.0.1.8882 > vagrant-ubuntu-trusty-64.54459: Flags [.], ack 1882970806, win 166, options [nop,nop,TS val 4294713781 ecr 4294713771], length 0
11:56:34.214902 IP vagrant-ubuntu-trusty-64.54459 > 10.0.0.1.8882: Flags [P.], seq 1882970970:1882971134, ack 3008757535, win 58, options [nop,nop,TS val 4294713811 ecr 4294713781], length 164
11:56:34.215744 IP 10.0.0.1.8882 > vagrant-ubuntu-trusty-64.54459: Flags [.], ack 1882970970, win 168, options [nop,nop,TS val 4294713801 ecr 4294713791], length 0
11:56:34.234953 IP vagrant-ubuntu-trusty-64.54459 > 10.0.0.1.8882: Flags [P.], seq 1882971134:1882971298, ack 3008757535, win 58, options [nop,nop,TS val 4294713831 ecr 4294713801], length 164
11:56:34.235963 IP 10.0.0.1.8882 > vagrant-ubuntu-trusty-64.54459: Flags [.], ack 1882971134, win 170, options [nop,nop,TS val 4294713822 ecr 4294713811], length 0
11:56:34.254873 IP vagrant-ubuntu-trusty-64.54459 > 10.0.0.1.8882: Flags [P.], seq 1882971298:1882971462, ack 3008757535, win 58, options [nop,nop,TS val 4294713851 ecr 4294713822], length 164
11:56:34.255749 IP 10.0.0.1.8882 > vagrant-ubuntu-trusty-64.54459: Flags [.], ack 1882971298, win 172, options [nop,nop,TS val 4294713841 ecr 4294713831], length 0
11:56:34.274920 IP vagrant-ubuntu-trusty-64.54459 > 10.0.0.1.8882: Flags [P.], seq 1882971462:1882971626, ack 3008757535, win 58, options [nop,nop,TS val 4294713871 ecr 4294713841], length 164
11:56:34.275823 IP 10.0.0.1.8882 > vagrant-ubuntu-trusty-64.54459: Flags [.], ack 1882971462, win 174, options [nop,nop,TS val 4294713861 ecr 4294713851], length 0
11:56:34.294603 IP vagrant-ubuntu-trusty-64.54459 > 10.0.0.1.8882: Flags [P.], seq 1882971626:1882971790, ack 3008757535, win 58, options [nop,nop,TS val 4294713891 ecr 4294713861], length 164
11:56:34.295904 IP 10.0.0.1.8882 > vagrant-ubuntu-trusty-64.54459: Flags [.], ack 1882971626, win 176, options [nop,nop,TS val 4294713882 ecr 4294713871], length 0
11:56:34.314600 IP vagrant-ubuntu-trusty-64.54459 > 10.0.0.1.8882: Flags [P.], seq 1882971790:1882971954, ack 3008757535, win 58, options [nop,nop,TS val 4294713911 ecr 4294713882], length 164
11:56:34.326738 IP 10.0.0.1.8882 > vagrant-ubuntu-trusty-64.54459: Flags [.], ack 1882971790, win 178, options [nop,nop,TS val 4294713913 ecr 4294713891], length 0
11:56:34.334480 IP vagrant-ubuntu-trusty-64.54459 > 10.0.0.1.8882: Flags [P.], seq 1882971954:1882972118, ack 3008757535, win 58, options [nop,nop,TS val 4294713931 ecr 4294713913], length 164
11:56:34.335100 IP 10.0.0.1.8882 > vagrant-ubuntu-trusty-64.54459: Flags [.], ack 1882971954, win 181, options [nop,nop,TS val 4294713920 ecr 4294713911], length 0
11:56:34.354609 IP vagrant-ubuntu-trusty-64.54459 > 10.0.0.1.8882: Flags [P.], seq 1882972118:1882972282, ack 3008757535, win 58, options [nop,nop,TS val 4294713951 ecr 4294713920], length 164
11:56:34.355974 IP 10.0.0.1.8882 > vagrant-ubuntu-trusty-64.54459: Flags [.], ack 1882972118, win 183, options [nop,nop,TS val 4294713941 ecr 4294713931], length 0
11:56:34.374585 IP vagrant-ubuntu-trusty-64.54459 > 10.0.0.1.8882: Flags [P.], seq 1882972282:1882972446, ack 3008757535, win 58, options [nop,nop,TS val 4294713971 ecr 4294713941], length 164
11:56:34.374759 IP 10.0.0.1.8882 > vagrant-ubuntu-trusty-64.54459: Flags [.], ack 1882972282, win 185, options [nop,nop,TS val 4294713961 ecr 4294713951], length 0
11:56:34.394895 IP vagrant-ubuntu-trusty-64.54459 > 10.0.0.1.8882: Flags [P.], seq 1882972446:1882972610, ack 3008757535, win 58, options [nop,nop,TS val 4294713991 ecr 4294713961], length 164
11:56:34.395130 IP 10.0.0.1.8882 > vagrant-ubuntu-trusty-64.54459: Flags [.], ack 1882972446, win 187, options [nop,nop,TS val 4294713981 ecr 4294713971], length 0
11:56:34.414504 IP vagrant-ubuntu-trusty-64.54459 > 10.0.0.1.8882: Flags [P.], seq 1882972610:1882972774, ack 3008757535, win 58, options [nop,nop,TS val 4294714011 ecr 4294713981], length 164
11:56:34.419819 IP 10.0.0.1.8882 > vagrant-ubuntu-trusty-64.54459: Flags [.], ack 1882972610, win 189, options [nop,nop,TS val 4294714005 ecr 4294713991], length 0
11:56:34.434883 IP vagrant-ubuntu-trusty-64.54459 > 10.0.0.1.8882: Flags [P.], seq 1882972774:1882972938, ack 3008757535, win 58, options [nop,nop,TS val 4294714031 ecr 4294714005], length 164
11:56:34.435161 IP 10.0.0.1.8882 > vagrant-ubuntu-trusty-64.54459: Flags [.], ack 1882972774, win 191, options [nop,nop,TS val 4294714021 ecr 4294714011], length 0
11:56:34.454495 IP vagrant-ubuntu-trusty-64.54459 > 10.0.0.1.8882: Flags [P.], seq 1882972938:1882973102, ack 3008757535, win 58, options [nop,nop,TS val 4294714051 ecr 4294714021], length 164
11:56:34.455921 IP 10.0.0.1.8882 > vagrant-ubuntu-trusty-64.54459: Flags [.], ack 1882972938, win 193, options [nop,nop,TS val 4294714041 ecr 4294714031], length 0
11:56:34.474908 IP vagrant-ubuntu-trusty-64.54459 > 10.0.0.1.8882: Flags [P.], seq 1882973102:1882973266, ack 3008757535, win 58, options [nop,nop,TS val 4294714071 ecr 4294714041], length 164
11:56:34.475016 IP 10.0.0.1.8882 > vagrant-ubuntu-trusty-64.54459: Flags [.], ack 1882973102, win 195, options [nop,nop,TS val 4294714060 ecr 4294714051], length 0
11:56:34.495131 IP vagrant-ubuntu-trusty-64.54459 > 10.0.0.1.8882: Flags [P.], seq 1882973266:1882973430, ack 3008757535, win 58, options [nop,nop,TS val 4294714091 ecr 4294714060], length 164
11:56:34.495959 IP 10.0.0.1.8882 > vagrant-ubuntu-trusty-64.54459: Flags [.], ack 1882973266, win 197, options [nop,nop,TS val 4294714081 ecr 4294714071], length 0
11:56:34.515016 IP vagrant-ubuntu-trusty-64.54459 > 10.0.0.1.8882: Flags [P.], seq 1882973430:1882973594, ack 3008757535, win 58, options [nop,nop,TS val 4294714111 ecr 4294714081], length 164
11:56:34.516632 IP 10.0.0.1.8882 > vagrant-ubuntu-trusty-64.54459: Flags [.], ack 1882973430, win 199, options [nop,nop,TS val 4294714102 ecr 4294714091], length 0
11:56:34.534566 IP vagrant-ubuntu-trusty-64.54459 > 10.0.0.1.8882: Flags [P.], seq 1882973594:1882973758, ack 3008757535, win 58, options [nop,nop,TS val 4294714131 ecr 4294714102], length 164
11:56:34.535336 IP 10.0.0.1.8882 > vagrant-ubuntu-trusty-64.54459: Flags [.], ack 1882973594, win 202, options [nop,nop,TS val 4294714121 ecr 4294714111], length 0
11:56:34.554913 IP vagrant-ubuntu-trusty-64.54459 > 10.0.0.1.8882: Flags [P.], seq 1882973758:1882973922, ack 3008757535, win 58, options [nop,nop,TS val 4294714151 ecr 4294714121], length 164
11:56:34.555193 IP 10.0.0.1.8882 > vagrant-ubuntu-trusty-64.54459: Flags [.], ack 1882973758, win 204, options [nop,nop,TS val 4294714141 ecr 4294714131], length 0
11:56:34.574562 IP vagrant-ubuntu-trusty-64.54459 > 10.0.0.1.8882: Flags [P.], seq 1882973922:1882974086, ack 3008757535, win 58, options [nop,nop,TS val 4294714171 ecr 4294714141], length 164
11:56:34.575739 IP 10.0.0.1.8882 > vagrant-ubuntu-trusty-64.54459: Flags [.], ack 1882973922, win 206, options [nop,nop,TS val 4294714161 ecr 4294714151], length 0
11:56:34.595286 IP vagrant-ubuntu-trusty-64.54459 > 10.0.0.1.8882: Flags [P.], seq 1882974086:1882974250, ack 3008757535, win 58, options [nop,nop,TS val 4294714192 ecr 4294714161], length 164
11:56:34.601189 IP 10.0.0.1.8882 > vagrant-ubuntu-trusty-64.54459: Flags [.], ack 1882974086, win 208, options [nop,nop,TS val 4294714187 ecr 4294714171], length 0
11:56:34.614512 IP vagrant-ubuntu-trusty-64.54459 > 10.0.0.1.8882: Flags [P.], seq 1882974250:1882974414, ack 3008757535, win 58, options [nop,nop,TS val 4294714211 ecr 4294714187], length 164
11:56:34.616865 IP 10.0.0.1.8882 > vagrant-ubuntu-trusty-64.54459: Flags [.], ack 1882974250, win 210, options [nop,nop,TS val 4294714202 ecr 4294714192], length 0
11:56:34.634929 IP vagrant-ubuntu-trusty-64.54459 > 10.0.0.1.8882: Flags [P.], seq 1882974414:1882974578, ack 3008757535, win 58, options [nop,nop,TS val 4294714231 ecr 4294714202], length 164
11:56:34.635271 IP 10.0.0.1.8882 > vagrant-ubuntu-trusty-64.54459: Flags [.], ack 1882974414, win 212, options [nop,nop,TS val 4294714221 ecr 4294714211], length 0
11:56:34.655032 IP vagrant-ubuntu-trusty-64.54459 > 10.0.0.1.8882: Flags [P.], seq 1882974578:1882974742, ack 3008757535, win 58, options [nop,nop,TS val 4294714251 ecr 4294714221], length 164
11:56:34.655249 IP 10.0.0.1.8882 > vagrant-ubuntu-trusty-64.54459: Flags [.], ack 1882974578, win 214, options [nop,nop,TS val 4294714241 ecr 4294714231], length 0
11:56:34.674487 IP vagrant-ubuntu-trusty-64.54459 > 10.0.0.1.8882: Flags [P.], seq 1882974742:1882974906, ack 3008757535, win 58, options [nop,nop,TS val 4294714271 ecr 4294714241], length 164
11:56:34.685069 IP 10.0.0.1.8882 > vagrant-ubuntu-trusty-64.54459: Flags [.], ack 1882974742, win 216, options [nop,nop,TS val 4294714271 ecr 4294714251], length 0
11:56:34.695084 IP vagrant-ubuntu-trusty-64.54459 > 10.0.0.1.8882: Flags [P.], seq 1882974906:1882975070, ack 3008757535, win 58, options [nop,nop,TS val 4294714291 ecr 4294714271], length 164
11:56:34.695349 IP 10.0.0.1.8882 > vagrant-ubuntu-trusty-64.54459: Flags [.], ack 1882974906, win 218, options [nop,nop,TS val 4294714281 ecr 4294714271], length 0
11:56:34.715189 IP vagrant-ubuntu-trusty-64.54459 > 10.0.0.1.8882: Flags [P.], seq 1882975070:1882975234, ack 3008757535, win 58, options [nop,nop,TS val 4294714311 ecr 4294714281], length 164
11:56:34.715882 IP 10.0.0.1.8882 > vagrant-ubuntu-trusty-64.54459: Flags [.], ack 1882975070, win 220, options [nop,nop,TS val 4294714302 ecr 4294714291], length 0
11:56:34.734484 IP vagrant-ubuntu-trusty-64.54459 > 10.0.0.1.8882: Flags [P.], seq 1882975234:1882975398, ack 3008757535, win 58, options [nop,nop,TS val 4294714331 ecr 4294714302], length 164
11:56:34.736827 IP 10.0.0.1.8882 > vagrant-ubuntu-trusty-64.54459: Flags [.], ack 1882975234, win 222, options [nop,nop,TS val 4294714322 ecr 4294714311], length 0
11:56:34.754459 IP vagrant-ubuntu-trusty-64.54459 > 10.0.0.1.8882: Flags [P.], seq 1882975398:1882975562, ack 3008757535, win 58, options [nop,nop,TS val 4294714351 ecr 4294714322], length 164
11:56:34.766225 IP 10.0.0.1.8882 > vagrant-ubuntu-trusty-64.54459: Flags [.], ack 1882975398, win 225, options [nop,nop,TS val 4294714352 ecr 4294714331], length 0
11:56:34.775296 IP vagrant-ubuntu-trusty-64.54459 > 10.0.0.1.8882: Flags [P.], seq 1882975562:1882975726, ack 3008757535, win 58, options [nop,nop,TS val 4294714372 ecr 4294714352], length 164
11:56:34.775418 IP 10.0.0.1.8882 > vagrant-ubuntu-trusty-64.54459: Flags [.], ack 1882975562, win 227, options [nop,nop,TS val 4294714360 ecr 4294714351], length 0
11:56:34.794484 IP vagrant-ubuntu-trusty-64.54459 > 10.0.0.1.8882: Flags [P.], seq 1882975726:1882975890, ack 3008757535, win 58, options [nop,nop,TS val 4294714391 ecr 4294714360], length 164
11:56:34.796016 IP 10.0.0.1.8882 > vagrant-ubuntu-trusty-64.54459: Flags [.], ack 1882975726, win 229, options [nop,nop,TS val 4294714382 ecr 4294714372], length 0
11:56:34.815038 IP vagrant-ubuntu-trusty-64.54459 > 10.0.0.1.8882: Flags [P.], seq 1882975890:1882976054, ack 3008757535, win 58, options [nop,nop,TS val 4294714411 ecr 4294714382], length 164
11:56:34.815293 IP 10.0.0.1.8882 > vagrant-ubuntu-trusty-64.54459: Flags [.], ack 1882975890, win 231, options [nop,nop,TS val 4294714401 ecr 4294714391], length 0
11:56:34.835377 IP vagrant-ubuntu-trusty-64.54459 > 10.0.0.1.8882: Flags [P.], seq 1882976054:1882976218, ack 3008757535, win 58, options [nop,nop,TS val 4294714432 ecr 4294714401], length 164
11:56:34.846084 IP 10.0.0.1.8882 > vagrant-ubuntu-trusty-64.54459: Flags [.], ack 1882976054, win 233, options [nop,nop,TS val 4294714432 ecr 4294714411], length 0
11:56:34.855115 IP vagrant-ubuntu-trusty-64.54459 > 10.0.0.1.8882: Flags [P.], seq 1882976218:1882976382, ack 3008757535, win 58, options [nop,nop,TS val 4294714451 ecr 4294714432], length 164
11:56:34.856949 IP 10.0.0.1.8882 > vagrant-ubuntu-trusty-64.54459: Flags [.], ack 1882976218, win 235, options [nop,nop,TS val 4294714442 ecr 4294714432], length 0
11:56:34.875154 IP vagrant-ubuntu-trusty-64.54459 > 10.0.0.1.8882: Flags [P.], seq 1882976382:1882976546, ack 3008757535, win 58, options [nop,nop,TS val 4294714471 ecr 4294714442], length 164
11:56:34.875973 IP 10.0.0.1.8882 > vagrant-ubuntu-trusty-64.54459: Flags [.], ack 1882976382, win 237, options [nop,nop,TS val 4294714462 ecr 4294714451], length 0
11:56:34.894703 IP vagrant-ubuntu-trusty-64.54459 > 10.0.0.1.8882: Flags [P.], seq 1882976546:1882976710, ack 3008757535, win 58, options [nop,nop,TS val 4294714491 ecr 4294714462], length 164
11:56:34.896071 IP 10.0.0.1.8882 > vagrant-ubuntu-trusty-64.54459: Flags [.], ack 1882976546, win 239, options [nop,nop,TS val 4294714482 ecr 4294714471], length 0
11:56:34.914957 IP vagrant-ubuntu-trusty-64.54459 > 10.0.0.1.8882: Flags [P.], seq 1882976710:1882976874, ack 3008757535, win 58, options [nop,nop,TS val 4294714511 ecr 4294714482], length 164
11:56:34.915298 IP 10.0.0.1.8882 > vagrant-ubuntu-trusty-64.54459: Flags [.], ack 1882976710, win 241, options [nop,nop,TS val 4294714501 ecr 4294714491], length 0
11:56:34.934646 IP vagrant-ubuntu-trusty-64.54459 > 10.0.0.1.8882: Flags [P.], seq 1882976874:1882977038, ack 3008757535, win 58, options [nop,nop,TS val 4294714531 ecr 4294714501], length 164
11:56:34.936366 IP 10.0.0.1.8882 > vagrant-ubuntu-trusty-64.54459: Flags [.], ack 1882976874, win 243, options [nop,nop,TS val 4294714522 ecr 4294714511], length 0
11:56:34.955249 IP 10.0.0.1.8882 > vagrant-ubuntu-trusty-64.54459: Flags [.], ack 1882977038, win 245, options [nop,nop,TS val 4294714541 ecr 4294714531], length 0
11:56:34.955329 IP vagrant-ubuntu-trusty-64.54459 > 10.0.0.1.8882: Flags [P.], seq 1882977038:1882977202, ack 3008757535, win 58, options [nop,nop,TS val 4294714552 ecr 4294714522], length 164
11:56:34.974928 IP vagrant-ubuntu-trusty-64.54459 > 10.0.0.1.8882: Flags [P.], seq 1882977202:1882977366, ack 3008757535, win 58, options [nop,nop,TS val 4294714571 ecr 4294714541], length 164
11:56:34.976000 IP 10.0.0.1.8882 > vagrant-ubuntu-trusty-64.54459: Flags [.], ack 1882977202, win 248, options [nop,nop,TS val 4294714562 ecr 4294714552], length 0
11:56:34.995193 IP vagrant-ubuntu-trusty-64.54459 > 10.0.0.1.8882: Flags [P.], seq 1882977366:1882977530, ack 3008757535, win 58, options [nop,nop,TS val 4294714591 ecr 4294714562], length 164
11:56:34.995990 IP 10.0.0.1.8882 > vagrant-ubuntu-trusty-64.54459: Flags [.], ack 1882977366, win 250, options [nop,nop,TS val 4294714581 ecr 4294714571], length 0
11:56:35.014703 IP vagrant-ubuntu-trusty-64.54459 > 10.0.0.1.8882: Flags [P.], seq 1882977530:1882977694, ack 3008757535, win 58, options [nop,nop,TS val 4294714611 ecr 4294714581], length 164
11:56:35.016294 IP 10.0.0.1.8882 > vagrant-ubuntu-trusty-64.54459: Flags [.], ack 1882977530, win 252, options [nop,nop,TS val 4294714602 ecr 4294714591], length 0
11:56:35.034658 IP vagrant-ubuntu-trusty-64.54459 > 10.0.0.1.8882: Flags [P.], seq 1882977694:1882977858, ack 3008757535, win 58, options [nop,nop,TS val 4294714631 ecr 4294714602], length 164
11:56:35.036116 IP 10.0.0.1.8882 > vagrant-ubuntu-trusty-64.54459: Flags [.], ack 1882977694, win 254, options [nop,nop,TS val 4294714621 ecr 4294714611], length 0
11:56:35.055212 IP 10.0.0.1.8882 > vagrant-ubuntu-trusty-64.54459: Flags [.], ack 1882977858, win 256, options [nop,nop,TS val 4294714641 ecr 4294714631], length 0
11:56:35.055256 IP vagrant-ubuntu-trusty-64.54459 > 10.0.0.1.8882: Flags [P.], seq 1882977858:1882978022, ack 3008757535, win 58, options [nop,nop,TS val 4294714651 ecr 4294714621], length 164
11:56:35.075304 IP vagrant-ubuntu-trusty-64.54459 > 10.0.0.1.8882: Flags [P.], seq 1882978022:1882978186, ack 3008757535, win 58, options [nop,nop,TS val 4294714672 ecr 4294714641], length 164
11:56:35.076982 IP 10.0.0.1.8882 > vagrant-ubuntu-trusty-64.54459: Flags [.], ack 1882978022, win 258, options [nop,nop,TS val 4294714662 ecr 4294714651], length 0
11:56:35.094529 IP vagrant-ubuntu-trusty-64.54459 > 10.0.0.1.8882: Flags [P.], seq 1882978186:1882978350, ack 3008757535, win 58, options [nop,nop,TS val 4294714691 ecr 4294714662], length 164
11:56:35.096079 IP 10.0.0.1.8882 > vagrant-ubuntu-trusty-64.54459: Flags [.], ack 1882978186, win 260, options [nop,nop,TS val 4294714682 ecr 4294714672], length 0
11:56:35.114577 IP vagrant-ubuntu-trusty-64.54459 > 10.0.0.1.8882: Flags [P.], seq 1882978350:1882978514, ack 3008757535, win 58, options [nop,nop,TS val 4294714711 ecr 4294714682], length 164
11:56:35.116112 IP 10.0.0.1.8882 > vagrant-ubuntu-trusty-64.54459: Flags [.], ack 1882978350, win 262, options [nop,nop,TS val 4294714701 ecr 4294714691], length 0
11:56:35.135090 IP vagrant-ubuntu-trusty-64.54459 > 10.0.0.1.8882: Flags [P.], seq 1882978514:1882978678, ack 3008757535, win 58, options [nop,nop,TS val 4294714731 ecr 4294714701], length 164
11:56:35.135454 IP 10.0.0.1.8882 > vagrant-ubuntu-trusty-64.54459: Flags [.], ack 1882978514, win 264, options [nop,nop,TS val 4294714721 ecr 4294714711], length 0
11:56:35.155228 IP vagrant-ubuntu-trusty-64.54459 > 10.0.0.1.8882: Flags [P.], seq 1882978678:1882978842, ack 3008757535, win 58, options [nop,nop,TS val 4294714751 ecr 4294714721], length 164
11:56:35.155530 IP 10.0.0.1.8882 > vagrant-ubuntu-trusty-64.54459: Flags [.], ack 1882978678, win 266, options [nop,nop,TS val 4294714742 ecr 4294714731], length 0
11:56:35.175178 IP vagrant-ubuntu-trusty-64.54459 > 10.0.0.1.8882: Flags [P.], seq 1882978842:1882979006, ack 3008757535, win 58, options [nop,nop,TS val 4294714771 ecr 4294714742], length 164
11:56:35.176411 IP 10.0.0.1.8882 > vagrant-ubuntu-trusty-64.54459: Flags [.], ack 1882978842, win 269, options [nop,nop,TS val 4294714762 ecr 4294714751], length 0
11:56:35.194604 IP vagrant-ubuntu-trusty-64.54459 > 10.0.0.1.8882: Flags [P.], seq 1882979006:1882979170, ack 3008757535, win 58, options [nop,nop,TS val 4294714791 ecr 4294714762], length 164
11:56:35.196249 IP 10.0.0.1.8882 > vagrant-ubuntu-trusty-64.54459: Flags [.], ack 1882979006, win 271, options [nop,nop,TS val 4294714782 ecr 4294714771], length 0
11:56:35.214633 IP vagrant-ubuntu-trusty-64.54459 > 10.0.0.1.8882: Flags [P.], seq 1882979170:1882979334, ack 3008757535, win 58, options [nop,nop,TS val 4294714811 ecr 4294714782], length 164
11:56:35.216295 IP 10.0.0.1.8882 > vagrant-ubuntu-trusty-64.54459: Flags [.], ack 1882979170, win 273, options [nop,nop,TS val 4294714801 ecr 4294714791], length 0
11:56:35.234564 IP vagrant-ubuntu-trusty-64.54459 > 10.0.0.1.8882: Flags [P.], seq 1882979334:1882979498, ack 3008757535, win 58, options [nop,nop,TS val 4294714831 ecr 4294714801], length 164
11:56:35.236263 IP 10.0.0.1.8882 > vagrant-ubuntu-trusty-64.54459: Flags [.], ack 1882979334, win 275, options [nop,nop,TS val 4294714821 ecr 4294714811], length 0
11:56:35.254667 IP vagrant-ubuntu-trusty-64.54459 > 10.0.0.1.8882: Flags [P.], seq 1882979498:1882979662, ack 3008757535, win 58, options [nop,nop,TS val 4294714851 ecr 4294714821], length 164
11:56:35.255538 IP 10.0.0.1.8882 > vagrant-ubuntu-trusty-64.54459: Flags [.], ack 1882979498, win 277, options [nop,nop,TS val 4294714841 ecr 4294714831], length 0
11:56:35.274597 IP vagrant-ubuntu-trusty-64.54459 > 10.0.0.1.8882: Flags [P.], seq 1882979662:1882979826, ack 3008757535, win 58, options [nop,nop,TS val 4294714871 ecr 4294714841], length 164
11:56:35.276176 IP 10.0.0.1.8882 > vagrant-ubuntu-trusty-64.54459: Flags [.], ack 1882979662, win 279, options [nop,nop,TS val 4294714862 ecr 4294714851], length 0
11:56:35.294592 IP vagrant-ubuntu-trusty-64.54459 > 10.0.0.1.8882: Flags [P.], seq 1882979826:1882979990, ack 3008757535, win 58, options [nop,nop,TS val 4294714891 ecr 4294714862], length 164
11:56:35.295666 IP 10.0.0.1.8882 > vagrant-ubuntu-trusty-64.54459: Flags [.], ack 1882979826, win 281, options [nop,nop,TS val 4294714881 ecr 4294714871], length 0
11:56:35.314695 IP vagrant-ubuntu-trusty-64.54459 > 10.0.0.1.8882: Flags [P.], seq 1882979990:1882980154, ack 3008757535, win 58, options [nop,nop,TS val 4294714911 ecr 4294714881], length 164
11:56:35.315445 IP 10.0.0.1.8882 > vagrant-ubuntu-trusty-64.54459: Flags [.], ack 1882979990, win 283, options [nop,nop,TS val 4294714901 ecr 4294714891], length 0
11:56:35.334647 IP vagrant-ubuntu-trusty-64.54459 > 10.0.0.1.8882: Flags [P.], seq 1882980154:1882980318, ack 3008757535, win 58, options [nop,nop,TS val 4294714931 ecr 4294714901], length 164
