12:07:30.762040 IP vagrant-ubuntu-trusty-64.41824 > 10.0.0.1.8882: Flags [P.], seq 252637779:252637943, ack 1541465463, win 58, options [nop,nop,TS val 4294712430 ecr 4294712399], length 164
12:07:30.762098 IP 10.0.0.1.8882 > vagrant-ubuntu-trusty-64.41824: Flags [.], ack 252637779, win 61, options [nop,nop,TS val 4294712420 ecr 4294712409], length 0
12:07:30.782030 IP vagrant-ubuntu-trusty-64.41824 > 10.0.0.1.8882: Flags [P.], seq 252637943:252638107, ack 1541465463, win 58, options [nop,nop,TS val 4294712450 ecr 4294712420], length 164
12:07:30.783168 IP 10.0.0.1.8882 > vagrant-ubuntu-trusty-64.41824: Flags [.], ack 252637943, win 63, options [nop,nop,TS val 4294712440 ecr 4294712430], length 0
12:07:30.801362 IP vagrant-ubuntu-trusty-64.41824 > 10.0.0.1.8882: Flags [P.], seq 252638107:252638271, ack 1541465463, win 58, options [nop,nop,TS val 4294712469 ecr 4294712440], length 164
12:07:30.802272 IP 10.0.0.1.8882 > vagrant-ubuntu-trusty-64.41824: Flags [.], ack 252638107, win 65, options [nop,nop,TS val 4294712460 ecr 4294712450], length 0
12:07:30.822001 IP vagrant-ubuntu-trusty-64.41824 > 10.0.0.1.8882: Flags [P.], seq 252638271:252638435, ack 1541465463, win 58, options [nop,nop,TS val 4294712490 ecr 4294712460], length 164
12:07:30.822275 IP 10.0.0.1.8882 > vagrant-ubuntu-trusty-64.41824: Flags [.], ack 252638271, win 68, options [nop,nop,TS val 4294712480 ecr 4294712469], length 0
12:07:30.841383 IP vagrant-ubuntu-trusty-64.41824 > 10.0.0.1.8882: Flags [P.], seq 252638435:252638599, ack 1541465463, win 58, options [nop,nop,TS val 4294712509 ecr 4294712480], length 164
12:07:30.842296 IP 10.0.0.1.8882 > vagrant-ubuntu-trusty-64.41824: Flags [.], ack 252638435, win 70, options [nop,nop,TS val 4294712500 ecr 4294712490], length 0
12:07:30.861931 IP vagrant-ubuntu-trusty-64.41824 > 10.0.0.1.8882: Flags [P.], seq 252638599:252638763, ack 1541465463, win 58, options [nop,nop,TS val 4294712530 ecr 4294712500], length 164
12:07:30.862420 IP 10.0.0.1.8882 > vagrant-ubuntu-trusty-64.41824: Flags [.], ack 252638599, win 72, options [nop,nop,TS val 4294712519 ecr 4294712509], length 0
12:07:30.881378 IP vagrant-ubuntu-trusty-64.41824 > 10.0.0.1.8882: Flags [P.], seq 252638763:252638927, ack 1541465463, win 58, options [nop,nop,TS val 4294712549 ecr 4294712519], length 164
12:07:30.882979 IP 10.0.0.1.8882 > vagrant-ubuntu-trusty-64.41824: Flags [.], ack 252638763, win 74, options [nop,nop,TS val 4294712540 ecr 4294712530], length 0
12:07:30.902195 IP vagrant-ubuntu-trusty-64.41824 > 10.0.0.1.8882: Flags [P.], seq 252638927:252639091, ack 1541465463, win 58, options [nop,nop,TS val 4294712570 ecr 4294712540], length 164
12:07:30.902457 IP 10.0.0.1.8882 > vagrant-ubuntu-trusty-64.41824: Flags [.], ack 252638927, win 76, options [nop,nop,TS val 4294712559 ecr 4294712549], length 0
12:07:30.922144 IP vagrant-ubuntu-trusty-64.41824 > 10.0.0.1.8882: Flags [P.], seq 252639091:252639255, ack 1541465463, win 58, options [nop,nop,TS val 4294712590 ecr 4294712559], length 164
12:07:30.923110 IP 10.0.0.1.8882 > vagrant-ubuntu-trusty-64.41824: Flags [.], ack 252639091, win 78, options [nop,nop,TS val 4294712580 ecr 4294712570], length 0
12:07:30.941495 IP vagrant-ubuntu-trusty-64.41824 > 10.0.0.1.8882: Flags [P.], seq 252639255:252639419, ack 1541465463, win 58, options [nop,nop,TS val 4294712609 ecr 4294712580], length 164
12:07:30.942497 IP 10.0.0.1.8882 > vagrant-ubuntu-trusty-64.41824: Flags [.], ack 252639255, win 80, options [nop,nop,TS val 4294712600 ecr 4294712590], length 0
12:07:30.962235 IP vagrant-ubuntu-trusty-64.41824 > 10.0.0.1.8882: Flags [P.], seq 252639419:252639583, ack 1541465463, win 58, options [nop,nop,TS val 4294712630 ecr 4294712600], length 164
12:07:30.967542 IP 10.0.0.1.8882 > vagrant-ubuntu-trusty-64.41824: Flags [.], ack 252639419, win 82, options [nop,nop,TS val 4294712625 ecr 4294712609], length 0
12:07:30.981451 IP vagrant-ubuntu-trusty-64.41824 > 10.0.0.1.8882: Flags [P.], seq 252639583:252639747, ack 1541465463, win 58, options [nop,nop,TS val 4294712649 ecr 4294712625], length 164
12:07:30.995521 IP 10.0.0.1.8882 > vagrant-ubuntu-trusty-64.41824: Flags [.], ack 252639583, win 84, options [nop,nop,TS val 4294712653 ecr 4294712630], length 0
12:07:31.001366 IP vagrant-ubuntu-trusty-64.41824 > 10.0.0.1.8882: Flags [P.], seq 252639747:252639911, ack 1541465463, win 58, options [nop,nop,TS val 4294712669 ecr 4294712653], length 164
12:07:31.022377 IP vagrant-ubuntu-trusty-64.41824 > 10.0.0.1.8882: Flags [P.], seq 252639911:252640075, ack 1541465463, win 58, options [nop,nop,TS val 4294712690 ecr 4294712653], length 164
12:07:31.022527 IP 10.0.0.1.8882 > vagrant-ubuntu-trusty-64.41824: Flags [.], ack 252639747, win 86, options [nop,nop,TS val 4294712680 ecr 4294712649], length 0
12:07:31.041446 IP vagrant-ubuntu-trusty-64.41824 > 10.0.0.1.8882: Flags [P.], seq 252640075:252640239, ack 1541465463, win 58, options [nop,nop,TS val 4294712709 ecr 4294712680], length 164
12:07:31.051391 IP 10.0.0.1.8882 > vagrant-ubuntu-trusty-64.41824: Flags [.], ack 252639911, win 88, options [nop,nop,TS val 4294712708 ecr 4294712669], length 0
12:07:31.061410 IP vagrant-ubuntu-trusty-64.41824 > 10.0.0.1.8882: Flags [P.], seq 252640239:252640403, ack 1541465463, win 58, options [nop,nop,TS val 4294712729 ecr 4294712708], length 164
12:07:31.071501 IP 10.0.0.1.8882 > vagrant-ubuntu-trusty-64.41824: Flags [.], ack 252640075, win 91, options [nop,nop,TS val 4294712729 ecr 4294712690], length 0
12:07:31.081573 IP vagrant-ubuntu-trusty-64.41824 > 10.0.0.1.8882: Flags [P.], seq 252640403:252640567, ack 1541465463, win 58, options [nop,nop,TS val 4294712749 ecr 4294712729], length 164
12:07:31.088505 IP 10.0.0.1.8882 > vagrant-ubuntu-trusty-64.41824: Flags [.], ack 252640239, win 93, options [nop,nop,TS val 4294712745 ecr 4294712709], length 0
12:07:31.099523 IP 10.0.0.1.8882 > vagrant-ubuntu-trusty-64.41824: Flags [.], ack 252640403, win 95, options [nop,nop,TS val 4294712757 ecr 4294712729], length 0
12:07:31.102667 IP vagrant-ubuntu-trusty-64.41824 > 10.0.0.1.8882: Flags [P.], seq 252640567:252640731, ack 1541465463, win 58, options [nop,nop,TS val 4294712771 ecr 4294712757], length 164
12:07:31.122097 IP vagrant-ubuntu-trusty-64.41824 > 10.0.0.1.8882: Flags [P.], seq 252640731:252640895, ack 1541465463, win 58, options [nop,nop,TS val 4294712790 ecr 4294712757], length 164
12:07:31.141451 IP vagrant-ubuntu-trusty-64.41824 > 10.0.0.1.8882: Flags [P.], seq 252640895:252641059, ack 1541465463, win 58, options [nop,nop,TS val 4294712809 ecr 4294712757], length 164
12:07:31.143425 IP 10.0.0.1.8882 > vagrant-ubuntu-trusty-64.41824: Flags [.], ack 252640403, win 97, options [nop,nop,TS val 4294712801 ecr 4294712729,nop,nop,sack 1 {252640567:252640731}], length 0
12:07:31.154403 IP 10.0.0.1.8882 > vagrant-ubuntu-trusty-64.41824: Flags [.], ack 252640403, win 99, options [nop,nop,TS val 4294712812 ecr 4294712729,nop,nop,sack 1 {252640567:252640895}], length 0
12:07:31.161655 IP vagrant-ubuntu-trusty-64.41824 > 10.0.0.1.8882: Flags [P.], seq 252641059:252641223, ack 1541465463, win 58, options [nop,nop,TS val 4294712830 ecr 4294712812], length 164
12:07:31.178425 IP 10.0.0.1.8882 > vagrant-ubuntu-trusty-64.41824: Flags [.], ack 252640403, win 101, options [nop,nop,TS val 4294712835 ecr 4294712729,nop,nop,sack 1 {252640567:252641059}], length 0
12:07:31.178496 IP vagrant-ubuntu-trusty-64.41824 > 10.0.0.1.8882: Flags [P.], seq 252640403:252640567, ack 1541465463, win 58, options [nop,nop,TS val 4294712846 ecr 4294712835], length 164
12:07:31.181561 IP vagrant-ubuntu-trusty-64.41824 > 10.0.0.1.8882: Flags [P.], seq 252641223:252641387, ack 1541465463, win 58, options [nop,nop,TS val 4294712849 ecr 4294712835], length 164
12:07:31.199641 IP 10.0.0.1.8882 > vagrant-ubuntu-trusty-64.41824: Flags [.], ack 252640403, win 103, options [nop,nop,TS val 4294712856 ecr 4294712729,nop,nop,sack 1 {252640567:252641223}], length 0
12:07:31.201320 IP vagrant-ubuntu-trusty-64.41824 > 10.0.0.1.8882: Flags [P.], seq 252641387:252641551, ack 1541465463, win 58, options [nop,nop,TS val 4294712869 ecr 4294712856], length 164
12:07:31.210296 IP 10.0.0.1.8882 > vagrant-ubuntu-trusty-64.41824: Flags [.], ack 252641223, win 105, options [nop,nop,TS val 4294712867 ecr 4294712846], length 0
12:07:31.214774 IP 10.0.0.1.8882 > vagrant-ubuntu-trusty-64.41824: Flags [.], ack 252641387, win 107, options [nop,nop,TS val 4294712872 ecr 4294712849], length 0
12:07:31.221296 IP vagrant-ubuntu-trusty-64.41824 > 10.0.0.1.8882: Flags [P.], seq 252641551:252641715, ack 1541465463, win 58, options [nop,nop,TS val 4294712889 ecr 4294712872], length 164
12:07:31.222260 IP 10.0.0.1.8882 > vagrant-ubuntu-trusty-64.41824: Flags [.], ack 252641551, win 109, options [nop,nop,TS val 4294712879 ecr 4294712869], length 0
12:07:31.241534 IP vagrant-ubuntu-trusty-64.41824 > 10.0.0.1.8882: Flags [P.], seq 252641715:252641879, ack 1541465463, win 58, options [nop,nop,TS val 4294712909 ecr 4294712879], length 164
12:07:31.248297 IP 10.0.0.1.8882 > vagrant-ubuntu-trusty-64.41824: Flags [.], ack 252641715, win 111, options [nop,nop,TS val 4294712906 ecr 4294712889], length 0
12:07:31.261669 IP vagrant-ubuntu-trusty-64.41824 > 10.0.0.1.8882: Flags [P.], seq 252641879:252642043, ack 1541465463, win 58, options [nop,nop,TS val 4294712930 ecr 4294712906], length 164
12:07:31.281589 IP vagrant-ubuntu-trusty-64.41824 > 10.0.0.1.8882: Flags [P.], seq 252642043:252642207, ack 1541465463, win 58, options [nop,nop,TS val 4294712949 ecr 4294712906], length 164
12:07:31.294411 IP 10.0.0.1.8882 > vagrant-ubuntu-trusty-64.41824: Flags [.], ack 252641715, win 114, options [nop,nop,TS val 4294712951 ecr 4294712889,nop,nop,sack 1 {252641879:252642043}], length 0
12:07:31.302565 IP vagrant-ubuntu-trusty-64.41824 > 10.0.0.1.8882: Flags [P.], seq 252642207:252642371, ack 1541465463, win 58, options [nop,nop,TS val 4294712970 ecr 4294712951], length 164
12:07:31.312561 IP 10.0.0.1.8882 > vagrant-ubuntu-trusty-64.41824: Flags [.], ack 252641715, win 116, options [nop,nop,TS val 4294712970 ecr 4294712889,nop,nop,sack 1 {252641879:252642207}], length 0
12:07:31.322777 IP vagrant-ubuntu-trusty-64.41824 > 10.0.0.1.8882: Flags [P.], seq 252642371:252642535, ack 1541465463, win 58, options [nop,nop,TS val 4294712991 ecr 4294712970], length 164
12:07:31.333533 IP 10.0.0.1.8882 > vagrant-ubuntu-trusty-64.41824: Flags [.], ack 252641715, win 118, options [nop,nop,TS val 4294712990 ecr 4294712889,nop,nop,sack 1 {252641879:252642371}], length 0
12:07:31.333621 IP vagrant-ubuntu-trusty-64.41824 > 10.0.0.1.8882: Flags [P.], seq 252641715:252641879, ack 1541465463, win 58, options [nop,nop,TS val 4294713001 ecr 4294712990], length 164
12:07:31.341438 IP vagrant-ubuntu-trusty-64.41824 > 10.0.0.1.8882: Flags [P.], seq 252642535:252642699, ack 1541465463, win 58, options [nop,nop,TS val 4294713009 ecr 4294712990], length 164
12:07:31.354645 IP 10.0.0.1.8882 > vagrant-ubuntu-trusty-64.41824: Flags [.], ack 252641715, win 120, options [nop,nop,TS val 4294713011 ecr 4294712889,nop,nop,sack 1 {252641879:252642535}], length 0
12:07:31.361345 IP 10.0.0.1.8882 > vagrant-ubuntu-trusty-64.41824: Flags [.], ack 252642535, win 122, options [nop,nop,TS val 4294713019 ecr 4294713001], length 0
12:07:31.361396 IP vagrant-ubuntu-trusty-64.41824 > 10.0.0.1.8882: Flags [P.], seq 252642699:252642863, ack 1541465463, win 58, options [nop,nop,TS val 4294713029 ecr 4294713011], length 164
12:07:31.367228 IP 10.0.0.1.8882 > vagrant-ubuntu-trusty-64.41824: Flags [.], ack 252642699, win 124, options [nop,nop,TS val 4294713025 ecr 4294713009], length 0
12:07:31.381342 IP vagrant-ubuntu-trusty-64.41824 > 10.0.0.1.8882: Flags [P.], seq 252642863:252643027, ack 1541465463, win 58, options [nop,nop,TS val 4294713049 ecr 4294713025], length 164
12:07:31.385225 IP 10.0.0.1.8882 > vagrant-ubuntu-trusty-64.41824: Flags [.], ack 252642863, win 126, options [nop,nop,TS val 4294713042 ecr 4294713029], length 0
12:07:31.401427 IP vagrant-ubuntu-trusty-64.41824 > 10.0.0.1.8882: Flags [P.], seq 252643027:252643191, ack 1541465463, win 58, options [nop,nop,TS val 4294713069 ecr 4294713042], length 164
12:07:31.402508 IP 10.0.0.1.8882 > vagrant-ubuntu-trusty-64.41824: Flags [.], ack 252643027, win 128, options [nop,nop,TS val 4294713060 ecr 4294713049], length 0
12:07:31.421696 IP vagrant-ubuntu-trusty-64.41824 > 10.0.0.1.8882: Flags [P.], seq 252643191:252643355, ack 1541465463, win 58, options [nop,nop,TS val 4294713090 ecr 4294713060], length 164
12:07:31.425539 IP 10.0.0.1.8882 > vagrant-ubuntu-trusty-64.41824: Flags [.], ack 252643191, win 130, options [nop,nop,TS val 4294713083 ecr 4294713069], length 0
12:07:31.441666 IP vagrant-ubuntu-trusty-64.41824 > 10.0.0.1.8882: Flags [P.], seq 252643355:252643519, ack 1541465463, win 58, options [nop,nop,TS val 4294713110 ecr 4294713083], length 164
12:07:31.448654 IP 10.0.0.1.8882 > vagrant-ubuntu-trusty-64.41824: Flags [.], ack 252643355, win 132, options [nop,nop,TS val 4294713106 ecr 4294713090], length 0
12:07:31.461486 IP vagrant-ubuntu-trusty-64.41824 > 10.0.0.1.8882: Flags [P.], seq 252643519:252643683, ack 1541465463, win 58, options [nop,nop,TS val 4294713129 ecr 4294713106], length 164
12:07:31.467586 IP 10.0.0.1.8882 > vagrant-ubuntu-trusty-64.41824: Flags [.], ack 252643519, win 135, options [nop,nop,TS val 4294713125 ecr 4294713110], length 0
12:07:31.481309 IP vagrant-ubuntu-trusty-64.41824 > 10.0.0.1.8882: Flags [P.], seq 252643683:252643847, ack 1541465463, win 58, options [nop,nop,TS val 4294713149 ecr 4294713125], length 164
12:07:31.485367 IP 10.0.0.1.8882 > vagrant-ubuntu-trusty-64.41824: Flags [.], ack 252643683, win 137, options [nop,nop,TS val 4294713143 ecr 4294713129], length 0
12:07:31.501858 IP vagrant-ubuntu-trusty-64.41824 > 10.0.0.1.8882: Flags [P.], seq 252643847:252644011, ack 1541465463, win 58, options [nop,nop,TS val 4294713170 ecr 4294713143], length 164
12:07:31.506602 IP 10.0.0.1.8882 > vagrant-ubuntu-trusty-64.41824: Flags [.], ack 252643847, win 139, options [nop,nop,TS val 4294713163 ecr 4294713149], length 0
12:07:31.521336 IP vagrant-ubuntu-trusty-64.41824 > 10.0.0.1.8882: Flags [P.], seq 252644011:252644175, ack 1541465463, win 58, options [nop,nop,TS val 4294713189 ecr 4294713163], length 164
12:07:31.526666 IP 10.0.0.1.8882 > vagrant-ubuntu-trusty-64.41824: Flags [.], ack 252644011, win 141, options [nop,nop,TS val 4294713184 ecr 4294713170], length 0
12:07:31.541285 IP vagrant-ubuntu-trusty-64.41824 > 10.0.0.1.8882: Flags [P.], seq 252644175:252644339, ack 1541465463, win 58, options [nop,nop,TS val 4294713209 ecr 4294713184], length 164
12:07:31.544867 IP 10.0.0.1.8882 > vagrant-ubuntu-trusty-64.41824: Flags [.], ack 252644175, win 143, options [nop,nop,TS val 4294713203 ecr 4294713189], length 0
12:07:31.561375 IP vagrant-ubuntu-trusty-64.41824 > 10.0.0.1.8882: Flags [P.], seq 252644339:252644503, ack 1541465463, win 58, options [nop,nop,TS val 4294713229 ecr 4294713203], length 164
12:07:31.567830 IP 10.0.0.1.8882 > vagrant-ubuntu-trusty-64.41824: Flags [.], ack 252644339, win 145, options [nop,nop,TS val 4294713225 ecr 4294713209], length 0
12:07:31.581416 IP vagrant-ubuntu-trusty-64.41824 > 10.0.0.1.8882: Flags [P.], seq 252644503:252644667, ack 1541465463, win 58, options [nop,nop,TS val 4294713249 ecr 4294713225], length 164
12:07:31.589527 IP 10.0.0.1.8882 > vagrant-ubuntu-trusty-64.41824: Flags [.], ack 252644503, win 147, options [nop,nop,TS val 4294713246 ecr 4294713229], length 0
12:07:31.601396 IP vagrant-ubuntu-trusty-64.41824 > 10.0.0.1.8882: Flags [P.], seq 252644667:252644831, ack 1541465463, win 58, options [nop,nop,TS val 4294713269 ecr 4294713246], length 164
12:07:31.606934 IP 10.0.0.1.8882 > vagrant-ubuntu-trusty-64.41824: Flags [.], ack 252644667, win 149, options [nop,nop,TS val 4294713264 ecr 4294713249], length 0
12:07:31.621310 IP vagrant-ubuntu-trusty-64.41824 > 10.0.0.1.8882: Flags [P.], seq 252644831:252644995, ack 1541465463, win 58, options [nop,nop,TS val 4294713289 ecr 4294713264], length 164
12:07:31.630189 IP 10.0.0.1.8882 > vagrant-ubuntu-trusty-64.41824: Flags [.], ack 252644831, win 151, options [nop,nop,TS val 4294713286 ecr 4294713269], length 0
12:07:31.641303 IP vagrant-ubuntu-trusty-64.41824 > 10.0.0.1.8882: Flags [P.], seq 252644995:252645159, ack 1541465463, win 58, options [nop,nop,TS val 4294713309 ecr 4294713286], length 164
12:07:31.646545 IP 10.0.0.1.8882 > vagrant-ubuntu-trusty-64.41824: Flags [.], ack 252644995, win 153, options [nop,nop,TS val 4294713304 ecr 4294713289], length 0
12:07:31.661901 IP vagrant-ubuntu-trusty-64.41824 > 10.0.0.1.8882: Flags [P.], seq 252645159:252645323, ack 1541465463, win 58, options [nop,nop,TS val 4294713330 ecr 4294713304], length 164
12:07:31.668813 IP 10.0.0.1.8882 > vagrant-ubuntu-trusty-64.41824: Flags [.], ack 252645159, win 155, options [nop,nop,TS val 4294713326 ecr 4294713309], length 0
12:07:31.681440 IP vagrant-ubuntu-trusty-64.41824 > 10.0.0.1.8882: Flags [P.], seq 252645323:252645487, ack 1541465463, win 58, options [nop,nop,TS val 4294713349 ecr 4294713326], length 164
12:07:31.687629 IP 10.0.0.1.8882 > vagrant-ubuntu-trusty-64.41824: Flags [.], ack 252645323, win 158, options [nop,nop,TS val 4294713344 ecr 4294713330], length 0
12:07:31.701715 IP vagrant-ubuntu-trusty-64.41824 > 10.0.0.1.8882: Flags [P.], seq 252645487:252645651, ack 1541465463, win 58, options [nop,nop,TS val 4294713370 ecr 4294713344], length 164
12:07:31.707834 IP 10.0.0.1.8882 > vagrant-ubuntu-trusty-64.41824: Flags [.], ack 252645487, win 160, options [nop,nop,TS val 4294713366 ecr 4294713349], length 0
12:07:31.721920 IP vagrant-ubuntu-trusty-64.41824 > 10.0.0.1.8882: Flags [P.], seq 252645651:252645815, ack 1541465463, win 58, options [nop,nop,TS val 4294713390 ecr 4294713366], length 164
12:07:31.729821 IP 10.0.0.1.8882 > vagrant-ubuntu-trusty-64.41824: Flags [.], ack 252645651, win 162, options [nop,nop,TS val 4294713388 ecr 4294713370], length 0
12:07:31.741385 IP vagrant-ubuntu-trusty-64.41824 > 10.0.0.1.8882: Flags [P.], seq 252645815:252645979, ack 1541465463, win 58, options [nop,nop,TS val 4294713409 ecr 4294713388], length 164
12:07:31.750680 IP 10.0.0.1.8882 > vagrant-ubuntu-trusty-64.41824: Flags [.], ack 252645815, win 164, options [nop,nop,TS val 4294713408 ecr 4294713390], length 0
12:07:31.761408 IP vagrant-ubuntu-trusty-64.41824 > 10.0.0.1.8882: Flags [P.], seq 252645979:252646143, ack 1541465463, win 58, options [nop,nop,TS val 4294713429 ecr 4294713408], length 164
12:07:31.768994 IP 10.0.0.1.8882 > vagrant-ubuntu-trusty-64.41824: Flags [.], ack 252645979, win 166, options [nop,nop,TS val 4294713427 ecr 4294713409], length 0
12:07:31.781328 IP vagrant-ubuntu-trusty-64.41824 > 10.0.0.1.8882: Flags [P.], seq 252646143:252646307, ack 1541465463, win 58, options [nop,nop,TS val 4294713449 ecr 4294713427], length 164
12:07:31.791744 IP 10.0.0.1.8882 > vagrant-ubuntu-trusty-64.41824: Flags [.], ack 252646143, win 168, options [nop,nop,TS val 4294713449 ecr 4294713429], length 0
12:07:31.801436 IP vagrant-ubuntu-trusty-64.41824 > 10.0.0.1.8882: Flags [P.], seq 252646307:252646471, ack 1541465463, win 58, options [nop,nop,TS val 4294713469 ecr 4294713449], length 164
12:07:31.809952 IP 10.0.0.1.8882 > vagrant-ubuntu-trusty-64.41824: Flags [.], ack 252646307, win 170, options [nop,nop,TS val 4294713467 ecr 4294713449], length 0
12:07:31.821343 IP vagrant-ubuntu-trusty-64.41824 > 10.0.0.1.8882: Flags [P.], seq 252646471:252646635, ack 1541465463, win 58, options [nop,nop,TS val 4294713489 ecr 4294713467], length 164
12:07:31.830979 IP 10.0.0.1.8882 > vagrant-ubuntu-trusty-64.41824: Flags [.], ack 252646471, win 172, options [nop,nop,TS val 4294713488 ecr 4294713469], length 0
12:07:31.841752 IP vagrant-ubuntu-trusty-64.41824 > 10.0.0.1.8882: Flags [P.], seq 252646635:252646799, ack 1541465463, win 58, options [nop,nop,TS val 4294713510 ecr 4294713488], length 164
12:07:31.849961 IP 10.0.0.1.8882 > vagrant-ubuntu-trusty-64.41824: Flags [.], ack 252646635, win 174, options [nop,nop,TS val 4294713507 ecr 4294713489], length 0
12:07:31.861334 IP vagrant-ubuntu-trusty-64.41824 > 10.0.0.1.8882: Flags [P.], seq 252646799:252646963, ack 1541465463, win 58, options [nop,nop,TS val 4294713529 ecr 4294713507], length 164
12:07:31.871125 IP 10.0.0.1.8882 > vagrant-ubuntu-trusty-64.41824: Flags [.], ack 252646799, win 176, options [nop,nop,TS val 4294713528 ecr 4294713510], length 0
12:07:31.881716 IP vagrant-ubuntu-trusty-64.41824 > 10.0.0.1.8882: Flags [P.], seq 252646963:252647127, ack 1541465463, win 58, options [nop,nop,TS val 4294713550 ecr 4294713528], length 164
12:07:31.888875 IP 10.0.0.1.8882 > vagrant-ubuntu-trusty-64.41824: Flags [.], ack 252646963, win 178, options [nop,nop,TS val 4294713547 ecr 4294713529], length 0
12:07:31.901343 IP vagrant-ubuntu-trusty-64.41824 > 10.0.0.1.8882: Flags [P.], seq 252647127:252647291, ack 1541465463, win 58, options [nop,nop,TS val 4294713569 ecr 4294713547], length 164
12:07:31.911803 IP 10.0.0.1.8882 > vagrant-ubuntu-trusty-64.41824: Flags [.], ack 252647127, win 181, options [nop,nop,TS val 4294713568 ecr 4294713550], length 0
12:07:31.922154 IP vagrant-ubuntu-trusty-64.41824 > 10.0.0.1.8882: Flags [P.], seq 252647291:252647455, ack 1541465463, win 58, options [nop,nop,TS val 4294713590 ecr 4294713568], length 164
12:07:31.932948 IP 10.0.0.1.8882 > vagrant-ubuntu-trusty-64.41824: Flags [.], ack 252647291, win 183, options [nop,nop,TS val 4294713590 ecr 4294713569], length 0
12:07:31.941325 IP vagrant-ubuntu-trusty-64.41824 > 10.0.0.1.8882: Flags [P.], seq 252647455:252647619, ack 1541465463, win 58, options [nop,nop,TS val 4294713609 ecr 4294713590], length 164
12:07:31.954054 IP 10.0.0.1.8882 > vagrant-ubuntu-trusty-64.41824: Flags [.], ack 252647455, win 185, options [nop,nop,TS val 4294713611 ecr 4294713590], length 0
12:07:31.962111 IP vagrant-ubuntu-trusty-64.41824 > 10.0.0.1.8882: Flags [P.], seq 252647619:252647783, ack 1541465463, win 58, options [nop,nop,TS val 4294713630 ecr 4294713611], length 164
12:07:31.974416 IP 10.0.0.1.8882 > vagrant-ubuntu-trusty-64.41824: Flags [.], ack 252647619, win 187, options [nop,nop,TS val 4294713632 ecr 4294713609], length 0
12:07:31.981328 IP vagrant-ubuntu-trusty-64.41824 > 10.0.0.1.8882: Flags [P.], seq 252647783:252647947, ack 1541465463, win 58, options [nop,nop,TS val 4294713649 ecr 4294713632], length 164
12:07:31.994257 IP 10.0.0.1.8882 > vagrant-ubuntu-trusty-64.41824: Flags [.], ack 252647783, win 189, options [nop,nop,TS val 4294713651 ecr 4294713630], length 0
12:07:32.002088 IP vagrant-ubuntu-trusty-64.41824 > 10.0.0.1.8882: Flags [P.], seq 252647947:252648111, ack 1541465463, win 58, options [nop,nop,TS val 4294713670 ecr 4294713651], length 164
12:07:32.015681 IP 10.0.0.1.8882 > vagrant-ubuntu-trusty-64.41824: Flags [.], ack 252647947, win 191, options [nop,nop,TS val 4294713673 ecr 4294713649], length 0
12:07:32.021341 IP vagrant-ubuntu-trusty-64.41824 > 10.0.0.1.8882: Flags [P.], seq 252648111:252648275, ack 1541465463, win 58, options [nop,nop,TS val 4294713689 ecr 4294713673], length 164
12:07:32.032720 IP 10.0.0.1.8882 > vagrant-ubuntu-trusty-64.41824: Flags [.], ack 252648111, win 193, options [nop,nop,TS val 4294713691 ecr 4294713670], length 0
12:07:32.041685 IP vagrant-ubuntu-trusty-64.41824 > 10.0.0.1.8882: Flags [P.], seq 252648275:252648439, ack 1541465463, win 58, options [nop,nop,TS val 4294713710 ecr 4294713691], length 164
12:07:32.055157 IP 10.0.0.1.8882 > vagrant-ubuntu-trusty-64.41824: Flags [.], ack 252648275, win 195, options [nop,nop,TS val 4294713713 ecr 4294713689], length 0
12:07:32.061787 IP vagrant-ubuntu-trusty-64.41824 > 10.0.0.1.8882: Flags [P.], seq 252648439:252648603, ack 1541465463, win 58, options [nop,nop,TS val 4294713730 ecr 4294713713], length 164
12:07:32.073751 IP 10.0.0.1.8882 > vagrant-ubuntu-trusty-64.41824: Flags [.], ack 252648439, win 197, options [nop,nop,TS val 4294713730 ecr 4294713710], length 0
12:07:32.081953 IP vagrant-ubuntu-trusty-64.41824 > 10.0.0.1.8882: Flags [P.], seq 252648603:252648767, ack 1541465463, win 58, options [nop,nop,TS val 4294713750 ecr 4294713730], length 164
12:07:32.094172 IP 10.0.0.1.8882 > vagrant-ubuntu-trusty-64.41824: Flags [.], ack 252648603, win 199, options [nop,nop,TS val 4294713752 ecr 4294713730], length 0
12:07:32.101803 IP vagrant-ubuntu-trusty-64.41824 > 10.0.0.1.8882: Flags [P.], seq 252648767:252648931, ack 1541465463, win 58, options [nop,nop,TS val 4294713770 ecr 4294713752], length 164
12:07:32.113587 IP 10.0.0.1.8882 > vagrant-ubuntu-trusty-64.41824: Flags [.], ack 252648767, win 202, options [nop,nop,TS val 4294713770 ecr 4294713750], length 0
12:07:32.121322 IP vagrant-ubuntu-trusty-64.41824 > 10.0.0.1.8882: Flags [P.], seq 252648931:252649095, ack 1541465463, win 58, options [nop,nop,TS val 4294713789 ecr 4294713770], length 164
12:07:32.134676 IP 10.0.0.1.8882 > vagrant-ubuntu-trusty-64.41824: Flags [.], ack 252648931, win 204, options [nop,nop,TS val 4294713792 ecr 4294713770], length 0
12:07:32.141803 IP vagrant-ubuntu-trusty-64.41824 > 10.0.0.1.8882: Flags [P.], seq 252649095:252649259, ack 1541465463, win 58, options [nop,nop,TS val 4294713810 ecr 4294713792], length 164
12:07:32.155268 IP 10.0.0.1.8882 > vagrant-ubuntu-trusty-64.41824: Flags [.], ack 252649095, win 206, options [nop,nop,TS val 4294713813 ecr 4294713789], length 0
12:07:32.161329 IP vagrant-ubuntu-trusty-64.41824 > 10.0.0.1.8882: Flags [P.], seq 252649259:252649423, ack 1541465463, win 58, options [nop,nop,TS val 4294713829 ecr 4294713813], length 164
12:07:32.177275 IP 10.0.0.1.8882 > vagrant-ubuntu-trusty-64.41824: Flags [.], ack 252649259, win 208, options [nop,nop,TS val 4294713835 ecr 4294713810], length 0
12:07:32.181770 IP vagrant-ubuntu-trusty-64.41824 > 10.0.0.1.8882: Flags [P.], seq 252649423:252649587, ack 1541465463, win 58, options [nop,nop,TS val 4294713850 ecr 4294713835], length 164
12:07:32.195877 IP 10.0.0.1.8882 > vagrant-ubuntu-trusty-64.41824: Flags [.], ack 252649423, win 210, options [nop,nop,TS val 4294713853 ecr 4294713829], length 0
12:07:32.201916 IP vagrant-ubuntu-trusty-64.41824 > 10.0.0.1.8882: Flags [P.], seq 252649587:252649751, ack 1541465463, win 58, options [nop,nop,TS val 4294713870 ecr 4294713853], length 164
12:07:32.217770 IP 10.0.0.1.8882 > vagrant-ubuntu-trusty-64.41824: Flags [.], ack 252649587, win 212, options [nop,nop,TS val 4294713874 ecr 4294713850], length 0
12:07:32.221720 IP vagrant-ubuntu-trusty-64.41824 > 10.0.0.1.8882: Flags [P.], seq 252649751:252649915, ack 1541465463, win 58, options [nop,nop,TS val 4294713890 ecr 4294713874], length 164
12:07:32.235106 IP 10.0.0.1.8882 > vagrant-ubuntu-trusty-64.41824: Flags [.], ack 252649751, win 214, options [nop,nop,TS val 4294713893 ecr 4294713870], length 0
12:07:32.241329 IP vagrant-ubuntu-trusty-64.41824 > 10.0.0.1.8882: Flags [P.], seq 252649915:252650079, ack 1541465463, win 58, options [nop,nop,TS val 4294713909 ecr 4294713893], length 164
12:07:32.257918 IP 10.0.0.1.8882 > vagrant-ubuntu-trusty-64.41824: Flags [.], ack 252649915, win 216, options [nop,nop,TS val 4294713914 ecr 4294713890], length 0
12:07:32.262046 IP vagrant-ubuntu-trusty-64.41824 > 10.0.0.1.8882: Flags [P.], seq 252650079:252650243, ack 1541465463, win 58, options [nop,nop,TS val 4294713930 ecr 4294713914], length 164
12:07:32.274908 IP 10.0.0.1.8882 > vagrant-ubuntu-trusty-64.41824: Flags [.], ack 252650079, win 218, options [nop,nop,TS val 4294713933 ecr 4294713909], length 0
12:07:32.282299 IP vagrant-ubuntu-trusty-64.41824 > 10.0.0.1.8882: Flags [P.], seq 252650243:252650407, ack 1541465463, win 58, options [nop,nop,TS val 4294713950 ecr 4294713933], length 164
12:07:32.297066 IP 10.0.0.1.8882 > vagrant-ubuntu-trusty-64.41824: Flags [.], ack 252650243, win 220, options [nop,nop,TS val 4294713954 ecr 4294713930], length 0
12:07:32.302127 IP vagrant-ubuntu-trusty-64.41824 > 10.0.0.1.8882: Flags [P.], seq 252650407:252650571, ack 1541465463, win 58, options [nop,nop,TS val 4294713970 ecr 4294713954], length 164
12:07:32.317864 IP 10.0.0.1.8882 > vagrant-ubuntu-trusty-64.41824: Flags [.], ack 252650407, win 222, options [nop,nop,TS val 4294713975 ecr 4294713950], length 0
12:07:32.322220 IP vagrant-ubuntu-trusty-64.41824 > 10.0.0.1.8882: Flags [P.], seq 252650571:252650735, ack 1541465463, win 58, options [nop,nop,TS val 4294713990 ecr 4294713975], length 164
12:07:32.337318 IP 10.0.0.1.8882 > vagrant-ubuntu-trusty-64.41824: Flags [.], ack 252650571, win 225, options [nop,nop,TS val 4294713994 ecr 4294713970], length 0
12:07:32.342136 IP vagrant-ubuntu-trusty-64.41824 > 10.0.0.1.8882: Flags [P.], seq 252650735:252650899, ack 1541465463, win 58, options [nop,nop,TS val 4294714010 ecr 4294713994], length 164
12:07:32.358752 IP 10.0.0.1.8882 > vagrant-ubuntu-trusty-64.41824: Flags [.], ack 252650735, win 227, options [nop,nop,TS val 4294714015 ecr 4294713990], length 0
12:07:32.361374 IP vagrant-ubuntu-trusty-64.41824 > 10.0.0.1.8882: Flags [P.], seq 252650899:252651063, ack 1541465463, win 58, options [nop,nop,TS val 4294714029 ecr 4294714015], length 164
12:07:32.376874 IP 10.0.0.1.8882 > vagrant-ubuntu-trusty-64.41824: Flags [.], ack 252650899, win 229, options [nop,nop,TS val 4294714034 ecr 4294714010], length 0
12:07:32.381339 IP vagrant-ubuntu-trusty-64.41824 > 10.0.0.1.8882: Flags [P.], seq 252651063:252651227, ack 1541465463, win 58, options [nop,nop,TS val 4294714049 ecr 4294714034], length 164
12:07:32.397504 IP 10.0.0.1.8882 > vagrant-ubuntu-trusty-64.41824: Flags [.], ack 252651063, win 231, options [nop,nop,TS val 4294714055 ecr 4294714029], length 0
12:07:32.402061 IP vagrant-ubuntu-trusty-64.41824 > 10.0.0.1.8882: Flags [P.], seq 252651227:252651391, ack 1541465463, win 58, options [nop,nop,TS val 4294714070 ecr 4294714055], length 164
12:07:32.419883 IP 10.0.0.1.8882 > vagrant-ubuntu-trusty-64.41824: Flags [.], ack 252651227, win 233, options [nop,nop,TS val 4294714077 ecr 4294714049], length 0
12:07:32.421306 IP vagrant-ubuntu-trusty-64.41824 > 10.0.0.1.8882: Flags [P.], seq 252651391:252651555, ack 1541465463, win 58, options [nop,nop,TS val 4294714089 ecr 4294714077], length 164
12:07:32.440333 IP 10.0.0.1.8882 > vagrant-ubuntu-trusty-64.41824: Flags [.], ack 252651391, win 235, options [nop,nop,TS val 4294714098 ecr 4294714070], length 0
12:07:32.441865 IP vagrant-ubuntu-trusty-64.41824 > 10.0.0.1.8882: Flags [P.], seq 252651555:252651719, ack 1541465463, win 58, options [nop,nop,TS val 4294714110 ecr 4294714098], length 164
12:07:32.459269 IP 10.0.0.1.8882 > vagrant-ubuntu-trusty-64.41824: Flags [.], ack 252651555, win 237, options [nop,nop,TS val 4294714116 ecr 4294714089], length 0
12:07:32.461917 IP vagrant-ubuntu-trusty-64.41824 > 10.0.0.1.8882: Flags [P.], seq 252651719:252651883, ack 1541465463, win 58, options [nop,nop,TS val 4294714130 ecr 4294714116], length 164
12:07:32.480475 IP 10.0.0.1.8882 > vagrant-ubuntu-trusty-64.41824: Flags [.], ack 252651719, win 239, options [nop,nop,TS val 4294714138 ecr 4294714110], length 0
12:07:32.481872 IP vagrant-ubuntu-trusty-64.41824 > 10.0.0.1.8882: Flags [P.], seq 252651883:252652047, ack 1541465463, win 58, options [nop,nop,TS val 4294714150 ecr 4294714138], length 164
12:07:32.499968 IP 10.0.0.1.8882 > vagrant-ubuntu-trusty-64.41824: Flags [.], ack 252651883, win 241, options [nop,nop,TS val 4294714156 ecr 4294714130], length 0
12:07:32.501406 IP vagrant-ubuntu-trusty-64.41824 > 10.0.0.1.8882: Flags [P.], seq 252652047:252652211, ack 1541465463, win 58, options [nop,nop,TS val 4294714169 ecr 4294714156], length 164
12:07:32.521050 IP 10.0.0.1.8882 > vagrant-ubuntu-trusty-64.41824: Flags [.], ack 252652047, win 243, options [nop,nop,TS val 4294714178 ecr 4294714150], length 0
12:07:32.521323 IP vagrant-ubuntu-trusty-64.41824 > 10.0.0.1.8882: Flags [P.], seq 252652211:252652375, ack 1541465463, win 58, options [nop,nop,TS val 4294714189 ecr 4294714178], length 164
12:07:32.539464 IP 10.0.0.1.8882 > vagrant-ubuntu-trusty-64.41824: Flags [.], ack 252652211, win 245, options [nop,nop,TS val 4294714197 ecr 4294714169], length 0
12:07:32.541304 IP vagrant-ubuntu-trusty-64.41824 > 10.0.0.1.8882: Flags [P.], seq 252652375:252652539, ack 1541465463, win 58, options [nop,nop,TS val 4294714209 ecr 4294714197], length 164
12:07:32.559696 IP 10.0.0.1.8882 > vagrant-ubuntu-trusty-64.41824: Flags [.], ack 252652375, win 248, options [nop,nop,TS val 4294714217 ecr 4294714189], length 0
12:07:32.561331 IP vagrant-ubuntu-trusty-64.41824 > 10.0.0.1.8882: Flags [P.], seq 252652539:252652703, ack 1541465463, win 58, options [nop,nop,TS val 4294714229 ecr 4294714217], length 164
12:07:32.578333 IP 10.0.0.1.8882 > vagrant-ubuntu-trusty-64.41824: Flags [.], ack 252652539, win 250, options [nop,nop,TS val 4294714236 ecr 4294714209], length 0
12:07:32.581324 IP vagrant-ubuntu-trusty-64.41824 > 10.0.0.1.8882: Flags [P.], seq 252652703:252652867, ack 1541465463, win 58, options [nop,nop,TS val 4294714249 ecr 4294714236], length 164
12:07:32.601065 IP 10.0.0.1.8882 > vagrant-ubuntu-trusty-64.41824: Flags [.], ack 252652703, win 252, options [nop,nop,TS val 4294714258 ecr 4294714229], length 0
12:07:32.601355 IP vagrant-ubuntu-trusty-64.41824 > 10.0.0.1.8882: Flags [P.], seq 252652867:252653031, ack 1541465463, win 58, options [nop,nop,TS val 4294714269 ecr 4294714258], length 164
12:07:32.618136 IP 10.0.0.1.8882 > vagrant-ubuntu-trusty-64.41824: Flags [.], ack 252652867, win 254, options [nop,nop,TS val 4294714276 ecr 4294714249], length 0
12:07:32.621357 IP vagrant-ubuntu-trusty-64.41824 > 10.0.0.1.8882: Flags [P.], seq 252653031:252653195, ack 1541465463, win 58, options [nop,nop,TS val 4294714289 ecr 4294714276], length 164
12:07:32.640439 IP 10.0.0.1.8882 > vagrant-ubuntu-trusty-64.41824: Flags [.], ack 252653031, win 256, options [nop,nop,TS val 4294714297 ecr 4294714269], length 0
12:07:32.641305 IP vagrant-ubuntu-trusty-64.41824 > 10.0.0.1.8882: Flags [P.], seq 252653195:252653359, ack 1541465463, win 58, options [nop,nop,TS val 4294714309 ecr 4294714297], length 164
12:07:32.658022 IP 10.0.0.1.8882 > vagrant-ubuntu-trusty-64.41824: Flags [.], ack 252653195, win 258, options [nop,nop,TS val 4294714316 ecr 4294714289], length 0
12:07:32.662324 IP vagrant-ubuntu-trusty-64.41824 > 10.0.0.1.8882: Flags [P.], seq 252653359:252653523, ack 1541465463, win 58, options [nop,nop,TS val 4294714330 ecr 4294714316], length 164
12:07:32.679260 IP 10.0.0.1.8882 > vagrant-ubuntu-trusty-64.41824: Flags [.], ack 252653359, win 260, options [nop,nop,TS val 4294714337 ecr 4294714309], length 0
12:07:32.682085 IP vagrant-ubuntu-trusty-64.41824 > 10.0.0.1.8882: Flags [P.], seq 252653523:252653687, ack 1541465463, win 58, options [nop,nop,TS val 4294714350 ecr 4294714337], length 164
12:07:32.702293 IP vagrant-ubuntu-trusty-64.41824 > 10.0.0.1.8882: Flags [P.], seq 252653687:252653851, ack 1541465463, win 58, options [nop,nop,TS val 4294714370 ecr 4294714337], length 164
12:07:32.704286 IP 10.0.0.1.8882 > vagrant-ubuntu-trusty-64.41824: Flags [.], ack 252653523, win 262, options [nop,nop,TS val 4294714362 ecr 4294714330], length 0
12:07:32.722104 IP vagrant-ubuntu-trusty-64.41824 > 10.0.0.1.8882: Flags [P.], seq 252653851:252654015, ack 1541465463, win 58, options [nop,nop,TS val 4294714390 ecr 4294714362], length 164
12:07:32.722306 IP 10.0.0.1.8882 > vagrant-ubuntu-trusty-64.41824: Flags [.], ack 252653687, win 264, options [nop,nop,TS val 4294714380 ecr 4294714350], length 0
12:07:32.741372 IP vagrant-ubuntu-trusty-64.41824 > 10.0.0.1.8882: Flags [P.], seq 252654015:252654179, ack 1541465463, win 58, options [nop,nop,TS val 4294714409 ecr 4294714380], length 164
12:07:32.745198 IP 10.0.0.1.8882 > vagrant-ubuntu-trusty-64.41824: Flags [.], ack 252653851, win 266, options [nop,nop,TS val 4294714401 ecr 4294714370], length 0
12:07:32.762237 IP vagrant-ubuntu-trusty-64.41824 > 10.0.0.1.8882: Flags [P.], seq 252654179:252654343, ack 1541465463, win 58, options [nop,nop,TS val 4294714430 ecr 4294714401], length 164
12:07:32.762407 IP 10.0.0.1.8882 > vagrant-ubuntu-trusty-64.41824: Flags [.], ack 252654015, win 269, options [nop,nop,TS val 4294714420 ecr 4294714390], length 0
12:07:32.781929 IP vagrant-ubuntu-trusty-64.41824 > 10.0.0.1.8882: Flags [P.], seq 252654343:252654507, ack 1541465463, win 58, options [nop,nop,TS val 4294714450 ecr 4294714420], length 164
12:07:32.783394 IP 10.0.0.1.8882 > vagrant-ubuntu-trusty-64.41824: Flags [.], ack 252654179, win 271, options [nop,nop,TS val 4294714441 ecr 4294714409], length 0
12:07:32.801322 IP vagrant-ubuntu-trusty-64.41824 > 10.0.0.1.8882: Flags [P.], seq 252654507:252654671, ack 1541465463, win 58, options [nop,nop,TS val 4294714469 ecr 4294714441], length 164
12:07:32.803075 IP 10.0.0.1.8882 > vagrant-ubuntu-trusty-64.41824: Flags [.], ack 252654343, win 273, options [nop,nop,TS val 4294714460 ecr 4294714430], length 0
12:07:32.821928 IP vagrant-ubuntu-trusty-64.41824 > 10.0.0.1.8882: Flags [P.], seq 252654671:252654835, ack 1541465463, win 58, options [nop,nop,TS val 4294714490 ecr 4294714460], length 164
12:07:32.824316 IP 10.0.0.1.8882 > vagrant-ubuntu-trusty-64.41824: Flags [.], ack 252654507, win 275, options [nop,nop,TS val 4294714481 ecr 4294714450], length 0
12:07:32.841362 IP vagrant-ubuntu-trusty-64.41824 > 10.0.0.1.8882: Flags [P.], seq 252654835:252654999, ack 1541465463, win 58, options [nop,nop,TS val 4294714509 ecr 4294714481], length 164
12:07:32.843140 IP 10.0.0.1.8882 > vagrant-ubuntu-trusty-64.41824: Flags [.], ack 252654671, win 277, options [nop,nop,TS val 4294714499 ecr 4294714469], length 0
12:07:32.862070 IP vagrant-ubuntu-trusty-64.41824 > 10.0.0.1.8882: Flags [P.], seq 252654999:252655163, ack 1541465463, win 58, options [nop,nop,TS val 4294714530 ecr 4294714499], length 164
12:07:32.863157 IP 10.0.0.1.8882 > vagrant-ubuntu-trusty-64.41824: Flags [.], ack 252654835, win 279, options [nop,nop,TS val 4294714521 ecr 4294714490], length 0
12:07:32.881340 IP vagrant-ubuntu-trusty-64.41824 > 10.0.0.1.8882: Flags [P.], seq 252655163:252655327, ack 1541465463, win 58, options [nop,nop,TS val 4294714549 ecr 4294714521], length 164
12:07:32.883009 IP 10.0.0.1.8882 > vagrant-ubuntu-trusty-64.41824: Flags [.], ack 252654999, win 281, options [nop,nop,TS val 4294714540 ecr 4294714509], length 0
12:07:32.901439 IP vagrant-ubuntu-trusty-64.41824 > 10.0.0.1.8882: Flags [P.], seq 252655327:252655491, ack 1541465463, win 58, options [nop,nop,TS val 4294714569 ecr 4294714540], length 164
12:07:32.904331 IP 10.0.0.1.8882 > vagrant-ubuntu-trusty-64.41824: Flags [.], ack 252655163, win 283, options [nop,nop,TS val 4294714561 ecr 4294714530], length 0
12:07:32.921336 IP vagrant-ubuntu-trusty-64.41824 > 10.0.0.1.8882: Flags [P.], seq 252655491:252655655, ack 1541465463, win 58, options [nop,nop,TS val 4294714589 ecr 4294714561], length 164
12:07:32.921391 IP 10.0.0.1.8882 > vagrant-ubuntu-trusty-64.41824: Flags [.], ack 252655327, win 285, options [nop,nop,TS val 4294714579 ecr 4294714549], length 0
12:07:32.942398 IP vagrant-ubuntu-trusty-64.41824 > 10.0.0.1.8882: Flags [P.], seq 252655655:252655819, ack 1541465463, win 58, options [nop,nop,TS val 4294714610 ecr 4294714579], length 164
12:07:32.943394 IP 10.0.0.1.8882 > vagrant-ubuntu-trusty-64.41824: Flags [.], ack 252655491, win 287, options [nop,nop,TS val 4294714601 ecr 4294714569], length 0
12:07:32.961243 IP 10.0.0.1.8882 > vagrant-ubuntu-trusty-64.41824: Flags [.], ack 252655655, win 289, options [nop,nop,TS val 4294714619 ecr 4294714589], length 0
12:07:32.961425 IP vagrant-ubuntu-trusty-64.41824 > 10.0.0.1.8882: Flags [P.], seq 252655819:252655983, ack 1541465463, win 58, options [nop,nop,TS val 4294714629 ecr 4294714619], length 164
12:07:32.982315 IP vagrant-ubuntu-trusty-64.41824 > 10.0.0.1.8882: Flags [P.], seq 252655983:252656147, ack 1541465463, win 58, options [nop,nop,TS val 4294714650 ecr 4294714619], length 164
