12:07:30.772423 IP 10.0.0.2.41824 > vagrant-ubuntu-trusty-64.8882: Flags [P.], seq 252637779:252637943, ack 1541465463, win 58, options [nop,nop,TS val 4294712430 ecr 4294712399], length 164
12:07:30.772457 IP vagrant-ubuntu-trusty-64.8882 > 10.0.0.2.41824: Flags [.], ack 252637943, win 63, options [nop,nop,TS val 4294712440 ecr 4294712430], length 0
12:07:30.792165 IP 10.0.0.2.41824 > vagrant-ubuntu-trusty-64.8882: Flags [P.], seq 252637943:252638107, ack 1541465463, win 58, options [nop,nop,TS val 4294712450 ecr 4294712420], length 164
12:07:30.792183 IP vagrant-ubuntu-trusty-64.8882 > 10.0.0.2.41824: Flags [.], ack 252638107, win 65, options [nop,nop,TS val 4294712460 ecr 4294712450], length 0
12:07:30.812083 IP 10.0.0.2.41824 > vagrant-ubuntu-trusty-64.8882: Flags [P.], seq 252638107:252638271, ack 1541465463, win 58, options [nop,nop,TS val 4294712469 ecr 4294712440], length 164
12:07:30.812129 IP vagrant-ubuntu-trusty-64.8882 > 10.0.0.2.41824: Flags [.], ack 252638271, win 68, options [nop,nop,TS val 4294712480 ecr 4294712469], length 0
12:07:30.832187 IP 10.0.0.2.41824 > vagrant-ubuntu-trusty-64.8882: Flags [P.], seq 252638271:252638435, ack 1541465463, win 58, options [nop,nop,TS val 4294712490 ecr 4294712460], length 164
12:07:30.832206 IP vagrant-ubuntu-trusty-64.8882 > 10.0.0.2.41824: Flags [.], ack 252638435, win 70, options [nop,nop,TS val 4294712500 ecr 4294712490], length 0
12:07:30.851980 IP 10.0.0.2.41824 > vagrant-ubuntu-trusty-64.8882: Flags [P.], seq 252638435:252638599, ack 1541465463, win 58, options [nop,nop,TS val 4294712509 ecr 4294712480], length 164
12:07:30.852039 IP vagrant-ubuntu-trusty-64.8882 > 10.0.0.2.41824: Flags [.], ack 252638599, win 72, options [nop,nop,TS val 4294712519 ecr 4294712509], length 0
12:07:30.872274 IP 10.0.0.2.41824 > vagrant-ubuntu-trusty-64.8882: Flags [P.], seq 252638599:252638763, ack 1541465463, win 58, options [nop,nop,TS val 4294712530 ecr 4294712500], length 164
12:07:30.872296 IP vagrant-ubuntu-trusty-64.8882 > 10.0.0.2.41824: Flags [.], ack 252638763, win 74, options [nop,nop,TS val 4294712540 ecr 4294712530], length 0
12:07:30.892008 IP 10.0.0.2.41824 > vagrant-ubuntu-trusty-64.8882: Flags [P.], seq 252638763:252638927, ack 1541465463, win 58, options [nop,nop,TS val 4294712549 ecr 4294712519], length 164
12:07:30.892083 IP vagrant-ubuntu-trusty-64.8882 > 10.0.0.2.41824: Flags [.], ack 252638927, win 76, options [nop,nop,TS val 4294712559 ecr 4294712549], length 0
12:07:30.912452 IP 10.0.0.2.41824 > vagrant-ubuntu-trusty-64.8882: Flags [P.], seq 252638927:252639091, ack 1541465463, win 58, options [nop,nop,TS val 4294712570 ecr 4294712540], length 164
12:07:30.912470 IP vagrant-ubuntu-trusty-64.8882 > 10.0.0.2.41824: Flags [.], ack 252639091, win 78, options [nop,nop,TS val 4294712580 ecr 4294712570], length 0
12:07:30.932318 IP 10.0.0.2.41824 > vagrant-ubuntu-trusty-64.8882: Flags [P.], seq 252639091:252639255, ack 1541465463, win 58, options [nop,nop,TS val 4294712590 ecr 4294712559], length 164
12:07:30.932341 IP vagrant-ubuntu-trusty-64.8882 > 10.0.0.2.41824: Flags [.], ack 252639255, win 80, options [nop,nop,TS val 4294712600 ecr 4294712590], length 0
12:07:30.957209 IP 10.0.0.2.41824 > vagrant-ubuntu-trusty-64.8882: Flags [P.], seq 252639255:252639419, ack 1541465463, win 58, options [nop,nop,TS val 4294712609 ecr 4294712580], length 164
12:07:30.957240 IP vagrant-ubuntu-trusty-64.8882 > 10.0.0.2.41824: Flags [.], ack 252639419, win 82, options [nop,nop,TS val 4294712625 ecr 4294712609], length 0
12:07:30.985274 IP 10.0.0.2.41824 > vagrant-ubuntu-trusty-64.8882: Flags [P.], seq 252639419:252639583, ack 1541465463, win 58, options [nop,nop,TS val 4294712630 ecr 4294712600], length 164
12:07:30.985342 IP vagrant-ubuntu-trusty-64.8882 > 10.0.0.2.41824: Flags [.], ack 252639583, win 84, options [nop,nop,TS val 4294712653 ecr 4294712630], length 0
12:07:31.012398 IP 10.0.0.2.41824 > vagrant-ubuntu-trusty-64.8882: Flags [P.], seq 252639583:252639747, ack 1541465463, win 58, options [nop,nop,TS val 4294712649 ecr 4294712625], length 164
12:07:31.012416 IP vagrant-ubuntu-trusty-64.8882 > 10.0.0.2.41824: Flags [.], ack 252639747, win 86, options [nop,nop,TS val 4294712680 ecr 4294712649], length 0
12:07:31.040447 IP 10.0.0.2.41824 > vagrant-ubuntu-trusty-64.8882: Flags [P.], seq 252639747:252639911, ack 1541465463, win 58, options [nop,nop,TS val 4294712669 ecr 4294712653], length 164
12:07:31.040517 IP vagrant-ubuntu-trusty-64.8882 > 10.0.0.2.41824: Flags [.], ack 252639911, win 88, options [nop,nop,TS val 4294712708 ecr 4294712669], length 0
12:07:31.061370 IP 10.0.0.2.41824 > vagrant-ubuntu-trusty-64.8882: Flags [P.], seq 252639911:252640075, ack 1541465463, win 58, options [nop,nop,TS val 4294712690 ecr 4294712653], length 164
12:07:31.061388 IP vagrant-ubuntu-trusty-64.8882 > 10.0.0.2.41824: Flags [.], ack 252640075, win 91, options [nop,nop,TS val 4294712729 ecr 4294712690], length 0
12:07:31.077258 IP 10.0.0.2.41824 > vagrant-ubuntu-trusty-64.8882: Flags [P.], seq 252640075:252640239, ack 1541465463, win 58, options [nop,nop,TS val 4294712709 ecr 4294712680], length 164
12:07:31.077327 IP vagrant-ubuntu-trusty-64.8882 > 10.0.0.2.41824: Flags [.], ack 252640239, win 93, options [nop,nop,TS val 4294712745 ecr 4294712709], length 0
12:07:31.089294 IP 10.0.0.2.41824 > vagrant-ubuntu-trusty-64.8882: Flags [P.], seq 252640239:252640403, ack 1541465463, win 58, options [nop,nop,TS val 4294712729 ecr 4294712708], length 164
12:07:31.089341 IP vagrant-ubuntu-trusty-64.8882 > 10.0.0.2.41824: Flags [.], ack 252640403, win 95, options [nop,nop,TS val 4294712757 ecr 4294712729], length 0
12:07:31.133264 IP 10.0.0.2.41824 > vagrant-ubuntu-trusty-64.8882: Flags [P.], seq 252640567:252640731, ack 1541465463, win 58, options [nop,nop,TS val 4294712771 ecr 4294712757], length 164
12:07:31.133301 IP vagrant-ubuntu-trusty-64.8882 > 10.0.0.2.41824: Flags [.], ack 252640403, win 97, options [nop,nop,TS val 4294712801 ecr 4294712729,nop,nop,sack 1 {252640567:252640731}], length 0
12:07:31.144140 IP 10.0.0.2.41824 > vagrant-ubuntu-trusty-64.8882: Flags [P.], seq 252640731:252640895, ack 1541465463, win 58, options [nop,nop,TS val 4294712790 ecr 4294712757], length 164
12:07:31.144159 IP vagrant-ubuntu-trusty-64.8882 > 10.0.0.2.41824: Flags [.], ack 252640403, win 99, options [nop,nop,TS val 4294712812 ecr 4294712729,nop,nop,sack 1 {252640567:252640895}], length 0
12:07:31.167365 IP 10.0.0.2.41824 > vagrant-ubuntu-trusty-64.8882: Flags [P.], seq 252640895:252641059, ack 1541465463, win 58, options [nop,nop,TS val 4294712809 ecr 4294712757], length 164
12:07:31.167428 IP vagrant-ubuntu-trusty-64.8882 > 10.0.0.2.41824: Flags [.], ack 252640403, win 101, options [nop,nop,TS val 4294712835 ecr 4294712729,nop,nop,sack 1 {252640567:252641059}], length 0
12:07:31.188492 IP 10.0.0.2.41824 > vagrant-ubuntu-trusty-64.8882: Flags [P.], seq 252641059:252641223, ack 1541465463, win 58, options [nop,nop,TS val 4294712830 ecr 4294712812], length 164
12:07:31.188525 IP vagrant-ubuntu-trusty-64.8882 > 10.0.0.2.41824: Flags [.], ack 252640403, win 103, options [nop,nop,TS val 4294712856 ecr 4294712729,nop,nop,sack 1 {252640567:252641223}], length 0
12:07:31.199675 IP 10.0.0.2.41824 > vagrant-ubuntu-trusty-64.8882: Flags [P.], seq 252640403:252640567, ack 1541465463, win 58, options [nop,nop,TS val 4294712846 ecr 4294712835], length 164
12:07:31.199738 IP vagrant-ubuntu-trusty-64.8882 > 10.0.0.2.41824: Flags [.], ack 252641223, win 105, options [nop,nop,TS val 4294712867 ecr 4294712846], length 0
12:07:31.204575 IP 10.0.0.2.41824 > vagrant-ubuntu-trusty-64.8882: Flags [P.], seq 252641223:252641387, ack 1541465463, win 58, options [nop,nop,TS val 4294712849 ecr 4294712835], length 164
12:07:31.204643 IP vagrant-ubuntu-trusty-64.8882 > 10.0.0.2.41824: Flags [.], ack 252641387, win 107, options [nop,nop,TS val 4294712872 ecr 4294712849], length 0
12:07:31.211504 IP 10.0.0.2.41824 > vagrant-ubuntu-trusty-64.8882: Flags [P.], seq 252641387:252641551, ack 1541465463, win 58, options [nop,nop,TS val 4294712869 ecr 4294712856], length 164
12:07:31.211537 IP vagrant-ubuntu-trusty-64.8882 > 10.0.0.2.41824: Flags [.], ack 252641551, win 109, options [nop,nop,TS val 4294712879 ecr 4294712869], length 0
12:07:31.237609 IP 10.0.0.2.41824 > vagrant-ubuntu-trusty-64.8882: Flags [P.], seq 252641551:252641715, ack 1541465463, win 58, options [nop,nop,TS val 4294712889 ecr 4294712872], length 164
12:07:31.237621 IP vagrant-ubuntu-trusty-64.8882 > 10.0.0.2.41824: Flags [.], ack 252641715, win 111, options [nop,nop,TS val 4294712906 ecr 4294712889], length 0
12:07:31.283667 IP 10.0.0.2.41824 > vagrant-ubuntu-trusty-64.8882: Flags [P.], seq 252641879:252642043, ack 1541465463, win 58, options [nop,nop,TS val 4294712930 ecr 4294712906], length 164
12:07:31.283746 IP vagrant-ubuntu-trusty-64.8882 > 10.0.0.2.41824: Flags [.], ack 252641715, win 114, options [nop,nop,TS val 4294712951 ecr 4294712889,nop,nop,sack 1 {252641879:252642043}], length 0
12:07:31.302351 IP 10.0.0.2.41824 > vagrant-ubuntu-trusty-64.8882: Flags [P.], seq 252642043:252642207, ack 1541465463, win 58, options [nop,nop,TS val 4294712949 ecr 4294712906], length 164
12:07:31.302415 IP vagrant-ubuntu-trusty-64.8882 > 10.0.0.2.41824: Flags [.], ack 252641715, win 116, options [nop,nop,TS val 4294712970 ecr 4294712889,nop,nop,sack 1 {252641879:252642207}], length 0
12:07:31.322533 IP 10.0.0.2.41824 > vagrant-ubuntu-trusty-64.8882: Flags [P.], seq 252642207:252642371, ack 1541465463, win 58, options [nop,nop,TS val 4294712970 ecr 4294712951], length 164
12:07:31.322645 IP vagrant-ubuntu-trusty-64.8882 > 10.0.0.2.41824: Flags [.], ack 252641715, win 118, options [nop,nop,TS val 4294712990 ecr 4294712889,nop,nop,sack 1 {252641879:252642371}], length 0
12:07:31.343442 IP 10.0.0.2.41824 > vagrant-ubuntu-trusty-64.8882: Flags [P.], seq 252642371:252642535, ack 1541465463, win 58, options [nop,nop,TS val 4294712991 ecr 4294712970], length 164
12:07:31.343522 IP vagrant-ubuntu-trusty-64.8882 > 10.0.0.2.41824: Flags [.], ack 252641715, win 120, options [nop,nop,TS val 4294713011 ecr 4294712889,nop,nop,sack 1 {252641879:252642535}], length 0
12:07:31.350809 IP 10.0.0.2.41824 > vagrant-ubuntu-trusty-64.8882: Flags [P.], seq 252641715:252641879, ack 1541465463, win 58, options [nop,nop,TS val 4294713001 ecr 4294712990], length 164
12:07:31.350832 IP vagrant-ubuntu-trusty-64.8882 > 10.0.0.2.41824: Flags [.], ack 252642535, win 122, options [nop,nop,TS val 4294713019 ecr 4294713001], length 0
12:07:31.357112 IP 10.0.0.2.41824 > vagrant-ubuntu-trusty-64.8882: Flags [P.], seq 252642535:252642699, ack 1541465463, win 58, options [nop,nop,TS val 4294713009 ecr 4294712990], length 164
12:07:31.357127 IP vagrant-ubuntu-trusty-64.8882 > 10.0.0.2.41824: Flags [.], ack 252642699, win 124, options [nop,nop,TS val 4294713025 ecr 4294713009], length 0
12:07:31.374522 IP 10.0.0.2.41824 > vagrant-ubuntu-trusty-64.8882: Flags [P.], seq 252642699:252642863, ack 1541465463, win 58, options [nop,nop,TS val 4294713029 ecr 4294713011], length 164
12:07:31.374591 IP vagrant-ubuntu-trusty-64.8882 > 10.0.0.2.41824: Flags [.], ack 252642863, win 126, options [nop,nop,TS val 4294713042 ecr 4294713029], length 0
12:07:31.392398 IP 10.0.0.2.41824 > vagrant-ubuntu-trusty-64.8882: Flags [P.], seq 252642863:252643027, ack 1541465463, win 58, options [nop,nop,TS val 4294713049 ecr 4294713025], length 164
12:07:31.392416 IP vagrant-ubuntu-trusty-64.8882 > 10.0.0.2.41824: Flags [.], ack 252643027, win 128, options [nop,nop,TS val 4294713060 ecr 4294713049], length 0
12:07:31.415405 IP 10.0.0.2.41824 > vagrant-ubuntu-trusty-64.8882: Flags [P.], seq 252643027:252643191, ack 1541465463, win 58, options [nop,nop,TS val 4294713069 ecr 4294713042], length 164
12:07:31.415426 IP vagrant-ubuntu-trusty-64.8882 > 10.0.0.2.41824: Flags [.], ack 252643191, win 130, options [nop,nop,TS val 4294713083 ecr 4294713069], length 0
12:07:31.438396 IP 10.0.0.2.41824 > vagrant-ubuntu-trusty-64.8882: Flags [P.], seq 252643191:252643355, ack 1541465463, win 58, options [nop,nop,TS val 4294713090 ecr 4294713060], length 164
12:07:31.438429 IP vagrant-ubuntu-trusty-64.8882 > 10.0.0.2.41824: Flags [.], ack 252643355, win 132, options [nop,nop,TS val 4294713106 ecr 4294713090], length 0
12:07:31.457290 IP 10.0.0.2.41824 > vagrant-ubuntu-trusty-64.8882: Flags [P.], seq 252643355:252643519, ack 1541465463, win 58, options [nop,nop,TS val 4294713110 ecr 4294713083], length 164
12:07:31.457373 IP vagrant-ubuntu-trusty-64.8882 > 10.0.0.2.41824: Flags [.], ack 252643519, win 135, options [nop,nop,TS val 4294713125 ecr 4294713110], length 0
12:07:31.475207 IP 10.0.0.2.41824 > vagrant-ubuntu-trusty-64.8882: Flags [P.], seq 252643519:252643683, ack 1541465463, win 58, options [nop,nop,TS val 4294713129 ecr 4294713106], length 164
12:07:31.475243 IP vagrant-ubuntu-trusty-64.8882 > 10.0.0.2.41824: Flags [.], ack 252643683, win 137, options [nop,nop,TS val 4294713143 ecr 4294713129], length 0
12:07:31.495303 IP 10.0.0.2.41824 > vagrant-ubuntu-trusty-64.8882: Flags [P.], seq 252643683:252643847, ack 1541465463, win 58, options [nop,nop,TS val 4294713149 ecr 4294713125], length 164
12:07:31.495362 IP vagrant-ubuntu-trusty-64.8882 > 10.0.0.2.41824: Flags [.], ack 252643847, win 139, options [nop,nop,TS val 4294713163 ecr 4294713149], length 0
12:07:31.516538 IP 10.0.0.2.41824 > vagrant-ubuntu-trusty-64.8882: Flags [P.], seq 252643847:252644011, ack 1541465463, win 58, options [nop,nop,TS val 4294713170 ecr 4294713143], length 164
12:07:31.516559 IP vagrant-ubuntu-trusty-64.8882 > 10.0.0.2.41824: Flags [.], ack 252644011, win 141, options [nop,nop,TS val 4294713184 ecr 4294713170], length 0
12:07:31.534792 IP 10.0.0.2.41824 > vagrant-ubuntu-trusty-64.8882: Flags [P.], seq 252644011:252644175, ack 1541465463, win 58, options [nop,nop,TS val 4294713189 ecr 4294713163], length 164
12:07:31.534805 IP vagrant-ubuntu-trusty-64.8882 > 10.0.0.2.41824: Flags [.], ack 252644175, win 143, options [nop,nop,TS val 4294713203 ecr 4294713189], length 0
12:07:31.557410 IP 10.0.0.2.41824 > vagrant-ubuntu-trusty-64.8882: Flags [P.], seq 252644175:252644339, ack 1541465463, win 58, options [nop,nop,TS val 4294713209 ecr 4294713184], length 164
12:07:31.557504 IP vagrant-ubuntu-trusty-64.8882 > 10.0.0.2.41824: Flags [.], ack 252644339, win 145, options [nop,nop,TS val 4294713225 ecr 4294713209], length 0
12:07:31.578403 IP 10.0.0.2.41824 > vagrant-ubuntu-trusty-64.8882: Flags [P.], seq 252644339:252644503, ack 1541465463, win 58, options [nop,nop,TS val 4294713229 ecr 4294713203], length 164
12:07:31.578464 IP vagrant-ubuntu-trusty-64.8882 > 10.0.0.2.41824: Flags [.], ack 252644503, win 147, options [nop,nop,TS val 4294713246 ecr 4294713229], length 0
12:07:31.596415 IP 10.0.0.2.41824 > vagrant-ubuntu-trusty-64.8882: Flags [P.], seq 252644503:252644667, ack 1541465463, win 58, options [nop,nop,TS val 4294713249 ecr 4294713225], length 164
12:07:31.596435 IP vagrant-ubuntu-trusty-64.8882 > 10.0.0.2.41824: Flags [.], ack 252644667, win 149, options [nop,nop,TS val 4294713264 ecr 4294713249], length 0
12:07:31.618503 IP 10.0.0.2.41824 > vagrant-ubuntu-trusty-64.8882: Flags [P.], seq 252644667:252644831, ack 1541465463, win 58, options [nop,nop,TS val 4294713269 ecr 4294713246], length 164
12:07:31.618565 IP vagrant-ubuntu-trusty-64.8882 > 10.0.0.2.41824: Flags [.], ack 252644831, win 151, options [nop,nop,TS val 4294713286 ecr 4294713269], length 0
12:07:31.636377 IP 10.0.0.2.41824 > vagrant-ubuntu-trusty-64.8882: Flags [P.], seq 252644831:252644995, ack 1541465463, win 58, options [nop,nop,TS val 4294713289 ecr 4294713264], length 164
12:07:31.636387 IP vagrant-ubuntu-trusty-64.8882 > 10.0.0.2.41824: Flags [.], ack 252644995, win 153, options [nop,nop,TS val 4294713304 ecr 4294713289], length 0
12:07:31.658581 IP 10.0.0.2.41824 > vagrant-ubuntu-trusty-64.8882: Flags [P.], seq 252644995:252645159, ack 1541465463, win 58, options [nop,nop,TS val 4294713309 ecr 4294713286], length 164
12:07:31.658667 IP vagrant-ubuntu-trusty-64.8882 > 10.0.0.2.41824: Flags [.], ack 252645159, win 155, options [nop,nop,TS val 4294713326 ecr 4294713309], length 0
12:07:31.676693 IP 10.0.0.2.41824 > vagrant-ubuntu-trusty-64.8882: Flags [P.], seq 252645159:252645323, ack 1541465463, win 58, options [nop,nop,TS val 4294713330 ecr 4294713304], length 164
12:07:31.676772 IP vagrant-ubuntu-trusty-64.8882 > 10.0.0.2.41824: Flags [.], ack 252645323, win 158, options [nop,nop,TS val 4294713344 ecr 4294713330], length 0
12:07:31.697725 IP 10.0.0.2.41824 > vagrant-ubuntu-trusty-64.8882: Flags [P.], seq 252645323:252645487, ack 1541465463, win 58, options [nop,nop,TS val 4294713349 ecr 4294713326], length 164
12:07:31.697755 IP vagrant-ubuntu-trusty-64.8882 > 10.0.0.2.41824: Flags [.], ack 252645487, win 160, options [nop,nop,TS val 4294713366 ecr 4294713349], length 0
12:07:31.719643 IP 10.0.0.2.41824 > vagrant-ubuntu-trusty-64.8882: Flags [P.], seq 252645487:252645651, ack 1541465463, win 58, options [nop,nop,TS val 4294713370 ecr 4294713344], length 164
12:07:31.719665 IP vagrant-ubuntu-trusty-64.8882 > 10.0.0.2.41824: Flags [.], ack 252645651, win 162, options [nop,nop,TS val 4294713388 ecr 4294713370], length 0
12:07:31.740563 IP 10.0.0.2.41824 > vagrant-ubuntu-trusty-64.8882: Flags [P.], seq 252645651:252645815, ack 1541465463, win 58, options [nop,nop,TS val 4294713390 ecr 4294713366], length 164
12:07:31.740597 IP vagrant-ubuntu-trusty-64.8882 > 10.0.0.2.41824: Flags [.], ack 252645815, win 164, options [nop,nop,TS val 4294713408 ecr 4294713390], length 0
12:07:31.758866 IP 10.0.0.2.41824 > vagrant-ubuntu-trusty-64.8882: Flags [P.], seq 252645815:252645979, ack 1541465463, win 58, options [nop,nop,TS val 4294713409 ecr 4294713388], length 164
12:07:31.758934 IP vagrant-ubuntu-trusty-64.8882 > 10.0.0.2.41824: Flags [.], ack 252645979, win 166, options [nop,nop,TS val 4294713427 ecr 4294713409], length 0
12:07:31.780969 IP 10.0.0.2.41824 > vagrant-ubuntu-trusty-64.8882: Flags [P.], seq 252645979:252646143, ack 1541465463, win 58, options [nop,nop,TS val 4294713429 ecr 4294713408], length 164
12:07:31.781014 IP vagrant-ubuntu-trusty-64.8882 > 10.0.0.2.41824: Flags [.], ack 252646143, win 168, options [nop,nop,TS val 4294713449 ecr 4294713429], length 0
12:07:31.799670 IP 10.0.0.2.41824 > vagrant-ubuntu-trusty-64.8882: Flags [P.], seq 252646143:252646307, ack 1541465463, win 58, options [nop,nop,TS val 4294713449 ecr 4294713427], length 164
12:07:31.799741 IP vagrant-ubuntu-trusty-64.8882 > 10.0.0.2.41824: Flags [.], ack 252646307, win 170, options [nop,nop,TS val 4294713467 ecr 4294713449], length 0
12:07:31.820757 IP 10.0.0.2.41824 > vagrant-ubuntu-trusty-64.8882: Flags [P.], seq 252646307:252646471, ack 1541465463, win 58, options [nop,nop,TS val 4294713469 ecr 4294713449], length 164
12:07:31.820834 IP vagrant-ubuntu-trusty-64.8882 > 10.0.0.2.41824: Flags [.], ack 252646471, win 172, options [nop,nop,TS val 4294713488 ecr 4294713469], length 0
12:07:31.839600 IP 10.0.0.2.41824 > vagrant-ubuntu-trusty-64.8882: Flags [P.], seq 252646471:252646635, ack 1541465463, win 58, options [nop,nop,TS val 4294713489 ecr 4294713467], length 164
12:07:31.839681 IP vagrant-ubuntu-trusty-64.8882 > 10.0.0.2.41824: Flags [.], ack 252646635, win 174, options [nop,nop,TS val 4294713507 ecr 4294713489], length 0
12:07:31.860812 IP 10.0.0.2.41824 > vagrant-ubuntu-trusty-64.8882: Flags [P.], seq 252646635:252646799, ack 1541465463, win 58, options [nop,nop,TS val 4294713510 ecr 4294713488], length 164
12:07:31.860884 IP vagrant-ubuntu-trusty-64.8882 > 10.0.0.2.41824: Flags [.], ack 252646799, win 176, options [nop,nop,TS val 4294713528 ecr 4294713510], length 0
12:07:31.878742 IP 10.0.0.2.41824 > vagrant-ubuntu-trusty-64.8882: Flags [P.], seq 252646799:252646963, ack 1541465463, win 58, options [nop,nop,TS val 4294713529 ecr 4294713507], length 164
12:07:31.878770 IP vagrant-ubuntu-trusty-64.8882 > 10.0.0.2.41824: Flags [.], ack 252646963, win 178, options [nop,nop,TS val 4294713547 ecr 4294713529], length 0
12:07:31.900738 IP 10.0.0.2.41824 > vagrant-ubuntu-trusty-64.8882: Flags [P.], seq 252646963:252647127, ack 1541465463, win 58, options [nop,nop,TS val 4294713550 ecr 4294713528], length 164
12:07:31.900818 IP vagrant-ubuntu-trusty-64.8882 > 10.0.0.2.41824: Flags [.], ack 252647127, win 181, options [nop,nop,TS val 4294713568 ecr 4294713550], length 0
12:07:31.922003 IP 10.0.0.2.41824 > vagrant-ubuntu-trusty-64.8882: Flags [P.], seq 252647127:252647291, ack 1541465463, win 58, options [nop,nop,TS val 4294713569 ecr 4294713547], length 164
12:07:31.922049 IP vagrant-ubuntu-trusty-64.8882 > 10.0.0.2.41824: Flags [.], ack 252647291, win 183, options [nop,nop,TS val 4294713590 ecr 4294713569], length 0
12:07:31.943761 IP 10.0.0.2.41824 > vagrant-ubuntu-trusty-64.8882: Flags [P.], seq 252647291:252647455, ack 1541465463, win 58, options [nop,nop,TS val 4294713590 ecr 4294713568], length 164
12:07:31.943829 IP vagrant-ubuntu-trusty-64.8882 > 10.0.0.2.41824: Flags [.], ack 252647455, win 185, options [nop,nop,TS val 4294713611 ecr 4294713590], length 0
12:07:31.964331 IP 10.0.0.2.41824 > vagrant-ubuntu-trusty-64.8882: Flags [P.], seq 252647455:252647619, ack 1541465463, win 58, options [nop,nop,TS val 4294713609 ecr 4294713590], length 164
12:07:31.964346 IP vagrant-ubuntu-trusty-64.8882 > 10.0.0.2.41824: Flags [.], ack 252647619, win 187, options [nop,nop,TS val 4294713632 ecr 4294713609], length 0
12:07:31.983997 IP 10.0.0.2.41824 > vagrant-ubuntu-trusty-64.8882: Flags [P.], seq 252647619:252647783, ack 1541465463, win 58, options [nop,nop,TS val 4294713630 ecr 4294713611], length 164
12:07:31.984066 IP vagrant-ubuntu-trusty-64.8882 > 10.0.0.2.41824: Flags [.], ack 252647783, win 189, options [nop,nop,TS val 4294713651 ecr 4294713630], length 0
12:07:32.004926 IP 10.0.0.2.41824 > vagrant-ubuntu-trusty-64.8882: Flags [P.], seq 252647783:252647947, ack 1541465463, win 58, options [nop,nop,TS val 4294713649 ecr 4294713632], length 164
12:07:32.004987 IP vagrant-ubuntu-trusty-64.8882 > 10.0.0.2.41824: Flags [.], ack 252647947, win 191, options [nop,nop,TS val 4294713673 ecr 4294713649], length 0
12:07:32.022637 IP 10.0.0.2.41824 > vagrant-ubuntu-trusty-64.8882: Flags [P.], seq 252647947:252648111, ack 1541465463, win 58, options [nop,nop,TS val 4294713670 ecr 4294713651], length 164
12:07:32.022650 IP vagrant-ubuntu-trusty-64.8882 > 10.0.0.2.41824: Flags [.], ack 252648111, win 193, options [nop,nop,TS val 4294713691 ecr 4294713670], length 0
12:07:32.044856 IP 10.0.0.2.41824 > vagrant-ubuntu-trusty-64.8882: Flags [P.], seq 252648111:252648275, ack 1541465463, win 58, options [nop,nop,TS val 4294713689 ecr 4294713673], length 164
12:07:32.044930 IP vagrant-ubuntu-trusty-64.8882 > 10.0.0.2.41824: Flags [.], ack 252648275, win 195, options [nop,nop,TS val 4294713713 ecr 4294713689], length 0
12:07:32.062886 IP 10.0.0.2.41824 > vagrant-ubuntu-trusty-64.8882: Flags [P.], seq 252648275:252648439, ack 1541465463, win 58, options [nop,nop,TS val 4294713710 ecr 4294713691], length 164
12:07:32.062961 IP vagrant-ubuntu-trusty-64.8882 > 10.0.0.2.41824: Flags [.], ack 252648439, win 197, options [nop,nop,TS val 4294713730 ecr 4294713710], length 0
12:07:32.083970 IP 10.0.0.2.41824 > vagrant-ubuntu-trusty-64.8882: Flags [P.], seq 252648439:252648603, ack 1541465463, win 58, options [nop,nop,TS val 4294713730 ecr 4294713713], length 164
12:07:32.084004 IP vagrant-ubuntu-trusty-64.8882 > 10.0.0.2.41824: Flags [.], ack 252648603, win 199, options [nop,nop,TS val 4294713752 ecr 4294713730], length 0
12:07:32.102792 IP 10.0.0.2.41824 > vagrant-ubuntu-trusty-64.8882: Flags [P.], seq 252648603:252648767, ack 1541465463, win 58, options [nop,nop,TS val 4294713750 ecr 4294713730], length 164
12:07:32.102868 IP vagrant-ubuntu-trusty-64.8882 > 10.0.0.2.41824: Flags [.], ack 252648767, win 202, options [nop,nop,TS val 4294713770 ecr 4294713750], length 0
12:07:32.123804 IP 10.0.0.2.41824 > vagrant-ubuntu-trusty-64.8882: Flags [P.], seq 252648767:252648931, ack 1541465463, win 58, options [nop,nop,TS val 4294713770 ecr 4294713752], length 164
12:07:32.123817 IP vagrant-ubuntu-trusty-64.8882 > 10.0.0.2.41824: Flags [.], ack 252648931, win 204, options [nop,nop,TS val 4294713792 ecr 4294713770], length 0
12:07:32.145145 IP 10.0.0.2.41824 > vagrant-ubuntu-trusty-64.8882: Flags [P.], seq 252648931:252649095, ack 1541465463, win 58, options [nop,nop,TS val 4294713789 ecr 4294713770], length 164
12:07:32.145161 IP vagrant-ubuntu-trusty-64.8882 > 10.0.0.2.41824: Flags [.], ack 252649095, win 206, options [nop,nop,TS val 4294713813 ecr 4294713789], length 0
12:07:32.167046 IP 10.0.0.2.41824 > vagrant-ubuntu-trusty-64.8882: Flags [P.], seq 252649095:252649259, ack 1541465463, win 58, options [nop,nop,TS val 4294713810 ecr 4294713792], length 164
12:07:32.167109 IP vagrant-ubuntu-trusty-64.8882 > 10.0.0.2.41824: Flags [.], ack 252649259, win 208, options [nop,nop,TS val 4294713835 ecr 4294713810], length 0
12:07:32.185662 IP 10.0.0.2.41824 > vagrant-ubuntu-trusty-64.8882: Flags [P.], seq 252649259:252649423, ack 1541465463, win 58, options [nop,nop,TS val 4294713829 ecr 4294713813], length 164
12:07:32.185723 IP vagrant-ubuntu-trusty-64.8882 > 10.0.0.2.41824: Flags [.], ack 252649423, win 210, options [nop,nop,TS val 4294713853 ecr 4294713829], length 0
12:07:32.206986 IP 10.0.0.2.41824 > vagrant-ubuntu-trusty-64.8882: Flags [P.], seq 252649423:252649587, ack 1541465463, win 58, options [nop,nop,TS val 4294713850 ecr 4294713835], length 164
12:07:32.207043 IP vagrant-ubuntu-trusty-64.8882 > 10.0.0.2.41824: Flags [.], ack 252649587, win 212, options [nop,nop,TS val 4294713874 ecr 4294713850], length 0
12:07:32.224960 IP 10.0.0.2.41824 > vagrant-ubuntu-trusty-64.8882: Flags [P.], seq 252649587:252649751, ack 1541465463, win 58, options [nop,nop,TS val 4294713870 ecr 4294713853], length 164
12:07:32.224990 IP vagrant-ubuntu-trusty-64.8882 > 10.0.0.2.41824: Flags [.], ack 252649751, win 214, options [nop,nop,TS val 4294713893 ecr 4294713870], length 0
12:07:32.246859 IP 10.0.0.2.41824 > vagrant-ubuntu-trusty-64.8882: Flags [P.], seq 252649751:252649915, ack 1541465463, win 58, options [nop,nop,TS val 4294713890 ecr 4294713874], length 164
12:07:32.246934 IP vagrant-ubuntu-trusty-64.8882 > 10.0.0.2.41824: Flags [.], ack 252649915, win 216, options [nop,nop,TS val 4294713914 ecr 4294713890], length 0
12:07:32.264788 IP 10.0.0.2.41824 > vagrant-ubuntu-trusty-64.8882: Flags [P.], seq 252649915:252650079, ack 1541465463, win 58, options [nop,nop,TS val 4294713909 ecr 4294713893], length 164
12:07:32.264817 IP vagrant-ubuntu-trusty-64.8882 > 10.0.0.2.41824: Flags [.], ack 252650079, win 218, options [nop,nop,TS val 4294713933 ecr 4294713909], length 0
12:07:32.286148 IP 10.0.0.2.41824 > vagrant-ubuntu-trusty-64.8882: Flags [P.], seq 252650079:252650243, ack 1541465463, win 58, options [nop,nop,TS val 4294713930 ecr 4294713914], length 164
12:07:32.286165 IP vagrant-ubuntu-trusty-64.8882 > 10.0.0.2.41824: Flags [.], ack 252650243, win 220, options [nop,nop,TS val 4294713954 ecr 4294713930], length 0
12:07:32.307646 IP 10.0.0.2.41824 > vagrant-ubuntu-trusty-64.8882: Flags [P.], seq 252650243:252650407, ack 1541465463, win 58, options [nop,nop,TS val 4294713950 ecr 4294713933], length 164
12:07:32.307674 IP vagrant-ubuntu-trusty-64.8882 > 10.0.0.2.41824: Flags [.], ack 252650407, win 222, options [nop,nop,TS val 4294713975 ecr 4294713950], length 0
12:07:32.326947 IP 10.0.0.2.41824 > vagrant-ubuntu-trusty-64.8882: Flags [P.], seq 252650407:252650571, ack 1541465463, win 58, options [nop,nop,TS val 4294713970 ecr 4294713954], length 164
12:07:32.327036 IP vagrant-ubuntu-trusty-64.8882 > 10.0.0.2.41824: Flags [.], ack 252650571, win 225, options [nop,nop,TS val 4294713994 ecr 4294713970], length 0
12:07:32.347819 IP 10.0.0.2.41824 > vagrant-ubuntu-trusty-64.8882: Flags [P.], seq 252650571:252650735, ack 1541465463, win 58, options [nop,nop,TS val 4294713990 ecr 4294713975], length 164
12:07:32.347880 IP vagrant-ubuntu-trusty-64.8882 > 10.0.0.2.41824: Flags [.], ack 252650735, win 227, options [nop,nop,TS val 4294714015 ecr 4294713990], length 0
12:07:32.366126 IP 10.0.0.2.41824 > vagrant-ubuntu-trusty-64.8882: Flags [P.], seq 252650735:252650899, ack 1541465463, win 58, options [nop,nop,TS val 4294714010 ecr 4294713994], length 164
12:07:32.366171 IP vagrant-ubuntu-trusty-64.8882 > 10.0.0.2.41824: Flags [.], ack 252650899, win 229, options [nop,nop,TS val 4294714034 ecr 4294714010], length 0
12:07:32.387391 IP 10.0.0.2.41824 > vagrant-ubuntu-trusty-64.8882: Flags [P.], seq 252650899:252651063, ack 1541465463, win 58, options [nop,nop,TS val 4294714029 ecr 4294714015], length 164
12:07:32.387407 IP vagrant-ubuntu-trusty-64.8882 > 10.0.0.2.41824: Flags [.], ack 252651063, win 231, options [nop,nop,TS val 4294714055 ecr 4294714029], length 0
12:07:32.409126 IP 10.0.0.2.41824 > vagrant-ubuntu-trusty-64.8882: Flags [P.], seq 252651063:252651227, ack 1541465463, win 58, options [nop,nop,TS val 4294714049 ecr 4294714034], length 164
12:07:32.409191 IP vagrant-ubuntu-trusty-64.8882 > 10.0.0.2.41824: Flags [.], ack 252651227, win 233, options [nop,nop,TS val 4294714077 ecr 4294714049], length 0
12:07:32.430246 IP 10.0.0.2.41824 > vagrant-ubuntu-trusty-64.8882: Flags [P.], seq 252651227:252651391, ack 1541465463, win 58, options [nop,nop,TS val 4294714070 ecr 4294714055], length 164
12:07:32.430272 IP vagrant-ubuntu-trusty-64.8882 > 10.0.0.2.41824: Flags [.], ack 252651391, win 235, options [nop,nop,TS val 4294714098 ecr 4294714070], length 0
12:07:32.449047 IP 10.0.0.2.41824 > vagrant-ubuntu-trusty-64.8882: Flags [P.], seq 252651391:252651555, ack 1541465463, win 58, options [nop,nop,TS val 4294714089 ecr 4294714077], length 164
12:07:32.449122 IP vagrant-ubuntu-trusty-64.8882 > 10.0.0.2.41824: Flags [.], ack 252651555, win 237, options [nop,nop,TS val 4294714116 ecr 4294714089], length 0
12:07:32.470261 IP 10.0.0.2.41824 > vagrant-ubuntu-trusty-64.8882: Flags [P.], seq 252651555:252651719, ack 1541465463, win 58, options [nop,nop,TS val 4294714110 ecr 4294714098], length 164
12:07:32.470314 IP vagrant-ubuntu-trusty-64.8882 > 10.0.0.2.41824: Flags [.], ack 252651719, win 239, options [nop,nop,TS val 4294714138 ecr 4294714110], length 0
12:07:32.488816 IP 10.0.0.2.41824 > vagrant-ubuntu-trusty-64.8882: Flags [P.], seq 252651719:252651883, ack 1541465463, win 58, options [nop,nop,TS val 4294714130 ecr 4294714116], length 164
12:07:32.488879 IP vagrant-ubuntu-trusty-64.8882 > 10.0.0.2.41824: Flags [.], ack 252651883, win 241, options [nop,nop,TS val 4294714156 ecr 4294714130], length 0
12:07:32.510189 IP 10.0.0.2.41824 > vagrant-ubuntu-trusty-64.8882: Flags [P.], seq 252651883:252652047, ack 1541465463, win 58, options [nop,nop,TS val 4294714150 ecr 4294714138], length 164
12:07:32.510254 IP vagrant-ubuntu-trusty-64.8882 > 10.0.0.2.41824: Flags [.], ack 252652047, win 243, options [nop,nop,TS val 4294714178 ecr 4294714150], length 0
12:07:32.529174 IP 10.0.0.2.41824 > vagrant-ubuntu-trusty-64.8882: Flags [P.], seq 252652047:252652211, ack 1541465463, win 58, options [nop,nop,TS val 4294714169 ecr 4294714156], length 164
12:07:32.529234 IP vagrant-ubuntu-trusty-64.8882 > 10.0.0.2.41824: Flags [.], ack 252652211, win 245, options [nop,nop,TS val 4294714197 ecr 4294714169], length 0
12:07:32.549595 IP 10.0.0.2.41824 > vagrant-ubuntu-trusty-64.8882: Flags [P.], seq 252652211:252652375, ack 1541465463, win 58, options [nop,nop,TS val 4294714189 ecr 4294714178], length 164
12:07:32.549607 IP vagrant-ubuntu-trusty-64.8882 > 10.0.0.2.41824: Flags [.], ack 252652375, win 248, options [nop,nop,TS val 4294714217 ecr 4294714189], length 0
12:07:32.568197 IP 10.0.0.2.41824 > vagrant-ubuntu-trusty-64.8882: Flags [P.], seq 252652375:252652539, ack 1541465463, win 58, options [nop,nop,TS val 4294714209 ecr 4294714197], length 164
12:07:32.568226 IP vagrant-ubuntu-trusty-64.8882 > 10.0.0.2.41824: Flags [.], ack 252652539, win 250, options [nop,nop,TS val 4294714236 ecr 4294714209], length 0
12:07:32.590013 IP 10.0.0.2.41824 > vagrant-ubuntu-trusty-64.8882: Flags [P.], seq 252652539:252652703, ack 1541465463, win 58, options [nop,nop,TS val 4294714229 ecr 4294714217], length 164
12:07:32.590070 IP vagrant-ubuntu-trusty-64.8882 > 10.0.0.2.41824: Flags [.], ack 252652703, win 252, options [nop,nop,TS val 4294714258 ecr 4294714229], length 0
12:07:32.607933 IP 10.0.0.2.41824 > vagrant-ubuntu-trusty-64.8882: Flags [P.], seq 252652703:252652867, ack 1541465463, win 58, options [nop,nop,TS val 4294714249 ecr 4294714236], length 164
12:07:32.607949 IP vagrant-ubuntu-trusty-64.8882 > 10.0.0.2.41824: Flags [.], ack 252652867, win 254, options [nop,nop,TS val 4294714276 ecr 4294714249], length 0
12:07:32.630073 IP 10.0.0.2.41824 > vagrant-ubuntu-trusty-64.8882: Flags [P.], seq 252652867:252653031, ack 1541465463, win 58, options [nop,nop,TS val 4294714269 ecr 4294714258], length 164
12:07:32.630157 IP vagrant-ubuntu-trusty-64.8882 > 10.0.0.2.41824: Flags [.], ack 252653031, win 256, options [nop,nop,TS val 4294714297 ecr 4294714269], length 0
12:07:32.647837 IP 10.0.0.2.41824 > vagrant-ubuntu-trusty-64.8882: Flags [P.], seq 252653031:252653195, ack 1541465463, win 58, options [nop,nop,TS val 4294714289 ecr 4294714276], length 164
12:07:32.647864 IP vagrant-ubuntu-trusty-64.8882 > 10.0.0.2.41824: Flags [.], ack 252653195, win 258, options [nop,nop,TS val 4294714316 ecr 4294714289], length 0
12:07:32.669138 IP 10.0.0.2.41824 > vagrant-ubuntu-trusty-64.8882: Flags [P.], seq 252653195:252653359, ack 1541465463, win 58, options [nop,nop,TS val 4294714309 ecr 4294714297], length 164
12:07:32.669154 IP vagrant-ubuntu-trusty-64.8882 > 10.0.0.2.41824: Flags [.], ack 252653359, win 260, options [nop,nop,TS val 4294714337 ecr 4294714309], length 0
12:07:32.694167 IP 10.0.0.2.41824 > vagrant-ubuntu-trusty-64.8882: Flags [P.], seq 252653359:252653523, ack 1541465463, win 58, options [nop,nop,TS val 4294714330 ecr 4294714316], length 164
12:07:32.694187 IP vagrant-ubuntu-trusty-64.8882 > 10.0.0.2.41824: Flags [.], ack 252653523, win 262, options [nop,nop,TS val 4294714362 ecr 4294714330], length 0
12:07:32.712164 IP 10.0.0.2.41824 > vagrant-ubuntu-trusty-64.8882: Flags [P.], seq 252653523:252653687, ack 1541465463, win 58, options [nop,nop,TS val 4294714350 ecr 4294714337], length 164
12:07:32.712179 IP vagrant-ubuntu-trusty-64.8882 > 10.0.0.2.41824: Flags [.], ack 252653687, win 264, options [nop,nop,TS val 4294714380 ecr 4294714350], length 0
12:07:32.734067 IP 10.0.0.2.41824 > vagrant-ubuntu-trusty-64.8882: Flags [P.], seq 252653687:252653851, ack 1541465463, win 58, options [nop,nop,TS val 4294714370 ecr 4294714337], length 164
12:07:32.734144 IP vagrant-ubuntu-trusty-64.8882 > 10.0.0.2.41824: Flags [.], ack 252653851, win 266, options [nop,nop,TS val 4294714401 ecr 4294714370], length 0
12:07:32.752281 IP 10.0.0.2.41824 > vagrant-ubuntu-trusty-64.8882: Flags [P.], seq 252653851:252654015, ack 1541465463, win 58, options [nop,nop,TS val 4294714390 ecr 4294714362], length 164
12:07:32.752302 IP vagrant-ubuntu-trusty-64.8882 > 10.0.0.2.41824: Flags [.], ack 252654015, win 269, options [nop,nop,TS val 4294714420 ecr 4294714390], length 0
12:07:32.773272 IP 10.0.0.2.41824 > vagrant-ubuntu-trusty-64.8882: Flags [P.], seq 252654015:252654179, ack 1541465463, win 58, options [nop,nop,TS val 4294714409 ecr 4294714380], length 164
12:07:32.773285 IP vagrant-ubuntu-trusty-64.8882 > 10.0.0.2.41824: Flags [.], ack 252654179, win 271, options [nop,nop,TS val 4294714441 ecr 4294714409], length 0
12:07:32.792308 IP 10.0.0.2.41824 > vagrant-ubuntu-trusty-64.8882: Flags [P.], seq 252654179:252654343, ack 1541465463, win 58, options [nop,nop,TS val 4294714430 ecr 4294714401], length 164
12:07:32.792333 IP vagrant-ubuntu-trusty-64.8882 > 10.0.0.2.41824: Flags [.], ack 252654343, win 273, options [nop,nop,TS val 4294714460 ecr 4294714430], length 0
12:07:32.813912 IP 10.0.0.2.41824 > vagrant-ubuntu-trusty-64.8882: Flags [P.], seq 252654343:252654507, ack 1541465463, win 58, options [nop,nop,TS val 4294714450 ecr 4294714420], length 164
12:07:32.814024 IP vagrant-ubuntu-trusty-64.8882 > 10.0.0.2.41824: Flags [.], ack 252654507, win 275, options [nop,nop,TS val 4294714481 ecr 4294714450], length 0
12:07:32.832111 IP 10.0.0.2.41824 > vagrant-ubuntu-trusty-64.8882: Flags [P.], seq 252654507:252654671, ack 1541465463, win 58, options [nop,nop,TS val 4294714469 ecr 4294714441], length 164
12:07:32.832186 IP vagrant-ubuntu-trusty-64.8882 > 10.0.0.2.41824: Flags [.], ack 252654671, win 277, options [nop,nop,TS val 4294714499 ecr 4294714469], length 0
12:07:32.853049 IP 10.0.0.2.41824 > vagrant-ubuntu-trusty-64.8882: Flags [P.], seq 252654671:252654835, ack 1541465463, win 58, options [nop,nop,TS val 4294714490 ecr 4294714460], length 164
12:07:32.853079 IP vagrant-ubuntu-trusty-64.8882 > 10.0.0.2.41824: Flags [.], ack 252654835, win 279, options [nop,nop,TS val 4294714521 ecr 4294714490], length 0
12:07:32.872199 IP 10.0.0.2.41824 > vagrant-ubuntu-trusty-64.8882: Flags [P.], seq 252654835:252654999, ack 1541465463, win 58, options [nop,nop,TS val 4294714509 ecr 4294714481], length 164
12:07:32.872229 IP vagrant-ubuntu-trusty-64.8882 > 10.0.0.2.41824: Flags [.], ack 252654999, win 281, options [nop,nop,TS val 4294714540 ecr 4294714509], length 0
12:07:32.893355 IP 10.0.0.2.41824 > vagrant-ubuntu-trusty-64.8882: Flags [P.], seq 252654999:252655163, ack 1541465463, win 58, options [nop,nop,TS val 4294714530 ecr 4294714499], length 164
12:07:32.893424 IP vagrant-ubuntu-trusty-64.8882 > 10.0.0.2.41824: Flags [.], ack 252655163, win 283, options [nop,nop,TS val 4294714561 ecr 4294714530], length 0
12:07:32.911292 IP 10.0.0.2.41824 > vagrant-ubuntu-trusty-64.8882: Flags [P.], seq 252655163:252655327, ack 1541465463, win 58, options [nop,nop,TS val 4294714549 ecr 4294714521], length 164
12:07:32.911322 IP vagrant-ubuntu-trusty-64.8882 > 10.0.0.2.41824: Flags [.], ack 252655327, win 285, options [nop,nop,TS val 4294714579 ecr 4294714549], length 0
12:07:32.933123 IP 10.0.0.2.41824 > vagrant-ubuntu-trusty-64.8882: Flags [P.], seq 252655327:252655491, ack 1541465463, win 58, options [nop,nop,TS val 4294714569 ecr 4294714540], length 164
12:07:32.933183 IP vagrant-ubuntu-trusty-64.8882 > 10.0.0.2.41824: Flags [.], ack 252655491, win 287, options [nop,nop,TS val 4294714601 ecr 4294714569], length 0
12:07:32.951076 IP 10.0.0.2.41824 > vagrant-ubuntu-trusty-64.8882: Flags [P.], seq 252655491:252655655, ack 1541465463, win 58, options [nop,nop,TS val 4294714589 ecr 4294714561], length 164
12:07:32.951096 IP vagrant-ubuntu-trusty-64.8882 > 10.0.0.2.41824: Flags [.], ack 252655655, win 289, options [nop,nop,TS val 4294714619 ecr 4294714589], length 0
12:07:32.972404 IP 10.0.0.2.41824 > vagrant-ubuntu-trusty-64.8882: Flags [P.], seq 252655655:252655819, ack 1541465463, win 58, options [nop,nop,TS val 4294714610 ecr 4294714579], length 164
12:07:32.972418 IP vagrant-ubuntu-trusty-64.8882 > 10.0.0.2.41824: Flags [.], ack 252655819, win 292, options [nop,nop,TS val 4294714640 ecr 4294714610], length 0
12:07:32.994427 IP 10.0.0.2.41824 > vagrant-ubuntu-trusty-64.8882: Flags [P.], seq 252655819:252655983, ack 1541465463, win 58, options [nop,nop,TS val 4294714629 ecr 4294714619], length 164
12:07:32.994448 IP vagrant-ubuntu-trusty-64.8882 > 10.0.0.2.41824: Flags [.], ack 252655983, win 294, options [nop,nop,TS val 4294714662 ecr 4294714629], length 0
12:07:33.016049 IP 10.0.0.2.41824 > vagrant-ubuntu-trusty-64.8882: Flags [P.], seq 252655983:252656147, ack 1541465463, win 58, options [nop,nop,TS val 4294714650 ecr 4294714619], length 164
12:07:33.016138 IP vagrant-ubuntu-trusty-64.8882 > 10.0.0.2.41824: Flags [.], ack 252656147, win 296, options [nop,nop,TS val 4294714683 ecr 4294714650], length 0
