11:14:48.302689 IP 10.0.0.2.55576 > 10.0.0.1.8882: Flags [P.], seq 4291580508:4291580672, ack 2539468977, win 58, options [nop,nop,TS val 4294837557 ecr 4294837528], length 164
11:14:48.303034 IP 10.0.0.1.8882 > 10.0.0.2.55576: Flags [.], ack 4291580672, win 80, options [nop,nop,TS val 4294837568 ecr 4294837557], length 0
11:14:48.322558 IP 10.0.0.2.55576 > 10.0.0.1.8882: Flags [P.], seq 4291580672:4291580836, ack 2539468977, win 58, options [nop,nop,TS val 4294837577 ecr 4294837548], length 164
11:14:48.322617 IP 10.0.0.1.8882 > 10.0.0.2.55576: Flags [.], ack 4291580836, win 82, options [nop,nop,TS val 4294837588 ecr 4294837577], length 0
11:14:48.344416 IP 10.0.0.2.55576 > 10.0.0.1.8882: Flags [P.], seq 4291580836:4291581000, ack 2539468977, win 58, options [nop,nop,TS val 4294837597 ecr 4294837568], length 164
11:14:48.344492 IP 10.0.0.1.8882 > 10.0.0.2.55576: Flags [.], ack 4291581000, win 84, options [nop,nop,TS val 4294837610 ecr 4294837597], length 0
11:14:48.365368 IP 10.0.0.2.55576 > 10.0.0.1.8882: Flags [P.], seq 4291581000:4291581164, ack 2539468977, win 58, options [nop,nop,TS val 4294837619 ecr 4294837588], length 164
11:14:48.365399 IP 10.0.0.1.8882 > 10.0.0.2.55576: Flags [.], ack 4291581164, win 86, options [nop,nop,TS val 4294837630 ecr 4294837619], length 0
11:14:48.384133 IP 10.0.0.2.55576 > 10.0.0.1.8882: Flags [P.], seq 4291581164:4291581328, ack 2539468977, win 58, options [nop,nop,TS val 4294837639 ecr 4294837610], length 164
11:14:48.384174 IP 10.0.0.1.8882 > 10.0.0.2.55576: Flags [.], ack 4291581328, win 88, options [nop,nop,TS val 4294837649 ecr 4294837639], length 0
11:14:48.402373 IP 10.0.0.2.55576 > 10.0.0.1.8882: Flags [P.], seq 4291581328:4291581492, ack 2539468977, win 58, options [nop,nop,TS val 4294837657 ecr 4294837630], length 164
11:14:48.402400 IP 10.0.0.1.8882 > 10.0.0.2.55576: Flags [.], ack 4291581492, win 91, options [nop,nop,TS val 4294837667 ecr 4294837657], length 0
11:14:48.422405 IP 10.0.0.2.55576 > 10.0.0.1.8882: Flags [P.], seq 4291581492:4291581656, ack 2539468977, win 58, options [nop,nop,TS val 4294837677 ecr 4294837649], length 164
11:14:48.422454 IP 10.0.0.1.8882 > 10.0.0.2.55576: Flags [.], ack 4291581656, win 93, options [nop,nop,TS val 4294837687 ecr 4294837677], length 0
11:14:48.442543 IP 10.0.0.2.55576 > 10.0.0.1.8882: Flags [P.], seq 4291581656:4291581820, ack 2539468977, win 58, options [nop,nop,TS val 4294837697 ecr 4294837667], length 164
11:14:48.442568 IP 10.0.0.1.8882 > 10.0.0.2.55576: Flags [.], ack 4291581820, win 95, options [nop,nop,TS val 4294837708 ecr 4294837697], length 0
11:14:48.462540 IP 10.0.0.2.55576 > 10.0.0.1.8882: Flags [P.], seq 4291581820:4291581984, ack 2539468977, win 58, options [nop,nop,TS val 4294837717 ecr 4294837687], length 164
11:14:48.462566 IP 10.0.0.1.8882 > 10.0.0.2.55576: Flags [.], ack 4291581984, win 97, options [nop,nop,TS val 4294837728 ecr 4294837717], length 0
11:14:48.482826 IP 10.0.0.2.55576 > 10.0.0.1.8882: Flags [P.], seq 4291581984:4291582148, ack 2539468977, win 58, options [nop,nop,TS val 4294837737 ecr 4294837708], length 164
11:14:48.483054 IP 10.0.0.1.8882 > 10.0.0.2.55576: Flags [.], ack 4291582148, win 99, options [nop,nop,TS val 4294837748 ecr 4294837737], length 0
11:14:48.502399 IP 10.0.0.2.55576 > 10.0.0.1.8882: Flags [P.], seq 4291582148:4291582312, ack 2539468977, win 58, options [nop,nop,TS val 4294837757 ecr 4294837728], length 164
11:14:48.502450 IP 10.0.0.1.8882 > 10.0.0.2.55576: Flags [.], ack 4291582312, win 101, options [nop,nop,TS val 4294837767 ecr 4294837757], length 0
11:14:48.522233 IP 10.0.0.2.55576 > 10.0.0.1.8882: Flags [P.], seq 4291582312:4291582476, ack 2539468977, win 58, options [nop,nop,TS val 4294837777 ecr 4294837748], length 164
11:14:48.522280 IP 10.0.0.1.8882 > 10.0.0.2.55576: Flags [.], ack 4291582476, win 103, options [nop,nop,TS val 4294837787 ecr 4294837777], length 0
11:14:48.542531 IP 10.0.0.2.55576 > 10.0.0.1.8882: Flags [P.], seq 4291582476:4291582640, ack 2539468977, win 58, options [nop,nop,TS val 4294837797 ecr 4294837767], length 164
11:14:48.542633 IP 10.0.0.1.8882 > 10.0.0.2.55576: Flags [.], ack 4291582640, win 105, options [nop,nop,TS val 4294837808 ecr 4294837797], length 0
11:14:48.562521 IP 10.0.0.2.55576 > 10.0.0.1.8882: Flags [P.], seq 4291582640:4291582804, ack 2539468977, win 58, options [nop,nop,TS val 4294837817 ecr 4294837787], length 164
11:14:48.562544 IP 10.0.0.1.8882 > 10.0.0.2.55576: Flags [.], ack 4291582804, win 107, options [nop,nop,TS val 4294837828 ecr 4294837817], length 0
11:14:48.583321 IP 10.0.0.2.55576 > 10.0.0.1.8882: Flags [P.], seq 4291582804:4291582968, ack 2539468977, win 58, options [nop,nop,TS val 4294837838 ecr 4294837808], length 164
11:14:48.583524 IP 10.0.0.1.8882 > 10.0.0.2.55576: Flags [.], ack 4291582968, win 109, options [nop,nop,TS val 4294837848 ecr 4294837838], length 0
11:14:48.602574 IP 10.0.0.2.55576 > 10.0.0.1.8882: Flags [P.], seq 4291582968:4291583132, ack 2539468977, win 58, options [nop,nop,TS val 4294837857 ecr 4294837828], length 164
11:14:48.602611 IP 10.0.0.1.8882 > 10.0.0.2.55576: Flags [.], ack 4291583132, win 111, options [nop,nop,TS val 4294837868 ecr 4294837857], length 0
11:14:48.622354 IP 10.0.0.2.55576 > 10.0.0.1.8882: Flags [P.], seq 4291583132:4291583296, ack 2539468977, win 58, options [nop,nop,TS val 4294837877 ecr 4294837848], length 164
11:14:48.622383 IP 10.0.0.1.8882 > 10.0.0.2.55576: Flags [.], ack 4291583296, win 114, options [nop,nop,TS val 4294837887 ecr 4294837877], length 0
11:14:48.642726 IP 10.0.0.2.55576 > 10.0.0.1.8882: Flags [P.], seq 4291583296:4291583460, ack 2539468977, win 58, options [nop,nop,TS val 4294837897 ecr 4294837868], length 164
11:14:48.642771 IP 10.0.0.1.8882 > 10.0.0.2.55576: Flags [.], ack 4291583460, win 116, options [nop,nop,TS val 4294837907 ecr 4294837897], length 0
11:14:48.662448 IP 10.0.0.2.55576 > 10.0.0.1.8882: Flags [P.], seq 4291583460:4291583624, ack 2539468977, win 58, options [nop,nop,TS val 4294837917 ecr 4294837887], length 164
11:14:48.662476 IP 10.0.0.1.8882 > 10.0.0.2.55576: Flags [.], ack 4291583624, win 118, options [nop,nop,TS val 4294837927 ecr 4294837917], length 0
11:14:48.685514 IP 10.0.0.2.55576 > 10.0.0.1.8882: Flags [P.], seq 4291583624:4291583788, ack 2539468977, win 58, options [nop,nop,TS val 4294837940 ecr 4294837927], length 164
11:14:48.685548 IP 10.0.0.1.8882 > 10.0.0.2.55576: Flags [.], ack 4291583788, win 120, options [nop,nop,TS val 4294837950 ecr 4294837940], length 0
11:14:48.702701 IP 10.0.0.2.55576 > 10.0.0.1.8882: Flags [P.], seq 4291583788:4291583952, ack 2539468977, win 58, options [nop,nop,TS val 4294837958 ecr 4294837927], length 164
11:14:48.702833 IP 10.0.0.1.8882 > 10.0.0.2.55576: Flags [.], ack 4291583952, win 122, options [nop,nop,TS val 4294837968 ecr 4294837958], length 0
11:14:48.722618 IP 10.0.0.2.55576 > 10.0.0.1.8882: Flags [P.], seq 4291583952:4291584116, ack 2539468977, win 58, options [nop,nop,TS val 4294837977 ecr 4294837950], length 164
11:14:48.722711 IP 10.0.0.1.8882 > 10.0.0.2.55576: Flags [.], ack 4291584116, win 124, options [nop,nop,TS val 4294837988 ecr 4294837977], length 0
11:14:48.743944 IP 10.0.0.2.55576 > 10.0.0.1.8882: Flags [P.], seq 4291584116:4291584280, ack 2539468977, win 58, options [nop,nop,TS val 4294837999 ecr 4294837988], length 164
11:14:48.744921 IP 10.0.0.1.8882 > 10.0.0.2.55576: Flags [.], ack 4291584280, win 126, options [nop,nop,TS val 4294838010 ecr 4294837999], length 0
11:14:48.762383 IP 10.0.0.2.55576 > 10.0.0.1.8882: Flags [P.], seq 4291584280:4291584444, ack 2539468977, win 58, options [nop,nop,TS val 4294838017 ecr 4294837988], length 164
11:14:48.762981 IP 10.0.0.1.8882 > 10.0.0.2.55576: Flags [.], ack 4291584444, win 128, options [nop,nop,TS val 4294838028 ecr 4294838017], length 0
11:14:48.782710 IP 10.0.0.2.55576 > 10.0.0.1.8882: Flags [P.], seq 4291584444:4291584608, ack 2539468977, win 58, options [nop,nop,TS val 4294838037 ecr 4294838010], length 164
11:14:48.782791 IP 10.0.0.1.8882 > 10.0.0.2.55576: Flags [.], ack 4291584608, win 130, options [nop,nop,TS val 4294838048 ecr 4294838037], length 0
11:14:48.802860 IP 10.0.0.2.55576 > 10.0.0.1.8882: Flags [P.], seq 4291584608:4291584772, ack 2539468977, win 58, options [nop,nop,TS val 4294838057 ecr 4294838028], length 164
11:14:48.802929 IP 10.0.0.1.8882 > 10.0.0.2.55576: Flags [.], ack 4291584772, win 132, options [nop,nop,TS val 4294838068 ecr 4294838057], length 0
11:14:48.824799 IP 10.0.0.2.55576 > 10.0.0.1.8882: Flags [P.], seq 4291584772:4291584936, ack 2539468977, win 58, options [nop,nop,TS val 4294838079 ecr 4294838068], length 164
11:14:48.824834 IP 10.0.0.1.8882 > 10.0.0.2.55576: Flags [.], ack 4291584936, win 135, options [nop,nop,TS val 4294838090 ecr 4294838079], length 0
11:14:48.842918 IP 10.0.0.2.55576 > 10.0.0.1.8882: Flags [P.], seq 4291584936:4291585100, ack 2539468977, win 58, options [nop,nop,TS val 4294838097 ecr 4294838068], length 164
11:14:48.843309 IP 10.0.0.1.8882 > 10.0.0.2.55576: Flags [.], ack 4291585100, win 137, options [nop,nop,TS val 4294838108 ecr 4294838097], length 0
11:14:48.863185 IP 10.0.0.2.55576 > 10.0.0.1.8882: Flags [P.], seq 4291585100:4291585264, ack 2539468977, win 58, options [nop,nop,TS val 4294838118 ecr 4294838090], length 164
11:14:48.864108 IP 10.0.0.1.8882 > 10.0.0.2.55576: Flags [.], ack 4291585264, win 139, options [nop,nop,TS val 4294838129 ecr 4294838118], length 0
11:14:48.882557 IP 10.0.0.2.55576 > 10.0.0.1.8882: Flags [P.], seq 4291585264:4291585428, ack 2539468977, win 58, options [nop,nop,TS val 4294838137 ecr 4294838108], length 164
11:14:48.882605 IP 10.0.0.1.8882 > 10.0.0.2.55576: Flags [.], ack 4291585428, win 141, options [nop,nop,TS val 4294838148 ecr 4294838137], length 0
11:14:48.902956 IP 10.0.0.2.55576 > 10.0.0.1.8882: Flags [P.], seq 4291585428:4291585592, ack 2539468977, win 58, options [nop,nop,TS val 4294838158 ecr 4294838148], length 164
11:14:48.903023 IP 10.0.0.1.8882 > 10.0.0.2.55576: Flags [.], ack 4291585592, win 143, options [nop,nop,TS val 4294838168 ecr 4294838158], length 0
11:14:48.922715 IP 10.0.0.2.55576 > 10.0.0.1.8882: Flags [P.], seq 4291585592:4291585756, ack 2539468977, win 58, options [nop,nop,TS val 4294838177 ecr 4294838148], length 164
11:14:48.923294 IP 10.0.0.1.8882 > 10.0.0.2.55576: Flags [.], ack 4291585756, win 145, options [nop,nop,TS val 4294838188 ecr 4294838177], length 0
11:14:48.943308 IP 10.0.0.2.55576 > 10.0.0.1.8882: Flags [P.], seq 4291585756:4291585920, ack 2539468977, win 58, options [nop,nop,TS val 4294838197 ecr 4294838168], length 164
11:14:48.943349 IP 10.0.0.1.8882 > 10.0.0.2.55576: Flags [.], ack 4291585920, win 147, options [nop,nop,TS val 4294838208 ecr 4294838197], length 0
11:14:48.962729 IP 10.0.0.2.55576 > 10.0.0.1.8882: Flags [P.], seq 4291585920:4291586084, ack 2539468977, win 58, options [nop,nop,TS val 4294838218 ecr 4294838188], length 164
11:14:48.962805 IP 10.0.0.1.8882 > 10.0.0.2.55576: Flags [.], ack 4291586084, win 149, options [nop,nop,TS val 4294838228 ecr 4294838218], length 0
11:14:48.982797 IP 10.0.0.2.55576 > 10.0.0.1.8882: Flags [P.], seq 4291586084:4291586248, ack 2539468977, win 58, options [nop,nop,TS val 4294838237 ecr 4294838208], length 164
11:14:48.982841 IP 10.0.0.1.8882 > 10.0.0.2.55576: Flags [.], ack 4291586248, win 151, options [nop,nop,TS val 4294838248 ecr 4294838237], length 0
11:14:49.002360 IP 10.0.0.2.55576 > 10.0.0.1.8882: Flags [P.], seq 4291586248:4291586412, ack 2539468977, win 58, options [nop,nop,TS val 4294838257 ecr 4294838228], length 164
11:14:49.002400 IP 10.0.0.1.8882 > 10.0.0.2.55576: Flags [.], ack 4291586412, win 153, options [nop,nop,TS val 4294838267 ecr 4294838257], length 0
11:14:49.022804 IP 10.0.0.2.55576 > 10.0.0.1.8882: Flags [P.], seq 4291586412:4291586576, ack 2539468977, win 58, options [nop,nop,TS val 4294838278 ecr 4294838248], length 164
11:14:49.022860 IP 10.0.0.1.8882 > 10.0.0.2.55576: Flags [.], ack 4291586576, win 155, options [nop,nop,TS val 4294838288 ecr 4294838278], length 0
11:14:49.042897 IP 10.0.0.2.55576 > 10.0.0.1.8882: Flags [P.], seq 4291586576:4291586740, ack 2539468977, win 58, options [nop,nop,TS val 4294838298 ecr 4294838267], length 164
11:14:49.042931 IP 10.0.0.1.8882 > 10.0.0.2.55576: Flags [.], ack 4291586740, win 158, options [nop,nop,TS val 4294838308 ecr 4294838298], length 0
11:14:49.062527 IP 10.0.0.2.55576 > 10.0.0.1.8882: Flags [P.], seq 4291586740:4291586904, ack 2539468977, win 58, options [nop,nop,TS val 4294838317 ecr 4294838288], length 164
11:14:49.062551 IP 10.0.0.1.8882 > 10.0.0.2.55576: Flags [.], ack 4291586904, win 160, options [nop,nop,TS val 4294838328 ecr 4294838317], length 0
11:14:49.082976 IP 10.0.0.2.55576 > 10.0.0.1.8882: Flags [P.], seq 4291586904:4291587068, ack 2539468977, win 58, options [nop,nop,TS val 4294838338 ecr 4294838328], length 164
11:14:49.083171 IP 10.0.0.1.8882 > 10.0.0.2.55576: Flags [.], ack 4291587068, win 162, options [nop,nop,TS val 4294838348 ecr 4294838338], length 0
11:14:49.102372 IP 10.0.0.2.55576 > 10.0.0.1.8882: Flags [P.], seq 4291587068:4291587232, ack 2539468977, win 58, options [nop,nop,TS val 4294838357 ecr 4294838328], length 164
11:14:49.102477 IP 10.0.0.1.8882 > 10.0.0.2.55576: Flags [.], ack 4291587232, win 164, options [nop,nop,TS val 4294838367 ecr 4294838357], length 0
11:14:49.122383 IP 10.0.0.2.55576 > 10.0.0.1.8882: Flags [P.], seq 4291587232:4291587396, ack 2539468977, win 58, options [nop,nop,TS val 4294838377 ecr 4294838348], length 164
11:14:49.122437 IP 10.0.0.1.8882 > 10.0.0.2.55576: Flags [.], ack 4291587396, win 166, options [nop,nop,TS val 4294838387 ecr 4294838377], length 0
11:14:49.142758 IP 10.0.0.2.55576 > 10.0.0.1.8882: Flags [P.], seq 4291587396:4291587560, ack 2539468977, win 58, options [nop,nop,TS val 4294838398 ecr 4294838367], length 164
11:14:49.142781 IP 10.0.0.1.8882 > 10.0.0.2.55576: Flags [.], ack 4291587560, win 168, options [nop,nop,TS val 4294838408 ecr 4294838398], length 0
11:14:49.163149 IP 10.0.0.2.55576 > 10.0.0.1.8882: Flags [P.], seq 4291587560:4291587724, ack 2539468977, win 58, options [nop,nop,TS val 4294838418 ecr 4294838387], length 164
11:14:49.163263 IP 10.0.0.1.8882 > 10.0.0.2.55576: Flags [.], ack 4291587724, win 170, options [nop,nop,TS val 4294838428 ecr 4294838418], length 0
11:14:49.182293 IP 10.0.0.2.55576 > 10.0.0.1.8882: Flags [P.], seq 4291587724:4291587888, ack 2539468977, win 58, options [nop,nop,TS val 4294838437 ecr 4294838408], length 164
11:14:49.182347 IP 10.0.0.1.8882 > 10.0.0.2.55576: Flags [.], ack 4291587888, win 172, options [nop,nop,TS val 4294838447 ecr 4294838437], length 0
11:14:49.202678 IP 10.0.0.2.55576 > 10.0.0.1.8882: Flags [P.], seq 4291587888:4291588052, ack 2539468977, win 58, options [nop,nop,TS val 4294838457 ecr 4294838428], length 164
11:14:49.202728 IP 10.0.0.1.8882 > 10.0.0.2.55576: Flags [.], ack 4291588052, win 174, options [nop,nop,TS val 4294838468 ecr 4294838457], length 0
11:14:49.222207 IP 10.0.0.2.55576 > 10.0.0.1.8882: Flags [P.], seq 4291588052:4291588216, ack 2539468977, win 58, options [nop,nop,TS val 4294838477 ecr 4294838447], length 164
11:14:49.222333 IP 10.0.0.1.8882 > 10.0.0.2.55576: Flags [.], ack 4291588216, win 176, options [nop,nop,TS val 4294838487 ecr 4294838477], length 0
11:14:49.242363 IP 10.0.0.2.55576 > 10.0.0.1.8882: Flags [P.], seq 4291588216:4291588380, ack 2539468977, win 58, options [nop,nop,TS val 4294838497 ecr 4294838468], length 164
11:14:49.243060 IP 10.0.0.1.8882 > 10.0.0.2.55576: Flags [.], ack 4291588380, win 178, options [nop,nop,TS val 4294838508 ecr 4294838497], length 0
11:14:49.262371 IP 10.0.0.2.55576 > 10.0.0.1.8882: Flags [P.], seq 4291588380:4291588544, ack 2539468977, win 58, options [nop,nop,TS val 4294838517 ecr 4294838487], length 164
11:14:49.262406 IP 10.0.0.1.8882 > 10.0.0.2.55576: Flags [.], ack 4291588544, win 181, options [nop,nop,TS val 4294838527 ecr 4294838517], length 0
11:14:49.283912 IP 10.0.0.2.55576 > 10.0.0.1.8882: Flags [P.], seq 4291588544:4291588708, ack 2539468977, win 58, options [nop,nop,TS val 4294838539 ecr 4294838527], length 164
11:14:49.283959 IP 10.0.0.1.8882 > 10.0.0.2.55576: Flags [.], ack 4291588708, win 183, options [nop,nop,TS val 4294838549 ecr 4294838539], length 0
11:14:49.302877 IP 10.0.0.2.55576 > 10.0.0.1.8882: Flags [P.], seq 4291588708:4291588872, ack 2539468977, win 58, options [nop,nop,TS val 4294838558 ecr 4294838527], length 164
11:14:49.302919 IP 10.0.0.1.8882 > 10.0.0.2.55576: Flags [.], ack 4291588872, win 185, options [nop,nop,TS val 4294838568 ecr 4294838558], length 0
11:14:49.322356 IP 10.0.0.2.55576 > 10.0.0.1.8882: Flags [P.], seq 4291588872:4291589036, ack 2539468977, win 58, options [nop,nop,TS val 4294838577 ecr 4294838549], length 164
11:14:49.322410 IP 10.0.0.1.8882 > 10.0.0.2.55576: Flags [.], ack 4291589036, win 187, options [nop,nop,TS val 4294838587 ecr 4294838577], length 0
11:14:49.343794 IP 10.0.0.2.55576 > 10.0.0.1.8882: Flags [P.], seq 4291589036:4291589200, ack 2539468977, win 58, options [nop,nop,TS val 4294838598 ecr 4294838587], length 164
11:14:49.344129 IP 10.0.0.1.8882 > 10.0.0.2.55576: Flags [.], ack 4291589200, win 189, options [nop,nop,TS val 4294838609 ecr 4294838598], length 0
11:14:49.362330 IP 10.0.0.2.55576 > 10.0.0.1.8882: Flags [P.], seq 4291589200:4291589364, ack 2539468977, win 58, options [nop,nop,TS val 4294838617 ecr 4294838587], length 164
11:14:49.362408 IP 10.0.0.1.8882 > 10.0.0.2.55576: Flags [.], ack 4291589364, win 191, options [nop,nop,TS val 4294838627 ecr 4294838617], length 0
11:14:49.382369 IP 10.0.0.2.55576 > 10.0.0.1.8882: Flags [P.], seq 4291589364:4291589528, ack 2539468977, win 58, options [nop,nop,TS val 4294838637 ecr 4294838609], length 164
11:14:49.382418 IP 10.0.0.1.8882 > 10.0.0.2.55576: Flags [.], ack 4291589528, win 193, options [nop,nop,TS val 4294838647 ecr 4294838637], length 0
11:14:49.404224 IP 10.0.0.2.55576 > 10.0.0.1.8882: Flags [P.], seq 4291589528:4291589692, ack 2539468977, win 58, options [nop,nop,TS val 4294838659 ecr 4294838627], length 164
11:14:49.404268 IP 10.0.0.1.8882 > 10.0.0.2.55576: Flags [.], ack 4291589692, win 195, options [nop,nop,TS val 4294838669 ecr 4294838659], length 0
11:14:49.422587 IP 10.0.0.2.55576 > 10.0.0.1.8882: Flags [P.], seq 4291589692:4291589856, ack 2539468977, win 58, options [nop,nop,TS val 4294838677 ecr 4294838647], length 164
11:14:49.422888 IP 10.0.0.1.8882 > 10.0.0.2.55576: Flags [.], ack 4291589856, win 197, options [nop,nop,TS val 4294838688 ecr 4294838677], length 0
11:14:49.442580 IP 10.0.0.2.55576 > 10.0.0.1.8882: Flags [P.], seq 4291589856:4291590020, ack 2539468977, win 58, options [nop,nop,TS val 4294838697 ecr 4294838669], length 164
11:14:49.442617 IP 10.0.0.1.8882 > 10.0.0.2.55576: Flags [.], ack 4291590020, win 199, options [nop,nop,TS val 4294838708 ecr 4294838697], length 0
11:14:49.462441 IP 10.0.0.2.55576 > 10.0.0.1.8882: Flags [P.], seq 4291590020:4291590184, ack 2539468977, win 58, options [nop,nop,TS val 4294838717 ecr 4294838688], length 164
11:14:49.462476 IP 10.0.0.1.8882 > 10.0.0.2.55576: Flags [.], ack 4291590184, win 202, options [nop,nop,TS val 4294838727 ecr 4294838717], length 0
11:14:49.482336 IP 10.0.0.2.55576 > 10.0.0.1.8882: Flags [P.], seq 4291590184:4291590348, ack 2539468977, win 58, options [nop,nop,TS val 4294838737 ecr 4294838708], length 164
11:14:49.482383 IP 10.0.0.1.8882 > 10.0.0.2.55576: Flags [.], ack 4291590348, win 204, options [nop,nop,TS val 4294838747 ecr 4294838737], length 0
11:14:49.502770 IP 10.0.0.2.55576 > 10.0.0.1.8882: Flags [P.], seq 4291590348:4291590512, ack 2539468977, win 58, options [nop,nop,TS val 4294838758 ecr 4294838747], length 164
11:14:49.502853 IP 10.0.0.1.8882 > 10.0.0.2.55576: Flags [.], ack 4291590512, win 206, options [nop,nop,TS val 4294838768 ecr 4294838758], length 0
11:14:49.522779 IP 10.0.0.2.55576 > 10.0.0.1.8882: Flags [P.], seq 4291590512:4291590676, ack 2539468977, win 58, options [nop,nop,TS val 4294838777 ecr 4294838747], length 164
11:14:49.522813 IP 10.0.0.1.8882 > 10.0.0.2.55576: Flags [.], ack 4291590676, win 208, options [nop,nop,TS val 4294838788 ecr 4294838777], length 0
11:14:49.542556 IP 10.0.0.2.55576 > 10.0.0.1.8882: Flags [P.], seq 4291590676:4291590840, ack 2539468977, win 58, options [nop,nop,TS val 4294838797 ecr 4294838768], length 164
11:14:49.542593 IP 10.0.0.1.8882 > 10.0.0.2.55576: Flags [.], ack 4291590840, win 210, options [nop,nop,TS val 4294838808 ecr 4294838797], length 0
11:14:49.562734 IP 10.0.0.2.55576 > 10.0.0.1.8882: Flags [P.], seq 4291590840:4291591004, ack 2539468977, win 58, options [nop,nop,TS val 4294838818 ecr 4294838788], length 164
11:14:49.563503 IP 10.0.0.1.8882 > 10.0.0.2.55576: Flags [.], ack 4291591004, win 212, options [nop,nop,TS val 4294838828 ecr 4294838818], length 0
11:14:49.582926 IP 10.0.0.2.55576 > 10.0.0.1.8882: Flags [P.], seq 4291591004:4291591168, ack 2539468977, win 58, options [nop,nop,TS val 4294838837 ecr 4294838808], length 164
11:14:49.582990 IP 10.0.0.1.8882 > 10.0.0.2.55576: Flags [.], ack 4291591168, win 214, options [nop,nop,TS val 4294838848 ecr 4294838837], length 0
11:14:49.602581 IP 10.0.0.2.55576 > 10.0.0.1.8882: Flags [P.], seq 4291591168:4291591332, ack 2539468977, win 58, options [nop,nop,TS val 4294838857 ecr 4294838828], length 164
11:14:49.603483 IP 10.0.0.1.8882 > 10.0.0.2.55576: Flags [.], ack 4291591332, win 216, options [nop,nop,TS val 4294838868 ecr 4294838857], length 0
11:14:49.623629 IP 10.0.0.2.55576 > 10.0.0.1.8882: Flags [P.], seq 4291591332:4291591496, ack 2539468977, win 58, options [nop,nop,TS val 4294838878 ecr 4294838848], length 164
11:14:49.623693 IP 10.0.0.1.8882 > 10.0.0.2.55576: Flags [.], ack 4291591496, win 218, options [nop,nop,TS val 4294838889 ecr 4294838878], length 0
11:14:49.643102 IP 10.0.0.2.55576 > 10.0.0.1.8882: Flags [P.], seq 4291591496:4291591660, ack 2539468977, win 58, options [nop,nop,TS val 4294838898 ecr 4294838868], length 164
11:14:49.643130 IP 10.0.0.1.8882 > 10.0.0.2.55576: Flags [.], ack 4291591660, win 220, options [nop,nop,TS val 4294838908 ecr 4294838898], length 0
11:14:49.662850 IP 10.0.0.2.55576 > 10.0.0.1.8882: Flags [P.], seq 4291591660:4291591824, ack 2539468977, win 58, options [nop,nop,TS val 4294838918 ecr 4294838889], length 164
11:14:49.662873 IP 10.0.0.1.8882 > 10.0.0.2.55576: Flags [.], ack 4291591824, win 222, options [nop,nop,TS val 4294838928 ecr 4294838918], length 0
11:14:49.684635 IP 10.0.0.2.55576 > 10.0.0.1.8882: Flags [P.], seq 4291591824:4291591988, ack 2539468977, win 58, options [nop,nop,TS val 4294838940 ecr 4294838928], length 164
11:14:49.684677 IP 10.0.0.1.8882 > 10.0.0.2.55576: Flags [.], ack 4291591988, win 225, options [nop,nop,TS val 4294838950 ecr 4294838940], length 0
11:14:49.702608 IP 10.0.0.2.55576 > 10.0.0.1.8882: Flags [P.], seq 4291591988:4291592152, ack 2539468977, win 58, options [nop,nop,TS val 4294838957 ecr 4294838928], length 164
11:14:49.702703 IP 10.0.0.1.8882 > 10.0.0.2.55576: Flags [.], ack 4291592152, win 227, options [nop,nop,TS val 4294838968 ecr 4294838957], length 0
11:14:49.722485 IP 10.0.0.2.55576 > 10.0.0.1.8882: Flags [P.], seq 4291592152:4291592316, ack 2539468977, win 58, options [nop,nop,TS val 4294838977 ecr 4294838950], length 164
11:14:49.722815 IP 10.0.0.1.8882 > 10.0.0.2.55576: Flags [.], ack 4291592316, win 229, options [nop,nop,TS val 4294838988 ecr 4294838977], length 0
11:14:49.743808 IP 10.0.0.2.55576 > 10.0.0.1.8882: Flags [P.], seq 4291592316:4291592480, ack 2539468977, win 58, options [nop,nop,TS val 4294838998 ecr 4294838988], length 164
11:14:49.743902 IP 10.0.0.1.8882 > 10.0.0.2.55576: Flags [.], ack 4291592480, win 231, options [nop,nop,TS val 4294839009 ecr 4294838998], length 0
11:14:49.762668 IP 10.0.0.2.55576 > 10.0.0.1.8882: Flags [P.], seq 4291592480:4291592644, ack 2539468977, win 58, options [nop,nop,TS val 4294839017 ecr 4294838988], length 164
11:14:49.762768 IP 10.0.0.1.8882 > 10.0.0.2.55576: Flags [.], ack 4291592644, win 233, options [nop,nop,TS val 4294839028 ecr 4294839017], length 0
11:14:49.792669 IP 10.0.0.2.55576 > 10.0.0.1.8882: Flags [P.], seq 4291592644:4291592808, ack 2539468977, win 58, options [nop,nop,TS val 4294839038 ecr 4294839009], length 164
11:14:49.792728 IP 10.0.0.1.8882 > 10.0.0.2.55576: Flags [.], ack 4291592808, win 235, options [nop,nop,TS val 4294839058 ecr 4294839038], length 0
11:14:49.814595 IP 10.0.0.2.55576 > 10.0.0.1.8882: Flags [P.], seq 4291592808:4291592972, ack 2539468977, win 58, options [nop,nop,TS val 4294839058 ecr 4294839028], length 164
11:14:49.814686 IP 10.0.0.1.8882 > 10.0.0.2.55576: Flags [.], ack 4291592972, win 237, options [nop,nop,TS val 4294839080 ecr 4294839058], length 0
11:14:49.846882 IP 10.0.0.2.55576 > 10.0.0.1.8882: Flags [P.], seq 4291592972:4291593136, ack 2539468977, win 58, options [nop,nop,TS val 4294839079 ecr 4294839058], length 164
11:14:49.847116 IP 10.0.0.1.8882 > 10.0.0.2.55576: Flags [.], ack 4291593136, win 239, options [nop,nop,TS val 4294839111 ecr 4294839079], length 0
11:14:49.870957 IP 10.0.0.2.55576 > 10.0.0.1.8882: Flags [P.], seq 4291593136:4291593300, ack 2539468977, win 58, options [nop,nop,TS val 4294839098 ecr 4294839080], length 164
11:14:49.871026 IP 10.0.0.1.8882 > 10.0.0.2.55576: Flags [.], ack 4291593300, win 241, options [nop,nop,TS val 4294839136 ecr 4294839098], length 0
11:14:49.918894 IP 10.0.0.2.55576 > 10.0.0.1.8882: Flags [P.], seq 4291593464:4291593628, ack 2539468977, win 58, options [nop,nop,TS val 4294839137 ecr 4294839111], length 164
11:14:49.919007 IP 10.0.0.1.8882 > 10.0.0.2.55576: Flags [.], ack 4291593300, win 243, options [nop,nop,TS val 4294839184 ecr 4294839098,nop,nop,sack 1 {4291593464:4291593628}], length 0
11:14:49.933096 IP 10.0.0.2.55576 > 10.0.0.1.8882: Flags [P.], seq 4291593628:4291593792, ack 2539468977, win 58, options [nop,nop,TS val 4294839157 ecr 4294839136], length 164
11:14:49.933349 IP 10.0.0.1.8882 > 10.0.0.2.55576: Flags [.], ack 4291593300, win 245, options [nop,nop,TS val 4294839198 ecr 4294839098,nop,nop,sack 1 {4291593464:4291593792}], length 0
11:14:49.973714 IP 10.0.0.2.55576 > 10.0.0.1.8882: Flags [P.], seq 4291594120:4291594284, ack 2539468977, win 58, options [nop,nop,TS val 4294839218 ecr 4294839198], length 164
11:14:49.974846 IP 10.0.0.1.8882 > 10.0.0.2.55576: Flags [.], ack 4291593300, win 248, options [nop,nop,TS val 4294839240 ecr 4294839098,nop,nop,sack 2 {4291594120:4291594284}{4291593464:4291593792}], length 0
11:14:50.015599 IP 10.0.0.2.55576 > 10.0.0.1.8882: Flags [P.], seq 4291593300:4291593464, ack 2539468977, win 58, options [nop,nop,TS val 4294839251 ecr 4294839240], length 164
11:14:50.015600 IP 10.0.0.2.55576 > 10.0.0.1.8882: Flags [P.], seq 4291593792:4291594120, ack 2539468977, win 58, options [nop,nop,TS val 4294839251 ecr 4294839240], length 328
11:14:50.015701 IP 10.0.0.1.8882 > 10.0.0.2.55576: Flags [.], ack 4291593792, win 250, options [nop,nop,TS val 4294839281 ecr 4294839251,nop,nop,sack 1 {4291594120:4291594284}], length 0
11:14:50.015710 IP 10.0.0.1.8882 > 10.0.0.2.55576: Flags [.], ack 4291594284, win 252, options [nop,nop,TS val 4294839281 ecr 4294839251], length 0
11:14:50.030413 IP 10.0.0.2.55576 > 10.0.0.1.8882: Flags [P.], seq 4291594448:4291594612, ack 2539468977, win 58, options [nop,nop,TS val 4294839257 ecr 4294839240], length 164
11:14:50.030674 IP 10.0.0.1.8882 > 10.0.0.2.55576: Flags [.], ack 4291594284, win 254, options [nop,nop,TS val 4294839296 ecr 4294839251,nop,nop,sack 1 {4291594448:4291594612}], length 0
11:14:50.054826 IP 10.0.0.2.55576 > 10.0.0.1.8882: Flags [P.], seq 4291594776:4291594940, ack 2539468977, win 58, options [nop,nop,TS val 4294839297 ecr 4294839281], length 164
11:14:50.054877 IP 10.0.0.1.8882 > 10.0.0.2.55576: Flags [.], ack 4291594284, win 256, options [nop,nop,TS val 4294839320 ecr 4294839251,nop,nop,sack 2 {4291594776:4291594940}{4291594448:4291594612}], length 0
11:14:50.059698 IP 10.0.0.2.55576 > 10.0.0.1.8882: Flags [P.], seq 4291594284:4291594448, ack 2539468977, win 58, options [nop,nop,TS val 4294839306 ecr 4294839296], length 164
11:14:50.059822 IP 10.0.0.1.8882 > 10.0.0.2.55576: Flags [.], ack 4291594612, win 258, options [nop,nop,TS val 4294839325 ecr 4294839306,nop,nop,sack 1 {4291594776:4291594940}], length 0
11:14:50.062444 IP 10.0.0.2.55576 > 10.0.0.1.8882: Flags [P.], seq 4291594940:4291595104, ack 2539468977, win 58, options [nop,nop,TS val 4294839317 ecr 4294839296], length 164
11:14:50.062600 IP 10.0.0.1.8882 > 10.0.0.2.55576: Flags [.], ack 4291594612, win 260, options [nop,nop,TS val 4294839328 ecr 4294839306,nop,nop,sack 1 {4291594776:4291595104}], length 0
11:14:50.081578 IP 10.0.0.2.55576 > 10.0.0.1.8882: Flags [P.], seq 4291594612:4291594776, ack 2539468977, win 58, options [nop,nop,TS val 4294839330 ecr 4294839320], length 164
11:14:50.081629 IP 10.0.0.1.8882 > 10.0.0.2.55576: Flags [.], ack 4291595104, win 262, options [nop,nop,TS val 4294839347 ecr 4294839330], length 0
11:14:50.085519 IP 10.0.0.2.55576 > 10.0.0.1.8882: Flags [P.], seq 4291595104:4291595268, ack 2539468977, win 58, options [nop,nop,TS val 4294839337 ecr 4294839325], length 164
11:14:50.085672 IP 10.0.0.1.8882 > 10.0.0.2.55576: Flags [.], ack 4291595268, win 264, options [nop,nop,TS val 4294839350 ecr 4294839337], length 0
11:14:50.118123 IP 10.0.0.2.55576 > 10.0.0.1.8882: Flags [P.], seq 4291595268:4291595432, ack 2539468977, win 58, options [nop,nop,TS val 4294839357 ecr 4294839347], length 164
11:14:50.118271 IP 10.0.0.1.8882 > 10.0.0.2.55576: Flags [.], ack 4291595432, win 266, options [nop,nop,TS val 4294839383 ecr 4294839357], length 0
11:14:50.151616 IP 10.0.0.2.55576 > 10.0.0.1.8882: Flags [P.], seq 4291595432:4291595596, ack 2539468977, win 58, options [nop,nop,TS val 4294839380 ecr 4294839350], length 164
11:14:50.151697 IP 10.0.0.1.8882 > 10.0.0.2.55576: Flags [.], ack 4291595596, win 269, options [nop,nop,TS val 4294839417 ecr 4294839380], length 0
11:14:50.170565 IP 10.0.0.2.55576 > 10.0.0.1.8882: Flags [P.], seq 4291595596:4291595760, ack 2539468977, win 58, options [nop,nop,TS val 4294839399 ecr 4294839383], length 164
11:14:50.170716 IP 10.0.0.1.8882 > 10.0.0.2.55576: Flags [.], ack 4291595760, win 271, options [nop,nop,TS val 4294839436 ecr 4294839399], length 0
11:14:50.185376 IP 10.0.0.2.55576 > 10.0.0.1.8882: Flags [P.], seq 4291595760:4291595924, ack 2539468977, win 58, options [nop,nop,TS val 4294839417 ecr 4294839383], length 164
11:14:50.185483 IP 10.0.0.1.8882 > 10.0.0.2.55576: Flags [.], ack 4291595924, win 273, options [nop,nop,TS val 4294839451 ecr 4294839417], length 0
11:14:50.211760 IP 10.0.0.2.55576 > 10.0.0.1.8882: Flags [P.], seq 4291595924:4291596088, ack 2539468977, win 58, options [nop,nop,TS val 4294839437 ecr 4294839417], length 164
11:14:50.211947 IP 10.0.0.1.8882 > 10.0.0.2.55576: Flags [.], ack 4291596088, win 275, options [nop,nop,TS val 4294839477 ecr 4294839437], length 0
11:14:50.232522 IP 10.0.0.2.55576 > 10.0.0.1.8882: Flags [P.], seq 4291596088:4291596252, ack 2539468977, win 58, options [nop,nop,TS val 4294839459 ecr 4294839436], length 164
11:14:50.232690 IP 10.0.0.1.8882 > 10.0.0.2.55576: Flags [.], ack 4291596252, win 277, options [nop,nop,TS val 4294839498 ecr 4294839459], length 0
11:14:50.251054 IP 10.0.0.2.55576 > 10.0.0.1.8882: Flags [P.], seq 4291596252:4291596416, ack 2539468977, win 58, options [nop,nop,TS val 4294839478 ecr 4294839451], length 164
11:14:50.251124 IP 10.0.0.1.8882 > 10.0.0.2.55576: Flags [.], ack 4291596416, win 279, options [nop,nop,TS val 4294839516 ecr 4294839478], length 0
11:14:50.269287 IP 10.0.0.2.55576 > 10.0.0.1.8882: Flags [P.], seq 4291596416:4291596580, ack 2539468977, win 58, options [nop,nop,TS val 4294839498 ecr 4294839477], length 164
11:14:50.269442 IP 10.0.0.1.8882 > 10.0.0.2.55576: Flags [.], ack 4291596580, win 281, options [nop,nop,TS val 4294839534 ecr 4294839498], length 0
11:14:50.292283 IP 10.0.0.2.55576 > 10.0.0.1.8882: Flags [P.], seq 4291596580:4291596744, ack 2539468977, win 58, options [nop,nop,TS val 4294839517 ecr 4294839498], length 164
11:14:50.295410 IP 10.0.0.1.8882 > 10.0.0.2.55576: Flags [.], ack 4291596744, win 283, options [nop,nop,TS val 4294839560 ecr 4294839517], length 0
11:14:50.309407 IP 10.0.0.2.55576 > 10.0.0.1.8882: Flags [P.], seq 4291596744:4291596908, ack 2539468977, win 58, options [nop,nop,TS val 4294839537 ecr 4294839516], length 164
11:14:50.309993 IP 10.0.0.1.8882 > 10.0.0.2.55576: Flags [.], ack 4291596908, win 285, options [nop,nop,TS val 4294839575 ecr 4294839537], length 0
11:14:50.333677 IP 10.0.0.2.55576 > 10.0.0.1.8882: Flags [P.], seq 4291596908:4291597072, ack 2539468977, win 58, options [nop,nop,TS val 4294839560 ecr 4294839534], length 164
11:14:50.333768 IP 10.0.0.1.8882 > 10.0.0.2.55576: Flags [.], ack 4291597072, win 287, options [nop,nop,TS val 4294839599 ecr 4294839560], length 0
11:14:50.349660 IP 10.0.0.2.55576 > 10.0.0.1.8882: Flags [P.], seq 4291597072:4291597236, ack 2539468977, win 58, options [nop,nop,TS val 4294839578 ecr 4294839560], length 164
11:14:50.349889 IP 10.0.0.1.8882 > 10.0.0.2.55576: Flags [.], ack 4291597236, win 289, options [nop,nop,TS val 4294839615 ecr 4294839578], length 0
11:14:50.371275 IP 10.0.0.2.55576 > 10.0.0.1.8882: Flags [P.], seq 4291597236:4291597400, ack 2539468977, win 58, options [nop,nop,TS val 4294839597 ecr 4294839575], length 164
11:14:50.371601 IP 10.0.0.1.8882 > 10.0.0.2.55576: Flags [.], ack 4291597400, win 292, options [nop,nop,TS val 4294839637 ecr 4294839597], length 0
11:14:50.388972 IP 10.0.0.2.55576 > 10.0.0.1.8882: Flags [P.], seq 4291597400:4291597564, ack 2539468977, win 58, options [nop,nop,TS val 4294839618 ecr 4294839599], length 164
11:14:50.389690 IP 10.0.0.1.8882 > 10.0.0.2.55576: Flags [.], ack 4291597564, win 294, options [nop,nop,TS val 4294839655 ecr 4294839618], length 0
11:14:50.410261 IP 10.0.0.2.55576 > 10.0.0.1.8882: Flags [P.], seq 4291597564:4291597728, ack 2539468977, win 58, options [nop,nop,TS val 4294839638 ecr 4294839615], length 164
11:14:50.410358 IP 10.0.0.1.8882 > 10.0.0.2.55576: Flags [.], ack 4291597728, win 296, options [nop,nop,TS val 4294839675 ecr 4294839638], length 0
11:14:50.422410 IP 10.0.0.2.55576 > 10.0.0.1.8882: Flags [P.], seq 4291597728:4291597892, ack 2539468977, win 58, options [nop,nop,TS val 4294839657 ecr 4294839637], length 164
11:14:50.422515 IP 10.0.0.1.8882 > 10.0.0.2.55576: Flags [.], ack 4291597892, win 298, options [nop,nop,TS val 4294839688 ecr 4294839657], length 0
11:14:50.432229 IP 10.0.0.2.55576 > 10.0.0.1.8882: Flags [P.], seq 4291597892:4291598056, ack 2539468977, win 58, options [nop,nop,TS val 4294839677 ecr 4294839655], length 164
11:14:50.432536 IP 10.0.0.1.8882 > 10.0.0.2.55576: Flags [.], ack 4291598056, win 300, options [nop,nop,TS val 4294839698 ecr 4294839677], length 0
11:14:50.452687 IP 10.0.0.2.55576 > 10.0.0.1.8882: Flags [P.], seq 4291598056:4291598220, ack 2539468977, win 58, options [nop,nop,TS val 4294839697 ecr 4294839675], length 164
11:14:50.452782 IP 10.0.0.1.8882 > 10.0.0.2.55576: Flags [.], ack 4291598220, win 302, options [nop,nop,TS val 4294839718 ecr 4294839697], length 0
11:14:50.465486 IP 10.0.0.2.55576 > 10.0.0.1.8882: Flags [P.], seq 4291598220:4291598384, ack 2539468977, win 58, options [nop,nop,TS val 4294839718 ecr 4294839698], length 164
11:14:50.465563 IP 10.0.0.1.8882 > 10.0.0.2.55576: Flags [.], ack 4291598384, win 304, options [nop,nop,TS val 4294839731 ecr 4294839718], length 0
11:14:50.484986 IP 10.0.0.2.55576 > 10.0.0.1.8882: Flags [P.], seq 4291598384:4291598548, ack 2539468977, win 58, options [nop,nop,TS val 4294839738 ecr 4294839718], length 164
11:14:50.485113 IP 10.0.0.1.8882 > 10.0.0.2.55576: Flags [.], ack 4291598548, win 306, options [nop,nop,TS val 4294839750 ecr 4294839738], length 0
11:14:50.509881 IP 10.0.0.2.55576 > 10.0.0.1.8882: Flags [P.], seq 4291598548:4291598712, ack 2539468977, win 58, options [nop,nop,TS val 4294839757 ecr 4294839731], length 164
11:14:50.510091 IP 10.0.0.1.8882 > 10.0.0.2.55576: Flags [.], ack 4291598712, win 308, options [nop,nop,TS val 4294839775 ecr 4294839757], length 0
11:14:50.530800 IP 10.0.0.2.55576 > 10.0.0.1.8882: Flags [P.], seq 4291598712:4291598876, ack 2539468977, win 58, options [nop,nop,TS val 4294839779 ecr 4294839750], length 164
11:14:50.530923 IP 10.0.0.1.8882 > 10.0.0.2.55576: Flags [.], ack 4291598876, win 310, options [nop,nop,TS val 4294839796 ecr 4294839779], length 0
11:14:50.547627 IP 10.0.0.2.55576 > 10.0.0.1.8882: Flags [P.], seq 4291598876:4291599040, ack 2539468977, win 58, options [nop,nop,TS val 4294839797 ecr 4294839775], length 164
11:14:50.547699 IP 10.0.0.1.8882 > 10.0.0.2.55576: Flags [.], ack 4291599040, win 312, options [nop,nop,TS val 4294839813 ecr 4294839797], length 0
11:14:50.572943 IP 10.0.0.2.55576 > 10.0.0.1.8882: Flags [P.], seq 4291599040:4291599204, ack 2539468977, win 58, options [nop,nop,TS val 4294839818 ecr 4294839796], length 164
11:14:50.573037 IP 10.0.0.1.8882 > 10.0.0.2.55576: Flags [.], ack 4291599204, win 315, options [nop,nop,TS val 4294839838 ecr 4294839818], length 0
11:14:50.593382 IP 10.0.0.2.55576 > 10.0.0.1.8882: Flags [P.], seq 4291599204:4291599368, ack 2539468977, win 58, options [nop,nop,TS val 4294839839 ecr 4294839813], length 164
11:14:50.593568 IP 10.0.0.1.8882 > 10.0.0.2.55576: Flags [.], ack 4291599368, win 317, options [nop,nop,TS val 4294839859 ecr 4294839839], length 0
11:14:50.612417 IP 10.0.0.2.55576 > 10.0.0.1.8882: Flags [P.], seq 4291599368:4291599532, ack 2539468977, win 58, options [nop,nop,TS val 4294839859 ecr 4294839838], length 164
11:14:50.612539 IP 10.0.0.1.8882 > 10.0.0.2.55576: Flags [.], ack 4291599532, win 319, options [nop,nop,TS val 4294839878 ecr 4294839859], length 0
11:14:50.629498 IP 10.0.0.2.55576 > 10.0.0.1.8882: Flags [P.], seq 4291599532:4291599696, ack 2539468977, win 58, options [nop,nop,TS val 4294839878 ecr 4294839859], length 164
11:14:50.629684 IP 10.0.0.1.8882 > 10.0.0.2.55576: Flags [.], ack 4291599696, win 321, options [nop,nop,TS val 4294839895 ecr 4294839878], length 0
11:14:50.647599 IP 10.0.0.2.55576 > 10.0.0.1.8882: Flags [P.], seq 4291599696:4291599860, ack 2539468977, win 58, options [nop,nop,TS val 4294839897 ecr 4294839878], length 164
11:14:50.647710 IP 10.0.0.1.8882 > 10.0.0.2.55576: Flags [.], ack 4291599860, win 323, options [nop,nop,TS val 4294839913 ecr 4294839897], length 0
11:14:50.669021 IP 10.0.0.2.55576 > 10.0.0.1.8882: Flags [P.], seq 4291599860:4291600024, ack 2539468977, win 58, options [nop,nop,TS val 4294839917 ecr 4294839895], length 164
11:14:50.669392 IP 10.0.0.1.8882 > 10.0.0.2.55576: Flags [.], ack 4291600024, win 325, options [nop,nop,TS val 4294839934 ecr 4294839917], length 0
11:14:50.690947 IP 10.0.0.2.55576 > 10.0.0.1.8882: Flags [P.], seq 4291600024:4291600188, ack 2539468977, win 58, options [nop,nop,TS val 4294839937 ecr 4294839913], length 164
11:14:50.691088 IP 10.0.0.1.8882 > 10.0.0.2.55576: Flags [.], ack 4291600188, win 327, options [nop,nop,TS val 4294839956 ecr 4294839937], length 0
11:14:50.711861 IP 10.0.0.2.55576 > 10.0.0.1.8882: Flags [P.], seq 4291600188:4291600352, ack 2539468977, win 58, options [nop,nop,TS val 4294839957 ecr 4294839934], length 164
11:14:50.711941 IP 10.0.0.1.8882 > 10.0.0.2.55576: Flags [.], ack 4291600352, win 329, options [nop,nop,TS val 4294839977 ecr 4294839957], length 0
11:14:50.730208 IP 10.0.0.2.55576 > 10.0.0.1.8882: Flags [P.], seq 4291600352:4291600516, ack 2539468977, win 58, options [nop,nop,TS val 4294839978 ecr 4294839956], length 164
11:14:50.730290 IP 10.0.0.1.8882 > 10.0.0.2.55576: Flags [.], ack 4291600516, win 331, options [nop,nop,TS val 4294839995 ecr 4294839978], length 0
11:14:50.760378 IP 10.0.0.2.55576 > 10.0.0.1.8882: Flags [P.], seq 4291600516:4291600680, ack 2539468977, win 58, options [nop,nop,TS val 4294839997 ecr 4294839977], length 164
11:14:50.760494 IP 10.0.0.1.8882 > 10.0.0.2.55576: Flags [.], ack 4291600680, win 333, options [nop,nop,TS val 4294840026 ecr 4294839997], length 0
