11:07:21.359940 IP 10.0.0.2.32900 > 10.0.0.1.8882: Flags [P.], seq 1083603160:1083603324, ack 2423705422, win 58, options [nop,nop,TS val 4294726604 ecr 4294726574], length 164
11:07:21.361045 IP 10.0.0.1.8882 > 10.0.0.2.32900: Flags [.], ack 1083603160, win 80, options [nop,nop,TS val 4294726595 ecr 4294726584], length 0
11:07:21.380517 IP 10.0.0.1.8882 > 10.0.0.2.32900: Flags [.], ack 1083603324, win 82, options [nop,nop,TS val 4294726614 ecr 4294726604], length 0
11:07:21.380674 IP 10.0.0.2.32900 > 10.0.0.1.8882: Flags [P.], seq 1083603324:1083603488, ack 2423705422, win 58, options [nop,nop,TS val 4294726625 ecr 4294726614], length 164
11:07:21.399569 IP 10.0.0.2.32900 > 10.0.0.1.8882: Flags [P.], seq 1083603488:1083603652, ack 2423705422, win 58, options [nop,nop,TS val 4294726643 ecr 4294726614], length 164
11:07:21.401272 IP 10.0.0.1.8882 > 10.0.0.2.32900: Flags [.], ack 1083603488, win 84, options [nop,nop,TS val 4294726635 ecr 4294726625], length 0
11:07:21.419751 IP 10.0.0.2.32900 > 10.0.0.1.8882: Flags [P.], seq 1083603652:1083603816, ack 2423705422, win 58, options [nop,nop,TS val 4294726664 ecr 4294726635], length 164
11:07:21.421436 IP 10.0.0.1.8882 > 10.0.0.2.32900: Flags [.], ack 1083603652, win 86, options [nop,nop,TS val 4294726655 ecr 4294726643], length 0
11:07:21.439660 IP 10.0.0.2.32900 > 10.0.0.1.8882: Flags [P.], seq 1083603816:1083603980, ack 2423705422, win 58, options [nop,nop,TS val 4294726684 ecr 4294726655], length 164
11:07:21.439986 IP 10.0.0.1.8882 > 10.0.0.2.32900: Flags [.], ack 1083603816, win 88, options [nop,nop,TS val 4294726674 ecr 4294726664], length 0
11:07:21.459647 IP 10.0.0.2.32900 > 10.0.0.1.8882: Flags [P.], seq 1083603980:1083604144, ack 2423705422, win 58, options [nop,nop,TS val 4294726704 ecr 4294726674], length 164
11:07:21.459947 IP 10.0.0.1.8882 > 10.0.0.2.32900: Flags [.], ack 1083603980, win 91, options [nop,nop,TS val 4294726694 ecr 4294726684], length 0
11:07:21.480057 IP 10.0.0.1.8882 > 10.0.0.2.32900: Flags [.], ack 1083604144, win 93, options [nop,nop,TS val 4294726714 ecr 4294726704], length 0
11:07:21.480760 IP 10.0.0.2.32900 > 10.0.0.1.8882: Flags [P.], seq 1083604144:1083604308, ack 2423705422, win 58, options [nop,nop,TS val 4294726725 ecr 4294726714], length 164
11:07:21.500165 IP 10.0.0.2.32900 > 10.0.0.1.8882: Flags [P.], seq 1083604308:1083604472, ack 2423705422, win 58, options [nop,nop,TS val 4294726744 ecr 4294726714], length 164
11:07:21.501494 IP 10.0.0.1.8882 > 10.0.0.2.32900: Flags [.], ack 1083604308, win 95, options [nop,nop,TS val 4294726735 ecr 4294726725], length 0
11:07:21.519790 IP 10.0.0.2.32900 > 10.0.0.1.8882: Flags [P.], seq 1083604472:1083604636, ack 2423705422, win 58, options [nop,nop,TS val 4294726764 ecr 4294726735], length 164
11:07:21.520963 IP 10.0.0.1.8882 > 10.0.0.2.32900: Flags [.], ack 1083604472, win 97, options [nop,nop,TS val 4294726754 ecr 4294726744], length 0
11:07:21.539655 IP 10.0.0.2.32900 > 10.0.0.1.8882: Flags [P.], seq 1083604636:1083604800, ack 2423705422, win 58, options [nop,nop,TS val 4294726784 ecr 4294726754], length 164
11:07:21.540670 IP 10.0.0.1.8882 > 10.0.0.2.32900: Flags [.], ack 1083604636, win 99, options [nop,nop,TS val 4294726774 ecr 4294726764], length 0
11:07:21.559820 IP 10.0.0.2.32900 > 10.0.0.1.8882: Flags [P.], seq 1083604800:1083604964, ack 2423705422, win 58, options [nop,nop,TS val 4294726804 ecr 4294726774], length 164
11:07:21.560113 IP 10.0.0.1.8882 > 10.0.0.2.32900: Flags [.], ack 1083604800, win 101, options [nop,nop,TS val 4294726794 ecr 4294726784], length 0
11:07:21.579651 IP 10.0.0.2.32900 > 10.0.0.1.8882: Flags [P.], seq 1083604964:1083605128, ack 2423705422, win 58, options [nop,nop,TS val 4294726824 ecr 4294726794], length 164
11:07:21.580203 IP 10.0.0.1.8882 > 10.0.0.2.32900: Flags [.], ack 1083604964, win 103, options [nop,nop,TS val 4294726814 ecr 4294726804], length 0
11:07:21.599905 IP 10.0.0.1.8882 > 10.0.0.2.32900: Flags [.], ack 1083605128, win 105, options [nop,nop,TS val 4294726834 ecr 4294726824], length 0
11:07:21.600425 IP 10.0.0.2.32900 > 10.0.0.1.8882: Flags [P.], seq 1083605128:1083605292, ack 2423705422, win 58, options [nop,nop,TS val 4294726844 ecr 4294726834], length 164
11:07:21.619795 IP 10.0.0.2.32900 > 10.0.0.1.8882: Flags [P.], seq 1083605292:1083605456, ack 2423705422, win 58, options [nop,nop,TS val 4294726864 ecr 4294726834], length 164
11:07:21.620794 IP 10.0.0.1.8882 > 10.0.0.2.32900: Flags [.], ack 1083605292, win 107, options [nop,nop,TS val 4294726855 ecr 4294726844], length 0
11:07:21.639834 IP 10.0.0.2.32900 > 10.0.0.1.8882: Flags [P.], seq 1083605456:1083605620, ack 2423705422, win 58, options [nop,nop,TS val 4294726884 ecr 4294726855], length 164
11:07:21.639956 IP 10.0.0.1.8882 > 10.0.0.2.32900: Flags [.], ack 1083605456, win 109, options [nop,nop,TS val 4294726874 ecr 4294726864], length 0
11:07:21.660078 IP 10.0.0.1.8882 > 10.0.0.2.32900: Flags [.], ack 1083605620, win 111, options [nop,nop,TS val 4294726894 ecr 4294726884], length 0
11:07:21.660139 IP 10.0.0.2.32900 > 10.0.0.1.8882: Flags [P.], seq 1083605620:1083605784, ack 2423705422, win 58, options [nop,nop,TS val 4294726904 ecr 4294726874], length 164
11:07:21.679727 IP 10.0.0.2.32900 > 10.0.0.1.8882: Flags [P.], seq 1083605784:1083605948, ack 2423705422, win 58, options [nop,nop,TS val 4294726924 ecr 4294726894], length 164
11:07:21.680991 IP 10.0.0.1.8882 > 10.0.0.2.32900: Flags [.], ack 1083605784, win 114, options [nop,nop,TS val 4294726915 ecr 4294726904], length 0
11:07:21.699929 IP 10.0.0.2.32900 > 10.0.0.1.8882: Flags [P.], seq 1083605948:1083606112, ack 2423705422, win 58, options [nop,nop,TS val 4294726944 ecr 4294726915], length 164
11:07:21.700098 IP 10.0.0.1.8882 > 10.0.0.2.32900: Flags [.], ack 1083605948, win 116, options [nop,nop,TS val 4294726934 ecr 4294726924], length 0
11:07:21.720288 IP 10.0.0.2.32900 > 10.0.0.1.8882: Flags [P.], seq 1083606112:1083606276, ack 2423705422, win 58, options [nop,nop,TS val 4294726964 ecr 4294726934], length 164
11:07:21.720918 IP 10.0.0.1.8882 > 10.0.0.2.32900: Flags [.], ack 1083606112, win 118, options [nop,nop,TS val 4294726955 ecr 4294726944], length 0
11:07:21.739702 IP 10.0.0.2.32900 > 10.0.0.1.8882: Flags [P.], seq 1083606276:1083606440, ack 2423705422, win 58, options [nop,nop,TS val 4294726984 ecr 4294726955], length 164
11:07:21.740904 IP 10.0.0.1.8882 > 10.0.0.2.32900: Flags [.], ack 1083606276, win 120, options [nop,nop,TS val 4294726974 ecr 4294726964], length 0
11:07:21.759743 IP 10.0.0.2.32900 > 10.0.0.1.8882: Flags [P.], seq 1083606440:1083606604, ack 2423705422, win 58, options [nop,nop,TS val 4294727004 ecr 4294726974], length 164
11:07:21.760277 IP 10.0.0.1.8882 > 10.0.0.2.32900: Flags [.], ack 1083606440, win 122, options [nop,nop,TS val 4294726994 ecr 4294726984], length 0
11:07:21.780232 IP 10.0.0.1.8882 > 10.0.0.2.32900: Flags [.], ack 1083606604, win 124, options [nop,nop,TS val 4294727014 ecr 4294727004], length 0
11:07:21.780385 IP 10.0.0.2.32900 > 10.0.0.1.8882: Flags [P.], seq 1083606604:1083606768, ack 2423705422, win 58, options [nop,nop,TS val 4294727024 ecr 4294727014], length 164
11:07:21.799839 IP 10.0.0.2.32900 > 10.0.0.1.8882: Flags [P.], seq 1083606768:1083606932, ack 2423705422, win 58, options [nop,nop,TS val 4294727044 ecr 4294727014], length 164
11:07:21.801064 IP 10.0.0.1.8882 > 10.0.0.2.32900: Flags [.], ack 1083606768, win 126, options [nop,nop,TS val 4294727035 ecr 4294727024], length 0
11:07:21.819659 IP 10.0.0.2.32900 > 10.0.0.1.8882: Flags [P.], seq 1083606932:1083607096, ack 2423705422, win 58, options [nop,nop,TS val 4294727064 ecr 4294727035], length 164
11:07:21.820374 IP 10.0.0.1.8882 > 10.0.0.2.32900: Flags [.], ack 1083606932, win 128, options [nop,nop,TS val 4294727054 ecr 4294727044], length 0
11:07:21.839839 IP 10.0.0.1.8882 > 10.0.0.2.32900: Flags [.], ack 1083607096, win 130, options [nop,nop,TS val 4294727074 ecr 4294727064], length 0
11:07:21.839904 IP 10.0.0.2.32900 > 10.0.0.1.8882: Flags [P.], seq 1083607096:1083607260, ack 2423705422, win 58, options [nop,nop,TS val 4294727084 ecr 4294727074], length 164
11:07:21.859895 IP 10.0.0.2.32900 > 10.0.0.1.8882: Flags [P.], seq 1083607260:1083607424, ack 2423705422, win 58, options [nop,nop,TS val 4294727104 ecr 4294727074], length 164
11:07:21.860123 IP 10.0.0.1.8882 > 10.0.0.2.32900: Flags [.], ack 1083607260, win 132, options [nop,nop,TS val 4294727094 ecr 4294727084], length 0
11:07:21.879824 IP 10.0.0.2.32900 > 10.0.0.1.8882: Flags [P.], seq 1083607424:1083607588, ack 2423705422, win 58, options [nop,nop,TS val 4294727124 ecr 4294727094], length 164
11:07:21.880469 IP 10.0.0.1.8882 > 10.0.0.2.32900: Flags [.], ack 1083607424, win 135, options [nop,nop,TS val 4294727114 ecr 4294727104], length 0
11:07:21.899566 IP 10.0.0.2.32900 > 10.0.0.1.8882: Flags [P.], seq 1083607588:1083607752, ack 2423705422, win 58, options [nop,nop,TS val 4294727143 ecr 4294727114], length 164
11:07:21.900563 IP 10.0.0.1.8882 > 10.0.0.2.32900: Flags [.], ack 1083607588, win 137, options [nop,nop,TS val 4294727134 ecr 4294727124], length 0
11:07:21.919527 IP 10.0.0.2.32900 > 10.0.0.1.8882: Flags [P.], seq 1083607752:1083607916, ack 2423705422, win 58, options [nop,nop,TS val 4294727163 ecr 4294727134], length 164
11:07:21.920041 IP 10.0.0.1.8882 > 10.0.0.2.32900: Flags [.], ack 1083607752, win 139, options [nop,nop,TS val 4294727154 ecr 4294727143], length 0
11:07:21.942545 IP 10.0.0.1.8882 > 10.0.0.2.32900: Flags [.], ack 1083607916, win 141, options [nop,nop,TS val 4294727174 ecr 4294727163], length 0
11:07:21.943009 IP 10.0.0.2.32900 > 10.0.0.1.8882: Flags [P.], seq 1083607916:1083608080, ack 2423705422, win 58, options [nop,nop,TS val 4294727187 ecr 4294727174], length 164
11:07:21.959731 IP 10.0.0.2.32900 > 10.0.0.1.8882: Flags [P.], seq 1083608080:1083608244, ack 2423705422, win 58, options [nop,nop,TS val 4294727204 ecr 4294727174], length 164
11:07:21.964060 IP 10.0.0.1.8882 > 10.0.0.2.32900: Flags [.], ack 1083608080, win 143, options [nop,nop,TS val 4294727198 ecr 4294727187], length 0
11:07:21.979708 IP 10.0.0.2.32900 > 10.0.0.1.8882: Flags [P.], seq 1083608244:1083608408, ack 2423705422, win 58, options [nop,nop,TS val 4294727224 ecr 4294727198], length 164
11:07:21.981422 IP 10.0.0.1.8882 > 10.0.0.2.32900: Flags [.], ack 1083608244, win 145, options [nop,nop,TS val 4294727215 ecr 4294727204], length 0
11:07:22.001903 IP 10.0.0.2.32900 > 10.0.0.1.8882: Flags [P.], seq 1083608408:1083608572, ack 2423705422, win 58, options [nop,nop,TS val 4294727246 ecr 4294727215], length 164
11:07:22.003364 IP 10.0.0.1.8882 > 10.0.0.2.32900: Flags [.], ack 1083608408, win 147, options [nop,nop,TS val 4294727237 ecr 4294727224], length 0
11:07:22.019756 IP 10.0.0.2.32900 > 10.0.0.1.8882: Flags [P.], seq 1083608572:1083608736, ack 2423705422, win 58, options [nop,nop,TS val 4294727264 ecr 4294727237], length 164
11:07:22.022288 IP 10.0.0.1.8882 > 10.0.0.2.32900: Flags [.], ack 1083608572, win 149, options [nop,nop,TS val 4294727256 ecr 4294727246], length 0
11:07:22.039872 IP 10.0.0.2.32900 > 10.0.0.1.8882: Flags [P.], seq 1083608736:1083608900, ack 2423705422, win 58, options [nop,nop,TS val 4294727283 ecr 4294727256], length 164
11:07:22.040230 IP 10.0.0.1.8882 > 10.0.0.2.32900: Flags [.], ack 1083608736, win 151, options [nop,nop,TS val 4294727274 ecr 4294727264], length 0
11:07:22.060497 IP 10.0.0.1.8882 > 10.0.0.2.32900: Flags [.], ack 1083608900, win 153, options [nop,nop,TS val 4294727294 ecr 4294727283], length 0
11:07:22.060661 IP 10.0.0.2.32900 > 10.0.0.1.8882: Flags [P.], seq 1083608900:1083609064, ack 2423705422, win 58, options [nop,nop,TS val 4294727304 ecr 4294727274], length 164
11:07:22.079992 IP 10.0.0.2.32900 > 10.0.0.1.8882: Flags [P.], seq 1083609064:1083609228, ack 2423705422, win 58, options [nop,nop,TS val 4294727324 ecr 4294727294], length 164
11:07:22.082630 IP 10.0.0.1.8882 > 10.0.0.2.32900: Flags [.], ack 1083609064, win 155, options [nop,nop,TS val 4294727315 ecr 4294727304], length 0
11:07:22.099913 IP 10.0.0.2.32900 > 10.0.0.1.8882: Flags [P.], seq 1083609228:1083609392, ack 2423705422, win 58, options [nop,nop,TS val 4294727344 ecr 4294727315], length 164
11:07:22.100435 IP 10.0.0.1.8882 > 10.0.0.2.32900: Flags [.], ack 1083609228, win 158, options [nop,nop,TS val 4294727334 ecr 4294727324], length 0
11:07:22.119937 IP 10.0.0.2.32900 > 10.0.0.1.8882: Flags [P.], seq 1083609392:1083609556, ack 2423705422, win 58, options [nop,nop,TS val 4294727363 ecr 4294727334], length 164
11:07:22.122532 IP 10.0.0.1.8882 > 10.0.0.2.32900: Flags [.], ack 1083609392, win 160, options [nop,nop,TS val 4294727354 ecr 4294727344], length 0
11:07:22.139901 IP 10.0.0.2.32900 > 10.0.0.1.8882: Flags [P.], seq 1083609556:1083609720, ack 2423705422, win 58, options [nop,nop,TS val 4294727384 ecr 4294727354], length 164
11:07:22.140524 IP 10.0.0.1.8882 > 10.0.0.2.32900: Flags [.], ack 1083609556, win 162, options [nop,nop,TS val 4294727374 ecr 4294727363], length 0
11:07:22.159675 IP 10.0.0.2.32900 > 10.0.0.1.8882: Flags [P.], seq 1083609720:1083609884, ack 2423705422, win 58, options [nop,nop,TS val 4294727403 ecr 4294727374], length 164
11:07:22.160455 IP 10.0.0.1.8882 > 10.0.0.2.32900: Flags [.], ack 1083609720, win 164, options [nop,nop,TS val 4294727394 ecr 4294727384], length 0
11:07:22.179638 IP 10.0.0.2.32900 > 10.0.0.1.8882: Flags [P.], seq 1083609884:1083610048, ack 2423705422, win 58, options [nop,nop,TS val 4294727423 ecr 4294727394], length 164
11:07:22.180214 IP 10.0.0.1.8882 > 10.0.0.2.32900: Flags [.], ack 1083609884, win 166, options [nop,nop,TS val 4294727414 ecr 4294727403], length 0
11:07:22.199873 IP 10.0.0.1.8882 > 10.0.0.2.32900: Flags [.], ack 1083610048, win 168, options [nop,nop,TS val 4294727434 ecr 4294727423], length 0
11:07:22.199917 IP 10.0.0.2.32900 > 10.0.0.1.8882: Flags [P.], seq 1083610048:1083610212, ack 2423705422, win 58, options [nop,nop,TS val 4294727444 ecr 4294727414], length 164
11:07:22.220022 IP 10.0.0.2.32900 > 10.0.0.1.8882: Flags [P.], seq 1083610212:1083610376, ack 2423705422, win 58, options [nop,nop,TS val 4294727464 ecr 4294727434], length 164
11:07:22.220500 IP 10.0.0.1.8882 > 10.0.0.2.32900: Flags [.], ack 1083610212, win 170, options [nop,nop,TS val 4294727454 ecr 4294727444], length 0
11:07:22.239935 IP 10.0.0.2.32900 > 10.0.0.1.8882: Flags [P.], seq 1083610376:1083610540, ack 2423705422, win 58, options [nop,nop,TS val 4294727484 ecr 4294727454], length 164
11:07:22.240918 IP 10.0.0.1.8882 > 10.0.0.2.32900: Flags [.], ack 1083610376, win 172, options [nop,nop,TS val 4294727475 ecr 4294727464], length 0
11:07:22.259776 IP 10.0.0.2.32900 > 10.0.0.1.8882: Flags [P.], seq 1083610540:1083610704, ack 2423705422, win 58, options [nop,nop,TS val 4294727504 ecr 4294727475], length 164
11:07:22.260201 IP 10.0.0.1.8882 > 10.0.0.2.32900: Flags [.], ack 1083610540, win 174, options [nop,nop,TS val 4294727494 ecr 4294727484], length 0
11:07:22.279662 IP 10.0.0.2.32900 > 10.0.0.1.8882: Flags [P.], seq 1083610704:1083610868, ack 2423705422, win 58, options [nop,nop,TS val 4294727523 ecr 4294727494], length 164
11:07:22.279968 IP 10.0.0.1.8882 > 10.0.0.2.32900: Flags [.], ack 1083610704, win 176, options [nop,nop,TS val 4294727514 ecr 4294727504], length 0
11:07:22.299927 IP 10.0.0.1.8882 > 10.0.0.2.32900: Flags [.], ack 1083610868, win 178, options [nop,nop,TS val 4294727534 ecr 4294727523], length 0
11:07:22.300003 IP 10.0.0.2.32900 > 10.0.0.1.8882: Flags [P.], seq 1083610868:1083611032, ack 2423705422, win 58, options [nop,nop,TS val 4294727544 ecr 4294727514], length 164
11:07:22.319676 IP 10.0.0.2.32900 > 10.0.0.1.8882: Flags [P.], seq 1083611032:1083611196, ack 2423705422, win 58, options [nop,nop,TS val 4294727564 ecr 4294727534], length 164
11:07:22.320431 IP 10.0.0.1.8882 > 10.0.0.2.32900: Flags [.], ack 1083611032, win 181, options [nop,nop,TS val 4294727554 ecr 4294727544], length 0
11:07:22.340167 IP 10.0.0.2.32900 > 10.0.0.1.8882: Flags [P.], seq 1083611196:1083611360, ack 2423705422, win 58, options [nop,nop,TS val 4294727584 ecr 4294727554], length 164
11:07:22.340456 IP 10.0.0.1.8882 > 10.0.0.2.32900: Flags [.], ack 1083611196, win 183, options [nop,nop,TS val 4294727574 ecr 4294727564], length 0
11:07:22.359866 IP 10.0.0.2.32900 > 10.0.0.1.8882: Flags [P.], seq 1083611360:1083611524, ack 2423705422, win 58, options [nop,nop,TS val 4294727604 ecr 4294727574], length 164
11:07:22.360672 IP 10.0.0.1.8882 > 10.0.0.2.32900: Flags [.], ack 1083611360, win 185, options [nop,nop,TS val 4294727594 ecr 4294727584], length 0
11:07:22.379908 IP 10.0.0.2.32900 > 10.0.0.1.8882: Flags [P.], seq 1083611524:1083611688, ack 2423705422, win 58, options [nop,nop,TS val 4294727624 ecr 4294727594], length 164
11:07:22.380711 IP 10.0.0.1.8882 > 10.0.0.2.32900: Flags [.], ack 1083611524, win 187, options [nop,nop,TS val 4294727614 ecr 4294727604], length 0
11:07:22.399746 IP 10.0.0.2.32900 > 10.0.0.1.8882: Flags [P.], seq 1083611688:1083611852, ack 2423705422, win 58, options [nop,nop,TS val 4294727643 ecr 4294727614], length 164
11:07:22.400529 IP 10.0.0.1.8882 > 10.0.0.2.32900: Flags [.], ack 1083611688, win 189, options [nop,nop,TS val 4294727634 ecr 4294727624], length 0
11:07:22.419845 IP 10.0.0.2.32900 > 10.0.0.1.8882: Flags [P.], seq 1083611852:1083612016, ack 2423705422, win 58, options [nop,nop,TS val 4294727664 ecr 4294727634], length 164
11:07:22.420152 IP 10.0.0.1.8882 > 10.0.0.2.32900: Flags [.], ack 1083611852, win 191, options [nop,nop,TS val 4294727654 ecr 4294727643], length 0
11:07:22.439969 IP 10.0.0.2.32900 > 10.0.0.1.8882: Flags [P.], seq 1083612016:1083612180, ack 2423705422, win 58, options [nop,nop,TS val 4294727684 ecr 4294727654], length 164
11:07:22.440453 IP 10.0.0.1.8882 > 10.0.0.2.32900: Flags [.], ack 1083612016, win 193, options [nop,nop,TS val 4294727674 ecr 4294727664], length 0
11:07:22.459654 IP 10.0.0.2.32900 > 10.0.0.1.8882: Flags [P.], seq 1083612180:1083612344, ack 2423705422, win 58, options [nop,nop,TS val 4294727704 ecr 4294727674], length 164
11:07:22.460429 IP 10.0.0.1.8882 > 10.0.0.2.32900: Flags [.], ack 1083612180, win 195, options [nop,nop,TS val 4294727694 ecr 4294727684], length 0
11:07:22.479658 IP 10.0.0.2.32900 > 10.0.0.1.8882: Flags [P.], seq 1083612344:1083612508, ack 2423705422, win 58, options [nop,nop,TS val 4294727724 ecr 4294727694], length 164
11:07:22.480190 IP 10.0.0.1.8882 > 10.0.0.2.32900: Flags [.], ack 1083612344, win 197, options [nop,nop,TS val 4294727714 ecr 4294727704], length 0
11:07:22.500085 IP 10.0.0.1.8882 > 10.0.0.2.32900: Flags [.], ack 1083612508, win 199, options [nop,nop,TS val 4294727734 ecr 4294727724], length 0
11:07:22.500144 IP 10.0.0.2.32900 > 10.0.0.1.8882: Flags [P.], seq 1083612508:1083612672, ack 2423705422, win 58, options [nop,nop,TS val 4294727744 ecr 4294727714], length 164
11:07:22.519715 IP 10.0.0.2.32900 > 10.0.0.1.8882: Flags [P.], seq 1083612672:1083612836, ack 2423705422, win 58, options [nop,nop,TS val 4294727764 ecr 4294727734], length 164
11:07:22.520505 IP 10.0.0.1.8882 > 10.0.0.2.32900: Flags [.], ack 1083612672, win 202, options [nop,nop,TS val 4294727754 ecr 4294727744], length 0
11:07:22.539857 IP 10.0.0.2.32900 > 10.0.0.1.8882: Flags [P.], seq 1083612836:1083613000, ack 2423705422, win 58, options [nop,nop,TS val 4294727784 ecr 4294727754], length 164
11:07:22.539966 IP 10.0.0.1.8882 > 10.0.0.2.32900: Flags [.], ack 1083612836, win 204, options [nop,nop,TS val 4294727774 ecr 4294727764], length 0
11:07:22.559591 IP 10.0.0.2.32900 > 10.0.0.1.8882: Flags [P.], seq 1083613000:1083613164, ack 2423705422, win 58, options [nop,nop,TS val 4294727803 ecr 4294727774], length 164
11:07:22.560255 IP 10.0.0.1.8882 > 10.0.0.2.32900: Flags [.], ack 1083613000, win 206, options [nop,nop,TS val 4294727794 ecr 4294727784], length 0
11:07:22.579657 IP 10.0.0.2.32900 > 10.0.0.1.8882: Flags [P.], seq 1083613164:1083613328, ack 2423705422, win 58, options [nop,nop,TS val 4294727824 ecr 4294727794], length 164
11:07:22.580049 IP 10.0.0.1.8882 > 10.0.0.2.32900: Flags [.], ack 1083613164, win 208, options [nop,nop,TS val 4294727814 ecr 4294727803], length 0
11:07:22.600152 IP 10.0.0.1.8882 > 10.0.0.2.32900: Flags [.], ack 1083613328, win 210, options [nop,nop,TS val 4294727834 ecr 4294727824], length 0
11:07:22.600169 IP 10.0.0.2.32900 > 10.0.0.1.8882: Flags [P.], seq 1083613328:1083613492, ack 2423705422, win 58, options [nop,nop,TS val 4294727844 ecr 4294727814], length 164
11:07:22.619716 IP 10.0.0.2.32900 > 10.0.0.1.8882: Flags [P.], seq 1083613492:1083613656, ack 2423705422, win 58, options [nop,nop,TS val 4294727864 ecr 4294727834], length 164
11:07:22.622149 IP 10.0.0.1.8882 > 10.0.0.2.32900: Flags [.], ack 1083613492, win 212, options [nop,nop,TS val 4294727854 ecr 4294727844], length 0
11:07:22.639747 IP 10.0.0.2.32900 > 10.0.0.1.8882: Flags [P.], seq 1083613656:1083613820, ack 2423705422, win 58, options [nop,nop,TS val 4294727884 ecr 4294727854], length 164
11:07:22.639949 IP 10.0.0.1.8882 > 10.0.0.2.32900: Flags [.], ack 1083613656, win 214, options [nop,nop,TS val 4294727874 ecr 4294727864], length 0
11:07:22.660069 IP 10.0.0.1.8882 > 10.0.0.2.32900: Flags [.], ack 1083613820, win 216, options [nop,nop,TS val 4294727894 ecr 4294727884], length 0
11:07:22.660194 IP 10.0.0.2.32900 > 10.0.0.1.8882: Flags [P.], seq 1083613820:1083613984, ack 2423705422, win 58, options [nop,nop,TS val 4294727904 ecr 4294727894], length 164
11:07:22.679716 IP 10.0.0.2.32900 > 10.0.0.1.8882: Flags [P.], seq 1083613984:1083614148, ack 2423705422, win 58, options [nop,nop,TS val 4294727924 ecr 4294727894], length 164
11:07:22.680796 IP 10.0.0.1.8882 > 10.0.0.2.32900: Flags [.], ack 1083613984, win 218, options [nop,nop,TS val 4294727914 ecr 4294727904], length 0
11:07:22.699790 IP 10.0.0.2.32900 > 10.0.0.1.8882: Flags [P.], seq 1083614148:1083614312, ack 2423705422, win 58, options [nop,nop,TS val 4294727944 ecr 4294727914], length 164
11:07:22.700026 IP 10.0.0.1.8882 > 10.0.0.2.32900: Flags [.], ack 1083614148, win 220, options [nop,nop,TS val 4294727934 ecr 4294727924], length 0
11:07:22.719621 IP 10.0.0.2.32900 > 10.0.0.1.8882: Flags [P.], seq 1083614312:1083614476, ack 2423705422, win 58, options [nop,nop,TS val 4294727963 ecr 4294727934], length 164
11:07:22.720102 IP 10.0.0.1.8882 > 10.0.0.2.32900: Flags [.], ack 1083614312, win 222, options [nop,nop,TS val 4294727954 ecr 4294727944], length 0
11:07:22.739549 IP 10.0.0.2.32900 > 10.0.0.1.8882: Flags [P.], seq 1083614476:1083614640, ack 2423705422, win 58, options [nop,nop,TS val 4294727983 ecr 4294727954], length 164
11:07:22.741166 IP 10.0.0.1.8882 > 10.0.0.2.32900: Flags [.], ack 1083614476, win 225, options [nop,nop,TS val 4294727975 ecr 4294727963], length 0
11:07:22.759608 IP 10.0.0.2.32900 > 10.0.0.1.8882: Flags [P.], seq 1083614640:1083614804, ack 2423705422, win 58, options [nop,nop,TS val 4294728003 ecr 4294727975], length 164
11:07:22.760396 IP 10.0.0.1.8882 > 10.0.0.2.32900: Flags [.], ack 1083614640, win 227, options [nop,nop,TS val 4294727994 ecr 4294727983], length 0
11:07:22.779888 IP 10.0.0.1.8882 > 10.0.0.2.32900: Flags [.], ack 1083614804, win 229, options [nop,nop,TS val 4294728014 ecr 4294728003], length 0
11:07:22.779930 IP 10.0.0.2.32900 > 10.0.0.1.8882: Flags [P.], seq 1083614804:1083614968, ack 2423705422, win 58, options [nop,nop,TS val 4294728024 ecr 4294727994], length 164
11:07:22.799857 IP 10.0.0.2.32900 > 10.0.0.1.8882: Flags [P.], seq 1083614968:1083615132, ack 2423705422, win 58, options [nop,nop,TS val 4294728044 ecr 4294728014], length 164
11:07:22.800191 IP 10.0.0.1.8882 > 10.0.0.2.32900: Flags [.], ack 1083614968, win 231, options [nop,nop,TS val 4294728034 ecr 4294728024], length 0
11:07:22.819838 IP 10.0.0.2.32900 > 10.0.0.1.8882: Flags [P.], seq 1083615132:1083615296, ack 2423705422, win 58, options [nop,nop,TS val 4294728064 ecr 4294728034], length 164
11:07:22.820396 IP 10.0.0.1.8882 > 10.0.0.2.32900: Flags [.], ack 1083615132, win 233, options [nop,nop,TS val 4294728054 ecr 4294728044], length 0
11:07:22.839994 IP 10.0.0.2.32900 > 10.0.0.1.8882: Flags [P.], seq 1083615296:1083615460, ack 2423705422, win 58, options [nop,nop,TS val 4294728084 ecr 4294728054], length 164
11:07:22.840150 IP 10.0.0.1.8882 > 10.0.0.2.32900: Flags [.], ack 1083615296, win 235, options [nop,nop,TS val 4294728074 ecr 4294728064], length 0
11:07:22.859526 IP 10.0.0.2.32900 > 10.0.0.1.8882: Flags [P.], seq 1083615460:1083615624, ack 2423705422, win 58, options [nop,nop,TS val 4294728103 ecr 4294728074], length 164
11:07:22.860152 IP 10.0.0.1.8882 > 10.0.0.2.32900: Flags [.], ack 1083615460, win 237, options [nop,nop,TS val 4294728094 ecr 4294728084], length 0
11:07:22.879542 IP 10.0.0.2.32900 > 10.0.0.1.8882: Flags [P.], seq 1083615624:1083615788, ack 2423705422, win 58, options [nop,nop,TS val 4294728123 ecr 4294728094], length 164
11:07:22.879816 IP 10.0.0.1.8882 > 10.0.0.2.32900: Flags [.], ack 1083615624, win 239, options [nop,nop,TS val 4294728114 ecr 4294728103], length 0
11:07:22.899894 IP 10.0.0.1.8882 > 10.0.0.2.32900: Flags [.], ack 1083615788, win 241, options [nop,nop,TS val 4294728134 ecr 4294728123], length 0
11:07:22.899937 IP 10.0.0.2.32900 > 10.0.0.1.8882: Flags [P.], seq 1083615788:1083615952, ack 2423705422, win 58, options [nop,nop,TS val 4294728144 ecr 4294728114], length 164
11:07:22.919718 IP 10.0.0.2.32900 > 10.0.0.1.8882: Flags [P.], seq 1083615952:1083616116, ack 2423705422, win 58, options [nop,nop,TS val 4294728164 ecr 4294728134], length 164
11:07:22.920578 IP 10.0.0.1.8882 > 10.0.0.2.32900: Flags [.], ack 1083615952, win 243, options [nop,nop,TS val 4294728154 ecr 4294728144], length 0
11:07:22.940109 IP 10.0.0.2.32900 > 10.0.0.1.8882: Flags [P.], seq 1083616116:1083616280, ack 2423705422, win 58, options [nop,nop,TS val 4294728184 ecr 4294728154], length 164
11:07:22.943458 IP 10.0.0.1.8882 > 10.0.0.2.32900: Flags [.], ack 1083616116, win 245, options [nop,nop,TS val 4294728177 ecr 4294728164], length 0
11:07:22.959744 IP 10.0.0.2.32900 > 10.0.0.1.8882: Flags [P.], seq 1083616280:1083616444, ack 2423705422, win 58, options [nop,nop,TS val 4294728204 ecr 4294728177], length 164
11:07:22.976786 IP 10.0.0.1.8882 > 10.0.0.2.32900: Flags [.], ack 1083616280, win 248, options [nop,nop,TS val 4294728210 ecr 4294728184], length 0
11:07:22.980703 IP 10.0.0.2.32900 > 10.0.0.1.8882: Flags [P.], seq 1083616444:1083616608, ack 2423705422, win 58, options [nop,nop,TS val 4294728225 ecr 4294728210], length 164
11:07:23.000218 IP 10.0.0.2.32900 > 10.0.0.1.8882: Flags [P.], seq 1083616608:1083616772, ack 2423705422, win 58, options [nop,nop,TS val 4294728244 ecr 4294728210], length 164
11:07:23.012309 IP 10.0.0.1.8882 > 10.0.0.2.32900: Flags [.], ack 1083616444, win 250, options [nop,nop,TS val 4294728243 ecr 4294728204], length 0
11:07:23.020048 IP 10.0.0.2.32900 > 10.0.0.1.8882: Flags [P.], seq 1083616772:1083616936, ack 2423705422, win 58, options [nop,nop,TS val 4294728264 ecr 4294728243], length 164
11:07:23.043432 IP 10.0.0.2.32900 > 10.0.0.1.8882: Flags [P.], seq 1083616936:1083617100, ack 2423705422, win 58, options [nop,nop,TS val 4294728287 ecr 4294728243], length 164
11:07:23.057357 IP 10.0.0.1.8882 > 10.0.0.2.32900: Flags [.], ack 1083616444, win 252, options [nop,nop,TS val 4294728291 ecr 4294728204,nop,nop,sack 1 {1083616608:1083616772}], length 0
11:07:23.059750 IP 10.0.0.2.32900 > 10.0.0.1.8882: Flags [P.], seq 1083617100:1083617264, ack 2423705422, win 58, options [nop,nop,TS val 4294728304 ecr 4294728291], length 164
11:07:23.067939 IP 10.0.0.1.8882 > 10.0.0.2.32900: Flags [.], ack 1083616444, win 254, options [nop,nop,TS val 4294728301 ecr 4294728204,nop,nop,sack 1 {1083616608:1083616936}], length 0
11:07:23.076872 IP 10.0.0.1.8882 > 10.0.0.2.32900: Flags [.], ack 1083616444, win 256, options [nop,nop,TS val 4294728311 ecr 4294728204,nop,nop,sack 1 {1083616608:1083617100}], length 0
11:07:23.076929 IP 10.0.0.2.32900 > 10.0.0.1.8882: Flags [P.], seq 1083616444:1083616608, ack 2423705422, win 58, options [nop,nop,TS val 4294728321 ecr 4294728311], length 164
11:07:23.079704 IP 10.0.0.2.32900 > 10.0.0.1.8882: Flags [P.], seq 1083617264:1083617428, ack 2423705422, win 58, options [nop,nop,TS val 4294728324 ecr 4294728311], length 164
11:07:23.114674 IP 10.0.0.1.8882 > 10.0.0.2.32900: Flags [.], ack 1083617100, win 258, options [nop,nop,TS val 4294728348 ecr 4294728321], length 0
11:07:23.114936 IP 10.0.0.2.32900 > 10.0.0.1.8882: Flags [P.], seq 1083617428:1083617592, ack 2423705422, win 58, options [nop,nop,TS val 4294728359 ecr 4294728348], length 164
11:07:23.118944 IP 10.0.0.1.8882 > 10.0.0.2.32900: Flags [.], ack 1083617100, win 260, options [nop,nop,TS val 4294728352 ecr 4294728321,nop,nop,sack 1 {1083617264:1083617428}], length 0
11:07:23.119072 IP 10.0.0.2.32900 > 10.0.0.1.8882: Flags [P.], seq 1083617100:1083617264, ack 2423705422, win 58, options [nop,nop,TS val 4294728363 ecr 4294728352], length 164
11:07:23.119568 IP 10.0.0.2.32900 > 10.0.0.1.8882: Flags [P.], seq 1083617592:1083617756, ack 2423705422, win 58, options [nop,nop,TS val 4294728363 ecr 4294728352], length 164
11:07:23.153075 IP 10.0.0.1.8882 > 10.0.0.2.32900: Flags [.], ack 1083617100, win 262, options [nop,nop,TS val 4294728386 ecr 4294728321,nop,nop,sack 1 {1083617264:1083617592}], length 0
11:07:23.153203 IP 10.0.0.2.32900 > 10.0.0.1.8882: Flags [P.], seq 1083617756:1083617920, ack 2423705422, win 58, options [nop,nop,TS val 4294728397 ecr 4294728386], length 164
11:07:23.157323 IP 10.0.0.1.8882 > 10.0.0.2.32900: Flags [.], ack 1083617592, win 264, options [nop,nop,TS val 4294728391 ecr 4294728363], length 0
11:07:23.157326 IP 10.0.0.1.8882 > 10.0.0.2.32900: Flags [.], ack 1083617756, win 266, options [nop,nop,TS val 4294728391 ecr 4294728363], length 0
11:07:23.159550 IP 10.0.0.2.32900 > 10.0.0.1.8882: Flags [P.], seq 1083617920:1083618084, ack 2423705422, win 58, options [nop,nop,TS val 4294728403 ecr 4294728391], length 164
11:07:23.180134 IP 10.0.0.2.32900 > 10.0.0.1.8882: Flags [P.], seq 1083618084:1083618248, ack 2423705422, win 58, options [nop,nop,TS val 4294728424 ecr 4294728391], length 164
11:07:23.183869 IP 10.0.0.1.8882 > 10.0.0.2.32900: Flags [.], ack 1083617920, win 269, options [nop,nop,TS val 4294728418 ecr 4294728397], length 0
11:07:23.193884 IP 10.0.0.1.8882 > 10.0.0.2.32900: Flags [.], ack 1083618084, win 271, options [nop,nop,TS val 4294728427 ecr 4294728403], length 0
11:07:23.199811 IP 10.0.0.2.32900 > 10.0.0.1.8882: Flags [P.], seq 1083618248:1083618412, ack 2423705422, win 58, options [nop,nop,TS val 4294728444 ecr 4294728427], length 164
11:07:23.214273 IP 10.0.0.1.8882 > 10.0.0.2.32900: Flags [.], ack 1083618248, win 273, options [nop,nop,TS val 4294728445 ecr 4294728424], length 0
11:07:23.220352 IP 10.0.0.2.32900 > 10.0.0.1.8882: Flags [P.], seq 1083618412:1083618576, ack 2423705422, win 58, options [nop,nop,TS val 4294728464 ecr 4294728445], length 164
11:07:23.227572 IP 10.0.0.1.8882 > 10.0.0.2.32900: Flags [.], ack 1083618412, win 275, options [nop,nop,TS val 4294728461 ecr 4294728444], length 0
11:07:23.240762 IP 10.0.0.2.32900 > 10.0.0.1.8882: Flags [P.], seq 1083618576:1083618740, ack 2423705422, win 58, options [nop,nop,TS val 4294728485 ecr 4294728461], length 164
11:07:23.253970 IP 10.0.0.1.8882 > 10.0.0.2.32900: Flags [.], ack 1083618576, win 277, options [nop,nop,TS val 4294728487 ecr 4294728464], length 0
11:07:23.260342 IP 10.0.0.2.32900 > 10.0.0.1.8882: Flags [P.], seq 1083618740:1083618904, ack 2423705422, win 58, options [nop,nop,TS val 4294728504 ecr 4294728487], length 164
11:07:23.277174 IP 10.0.0.1.8882 > 10.0.0.2.32900: Flags [.], ack 1083618740, win 279, options [nop,nop,TS val 4294728511 ecr 4294728485], length 0
11:07:23.279889 IP 10.0.0.2.32900 > 10.0.0.1.8882: Flags [P.], seq 1083618904:1083619068, ack 2423705422, win 58, options [nop,nop,TS val 4294728524 ecr 4294728511], length 164
11:07:23.292375 IP 10.0.0.1.8882 > 10.0.0.2.32900: Flags [.], ack 1083618904, win 281, options [nop,nop,TS val 4294728526 ecr 4294728504], length 0
11:07:23.299862 IP 10.0.0.2.32900 > 10.0.0.1.8882: Flags [P.], seq 1083619068:1083619232, ack 2423705422, win 58, options [nop,nop,TS val 4294728544 ecr 4294728526], length 164
11:07:23.310466 IP 10.0.0.1.8882 > 10.0.0.2.32900: Flags [.], ack 1083619068, win 283, options [nop,nop,TS val 4294728544 ecr 4294728524], length 0
11:07:23.319813 IP 10.0.0.2.32900 > 10.0.0.1.8882: Flags [P.], seq 1083619232:1083619396, ack 2423705422, win 58, options [nop,nop,TS val 4294728564 ecr 4294728544], length 164
11:07:23.343543 IP 10.0.0.2.32900 > 10.0.0.1.8882: Flags [P.], seq 1083619396:1083619560, ack 2423705422, win 58, options [nop,nop,TS val 4294728587 ecr 4294728544], length 164
11:07:23.354305 IP 10.0.0.1.8882 > 10.0.0.2.32900: Flags [.], ack 1083619068, win 285, options [nop,nop,TS val 4294728587 ecr 4294728524,nop,nop,sack 1 {1083619232:1083619396}], length 0
11:07:23.359649 IP 10.0.0.2.32900 > 10.0.0.1.8882: Flags [P.], seq 1083619560:1083619724, ack 2423705422, win 58, options [nop,nop,TS val 4294728604 ecr 4294728587], length 164
11:07:23.369893 IP 10.0.0.1.8882 > 10.0.0.2.32900: Flags [.], ack 1083619068, win 287, options [nop,nop,TS val 4294728603 ecr 4294728524,nop,nop,sack 1 {1083619232:1083619560}], length 0
11:07:23.379660 IP 10.0.0.2.32900 > 10.0.0.1.8882: Flags [P.], seq 1083619724:1083619888, ack 2423705422, win 58, options [nop,nop,TS val 4294728624 ecr 4294728603], length 164
11:07:23.382660 IP 10.0.0.1.8882 > 10.0.0.2.32900: Flags [.], ack 1083619068, win 289, options [nop,nop,TS val 4294728617 ecr 4294728524,nop,nop,sack 1 {1083619232:1083619724}], length 0
11:07:23.382742 IP 10.0.0.2.32900 > 10.0.0.1.8882: Flags [P.], seq 1083619068:1083619232, ack 2423705422, win 58, options [nop,nop,TS val 4294728627 ecr 4294728617], length 164
11:07:23.401433 IP 10.0.0.2.32900 > 10.0.0.1.8882: Flags [P.], seq 1083619888:1083620052, ack 2423705422, win 58, options [nop,nop,TS val 4294728645 ecr 4294728617], length 164
11:07:23.402891 IP 10.0.0.1.8882 > 10.0.0.2.32900: Flags [.], ack 1083619068, win 292, options [nop,nop,TS val 4294728637 ecr 4294728524,nop,nop,sack 1 {1083619232:1083619888}], length 0
11:07:23.407727 IP 10.0.0.1.8882 > 10.0.0.2.32900: Flags [.], ack 1083619888, win 294, options [nop,nop,TS val 4294728641 ecr 4294728627], length 0
11:07:23.419782 IP 10.0.0.2.32900 > 10.0.0.1.8882: Flags [P.], seq 1083620052:1083620216, ack 2423705422, win 58, options [nop,nop,TS val 4294728664 ecr 4294728641], length 164
11:07:23.433882 IP 10.0.0.1.8882 > 10.0.0.2.32900: Flags [.], ack 1083620052, win 296, options [nop,nop,TS val 4294728662 ecr 4294728645], length 0
11:07:23.443424 IP 10.0.0.2.32900 > 10.0.0.1.8882: Flags [P.], seq 1083620216:1083620380, ack 2423705422, win 58, options [nop,nop,TS val 4294728687 ecr 4294728662], length 164
11:07:23.453514 IP 10.0.0.1.8882 > 10.0.0.2.32900: Flags [.], ack 1083620216, win 298, options [nop,nop,TS val 4294728687 ecr 4294728664], length 0
11:07:23.459874 IP 10.0.0.2.32900 > 10.0.0.1.8882: Flags [P.], seq 1083620380:1083620544, ack 2423705422, win 58, options [nop,nop,TS val 4294728704 ecr 4294728687], length 164
11:07:23.470159 IP 10.0.0.1.8882 > 10.0.0.2.32900: Flags [.], ack 1083620380, win 300, options [nop,nop,TS val 4294728704 ecr 4294728687], length 0
11:07:23.479917 IP 10.0.0.2.32900 > 10.0.0.1.8882: Flags [P.], seq 1083620544:1083620708, ack 2423705422, win 58, options [nop,nop,TS val 4294728724 ecr 4294728704], length 164
11:07:23.485836 IP 10.0.0.1.8882 > 10.0.0.2.32900: Flags [.], ack 1083620544, win 302, options [nop,nop,TS val 4294728720 ecr 4294728704], length 0
11:07:23.500048 IP 10.0.0.2.32900 > 10.0.0.1.8882: Flags [P.], seq 1083620708:1083620872, ack 2423705422, win 58, options [nop,nop,TS val 4294728744 ecr 4294728720], length 164
11:07:23.507704 IP 10.0.0.1.8882 > 10.0.0.2.32900: Flags [.], ack 1083620708, win 304, options [nop,nop,TS val 4294728741 ecr 4294728724], length 0
11:07:23.519775 IP 10.0.0.2.32900 > 10.0.0.1.8882: Flags [P.], seq 1083620872:1083621036, ack 2423705422, win 58, options [nop,nop,TS val 4294728764 ecr 4294728741], length 164
11:07:23.527854 IP 10.0.0.1.8882 > 10.0.0.2.32900: Flags [.], ack 1083620872, win 306, options [nop,nop,TS val 4294728761 ecr 4294728744], length 0
11:07:23.539658 IP 10.0.0.2.32900 > 10.0.0.1.8882: Flags [P.], seq 1083621036:1083621200, ack 2423705422, win 58, options [nop,nop,TS val 4294728784 ecr 4294728761], length 164
11:07:23.548297 IP 10.0.0.1.8882 > 10.0.0.2.32900: Flags [.], ack 1083621036, win 308, options [nop,nop,TS val 4294728782 ecr 4294728764], length 0
11:07:23.560737 IP 10.0.0.2.32900 > 10.0.0.1.8882: Flags [P.], seq 1083621200:1083621364, ack 2423705422, win 58, options [nop,nop,TS val 4294728805 ecr 4294728782], length 164
11:07:23.570294 IP 10.0.0.1.8882 > 10.0.0.2.32900: Flags [.], ack 1083621200, win 310, options [nop,nop,TS val 4294728803 ecr 4294728784], length 0
11:07:23.579666 IP 10.0.0.2.32900 > 10.0.0.1.8882: Flags [P.], seq 1083621364:1083621528, ack 2423705422, win 58, options [nop,nop,TS val 4294728824 ecr 4294728803], length 164
11:07:23.585031 IP 10.0.0.1.8882 > 10.0.0.2.32900: Flags [.], ack 1083621364, win 312, options [nop,nop,TS val 4294728818 ecr 4294728805], length 0
11:07:23.601243 IP 10.0.0.2.32900 > 10.0.0.1.8882: Flags [P.], seq 1083621528:1083621692, ack 2423705422, win 58, options [nop,nop,TS val 4294728844 ecr 4294728818], length 164
11:07:23.610550 IP 10.0.0.1.8882 > 10.0.0.2.32900: Flags [.], ack 1083621528, win 315, options [nop,nop,TS val 4294728841 ecr 4294728824], length 0
11:07:23.620510 IP 10.0.0.2.32900 > 10.0.0.1.8882: Flags [P.], seq 1083621692:1083621856, ack 2423705422, win 58, options [nop,nop,TS val 4294728864 ecr 4294728841], length 164
11:07:23.629036 IP 10.0.0.1.8882 > 10.0.0.2.32900: Flags [.], ack 1083621692, win 317, options [nop,nop,TS val 4294728862 ecr 4294728844], length 0
11:07:23.639757 IP 10.0.0.2.32900 > 10.0.0.1.8882: Flags [P.], seq 1083621856:1083622020, ack 2423705422, win 58, options [nop,nop,TS val 4294728884 ecr 4294728862], length 164
11:07:23.647368 IP 10.0.0.1.8882 > 10.0.0.2.32900: Flags [.], ack 1083621856, win 319, options [nop,nop,TS val 4294728881 ecr 4294728864], length 0
11:07:23.659931 IP 10.0.0.2.32900 > 10.0.0.1.8882: Flags [P.], seq 1083622020:1083622184, ack 2423705422, win 58, options [nop,nop,TS val 4294728904 ecr 4294728881], length 164
11:07:23.668176 IP 10.0.0.1.8882 > 10.0.0.2.32900: Flags [.], ack 1083622020, win 321, options [nop,nop,TS val 4294728901 ecr 4294728884], length 0
11:07:23.679877 IP 10.0.0.2.32900 > 10.0.0.1.8882: Flags [P.], seq 1083622184:1083622348, ack 2423705422, win 58, options [nop,nop,TS val 4294728924 ecr 4294728901], length 164
11:07:23.688315 IP 10.0.0.1.8882 > 10.0.0.2.32900: Flags [.], ack 1083622184, win 323, options [nop,nop,TS val 4294728922 ecr 4294728904], length 0
11:07:23.701898 IP 10.0.0.2.32900 > 10.0.0.1.8882: Flags [P.], seq 1083622348:1083622512, ack 2423705422, win 58, options [nop,nop,TS val 4294728946 ecr 4294728922], length 164
11:07:23.714091 IP 10.0.0.1.8882 > 10.0.0.2.32900: Flags [.], ack 1083622348, win 325, options [nop,nop,TS val 4294728945 ecr 4294728924], length 0
11:07:23.719934 IP 10.0.0.2.32900 > 10.0.0.1.8882: Flags [P.], seq 1083622512:1083622676, ack 2423705422, win 58, options [nop,nop,TS val 4294728964 ecr 4294728945], length 164
11:07:23.732307 IP 10.0.0.1.8882 > 10.0.0.2.32900: Flags [.], ack 1083622512, win 327, options [nop,nop,TS val 4294728966 ecr 4294728946], length 0
11:07:23.739778 IP 10.0.0.2.32900 > 10.0.0.1.8882: Flags [P.], seq 1083622676:1083622840, ack 2423705422, win 58, options [nop,nop,TS val 4294728984 ecr 4294728966], length 164
11:07:23.748651 IP 10.0.0.1.8882 > 10.0.0.2.32900: Flags [.], ack 1083622676, win 329, options [nop,nop,TS val 4294728982 ecr 4294728964], length 0
