11:36:04.306375 IP 10.0.0.2.43638 > vagrant-ubuntu-trusty-64.8882: Flags [P.], seq 3291450681:3291450845, ack 3084033470, win 58, options [nop,nop,TS val 4294712899 ecr 4294712845], length 164
11:36:04.306411 IP vagrant-ubuntu-trusty-64.8882 > 10.0.0.2.43638: Flags [.], ack 3291450845, win 61, options [nop,nop,TS val 4294712910 ecr 4294712899], length 0
11:36:04.327019 IP 10.0.0.2.43638 > vagrant-ubuntu-trusty-64.8882: Flags [P.], seq 3291450845:3291451009, ack 3084033470, win 58, options [nop,nop,TS val 4294712919 ecr 4294712891], length 164
11:36:04.327061 IP vagrant-ubuntu-trusty-64.8882 > 10.0.0.2.43638: Flags [.], ack 3291451009, win 63, options [nop,nop,TS val 4294712930 ecr 4294712919], length 0
11:36:04.346167 IP 10.0.0.2.43638 > vagrant-ubuntu-trusty-64.8882: Flags [P.], seq 3291451009:3291451173, ack 3084033470, win 58, options [nop,nop,TS val 4294712939 ecr 4294712910], length 164
11:36:04.346187 IP vagrant-ubuntu-trusty-64.8882 > 10.0.0.2.43638: Flags [.], ack 3291451173, win 65, options [nop,nop,TS val 4294712950 ecr 4294712939], length 0
11:36:04.367536 IP 10.0.0.2.43638 > vagrant-ubuntu-trusty-64.8882: Flags [P.], seq 3291451173:3291451337, ack 3084033470, win 58, options [nop,nop,TS val 4294712960 ecr 4294712930], length 164
11:36:04.368248 IP vagrant-ubuntu-trusty-64.8882 > 10.0.0.2.43638: Flags [.], ack 3291451337, win 68, options [nop,nop,TS val 4294712971 ecr 4294712960], length 0
11:36:04.386627 IP 10.0.0.2.43638 > vagrant-ubuntu-trusty-64.8882: Flags [P.], seq 3291451337:3291451501, ack 3084033470, win 58, options [nop,nop,TS val 4294712980 ecr 4294712950], length 164
11:36:04.386658 IP vagrant-ubuntu-trusty-64.8882 > 10.0.0.2.43638: Flags [.], ack 3291451501, win 70, options [nop,nop,TS val 4294712990 ecr 4294712980], length 0
11:36:04.407106 IP 10.0.0.2.43638 > vagrant-ubuntu-trusty-64.8882: Flags [P.], seq 3291451501:3291451665, ack 3084033470, win 58, options [nop,nop,TS val 4294713000 ecr 4294712971], length 164
11:36:04.407192 IP vagrant-ubuntu-trusty-64.8882 > 10.0.0.2.43638: Flags [.], ack 3291451665, win 72, options [nop,nop,TS val 4294713010 ecr 4294713000], length 0
11:36:04.435285 IP 10.0.0.2.43638 > vagrant-ubuntu-trusty-64.8882: Flags [P.], seq 3291451665:3291451829, ack 3084033470, win 58, options [nop,nop,TS val 4294713020 ecr 4294712990], length 164
11:36:04.435326 IP vagrant-ubuntu-trusty-64.8882 > 10.0.0.2.43638: Flags [.], ack 3291451829, win 74, options [nop,nop,TS val 4294713038 ecr 4294713020], length 0
11:36:04.457396 IP 10.0.0.2.43638 > vagrant-ubuntu-trusty-64.8882: Flags [P.], seq 3291451829:3291451993, ack 3084033470, win 58, options [nop,nop,TS val 4294713039 ecr 4294713010], length 164
11:36:04.457478 IP vagrant-ubuntu-trusty-64.8882 > 10.0.0.2.43638: Flags [.], ack 3291451993, win 76, options [nop,nop,TS val 4294713060 ecr 4294713039], length 0
11:36:04.484451 IP 10.0.0.2.43638 > vagrant-ubuntu-trusty-64.8882: Flags [P.], seq 3291451993:3291452157, ack 3084033470, win 58, options [nop,nop,TS val 4294713060 ecr 4294713038], length 164
11:36:04.484499 IP vagrant-ubuntu-trusty-64.8882 > 10.0.0.2.43638: Flags [.], ack 3291452157, win 78, options [nop,nop,TS val 4294713088 ecr 4294713060], length 0
11:36:04.514907 IP 10.0.0.2.43638 > vagrant-ubuntu-trusty-64.8882: Flags [P.], seq 3291452157:3291452321, ack 3084033470, win 58, options [nop,nop,TS val 4294713080 ecr 4294713060], length 164
11:36:04.514944 IP vagrant-ubuntu-trusty-64.8882 > 10.0.0.2.43638: Flags [.], ack 3291452321, win 80, options [nop,nop,TS val 4294713118 ecr 4294713080], length 0
11:36:04.554565 IP 10.0.0.2.43638 > vagrant-ubuntu-trusty-64.8882: Flags [P.], seq 3291452485:3291452649, ack 3084033470, win 58, options [nop,nop,TS val 4294713120 ecr 4294713088], length 164
11:36:04.554598 IP vagrant-ubuntu-trusty-64.8882 > 10.0.0.2.43638: Flags [.], ack 3291452321, win 82, options [nop,nop,TS val 4294713158 ecr 4294713080,nop,nop,sack 1 {3291452485:3291452649}], length 0
11:36:04.568289 IP 10.0.0.2.43638 > vagrant-ubuntu-trusty-64.8882: Flags [P.], seq 3291452649:3291452813, ack 3084033470, win 58, options [nop,nop,TS val 4294713140 ecr 4294713118], length 164
11:36:04.568302 IP vagrant-ubuntu-trusty-64.8882 > 10.0.0.2.43638: Flags [.], ack 3291452321, win 84, options [nop,nop,TS val 4294713172 ecr 4294713080,nop,nop,sack 1 {3291452485:3291452813}], length 0
11:36:04.599443 IP 10.0.0.2.43638 > vagrant-ubuntu-trusty-64.8882: Flags [P.], seq 3291452977:3291453141, ack 3084033470, win 58, options [nop,nop,TS val 4294713180 ecr 4294713158], length 164
11:36:04.599532 IP vagrant-ubuntu-trusty-64.8882 > 10.0.0.2.43638: Flags [.], ack 3291452321, win 86, options [nop,nop,TS val 4294713202 ecr 4294713080,nop,nop,sack 2 {3291452977:3291453141}{3291452485:3291452813}], length 0
11:36:04.615781 IP 10.0.0.2.43638 > vagrant-ubuntu-trusty-64.8882: Flags [P.], seq 3291453141:3291453305, ack 3084033470, win 58, options [nop,nop,TS val 4294713200 ecr 4294713172], length 164
11:36:04.615788 IP vagrant-ubuntu-trusty-64.8882 > 10.0.0.2.43638: Flags [.], ack 3291452321, win 88, options [nop,nop,TS val 4294713218 ecr 4294713080,nop,nop,sack 2 {3291452977:3291453305}{3291452485:3291452813}], length 0
11:36:04.628697 IP 10.0.0.2.43638 > vagrant-ubuntu-trusty-64.8882: Flags [P.], seq 3291452321:3291452485, ack 3084033470, win 58, options [nop,nop,TS val 4294713212 ecr 4294713202], length 164
11:36:04.628810 IP vagrant-ubuntu-trusty-64.8882 > 10.0.0.2.43638: Flags [.], ack 3291452813, win 91, options [nop,nop,TS val 4294713231 ecr 4294713212,nop,nop,sack 1 {3291452977:3291453305}], length 0
11:36:04.628714 IP 10.0.0.2.43638 > vagrant-ubuntu-trusty-64.8882: Flags [P.], seq 3291452813:3291452977, ack 3084033470, win 58, options [nop,nop,TS val 4294713212 ecr 4294713202], length 164
11:36:04.628855 IP vagrant-ubuntu-trusty-64.8882 > 10.0.0.2.43638: Flags [.], ack 3291453305, win 93, options [nop,nop,TS val 4294713231 ecr 4294713212], length 0
11:36:04.651227 IP 10.0.0.2.43638 > vagrant-ubuntu-trusty-64.8882: Flags [P.], seq 3291453305:3291453469, ack 3084033470, win 58, options [nop,nop,TS val 4294713229 ecr 4294713218], length 164
11:36:04.651247 IP vagrant-ubuntu-trusty-64.8882 > 10.0.0.2.43638: Flags [.], ack 3291453469, win 95, options [nop,nop,TS val 4294713255 ecr 4294713229], length 0
11:36:04.662587 IP 10.0.0.2.43638 > vagrant-ubuntu-trusty-64.8882: Flags [P.], seq 3291453469:3291453633, ack 3084033470, win 58, options [nop,nop,TS val 4294713240 ecr 4294713218], length 164
11:36:04.662660 IP vagrant-ubuntu-trusty-64.8882 > 10.0.0.2.43638: Flags [.], ack 3291453633, win 97, options [nop,nop,TS val 4294713266 ecr 4294713240], length 0
11:36:04.677545 IP 10.0.0.2.43638 > vagrant-ubuntu-trusty-64.8882: Flags [P.], seq 3291453633:3291453797, ack 3084033470, win 58, options [nop,nop,TS val 4294713260 ecr 4294713231], length 164
11:36:04.677570 IP vagrant-ubuntu-trusty-64.8882 > 10.0.0.2.43638: Flags [.], ack 3291453797, win 99, options [nop,nop,TS val 4294713281 ecr 4294713260], length 0
11:36:04.686710 IP 10.0.0.2.43638 > vagrant-ubuntu-trusty-64.8882: Flags [P.], seq 3291453797:3291453961, ack 3084033470, win 58, options [nop,nop,TS val 4294713280 ecr 4294713266], length 164
11:36:04.686724 IP vagrant-ubuntu-trusty-64.8882 > 10.0.0.2.43638: Flags [.], ack 3291453961, win 101, options [nop,nop,TS val 4294713290 ecr 4294713280], length 0
11:36:04.711439 IP 10.0.0.2.43638 > vagrant-ubuntu-trusty-64.8882: Flags [P.], seq 3291453961:3291454125, ack 3084033470, win 58, options [nop,nop,TS val 4294713299 ecr 4294713281], length 164
11:36:04.711469 IP vagrant-ubuntu-trusty-64.8882 > 10.0.0.2.43638: Flags [.], ack 3291454125, win 103, options [nop,nop,TS val 4294713315 ecr 4294713299], length 0
11:36:04.734677 IP 10.0.0.2.43638 > vagrant-ubuntu-trusty-64.8882: Flags [P.], seq 3291454125:3291454289, ack 3084033470, win 58, options [nop,nop,TS val 4294713320 ecr 4294713290], length 164
11:36:04.734733 IP vagrant-ubuntu-trusty-64.8882 > 10.0.0.2.43638: Flags [.], ack 3291454289, win 105, options [nop,nop,TS val 4294713338 ecr 4294713320], length 0
11:36:04.770503 IP 10.0.0.2.43638 > vagrant-ubuntu-trusty-64.8882: Flags [P.], seq 3291454289:3291454453, ack 3084033470, win 58, options [nop,nop,TS val 4294713340 ecr 4294713315], length 164
11:36:04.770524 IP vagrant-ubuntu-trusty-64.8882 > 10.0.0.2.43638: Flags [.], ack 3291454453, win 107, options [nop,nop,TS val 4294713374 ecr 4294713340], length 0
11:36:04.788832 IP 10.0.0.2.43638 > vagrant-ubuntu-trusty-64.8882: Flags [P.], seq 3291454453:3291454617, ack 3084033470, win 58, options [nop,nop,TS val 4294713360 ecr 4294713338], length 164
11:36:04.788859 IP vagrant-ubuntu-trusty-64.8882 > 10.0.0.2.43638: Flags [.], ack 3291454617, win 109, options [nop,nop,TS val 4294713392 ecr 4294713360], length 0
11:36:04.810655 IP 10.0.0.2.43638 > vagrant-ubuntu-trusty-64.8882: Flags [P.], seq 3291454617:3291454781, ack 3084033470, win 58, options [nop,nop,TS val 4294713380 ecr 4294713338], length 164
11:36:04.810729 IP vagrant-ubuntu-trusty-64.8882 > 10.0.0.2.43638: Flags [.], ack 3291454781, win 111, options [nop,nop,TS val 4294713414 ecr 4294713380], length 0
11:36:04.832354 IP 10.0.0.2.43638 > vagrant-ubuntu-trusty-64.8882: Flags [P.], seq 3291454781:3291454945, ack 3084033470, win 58, options [nop,nop,TS val 4294713400 ecr 4294713374], length 164
11:36:04.832460 IP vagrant-ubuntu-trusty-64.8882 > 10.0.0.2.43638: Flags [.], ack 3291454945, win 114, options [nop,nop,TS val 4294713435 ecr 4294713400], length 0
11:36:04.854554 IP 10.0.0.2.43638 > vagrant-ubuntu-trusty-64.8882: Flags [P.], seq 3291454945:3291455109, ack 3084033470, win 58, options [nop,nop,TS val 4294713420 ecr 4294713392], length 164
11:36:04.854685 IP vagrant-ubuntu-trusty-64.8882 > 10.0.0.2.43638: Flags [.], ack 3291455109, win 116, options [nop,nop,TS val 4294713456 ecr 4294713420], length 0
11:36:04.871556 IP 10.0.0.2.43638 > vagrant-ubuntu-trusty-64.8882: Flags [P.], seq 3291455109:3291455273, ack 3084033470, win 58, options [nop,nop,TS val 4294713440 ecr 4294713414], length 164
11:36:04.871590 IP vagrant-ubuntu-trusty-64.8882 > 10.0.0.2.43638: Flags [.], ack 3291455273, win 118, options [nop,nop,TS val 4294713475 ecr 4294713440], length 0
11:36:04.893379 IP 10.0.0.2.43638 > vagrant-ubuntu-trusty-64.8882: Flags [P.], seq 3291455273:3291455437, ack 3084033470, win 58, options [nop,nop,TS val 4294713459 ecr 4294713435], length 164
11:36:04.893453 IP vagrant-ubuntu-trusty-64.8882 > 10.0.0.2.43638: Flags [.], ack 3291455437, win 120, options [nop,nop,TS val 4294713496 ecr 4294713459], length 0
11:36:04.914399 IP 10.0.0.2.43638 > vagrant-ubuntu-trusty-64.8882: Flags [P.], seq 3291455437:3291455601, ack 3084033470, win 58, options [nop,nop,TS val 4294713480 ecr 4294713456], length 164
11:36:04.914430 IP vagrant-ubuntu-trusty-64.8882 > 10.0.0.2.43638: Flags [.], ack 3291455601, win 122, options [nop,nop,TS val 4294713518 ecr 4294713480], length 0
11:36:04.932809 IP 10.0.0.2.43638 > vagrant-ubuntu-trusty-64.8882: Flags [P.], seq 3291455601:3291455765, ack 3084033470, win 58, options [nop,nop,TS val 4294713500 ecr 4294713475], length 164
11:36:04.932842 IP vagrant-ubuntu-trusty-64.8882 > 10.0.0.2.43638: Flags [.], ack 3291455765, win 124, options [nop,nop,TS val 4294713536 ecr 4294713500], length 0
11:36:04.954563 IP 10.0.0.2.43638 > vagrant-ubuntu-trusty-64.8882: Flags [P.], seq 3291455765:3291455929, ack 3084033470, win 58, options [nop,nop,TS val 4294713519 ecr 4294713496], length 164
11:36:04.954615 IP vagrant-ubuntu-trusty-64.8882 > 10.0.0.2.43638: Flags [.], ack 3291455929, win 126, options [nop,nop,TS val 4294713558 ecr 4294713519], length 0
11:36:04.972639 IP 10.0.0.2.43638 > vagrant-ubuntu-trusty-64.8882: Flags [P.], seq 3291455929:3291456093, ack 3084033470, win 58, options [nop,nop,TS val 4294713540 ecr 4294713518], length 164
11:36:04.972671 IP vagrant-ubuntu-trusty-64.8882 > 10.0.0.2.43638: Flags [.], ack 3291456093, win 128, options [nop,nop,TS val 4294713576 ecr 4294713540], length 0
11:36:04.994540 IP 10.0.0.2.43638 > vagrant-ubuntu-trusty-64.8882: Flags [P.], seq 3291456093:3291456257, ack 3084033470, win 58, options [nop,nop,TS val 4294713560 ecr 4294713536], length 164
11:36:04.994636 IP vagrant-ubuntu-trusty-64.8882 > 10.0.0.2.43638: Flags [.], ack 3291456257, win 130, options [nop,nop,TS val 4294713597 ecr 4294713560], length 0
11:36:05.015367 IP 10.0.0.2.43638 > vagrant-ubuntu-trusty-64.8882: Flags [P.], seq 3291456257:3291456421, ack 3084033470, win 58, options [nop,nop,TS val 4294713580 ecr 4294713558], length 164
11:36:05.015385 IP vagrant-ubuntu-trusty-64.8882 > 10.0.0.2.43638: Flags [.], ack 3291456421, win 132, options [nop,nop,TS val 4294713619 ecr 4294713580], length 0
11:36:05.034781 IP 10.0.0.2.43638 > vagrant-ubuntu-trusty-64.8882: Flags [P.], seq 3291456421:3291456585, ack 3084033470, win 58, options [nop,nop,TS val 4294713600 ecr 4294713576], length 164
11:36:05.034843 IP vagrant-ubuntu-trusty-64.8882 > 10.0.0.2.43638: Flags [.], ack 3291456585, win 135, options [nop,nop,TS val 4294713638 ecr 4294713600], length 0
11:36:05.052758 IP 10.0.0.2.43638 > vagrant-ubuntu-trusty-64.8882: Flags [P.], seq 3291456585:3291456749, ack 3084033470, win 58, options [nop,nop,TS val 4294713620 ecr 4294713597], length 164
11:36:05.052834 IP vagrant-ubuntu-trusty-64.8882 > 10.0.0.2.43638: Flags [.], ack 3291456749, win 137, options [nop,nop,TS val 4294713656 ecr 4294713620], length 0
11:36:05.073599 IP 10.0.0.2.43638 > vagrant-ubuntu-trusty-64.8882: Flags [P.], seq 3291456749:3291456913, ack 3084033470, win 58, options [nop,nop,TS val 4294713640 ecr 4294713619], length 164
11:36:05.073612 IP vagrant-ubuntu-trusty-64.8882 > 10.0.0.2.43638: Flags [.], ack 3291456913, win 139, options [nop,nop,TS val 4294713677 ecr 4294713640], length 0
11:36:05.092620 IP 10.0.0.2.43638 > vagrant-ubuntu-trusty-64.8882: Flags [P.], seq 3291456913:3291457077, ack 3084033470, win 58, options [nop,nop,TS val 4294713660 ecr 4294713638], length 164
11:36:05.092711 IP vagrant-ubuntu-trusty-64.8882 > 10.0.0.2.43638: Flags [.], ack 3291457077, win 141, options [nop,nop,TS val 4294713695 ecr 4294713660], length 0
11:36:05.113409 IP 10.0.0.2.43638 > vagrant-ubuntu-trusty-64.8882: Flags [P.], seq 3291457077:3291457241, ack 3084033470, win 58, options [nop,nop,TS val 4294713680 ecr 4294713656], length 164
11:36:05.113423 IP vagrant-ubuntu-trusty-64.8882 > 10.0.0.2.43638: Flags [.], ack 3291457241, win 143, options [nop,nop,TS val 4294713717 ecr 4294713680], length 0
11:36:05.131844 IP 10.0.0.2.43638 > vagrant-ubuntu-trusty-64.8882: Flags [P.], seq 3291457241:3291457405, ack 3084033470, win 58, options [nop,nop,TS val 4294713700 ecr 4294713677], length 164
11:36:05.131861 IP vagrant-ubuntu-trusty-64.8882 > 10.0.0.2.43638: Flags [.], ack 3291457405, win 145, options [nop,nop,TS val 4294713735 ecr 4294713700], length 0
11:36:05.153257 IP 10.0.0.2.43638 > vagrant-ubuntu-trusty-64.8882: Flags [P.], seq 3291457405:3291457569, ack 3084033470, win 58, options [nop,nop,TS val 4294713720 ecr 4294713695], length 164
11:36:05.153278 IP vagrant-ubuntu-trusty-64.8882 > 10.0.0.2.43638: Flags [.], ack 3291457569, win 147, options [nop,nop,TS val 4294713757 ecr 4294713720], length 0
11:36:05.168711 IP 10.0.0.2.43638 > vagrant-ubuntu-trusty-64.8882: Flags [P.], seq 3291457569:3291457733, ack 3084033470, win 58, options [nop,nop,TS val 4294713740 ecr 4294713717], length 164
11:36:05.168720 IP vagrant-ubuntu-trusty-64.8882 > 10.0.0.2.43638: Flags [.], ack 3291457733, win 149, options [nop,nop,TS val 4294713772 ecr 4294713740], length 0
11:36:05.179520 IP 10.0.0.2.43638 > vagrant-ubuntu-trusty-64.8882: Flags [P.], seq 3291457733:3291457897, ack 3084033470, win 58, options [nop,nop,TS val 4294713760 ecr 4294713735], length 164
11:36:05.179533 IP vagrant-ubuntu-trusty-64.8882 > 10.0.0.2.43638: Flags [.], ack 3291457897, win 151, options [nop,nop,TS val 4294713783 ecr 4294713760], length 0
11:36:05.198591 IP 10.0.0.2.43638 > vagrant-ubuntu-trusty-64.8882: Flags [P.], seq 3291457897:3291458061, ack 3084033470, win 58, options [nop,nop,TS val 4294713780 ecr 4294713757], length 164
11:36:05.198692 IP vagrant-ubuntu-trusty-64.8882 > 10.0.0.2.43638: Flags [.], ack 3291458061, win 153, options [nop,nop,TS val 4294713801 ecr 4294713780], length 0
11:36:05.229928 IP 10.0.0.2.43638 > vagrant-ubuntu-trusty-64.8882: Flags [P.], seq 3291458225:3291458389, ack 3084033470, win 58, options [nop,nop,TS val 4294713819 ecr 4294713801], length 164
11:36:05.229940 IP vagrant-ubuntu-trusty-64.8882 > 10.0.0.2.43638: Flags [.], ack 3291458061, win 155, options [nop,nop,TS val 4294713833 ecr 4294713780,nop,nop,sack 1 {3291458225:3291458389}], length 0
11:36:05.250981 IP 10.0.0.2.43638 > vagrant-ubuntu-trusty-64.8882: Flags [P.], seq 3291458389:3291458553, ack 3084033470, win 58, options [nop,nop,TS val 4294713839 ecr 4294713801], length 164
11:36:05.251067 IP vagrant-ubuntu-trusty-64.8882 > 10.0.0.2.43638: Flags [.], ack 3291458061, win 158, options [nop,nop,TS val 4294713854 ecr 4294713780,nop,nop,sack 1 {3291458225:3291458553}], length 0
11:36:05.265539 IP 10.0.0.2.43638 > vagrant-ubuntu-trusty-64.8882: Flags [P.], seq 3291458061:3291458225, ack 3084033470, win 58, options [nop,nop,TS val 4294713855 ecr 4294713833], length 164
11:36:05.265562 IP vagrant-ubuntu-trusty-64.8882 > 10.0.0.2.43638: Flags [.], ack 3291458553, win 160, options [nop,nop,TS val 4294713869 ecr 4294713855], length 0
11:36:05.268887 IP 10.0.0.2.43638 > vagrant-ubuntu-trusty-64.8882: Flags [P.], seq 3291458553:3291458717, ack 3084033470, win 58, options [nop,nop,TS val 4294713859 ecr 4294713833], length 164
11:36:05.268920 IP vagrant-ubuntu-trusty-64.8882 > 10.0.0.2.43638: Flags [.], ack 3291458717, win 162, options [nop,nop,TS val 4294713872 ecr 4294713859], length 0
11:36:05.288830 IP 10.0.0.2.43638 > vagrant-ubuntu-trusty-64.8882: Flags [P.], seq 3291458717:3291458881, ack 3084033470, win 58, options [nop,nop,TS val 4294713879 ecr 4294713869], length 164
11:36:05.288869 IP vagrant-ubuntu-trusty-64.8882 > 10.0.0.2.43638: Flags [.], ack 3291458881, win 164, options [nop,nop,TS val 4294713892 ecr 4294713879], length 0
11:36:05.313222 IP 10.0.0.2.43638 > vagrant-ubuntu-trusty-64.8882: Flags [P.], seq 3291458881:3291459045, ack 3084033470, win 58, options [nop,nop,TS val 4294713899 ecr 4294713872], length 164
11:36:05.313271 IP vagrant-ubuntu-trusty-64.8882 > 10.0.0.2.43638: Flags [.], ack 3291459045, win 166, options [nop,nop,TS val 4294713916 ecr 4294713899], length 0
11:36:05.329160 IP 10.0.0.2.43638 > vagrant-ubuntu-trusty-64.8882: Flags [P.], seq 3291459045:3291459209, ack 3084033470, win 58, options [nop,nop,TS val 4294713920 ecr 4294713892], length 164
11:36:05.329177 IP vagrant-ubuntu-trusty-64.8882 > 10.0.0.2.43638: Flags [.], ack 3291459209, win 168, options [nop,nop,TS val 4294713933 ecr 4294713920], length 0
11:36:05.347653 IP 10.0.0.2.43638 > vagrant-ubuntu-trusty-64.8882: Flags [P.], seq 3291459209:3291459373, ack 3084033470, win 58, options [nop,nop,TS val 4294713940 ecr 4294713916], length 164
11:36:05.347685 IP vagrant-ubuntu-trusty-64.8882 > 10.0.0.2.43638: Flags [.], ack 3291459373, win 170, options [nop,nop,TS val 4294713951 ecr 4294713940], length 0
11:36:05.366677 IP 10.0.0.2.43638 > vagrant-ubuntu-trusty-64.8882: Flags [P.], seq 3291459373:3291459537, ack 3084033470, win 58, options [nop,nop,TS val 4294713959 ecr 4294713933], length 164
11:36:05.366710 IP vagrant-ubuntu-trusty-64.8882 > 10.0.0.2.43638: Flags [.], ack 3291459537, win 172, options [nop,nop,TS val 4294713970 ecr 4294713959], length 0
11:36:05.386760 IP 10.0.0.2.43638 > vagrant-ubuntu-trusty-64.8882: Flags [P.], seq 3291459537:3291459701, ack 3084033470, win 58, options [nop,nop,TS val 4294713980 ecr 4294713951], length 164
11:36:05.386770 IP vagrant-ubuntu-trusty-64.8882 > 10.0.0.2.43638: Flags [.], ack 3291459701, win 174, options [nop,nop,TS val 4294713990 ecr 4294713980], length 0
11:36:05.406015 IP 10.0.0.2.43638 > vagrant-ubuntu-trusty-64.8882: Flags [P.], seq 3291459701:3291459865, ack 3084033470, win 58, options [nop,nop,TS val 4294713999 ecr 4294713970], length 164
11:36:05.406032 IP vagrant-ubuntu-trusty-64.8882 > 10.0.0.2.43638: Flags [.], ack 3291459865, win 176, options [nop,nop,TS val 4294714009 ecr 4294713999], length 0
11:36:05.425926 IP 10.0.0.2.43638 > vagrant-ubuntu-trusty-64.8882: Flags [P.], seq 3291459865:3291460029, ack 3084033470, win 58, options [nop,nop,TS val 4294714019 ecr 4294713990], length 164
11:36:05.425937 IP vagrant-ubuntu-trusty-64.8882 > 10.0.0.2.43638: Flags [.], ack 3291460029, win 178, options [nop,nop,TS val 4294714029 ecr 4294714019], length 0
11:36:05.446514 IP 10.0.0.2.43638 > vagrant-ubuntu-trusty-64.8882: Flags [P.], seq 3291460029:3291460193, ack 3084033470, win 58, options [nop,nop,TS val 4294714039 ecr 4294714009], length 164
11:36:05.446589 IP vagrant-ubuntu-trusty-64.8882 > 10.0.0.2.43638: Flags [.], ack 3291460193, win 181, options [nop,nop,TS val 4294714049 ecr 4294714039], length 0
11:36:05.466686 IP 10.0.0.2.43638 > vagrant-ubuntu-trusty-64.8882: Flags [P.], seq 3291460193:3291460357, ack 3084033470, win 58, options [nop,nop,TS val 4294714060 ecr 4294714029], length 164
11:36:05.466727 IP vagrant-ubuntu-trusty-64.8882 > 10.0.0.2.43638: Flags [.], ack 3291460357, win 183, options [nop,nop,TS val 4294714070 ecr 4294714060], length 0
11:36:05.494565 IP 10.0.0.2.43638 > vagrant-ubuntu-trusty-64.8882: Flags [P.], seq 3291460357:3291460521, ack 3084033470, win 58, options [nop,nop,TS val 4294714080 ecr 4294714049], length 164
11:36:05.494615 IP vagrant-ubuntu-trusty-64.8882 > 10.0.0.2.43638: Flags [.], ack 3291460521, win 185, options [nop,nop,TS val 4294714098 ecr 4294714080], length 0
11:36:05.506739 IP 10.0.0.2.43638 > vagrant-ubuntu-trusty-64.8882: Flags [P.], seq 3291460521:3291460685, ack 3084033470, win 58, options [nop,nop,TS val 4294714099 ecr 4294714070], length 164
11:36:05.506780 IP vagrant-ubuntu-trusty-64.8882 > 10.0.0.2.43638: Flags [.], ack 3291460685, win 187, options [nop,nop,TS val 4294714110 ecr 4294714099], length 0
11:36:05.525891 IP 10.0.0.2.43638 > vagrant-ubuntu-trusty-64.8882: Flags [P.], seq 3291460685:3291460849, ack 3084033470, win 58, options [nop,nop,TS val 4294714119 ecr 4294714098], length 164
11:36:05.525903 IP vagrant-ubuntu-trusty-64.8882 > 10.0.0.2.43638: Flags [.], ack 3291460849, win 189, options [nop,nop,TS val 4294714129 ecr 4294714119], length 0
11:36:05.546005 IP 10.0.0.2.43638 > vagrant-ubuntu-trusty-64.8882: Flags [P.], seq 3291460849:3291461013, ack 3084033470, win 58, options [nop,nop,TS val 4294714139 ecr 4294714110], length 164
11:36:05.546044 IP vagrant-ubuntu-trusty-64.8882 > 10.0.0.2.43638: Flags [.], ack 3291461013, win 191, options [nop,nop,TS val 4294714149 ecr 4294714139], length 0
11:36:05.565920 IP 10.0.0.2.43638 > vagrant-ubuntu-trusty-64.8882: Flags [P.], seq 3291461013:3291461177, ack 3084033470, win 58, options [nop,nop,TS val 4294714159 ecr 4294714129], length 164
11:36:05.565934 IP vagrant-ubuntu-trusty-64.8882 > 10.0.0.2.43638: Flags [.], ack 3291461177, win 193, options [nop,nop,TS val 4294714169 ecr 4294714159], length 0
11:36:05.589726 IP 10.0.0.2.43638 > vagrant-ubuntu-trusty-64.8882: Flags [P.], seq 3291461177:3291461341, ack 3084033470, win 58, options [nop,nop,TS val 4294714180 ecr 4294714169], length 164
11:36:05.589763 IP vagrant-ubuntu-trusty-64.8882 > 10.0.0.2.43638: Flags [.], ack 3291461341, win 195, options [nop,nop,TS val 4294714193 ecr 4294714180], length 0
11:36:05.606152 IP 10.0.0.2.43638 > vagrant-ubuntu-trusty-64.8882: Flags [P.], seq 3291461341:3291461505, ack 3084033470, win 58, options [nop,nop,TS val 4294714199 ecr 4294714169], length 164
11:36:05.606169 IP vagrant-ubuntu-trusty-64.8882 > 10.0.0.2.43638: Flags [.], ack 3291461505, win 197, options [nop,nop,TS val 4294714210 ecr 4294714199], length 0
11:36:05.626722 IP 10.0.0.2.43638 > vagrant-ubuntu-trusty-64.8882: Flags [P.], seq 3291461505:3291461669, ack 3084033470, win 58, options [nop,nop,TS val 4294714219 ecr 4294714193], length 164
11:36:05.626769 IP vagrant-ubuntu-trusty-64.8882 > 10.0.0.2.43638: Flags [.], ack 3291461669, win 199, options [nop,nop,TS val 4294714230 ecr 4294714219], length 0
11:36:05.645963 IP 10.0.0.2.43638 > vagrant-ubuntu-trusty-64.8882: Flags [P.], seq 3291461669:3291461833, ack 3084033470, win 58, options [nop,nop,TS val 4294714239 ecr 4294714210], length 164
11:36:05.645980 IP vagrant-ubuntu-trusty-64.8882 > 10.0.0.2.43638: Flags [.], ack 3291461833, win 202, options [nop,nop,TS val 4294714249 ecr 4294714239], length 0
11:36:05.666755 IP 10.0.0.2.43638 > vagrant-ubuntu-trusty-64.8882: Flags [P.], seq 3291461833:3291461997, ack 3084033470, win 58, options [nop,nop,TS val 4294714259 ecr 4294714230], length 164
11:36:05.666820 IP vagrant-ubuntu-trusty-64.8882 > 10.0.0.2.43638: Flags [.], ack 3291461997, win 204, options [nop,nop,TS val 4294714269 ecr 4294714259], length 0
11:36:05.687095 IP 10.0.0.2.43638 > vagrant-ubuntu-trusty-64.8882: Flags [P.], seq 3291461997:3291462161, ack 3084033470, win 58, options [nop,nop,TS val 4294714280 ecr 4294714249], length 164
11:36:05.687127 IP vagrant-ubuntu-trusty-64.8882 > 10.0.0.2.43638: Flags [.], ack 3291462161, win 206, options [nop,nop,TS val 4294714290 ecr 4294714280], length 0
11:36:05.705996 IP 10.0.0.2.43638 > vagrant-ubuntu-trusty-64.8882: Flags [P.], seq 3291462161:3291462325, ack 3084033470, win 58, options [nop,nop,TS val 4294714299 ecr 4294714269], length 164
11:36:05.706013 IP vagrant-ubuntu-trusty-64.8882 > 10.0.0.2.43638: Flags [.], ack 3291462325, win 208, options [nop,nop,TS val 4294714309 ecr 4294714299], length 0
11:36:05.726722 IP 10.0.0.2.43638 > vagrant-ubuntu-trusty-64.8882: Flags [P.], seq 3291462325:3291462489, ack 3084033470, win 58, options [nop,nop,TS val 4294714320 ecr 4294714309], length 164
11:36:05.726850 IP vagrant-ubuntu-trusty-64.8882 > 10.0.0.2.43638: Flags [.], ack 3291462489, win 210, options [nop,nop,TS val 4294714330 ecr 4294714320], length 0
11:36:05.746859 IP 10.0.0.2.43638 > vagrant-ubuntu-trusty-64.8882: Flags [P.], seq 3291462489:3291462653, ack 3084033470, win 58, options [nop,nop,TS val 4294714340 ecr 4294714309], length 164
11:36:05.746898 IP vagrant-ubuntu-trusty-64.8882 > 10.0.0.2.43638: Flags [.], ack 3291462653, win 212, options [nop,nop,TS val 4294714350 ecr 4294714340], length 0
11:36:05.772205 IP 10.0.0.2.43638 > vagrant-ubuntu-trusty-64.8882: Flags [P.], seq 3291462653:3291462817, ack 3084033470, win 58, options [nop,nop,TS val 4294714359 ecr 4294714330], length 164
11:36:05.772240 IP vagrant-ubuntu-trusty-64.8882 > 10.0.0.2.43638: Flags [.], ack 3291462817, win 214, options [nop,nop,TS val 4294714375 ecr 4294714359], length 0
11:36:05.786076 IP 10.0.0.2.43638 > vagrant-ubuntu-trusty-64.8882: Flags [P.], seq 3291462817:3291462981, ack 3084033470, win 58, options [nop,nop,TS val 4294714379 ecr 4294714350], length 164
11:36:05.786111 IP vagrant-ubuntu-trusty-64.8882 > 10.0.0.2.43638: Flags [.], ack 3291462981, win 216, options [nop,nop,TS val 4294714389 ecr 4294714379], length 0
11:36:05.806631 IP 10.0.0.2.43638 > vagrant-ubuntu-trusty-64.8882: Flags [P.], seq 3291462981:3291463145, ack 3084033470, win 58, options [nop,nop,TS val 4294714399 ecr 4294714375], length 164
11:36:05.806675 IP vagrant-ubuntu-trusty-64.8882 > 10.0.0.2.43638: Flags [.], ack 3291463145, win 218, options [nop,nop,TS val 4294714410 ecr 4294714399], length 0
11:36:05.826180 IP 10.0.0.2.43638 > vagrant-ubuntu-trusty-64.8882: Flags [P.], seq 3291463145:3291463309, ack 3084033470, win 58, options [nop,nop,TS val 4294714419 ecr 4294714389], length 164
11:36:05.826197 IP vagrant-ubuntu-trusty-64.8882 > 10.0.0.2.43638: Flags [.], ack 3291463309, win 220, options [nop,nop,TS val 4294714430 ecr 4294714419], length 0
11:36:05.854336 IP 10.0.0.2.43638 > vagrant-ubuntu-trusty-64.8882: Flags [P.], seq 3291463309:3291463473, ack 3084033470, win 58, options [nop,nop,TS val 4294714439 ecr 4294714410], length 164
11:36:05.854384 IP vagrant-ubuntu-trusty-64.8882 > 10.0.0.2.43638: Flags [.], ack 3291463473, win 222, options [nop,nop,TS val 4294714457 ecr 4294714439], length 0
11:36:05.865975 IP 10.0.0.2.43638 > vagrant-ubuntu-trusty-64.8882: Flags [P.], seq 3291463473:3291463637, ack 3084033470, win 58, options [nop,nop,TS val 4294714459 ecr 4294714430], length 164
11:36:05.865992 IP vagrant-ubuntu-trusty-64.8882 > 10.0.0.2.43638: Flags [.], ack 3291463637, win 225, options [nop,nop,TS val 4294714469 ecr 4294714459], length 0
11:36:05.886775 IP 10.0.0.2.43638 > vagrant-ubuntu-trusty-64.8882: Flags [P.], seq 3291463637:3291463801, ack 3084033470, win 58, options [nop,nop,TS val 4294714479 ecr 4294714457], length 164
11:36:05.886818 IP vagrant-ubuntu-trusty-64.8882 > 10.0.0.2.43638: Flags [.], ack 3291463801, win 227, options [nop,nop,TS val 4294714490 ecr 4294714479], length 0
11:36:05.905964 IP 10.0.0.2.43638 > vagrant-ubuntu-trusty-64.8882: Flags [P.], seq 3291463801:3291463965, ack 3084033470, win 58, options [nop,nop,TS val 4294714499 ecr 4294714469], length 164
11:36:05.905979 IP vagrant-ubuntu-trusty-64.8882 > 10.0.0.2.43638: Flags [.], ack 3291463965, win 229, options [nop,nop,TS val 4294714509 ecr 4294714499], length 0
11:36:05.936578 IP 10.0.0.2.43638 > vagrant-ubuntu-trusty-64.8882: Flags [P.], seq 3291463965:3291464129, ack 3084033470, win 58, options [nop,nop,TS val 4294714519 ecr 4294714490], length 164
11:36:05.936597 IP vagrant-ubuntu-trusty-64.8882 > 10.0.0.2.43638: Flags [.], ack 3291464129, win 231, options [nop,nop,TS val 4294714540 ecr 4294714519], length 0
11:36:05.946750 IP 10.0.0.2.43638 > vagrant-ubuntu-trusty-64.8882: Flags [P.], seq 3291464129:3291464293, ack 3084033470, win 58, options [nop,nop,TS val 4294714540 ecr 4294714509], length 164
11:36:05.946773 IP vagrant-ubuntu-trusty-64.8882 > 10.0.0.2.43638: Flags [.], ack 3291464293, win 233, options [nop,nop,TS val 4294714550 ecr 4294714540], length 0
11:36:05.966190 IP 10.0.0.2.43638 > vagrant-ubuntu-trusty-64.8882: Flags [P.], seq 3291464293:3291464457, ack 3084033470, win 58, options [nop,nop,TS val 4294714560 ecr 4294714540], length 164
11:36:05.966205 IP vagrant-ubuntu-trusty-64.8882 > 10.0.0.2.43638: Flags [.], ack 3291464457, win 235, options [nop,nop,TS val 4294714570 ecr 4294714560], length 0
11:36:05.986389 IP 10.0.0.2.43638 > vagrant-ubuntu-trusty-64.8882: Flags [P.], seq 3291464457:3291464621, ack 3084033470, win 58, options [nop,nop,TS val 4294714579 ecr 4294714550], length 164
11:36:05.986429 IP vagrant-ubuntu-trusty-64.8882 > 10.0.0.2.43638: Flags [.], ack 3291464621, win 237, options [nop,nop,TS val 4294714589 ecr 4294714579], length 0
11:36:06.006015 IP 10.0.0.2.43638 > vagrant-ubuntu-trusty-64.8882: Flags [P.], seq 3291464621:3291464785, ack 3084033470, win 58, options [nop,nop,TS val 4294714599 ecr 4294714570], length 164
11:36:06.006031 IP vagrant-ubuntu-trusty-64.8882 > 10.0.0.2.43638: Flags [.], ack 3291464785, win 239, options [nop,nop,TS val 4294714609 ecr 4294714599], length 0
11:36:06.026138 IP 10.0.0.2.43638 > vagrant-ubuntu-trusty-64.8882: Flags [P.], seq 3291464785:3291464949, ack 3084033470, win 58, options [nop,nop,TS val 4294714619 ecr 4294714589], length 164
11:36:06.026182 IP vagrant-ubuntu-trusty-64.8882 > 10.0.0.2.43638: Flags [.], ack 3291464949, win 241, options [nop,nop,TS val 4294714629 ecr 4294714619], length 0
11:36:06.046340 IP 10.0.0.2.43638 > vagrant-ubuntu-trusty-64.8882: Flags [P.], seq 3291464949:3291465113, ack 3084033470, win 58, options [nop,nop,TS val 4294714640 ecr 4294714609], length 164
11:36:06.046350 IP vagrant-ubuntu-trusty-64.8882 > 10.0.0.2.43638: Flags [.], ack 3291465113, win 243, options [nop,nop,TS val 4294714650 ecr 4294714640], length 0
11:36:06.067095 IP 10.0.0.2.43638 > vagrant-ubuntu-trusty-64.8882: Flags [P.], seq 3291465113:3291465277, ack 3084033470, win 58, options [nop,nop,TS val 4294714660 ecr 4294714629], length 164
11:36:06.067128 IP vagrant-ubuntu-trusty-64.8882 > 10.0.0.2.43638: Flags [.], ack 3291465277, win 245, options [nop,nop,TS val 4294714670 ecr 4294714660], length 0
11:36:06.085987 IP 10.0.0.2.43638 > vagrant-ubuntu-trusty-64.8882: Flags [P.], seq 3291465277:3291465441, ack 3084033470, win 58, options [nop,nop,TS val 4294714679 ecr 4294714650], length 164
11:36:06.086003 IP vagrant-ubuntu-trusty-64.8882 > 10.0.0.2.43638: Flags [.], ack 3291465441, win 248, options [nop,nop,TS val 4294714689 ecr 4294714679], length 0
11:36:06.106147 IP 10.0.0.2.43638 > vagrant-ubuntu-trusty-64.8882: Flags [P.], seq 3291465441:3291465605, ack 3084033470, win 58, options [nop,nop,TS val 4294714699 ecr 4294714670], length 164
11:36:06.106163 IP vagrant-ubuntu-trusty-64.8882 > 10.0.0.2.43638: Flags [.], ack 3291465605, win 250, options [nop,nop,TS val 4294714710 ecr 4294714699], length 0
11:36:06.126968 IP 10.0.0.2.43638 > vagrant-ubuntu-trusty-64.8882: Flags [P.], seq 3291465605:3291465769, ack 3084033470, win 58, options [nop,nop,TS val 4294714720 ecr 4294714689], length 164
11:36:06.127012 IP vagrant-ubuntu-trusty-64.8882 > 10.0.0.2.43638: Flags [.], ack 3291465769, win 252, options [nop,nop,TS val 4294714730 ecr 4294714720], length 0
11:36:06.145966 IP 10.0.0.2.43638 > vagrant-ubuntu-trusty-64.8882: Flags [P.], seq 3291465769:3291465933, ack 3084033470, win 58, options [nop,nop,TS val 4294714739 ecr 4294714710], length 164
11:36:06.145983 IP vagrant-ubuntu-trusty-64.8882 > 10.0.0.2.43638: Flags [.], ack 3291465933, win 254, options [nop,nop,TS val 4294714749 ecr 4294714739], length 0
11:36:06.166546 IP 10.0.0.2.43638 > vagrant-ubuntu-trusty-64.8882: Flags [P.], seq 3291465933:3291466097, ack 3084033470, win 58, options [nop,nop,TS val 4294714760 ecr 4294714730], length 164
11:36:06.166563 IP vagrant-ubuntu-trusty-64.8882 > 10.0.0.2.43638: Flags [.], ack 3291466097, win 256, options [nop,nop,TS val 4294714770 ecr 4294714760], length 0
11:36:06.186456 IP 10.0.0.2.43638 > vagrant-ubuntu-trusty-64.8882: Flags [P.], seq 3291466097:3291466261, ack 3084033470, win 58, options [nop,nop,TS val 4294714780 ecr 4294714749], length 164
11:36:06.186473 IP vagrant-ubuntu-trusty-64.8882 > 10.0.0.2.43638: Flags [.], ack 3291466261, win 258, options [nop,nop,TS val 4294714790 ecr 4294714780], length 0
11:36:06.206270 IP 10.0.0.2.43638 > vagrant-ubuntu-trusty-64.8882: Flags [P.], seq 3291466261:3291466425, ack 3084033470, win 58, options [nop,nop,TS val 4294714799 ecr 4294714770], length 164
11:36:06.206304 IP vagrant-ubuntu-trusty-64.8882 > 10.0.0.2.43638: Flags [.], ack 3291466425, win 260, options [nop,nop,TS val 4294714810 ecr 4294714799], length 0
11:36:06.225938 IP 10.0.0.2.43638 > vagrant-ubuntu-trusty-64.8882: Flags [P.], seq 3291466425:3291466589, ack 3084033470, win 58, options [nop,nop,TS val 4294714819 ecr 4294714790], length 164
11:36:06.225955 IP vagrant-ubuntu-trusty-64.8882 > 10.0.0.2.43638: Flags [.], ack 3291466589, win 262, options [nop,nop,TS val 4294714829 ecr 4294714819], length 0
11:36:06.247219 IP 10.0.0.2.43638 > vagrant-ubuntu-trusty-64.8882: Flags [P.], seq 3291466589:3291466753, ack 3084033470, win 58, options [nop,nop,TS val 4294714840 ecr 4294714810], length 164
11:36:06.247248 IP vagrant-ubuntu-trusty-64.8882 > 10.0.0.2.43638: Flags [.], ack 3291466753, win 264, options [nop,nop,TS val 4294714850 ecr 4294714840], length 0
11:36:06.266570 IP 10.0.0.2.43638 > vagrant-ubuntu-trusty-64.8882: Flags [P.], seq 3291466753:3291466917, ack 3084033470, win 58, options [nop,nop,TS val 4294714860 ecr 4294714829], length 164
11:36:06.266604 IP vagrant-ubuntu-trusty-64.8882 > 10.0.0.2.43638: Flags [.], ack 3291466917, win 266, options [nop,nop,TS val 4294714870 ecr 4294714860], length 0
11:36:06.286708 IP 10.0.0.2.43638 > vagrant-ubuntu-trusty-64.8882: Flags [P.], seq 3291466917:3291467081, ack 3084033470, win 58, options [nop,nop,TS val 4294714880 ecr 4294714850], length 164
11:36:06.286725 IP vagrant-ubuntu-trusty-64.8882 > 10.0.0.2.43638: Flags [.], ack 3291467081, win 269, options [nop,nop,TS val 4294714890 ecr 4294714880], length 0
11:36:06.306280 IP 10.0.0.2.43638 > vagrant-ubuntu-trusty-64.8882: Flags [P.], seq 3291467081:3291467245, ack 3084033470, win 58, options [nop,nop,TS val 4294714900 ecr 4294714870], length 164
11:36:06.306296 IP vagrant-ubuntu-trusty-64.8882 > 10.0.0.2.43638: Flags [.], ack 3291467245, win 271, options [nop,nop,TS val 4294714910 ecr 4294714900], length 0
11:36:06.326120 IP 10.0.0.2.43638 > vagrant-ubuntu-trusty-64.8882: Flags [P.], seq 3291467245:3291467409, ack 3084033470, win 58, options [nop,nop,TS val 4294714919 ecr 4294714890], length 164
11:36:06.326161 IP vagrant-ubuntu-trusty-64.8882 > 10.0.0.2.43638: Flags [.], ack 3291467409, win 273, options [nop,nop,TS val 4294714929 ecr 4294714919], length 0
11:36:06.345979 IP 10.0.0.2.43638 > vagrant-ubuntu-trusty-64.8882: Flags [P.], seq 3291467409:3291467573, ack 3084033470, win 58, options [nop,nop,TS val 4294714939 ecr 4294714910], length 164
11:36:06.345996 IP vagrant-ubuntu-trusty-64.8882 > 10.0.0.2.43638: Flags [.], ack 3291467573, win 275, options [nop,nop,TS val 4294714949 ecr 4294714939], length 0
11:36:06.367028 IP 10.0.0.2.43638 > vagrant-ubuntu-trusty-64.8882: Flags [P.], seq 3291467573:3291467737, ack 3084033470, win 58, options [nop,nop,TS val 4294714960 ecr 4294714929], length 164
11:36:06.367062 IP vagrant-ubuntu-trusty-64.8882 > 10.0.0.2.43638: Flags [.], ack 3291467737, win 277, options [nop,nop,TS val 4294714970 ecr 4294714960], length 0
11:36:06.386039 IP 10.0.0.2.43638 > vagrant-ubuntu-trusty-64.8882: Flags [P.], seq 3291467737:3291467901, ack 3084033470, win 58, options [nop,nop,TS val 4294714979 ecr 4294714949], length 164
11:36:06.386073 IP vagrant-ubuntu-trusty-64.8882 > 10.0.0.2.43638: Flags [.], ack 3291467901, win 279, options [nop,nop,TS val 4294714989 ecr 4294714979], length 0
11:36:06.407198 IP 10.0.0.2.43638 > vagrant-ubuntu-trusty-64.8882: Flags [P.], seq 3291467901:3291468065, ack 3084033470, win 58, options [nop,nop,TS val 4294715000 ecr 4294714989], length 164
11:36:06.407236 IP vagrant-ubuntu-trusty-64.8882 > 10.0.0.2.43638: Flags [.], ack 3291468065, win 281, options [nop,nop,TS val 4294715011 ecr 4294715000], length 0
11:36:06.427110 IP 10.0.0.2.43638 > vagrant-ubuntu-trusty-64.8882: Flags [P.], seq 3291468065:3291468229, ack 3084033470, win 58, options [nop,nop,TS val 4294715020 ecr 4294714989], length 164
11:36:06.427143 IP vagrant-ubuntu-trusty-64.8882 > 10.0.0.2.43638: Flags [.], ack 3291468229, win 283, options [nop,nop,TS val 4294715030 ecr 4294715020], length 0
11:36:06.446494 IP 10.0.0.2.43638 > vagrant-ubuntu-trusty-64.8882: Flags [P.], seq 3291468229:3291468393, ack 3084033470, win 58, options [nop,nop,TS val 4294715040 ecr 4294715011], length 164
11:36:06.446528 IP vagrant-ubuntu-trusty-64.8882 > 10.0.0.2.43638: Flags [.], ack 3291468393, win 285, options [nop,nop,TS val 4294715050 ecr 4294715040], length 0
11:36:06.466813 IP 10.0.0.2.43638 > vagrant-ubuntu-trusty-64.8882: Flags [P.], seq 3291468393:3291468557, ack 3084033470, win 58, options [nop,nop,TS val 4294715060 ecr 4294715050], length 164
11:36:06.466856 IP vagrant-ubuntu-trusty-64.8882 > 10.0.0.2.43638: Flags [.], ack 3291468557, win 287, options [nop,nop,TS val 4294715070 ecr 4294715060], length 0
11:36:06.486621 IP 10.0.0.2.43638 > vagrant-ubuntu-trusty-64.8882: Flags [P.], seq 3291468557:3291468721, ack 3084033470, win 58, options [nop,nop,TS val 4294715080 ecr 4294715050], length 164
11:36:06.486638 IP vagrant-ubuntu-trusty-64.8882 > 10.0.0.2.43638: Flags [.], ack 3291468721, win 289, options [nop,nop,TS val 4294715090 ecr 4294715080], length 0
11:36:06.506576 IP 10.0.0.2.43638 > vagrant-ubuntu-trusty-64.8882: Flags [P.], seq 3291468721:3291468885, ack 3084033470, win 58, options [nop,nop,TS val 4294715099 ecr 4294715070], length 164
11:36:06.506604 IP vagrant-ubuntu-trusty-64.8882 > 10.0.0.2.43638: Flags [.], ack 3291468885, win 292, options [nop,nop,TS val 4294715110 ecr 4294715099], length 0
