11:52:34.987484 IP vagrant-ubuntu-trusty-64.54912 > 10.0.0.1.8882: Flags [P.], seq 1869047534:1869047698, ack 3256007303, win 58, options [nop,nop,TS val 4294713576 ecr 4294713546], length 164
11:52:34.988702 IP 10.0.0.1.8882 > vagrant-ubuntu-trusty-64.54912: Flags [.], ack 1869047534, win 63, options [nop,nop,TS val 4294713566 ecr 4294713556], length 0
11:52:35.007963 IP vagrant-ubuntu-trusty-64.54912 > 10.0.0.1.8882: Flags [P.], seq 1869047698:1869047862, ack 3256007303, win 58, options [nop,nop,TS val 4294713596 ecr 4294713566], length 164
11:52:35.008437 IP 10.0.0.1.8882 > vagrant-ubuntu-trusty-64.54912: Flags [.], ack 1869047698, win 65, options [nop,nop,TS val 4294713586 ecr 4294713576], length 0
11:52:35.028056 IP vagrant-ubuntu-trusty-64.54912 > 10.0.0.1.8882: Flags [P.], seq 1869047862:1869048026, ack 3256007303, win 58, options [nop,nop,TS val 4294713616 ecr 4294713586], length 164
11:52:35.028445 IP 10.0.0.1.8882 > vagrant-ubuntu-trusty-64.54912: Flags [.], ack 1869047862, win 68, options [nop,nop,TS val 4294713607 ecr 4294713596], length 0
11:52:35.047358 IP vagrant-ubuntu-trusty-64.54912 > 10.0.0.1.8882: Flags [P.], seq 1869048026:1869048190, ack 3256007303, win 58, options [nop,nop,TS val 4294713636 ecr 4294713607], length 164
11:52:35.049823 IP 10.0.0.1.8882 > vagrant-ubuntu-trusty-64.54912: Flags [.], ack 1869048026, win 70, options [nop,nop,TS val 4294713627 ecr 4294713616], length 0
11:52:35.067923 IP vagrant-ubuntu-trusty-64.54912 > 10.0.0.1.8882: Flags [P.], seq 1869048190:1869048354, ack 3256007303, win 58, options [nop,nop,TS val 4294713656 ecr 4294713627], length 164
11:52:35.068507 IP 10.0.0.1.8882 > vagrant-ubuntu-trusty-64.54912: Flags [.], ack 1869048190, win 72, options [nop,nop,TS val 4294713646 ecr 4294713636], length 0
11:52:35.087287 IP vagrant-ubuntu-trusty-64.54912 > 10.0.0.1.8882: Flags [P.], seq 1869048354:1869048518, ack 3256007303, win 58, options [nop,nop,TS val 4294713676 ecr 4294713646], length 164
11:52:35.088978 IP 10.0.0.1.8882 > vagrant-ubuntu-trusty-64.54912: Flags [.], ack 1869048354, win 74, options [nop,nop,TS val 4294713667 ecr 4294713656], length 0
11:52:35.107284 IP vagrant-ubuntu-trusty-64.54912 > 10.0.0.1.8882: Flags [P.], seq 1869048518:1869048682, ack 3256007303, win 58, options [nop,nop,TS val 4294713696 ecr 4294713667], length 164
11:52:35.107435 IP 10.0.0.1.8882 > vagrant-ubuntu-trusty-64.54912: Flags [.], ack 1869048518, win 76, options [nop,nop,TS val 4294713686 ecr 4294713676], length 0
11:52:35.127599 IP vagrant-ubuntu-trusty-64.54912 > 10.0.0.1.8882: Flags [P.], seq 1869048682:1869048846, ack 3256007303, win 58, options [nop,nop,TS val 4294713716 ecr 4294713686], length 164
11:52:35.128970 IP 10.0.0.1.8882 > vagrant-ubuntu-trusty-64.54912: Flags [.], ack 1869048682, win 78, options [nop,nop,TS val 4294713707 ecr 4294713696], length 0
11:52:35.147358 IP vagrant-ubuntu-trusty-64.54912 > 10.0.0.1.8882: Flags [P.], seq 1869048846:1869049010, ack 3256007303, win 58, options [nop,nop,TS val 4294713736 ecr 4294713707], length 164
11:52:35.147991 IP 10.0.0.1.8882 > vagrant-ubuntu-trusty-64.54912: Flags [.], ack 1869048846, win 80, options [nop,nop,TS val 4294713726 ecr 4294713716], length 0
11:52:35.167255 IP vagrant-ubuntu-trusty-64.54912 > 10.0.0.1.8882: Flags [P.], seq 1869049010:1869049174, ack 3256007303, win 58, options [nop,nop,TS val 4294713756 ecr 4294713726], length 164
11:52:35.168009 IP 10.0.0.1.8882 > vagrant-ubuntu-trusty-64.54912: Flags [.], ack 1869049010, win 82, options [nop,nop,TS val 4294713746 ecr 4294713736], length 0
11:52:35.187209 IP vagrant-ubuntu-trusty-64.54912 > 10.0.0.1.8882: Flags [P.], seq 1869049174:1869049338, ack 3256007303, win 58, options [nop,nop,TS val 4294713776 ecr 4294713746], length 164
11:52:35.191862 IP 10.0.0.1.8882 > vagrant-ubuntu-trusty-64.54912: Flags [.], ack 1869049174, win 84, options [nop,nop,TS val 4294713770 ecr 4294713756], length 0
11:52:35.207241 IP vagrant-ubuntu-trusty-64.54912 > 10.0.0.1.8882: Flags [P.], seq 1869049338:1869049502, ack 3256007303, win 58, options [nop,nop,TS val 4294713796 ecr 4294713770], length 164
11:52:35.223267 IP 10.0.0.1.8882 > vagrant-ubuntu-trusty-64.54912: Flags [.], ack 1869049338, win 86, options [nop,nop,TS val 4294713802 ecr 4294713776], length 0
11:52:35.227216 IP vagrant-ubuntu-trusty-64.54912 > 10.0.0.1.8882: Flags [P.], seq 1869049502:1869049666, ack 3256007303, win 58, options [nop,nop,TS val 4294713816 ecr 4294713802], length 164
11:52:35.247973 IP vagrant-ubuntu-trusty-64.54912 > 10.0.0.1.8882: Flags [P.], seq 1869049666:1869049830, ack 3256007303, win 58, options [nop,nop,TS val 4294713836 ecr 4294713802], length 164
11:52:35.248434 IP 10.0.0.1.8882 > vagrant-ubuntu-trusty-64.54912: Flags [.], ack 1869049502, win 88, options [nop,nop,TS val 4294713826 ecr 4294713796], length 0
11:52:35.267278 IP vagrant-ubuntu-trusty-64.54912 > 10.0.0.1.8882: Flags [P.], seq 1869049830:1869049994, ack 3256007303, win 58, options [nop,nop,TS val 4294713856 ecr 4294713826], length 164
11:52:35.287256 IP vagrant-ubuntu-trusty-64.54912 > 10.0.0.1.8882: Flags [P.], seq 1869049994:1869050158, ack 3256007303, win 58, options [nop,nop,TS val 4294713876 ecr 4294713826], length 164
11:52:35.300417 IP 10.0.0.1.8882 > vagrant-ubuntu-trusty-64.54912: Flags [.], ack 1869049502, win 91, options [nop,nop,TS val 4294713878 ecr 4294713796,nop,nop,sack 1 {1869049666:1869049830}], length 0
11:52:35.307301 IP vagrant-ubuntu-trusty-64.54912 > 10.0.0.1.8882: Flags [P.], seq 1869050158:1869050322, ack 3256007303, win 58, options [nop,nop,TS val 4294713896 ecr 4294713878], length 164
11:52:35.319602 IP 10.0.0.1.8882 > vagrant-ubuntu-trusty-64.54912: Flags [.], ack 1869049502, win 93, options [nop,nop,TS val 4294713898 ecr 4294713796,nop,nop,sack 2 {1869049994:1869050158}{1869049666:1869049830}], length 0
11:52:35.319742 IP vagrant-ubuntu-trusty-64.54912 > 10.0.0.1.8882: Flags [P.], seq 1869049502:1869049666, ack 3256007303, win 58, options [nop,nop,TS val 4294713907 ecr 4294713898], length 164
11:52:35.319808 IP vagrant-ubuntu-trusty-64.54912 > 10.0.0.1.8882: Flags [P.], seq 1869049830:1869049994, ack 3256007303, win 58, options [nop,nop,TS val 4294713907 ecr 4294713898], length 164
11:52:35.354391 IP 10.0.0.1.8882 > vagrant-ubuntu-trusty-64.54912: Flags [.], ack 1869049830, win 95, options [nop,nop,TS val 4294713933 ecr 4294713907,nop,nop,sack 1 {1869049994:1869050158}], length 0
11:52:35.354494 IP vagrant-ubuntu-trusty-64.54912 > 10.0.0.1.8882: Flags [P.], seq 1869050322:1869050650, ack 3256007303, win 58, options [nop,nop,TS val 4294713943 ecr 4294713933], length 328
11:52:35.368774 IP vagrant-ubuntu-trusty-64.54912 > 10.0.0.1.8882: Flags [P.], seq 1869050650:1869050814, ack 3256007303, win 58, options [nop,nop,TS val 4294713957 ecr 4294713933], length 164
11:52:35.383499 IP 10.0.0.1.8882 > vagrant-ubuntu-trusty-64.54912: Flags [.], ack 1869049830, win 97, options [nop,nop,TS val 4294713962 ecr 4294713907,nop,nop,sack 2 {1869050322:1869050650}{1869049994:1869050158}], length 0
11:52:35.383548 IP vagrant-ubuntu-trusty-64.54912 > 10.0.0.1.8882: Flags [P.], seq 1869049830:1869049994, ack 3256007303, win 58, options [nop,nop,TS val 4294713972 ecr 4294713962], length 164
11:52:35.383584 IP vagrant-ubuntu-trusty-64.54912 > 10.0.0.1.8882: Flags [P.], seq 1869050158:1869050322, ack 3256007303, win 58, options [nop,nop,TS val 4294713972 ecr 4294713962], length 164
11:52:35.398705 IP 10.0.0.1.8882 > vagrant-ubuntu-trusty-64.54912: Flags [.], ack 1869049830, win 99, options [nop,nop,TS val 4294713977 ecr 4294713907,nop,nop,sack 2 {1869050322:1869050814}{1869049994:1869050158}], length 0
11:52:35.398802 IP vagrant-ubuntu-trusty-64.54912 > 10.0.0.1.8882: Flags [P.], seq 1869050814:1869050978, ack 3256007303, win 58, options [nop,nop,TS val 4294713987 ecr 4294713977], length 164
11:52:35.407416 IP vagrant-ubuntu-trusty-64.54912 > 10.0.0.1.8882: Flags [P.], seq 1869050978:1869051142, ack 3256007303, win 58, options [nop,nop,TS val 4294713996 ecr 4294713977], length 164
11:52:35.432669 IP 10.0.0.1.8882 > vagrant-ubuntu-trusty-64.54912: Flags [.], ack 1869049830, win 101, options [nop,nop,TS val 4294714011 ecr 4294713907,nop,nop,sack 2 {1869050322:1869050978}{1869049994:1869050158}], length 0
11:52:35.432724 IP vagrant-ubuntu-trusty-64.54912 > 10.0.0.1.8882: Flags [P.], seq 1869049830:1869049994, ack 3256007303, win 58, options [nop,nop,TS val 4294714021 ecr 4294714011], length 164
11:52:35.432784 IP vagrant-ubuntu-trusty-64.54912 > 10.0.0.1.8882: Flags [P.], seq 1869050158:1869050322, ack 3256007303, win 58, options [nop,nop,TS val 4294714021 ecr 4294714011], length 164
11:52:35.442012 IP 10.0.0.1.8882 > vagrant-ubuntu-trusty-64.54912: Flags [.], ack 1869049830, win 103, options [nop,nop,TS val 4294714020 ecr 4294713907,nop,nop,sack 2 {1869050322:1869051142}{1869049994:1869050158}], length 0
11:52:35.442111 IP vagrant-ubuntu-trusty-64.54912 > 10.0.0.1.8882: Flags [P.], seq 1869051142:1869051306, ack 3256007303, win 58, options [nop,nop,TS val 4294714030 ecr 4294714020], length 164
11:52:35.447357 IP vagrant-ubuntu-trusty-64.54912 > 10.0.0.1.8882: Flags [P.], seq 1869051306:1869051470, ack 3256007303, win 58, options [nop,nop,TS val 4294714036 ecr 4294714020], length 164
11:52:35.463515 IP 10.0.0.1.8882 > vagrant-ubuntu-trusty-64.54912: Flags [.], ack 1869050158, win 105, options [nop,nop,TS val 4294714041 ecr 4294714021,nop,nop,sack 1 {1869050322:1869051142}], length 0
11:52:35.463629 IP 10.0.0.1.8882 > vagrant-ubuntu-trusty-64.54912: Flags [.], ack 1869051142, win 107, options [nop,nop,TS val 4294714042 ecr 4294714021], length 0
11:52:35.467168 IP vagrant-ubuntu-trusty-64.54912 > 10.0.0.1.8882: Flags [P.], seq 1869051470:1869051634, ack 3256007303, win 58, options [nop,nop,TS val 4294714056 ecr 4294714042], length 164
11:52:35.480516 IP 10.0.0.1.8882 > vagrant-ubuntu-trusty-64.54912: Flags [.], ack 1869051142, win 109, options [nop,nop,TS val 4294714057 ecr 4294714021,nop,nop,sack 1 {1869051306:1869051470}], length 0
11:52:35.487188 IP vagrant-ubuntu-trusty-64.54912 > 10.0.0.1.8882: Flags [P.], seq 1869051142:1869051306, ack 3256007303, win 58, options [nop,nop,TS val 4294714076 ecr 4294714057], length 164
11:52:35.487467 IP vagrant-ubuntu-trusty-64.54912 > 10.0.0.1.8882: Flags [P.], seq 1869051634:1869051798, ack 3256007303, win 58, options [nop,nop,TS val 4294714076 ecr 4294714057], length 164
11:52:35.501673 IP 10.0.0.1.8882 > vagrant-ubuntu-trusty-64.54912: Flags [.], ack 1869051142, win 111, options [nop,nop,TS val 4294714079 ecr 4294714021,nop,nop,sack 1 {1869051306:1869051634}], length 0
11:52:35.507342 IP vagrant-ubuntu-trusty-64.54912 > 10.0.0.1.8882: Flags [P.], seq 1869051798:1869051962, ack 3256007303, win 58, options [nop,nop,TS val 4294714096 ecr 4294714079], length 164
11:52:35.517423 IP 10.0.0.1.8882 > vagrant-ubuntu-trusty-64.54912: Flags [.], ack 1869051634, win 114, options [nop,nop,TS val 4294714096 ecr 4294714076], length 0
11:52:35.527276 IP vagrant-ubuntu-trusty-64.54912 > 10.0.0.1.8882: Flags [P.], seq 1869051962:1869052126, ack 3256007303, win 58, options [nop,nop,TS val 4294714116 ecr 4294714096], length 164
11:52:35.528594 IP 10.0.0.1.8882 > vagrant-ubuntu-trusty-64.54912: Flags [.], ack 1869051634, win 116, options [nop,nop,TS val 4294714106 ecr 4294714076,nop,nop,sack 1 {1869051798:1869051962}], length 0
11:52:35.536410 IP vagrant-ubuntu-trusty-64.54912 > 10.0.0.1.8882: Flags [P.], seq 1869051634:1869051798, ack 3256007303, win 58, options [nop,nop,TS val 4294714125 ecr 4294714106], length 164
11:52:35.547239 IP vagrant-ubuntu-trusty-64.54912 > 10.0.0.1.8882: Flags [P.], seq 1869052126:1869052290, ack 3256007303, win 58, options [nop,nop,TS val 4294714136 ecr 4294714106], length 164
11:52:35.568657 IP vagrant-ubuntu-trusty-64.54912 > 10.0.0.1.8882: Flags [P.], seq 1869052290:1869052454, ack 3256007303, win 58, options [nop,nop,TS val 4294714157 ecr 4294714106], length 164
11:52:35.570690 IP 10.0.0.1.8882 > vagrant-ubuntu-trusty-64.54912: Flags [.], ack 1869051962, win 118, options [nop,nop,TS val 4294714148 ecr 4294714125], length 0
11:52:35.600408 IP 10.0.0.1.8882 > vagrant-ubuntu-trusty-64.54912: Flags [.], ack 1869051962, win 120, options [nop,nop,TS val 4294714179 ecr 4294714125,nop,nop,sack 1 {1869052290:1869052454}], length 0
11:52:35.801497 IP vagrant-ubuntu-trusty-64.54912 > 10.0.0.1.8882: Flags [P.], seq 1869051962:1869052290, ack 3256007303, win 58, options [nop,nop,TS val 4294714390 ecr 4294714179], length 328
11:52:35.832537 IP 10.0.0.1.8882 > vagrant-ubuntu-trusty-64.54912: Flags [.], ack 1869052454, win 122, options [nop,nop,TS val 4294714411 ecr 4294714390], length 0
11:52:35.832835 IP vagrant-ubuntu-trusty-64.54912 > 10.0.0.1.8882: Flags [P.], seq 1869052454:1869054586, ack 3256007303, win 58, options [nop,nop,TS val 4294714420 ecr 4294714411], length 2132
11:52:35.847231 IP vagrant-ubuntu-trusty-64.54912 > 10.0.0.1.8882: Flags [P.], seq 1869054586:1869054750, ack 3256007303, win 58, options [nop,nop,TS val 4294714436 ecr 4294714411], length 164
11:52:35.863561 IP 10.0.0.1.8882 > vagrant-ubuntu-trusty-64.54912: Flags [.], ack 1869054586, win 130, options [nop,nop,TS val 4294714441 ecr 4294714420], length 0
11:52:35.867268 IP vagrant-ubuntu-trusty-64.54912 > 10.0.0.1.8882: Flags [P.], seq 1869054750:1869054914, ack 3256007303, win 58, options [nop,nop,TS val 4294714456 ecr 4294714441], length 164
11:52:35.880627 IP 10.0.0.1.8882 > vagrant-ubuntu-trusty-64.54912: Flags [.], ack 1869054750, win 136, options [nop,nop,TS val 4294714459 ecr 4294714436], length 0
11:52:35.887296 IP vagrant-ubuntu-trusty-64.54912 > 10.0.0.1.8882: Flags [P.], seq 1869054914:1869055078, ack 3256007303, win 58, options [nop,nop,TS val 4294714476 ecr 4294714459], length 164
11:52:35.899610 IP 10.0.0.1.8882 > vagrant-ubuntu-trusty-64.54912: Flags [.], ack 1869054914, win 142, options [nop,nop,TS val 4294714477 ecr 4294714456], length 0
11:52:35.907741 IP vagrant-ubuntu-trusty-64.54912 > 10.0.0.1.8882: Flags [P.], seq 1869055078:1869055242, ack 3256007303, win 58, options [nop,nop,TS val 4294714496 ecr 4294714477], length 164
11:52:35.920533 IP 10.0.0.1.8882 > vagrant-ubuntu-trusty-64.54912: Flags [.], ack 1869055078, win 147, options [nop,nop,TS val 4294714499 ecr 4294714476], length 0
11:52:35.927236 IP vagrant-ubuntu-trusty-64.54912 > 10.0.0.1.8882: Flags [P.], seq 1869055242:1869055406, ack 3256007303, win 58, options [nop,nop,TS val 4294714516 ecr 4294714499], length 164
11:52:35.938903 IP 10.0.0.1.8882 > vagrant-ubuntu-trusty-64.54912: Flags [.], ack 1869055242, win 153, options [nop,nop,TS val 4294714517 ecr 4294714496], length 0
11:52:35.947527 IP vagrant-ubuntu-trusty-64.54912 > 10.0.0.1.8882: Flags [P.], seq 1869055406:1869055570, ack 3256007303, win 58, options [nop,nop,TS val 4294714536 ecr 4294714517], length 164
11:52:35.957268 IP 10.0.0.1.8882 > vagrant-ubuntu-trusty-64.54912: Flags [.], ack 1869055406, win 159, options [nop,nop,TS val 4294714536 ecr 4294714516], length 0
11:52:35.967261 IP vagrant-ubuntu-trusty-64.54912 > 10.0.0.1.8882: Flags [P.], seq 1869055570:1869055734, ack 3256007303, win 58, options [nop,nop,TS val 4294714556 ecr 4294714536], length 164
11:52:35.978884 IP 10.0.0.1.8882 > vagrant-ubuntu-trusty-64.54912: Flags [.], ack 1869055570, win 164, options [nop,nop,TS val 4294714557 ecr 4294714536], length 0
11:52:35.987664 IP vagrant-ubuntu-trusty-64.54912 > 10.0.0.1.8882: Flags [P.], seq 1869055734:1869055898, ack 3256007303, win 58, options [nop,nop,TS val 4294714576 ecr 4294714557], length 164
11:52:36.001676 IP 10.0.0.1.8882 > vagrant-ubuntu-trusty-64.54912: Flags [.], ack 1869055734, win 170, options [nop,nop,TS val 4294714578 ecr 4294714556], length 0
11:52:36.007242 IP vagrant-ubuntu-trusty-64.54912 > 10.0.0.1.8882: Flags [P.], seq 1869055898:1869056062, ack 3256007303, win 58, options [nop,nop,TS val 4294714596 ecr 4294714578], length 164
11:52:36.018719 IP 10.0.0.1.8882 > vagrant-ubuntu-trusty-64.54912: Flags [.], ack 1869055898, win 176, options [nop,nop,TS val 4294714597 ecr 4294714576], length 0
11:52:36.027226 IP vagrant-ubuntu-trusty-64.54912 > 10.0.0.1.8882: Flags [P.], seq 1869056062:1869056226, ack 3256007303, win 58, options [nop,nop,TS val 4294714616 ecr 4294714597], length 164
11:52:36.043701 IP 10.0.0.1.8882 > vagrant-ubuntu-trusty-64.54912: Flags [.], ack 1869056062, win 181, options [nop,nop,TS val 4294714621 ecr 4294714596], length 0
11:52:36.047249 IP vagrant-ubuntu-trusty-64.54912 > 10.0.0.1.8882: Flags [P.], seq 1869056226:1869056390, ack 3256007303, win 58, options [nop,nop,TS val 4294714636 ecr 4294714621], length 164
11:52:36.061734 IP 10.0.0.1.8882 > vagrant-ubuntu-trusty-64.54912: Flags [.], ack 1869056226, win 187, options [nop,nop,TS val 4294714640 ecr 4294714616], length 0
11:52:36.067583 IP vagrant-ubuntu-trusty-64.54912 > 10.0.0.1.8882: Flags [P.], seq 1869056390:1869056554, ack 3256007303, win 58, options [nop,nop,TS val 4294714656 ecr 4294714640], length 164
11:52:36.083656 IP 10.0.0.1.8882 > vagrant-ubuntu-trusty-64.54912: Flags [.], ack 1869056390, win 193, options [nop,nop,TS val 4294714661 ecr 4294714636], length 0
11:52:36.087286 IP vagrant-ubuntu-trusty-64.54912 > 10.0.0.1.8882: Flags [P.], seq 1869056554:1869056718, ack 3256007303, win 58, options [nop,nop,TS val 4294714676 ecr 4294714661], length 164
11:52:36.101839 IP 10.0.0.1.8882 > vagrant-ubuntu-trusty-64.54912: Flags [.], ack 1869056554, win 198, options [nop,nop,TS val 4294714680 ecr 4294714656], length 0
11:52:36.107875 IP vagrant-ubuntu-trusty-64.54912 > 10.0.0.1.8882: Flags [P.], seq 1869056718:1869056882, ack 3256007303, win 58, options [nop,nop,TS val 4294714696 ecr 4294714680], length 164
11:52:36.122755 IP 10.0.0.1.8882 > vagrant-ubuntu-trusty-64.54912: Flags [.], ack 1869056718, win 204, options [nop,nop,TS val 4294714701 ecr 4294714676], length 0
11:52:36.127247 IP vagrant-ubuntu-trusty-64.54912 > 10.0.0.1.8882: Flags [P.], seq 1869056882:1869057046, ack 3256007303, win 58, options [nop,nop,TS val 4294714716 ecr 4294714701], length 164
11:52:36.144778 IP 10.0.0.1.8882 > vagrant-ubuntu-trusty-64.54912: Flags [.], ack 1869056882, win 209, options [nop,nop,TS val 4294714722 ecr 4294714696], length 0
11:52:36.147839 IP vagrant-ubuntu-trusty-64.54912 > 10.0.0.1.8882: Flags [P.], seq 1869057046:1869057210, ack 3256007303, win 58, options [nop,nop,TS val 4294714736 ecr 4294714722], length 164
11:52:36.163002 IP 10.0.0.1.8882 > vagrant-ubuntu-trusty-64.54912: Flags [.], ack 1869057046, win 215, options [nop,nop,TS val 4294714741 ecr 4294714716], length 0
11:52:36.167628 IP vagrant-ubuntu-trusty-64.54912 > 10.0.0.1.8882: Flags [P.], seq 1869057210:1869057374, ack 3256007303, win 58, options [nop,nop,TS val 4294714756 ecr 4294714741], length 164
11:52:36.184749 IP 10.0.0.1.8882 > vagrant-ubuntu-trusty-64.54912: Flags [.], ack 1869057210, win 221, options [nop,nop,TS val 4294714762 ecr 4294714736], length 0
11:52:36.187216 IP vagrant-ubuntu-trusty-64.54912 > 10.0.0.1.8882: Flags [P.], seq 1869057374:1869057538, ack 3256007303, win 58, options [nop,nop,TS val 4294714776 ecr 4294714762], length 164
11:52:36.203583 IP 10.0.0.1.8882 > vagrant-ubuntu-trusty-64.54912: Flags [.], ack 1869057374, win 226, options [nop,nop,TS val 4294714781 ecr 4294714756], length 0
11:52:36.207871 IP vagrant-ubuntu-trusty-64.54912 > 10.0.0.1.8882: Flags [P.], seq 1869057538:1869057702, ack 3256007303, win 58, options [nop,nop,TS val 4294714796 ecr 4294714781], length 164
11:52:36.220822 IP 10.0.0.1.8882 > vagrant-ubuntu-trusty-64.54912: Flags [.], ack 1869057538, win 232, options [nop,nop,TS val 4294714799 ecr 4294714776], length 0
11:52:36.227158 IP vagrant-ubuntu-trusty-64.54912 > 10.0.0.1.8882: Flags [P.], seq 1869057702:1869057866, ack 3256007303, win 58, options [nop,nop,TS val 4294714816 ecr 4294714799], length 164
11:52:36.242962 IP 10.0.0.1.8882 > vagrant-ubuntu-trusty-64.54912: Flags [.], ack 1869057702, win 238, options [nop,nop,TS val 4294714820 ecr 4294714796], length 0
11:52:36.247786 IP vagrant-ubuntu-trusty-64.54912 > 10.0.0.1.8882: Flags [P.], seq 1869057866:1869058030, ack 3256007303, win 58, options [nop,nop,TS val 4294714836 ecr 4294714820], length 164
11:52:36.260688 IP 10.0.0.1.8882 > vagrant-ubuntu-trusty-64.54912: Flags [.], ack 1869057866, win 243, options [nop,nop,TS val 4294714839 ecr 4294714816], length 0
11:52:36.267227 IP vagrant-ubuntu-trusty-64.54912 > 10.0.0.1.8882: Flags [P.], seq 1869058030:1869058194, ack 3256007303, win 58, options [nop,nop,TS val 4294714856 ecr 4294714839], length 164
11:52:36.285996 IP 10.0.0.1.8882 > vagrant-ubuntu-trusty-64.54912: Flags [.], ack 1869058030, win 249, options [nop,nop,TS val 4294714864 ecr 4294714836], length 0
11:52:36.287253 IP vagrant-ubuntu-trusty-64.54912 > 10.0.0.1.8882: Flags [P.], seq 1869058194:1869058358, ack 3256007303, win 58, options [nop,nop,TS val 4294714876 ecr 4294714864], length 164
11:52:36.303926 IP 10.0.0.1.8882 > vagrant-ubuntu-trusty-64.54912: Flags [.], ack 1869058194, win 255, options [nop,nop,TS val 4294714882 ecr 4294714856], length 0
11:52:36.307471 IP vagrant-ubuntu-trusty-64.54912 > 10.0.0.1.8882: Flags [P.], seq 1869058358:1869058522, ack 3256007303, win 58, options [nop,nop,TS val 4294714896 ecr 4294714882], length 164
11:52:36.324883 IP 10.0.0.1.8882 > vagrant-ubuntu-trusty-64.54912: Flags [.], ack 1869058358, win 260, options [nop,nop,TS val 4294714903 ecr 4294714876], length 0
11:52:36.327603 IP vagrant-ubuntu-trusty-64.54912 > 10.0.0.1.8882: Flags [P.], seq 1869058522:1869058686, ack 3256007303, win 58, options [nop,nop,TS val 4294714916 ecr 4294714903], length 164
11:52:36.347522 IP 10.0.0.1.8882 > vagrant-ubuntu-trusty-64.54912: Flags [.], ack 1869058522, win 266, options [nop,nop,TS val 4294714925 ecr 4294714896], length 0
11:52:36.347696 IP vagrant-ubuntu-trusty-64.54912 > 10.0.0.1.8882: Flags [P.], seq 1869058686:1869058850, ack 3256007303, win 58, options [nop,nop,TS val 4294714936 ecr 4294714903], length 164
11:52:36.364697 IP 10.0.0.1.8882 > vagrant-ubuntu-trusty-64.54912: Flags [.], ack 1869058686, win 272, options [nop,nop,TS val 4294714943 ecr 4294714916], length 0
11:52:36.367217 IP vagrant-ubuntu-trusty-64.54912 > 10.0.0.1.8882: Flags [P.], seq 1869058850:1869059014, ack 3256007303, win 58, options [nop,nop,TS val 4294714956 ecr 4294714943], length 164
11:52:36.386898 IP 10.0.0.1.8882 > vagrant-ubuntu-trusty-64.54912: Flags [.], ack 1869058850, win 277, options [nop,nop,TS val 4294714964 ecr 4294714936], length 0
11:52:36.387244 IP vagrant-ubuntu-trusty-64.54912 > 10.0.0.1.8882: Flags [P.], seq 1869059014:1869059178, ack 3256007303, win 58, options [nop,nop,TS val 4294714976 ecr 4294714964], length 164
11:52:36.404488 IP 10.0.0.1.8882 > vagrant-ubuntu-trusty-64.54912: Flags [.], ack 1869059014, win 283, options [nop,nop,TS val 4294714983 ecr 4294714956], length 0
11:52:36.407928 IP vagrant-ubuntu-trusty-64.54912 > 10.0.0.1.8882: Flags [P.], seq 1869059178:1869059342, ack 3256007303, win 58, options [nop,nop,TS val 4294714996 ecr 4294714983], length 164
11:52:36.426062 IP 10.0.0.1.8882 > vagrant-ubuntu-trusty-64.54912: Flags [.], ack 1869059178, win 289, options [nop,nop,TS val 4294715004 ecr 4294714976], length 0
11:52:36.427798 IP vagrant-ubuntu-trusty-64.54912 > 10.0.0.1.8882: Flags [P.], seq 1869059342:1869059506, ack 3256007303, win 58, options [nop,nop,TS val 4294715016 ecr 4294715004], length 164
11:52:36.445659 IP 10.0.0.1.8882 > vagrant-ubuntu-trusty-64.54912: Flags [.], ack 1869059342, win 294, options [nop,nop,TS val 4294715023 ecr 4294714996], length 0
11:52:36.447981 IP vagrant-ubuntu-trusty-64.54912 > 10.0.0.1.8882: Flags [P.], seq 1869059506:1869059670, ack 3256007303, win 58, options [nop,nop,TS val 4294715036 ecr 4294715023], length 164
11:52:36.465998 IP 10.0.0.1.8882 > vagrant-ubuntu-trusty-64.54912: Flags [.], ack 1869059506, win 300, options [nop,nop,TS val 4294715044 ecr 4294715016], length 0
11:52:36.467306 IP vagrant-ubuntu-trusty-64.54912 > 10.0.0.1.8882: Flags [P.], seq 1869059670:1869059834, ack 3256007303, win 58, options [nop,nop,TS val 4294715056 ecr 4294715044], length 164
11:52:36.487208 IP vagrant-ubuntu-trusty-64.54912 > 10.0.0.1.8882: Flags [P.], seq 1869059834:1869059998, ack 3256007303, win 58, options [nop,nop,TS val 4294715076 ecr 4294715044], length 164
11:52:36.487853 IP 10.0.0.1.8882 > vagrant-ubuntu-trusty-64.54912: Flags [.], ack 1869059670, win 306, options [nop,nop,TS val 4294715066 ecr 4294715036], length 0
11:52:36.506890 IP 10.0.0.1.8882 > vagrant-ubuntu-trusty-64.54912: Flags [.], ack 1869059834, win 311, options [nop,nop,TS val 4294715085 ecr 4294715056], length 0
11:52:36.507347 IP vagrant-ubuntu-trusty-64.54912 > 10.0.0.1.8882: Flags [P.], seq 1869059998:1869060162, ack 3256007303, win 58, options [nop,nop,TS val 4294715096 ecr 4294715085], length 164
11:52:36.523996 IP 10.0.0.1.8882 > vagrant-ubuntu-trusty-64.54912: Flags [.], ack 1869059998, win 317, options [nop,nop,TS val 4294715102 ecr 4294715076], length 0
11:52:36.527215 IP vagrant-ubuntu-trusty-64.54912 > 10.0.0.1.8882: Flags [P.], seq 1869060162:1869060326, ack 3256007303, win 58, options [nop,nop,TS val 4294715116 ecr 4294715102], length 164
11:52:36.546793 IP 10.0.0.1.8882 > vagrant-ubuntu-trusty-64.54912: Flags [.], ack 1869060162, win 323, options [nop,nop,TS val 4294715124 ecr 4294715096], length 0
11:52:36.547265 IP vagrant-ubuntu-trusty-64.54912 > 10.0.0.1.8882: Flags [P.], seq 1869060326:1869060490, ack 3256007303, win 58, options [nop,nop,TS val 4294715136 ecr 4294715124], length 164
11:52:36.563918 IP 10.0.0.1.8882 > vagrant-ubuntu-trusty-64.54912: Flags [.], ack 1869060326, win 328, options [nop,nop,TS val 4294715142 ecr 4294715116], length 0
11:52:36.567207 IP vagrant-ubuntu-trusty-64.54912 > 10.0.0.1.8882: Flags [P.], seq 1869060490:1869060654, ack 3256007303, win 58, options [nop,nop,TS val 4294715156 ecr 4294715142], length 164
11:52:36.586886 IP 10.0.0.1.8882 > vagrant-ubuntu-trusty-64.54912: Flags [.], ack 1869060490, win 334, options [nop,nop,TS val 4294715165 ecr 4294715136], length 0
11:52:36.587767 IP vagrant-ubuntu-trusty-64.54912 > 10.0.0.1.8882: Flags [P.], seq 1869060654:1869060818, ack 3256007303, win 58, options [nop,nop,TS val 4294715176 ecr 4294715165], length 164
11:52:36.606956 IP 10.0.0.1.8882 > vagrant-ubuntu-trusty-64.54912: Flags [.], ack 1869060654, win 340, options [nop,nop,TS val 4294715185 ecr 4294715156], length 0
11:52:36.607210 IP vagrant-ubuntu-trusty-64.54912 > 10.0.0.1.8882: Flags [P.], seq 1869060818:1869060982, ack 3256007303, win 58, options [nop,nop,TS val 4294715196 ecr 4294715185], length 164
11:52:36.628025 IP vagrant-ubuntu-trusty-64.54912 > 10.0.0.1.8882: Flags [P.], seq 1869060982:1869061146, ack 3256007303, win 58, options [nop,nop,TS val 4294715216 ecr 4294715185], length 164
11:52:36.628860 IP 10.0.0.1.8882 > vagrant-ubuntu-trusty-64.54912: Flags [.], ack 1869060818, win 345, options [nop,nop,TS val 4294715207 ecr 4294715176], length 0
11:52:36.647327 IP vagrant-ubuntu-trusty-64.54912 > 10.0.0.1.8882: Flags [P.], seq 1869061146:1869061310, ack 3256007303, win 58, options [nop,nop,TS val 4294715236 ecr 4294715207], length 164
11:52:36.651104 IP 10.0.0.1.8882 > vagrant-ubuntu-trusty-64.54912: Flags [.], ack 1869060982, win 351, options [nop,nop,TS val 4294715228 ecr 4294715196], length 0
11:52:36.667894 IP vagrant-ubuntu-trusty-64.54912 > 10.0.0.1.8882: Flags [P.], seq 1869061310:1869061474, ack 3256007303, win 58, options [nop,nop,TS val 4294715256 ecr 4294715228], length 164
11:52:36.667992 IP 10.0.0.1.8882 > vagrant-ubuntu-trusty-64.54912: Flags [.], ack 1869061146, win 357, options [nop,nop,TS val 4294715246 ecr 4294715216], length 0
11:52:36.687316 IP vagrant-ubuntu-trusty-64.54912 > 10.0.0.1.8882: Flags [P.], seq 1869061474:1869061638, ack 3256007303, win 58, options [nop,nop,TS val 4294715276 ecr 4294715246], length 164
11:52:36.690980 IP 10.0.0.1.8882 > vagrant-ubuntu-trusty-64.54912: Flags [.], ack 1869061310, win 358, options [nop,nop,TS val 4294715268 ecr 4294715236], length 0
11:52:36.707982 IP vagrant-ubuntu-trusty-64.54912 > 10.0.0.1.8882: Flags [P.], seq 1869061638:1869061802, ack 3256007303, win 58, options [nop,nop,TS val 4294715296 ecr 4294715268], length 164
11:52:36.709446 IP 10.0.0.1.8882 > vagrant-ubuntu-trusty-64.54912: Flags [.], ack 1869061474, win 358, options [nop,nop,TS val 4294715286 ecr 4294715256], length 0
11:52:36.727710 IP vagrant-ubuntu-trusty-64.54912 > 10.0.0.1.8882: Flags [P.], seq 1869061802:1869061966, ack 3256007303, win 58, options [nop,nop,TS val 4294715316 ecr 4294715286], length 164
11:52:36.730192 IP 10.0.0.1.8882 > vagrant-ubuntu-trusty-64.54912: Flags [.], ack 1869061638, win 358, options [nop,nop,TS val 4294715308 ecr 4294715276], length 0
11:52:36.747240 IP vagrant-ubuntu-trusty-64.54912 > 10.0.0.1.8882: Flags [P.], seq 1869061966:1869062130, ack 3256007303, win 58, options [nop,nop,TS val 4294715336 ecr 4294715308], length 164
11:52:36.748937 IP 10.0.0.1.8882 > vagrant-ubuntu-trusty-64.54912: Flags [.], ack 1869061802, win 358, options [nop,nop,TS val 4294715326 ecr 4294715296], length 0
11:52:36.767740 IP vagrant-ubuntu-trusty-64.54912 > 10.0.0.1.8882: Flags [P.], seq 1869062130:1869062294, ack 3256007303, win 58, options [nop,nop,TS val 4294715356 ecr 4294715326], length 164
11:52:36.769154 IP 10.0.0.1.8882 > vagrant-ubuntu-trusty-64.54912: Flags [.], ack 1869061966, win 358, options [nop,nop,TS val 4294715347 ecr 4294715316], length 0
11:52:36.787697 IP vagrant-ubuntu-trusty-64.54912 > 10.0.0.1.8882: Flags [P.], seq 1869062294:1869062458, ack 3256007303, win 58, options [nop,nop,TS val 4294715376 ecr 4294715347], length 164
11:52:36.788118 IP 10.0.0.1.8882 > vagrant-ubuntu-trusty-64.54912: Flags [.], ack 1869062130, win 358, options [nop,nop,TS val 4294715366 ecr 4294715336], length 0
11:52:36.807709 IP vagrant-ubuntu-trusty-64.54912 > 10.0.0.1.8882: Flags [P.], seq 1869062458:1869062622, ack 3256007303, win 58, options [nop,nop,TS val 4294715396 ecr 4294715366], length 164
11:52:36.808870 IP 10.0.0.1.8882 > vagrant-ubuntu-trusty-64.54912: Flags [.], ack 1869062294, win 358, options [nop,nop,TS val 4294715387 ecr 4294715356], length 0
11:52:36.827272 IP vagrant-ubuntu-trusty-64.54912 > 10.0.0.1.8882: Flags [P.], seq 1869062622:1869062786, ack 3256007303, win 58, options [nop,nop,TS val 4294715416 ecr 4294715387], length 164
11:52:36.827999 IP 10.0.0.1.8882 > vagrant-ubuntu-trusty-64.54912: Flags [.], ack 1869062458, win 358, options [nop,nop,TS val 4294715406 ecr 4294715376], length 0
11:52:36.847693 IP vagrant-ubuntu-trusty-64.54912 > 10.0.0.1.8882: Flags [P.], seq 1869062786:1869062950, ack 3256007303, win 58, options [nop,nop,TS val 4294715436 ecr 4294715406], length 164
11:52:36.848670 IP 10.0.0.1.8882 > vagrant-ubuntu-trusty-64.54912: Flags [.], ack 1869062622, win 358, options [nop,nop,TS val 4294715427 ecr 4294715396], length 0
11:52:36.867185 IP 10.0.0.1.8882 > vagrant-ubuntu-trusty-64.54912: Flags [.], ack 1869062786, win 358, options [nop,nop,TS val 4294715445 ecr 4294715416], length 0
11:52:36.867202 IP vagrant-ubuntu-trusty-64.54912 > 10.0.0.1.8882: Flags [P.], seq 1869062950:1869063114, ack 3256007303, win 58, options [nop,nop,TS val 4294715456 ecr 4294715427], length 164
11:52:36.888387 IP vagrant-ubuntu-trusty-64.54912 > 10.0.0.1.8882: Flags [P.], seq 1869063114:1869063278, ack 3256007303, win 58, options [nop,nop,TS val 4294715477 ecr 4294715445], length 164
11:52:36.893102 IP 10.0.0.1.8882 > vagrant-ubuntu-trusty-64.54912: Flags [.], ack 1869062950, win 358, options [nop,nop,TS val 4294715470 ecr 4294715436], length 0
11:52:36.907354 IP vagrant-ubuntu-trusty-64.54912 > 10.0.0.1.8882: Flags [P.], seq 1869063278:1869063442, ack 3256007303, win 58, options [nop,nop,TS val 4294715496 ecr 4294715470], length 164
11:52:36.910007 IP 10.0.0.1.8882 > vagrant-ubuntu-trusty-64.54912: Flags [.], ack 1869063114, win 358, options [nop,nop,TS val 4294715488 ecr 4294715456], length 0
11:52:36.928346 IP vagrant-ubuntu-trusty-64.54912 > 10.0.0.1.8882: Flags [P.], seq 1869063442:1869063606, ack 3256007303, win 58, options [nop,nop,TS val 4294715517 ecr 4294715488], length 164
11:52:36.932164 IP 10.0.0.1.8882 > vagrant-ubuntu-trusty-64.54912: Flags [.], ack 1869063278, win 358, options [nop,nop,TS val 4294715510 ecr 4294715477], length 0
11:52:36.947745 IP vagrant-ubuntu-trusty-64.54912 > 10.0.0.1.8882: Flags [P.], seq 1869063606:1869063770, ack 3256007303, win 58, options [nop,nop,TS val 4294715536 ecr 4294715510], length 164
11:52:36.951134 IP 10.0.0.1.8882 > vagrant-ubuntu-trusty-64.54912: Flags [.], ack 1869063442, win 358, options [nop,nop,TS val 4294715528 ecr 4294715496], length 0
11:52:36.968408 IP vagrant-ubuntu-trusty-64.54912 > 10.0.0.1.8882: Flags [P.], seq 1869063770:1869063934, ack 3256007303, win 58, options [nop,nop,TS val 4294715557 ecr 4294715528], length 164
11:52:36.972119 IP 10.0.0.1.8882 > vagrant-ubuntu-trusty-64.54912: Flags [.], ack 1869063606, win 358, options [nop,nop,TS val 4294715550 ecr 4294715517], length 0
11:52:36.987232 IP vagrant-ubuntu-trusty-64.54912 > 10.0.0.1.8882: Flags [P.], seq 1869063934:1869064098, ack 3256007303, win 58, options [nop,nop,TS val 4294715576 ecr 4294715550], length 164
11:52:36.993209 IP 10.0.0.1.8882 > vagrant-ubuntu-trusty-64.54912: Flags [.], ack 1869063770, win 358, options [nop,nop,TS val 4294715571 ecr 4294715536], length 0
11:52:37.008407 IP vagrant-ubuntu-trusty-64.54912 > 10.0.0.1.8882: Flags [P.], seq 1869064098:1869064262, ack 3256007303, win 58, options [nop,nop,TS val 4294715597 ecr 4294715571], length 164
11:52:37.011024 IP 10.0.0.1.8882 > vagrant-ubuntu-trusty-64.54912: Flags [.], ack 1869063934, win 358, options [nop,nop,TS val 4294715589 ecr 4294715557], length 0
11:52:37.027782 IP vagrant-ubuntu-trusty-64.54912 > 10.0.0.1.8882: Flags [P.], seq 1869064262:1869064426, ack 3256007303, win 58, options [nop,nop,TS val 4294715616 ecr 4294715589], length 164
11:52:37.033227 IP 10.0.0.1.8882 > vagrant-ubuntu-trusty-64.54912: Flags [.], ack 1869064098, win 358, options [nop,nop,TS val 4294715612 ecr 4294715576], length 0
11:52:37.047410 IP vagrant-ubuntu-trusty-64.54912 > 10.0.0.1.8882: Flags [P.], seq 1869064426:1869064590, ack 3256007303, win 58, options [nop,nop,TS val 4294715636 ecr 4294715612], length 164
11:52:37.051143 IP 10.0.0.1.8882 > vagrant-ubuntu-trusty-64.54912: Flags [.], ack 1869064262, win 358, options [nop,nop,TS val 4294715629 ecr 4294715597], length 0
11:52:37.067651 IP vagrant-ubuntu-trusty-64.54912 > 10.0.0.1.8882: Flags [P.], seq 1869064590:1869064754, ack 3256007303, win 58, options [nop,nop,TS val 4294715656 ecr 4294715629], length 164
11:52:37.073999 IP 10.0.0.1.8882 > vagrant-ubuntu-trusty-64.54912: Flags [.], ack 1869064426, win 358, options [nop,nop,TS val 4294715652 ecr 4294715616], length 0
11:52:37.087268 IP vagrant-ubuntu-trusty-64.54912 > 10.0.0.1.8882: Flags [P.], seq 1869064754:1869064918, ack 3256007303, win 58, options [nop,nop,TS val 4294715676 ecr 4294715652], length 164
11:52:37.091991 IP 10.0.0.1.8882 > vagrant-ubuntu-trusty-64.54912: Flags [.], ack 1869064590, win 358, options [nop,nop,TS val 4294715670 ecr 4294715636], length 0
11:52:37.107261 IP vagrant-ubuntu-trusty-64.54912 > 10.0.0.1.8882: Flags [P.], seq 1869064918:1869065082, ack 3256007303, win 58, options [nop,nop,TS val 4294715696 ecr 4294715670], length 164
11:52:37.113279 IP 10.0.0.1.8882 > vagrant-ubuntu-trusty-64.54912: Flags [.], ack 1869064754, win 358, options [nop,nop,TS val 4294715691 ecr 4294715656], length 0
11:52:37.127243 IP vagrant-ubuntu-trusty-64.54912 > 10.0.0.1.8882: Flags [P.], seq 1869065082:1869065246, ack 3256007303, win 58, options [nop,nop,TS val 4294715716 ecr 4294715691], length 164
11:52:37.132045 IP 10.0.0.1.8882 > vagrant-ubuntu-trusty-64.54912: Flags [.], ack 1869064918, win 358, options [nop,nop,TS val 4294715710 ecr 4294715676], length 0
11:52:37.147273 IP vagrant-ubuntu-trusty-64.54912 > 10.0.0.1.8882: Flags [P.], seq 1869065246:1869065410, ack 3256007303, win 58, options [nop,nop,TS val 4294715736 ecr 4294715710], length 164
11:52:37.153044 IP 10.0.0.1.8882 > vagrant-ubuntu-trusty-64.54912: Flags [.], ack 1869065082, win 358, options [nop,nop,TS val 4294715731 ecr 4294715696], length 0
11:52:37.167251 IP vagrant-ubuntu-trusty-64.54912 > 10.0.0.1.8882: Flags [P.], seq 1869065410:1869065574, ack 3256007303, win 58, options [nop,nop,TS val 4294715756 ecr 4294715731], length 164
11:52:37.170410 IP 10.0.0.1.8882 > vagrant-ubuntu-trusty-64.54912: Flags [.], ack 1869065246, win 358, options [nop,nop,TS val 4294715749 ecr 4294715716], length 0
11:52:37.187676 IP vagrant-ubuntu-trusty-64.54912 > 10.0.0.1.8882: Flags [P.], seq 1869065574:1869065738, ack 3256007303, win 58, options [nop,nop,TS val 4294715776 ecr 4294715749], length 164
11:52:37.193127 IP 10.0.0.1.8882 > vagrant-ubuntu-trusty-64.54912: Flags [.], ack 1869065410, win 358, options [nop,nop,TS val 4294715771 ecr 4294715736], length 0
11:52:37.207256 IP vagrant-ubuntu-trusty-64.54912 > 10.0.0.1.8882: Flags [P.], seq 1869065738:1869065902, ack 3256007303, win 58, options [nop,nop,TS val 4294715796 ecr 4294715771], length 164
11:52:37.210224 IP 10.0.0.1.8882 > vagrant-ubuntu-trusty-64.54912: Flags [.], ack 1869065574, win 358, options [nop,nop,TS val 4294715789 ecr 4294715756], length 0
11:52:37.227255 IP vagrant-ubuntu-trusty-64.54912 > 10.0.0.1.8882: Flags [P.], seq 1869065902:1869066066, ack 3256007303, win 58, options [nop,nop,TS val 4294715816 ecr 4294715789], length 164
11:52:37.235405 IP 10.0.0.1.8882 > vagrant-ubuntu-trusty-64.54912: Flags [.], ack 1869065738, win 358, options [nop,nop,TS val 4294715814 ecr 4294715776], length 0
11:52:37.247233 IP vagrant-ubuntu-trusty-64.54912 > 10.0.0.1.8882: Flags [P.], seq 1869066066:1869066230, ack 3256007303, win 58, options [nop,nop,TS val 4294715836 ecr 4294715814], length 164
11:52:37.256246 IP 10.0.0.1.8882 > vagrant-ubuntu-trusty-64.54912: Flags [.], ack 1869065902, win 358, options [nop,nop,TS val 4294715835 ecr 4294715796], length 0
11:52:37.267254 IP vagrant-ubuntu-trusty-64.54912 > 10.0.0.1.8882: Flags [P.], seq 1869066230:1869066394, ack 3256007303, win 58, options [nop,nop,TS val 4294715856 ecr 4294715835], length 164
11:52:37.275351 IP 10.0.0.1.8882 > vagrant-ubuntu-trusty-64.54912: Flags [.], ack 1869066066, win 358, options [nop,nop,TS val 4294715854 ecr 4294715816], length 0
11:52:37.287404 IP vagrant-ubuntu-trusty-64.54912 > 10.0.0.1.8882: Flags [P.], seq 1869066394:1869066558, ack 3256007303, win 58, options [nop,nop,TS val 4294715876 ecr 4294715854], length 164
11:52:37.296525 IP 10.0.0.1.8882 > vagrant-ubuntu-trusty-64.54912: Flags [.], ack 1869066230, win 358, options [nop,nop,TS val 4294715875 ecr 4294715836], length 0
11:52:37.308170 IP vagrant-ubuntu-trusty-64.54912 > 10.0.0.1.8882: Flags [P.], seq 1869066558:1869066722, ack 3256007303, win 58, options [nop,nop,TS val 4294715897 ecr 4294715875], length 164
11:52:37.314346 IP 10.0.0.1.8882 > vagrant-ubuntu-trusty-64.54912: Flags [.], ack 1869066394, win 358, options [nop,nop,TS val 4294715893 ecr 4294715856], length 0
11:52:37.327978 IP vagrant-ubuntu-trusty-64.54912 > 10.0.0.1.8882: Flags [P.], seq 1869066722:1869066886, ack 3256007303, win 58, options [nop,nop,TS val 4294715916 ecr 4294715893], length 164
11:52:37.337278 IP 10.0.0.1.8882 > vagrant-ubuntu-trusty-64.54912: Flags [.], ack 1869066558, win 358, options [nop,nop,TS val 4294715915 ecr 4294715876], length 0
11:52:37.347419 IP vagrant-ubuntu-trusty-64.54912 > 10.0.0.1.8882: Flags [P.], seq 1869066886:1869067050, ack 3256007303, win 58, options [nop,nop,TS val 4294715936 ecr 4294715915], length 164
11:52:37.354241 IP 10.0.0.1.8882 > vagrant-ubuntu-trusty-64.54912: Flags [.], ack 1869066722, win 358, options [nop,nop,TS val 4294715933 ecr 4294715897], length 0
