09:05:33.335394 IP 10.0.0.2.60528 > 10.0.0.1.8882: Flags [P.], seq 1508842458:1508842622, ack 263878990, win 58, options [nop,nop,TS val 4294715660 ecr 4294715630], length 164
09:05:33.337006 IP 10.0.0.1.8882 > 10.0.0.2.60528: Flags [.], ack 1508842458, win 82, options [nop,nop,TS val 4294715651 ecr 4294715641], length 0
09:05:33.355480 IP 10.0.0.2.60528 > 10.0.0.1.8882: Flags [P.], seq 1508842622:1508842786, ack 263878990, win 58, options [nop,nop,TS val 4294715680 ecr 4294715651], length 164
09:05:33.355778 IP 10.0.0.1.8882 > 10.0.0.2.60528: Flags [.], ack 1508842622, win 84, options [nop,nop,TS val 4294715670 ecr 4294715660], length 0
09:05:33.376496 IP 10.0.0.1.8882 > 10.0.0.2.60528: Flags [.], ack 1508842786, win 86, options [nop,nop,TS val 4294715690 ecr 4294715680], length 0
09:05:33.376517 IP 10.0.0.2.60528 > 10.0.0.1.8882: Flags [P.], seq 1508842786:1508842950, ack 263878990, win 58, options [nop,nop,TS val 4294715701 ecr 4294715670], length 164
09:05:33.395623 IP 10.0.0.2.60528 > 10.0.0.1.8882: Flags [P.], seq 1508842950:1508843114, ack 263878990, win 58, options [nop,nop,TS val 4294715720 ecr 4294715690], length 164
09:05:33.396854 IP 10.0.0.1.8882 > 10.0.0.2.60528: Flags [.], ack 1508842950, win 88, options [nop,nop,TS val 4294715711 ecr 4294715701], length 0
09:05:33.415513 IP 10.0.0.2.60528 > 10.0.0.1.8882: Flags [P.], seq 1508843114:1508843278, ack 263878990, win 58, options [nop,nop,TS val 4294715740 ecr 4294715711], length 164
09:05:33.416031 IP 10.0.0.1.8882 > 10.0.0.2.60528: Flags [.], ack 1508843114, win 91, options [nop,nop,TS val 4294715730 ecr 4294715720], length 0
09:05:33.435694 IP 10.0.0.2.60528 > 10.0.0.1.8882: Flags [P.], seq 1508843278:1508843442, ack 263878990, win 58, options [nop,nop,TS val 4294715760 ecr 4294715730], length 164
09:05:33.435997 IP 10.0.0.1.8882 > 10.0.0.2.60528: Flags [.], ack 1508843278, win 93, options [nop,nop,TS val 4294715750 ecr 4294715740], length 0
09:05:33.455553 IP 10.0.0.2.60528 > 10.0.0.1.8882: Flags [P.], seq 1508843442:1508843606, ack 263878990, win 58, options [nop,nop,TS val 4294715780 ecr 4294715750], length 164
09:05:33.456374 IP 10.0.0.1.8882 > 10.0.0.2.60528: Flags [.], ack 1508843442, win 95, options [nop,nop,TS val 4294715770 ecr 4294715760], length 0
09:05:33.475735 IP 10.0.0.2.60528 > 10.0.0.1.8882: Flags [P.], seq 1508843606:1508843770, ack 263878990, win 58, options [nop,nop,TS val 4294715800 ecr 4294715770], length 164
09:05:33.476032 IP 10.0.0.1.8882 > 10.0.0.2.60528: Flags [.], ack 1508843606, win 97, options [nop,nop,TS val 4294715790 ecr 4294715780], length 0
09:05:33.495705 IP 10.0.0.2.60528 > 10.0.0.1.8882: Flags [P.], seq 1508843770:1508843934, ack 263878990, win 58, options [nop,nop,TS val 4294715820 ecr 4294715790], length 164
09:05:33.496020 IP 10.0.0.1.8882 > 10.0.0.2.60528: Flags [.], ack 1508843770, win 99, options [nop,nop,TS val 4294715810 ecr 4294715800], length 0
09:05:33.515694 IP 10.0.0.2.60528 > 10.0.0.1.8882: Flags [P.], seq 1508843934:1508844098, ack 263878990, win 58, options [nop,nop,TS val 4294715840 ecr 4294715810], length 164
09:05:33.516262 IP 10.0.0.1.8882 > 10.0.0.2.60528: Flags [.], ack 1508843934, win 101, options [nop,nop,TS val 4294715830 ecr 4294715820], length 0
09:05:33.535740 IP 10.0.0.2.60528 > 10.0.0.1.8882: Flags [P.], seq 1508844098:1508844262, ack 263878990, win 58, options [nop,nop,TS val 4294715860 ecr 4294715830], length 164
09:05:33.536058 IP 10.0.0.1.8882 > 10.0.0.2.60528: Flags [.], ack 1508844098, win 103, options [nop,nop,TS val 4294715850 ecr 4294715840], length 0
09:05:33.555736 IP 10.0.0.2.60528 > 10.0.0.1.8882: Flags [P.], seq 1508844262:1508844426, ack 263878990, win 58, options [nop,nop,TS val 4294715880 ecr 4294715850], length 164
09:05:33.556155 IP 10.0.0.1.8882 > 10.0.0.2.60528: Flags [.], ack 1508844262, win 105, options [nop,nop,TS val 4294715870 ecr 4294715860], length 0
09:05:33.575747 IP 10.0.0.2.60528 > 10.0.0.1.8882: Flags [P.], seq 1508844426:1508844590, ack 263878990, win 58, options [nop,nop,TS val 4294715900 ecr 4294715870], length 164
09:05:33.576109 IP 10.0.0.1.8882 > 10.0.0.2.60528: Flags [.], ack 1508844426, win 107, options [nop,nop,TS val 4294715890 ecr 4294715880], length 0
09:05:33.595705 IP 10.0.0.2.60528 > 10.0.0.1.8882: Flags [P.], seq 1508844590:1508844754, ack 263878990, win 58, options [nop,nop,TS val 4294715920 ecr 4294715890], length 164
09:05:33.596785 IP 10.0.0.1.8882 > 10.0.0.2.60528: Flags [.], ack 1508844590, win 109, options [nop,nop,TS val 4294715910 ecr 4294715900], length 0
09:05:33.615608 IP 10.0.0.2.60528 > 10.0.0.1.8882: Flags [P.], seq 1508844754:1508844918, ack 263878990, win 58, options [nop,nop,TS val 4294715940 ecr 4294715910], length 164
09:05:33.616209 IP 10.0.0.1.8882 > 10.0.0.2.60528: Flags [.], ack 1508844754, win 111, options [nop,nop,TS val 4294715930 ecr 4294715920], length 0
09:05:33.635565 IP 10.0.0.2.60528 > 10.0.0.1.8882: Flags [P.], seq 1508844918:1508845082, ack 263878990, win 58, options [nop,nop,TS val 4294715960 ecr 4294715930], length 164
09:05:33.636457 IP 10.0.0.1.8882 > 10.0.0.2.60528: Flags [.], ack 1508844918, win 114, options [nop,nop,TS val 4294715950 ecr 4294715940], length 0
09:05:33.655697 IP 10.0.0.2.60528 > 10.0.0.1.8882: Flags [P.], seq 1508845082:1508845246, ack 263878990, win 58, options [nop,nop,TS val 4294715980 ecr 4294715950], length 164
09:05:33.656198 IP 10.0.0.1.8882 > 10.0.0.2.60528: Flags [.], ack 1508845082, win 116, options [nop,nop,TS val 4294715970 ecr 4294715960], length 0
09:05:33.675437 IP 10.0.0.2.60528 > 10.0.0.1.8882: Flags [P.], seq 1508845246:1508845410, ack 263878990, win 58, options [nop,nop,TS val 4294716000 ecr 4294715970], length 164
09:05:33.676176 IP 10.0.0.1.8882 > 10.0.0.2.60528: Flags [.], ack 1508845246, win 118, options [nop,nop,TS val 4294715990 ecr 4294715980], length 0
09:05:33.695401 IP 10.0.0.2.60528 > 10.0.0.1.8882: Flags [P.], seq 1508845410:1508845574, ack 263878990, win 58, options [nop,nop,TS val 4294716020 ecr 4294715990], length 164
09:05:33.696781 IP 10.0.0.1.8882 > 10.0.0.2.60528: Flags [.], ack 1508845410, win 120, options [nop,nop,TS val 4294716011 ecr 4294716000], length 0
09:05:33.715683 IP 10.0.0.2.60528 > 10.0.0.1.8882: Flags [P.], seq 1508845574:1508845738, ack 263878990, win 58, options [nop,nop,TS val 4294716040 ecr 4294716011], length 164
09:05:33.716386 IP 10.0.0.1.8882 > 10.0.0.2.60528: Flags [.], ack 1508845574, win 122, options [nop,nop,TS val 4294716030 ecr 4294716020], length 0
09:05:33.735424 IP 10.0.0.2.60528 > 10.0.0.1.8882: Flags [P.], seq 1508845738:1508845902, ack 263878990, win 58, options [nop,nop,TS val 4294716060 ecr 4294716030], length 164
09:05:33.736053 IP 10.0.0.1.8882 > 10.0.0.2.60528: Flags [.], ack 1508845738, win 124, options [nop,nop,TS val 4294716050 ecr 4294716040], length 0
09:05:33.755882 IP 10.0.0.2.60528 > 10.0.0.1.8882: Flags [P.], seq 1508845902:1508846066, ack 263878990, win 58, options [nop,nop,TS val 4294716080 ecr 4294716050], length 164
09:05:33.756303 IP 10.0.0.1.8882 > 10.0.0.2.60528: Flags [.], ack 1508845902, win 126, options [nop,nop,TS val 4294716070 ecr 4294716060], length 0
09:05:33.775462 IP 10.0.0.2.60528 > 10.0.0.1.8882: Flags [P.], seq 1508846066:1508846230, ack 263878990, win 58, options [nop,nop,TS val 4294716100 ecr 4294716070], length 164
09:05:33.776337 IP 10.0.0.1.8882 > 10.0.0.2.60528: Flags [.], ack 1508846066, win 128, options [nop,nop,TS val 4294716090 ecr 4294716080], length 0
09:05:33.795397 IP 10.0.0.2.60528 > 10.0.0.1.8882: Flags [P.], seq 1508846230:1508846394, ack 263878990, win 58, options [nop,nop,TS val 4294716120 ecr 4294716090], length 164
09:05:33.796123 IP 10.0.0.1.8882 > 10.0.0.2.60528: Flags [.], ack 1508846230, win 130, options [nop,nop,TS val 4294716110 ecr 4294716100], length 0
09:05:33.815495 IP 10.0.0.2.60528 > 10.0.0.1.8882: Flags [P.], seq 1508846394:1508846558, ack 263878990, win 58, options [nop,nop,TS val 4294716140 ecr 4294716110], length 164
09:05:33.815812 IP 10.0.0.1.8882 > 10.0.0.2.60528: Flags [.], ack 1508846394, win 132, options [nop,nop,TS val 4294716130 ecr 4294716120], length 0
09:05:33.835639 IP 10.0.0.2.60528 > 10.0.0.1.8882: Flags [P.], seq 1508846558:1508846722, ack 263878990, win 58, options [nop,nop,TS val 4294716160 ecr 4294716130], length 164
09:05:33.836586 IP 10.0.0.1.8882 > 10.0.0.2.60528: Flags [.], ack 1508846558, win 135, options [nop,nop,TS val 4294716151 ecr 4294716140], length 0
09:05:33.855421 IP 10.0.0.2.60528 > 10.0.0.1.8882: Flags [P.], seq 1508846722:1508846886, ack 263878990, win 58, options [nop,nop,TS val 4294716180 ecr 4294716151], length 164
09:05:33.856300 IP 10.0.0.1.8882 > 10.0.0.2.60528: Flags [.], ack 1508846722, win 137, options [nop,nop,TS val 4294716170 ecr 4294716160], length 0
09:05:33.875454 IP 10.0.0.2.60528 > 10.0.0.1.8882: Flags [P.], seq 1508846886:1508847050, ack 263878990, win 58, options [nop,nop,TS val 4294716200 ecr 4294716170], length 164
09:05:33.875594 IP 10.0.0.1.8882 > 10.0.0.2.60528: Flags [.], ack 1508846886, win 139, options [nop,nop,TS val 4294716190 ecr 4294716180], length 0
09:05:33.895505 IP 10.0.0.2.60528 > 10.0.0.1.8882: Flags [P.], seq 1508847050:1508847214, ack 263878990, win 58, options [nop,nop,TS val 4294716220 ecr 4294716190], length 164
09:05:33.896149 IP 10.0.0.1.8882 > 10.0.0.2.60528: Flags [.], ack 1508847050, win 141, options [nop,nop,TS val 4294716210 ecr 4294716200], length 0
09:05:33.916324 IP 10.0.0.1.8882 > 10.0.0.2.60528: Flags [.], ack 1508847214, win 143, options [nop,nop,TS val 4294716230 ecr 4294716220], length 0
09:05:33.916362 IP 10.0.0.2.60528 > 10.0.0.1.8882: Flags [P.], seq 1508847214:1508847378, ack 263878990, win 58, options [nop,nop,TS val 4294716241 ecr 4294716210], length 164
09:05:33.935522 IP 10.0.0.2.60528 > 10.0.0.1.8882: Flags [P.], seq 1508847378:1508847542, ack 263878990, win 58, options [nop,nop,TS val 4294716260 ecr 4294716230], length 164
09:05:33.936826 IP 10.0.0.1.8882 > 10.0.0.2.60528: Flags [.], ack 1508847378, win 145, options [nop,nop,TS val 4294716251 ecr 4294716241], length 0
09:05:33.956008 IP 10.0.0.1.8882 > 10.0.0.2.60528: Flags [.], ack 1508847542, win 147, options [nop,nop,TS val 4294716270 ecr 4294716260], length 0
09:05:33.956029 IP 10.0.0.2.60528 > 10.0.0.1.8882: Flags [P.], seq 1508847542:1508847706, ack 263878990, win 58, options [nop,nop,TS val 4294716280 ecr 4294716251], length 164
09:05:33.975704 IP 10.0.0.2.60528 > 10.0.0.1.8882: Flags [P.], seq 1508847706:1508847870, ack 263878990, win 58, options [nop,nop,TS val 4294716300 ecr 4294716270], length 164
09:05:33.976603 IP 10.0.0.1.8882 > 10.0.0.2.60528: Flags [.], ack 1508847706, win 149, options [nop,nop,TS val 4294716291 ecr 4294716280], length 0
09:05:33.995491 IP 10.0.0.2.60528 > 10.0.0.1.8882: Flags [P.], seq 1508847870:1508848034, ack 263878990, win 58, options [nop,nop,TS val 4294716320 ecr 4294716291], length 164
09:05:33.996972 IP 10.0.0.1.8882 > 10.0.0.2.60528: Flags [.], ack 1508847870, win 151, options [nop,nop,TS val 4294716311 ecr 4294716300], length 0
09:05:34.015448 IP 10.0.0.2.60528 > 10.0.0.1.8882: Flags [P.], seq 1508848034:1508848198, ack 263878990, win 58, options [nop,nop,TS val 4294716340 ecr 4294716311], length 164
09:05:34.015852 IP 10.0.0.1.8882 > 10.0.0.2.60528: Flags [.], ack 1508848034, win 153, options [nop,nop,TS val 4294716330 ecr 4294716320], length 0
09:05:34.035504 IP 10.0.0.2.60528 > 10.0.0.1.8882: Flags [P.], seq 1508848198:1508848362, ack 263878990, win 58, options [nop,nop,TS val 4294716360 ecr 4294716330], length 164
09:05:34.035956 IP 10.0.0.1.8882 > 10.0.0.2.60528: Flags [.], ack 1508848198, win 155, options [nop,nop,TS val 4294716350 ecr 4294716340], length 0
09:05:34.055774 IP 10.0.0.2.60528 > 10.0.0.1.8882: Flags [P.], seq 1508848362:1508848526, ack 263878990, win 58, options [nop,nop,TS val 4294716380 ecr 4294716350], length 164
09:05:34.056095 IP 10.0.0.1.8882 > 10.0.0.2.60528: Flags [.], ack 1508848362, win 158, options [nop,nop,TS val 4294716370 ecr 4294716360], length 0
09:05:34.075541 IP 10.0.0.2.60528 > 10.0.0.1.8882: Flags [P.], seq 1508848526:1508848690, ack 263878990, win 58, options [nop,nop,TS val 4294716400 ecr 4294716370], length 164
09:05:34.076605 IP 10.0.0.1.8882 > 10.0.0.2.60528: Flags [.], ack 1508848526, win 160, options [nop,nop,TS val 4294716391 ecr 4294716380], length 0
09:05:34.095486 IP 10.0.0.2.60528 > 10.0.0.1.8882: Flags [P.], seq 1508848690:1508848854, ack 263878990, win 58, options [nop,nop,TS val 4294716420 ecr 4294716391], length 164
09:05:34.096454 IP 10.0.0.1.8882 > 10.0.0.2.60528: Flags [.], ack 1508848690, win 162, options [nop,nop,TS val 4294716410 ecr 4294716400], length 0
09:05:34.115431 IP 10.0.0.2.60528 > 10.0.0.1.8882: Flags [P.], seq 1508848854:1508849018, ack 263878990, win 58, options [nop,nop,TS val 4294716440 ecr 4294716410], length 164
09:05:34.117023 IP 10.0.0.1.8882 > 10.0.0.2.60528: Flags [.], ack 1508848854, win 164, options [nop,nop,TS val 4294716431 ecr 4294716420], length 0
09:05:34.135763 IP 10.0.0.2.60528 > 10.0.0.1.8882: Flags [P.], seq 1508849018:1508849182, ack 263878990, win 58, options [nop,nop,TS val 4294716460 ecr 4294716431], length 164
09:05:34.136464 IP 10.0.0.1.8882 > 10.0.0.2.60528: Flags [.], ack 1508849018, win 166, options [nop,nop,TS val 4294716450 ecr 4294716440], length 0
09:05:34.155431 IP 10.0.0.2.60528 > 10.0.0.1.8882: Flags [P.], seq 1508849182:1508849346, ack 263878990, win 58, options [nop,nop,TS val 4294716480 ecr 4294716450], length 164
09:05:34.156390 IP 10.0.0.1.8882 > 10.0.0.2.60528: Flags [.], ack 1508849182, win 168, options [nop,nop,TS val 4294716470 ecr 4294716460], length 0
09:05:34.175600 IP 10.0.0.2.60528 > 10.0.0.1.8882: Flags [P.], seq 1508849346:1508849510, ack 263878990, win 58, options [nop,nop,TS val 4294716500 ecr 4294716470], length 164
09:05:34.175863 IP 10.0.0.1.8882 > 10.0.0.2.60528: Flags [.], ack 1508849346, win 170, options [nop,nop,TS val 4294716490 ecr 4294716480], length 0
09:05:34.195576 IP 10.0.0.2.60528 > 10.0.0.1.8882: Flags [P.], seq 1508849510:1508849674, ack 263878990, win 58, options [nop,nop,TS val 4294716520 ecr 4294716490], length 164
09:05:34.196088 IP 10.0.0.1.8882 > 10.0.0.2.60528: Flags [.], ack 1508849510, win 172, options [nop,nop,TS val 4294716510 ecr 4294716500], length 0
09:05:34.216690 IP 10.0.0.1.8882 > 10.0.0.2.60528: Flags [.], ack 1508849674, win 174, options [nop,nop,TS val 4294716530 ecr 4294716520], length 0
09:05:34.216698 IP 10.0.0.2.60528 > 10.0.0.1.8882: Flags [P.], seq 1508849674:1508849838, ack 263878990, win 58, options [nop,nop,TS val 4294716541 ecr 4294716510], length 164
09:05:34.236156 IP 10.0.0.2.60528 > 10.0.0.1.8882: Flags [P.], seq 1508849838:1508850002, ack 263878990, win 58, options [nop,nop,TS val 4294716560 ecr 4294716530], length 164
09:05:34.237343 IP 10.0.0.1.8882 > 10.0.0.2.60528: Flags [.], ack 1508849838, win 176, options [nop,nop,TS val 4294716552 ecr 4294716541], length 0
09:05:34.256037 IP 10.0.0.2.60528 > 10.0.0.1.8882: Flags [P.], seq 1508850002:1508850166, ack 263878990, win 58, options [nop,nop,TS val 4294716580 ecr 4294716552], length 164
09:05:34.256449 IP 10.0.0.1.8882 > 10.0.0.2.60528: Flags [.], ack 1508850002, win 178, options [nop,nop,TS val 4294716571 ecr 4294716560], length 0
09:05:34.275656 IP 10.0.0.2.60528 > 10.0.0.1.8882: Flags [P.], seq 1508850166:1508850330, ack 263878990, win 58, options [nop,nop,TS val 4294716600 ecr 4294716571], length 164
09:05:34.276928 IP 10.0.0.1.8882 > 10.0.0.2.60528: Flags [.], ack 1508850166, win 181, options [nop,nop,TS val 4294716591 ecr 4294716580], length 0
09:05:34.295602 IP 10.0.0.2.60528 > 10.0.0.1.8882: Flags [P.], seq 1508850330:1508850494, ack 263878990, win 58, options [nop,nop,TS val 4294716620 ecr 4294716591], length 164
09:05:34.296186 IP 10.0.0.1.8882 > 10.0.0.2.60528: Flags [.], ack 1508850330, win 183, options [nop,nop,TS val 4294716610 ecr 4294716600], length 0
09:05:34.315666 IP 10.0.0.2.60528 > 10.0.0.1.8882: Flags [P.], seq 1508850494:1508850658, ack 263878990, win 58, options [nop,nop,TS val 4294716640 ecr 4294716610], length 164
09:05:34.316338 IP 10.0.0.1.8882 > 10.0.0.2.60528: Flags [.], ack 1508850494, win 185, options [nop,nop,TS val 4294716630 ecr 4294716620], length 0
09:05:34.336543 IP 10.0.0.1.8882 > 10.0.0.2.60528: Flags [.], ack 1508850658, win 187, options [nop,nop,TS val 4294716651 ecr 4294716640], length 0
09:05:34.336552 IP 10.0.0.2.60528 > 10.0.0.1.8882: Flags [P.], seq 1508850658:1508850822, ack 263878990, win 58, options [nop,nop,TS val 4294716661 ecr 4294716630], length 164
09:05:34.355464 IP 10.0.0.2.60528 > 10.0.0.1.8882: Flags [P.], seq 1508850822:1508850986, ack 263878990, win 58, options [nop,nop,TS val 4294716680 ecr 4294716651], length 164
09:05:34.357909 IP 10.0.0.1.8882 > 10.0.0.2.60528: Flags [.], ack 1508850822, win 189, options [nop,nop,TS val 4294716672 ecr 4294716661], length 0
09:05:34.375784 IP 10.0.0.2.60528 > 10.0.0.1.8882: Flags [P.], seq 1508850986:1508851150, ack 263878990, win 58, options [nop,nop,TS val 4294716700 ecr 4294716672], length 164
09:05:34.375950 IP 10.0.0.1.8882 > 10.0.0.2.60528: Flags [.], ack 1508850986, win 191, options [nop,nop,TS val 4294716690 ecr 4294716680], length 0
09:05:34.395834 IP 10.0.0.2.60528 > 10.0.0.1.8882: Flags [P.], seq 1508851150:1508851314, ack 263878990, win 58, options [nop,nop,TS val 4294716720 ecr 4294716690], length 164
09:05:34.397541 IP 10.0.0.1.8882 > 10.0.0.2.60528: Flags [.], ack 1508851150, win 193, options [nop,nop,TS val 4294716711 ecr 4294716700], length 0
09:05:34.415630 IP 10.0.0.2.60528 > 10.0.0.1.8882: Flags [P.], seq 1508851314:1508851478, ack 263878990, win 58, options [nop,nop,TS val 4294716740 ecr 4294716711], length 164
09:05:34.416508 IP 10.0.0.1.8882 > 10.0.0.2.60528: Flags [.], ack 1508851314, win 195, options [nop,nop,TS val 4294716730 ecr 4294716720], length 0
09:05:34.435596 IP 10.0.0.2.60528 > 10.0.0.1.8882: Flags [P.], seq 1508851478:1508851642, ack 263878990, win 58, options [nop,nop,TS val 4294716760 ecr 4294716730], length 164
09:05:34.436061 IP 10.0.0.1.8882 > 10.0.0.2.60528: Flags [.], ack 1508851478, win 197, options [nop,nop,TS val 4294716750 ecr 4294716740], length 0
09:05:34.455556 IP 10.0.0.2.60528 > 10.0.0.1.8882: Flags [P.], seq 1508851642:1508851806, ack 263878990, win 58, options [nop,nop,TS val 4294716780 ecr 4294716750], length 164
09:05:34.456024 IP 10.0.0.1.8882 > 10.0.0.2.60528: Flags [.], ack 1508851642, win 199, options [nop,nop,TS val 4294716770 ecr 4294716760], length 0
09:05:34.475688 IP 10.0.0.2.60528 > 10.0.0.1.8882: Flags [P.], seq 1508851806:1508851970, ack 263878990, win 58, options [nop,nop,TS val 4294716800 ecr 4294716770], length 164
09:05:34.476893 IP 10.0.0.1.8882 > 10.0.0.2.60528: Flags [.], ack 1508851806, win 202, options [nop,nop,TS val 4294716790 ecr 4294716780], length 0
09:05:34.495684 IP 10.0.0.2.60528 > 10.0.0.1.8882: Flags [P.], seq 1508851970:1508852134, ack 263878990, win 58, options [nop,nop,TS val 4294716820 ecr 4294716790], length 164
09:05:34.496837 IP 10.0.0.1.8882 > 10.0.0.2.60528: Flags [.], ack 1508851970, win 204, options [nop,nop,TS val 4294716811 ecr 4294716800], length 0
09:05:34.515460 IP 10.0.0.2.60528 > 10.0.0.1.8882: Flags [P.], seq 1508852134:1508852298, ack 263878990, win 58, options [nop,nop,TS val 4294716840 ecr 4294716811], length 164
09:05:34.515986 IP 10.0.0.1.8882 > 10.0.0.2.60528: Flags [.], ack 1508852134, win 206, options [nop,nop,TS val 4294716830 ecr 4294716820], length 0
09:05:34.535542 IP 10.0.0.2.60528 > 10.0.0.1.8882: Flags [P.], seq 1508852298:1508852462, ack 263878990, win 58, options [nop,nop,TS val 4294716860 ecr 4294716830], length 164
09:05:34.538035 IP 10.0.0.1.8882 > 10.0.0.2.60528: Flags [.], ack 1508852298, win 208, options [nop,nop,TS val 4294716852 ecr 4294716840], length 0
09:05:34.555659 IP 10.0.0.2.60528 > 10.0.0.1.8882: Flags [P.], seq 1508852462:1508852626, ack 263878990, win 58, options [nop,nop,TS val 4294716880 ecr 4294716852], length 164
09:05:34.556063 IP 10.0.0.1.8882 > 10.0.0.2.60528: Flags [.], ack 1508852462, win 210, options [nop,nop,TS val 4294716870 ecr 4294716860], length 0
09:05:34.575720 IP 10.0.0.2.60528 > 10.0.0.1.8882: Flags [P.], seq 1508852626:1508852790, ack 263878990, win 58, options [nop,nop,TS val 4294716900 ecr 4294716870], length 164
09:05:34.576328 IP 10.0.0.1.8882 > 10.0.0.2.60528: Flags [.], ack 1508852626, win 212, options [nop,nop,TS val 4294716890 ecr 4294716880], length 0
09:05:34.595993 IP 10.0.0.2.60528 > 10.0.0.1.8882: Flags [P.], seq 1508852790:1508852954, ack 263878990, win 58, options [nop,nop,TS val 4294716920 ecr 4294716890], length 164
09:05:34.596802 IP 10.0.0.1.8882 > 10.0.0.2.60528: Flags [.], ack 1508852790, win 214, options [nop,nop,TS val 4294716911 ecr 4294716900], length 0
09:05:34.615540 IP 10.0.0.2.60528 > 10.0.0.1.8882: Flags [P.], seq 1508852954:1508853118, ack 263878990, win 58, options [nop,nop,TS val 4294716940 ecr 4294716911], length 164
09:05:34.616334 IP 10.0.0.1.8882 > 10.0.0.2.60528: Flags [.], ack 1508852954, win 216, options [nop,nop,TS val 4294716930 ecr 4294716920], length 0
09:05:34.635671 IP 10.0.0.2.60528 > 10.0.0.1.8882: Flags [P.], seq 1508853118:1508853282, ack 263878990, win 58, options [nop,nop,TS val 4294716960 ecr 4294716930], length 164
09:05:34.635970 IP 10.0.0.1.8882 > 10.0.0.2.60528: Flags [.], ack 1508853118, win 218, options [nop,nop,TS val 4294716950 ecr 4294716940], length 0
09:05:34.655837 IP 10.0.0.2.60528 > 10.0.0.1.8882: Flags [P.], seq 1508853282:1508853446, ack 263878990, win 58, options [nop,nop,TS val 4294716980 ecr 4294716950], length 164
09:05:34.656575 IP 10.0.0.1.8882 > 10.0.0.2.60528: Flags [.], ack 1508853282, win 220, options [nop,nop,TS val 4294716971 ecr 4294716960], length 0
09:05:34.675416 IP 10.0.0.2.60528 > 10.0.0.1.8882: Flags [P.], seq 1508853446:1508853610, ack 263878990, win 58, options [nop,nop,TS val 4294717000 ecr 4294716971], length 164
09:05:34.676518 IP 10.0.0.1.8882 > 10.0.0.2.60528: Flags [.], ack 1508853446, win 222, options [nop,nop,TS val 4294716990 ecr 4294716980], length 0
09:05:34.696031 IP 10.0.0.2.60528 > 10.0.0.1.8882: Flags [P.], seq 1508853610:1508853774, ack 263878990, win 58, options [nop,nop,TS val 4294717020 ecr 4294716990], length 164
09:05:34.713080 IP 10.0.0.1.8882 > 10.0.0.2.60528: Flags [.], ack 1508853610, win 225, options [nop,nop,TS val 4294717027 ecr 4294717000], length 0
09:05:34.716183 IP 10.0.0.2.60528 > 10.0.0.1.8882: Flags [P.], seq 1508853774:1508853938, ack 263878990, win 58, options [nop,nop,TS val 4294717040 ecr 4294717027], length 164
09:05:34.716225 IP 10.0.0.1.8882 > 10.0.0.2.60528: Flags [.], ack 1508853774, win 227, options [nop,nop,TS val 4294717030 ecr 4294717020], length 0
09:05:34.735848 IP 10.0.0.2.60528 > 10.0.0.1.8882: Flags [P.], seq 1508853938:1508854102, ack 263878990, win 58, options [nop,nop,TS val 4294717060 ecr 4294717030], length 164
09:05:34.747310 IP 10.0.0.1.8882 > 10.0.0.2.60528: Flags [.], ack 1508853938, win 229, options [nop,nop,TS val 4294717061 ecr 4294717040], length 0
09:05:34.755580 IP 10.0.0.2.60528 > 10.0.0.1.8882: Flags [P.], seq 1508854102:1508854266, ack 263878990, win 58, options [nop,nop,TS val 4294717080 ecr 4294717061], length 164
09:05:34.775411 IP 10.0.0.2.60528 > 10.0.0.1.8882: Flags [P.], seq 1508854266:1508854430, ack 263878990, win 58, options [nop,nop,TS val 4294717100 ecr 4294717061], length 164
09:05:34.798415 IP 10.0.0.2.60528 > 10.0.0.1.8882: Flags [P.], seq 1508854430:1508854594, ack 263878990, win 58, options [nop,nop,TS val 4294717123 ecr 4294717061], length 164
09:05:34.813592 IP 10.0.0.1.8882 > 10.0.0.2.60528: Flags [.], ack 1508853938, win 231, options [nop,nop,TS val 4294717128 ecr 4294717040,nop,nop,sack 1 {1508854102:1508854266}], length 0
09:05:34.815752 IP 10.0.0.2.60528 > 10.0.0.1.8882: Flags [P.], seq 1508854594:1508854758, ack 263878990, win 58, options [nop,nop,TS val 4294717140 ecr 4294717128], length 164
09:05:34.835696 IP 10.0.0.2.60528 > 10.0.0.1.8882: Flags [P.], seq 1508854758:1508854922, ack 263878990, win 58, options [nop,nop,TS val 4294717160 ecr 4294717128], length 164
09:05:34.855424 IP 10.0.0.2.60528 > 10.0.0.1.8882: Flags [P.], seq 1508854922:1508855086, ack 263878990, win 58, options [nop,nop,TS val 4294717180 ecr 4294717128], length 164
09:05:34.875656 IP 10.0.0.2.60528 > 10.0.0.1.8882: Flags [P.], seq 1508855086:1508855250, ack 263878990, win 58, options [nop,nop,TS val 4294717200 ecr 4294717128], length 164
09:05:34.893366 IP 10.0.0.1.8882 > 10.0.0.2.60528: Flags [.], ack 1508853938, win 233, options [nop,nop,TS val 4294717208 ecr 4294717040,nop,nop,sack 2 {1508854922:1508855086}{1508854102:1508854266}], length 0
09:05:34.893406 IP 10.0.0.2.60528 > 10.0.0.1.8882: Flags [P.], seq 1508853938:1508854102, ack 263878990, win 58, options [nop,nop,TS val 4294717218 ecr 4294717208], length 164
09:05:34.893430 IP 10.0.0.2.60528 > 10.0.0.1.8882: Flags [P.], seq 1508854266:1508854922, ack 263878990, win 58, options [nop,nop,TS val 4294717218 ecr 4294717208], length 656
09:05:34.895763 IP 10.0.0.2.60528 > 10.0.0.1.8882: Flags [P.], seq 1508855250:1508855414, ack 263878990, win 58, options [nop,nop,TS val 4294717220 ecr 4294717208], length 164
09:05:34.906111 IP 10.0.0.1.8882 > 10.0.0.2.60528: Flags [.], ack 1508853938, win 235, options [nop,nop,TS val 4294717220 ecr 4294717040,nop,nop,sack 2 {1508854922:1508855250}{1508854102:1508854266}], length 0
09:05:34.916040 IP 10.0.0.2.60528 > 10.0.0.1.8882: Flags [P.], seq 1508855414:1508855578, ack 263878990, win 58, options [nop,nop,TS val 4294717240 ecr 4294717220], length 164
09:05:34.926356 IP 10.0.0.1.8882 > 10.0.0.2.60528: Flags [.], ack 1508853938, win 237, options [nop,nop,TS val 4294717240 ecr 4294717040,nop,nop,sack 2 {1508854922:1508855414}{1508854102:1508854266}], length 0
09:05:34.926449 IP 10.0.0.2.60528 > 10.0.0.1.8882: Flags [P.], seq 1508853938:1508854102, ack 263878990, win 58, options [nop,nop,TS val 4294717251 ecr 4294717240], length 164
09:05:34.926455 IP 10.0.0.2.60528 > 10.0.0.1.8882: Flags [P.], seq 1508854266:1508854922, ack 263878990, win 58, options [nop,nop,TS val 4294717251 ecr 4294717240], length 656
09:05:34.942569 IP 10.0.0.1.8882 > 10.0.0.2.60528: Flags [.], ack 1508853938, win 239, options [nop,nop,TS val 4294717257 ecr 4294717040,nop,nop,sack 2 {1508854922:1508855578}{1508854102:1508854266}], length 0
09:05:34.942644 IP 10.0.0.2.60528 > 10.0.0.1.8882: Flags [P.], seq 1508855578:1508855742, ack 263878990, win 58, options [nop,nop,TS val 4294717267 ecr 4294717257], length 164
09:05:34.956114 IP 10.0.0.2.60528 > 10.0.0.1.8882: Flags [P.], seq 1508855742:1508855906, ack 263878990, win 58, options [nop,nop,TS val 4294717280 ecr 4294717257], length 164
09:05:34.971736 IP 10.0.0.1.8882 > 10.0.0.2.60528: Flags [.], ack 1508853938, win 241, options [nop,nop,TS val 4294717286 ecr 4294717040,nop,nop,sack 2 {1508854922:1508855742}{1508854102:1508854266}], length 0
09:05:34.971782 IP 10.0.0.2.60528 > 10.0.0.1.8882: Flags [P.], seq 1508853938:1508854102, ack 263878990, win 58, options [nop,nop,TS val 4294717296 ecr 4294717286], length 164
09:05:34.971787 IP 10.0.0.2.60528 > 10.0.0.1.8882: Flags [P.], seq 1508854266:1508854922, ack 263878990, win 58, options [nop,nop,TS val 4294717296 ecr 4294717286], length 656
09:05:34.979941 IP 10.0.0.1.8882 > 10.0.0.2.60528: Flags [.], ack 1508853938, win 243, options [nop,nop,TS val 4294717293 ecr 4294717040,nop,nop,sack 2 {1508854922:1508855906}{1508854102:1508854266}], length 0
09:05:34.980008 IP 10.0.0.2.60528 > 10.0.0.1.8882: Flags [P.], seq 1508855906:1508856070, ack 263878990, win 58, options [nop,nop,TS val 4294717304 ecr 4294717293], length 164
09:05:34.992930 IP 10.0.0.1.8882 > 10.0.0.2.60528: Flags [.], ack 1508854266, win 245, options [nop,nop,TS val 4294717307 ecr 4294717296,nop,nop,sack 1 {1508854922:1508855906}], length 0
09:05:34.992932 IP 10.0.0.1.8882 > 10.0.0.2.60528: Flags [.], ack 1508855906, win 248, options [nop,nop,TS val 4294717307 ecr 4294717296], length 0
09:05:34.995415 IP 10.0.0.2.60528 > 10.0.0.1.8882: Flags [P.], seq 1508856070:1508856234, ack 263878990, win 58, options [nop,nop,TS val 4294717320 ecr 4294717307], length 164
09:05:35.003459 IP 10.0.0.1.8882 > 10.0.0.2.60528: Flags [.], ack 1508856070, win 251, options [nop,nop,TS val 4294717317 ecr 4294717304], length 0
09:05:35.015507 IP 10.0.0.2.60528 > 10.0.0.1.8882: Flags [P.], seq 1508856234:1508856398, ack 263878990, win 58, options [nop,nop,TS val 4294717340 ecr 4294717317], length 164
09:05:35.035507 IP 10.0.0.2.60528 > 10.0.0.1.8882: Flags [P.], seq 1508856398:1508856562, ack 263878990, win 58, options [nop,nop,TS val 4294717360 ecr 4294717317], length 164
09:05:35.050075 IP 10.0.0.1.8882 > 10.0.0.2.60528: Flags [.], ack 1508856070, win 253, options [nop,nop,TS val 4294717364 ecr 4294717304,nop,nop,sack 1 {1508856234:1508856398}], length 0
09:05:35.055638 IP 10.0.0.2.60528 > 10.0.0.1.8882: Flags [P.], seq 1508856562:1508856726, ack 263878990, win 58, options [nop,nop,TS val 4294717380 ecr 4294717364], length 164
09:05:35.070485 IP 10.0.0.1.8882 > 10.0.0.2.60528: Flags [.], ack 1508856070, win 256, options [nop,nop,TS val 4294717381 ecr 4294717304,nop,nop,sack 1 {1508856234:1508856562}], length 0
09:05:35.075876 IP 10.0.0.2.60528 > 10.0.0.1.8882: Flags [P.], seq 1508856726:1508856890, ack 263878990, win 58, options [nop,nop,TS val 4294717400 ecr 4294717381], length 164
09:05:35.087195 IP 10.0.0.1.8882 > 10.0.0.2.60528: Flags [.], ack 1508856070, win 258, options [nop,nop,TS val 4294717400 ecr 4294717304,nop,nop,sack 1 {1508856234:1508856726}], length 0
09:05:35.087467 IP 10.0.0.2.60528 > 10.0.0.1.8882: Flags [P.], seq 1508856070:1508856234, ack 263878990, win 58, options [nop,nop,TS val 4294717412 ecr 4294717400], length 164
09:05:35.095600 IP 10.0.0.2.60528 > 10.0.0.1.8882: Flags [P.], seq 1508856890:1508857054, ack 263878990, win 58, options [nop,nop,TS val 4294717420 ecr 4294717400], length 164
09:05:35.108167 IP 10.0.0.1.8882 > 10.0.0.2.60528: Flags [.], ack 1508856070, win 261, options [nop,nop,TS val 4294717422 ecr 4294717304,nop,nop,sack 1 {1508856234:1508856890}], length 0
09:05:35.115851 IP 10.0.0.2.60528 > 10.0.0.1.8882: Flags [P.], seq 1508857054:1508857218, ack 263878990, win 58, options [nop,nop,TS val 4294717440 ecr 4294717422], length 164
09:05:35.117930 IP 10.0.0.1.8882 > 10.0.0.2.60528: Flags [.], ack 1508856890, win 263, options [nop,nop,TS val 4294717432 ecr 4294717412], length 0
09:05:35.124577 IP 10.0.0.1.8882 > 10.0.0.2.60528: Flags [.], ack 1508857054, win 266, options [nop,nop,TS val 4294717439 ecr 4294717420], length 0
09:05:35.135906 IP 10.0.0.2.60528 > 10.0.0.1.8882: Flags [P.], seq 1508857218:1508857382, ack 263878990, win 58, options [nop,nop,TS val 4294717460 ecr 4294717439], length 164
09:05:35.139670 IP 10.0.0.1.8882 > 10.0.0.2.60528: Flags [.], ack 1508857218, win 269, options [nop,nop,TS val 4294717454 ecr 4294717440], length 0
09:05:35.155658 IP 10.0.0.2.60528 > 10.0.0.1.8882: Flags [P.], seq 1508857382:1508857546, ack 263878990, win 58, options [nop,nop,TS val 4294717480 ecr 4294717454], length 164
09:05:35.158027 IP 10.0.0.1.8882 > 10.0.0.2.60528: Flags [.], ack 1508857382, win 271, options [nop,nop,TS val 4294717472 ecr 4294717460], length 0
09:05:35.175556 IP 10.0.0.2.60528 > 10.0.0.1.8882: Flags [P.], seq 1508857546:1508857710, ack 263878990, win 58, options [nop,nop,TS val 4294717500 ecr 4294717472], length 164
09:05:35.181110 IP 10.0.0.1.8882 > 10.0.0.2.60528: Flags [.], ack 1508857546, win 274, options [nop,nop,TS val 4294717495 ecr 4294717480], length 0
09:05:35.195401 IP 10.0.0.2.60528 > 10.0.0.1.8882: Flags [P.], seq 1508857710:1508857874, ack 263878990, win 58, options [nop,nop,TS val 4294717520 ecr 4294717495], length 164
09:05:35.205715 IP 10.0.0.1.8882 > 10.0.0.2.60528: Flags [.], ack 1508857710, win 276, options [nop,nop,TS val 4294717520 ecr 4294717500], length 0
09:05:35.215539 IP 10.0.0.2.60528 > 10.0.0.1.8882: Flags [P.], seq 1508857874:1508858038, ack 263878990, win 58, options [nop,nop,TS val 4294717540 ecr 4294717520], length 164
09:05:35.224180 IP 10.0.0.1.8882 > 10.0.0.2.60528: Flags [.], ack 1508857874, win 279, options [nop,nop,TS val 4294717538 ecr 4294717520], length 0
09:05:35.235447 IP 10.0.0.2.60528 > 10.0.0.1.8882: Flags [P.], seq 1508858038:1508858202, ack 263878990, win 58, options [nop,nop,TS val 4294717560 ecr 4294717538], length 164
09:05:35.242669 IP 10.0.0.1.8882 > 10.0.0.2.60528: Flags [.], ack 1508858038, win 281, options [nop,nop,TS val 4294717554 ecr 4294717540], length 0
09:05:35.255697 IP 10.0.0.2.60528 > 10.0.0.1.8882: Flags [P.], seq 1508858202:1508858366, ack 263878990, win 58, options [nop,nop,TS val 4294717580 ecr 4294717554], length 164
09:05:35.262910 IP 10.0.0.1.8882 > 10.0.0.2.60528: Flags [.], ack 1508858202, win 284, options [nop,nop,TS val 4294717577 ecr 4294717560], length 0
09:05:35.275527 IP 10.0.0.2.60528 > 10.0.0.1.8882: Flags [P.], seq 1508858366:1508858530, ack 263878990, win 58, options [nop,nop,TS val 4294717600 ecr 4294717577], length 164
09:05:35.283592 IP 10.0.0.1.8882 > 10.0.0.2.60528: Flags [.], ack 1508858366, win 286, options [nop,nop,TS val 4294717598 ecr 4294717580], length 0
09:05:35.295518 IP 10.0.0.2.60528 > 10.0.0.1.8882: Flags [P.], seq 1508858530:1508858694, ack 263878990, win 58, options [nop,nop,TS val 4294717620 ecr 4294717598], length 164
09:05:35.304731 IP 10.0.0.1.8882 > 10.0.0.2.60528: Flags [.], ack 1508858530, win 289, options [nop,nop,TS val 4294717619 ecr 4294717600], length 0
09:05:35.315780 IP 10.0.0.2.60528 > 10.0.0.1.8882: Flags [P.], seq 1508858694:1508858858, ack 263878990, win 58, options [nop,nop,TS val 4294717640 ecr 4294717619], length 164
09:05:35.325751 IP 10.0.0.1.8882 > 10.0.0.2.60528: Flags [.], ack 1508858694, win 292, options [nop,nop,TS val 4294717639 ecr 4294717620], length 0
09:05:35.336048 IP 10.0.0.2.60528 > 10.0.0.1.8882: Flags [P.], seq 1508858858:1508859022, ack 263878990, win 58, options [nop,nop,TS val 4294717660 ecr 4294717639], length 164
09:05:35.342968 IP 10.0.0.1.8882 > 10.0.0.2.60528: Flags [.], ack 1508858858, win 294, options [nop,nop,TS val 4294717657 ecr 4294717640], length 0
09:05:35.355391 IP 10.0.0.2.60528 > 10.0.0.1.8882: Flags [P.], seq 1508859022:1508859186, ack 263878990, win 58, options [nop,nop,TS val 4294717680 ecr 4294717657], length 164
09:05:35.362072 IP 10.0.0.1.8882 > 10.0.0.2.60528: Flags [.], ack 1508859022, win 297, options [nop,nop,TS val 4294717675 ecr 4294717660], length 0
09:05:35.375743 IP 10.0.0.2.60528 > 10.0.0.1.8882: Flags [P.], seq 1508859186:1508859350, ack 263878990, win 58, options [nop,nop,TS val 4294717700 ecr 4294717675], length 164
09:05:35.383458 IP 10.0.0.1.8882 > 10.0.0.2.60528: Flags [.], ack 1508859186, win 299, options [nop,nop,TS val 4294717698 ecr 4294717680], length 0
09:05:35.395410 IP 10.0.0.2.60528 > 10.0.0.1.8882: Flags [P.], seq 1508859350:1508859514, ack 263878990, win 58, options [nop,nop,TS val 4294717720 ecr 4294717698], length 164
09:05:35.405333 IP 10.0.0.1.8882 > 10.0.0.2.60528: Flags [.], ack 1508859350, win 302, options [nop,nop,TS val 4294717719 ecr 4294717700], length 0
09:05:35.415622 IP 10.0.0.2.60528 > 10.0.0.1.8882: Flags [P.], seq 1508859514:1508859678, ack 263878990, win 58, options [nop,nop,TS val 4294717740 ecr 4294717719], length 164
09:05:35.424730 IP 10.0.0.1.8882 > 10.0.0.2.60528: Flags [.], ack 1508859514, win 304, options [nop,nop,TS val 4294717739 ecr 4294717720], length 0
09:05:35.435686 IP 10.0.0.2.60528 > 10.0.0.1.8882: Flags [P.], seq 1508859678:1508859842, ack 263878990, win 58, options [nop,nop,TS val 4294717760 ecr 4294717739], length 164
09:05:35.443784 IP 10.0.0.1.8882 > 10.0.0.2.60528: Flags [.], ack 1508859678, win 307, options [nop,nop,TS val 4294717758 ecr 4294717740], length 0
09:05:35.456015 IP 10.0.0.2.60528 > 10.0.0.1.8882: Flags [P.], seq 1508859842:1508860006, ack 263878990, win 58, options [nop,nop,TS val 4294717780 ecr 4294717758], length 164
09:05:35.466209 IP 10.0.0.1.8882 > 10.0.0.2.60528: Flags [.], ack 1508859842, win 310, options [nop,nop,TS val 4294717780 ecr 4294717760], length 0
09:05:35.479019 IP 10.0.0.2.60528 > 10.0.0.1.8882: Flags [P.], seq 1508860006:1508860170, ack 263878990, win 58, options [nop,nop,TS val 4294717803 ecr 4294717780], length 164
09:05:35.494128 IP 10.0.0.1.8882 > 10.0.0.2.60528: Flags [.], ack 1508860006, win 312, options [nop,nop,TS val 4294717808 ecr 4294717780], length 0
09:05:35.495624 IP 10.0.0.2.60528 > 10.0.0.1.8882: Flags [P.], seq 1508860170:1508860334, ack 263878990, win 58, options [nop,nop,TS val 4294717820 ecr 4294717808], length 164
09:05:35.514365 IP 10.0.0.1.8882 > 10.0.0.2.60528: Flags [.], ack 1508860170, win 315, options [nop,nop,TS val 4294717828 ecr 4294717803], length 0
09:05:35.515470 IP 10.0.0.2.60528 > 10.0.0.1.8882: Flags [P.], seq 1508860334:1508860498, ack 263878990, win 58, options [nop,nop,TS val 4294717840 ecr 4294717828], length 164
09:05:35.525075 IP 10.0.0.1.8882 > 10.0.0.2.60528: Flags [.], ack 1508860334, win 317, options [nop,nop,TS val 4294717839 ecr 4294717820], length 0
09:05:35.536218 IP 10.0.0.2.60528 > 10.0.0.1.8882: Flags [P.], seq 1508860498:1508860662, ack 263878990, win 58, options [nop,nop,TS val 4294717860 ecr 4294717839], length 164
09:05:35.543555 IP 10.0.0.1.8882 > 10.0.0.2.60528: Flags [.], ack 1508860498, win 320, options [nop,nop,TS val 4294717858 ecr 4294717840], length 0
09:05:35.555636 IP 10.0.0.2.60528 > 10.0.0.1.8882: Flags [P.], seq 1508860662:1508860826, ack 263878990, win 58, options [nop,nop,TS val 4294717880 ecr 4294717858], length 164
09:05:35.566628 IP 10.0.0.1.8882 > 10.0.0.2.60528: Flags [.], ack 1508860662, win 322, options [nop,nop,TS val 4294717880 ecr 4294717860], length 0
09:05:35.577713 IP 10.0.0.2.60528 > 10.0.0.1.8882: Flags [P.], seq 1508860826:1508860990, ack 263878990, win 58, options [nop,nop,TS val 4294717902 ecr 4294717880], length 164
09:05:35.592939 IP 10.0.0.1.8882 > 10.0.0.2.60528: Flags [.], ack 1508860826, win 325, options [nop,nop,TS val 4294717907 ecr 4294717880], length 0
09:05:35.595387 IP 10.0.0.2.60528 > 10.0.0.1.8882: Flags [P.], seq 1508860990:1508861154, ack 263878990, win 58, options [nop,nop,TS val 4294717920 ecr 4294717907], length 164
09:05:35.613726 IP 10.0.0.1.8882 > 10.0.0.2.60528: Flags [.], ack 1508860990, win 327, options [nop,nop,TS val 4294717928 ecr 4294717902], length 0
09:05:35.615444 IP 10.0.0.2.60528 > 10.0.0.1.8882: Flags [P.], seq 1508861154:1508861318, ack 263878990, win 58, options [nop,nop,TS val 4294717940 ecr 4294717928], length 164
09:05:35.627124 IP 10.0.0.1.8882 > 10.0.0.2.60528: Flags [.], ack 1508861154, win 330, options [nop,nop,TS val 4294717941 ecr 4294717920], length 0
09:05:35.635478 IP 10.0.0.2.60528 > 10.0.0.1.8882: Flags [P.], seq 1508861318:1508861482, ack 263878990, win 58, options [nop,nop,TS val 4294717960 ecr 4294717941], length 164
09:05:35.642921 IP 10.0.0.1.8882 > 10.0.0.2.60528: Flags [.], ack 1508861318, win 333, options [nop,nop,TS val 4294717957 ecr 4294717940], length 0
09:05:35.655487 IP 10.0.0.2.60528 > 10.0.0.1.8882: Flags [P.], seq 1508861482:1508861646, ack 263878990, win 58, options [nop,nop,TS val 4294717980 ecr 4294717957], length 164
09:05:35.664474 IP 10.0.0.1.8882 > 10.0.0.2.60528: Flags [.], ack 1508861482, win 335, options [nop,nop,TS val 4294717979 ecr 4294717960], length 0
09:05:35.675419 IP 10.0.0.2.60528 > 10.0.0.1.8882: Flags [P.], seq 1508861646:1508861810, ack 263878990, win 58, options [nop,nop,TS val 4294718000 ecr 4294717979], length 164
09:05:35.685985 IP 10.0.0.1.8882 > 10.0.0.2.60528: Flags [.], ack 1508861646, win 338, options [nop,nop,TS val 4294717998 ecr 4294717980], length 0
09:05:35.697682 IP 10.0.0.2.60528 > 10.0.0.1.8882: Flags [P.], seq 1508861810:1508861974, ack 263878990, win 58, options [nop,nop,TS val 4294718022 ecr 4294717998], length 164
09:05:35.715384 IP 10.0.0.1.8882 > 10.0.0.2.60528: Flags [.], ack 1508861810, win 340, options [nop,nop,TS val 4294718030 ecr 4294718000], length 0
