12:11:24.511961 IP 10.0.0.2.33480 > vagrant-ubuntu-trusty-64.8882: Flags [P.], seq 2407283171:2407283335, ack 2114665125, win 58, options [nop,nop,TS val 4294713110 ecr 4294713080], length 164
12:11:24.511985 IP vagrant-ubuntu-trusty-64.8882 > 10.0.0.2.33480: Flags [.], ack 2407283335, win 65, options [nop,nop,TS val 4294713120 ecr 4294713110], length 0
12:11:24.532551 IP 10.0.0.2.33480 > vagrant-ubuntu-trusty-64.8882: Flags [P.], seq 2407283335:2407283499, ack 2114665125, win 58, options [nop,nop,TS val 4294713130 ecr 4294713101], length 164
12:11:24.532629 IP vagrant-ubuntu-trusty-64.8882 > 10.0.0.2.33480: Flags [.], ack 2407283499, win 68, options [nop,nop,TS val 4294713140 ecr 4294713130], length 0
12:11:24.551636 IP 10.0.0.2.33480 > vagrant-ubuntu-trusty-64.8882: Flags [P.], seq 2407283499:2407283663, ack 2114665125, win 58, options [nop,nop,TS val 4294713150 ecr 4294713120], length 164
12:11:24.551654 IP vagrant-ubuntu-trusty-64.8882 > 10.0.0.2.33480: Flags [.], ack 2407283663, win 70, options [nop,nop,TS val 4294713160 ecr 4294713150], length 0
12:11:24.572009 IP 10.0.0.2.33480 > vagrant-ubuntu-trusty-64.8882: Flags [P.], seq 2407283663:2407283827, ack 2114665125, win 58, options [nop,nop,TS val 4294713170 ecr 4294713160], length 164
12:11:24.572056 IP vagrant-ubuntu-trusty-64.8882 > 10.0.0.2.33480: Flags [.], ack 2407283827, win 72, options [nop,nop,TS val 4294713180 ecr 4294713170], length 0
12:11:24.593060 IP 10.0.0.2.33480 > vagrant-ubuntu-trusty-64.8882: Flags [P.], seq 2407283827:2407283991, ack 2114665125, win 58, options [nop,nop,TS val 4294713191 ecr 4294713160], length 164
12:11:24.593078 IP vagrant-ubuntu-trusty-64.8882 > 10.0.0.2.33480: Flags [.], ack 2407283991, win 74, options [nop,nop,TS val 4294713201 ecr 4294713191], length 0
12:11:24.613689 IP 10.0.0.2.33480 > vagrant-ubuntu-trusty-64.8882: Flags [P.], seq 2407283991:2407284155, ack 2114665125, win 58, options [nop,nop,TS val 4294713211 ecr 4294713180], length 164
12:11:24.613722 IP vagrant-ubuntu-trusty-64.8882 > 10.0.0.2.33480: Flags [.], ack 2407284155, win 76, options [nop,nop,TS val 4294713222 ecr 4294713211], length 0
12:11:24.632402 IP 10.0.0.2.33480 > vagrant-ubuntu-trusty-64.8882: Flags [P.], seq 2407284155:2407284319, ack 2114665125, win 58, options [nop,nop,TS val 4294713230 ecr 4294713201], length 164
12:11:24.632441 IP vagrant-ubuntu-trusty-64.8882 > 10.0.0.2.33480: Flags [.], ack 2407284319, win 78, options [nop,nop,TS val 4294713240 ecr 4294713230], length 0
12:11:24.652576 IP 10.0.0.2.33480 > vagrant-ubuntu-trusty-64.8882: Flags [P.], seq 2407284319:2407284483, ack 2114665125, win 58, options [nop,nop,TS val 4294713250 ecr 4294713222], length 164
12:11:24.652656 IP vagrant-ubuntu-trusty-64.8882 > 10.0.0.2.33480: Flags [.], ack 2407284483, win 80, options [nop,nop,TS val 4294713260 ecr 4294713250], length 0
12:11:24.671796 IP 10.0.0.2.33480 > vagrant-ubuntu-trusty-64.8882: Flags [P.], seq 2407284483:2407284647, ack 2114665125, win 58, options [nop,nop,TS val 4294713270 ecr 4294713240], length 164
12:11:24.671811 IP vagrant-ubuntu-trusty-64.8882 > 10.0.0.2.33480: Flags [.], ack 2407284647, win 82, options [nop,nop,TS val 4294713280 ecr 4294713270], length 0
12:11:24.699717 IP 10.0.0.2.33480 > vagrant-ubuntu-trusty-64.8882: Flags [P.], seq 2407284647:2407284811, ack 2114665125, win 58, options [nop,nop,TS val 4294713290 ecr 4294713260], length 164
12:11:24.699762 IP vagrant-ubuntu-trusty-64.8882 > 10.0.0.2.33480: Flags [.], ack 2407284811, win 84, options [nop,nop,TS val 4294713307 ecr 4294713290], length 0
12:11:24.721468 IP 10.0.0.2.33480 > vagrant-ubuntu-trusty-64.8882: Flags [P.], seq 2407284811:2407284975, ack 2114665125, win 58, options [nop,nop,TS val 4294713310 ecr 4294713280], length 164
12:11:24.721473 IP vagrant-ubuntu-trusty-64.8882 > 10.0.0.2.33480: Flags [.], ack 2407284975, win 86, options [nop,nop,TS val 4294713330 ecr 4294713310], length 0
12:11:24.748984 IP 10.0.0.2.33480 > vagrant-ubuntu-trusty-64.8882: Flags [P.], seq 2407284975:2407285139, ack 2114665125, win 58, options [nop,nop,TS val 4294713330 ecr 4294713307], length 164
12:11:24.749006 IP vagrant-ubuntu-trusty-64.8882 > 10.0.0.2.33480: Flags [.], ack 2407285139, win 88, options [nop,nop,TS val 4294713357 ecr 4294713330], length 0
12:11:24.800773 IP 10.0.0.2.33480 > vagrant-ubuntu-trusty-64.8882: Flags [P.], seq 2407285303:2407285467, ack 2114665125, win 58, options [nop,nop,TS val 4294713370 ecr 4294713357], length 164
12:11:24.800814 IP vagrant-ubuntu-trusty-64.8882 > 10.0.0.2.33480: Flags [.], ack 2407285139, win 91, options [nop,nop,TS val 4294713409 ecr 4294713330,nop,nop,sack 1 {2407285303:2407285467}], length 0
12:11:24.819712 IP 10.0.0.2.33480 > vagrant-ubuntu-trusty-64.8882: Flags [P.], seq 2407285467:2407285631, ack 2114665125, win 58, options [nop,nop,TS val 4294713390 ecr 4294713357], length 164
12:11:24.819861 IP vagrant-ubuntu-trusty-64.8882 > 10.0.0.2.33480: Flags [.], ack 2407285139, win 93, options [nop,nop,TS val 4294713427 ecr 4294713330,nop,nop,sack 1 {2407285303:2407285631}], length 0
12:11:24.829915 IP 10.0.0.2.33480 > vagrant-ubuntu-trusty-64.8882: Flags [P.], seq 2407285631:2407285795, ack 2114665125, win 58, options [nop,nop,TS val 4294713410 ecr 4294713357], length 164
12:11:24.829949 IP vagrant-ubuntu-trusty-64.8882 > 10.0.0.2.33480: Flags [.], ack 2407285139, win 95, options [nop,nop,TS val 4294713438 ecr 4294713330,nop,nop,sack 1 {2407285303:2407285795}], length 0
12:11:24.865988 IP 10.0.0.2.33480 > vagrant-ubuntu-trusty-64.8882: Flags [P.], seq 2407285959:2407286123, ack 2114665125, win 58, options [nop,nop,TS val 4294713450 ecr 4294713438], length 164
12:11:24.866063 IP vagrant-ubuntu-trusty-64.8882 > 10.0.0.2.33480: Flags [.], ack 2407285139, win 97, options [nop,nop,TS val 4294713473 ecr 4294713330,nop,nop,sack 2 {2407285959:2407286123}{2407285303:2407285795}], length 0
12:11:24.895441 IP 10.0.0.2.33480 > vagrant-ubuntu-trusty-64.8882: Flags [P.], seq 2407285139:2407285303, ack 2114665125, win 58, options [nop,nop,TS val 4294713484 ecr 4294713473], length 164
12:11:24.895458 IP vagrant-ubuntu-trusty-64.8882 > 10.0.0.2.33480: Flags [.], ack 2407285795, win 99, options [nop,nop,TS val 4294713504 ecr 4294713484,nop,nop,sack 1 {2407285959:2407286123}], length 0
12:11:24.895659 IP 10.0.0.2.33480 > vagrant-ubuntu-trusty-64.8882: Flags [P.], seq 2407286123:2407286287, ack 2114665125, win 58, options [nop,nop,TS val 4294713484 ecr 4294713473], length 164
12:11:24.895678 IP vagrant-ubuntu-trusty-64.8882 > 10.0.0.2.33480: Flags [.], ack 2407285795, win 101, options [nop,nop,TS val 4294713504 ecr 4294713484,nop,nop,sack 1 {2407285959:2407286287}], length 0
12:11:24.926969 IP 10.0.0.2.33480 > vagrant-ubuntu-trusty-64.8882: Flags [P.], seq 2407286287:2407286615, ack 2114665125, win 58, options [nop,nop,TS val 4294713514 ecr 4294713504], length 328
12:11:24.927105 IP vagrant-ubuntu-trusty-64.8882 > 10.0.0.2.33480: Flags [.], ack 2407285795, win 103, options [nop,nop,TS val 4294713534 ecr 4294713484,nop,nop,sack 1 {2407285959:2407286615}], length 0
12:11:24.971424 IP 10.0.0.2.33480 > vagrant-ubuntu-trusty-64.8882: Flags [P.], seq 2407286779:2407286943, ack 2114665125, win 58, options [nop,nop,TS val 4294713550 ecr 4294713534], length 164
12:11:24.971448 IP vagrant-ubuntu-trusty-64.8882 > 10.0.0.2.33480: Flags [.], ack 2407285795, win 105, options [nop,nop,TS val 4294713580 ecr 4294713484,nop,nop,sack 2 {2407286779:2407286943}{2407285959:2407286615}], length 0
12:11:24.979982 IP 10.0.0.2.33480 > vagrant-ubuntu-trusty-64.8882: Flags [P.], seq 2407286943:2407287107, ack 2114665125, win 58, options [nop,nop,TS val 4294713570 ecr 4294713534], length 164
12:11:24.980124 IP vagrant-ubuntu-trusty-64.8882 > 10.0.0.2.33480: Flags [.], ack 2407285795, win 107, options [nop,nop,TS val 4294713587 ecr 4294713484,nop,nop,sack 2 {2407286779:2407287107}{2407285959:2407286615}], length 0
12:11:25.000942 IP 10.0.0.2.33480 > vagrant-ubuntu-trusty-64.8882: Flags [P.], seq 2407285795:2407285959, ack 2114665125, win 58, options [nop,nop,TS val 4294713590 ecr 4294713580], length 164
12:11:25.000976 IP vagrant-ubuntu-trusty-64.8882 > 10.0.0.2.33480: Flags [.], ack 2407286615, win 109, options [nop,nop,TS val 4294713609 ecr 4294713590,nop,nop,sack 1 {2407286779:2407287107}], length 0
12:11:25.001043 IP 10.0.0.2.33480 > vagrant-ubuntu-trusty-64.8882: Flags [P.], seq 2407287107:2407287271, ack 2114665125, win 58, options [nop,nop,TS val 4294713590 ecr 4294713580], length 164
12:11:25.001057 IP vagrant-ubuntu-trusty-64.8882 > 10.0.0.2.33480: Flags [.], ack 2407286615, win 111, options [nop,nop,TS val 4294713609 ecr 4294713590,nop,nop,sack 1 {2407286779:2407287271}], length 0
12:11:25.007967 IP 10.0.0.2.33480 > vagrant-ubuntu-trusty-64.8882: Flags [P.], seq 2407286615:2407286779, ack 2114665125, win 58, options [nop,nop,TS val 4294713599 ecr 4294713587], length 164
12:11:25.008026 IP vagrant-ubuntu-trusty-64.8882 > 10.0.0.2.33480: Flags [.], ack 2407287271, win 114, options [nop,nop,TS val 4294713616 ecr 4294713599], length 0
12:11:25.022005 IP 10.0.0.2.33480 > vagrant-ubuntu-trusty-64.8882: Flags [P.], seq 2407287271:2407287435, ack 2114665125, win 58, options [nop,nop,TS val 4294713610 ecr 4294713587], length 164
12:11:25.022068 IP vagrant-ubuntu-trusty-64.8882 > 10.0.0.2.33480: Flags [.], ack 2407287435, win 116, options [nop,nop,TS val 4294713630 ecr 4294713610], length 0
12:11:25.044920 IP 10.0.0.2.33480 > vagrant-ubuntu-trusty-64.8882: Flags [P.], seq 2407287435:2407287599, ack 2114665125, win 58, options [nop,nop,TS val 4294713630 ecr 4294713616], length 164
12:11:25.044992 IP vagrant-ubuntu-trusty-64.8882 > 10.0.0.2.33480: Flags [.], ack 2407287599, win 118, options [nop,nop,TS val 4294713652 ecr 4294713630], length 0
12:11:25.056650 IP 10.0.0.2.33480 > vagrant-ubuntu-trusty-64.8882: Flags [P.], seq 2407287599:2407287763, ack 2114665125, win 58, options [nop,nop,TS val 4294713651 ecr 4294713630], length 164
12:11:25.056653 IP vagrant-ubuntu-trusty-64.8882 > 10.0.0.2.33480: Flags [.], ack 2407287763, win 120, options [nop,nop,TS val 4294713665 ecr 4294713651], length 0
12:11:25.081073 IP 10.0.0.2.33480 > vagrant-ubuntu-trusty-64.8882: Flags [P.], seq 2407287763:2407287927, ack 2114665125, win 58, options [nop,nop,TS val 4294713670 ecr 4294713652], length 164
12:11:25.081096 IP vagrant-ubuntu-trusty-64.8882 > 10.0.0.2.33480: Flags [.], ack 2407287927, win 122, options [nop,nop,TS val 4294713689 ecr 4294713670], length 0
12:11:25.100914 IP 10.0.0.2.33480 > vagrant-ubuntu-trusty-64.8882: Flags [P.], seq 2407287927:2407288091, ack 2114665125, win 58, options [nop,nop,TS val 4294713690 ecr 4294713665], length 164
12:11:25.100942 IP vagrant-ubuntu-trusty-64.8882 > 10.0.0.2.33480: Flags [.], ack 2407288091, win 124, options [nop,nop,TS val 4294713709 ecr 4294713690], length 0
12:11:25.118061 IP 10.0.0.2.33480 > vagrant-ubuntu-trusty-64.8882: Flags [P.], seq 2407288091:2407288255, ack 2114665125, win 58, options [nop,nop,TS val 4294713710 ecr 4294713689], length 164
12:11:25.118111 IP vagrant-ubuntu-trusty-64.8882 > 10.0.0.2.33480: Flags [.], ack 2407288255, win 126, options [nop,nop,TS val 4294713726 ecr 4294713710], length 0
12:11:25.138101 IP 10.0.0.2.33480 > vagrant-ubuntu-trusty-64.8882: Flags [P.], seq 2407288255:2407288419, ack 2114665125, win 58, options [nop,nop,TS val 4294713730 ecr 4294713709], length 164
12:11:25.138161 IP vagrant-ubuntu-trusty-64.8882 > 10.0.0.2.33480: Flags [.], ack 2407288419, win 128, options [nop,nop,TS val 4294713746 ecr 4294713730], length 0
12:11:25.152678 IP 10.0.0.2.33480 > vagrant-ubuntu-trusty-64.8882: Flags [P.], seq 2407288419:2407288583, ack 2114665125, win 58, options [nop,nop,TS val 4294713750 ecr 4294713726], length 164
12:11:25.152693 IP vagrant-ubuntu-trusty-64.8882 > 10.0.0.2.33480: Flags [.], ack 2407288583, win 130, options [nop,nop,TS val 4294713761 ecr 4294713750], length 0
12:11:25.174798 IP 10.0.0.2.33480 > vagrant-ubuntu-trusty-64.8882: Flags [P.], seq 2407288583:2407288747, ack 2114665125, win 58, options [nop,nop,TS val 4294713770 ecr 4294713746], length 164
12:11:25.174865 IP vagrant-ubuntu-trusty-64.8882 > 10.0.0.2.33480: Flags [.], ack 2407288747, win 132, options [nop,nop,TS val 4294713782 ecr 4294713770], length 0
12:11:25.192980 IP 10.0.0.2.33480 > vagrant-ubuntu-trusty-64.8882: Flags [P.], seq 2407288747:2407288911, ack 2114665125, win 58, options [nop,nop,TS val 4294713790 ecr 4294713761], length 164
12:11:25.193029 IP vagrant-ubuntu-trusty-64.8882 > 10.0.0.2.33480: Flags [.], ack 2407288911, win 135, options [nop,nop,TS val 4294713801 ecr 4294713790], length 0
12:11:25.213988 IP 10.0.0.2.33480 > vagrant-ubuntu-trusty-64.8882: Flags [P.], seq 2407288911:2407289075, ack 2114665125, win 58, options [nop,nop,TS val 4294713810 ecr 4294713782], length 164
12:11:25.214018 IP vagrant-ubuntu-trusty-64.8882 > 10.0.0.2.33480: Flags [.], ack 2407289075, win 137, options [nop,nop,TS val 4294713822 ecr 4294713810], length 0
12:11:25.236041 IP 10.0.0.2.33480 > vagrant-ubuntu-trusty-64.8882: Flags [P.], seq 2407289075:2407289239, ack 2114665125, win 58, options [nop,nop,TS val 4294713830 ecr 4294713801], length 164
12:11:25.236123 IP vagrant-ubuntu-trusty-64.8882 > 10.0.0.2.33480: Flags [.], ack 2407289239, win 139, options [nop,nop,TS val 4294713844 ecr 4294713830], length 0
12:11:25.253736 IP 10.0.0.2.33480 > vagrant-ubuntu-trusty-64.8882: Flags [P.], seq 2407289239:2407289403, ack 2114665125, win 58, options [nop,nop,TS val 4294713850 ecr 4294713822], length 164
12:11:25.253748 IP vagrant-ubuntu-trusty-64.8882 > 10.0.0.2.33480: Flags [.], ack 2407289403, win 141, options [nop,nop,TS val 4294713862 ecr 4294713850], length 0
12:11:25.275258 IP 10.0.0.2.33480 > vagrant-ubuntu-trusty-64.8882: Flags [P.], seq 2407289403:2407289567, ack 2114665125, win 58, options [nop,nop,TS val 4294713870 ecr 4294713844], length 164
12:11:25.275283 IP vagrant-ubuntu-trusty-64.8882 > 10.0.0.2.33480: Flags [.], ack 2407289567, win 143, options [nop,nop,TS val 4294713883 ecr 4294713870], length 0
12:11:25.294008 IP 10.0.0.2.33480 > vagrant-ubuntu-trusty-64.8882: Flags [P.], seq 2407289567:2407289731, ack 2114665125, win 58, options [nop,nop,TS val 4294713890 ecr 4294713862], length 164
12:11:25.294088 IP vagrant-ubuntu-trusty-64.8882 > 10.0.0.2.33480: Flags [.], ack 2407289731, win 145, options [nop,nop,TS val 4294713902 ecr 4294713890], length 0
12:11:25.314986 IP 10.0.0.2.33480 > vagrant-ubuntu-trusty-64.8882: Flags [P.], seq 2407289731:2407289895, ack 2114665125, win 58, options [nop,nop,TS val 4294713910 ecr 4294713883], length 164
12:11:25.314998 IP vagrant-ubuntu-trusty-64.8882 > 10.0.0.2.33480: Flags [.], ack 2407289895, win 147, options [nop,nop,TS val 4294713923 ecr 4294713910], length 0
12:11:25.336420 IP 10.0.0.2.33480 > vagrant-ubuntu-trusty-64.8882: Flags [P.], seq 2407289895:2407290059, ack 2114665125, win 58, options [nop,nop,TS val 4294713930 ecr 4294713902], length 164
12:11:25.336434 IP vagrant-ubuntu-trusty-64.8882 > 10.0.0.2.33480: Flags [.], ack 2407290059, win 149, options [nop,nop,TS val 4294713945 ecr 4294713930], length 0
12:11:25.357955 IP 10.0.0.2.33480 > vagrant-ubuntu-trusty-64.8882: Flags [P.], seq 2407290059:2407290223, ack 2114665125, win 58, options [nop,nop,TS val 4294713950 ecr 4294713923], length 164
12:11:25.357986 IP vagrant-ubuntu-trusty-64.8882 > 10.0.0.2.33480: Flags [.], ack 2407290223, win 151, options [nop,nop,TS val 4294713966 ecr 4294713950], length 0
12:11:25.376823 IP 10.0.0.2.33480 > vagrant-ubuntu-trusty-64.8882: Flags [P.], seq 2407290223:2407290387, ack 2114665125, win 58, options [nop,nop,TS val 4294713970 ecr 4294713945], length 164
12:11:25.376904 IP vagrant-ubuntu-trusty-64.8882 > 10.0.0.2.33480: Flags [.], ack 2407290387, win 153, options [nop,nop,TS val 4294713984 ecr 4294713970], length 0
12:11:25.398239 IP 10.0.0.2.33480 > vagrant-ubuntu-trusty-64.8882: Flags [P.], seq 2407290387:2407290551, ack 2114665125, win 58, options [nop,nop,TS val 4294713990 ecr 4294713966], length 164
12:11:25.398309 IP vagrant-ubuntu-trusty-64.8882 > 10.0.0.2.33480: Flags [.], ack 2407290551, win 155, options [nop,nop,TS val 4294714006 ecr 4294713990], length 0
12:11:25.416192 IP 10.0.0.2.33480 > vagrant-ubuntu-trusty-64.8882: Flags [P.], seq 2407290551:2407290715, ack 2114665125, win 58, options [nop,nop,TS val 4294714010 ecr 4294713984], length 164
12:11:25.416212 IP vagrant-ubuntu-trusty-64.8882 > 10.0.0.2.33480: Flags [.], ack 2407290715, win 158, options [nop,nop,TS val 4294714024 ecr 4294714010], length 0
12:11:25.438068 IP 10.0.0.2.33480 > vagrant-ubuntu-trusty-64.8882: Flags [P.], seq 2407290715:2407290879, ack 2114665125, win 58, options [nop,nop,TS val 4294714030 ecr 4294714006], length 164
12:11:25.438137 IP vagrant-ubuntu-trusty-64.8882 > 10.0.0.2.33480: Flags [.], ack 2407290879, win 160, options [nop,nop,TS val 4294714046 ecr 4294714030], length 0
12:11:25.458938 IP 10.0.0.2.33480 > vagrant-ubuntu-trusty-64.8882: Flags [P.], seq 2407290879:2407291043, ack 2114665125, win 58, options [nop,nop,TS val 4294714050 ecr 4294714024], length 164
12:11:25.458954 IP vagrant-ubuntu-trusty-64.8882 > 10.0.0.2.33480: Flags [.], ack 2407291043, win 162, options [nop,nop,TS val 4294714067 ecr 4294714050], length 0
12:11:25.478082 IP 10.0.0.2.33480 > vagrant-ubuntu-trusty-64.8882: Flags [P.], seq 2407291043:2407291207, ack 2114665125, win 58, options [nop,nop,TS val 4294714070 ecr 4294714046], length 164
12:11:25.478141 IP vagrant-ubuntu-trusty-64.8882 > 10.0.0.2.33480: Flags [.], ack 2407291207, win 164, options [nop,nop,TS val 4294714086 ecr 4294714070], length 0
12:11:25.496450 IP 10.0.0.2.33480 > vagrant-ubuntu-trusty-64.8882: Flags [P.], seq 2407291207:2407291371, ack 2114665125, win 58, options [nop,nop,TS val 4294714090 ecr 4294714067], length 164
12:11:25.496493 IP vagrant-ubuntu-trusty-64.8882 > 10.0.0.2.33480: Flags [.], ack 2407291371, win 166, options [nop,nop,TS val 4294714104 ecr 4294714090], length 0
12:11:25.521077 IP 10.0.0.2.33480 > vagrant-ubuntu-trusty-64.8882: Flags [P.], seq 2407291371:2407291535, ack 2114665125, win 58, options [nop,nop,TS val 4294714111 ecr 4294714086], length 164
12:11:25.521165 IP vagrant-ubuntu-trusty-64.8882 > 10.0.0.2.33480: Flags [.], ack 2407291535, win 168, options [nop,nop,TS val 4294714129 ecr 4294714111], length 0
12:11:25.539354 IP 10.0.0.2.33480 > vagrant-ubuntu-trusty-64.8882: Flags [P.], seq 2407291535:2407291699, ack 2114665125, win 58, options [nop,nop,TS val 4294714130 ecr 4294714104], length 164
12:11:25.539406 IP vagrant-ubuntu-trusty-64.8882 > 10.0.0.2.33480: Flags [.], ack 2407291699, win 170, options [nop,nop,TS val 4294714147 ecr 4294714130], length 0
12:11:25.561124 IP 10.0.0.2.33480 > vagrant-ubuntu-trusty-64.8882: Flags [P.], seq 2407291699:2407291863, ack 2114665125, win 58, options [nop,nop,TS val 4294714150 ecr 4294714129], length 164
12:11:25.561208 IP vagrant-ubuntu-trusty-64.8882 > 10.0.0.2.33480: Flags [.], ack 2407291863, win 172, options [nop,nop,TS val 4294714169 ecr 4294714150], length 0
12:11:25.582328 IP 10.0.0.2.33480 > vagrant-ubuntu-trusty-64.8882: Flags [P.], seq 2407291863:2407292027, ack 2114665125, win 58, options [nop,nop,TS val 4294714170 ecr 4294714147], length 164
12:11:25.582380 IP vagrant-ubuntu-trusty-64.8882 > 10.0.0.2.33480: Flags [.], ack 2407292027, win 174, options [nop,nop,TS val 4294714191 ecr 4294714170], length 0
12:11:25.600303 IP 10.0.0.2.33480 > vagrant-ubuntu-trusty-64.8882: Flags [P.], seq 2407292027:2407292191, ack 2114665125, win 58, options [nop,nop,TS val 4294714191 ecr 4294714169], length 164
12:11:25.600319 IP vagrant-ubuntu-trusty-64.8882 > 10.0.0.2.33480: Flags [.], ack 2407292191, win 176, options [nop,nop,TS val 4294714208 ecr 4294714191], length 0
12:11:25.621683 IP 10.0.0.2.33480 > vagrant-ubuntu-trusty-64.8882: Flags [P.], seq 2407292191:2407292355, ack 2114665125, win 58, options [nop,nop,TS val 4294714211 ecr 4294714191], length 164
12:11:25.621699 IP vagrant-ubuntu-trusty-64.8882 > 10.0.0.2.33480: Flags [.], ack 2407292355, win 178, options [nop,nop,TS val 4294714230 ecr 4294714211], length 0
12:11:25.640353 IP 10.0.0.2.33480 > vagrant-ubuntu-trusty-64.8882: Flags [P.], seq 2407292355:2407292519, ack 2114665125, win 58, options [nop,nop,TS val 4294714230 ecr 4294714208], length 164
12:11:25.640374 IP vagrant-ubuntu-trusty-64.8882 > 10.0.0.2.33480: Flags [.], ack 2407292519, win 181, options [nop,nop,TS val 4294714249 ecr 4294714230], length 0
12:11:25.662351 IP 10.0.0.2.33480 > vagrant-ubuntu-trusty-64.8882: Flags [P.], seq 2407292519:2407292683, ack 2114665125, win 58, options [nop,nop,TS val 4294714250 ecr 4294714230], length 164
12:11:25.662380 IP vagrant-ubuntu-trusty-64.8882 > 10.0.0.2.33480: Flags [.], ack 2407292683, win 183, options [nop,nop,TS val 4294714271 ecr 4294714250], length 0
12:11:25.680292 IP 10.0.0.2.33480 > vagrant-ubuntu-trusty-64.8882: Flags [P.], seq 2407292683:2407292847, ack 2114665125, win 58, options [nop,nop,TS val 4294714271 ecr 4294714249], length 164
12:11:25.680353 IP vagrant-ubuntu-trusty-64.8882 > 10.0.0.2.33480: Flags [.], ack 2407292847, win 185, options [nop,nop,TS val 4294714288 ecr 4294714271], length 0
12:11:25.701449 IP 10.0.0.2.33480 > vagrant-ubuntu-trusty-64.8882: Flags [P.], seq 2407292847:2407293011, ack 2114665125, win 58, options [nop,nop,TS val 4294714290 ecr 4294714271], length 164
12:11:25.701483 IP vagrant-ubuntu-trusty-64.8882 > 10.0.0.2.33480: Flags [.], ack 2407293011, win 187, options [nop,nop,TS val 4294714310 ecr 4294714290], length 0
12:11:25.723328 IP 10.0.0.2.33480 > vagrant-ubuntu-trusty-64.8882: Flags [P.], seq 2407293011:2407293175, ack 2114665125, win 58, options [nop,nop,TS val 4294714310 ecr 4294714288], length 164
12:11:25.723403 IP vagrant-ubuntu-trusty-64.8882 > 10.0.0.2.33480: Flags [.], ack 2407293175, win 189, options [nop,nop,TS val 4294714331 ecr 4294714310], length 0
12:11:25.744395 IP 10.0.0.2.33480 > vagrant-ubuntu-trusty-64.8882: Flags [P.], seq 2407293175:2407293339, ack 2114665125, win 58, options [nop,nop,TS val 4294714330 ecr 4294714310], length 164
12:11:25.744418 IP vagrant-ubuntu-trusty-64.8882 > 10.0.0.2.33480: Flags [.], ack 2407293339, win 191, options [nop,nop,TS val 4294714353 ecr 4294714330], length 0
12:11:25.762661 IP 10.0.0.2.33480 > vagrant-ubuntu-trusty-64.8882: Flags [P.], seq 2407293339:2407293503, ack 2114665125, win 58, options [nop,nop,TS val 4294714350 ecr 4294714331], length 164
12:11:25.762675 IP vagrant-ubuntu-trusty-64.8882 > 10.0.0.2.33480: Flags [.], ack 2407293503, win 193, options [nop,nop,TS val 4294714371 ecr 4294714350], length 0
12:11:25.784137 IP 10.0.0.2.33480 > vagrant-ubuntu-trusty-64.8882: Flags [P.], seq 2407293503:2407293667, ack 2114665125, win 58, options [nop,nop,TS val 4294714370 ecr 4294714353], length 164
12:11:25.784161 IP vagrant-ubuntu-trusty-64.8882 > 10.0.0.2.33480: Flags [.], ack 2407293667, win 195, options [nop,nop,TS val 4294714392 ecr 4294714370], length 0
12:11:25.802524 IP 10.0.0.2.33480 > vagrant-ubuntu-trusty-64.8882: Flags [P.], seq 2407293667:2407293831, ack 2114665125, win 58, options [nop,nop,TS val 4294714390 ecr 4294714371], length 164
12:11:25.802536 IP vagrant-ubuntu-trusty-64.8882 > 10.0.0.2.33480: Flags [.], ack 2407293831, win 197, options [nop,nop,TS val 4294714411 ecr 4294714390], length 0
12:11:25.824305 IP 10.0.0.2.33480 > vagrant-ubuntu-trusty-64.8882: Flags [P.], seq 2407293831:2407293995, ack 2114665125, win 58, options [nop,nop,TS val 4294714410 ecr 4294714392], length 164
12:11:25.824353 IP vagrant-ubuntu-trusty-64.8882 > 10.0.0.2.33480: Flags [.], ack 2407293995, win 199, options [nop,nop,TS val 4294714432 ecr 4294714410], length 0
12:11:25.842609 IP 10.0.0.2.33480 > vagrant-ubuntu-trusty-64.8882: Flags [P.], seq 2407293995:2407294159, ack 2114665125, win 58, options [nop,nop,TS val 4294714430 ecr 4294714411], length 164
12:11:25.842657 IP vagrant-ubuntu-trusty-64.8882 > 10.0.0.2.33480: Flags [.], ack 2407294159, win 202, options [nop,nop,TS val 4294714451 ecr 4294714430], length 0
12:11:25.863857 IP 10.0.0.2.33480 > vagrant-ubuntu-trusty-64.8882: Flags [P.], seq 2407294159:2407294323, ack 2114665125, win 58, options [nop,nop,TS val 4294714451 ecr 4294714432], length 164
12:11:25.863874 IP vagrant-ubuntu-trusty-64.8882 > 10.0.0.2.33480: Flags [.], ack 2407294323, win 204, options [nop,nop,TS val 4294714472 ecr 4294714451], length 0
12:11:25.882566 IP 10.0.0.2.33480 > vagrant-ubuntu-trusty-64.8882: Flags [P.], seq 2407294323:2407294487, ack 2114665125, win 58, options [nop,nop,TS val 4294714470 ecr 4294714451], length 164
12:11:25.882619 IP vagrant-ubuntu-trusty-64.8882 > 10.0.0.2.33480: Flags [.], ack 2407294487, win 206, options [nop,nop,TS val 4294714491 ecr 4294714470], length 0
12:11:25.903549 IP 10.0.0.2.33480 > vagrant-ubuntu-trusty-64.8882: Flags [P.], seq 2407294487:2407294651, ack 2114665125, win 58, options [nop,nop,TS val 4294714491 ecr 4294714472], length 164
12:11:25.903565 IP vagrant-ubuntu-trusty-64.8882 > 10.0.0.2.33480: Flags [.], ack 2407294651, win 208, options [nop,nop,TS val 4294714512 ecr 4294714491], length 0
12:11:25.924983 IP 10.0.0.2.33480 > vagrant-ubuntu-trusty-64.8882: Flags [P.], seq 2407294651:2407294815, ack 2114665125, win 58, options [nop,nop,TS val 4294714511 ecr 4294714491], length 164
12:11:25.924995 IP vagrant-ubuntu-trusty-64.8882 > 10.0.0.2.33480: Flags [.], ack 2407294815, win 210, options [nop,nop,TS val 4294714533 ecr 4294714511], length 0
12:11:25.944105 IP 10.0.0.2.33480 > vagrant-ubuntu-trusty-64.8882: Flags [P.], seq 2407294815:2407294979, ack 2114665125, win 58, options [nop,nop,TS val 4294714530 ecr 4294714512], length 164
12:11:25.944187 IP vagrant-ubuntu-trusty-64.8882 > 10.0.0.2.33480: Flags [.], ack 2407294979, win 212, options [nop,nop,TS val 4294714552 ecr 4294714530], length 0
12:11:25.968389 IP 10.0.0.2.33480 > vagrant-ubuntu-trusty-64.8882: Flags [P.], seq 2407294979:2407295143, ack 2114665125, win 58, options [nop,nop,TS val 4294714550 ecr 4294714533], length 164
12:11:25.968471 IP vagrant-ubuntu-trusty-64.8882 > 10.0.0.2.33480: Flags [.], ack 2407295143, win 214, options [nop,nop,TS val 4294714576 ecr 4294714550], length 0
12:11:25.986367 IP 10.0.0.2.33480 > vagrant-ubuntu-trusty-64.8882: Flags [P.], seq 2407295143:2407295307, ack 2114665125, win 58, options [nop,nop,TS val 4294714570 ecr 4294714552], length 164
12:11:25.986394 IP vagrant-ubuntu-trusty-64.8882 > 10.0.0.2.33480: Flags [.], ack 2407295307, win 216, options [nop,nop,TS val 4294714594 ecr 4294714570], length 0
12:11:26.008369 IP 10.0.0.2.33480 > vagrant-ubuntu-trusty-64.8882: Flags [P.], seq 2407295307:2407295471, ack 2114665125, win 58, options [nop,nop,TS val 4294714591 ecr 4294714576], length 164
12:11:26.008452 IP vagrant-ubuntu-trusty-64.8882 > 10.0.0.2.33480: Flags [.], ack 2407295471, win 218, options [nop,nop,TS val 4294714616 ecr 4294714591], length 0
12:11:26.026515 IP 10.0.0.2.33480 > vagrant-ubuntu-trusty-64.8882: Flags [P.], seq 2407295471:2407295635, ack 2114665125, win 58, options [nop,nop,TS val 4294714610 ecr 4294714594], length 164
12:11:26.026593 IP vagrant-ubuntu-trusty-64.8882 > 10.0.0.2.33480: Flags [.], ack 2407295635, win 220, options [nop,nop,TS val 4294714634 ecr 4294714610], length 0
12:11:26.047603 IP 10.0.0.2.33480 > vagrant-ubuntu-trusty-64.8882: Flags [P.], seq 2407295635:2407295799, ack 2114665125, win 58, options [nop,nop,TS val 4294714630 ecr 4294714616], length 164
12:11:26.047632 IP vagrant-ubuntu-trusty-64.8882 > 10.0.0.2.33480: Flags [.], ack 2407295799, win 222, options [nop,nop,TS val 4294714656 ecr 4294714630], length 0
12:11:26.066499 IP 10.0.0.2.33480 > vagrant-ubuntu-trusty-64.8882: Flags [P.], seq 2407295799:2407295963, ack 2114665125, win 58, options [nop,nop,TS val 4294714650 ecr 4294714634], length 164
12:11:26.066572 IP vagrant-ubuntu-trusty-64.8882 > 10.0.0.2.33480: Flags [.], ack 2407295963, win 225, options [nop,nop,TS val 4294714674 ecr 4294714650], length 0
12:11:26.087763 IP 10.0.0.2.33480 > vagrant-ubuntu-trusty-64.8882: Flags [P.], seq 2407295963:2407296127, ack 2114665125, win 58, options [nop,nop,TS val 4294714670 ecr 4294714656], length 164
12:11:26.087803 IP vagrant-ubuntu-trusty-64.8882 > 10.0.0.2.33480: Flags [.], ack 2407296127, win 227, options [nop,nop,TS val 4294714696 ecr 4294714670], length 0
12:11:26.105813 IP 10.0.0.2.33480 > vagrant-ubuntu-trusty-64.8882: Flags [P.], seq 2407296127:2407296291, ack 2114665125, win 58, options [nop,nop,TS val 4294714690 ecr 4294714674], length 164
12:11:26.105841 IP vagrant-ubuntu-trusty-64.8882 > 10.0.0.2.33480: Flags [.], ack 2407296291, win 229, options [nop,nop,TS val 4294714714 ecr 4294714690], length 0
12:11:26.127581 IP 10.0.0.2.33480 > vagrant-ubuntu-trusty-64.8882: Flags [P.], seq 2407296291:2407296455, ack 2114665125, win 58, options [nop,nop,TS val 4294714710 ecr 4294714696], length 164
12:11:26.127648 IP vagrant-ubuntu-trusty-64.8882 > 10.0.0.2.33480: Flags [.], ack 2407296455, win 231, options [nop,nop,TS val 4294714735 ecr 4294714710], length 0
12:11:26.145546 IP 10.0.0.2.33480 > vagrant-ubuntu-trusty-64.8882: Flags [P.], seq 2407296455:2407296619, ack 2114665125, win 58, options [nop,nop,TS val 4294714730 ecr 4294714714], length 164
12:11:26.145558 IP vagrant-ubuntu-trusty-64.8882 > 10.0.0.2.33480: Flags [.], ack 2407296619, win 233, options [nop,nop,TS val 4294714754 ecr 4294714730], length 0
12:11:26.167352 IP 10.0.0.2.33480 > vagrant-ubuntu-trusty-64.8882: Flags [P.], seq 2407296619:2407296783, ack 2114665125, win 58, options [nop,nop,TS val 4294714750 ecr 4294714735], length 164
12:11:26.167368 IP vagrant-ubuntu-trusty-64.8882 > 10.0.0.2.33480: Flags [.], ack 2407296783, win 235, options [nop,nop,TS val 4294714776 ecr 4294714750], length 0
12:11:26.185560 IP 10.0.0.2.33480 > vagrant-ubuntu-trusty-64.8882: Flags [P.], seq 2407296783:2407296947, ack 2114665125, win 58, options [nop,nop,TS val 4294714770 ecr 4294714754], length 164
12:11:26.185589 IP vagrant-ubuntu-trusty-64.8882 > 10.0.0.2.33480: Flags [.], ack 2407296947, win 237, options [nop,nop,TS val 4294714794 ecr 4294714770], length 0
12:11:26.207515 IP 10.0.0.2.33480 > vagrant-ubuntu-trusty-64.8882: Flags [P.], seq 2407296947:2407297111, ack 2114665125, win 58, options [nop,nop,TS val 4294714790 ecr 4294714776], length 164
12:11:26.207592 IP vagrant-ubuntu-trusty-64.8882 > 10.0.0.2.33480: Flags [.], ack 2407297111, win 239, options [nop,nop,TS val 4294714815 ecr 4294714790], length 0
12:11:26.225479 IP 10.0.0.2.33480 > vagrant-ubuntu-trusty-64.8882: Flags [P.], seq 2407297111:2407297275, ack 2114665125, win 58, options [nop,nop,TS val 4294714810 ecr 4294714794], length 164
12:11:26.225508 IP vagrant-ubuntu-trusty-64.8882 > 10.0.0.2.33480: Flags [.], ack 2407297275, win 241, options [nop,nop,TS val 4294714834 ecr 4294714810], length 0
12:11:26.250509 IP 10.0.0.2.33480 > vagrant-ubuntu-trusty-64.8882: Flags [P.], seq 2407297275:2407297439, ack 2114665125, win 58, options [nop,nop,TS val 4294714830 ecr 4294714815], length 164
12:11:26.250590 IP vagrant-ubuntu-trusty-64.8882 > 10.0.0.2.33480: Flags [.], ack 2407297439, win 243, options [nop,nop,TS val 4294714858 ecr 4294714830], length 0
12:11:26.268312 IP 10.0.0.2.33480 > vagrant-ubuntu-trusty-64.8882: Flags [P.], seq 2407297439:2407297603, ack 2114665125, win 58, options [nop,nop,TS val 4294714850 ecr 4294714834], length 164
12:11:26.268347 IP vagrant-ubuntu-trusty-64.8882 > 10.0.0.2.33480: Flags [.], ack 2407297603, win 245, options [nop,nop,TS val 4294714876 ecr 4294714850], length 0
12:11:26.289753 IP 10.0.0.2.33480 > vagrant-ubuntu-trusty-64.8882: Flags [P.], seq 2407297603:2407297767, ack 2114665125, win 58, options [nop,nop,TS val 4294714870 ecr 4294714858], length 164
12:11:26.289781 IP vagrant-ubuntu-trusty-64.8882 > 10.0.0.2.33480: Flags [.], ack 2407297767, win 248, options [nop,nop,TS val 4294714898 ecr 4294714870], length 0
12:11:26.311655 IP 10.0.0.2.33480 > vagrant-ubuntu-trusty-64.8882: Flags [P.], seq 2407297767:2407297931, ack 2114665125, win 58, options [nop,nop,TS val 4294714890 ecr 4294714876], length 164
12:11:26.311724 IP vagrant-ubuntu-trusty-64.8882 > 10.0.0.2.33480: Flags [.], ack 2407297931, win 250, options [nop,nop,TS val 4294714919 ecr 4294714890], length 0
12:11:26.329569 IP 10.0.0.2.33480 > vagrant-ubuntu-trusty-64.8882: Flags [P.], seq 2407297931:2407298095, ack 2114665125, win 58, options [nop,nop,TS val 4294714911 ecr 4294714898], length 164
12:11:26.329598 IP vagrant-ubuntu-trusty-64.8882 > 10.0.0.2.33480: Flags [.], ack 2407298095, win 252, options [nop,nop,TS val 4294714938 ecr 4294714911], length 0
12:11:26.350874 IP 10.0.0.2.33480 > vagrant-ubuntu-trusty-64.8882: Flags [P.], seq 2407298095:2407298259, ack 2114665125, win 58, options [nop,nop,TS val 4294714931 ecr 4294714898], length 164
12:11:26.350885 IP vagrant-ubuntu-trusty-64.8882 > 10.0.0.2.33480: Flags [.], ack 2407298259, win 254, options [nop,nop,TS val 4294714959 ecr 4294714931], length 0
12:11:26.369384 IP 10.0.0.2.33480 > vagrant-ubuntu-trusty-64.8882: Flags [P.], seq 2407298259:2407298423, ack 2114665125, win 58, options [nop,nop,TS val 4294714950 ecr 4294714938], length 164
12:11:26.369416 IP vagrant-ubuntu-trusty-64.8882 > 10.0.0.2.33480: Flags [.], ack 2407298423, win 256, options [nop,nop,TS val 4294714977 ecr 4294714950], length 0
12:11:26.390724 IP 10.0.0.2.33480 > vagrant-ubuntu-trusty-64.8882: Flags [P.], seq 2407298423:2407298587, ack 2114665125, win 58, options [nop,nop,TS val 4294714970 ecr 4294714938], length 164
12:11:26.390740 IP vagrant-ubuntu-trusty-64.8882 > 10.0.0.2.33480: Flags [.], ack 2407298587, win 258, options [nop,nop,TS val 4294714999 ecr 4294714970], length 0
12:11:26.409129 IP 10.0.0.2.33480 > vagrant-ubuntu-trusty-64.8882: Flags [P.], seq 2407298587:2407298751, ack 2114665125, win 58, options [nop,nop,TS val 4294714990 ecr 4294714977], length 164
12:11:26.409146 IP vagrant-ubuntu-trusty-64.8882 > 10.0.0.2.33480: Flags [.], ack 2407298751, win 260, options [nop,nop,TS val 4294715017 ecr 4294714990], length 0
12:11:26.430573 IP 10.0.0.2.33480 > vagrant-ubuntu-trusty-64.8882: Flags [P.], seq 2407298751:2407298915, ack 2114665125, win 58, options [nop,nop,TS val 4294715010 ecr 4294714999], length 164
12:11:26.430590 IP vagrant-ubuntu-trusty-64.8882 > 10.0.0.2.33480: Flags [.], ack 2407298915, win 262, options [nop,nop,TS val 4294715039 ecr 4294715010], length 0
12:11:26.449485 IP 10.0.0.2.33480 > vagrant-ubuntu-trusty-64.8882: Flags [P.], seq 2407298915:2407299079, ack 2114665125, win 58, options [nop,nop,TS val 4294715030 ecr 4294715017], length 164
12:11:26.449548 IP vagrant-ubuntu-trusty-64.8882 > 10.0.0.2.33480: Flags [.], ack 2407299079, win 264, options [nop,nop,TS val 4294715057 ecr 4294715030], length 0
12:11:26.470472 IP 10.0.0.2.33480 > vagrant-ubuntu-trusty-64.8882: Flags [P.], seq 2407299079:2407299243, ack 2114665125, win 58, options [nop,nop,TS val 4294715050 ecr 4294715039], length 164
12:11:26.470500 IP vagrant-ubuntu-trusty-64.8882 > 10.0.0.2.33480: Flags [.], ack 2407299243, win 266, options [nop,nop,TS val 4294715079 ecr 4294715050], length 0
12:11:26.488808 IP 10.0.0.2.33480 > vagrant-ubuntu-trusty-64.8882: Flags [P.], seq 2407299243:2407299407, ack 2114665125, win 58, options [nop,nop,TS val 4294715070 ecr 4294715057], length 164
12:11:26.488825 IP vagrant-ubuntu-trusty-64.8882 > 10.0.0.2.33480: Flags [.], ack 2407299407, win 269, options [nop,nop,TS val 4294715097 ecr 4294715070], length 0
12:11:26.510206 IP 10.0.0.2.33480 > vagrant-ubuntu-trusty-64.8882: Flags [P.], seq 2407299407:2407299571, ack 2114665125, win 58, options [nop,nop,TS val 4294715090 ecr 4294715079], length 164
12:11:26.510223 IP vagrant-ubuntu-trusty-64.8882 > 10.0.0.2.33480: Flags [.], ack 2407299571, win 271, options [nop,nop,TS val 4294715118 ecr 4294715090], length 0
12:11:26.531722 IP 10.0.0.2.33480 > vagrant-ubuntu-trusty-64.8882: Flags [P.], seq 2407299571:2407299735, ack 2114665125, win 58, options [nop,nop,TS val 4294715110 ecr 4294715097], length 164
12:11:26.531750 IP vagrant-ubuntu-trusty-64.8882 > 10.0.0.2.33480: Flags [.], ack 2407299735, win 273, options [nop,nop,TS val 4294715140 ecr 4294715110], length 0
12:11:26.553775 IP 10.0.0.2.33480 > vagrant-ubuntu-trusty-64.8882: Flags [P.], seq 2407299735:2407299899, ack 2114665125, win 58, options [nop,nop,TS val 4294715131 ecr 4294715118], length 164
12:11:26.553828 IP vagrant-ubuntu-trusty-64.8882 > 10.0.0.2.33480: Flags [.], ack 2407299899, win 275, options [nop,nop,TS val 4294715162 ecr 4294715131], length 0
12:11:26.571865 IP 10.0.0.2.33480 > vagrant-ubuntu-trusty-64.8882: Flags [P.], seq 2407299899:2407300063, ack 2114665125, win 58, options [nop,nop,TS val 4294715150 ecr 4294715118], length 164
12:11:26.571927 IP vagrant-ubuntu-trusty-64.8882 > 10.0.0.2.33480: Flags [.], ack 2407300063, win 277, options [nop,nop,TS val 4294715180 ecr 4294715150], length 0
12:11:26.592934 IP 10.0.0.2.33480 > vagrant-ubuntu-trusty-64.8882: Flags [P.], seq 2407300063:2407300227, ack 2114665125, win 58, options [nop,nop,TS val 4294715170 ecr 4294715140], length 164
12:11:26.592950 IP vagrant-ubuntu-trusty-64.8882 > 10.0.0.2.33480: Flags [.], ack 2407300227, win 279, options [nop,nop,TS val 4294715201 ecr 4294715170], length 0
12:11:26.611324 IP 10.0.0.2.33480 > vagrant-ubuntu-trusty-64.8882: Flags [P.], seq 2407300227:2407300391, ack 2114665125, win 58, options [nop,nop,TS val 4294715190 ecr 4294715162], length 164
12:11:26.611341 IP vagrant-ubuntu-trusty-64.8882 > 10.0.0.2.33480: Flags [.], ack 2407300391, win 281, options [nop,nop,TS val 4294715219 ecr 4294715190], length 0
12:11:26.632754 IP 10.0.0.2.33480 > vagrant-ubuntu-trusty-64.8882: Flags [P.], seq 2407300391:2407300555, ack 2114665125, win 58, options [nop,nop,TS val 4294715210 ecr 4294715180], length 164
12:11:26.632770 IP vagrant-ubuntu-trusty-64.8882 > 10.0.0.2.33480: Flags [.], ack 2407300555, win 283, options [nop,nop,TS val 4294715241 ecr 4294715210], length 0
12:11:26.654281 IP 10.0.0.2.33480 > vagrant-ubuntu-trusty-64.8882: Flags [P.], seq 2407300555:2407300719, ack 2114665125, win 58, options [nop,nop,TS val 4294715230 ecr 4294715219], length 164
12:11:26.654297 IP vagrant-ubuntu-trusty-64.8882 > 10.0.0.2.33480: Flags [.], ack 2407300719, win 285, options [nop,nop,TS val 4294715262 ecr 4294715230], length 0
12:11:26.672585 IP 10.0.0.2.33480 > vagrant-ubuntu-trusty-64.8882: Flags [P.], seq 2407300719:2407300883, ack 2114665125, win 58, options [nop,nop,TS val 4294715250 ecr 4294715219], length 164
12:11:26.672597 IP vagrant-ubuntu-trusty-64.8882 > 10.0.0.2.33480: Flags [.], ack 2407300883, win 287, options [nop,nop,TS val 4294715281 ecr 4294715250], length 0
12:11:26.694445 IP 10.0.0.2.33480 > vagrant-ubuntu-trusty-64.8882: Flags [P.], seq 2407300883:2407301047, ack 2114665125, win 58, options [nop,nop,TS val 4294715271 ecr 4294715241], length 164
12:11:26.694548 IP vagrant-ubuntu-trusty-64.8882 > 10.0.0.2.33480: Flags [.], ack 2407301047, win 289, options [nop,nop,TS val 4294715302 ecr 4294715271], length 0
12:11:26.712790 IP 10.0.0.2.33480 > vagrant-ubuntu-trusty-64.8882: Flags [P.], seq 2407301047:2407301211, ack 2114665125, win 58, options [nop,nop,TS val 4294715290 ecr 4294715262], length 164
12:11:26.712839 IP vagrant-ubuntu-trusty-64.8882 > 10.0.0.2.33480: Flags [.], ack 2407301211, win 292, options [nop,nop,TS val 4294715321 ecr 4294715290], length 0
12:11:26.734356 IP 10.0.0.2.33480 > vagrant-ubuntu-trusty-64.8882: Flags [P.], seq 2407301211:2407301375, ack 2114665125, win 58, options [nop,nop,TS val 4294715310 ecr 4294715281], length 164
12:11:26.734468 IP vagrant-ubuntu-trusty-64.8882 > 10.0.0.2.33480: Flags [.], ack 2407301375, win 294, options [nop,nop,TS val 4294715342 ecr 4294715310], length 0
12:11:26.753766 IP 10.0.0.2.33480 > vagrant-ubuntu-trusty-64.8882: Flags [P.], seq 2407301375:2407301539, ack 2114665125, win 58, options [nop,nop,TS val 4294715330 ecr 4294715302], length 164
