12:11:24.501565 IP vagrant-ubuntu-trusty-64.33480 > 10.0.0.1.8882: Flags [P.], seq 2407283171:2407283335, ack 2114665125, win 58, options [nop,nop,TS val 4294713110 ecr 4294713080], length 164
12:11:24.503378 IP 10.0.0.1.8882 > vagrant-ubuntu-trusty-64.33480: Flags [.], ack 2407283171, win 63, options [nop,nop,TS val 4294713101 ecr 4294713090], length 0
12:11:24.521587 IP vagrant-ubuntu-trusty-64.33480 > 10.0.0.1.8882: Flags [P.], seq 2407283335:2407283499, ack 2114665125, win 58, options [nop,nop,TS val 4294713130 ecr 4294713101], length 164
12:11:24.522877 IP 10.0.0.1.8882 > vagrant-ubuntu-trusty-64.33480: Flags [.], ack 2407283335, win 65, options [nop,nop,TS val 4294713120 ecr 4294713110], length 0
12:11:24.541567 IP vagrant-ubuntu-trusty-64.33480 > 10.0.0.1.8882: Flags [P.], seq 2407283499:2407283663, ack 2114665125, win 58, options [nop,nop,TS val 4294713150 ecr 4294713120], length 164
12:11:24.542769 IP 10.0.0.1.8882 > vagrant-ubuntu-trusty-64.33480: Flags [.], ack 2407283499, win 68, options [nop,nop,TS val 4294713140 ecr 4294713130], length 0
12:11:24.561749 IP 10.0.0.1.8882 > vagrant-ubuntu-trusty-64.33480: Flags [.], ack 2407283663, win 70, options [nop,nop,TS val 4294713160 ecr 4294713150], length 0
12:11:24.561811 IP vagrant-ubuntu-trusty-64.33480 > 10.0.0.1.8882: Flags [P.], seq 2407283663:2407283827, ack 2114665125, win 58, options [nop,nop,TS val 4294713170 ecr 4294713160], length 164
12:11:24.582881 IP 10.0.0.1.8882 > vagrant-ubuntu-trusty-64.33480: Flags [.], ack 2407283827, win 72, options [nop,nop,TS val 4294713180 ecr 4294713170], length 0
12:11:24.582977 IP vagrant-ubuntu-trusty-64.33480 > 10.0.0.1.8882: Flags [P.], seq 2407283827:2407283991, ack 2114665125, win 58, options [nop,nop,TS val 4294713191 ecr 4294713160], length 164
12:11:24.602649 IP vagrant-ubuntu-trusty-64.33480 > 10.0.0.1.8882: Flags [P.], seq 2407283991:2407284155, ack 2114665125, win 58, options [nop,nop,TS val 4294713211 ecr 4294713180], length 164
12:11:24.603356 IP 10.0.0.1.8882 > vagrant-ubuntu-trusty-64.33480: Flags [.], ack 2407283991, win 74, options [nop,nop,TS val 4294713201 ecr 4294713191], length 0
12:11:24.621758 IP vagrant-ubuntu-trusty-64.33480 > 10.0.0.1.8882: Flags [P.], seq 2407284155:2407284319, ack 2114665125, win 58, options [nop,nop,TS val 4294713230 ecr 4294713201], length 164
12:11:24.623876 IP 10.0.0.1.8882 > vagrant-ubuntu-trusty-64.33480: Flags [.], ack 2407284155, win 76, options [nop,nop,TS val 4294713222 ecr 4294713211], length 0
12:11:24.641587 IP vagrant-ubuntu-trusty-64.33480 > 10.0.0.1.8882: Flags [P.], seq 2407284319:2407284483, ack 2114665125, win 58, options [nop,nop,TS val 4294713250 ecr 4294713222], length 164
12:11:24.642786 IP 10.0.0.1.8882 > vagrant-ubuntu-trusty-64.33480: Flags [.], ack 2407284319, win 78, options [nop,nop,TS val 4294713240 ecr 4294713230], length 0
12:11:24.661687 IP vagrant-ubuntu-trusty-64.33480 > 10.0.0.1.8882: Flags [P.], seq 2407284483:2407284647, ack 2114665125, win 58, options [nop,nop,TS val 4294713270 ecr 4294713240], length 164
12:11:24.663137 IP 10.0.0.1.8882 > vagrant-ubuntu-trusty-64.33480: Flags [.], ack 2407284483, win 80, options [nop,nop,TS val 4294713260 ecr 4294713250], length 0
12:11:24.681695 IP vagrant-ubuntu-trusty-64.33480 > 10.0.0.1.8882: Flags [P.], seq 2407284647:2407284811, ack 2114665125, win 58, options [nop,nop,TS val 4294713290 ecr 4294713260], length 164
12:11:24.681873 IP 10.0.0.1.8882 > vagrant-ubuntu-trusty-64.33480: Flags [.], ack 2407284647, win 82, options [nop,nop,TS val 4294713280 ecr 4294713270], length 0
12:11:24.701572 IP vagrant-ubuntu-trusty-64.33480 > 10.0.0.1.8882: Flags [P.], seq 2407284811:2407284975, ack 2114665125, win 58, options [nop,nop,TS val 4294713310 ecr 4294713280], length 164
12:11:24.709906 IP 10.0.0.1.8882 > vagrant-ubuntu-trusty-64.33480: Flags [.], ack 2407284811, win 84, options [nop,nop,TS val 4294713307 ecr 4294713290], length 0
12:11:24.722165 IP vagrant-ubuntu-trusty-64.33480 > 10.0.0.1.8882: Flags [P.], seq 2407284975:2407285139, ack 2114665125, win 58, options [nop,nop,TS val 4294713330 ecr 4294713307], length 164
12:11:24.732564 IP 10.0.0.1.8882 > vagrant-ubuntu-trusty-64.33480: Flags [.], ack 2407284975, win 86, options [nop,nop,TS val 4294713330 ecr 4294713310], length 0
12:11:24.741669 IP vagrant-ubuntu-trusty-64.33480 > 10.0.0.1.8882: Flags [P.], seq 2407285139:2407285303, ack 2114665125, win 58, options [nop,nop,TS val 4294713350 ecr 4294713330], length 164
12:11:24.759125 IP 10.0.0.1.8882 > vagrant-ubuntu-trusty-64.33480: Flags [.], ack 2407285139, win 88, options [nop,nop,TS val 4294713357 ecr 4294713330], length 0
12:11:24.762029 IP vagrant-ubuntu-trusty-64.33480 > 10.0.0.1.8882: Flags [P.], seq 2407285303:2407285467, ack 2114665125, win 58, options [nop,nop,TS val 4294713370 ecr 4294713357], length 164
12:11:24.781719 IP vagrant-ubuntu-trusty-64.33480 > 10.0.0.1.8882: Flags [P.], seq 2407285467:2407285631, ack 2114665125, win 58, options [nop,nop,TS val 4294713390 ecr 4294713357], length 164
12:11:24.801987 IP vagrant-ubuntu-trusty-64.33480 > 10.0.0.1.8882: Flags [P.], seq 2407285631:2407285795, ack 2114665125, win 58, options [nop,nop,TS val 4294713410 ecr 4294713357], length 164
12:11:24.810931 IP 10.0.0.1.8882 > vagrant-ubuntu-trusty-64.33480: Flags [.], ack 2407285139, win 91, options [nop,nop,TS val 4294713409 ecr 4294713330,nop,nop,sack 1 {2407285303:2407285467}], length 0
12:11:24.821574 IP vagrant-ubuntu-trusty-64.33480 > 10.0.0.1.8882: Flags [P.], seq 2407285795:2407285959, ack 2114665125, win 58, options [nop,nop,TS val 4294713430 ecr 4294713409], length 164
12:11:24.830028 IP 10.0.0.1.8882 > vagrant-ubuntu-trusty-64.33480: Flags [.], ack 2407285139, win 93, options [nop,nop,TS val 4294713427 ecr 4294713330,nop,nop,sack 1 {2407285303:2407285631}], length 0
12:11:24.840130 IP 10.0.0.1.8882 > vagrant-ubuntu-trusty-64.33480: Flags [.], ack 2407285139, win 95, options [nop,nop,TS val 4294713438 ecr 4294713330,nop,nop,sack 1 {2407285303:2407285795}], length 0
12:11:24.840173 IP vagrant-ubuntu-trusty-64.33480 > 10.0.0.1.8882: Flags [P.], seq 2407285139:2407285303, ack 2114665125, win 58, options [nop,nop,TS val 4294713448 ecr 4294713438], length 164
12:11:24.841575 IP vagrant-ubuntu-trusty-64.33480 > 10.0.0.1.8882: Flags [P.], seq 2407285959:2407286123, ack 2114665125, win 58, options [nop,nop,TS val 4294713450 ecr 4294713438], length 164
12:11:24.876903 IP 10.0.0.1.8882 > vagrant-ubuntu-trusty-64.33480: Flags [.], ack 2407285139, win 97, options [nop,nop,TS val 4294713473 ecr 4294713330,nop,nop,sack 2 {2407285959:2407286123}{2407285303:2407285795}], length 0
12:11:24.877071 IP vagrant-ubuntu-trusty-64.33480 > 10.0.0.1.8882: Flags [P.], seq 2407285139:2407285303, ack 2114665125, win 58, options [nop,nop,TS val 4294713484 ecr 4294713473], length 164
12:11:24.877151 IP vagrant-ubuntu-trusty-64.33480 > 10.0.0.1.8882: Flags [P.], seq 2407286123:2407286287, ack 2114665125, win 58, options [nop,nop,TS val 4294713484 ecr 4294713473], length 164
12:11:24.906136 IP 10.0.0.1.8882 > vagrant-ubuntu-trusty-64.33480: Flags [.], ack 2407285795, win 99, options [nop,nop,TS val 4294713504 ecr 4294713484,nop,nop,sack 1 {2407285959:2407286123}], length 0
12:11:24.906357 IP vagrant-ubuntu-trusty-64.33480 > 10.0.0.1.8882: Flags [P.], seq 2407286287:2407286615, ack 2114665125, win 58, options [nop,nop,TS val 4294713514 ecr 4294713504], length 328
12:11:24.906152 IP 10.0.0.1.8882 > vagrant-ubuntu-trusty-64.33480: Flags [.], ack 2407285795, win 101, options [nop,nop,TS val 4294713504 ecr 4294713484,nop,nop,sack 1 {2407285959:2407286287}], length 0
12:11:24.906405 IP vagrant-ubuntu-trusty-64.33480 > 10.0.0.1.8882: Flags [P.], seq 2407285795:2407285959, ack 2114665125, win 58, options [nop,nop,TS val 4294713515 ecr 4294713504], length 164
12:11:24.921583 IP vagrant-ubuntu-trusty-64.33480 > 10.0.0.1.8882: Flags [P.], seq 2407286615:2407286779, ack 2114665125, win 58, options [nop,nop,TS val 4294713530 ecr 4294713504], length 164
12:11:24.938182 IP 10.0.0.1.8882 > vagrant-ubuntu-trusty-64.33480: Flags [.], ack 2407285795, win 103, options [nop,nop,TS val 4294713534 ecr 4294713484,nop,nop,sack 1 {2407285959:2407286615}], length 0
12:11:24.942334 IP vagrant-ubuntu-trusty-64.33480 > 10.0.0.1.8882: Flags [P.], seq 2407286779:2407286943, ack 2114665125, win 58, options [nop,nop,TS val 4294713550 ecr 4294713534], length 164
12:11:24.962196 IP vagrant-ubuntu-trusty-64.33480 > 10.0.0.1.8882: Flags [P.], seq 2407286943:2407287107, ack 2114665125, win 58, options [nop,nop,TS val 4294713570 ecr 4294713534], length 164
12:11:24.981688 IP 10.0.0.1.8882 > vagrant-ubuntu-trusty-64.33480: Flags [.], ack 2407285795, win 105, options [nop,nop,TS val 4294713580 ecr 4294713484,nop,nop,sack 2 {2407286779:2407286943}{2407285959:2407286615}], length 0
12:11:24.981797 IP vagrant-ubuntu-trusty-64.33480 > 10.0.0.1.8882: Flags [P.], seq 2407285795:2407285959, ack 2114665125, win 58, options [nop,nop,TS val 4294713590 ecr 4294713580], length 164
12:11:24.981831 IP vagrant-ubuntu-trusty-64.33480 > 10.0.0.1.8882: Flags [P.], seq 2407287107:2407287271, ack 2114665125, win 58, options [nop,nop,TS val 4294713590 ecr 4294713580], length 164
12:11:24.991045 IP 10.0.0.1.8882 > vagrant-ubuntu-trusty-64.33480: Flags [.], ack 2407285795, win 107, options [nop,nop,TS val 4294713587 ecr 4294713484,nop,nop,sack 2 {2407286779:2407287107}{2407285959:2407286615}], length 0
12:11:24.991190 IP vagrant-ubuntu-trusty-64.33480 > 10.0.0.1.8882: Flags [P.], seq 2407286615:2407286779, ack 2114665125, win 58, options [nop,nop,TS val 4294713599 ecr 4294713587], length 164
12:11:25.001581 IP vagrant-ubuntu-trusty-64.33480 > 10.0.0.1.8882: Flags [P.], seq 2407287271:2407287435, ack 2114665125, win 58, options [nop,nop,TS val 4294713610 ecr 4294713587], length 164
12:11:25.011050 IP 10.0.0.1.8882 > vagrant-ubuntu-trusty-64.33480: Flags [.], ack 2407286615, win 109, options [nop,nop,TS val 4294713609 ecr 4294713590,nop,nop,sack 1 {2407286779:2407287107}], length 0
12:11:25.011116 IP 10.0.0.1.8882 > vagrant-ubuntu-trusty-64.33480: Flags [.], ack 2407286615, win 111, options [nop,nop,TS val 4294713609 ecr 4294713590,nop,nop,sack 1 {2407286779:2407287271}], length 0
12:11:25.018816 IP 10.0.0.1.8882 > vagrant-ubuntu-trusty-64.33480: Flags [.], ack 2407287271, win 114, options [nop,nop,TS val 4294713616 ecr 4294713599], length 0
12:11:25.022361 IP vagrant-ubuntu-trusty-64.33480 > 10.0.0.1.8882: Flags [P.], seq 2407287435:2407287599, ack 2114665125, win 58, options [nop,nop,TS val 4294713630 ecr 4294713616], length 164
12:11:25.032213 IP 10.0.0.1.8882 > vagrant-ubuntu-trusty-64.33480: Flags [.], ack 2407287435, win 116, options [nop,nop,TS val 4294713630 ecr 4294713610], length 0
12:11:25.042351 IP vagrant-ubuntu-trusty-64.33480 > 10.0.0.1.8882: Flags [P.], seq 2407287599:2407287763, ack 2114665125, win 58, options [nop,nop,TS val 4294713651 ecr 4294713630], length 164
12:11:25.056100 IP 10.0.0.1.8882 > vagrant-ubuntu-trusty-64.33480: Flags [.], ack 2407287599, win 118, options [nop,nop,TS val 4294713652 ecr 4294713630], length 0
12:11:25.062150 IP vagrant-ubuntu-trusty-64.33480 > 10.0.0.1.8882: Flags [P.], seq 2407287763:2407287927, ack 2114665125, win 58, options [nop,nop,TS val 4294713670 ecr 4294713652], length 164
12:11:25.067188 IP 10.0.0.1.8882 > vagrant-ubuntu-trusty-64.33480: Flags [.], ack 2407287763, win 120, options [nop,nop,TS val 4294713665 ecr 4294713651], length 0
12:11:25.081546 IP vagrant-ubuntu-trusty-64.33480 > 10.0.0.1.8882: Flags [P.], seq 2407287927:2407288091, ack 2114665125, win 58, options [nop,nop,TS val 4294713690 ecr 4294713665], length 164
12:11:25.091196 IP 10.0.0.1.8882 > vagrant-ubuntu-trusty-64.33480: Flags [.], ack 2407287927, win 122, options [nop,nop,TS val 4294713689 ecr 4294713670], length 0
12:11:25.101545 IP vagrant-ubuntu-trusty-64.33480 > 10.0.0.1.8882: Flags [P.], seq 2407288091:2407288255, ack 2114665125, win 58, options [nop,nop,TS val 4294713710 ecr 4294713689], length 164
12:11:25.111167 IP 10.0.0.1.8882 > vagrant-ubuntu-trusty-64.33480: Flags [.], ack 2407288091, win 124, options [nop,nop,TS val 4294713709 ecr 4294713690], length 0
12:11:25.122306 IP vagrant-ubuntu-trusty-64.33480 > 10.0.0.1.8882: Flags [P.], seq 2407288255:2407288419, ack 2114665125, win 58, options [nop,nop,TS val 4294713730 ecr 4294713709], length 164
12:11:25.129037 IP 10.0.0.1.8882 > vagrant-ubuntu-trusty-64.33480: Flags [.], ack 2407288255, win 126, options [nop,nop,TS val 4294713726 ecr 4294713710], length 0
12:11:25.142061 IP vagrant-ubuntu-trusty-64.33480 > 10.0.0.1.8882: Flags [P.], seq 2407288419:2407288583, ack 2114665125, win 58, options [nop,nop,TS val 4294713750 ecr 4294713726], length 164
12:11:25.148830 IP 10.0.0.1.8882 > vagrant-ubuntu-trusty-64.33480: Flags [.], ack 2407288419, win 128, options [nop,nop,TS val 4294713746 ecr 4294713730], length 0
12:11:25.162112 IP vagrant-ubuntu-trusty-64.33480 > 10.0.0.1.8882: Flags [P.], seq 2407288583:2407288747, ack 2114665125, win 58, options [nop,nop,TS val 4294713770 ecr 4294713746], length 164
12:11:25.162765 IP 10.0.0.1.8882 > vagrant-ubuntu-trusty-64.33480: Flags [.], ack 2407288583, win 130, options [nop,nop,TS val 4294713761 ecr 4294713750], length 0
12:11:25.181550 IP vagrant-ubuntu-trusty-64.33480 > 10.0.0.1.8882: Flags [P.], seq 2407288747:2407288911, ack 2114665125, win 58, options [nop,nop,TS val 4294713790 ecr 4294713761], length 164
12:11:25.185122 IP 10.0.0.1.8882 > vagrant-ubuntu-trusty-64.33480: Flags [.], ack 2407288747, win 132, options [nop,nop,TS val 4294713782 ecr 4294713770], length 0
12:11:25.202323 IP vagrant-ubuntu-trusty-64.33480 > 10.0.0.1.8882: Flags [P.], seq 2407288911:2407289075, ack 2114665125, win 58, options [nop,nop,TS val 4294713810 ecr 4294713782], length 164
12:11:25.203621 IP 10.0.0.1.8882 > vagrant-ubuntu-trusty-64.33480: Flags [.], ack 2407288911, win 135, options [nop,nop,TS val 4294713801 ecr 4294713790], length 0
12:11:25.222069 IP vagrant-ubuntu-trusty-64.33480 > 10.0.0.1.8882: Flags [P.], seq 2407289075:2407289239, ack 2114665125, win 58, options [nop,nop,TS val 4294713830 ecr 4294713801], length 164
12:11:25.224127 IP 10.0.0.1.8882 > vagrant-ubuntu-trusty-64.33480: Flags [.], ack 2407289075, win 137, options [nop,nop,TS val 4294713822 ecr 4294713810], length 0
12:11:25.242322 IP vagrant-ubuntu-trusty-64.33480 > 10.0.0.1.8882: Flags [P.], seq 2407289239:2407289403, ack 2114665125, win 58, options [nop,nop,TS val 4294713850 ecr 4294713822], length 164
12:11:25.247016 IP 10.0.0.1.8882 > vagrant-ubuntu-trusty-64.33480: Flags [.], ack 2407289239, win 139, options [nop,nop,TS val 4294713844 ecr 4294713830], length 0
12:11:25.262045 IP vagrant-ubuntu-trusty-64.33480 > 10.0.0.1.8882: Flags [P.], seq 2407289403:2407289567, ack 2114665125, win 58, options [nop,nop,TS val 4294713870 ecr 4294713844], length 164
12:11:25.263868 IP 10.0.0.1.8882 > vagrant-ubuntu-trusty-64.33480: Flags [.], ack 2407289403, win 141, options [nop,nop,TS val 4294713862 ecr 4294713850], length 0
12:11:25.282326 IP vagrant-ubuntu-trusty-64.33480 > 10.0.0.1.8882: Flags [P.], seq 2407289567:2407289731, ack 2114665125, win 58, options [nop,nop,TS val 4294713890 ecr 4294713862], length 164
12:11:25.285362 IP 10.0.0.1.8882 > vagrant-ubuntu-trusty-64.33480: Flags [.], ack 2407289567, win 143, options [nop,nop,TS val 4294713883 ecr 4294713870], length 0
12:11:25.301983 IP vagrant-ubuntu-trusty-64.33480 > 10.0.0.1.8882: Flags [P.], seq 2407289731:2407289895, ack 2114665125, win 58, options [nop,nop,TS val 4294713910 ecr 4294713883], length 164
12:11:25.304896 IP 10.0.0.1.8882 > vagrant-ubuntu-trusty-64.33480: Flags [.], ack 2407289731, win 145, options [nop,nop,TS val 4294713902 ecr 4294713890], length 0
12:11:25.322186 IP vagrant-ubuntu-trusty-64.33480 > 10.0.0.1.8882: Flags [P.], seq 2407289895:2407290059, ack 2114665125, win 58, options [nop,nop,TS val 4294713930 ecr 4294713902], length 164
12:11:25.325365 IP 10.0.0.1.8882 > vagrant-ubuntu-trusty-64.33480: Flags [.], ack 2407289895, win 147, options [nop,nop,TS val 4294713923 ecr 4294713910], length 0
12:11:25.342141 IP vagrant-ubuntu-trusty-64.33480 > 10.0.0.1.8882: Flags [P.], seq 2407290059:2407290223, ack 2114665125, win 58, options [nop,nop,TS val 4294713950 ecr 4294713923], length 164
12:11:25.346526 IP 10.0.0.1.8882 > vagrant-ubuntu-trusty-64.33480: Flags [.], ack 2407290059, win 149, options [nop,nop,TS val 4294713945 ecr 4294713930], length 0
12:11:25.361571 IP vagrant-ubuntu-trusty-64.33480 > 10.0.0.1.8882: Flags [P.], seq 2407290223:2407290387, ack 2114665125, win 58, options [nop,nop,TS val 4294713970 ecr 4294713945], length 164
12:11:25.368884 IP 10.0.0.1.8882 > vagrant-ubuntu-trusty-64.33480: Flags [.], ack 2407290223, win 151, options [nop,nop,TS val 4294713966 ecr 4294713950], length 0
12:11:25.382117 IP vagrant-ubuntu-trusty-64.33480 > 10.0.0.1.8882: Flags [P.], seq 2407290387:2407290551, ack 2114665125, win 58, options [nop,nop,TS val 4294713990 ecr 4294713966], length 164
12:11:25.387063 IP 10.0.0.1.8882 > vagrant-ubuntu-trusty-64.33480: Flags [.], ack 2407290387, win 153, options [nop,nop,TS val 4294713984 ecr 4294713970], length 0
12:11:25.402130 IP vagrant-ubuntu-trusty-64.33480 > 10.0.0.1.8882: Flags [P.], seq 2407290551:2407290715, ack 2114665125, win 58, options [nop,nop,TS val 4294714010 ecr 4294713984], length 164
12:11:25.409258 IP 10.0.0.1.8882 > vagrant-ubuntu-trusty-64.33480: Flags [.], ack 2407290551, win 155, options [nop,nop,TS val 4294714006 ecr 4294713990], length 0
12:11:25.422248 IP vagrant-ubuntu-trusty-64.33480 > 10.0.0.1.8882: Flags [P.], seq 2407290715:2407290879, ack 2114665125, win 58, options [nop,nop,TS val 4294714030 ecr 4294714006], length 164
12:11:25.426329 IP 10.0.0.1.8882 > vagrant-ubuntu-trusty-64.33480: Flags [.], ack 2407290715, win 158, options [nop,nop,TS val 4294714024 ecr 4294714010], length 0
12:11:25.442101 IP vagrant-ubuntu-trusty-64.33480 > 10.0.0.1.8882: Flags [P.], seq 2407290879:2407291043, ack 2114665125, win 58, options [nop,nop,TS val 4294714050 ecr 4294714024], length 164
12:11:25.448347 IP 10.0.0.1.8882 > vagrant-ubuntu-trusty-64.33480: Flags [.], ack 2407290879, win 160, options [nop,nop,TS val 4294714046 ecr 4294714030], length 0
12:11:25.462246 IP vagrant-ubuntu-trusty-64.33480 > 10.0.0.1.8882: Flags [P.], seq 2407291043:2407291207, ack 2114665125, win 58, options [nop,nop,TS val 4294714070 ecr 4294714046], length 164
12:11:25.469069 IP 10.0.0.1.8882 > vagrant-ubuntu-trusty-64.33480: Flags [.], ack 2407291043, win 162, options [nop,nop,TS val 4294714067 ecr 4294714050], length 0
12:11:25.481539 IP vagrant-ubuntu-trusty-64.33480 > 10.0.0.1.8882: Flags [P.], seq 2407291207:2407291371, ack 2114665125, win 58, options [nop,nop,TS val 4294714090 ecr 4294714067], length 164
12:11:25.489312 IP 10.0.0.1.8882 > vagrant-ubuntu-trusty-64.33480: Flags [.], ack 2407291207, win 164, options [nop,nop,TS val 4294714086 ecr 4294714070], length 0
12:11:25.502400 IP vagrant-ubuntu-trusty-64.33480 > 10.0.0.1.8882: Flags [P.], seq 2407291371:2407291535, ack 2114665125, win 58, options [nop,nop,TS val 4294714111 ecr 4294714086], length 164
12:11:25.506594 IP 10.0.0.1.8882 > vagrant-ubuntu-trusty-64.33480: Flags [.], ack 2407291371, win 166, options [nop,nop,TS val 4294714104 ecr 4294714090], length 0
12:11:25.521538 IP vagrant-ubuntu-trusty-64.33480 > 10.0.0.1.8882: Flags [P.], seq 2407291535:2407291699, ack 2114665125, win 58, options [nop,nop,TS val 4294714130 ecr 4294714104], length 164
12:11:25.531333 IP 10.0.0.1.8882 > vagrant-ubuntu-trusty-64.33480: Flags [.], ack 2407291535, win 168, options [nop,nop,TS val 4294714129 ecr 4294714111], length 0
12:11:25.542392 IP vagrant-ubuntu-trusty-64.33480 > 10.0.0.1.8882: Flags [P.], seq 2407291699:2407291863, ack 2114665125, win 58, options [nop,nop,TS val 4294714150 ecr 4294714129], length 164
12:11:25.550207 IP 10.0.0.1.8882 > vagrant-ubuntu-trusty-64.33480: Flags [.], ack 2407291699, win 170, options [nop,nop,TS val 4294714147 ecr 4294714130], length 0
12:11:25.561554 IP vagrant-ubuntu-trusty-64.33480 > 10.0.0.1.8882: Flags [P.], seq 2407291863:2407292027, ack 2114665125, win 58, options [nop,nop,TS val 4294714170 ecr 4294714147], length 164
12:11:25.571383 IP 10.0.0.1.8882 > vagrant-ubuntu-trusty-64.33480: Flags [.], ack 2407291863, win 172, options [nop,nop,TS val 4294714169 ecr 4294714150], length 0
12:11:25.582448 IP vagrant-ubuntu-trusty-64.33480 > 10.0.0.1.8882: Flags [P.], seq 2407292027:2407292191, ack 2114665125, win 58, options [nop,nop,TS val 4294714191 ecr 4294714169], length 164
12:11:25.593213 IP 10.0.0.1.8882 > vagrant-ubuntu-trusty-64.33480: Flags [.], ack 2407292027, win 174, options [nop,nop,TS val 4294714191 ecr 4294714170], length 0
12:11:25.602400 IP vagrant-ubuntu-trusty-64.33480 > 10.0.0.1.8882: Flags [P.], seq 2407292191:2407292355, ack 2114665125, win 58, options [nop,nop,TS val 4294714211 ecr 4294714191], length 164
12:11:25.610478 IP 10.0.0.1.8882 > vagrant-ubuntu-trusty-64.33480: Flags [.], ack 2407292191, win 176, options [nop,nop,TS val 4294714208 ecr 4294714191], length 0
12:11:25.621761 IP vagrant-ubuntu-trusty-64.33480 > 10.0.0.1.8882: Flags [P.], seq 2407292355:2407292519, ack 2114665125, win 58, options [nop,nop,TS val 4294714230 ecr 4294714208], length 164
12:11:25.631797 IP 10.0.0.1.8882 > vagrant-ubuntu-trusty-64.33480: Flags [.], ack 2407292355, win 178, options [nop,nop,TS val 4294714230 ecr 4294714211], length 0
12:11:25.641546 IP vagrant-ubuntu-trusty-64.33480 > 10.0.0.1.8882: Flags [P.], seq 2407292519:2407292683, ack 2114665125, win 58, options [nop,nop,TS val 4294714250 ecr 4294714230], length 164
12:11:25.651346 IP 10.0.0.1.8882 > vagrant-ubuntu-trusty-64.33480: Flags [.], ack 2407292519, win 181, options [nop,nop,TS val 4294714249 ecr 4294714230], length 0
12:11:25.662446 IP vagrant-ubuntu-trusty-64.33480 > 10.0.0.1.8882: Flags [P.], seq 2407292683:2407292847, ack 2114665125, win 58, options [nop,nop,TS val 4294714271 ecr 4294714249], length 164
12:11:25.673314 IP 10.0.0.1.8882 > vagrant-ubuntu-trusty-64.33480: Flags [.], ack 2407292683, win 183, options [nop,nop,TS val 4294714271 ecr 4294714250], length 0
12:11:25.681968 IP vagrant-ubuntu-trusty-64.33480 > 10.0.0.1.8882: Flags [P.], seq 2407292847:2407293011, ack 2114665125, win 58, options [nop,nop,TS val 4294714290 ecr 4294714271], length 164
12:11:25.691079 IP 10.0.0.1.8882 > vagrant-ubuntu-trusty-64.33480: Flags [.], ack 2407292847, win 185, options [nop,nop,TS val 4294714288 ecr 4294714271], length 0
12:11:25.701637 IP vagrant-ubuntu-trusty-64.33480 > 10.0.0.1.8882: Flags [P.], seq 2407293011:2407293175, ack 2114665125, win 58, options [nop,nop,TS val 4294714310 ecr 4294714288], length 164
12:11:25.711588 IP 10.0.0.1.8882 > vagrant-ubuntu-trusty-64.33480: Flags [.], ack 2407293011, win 187, options [nop,nop,TS val 4294714310 ecr 4294714290], length 0
12:11:25.721637 IP vagrant-ubuntu-trusty-64.33480 > 10.0.0.1.8882: Flags [P.], seq 2407293175:2407293339, ack 2114665125, win 58, options [nop,nop,TS val 4294714330 ecr 4294714310], length 164
12:11:25.734104 IP 10.0.0.1.8882 > vagrant-ubuntu-trusty-64.33480: Flags [.], ack 2407293175, win 189, options [nop,nop,TS val 4294714331 ecr 4294714310], length 0
12:11:25.741542 IP vagrant-ubuntu-trusty-64.33480 > 10.0.0.1.8882: Flags [P.], seq 2407293339:2407293503, ack 2114665125, win 58, options [nop,nop,TS val 4294714350 ecr 4294714331], length 164
12:11:25.755139 IP 10.0.0.1.8882 > vagrant-ubuntu-trusty-64.33480: Flags [.], ack 2407293339, win 191, options [nop,nop,TS val 4294714353 ecr 4294714330], length 0
12:11:25.761596 IP vagrant-ubuntu-trusty-64.33480 > 10.0.0.1.8882: Flags [P.], seq 2407293503:2407293667, ack 2114665125, win 58, options [nop,nop,TS val 4294714370 ecr 4294714353], length 164
12:11:25.772766 IP 10.0.0.1.8882 > vagrant-ubuntu-trusty-64.33480: Flags [.], ack 2407293503, win 193, options [nop,nop,TS val 4294714371 ecr 4294714350], length 0
12:11:25.781592 IP vagrant-ubuntu-trusty-64.33480 > 10.0.0.1.8882: Flags [P.], seq 2407293667:2407293831, ack 2114665125, win 58, options [nop,nop,TS val 4294714390 ecr 4294714371], length 164
12:11:25.794313 IP 10.0.0.1.8882 > vagrant-ubuntu-trusty-64.33480: Flags [.], ack 2407293667, win 195, options [nop,nop,TS val 4294714392 ecr 4294714370], length 0
12:11:25.801572 IP vagrant-ubuntu-trusty-64.33480 > 10.0.0.1.8882: Flags [P.], seq 2407293831:2407293995, ack 2114665125, win 58, options [nop,nop,TS val 4294714410 ecr 4294714392], length 164
12:11:25.813371 IP 10.0.0.1.8882 > vagrant-ubuntu-trusty-64.33480: Flags [.], ack 2407293831, win 197, options [nop,nop,TS val 4294714411 ecr 4294714390], length 0
12:11:25.822259 IP vagrant-ubuntu-trusty-64.33480 > 10.0.0.1.8882: Flags [P.], seq 2407293995:2407294159, ack 2114665125, win 58, options [nop,nop,TS val 4294714430 ecr 4294714411], length 164
12:11:25.835348 IP 10.0.0.1.8882 > vagrant-ubuntu-trusty-64.33480: Flags [.], ack 2407293995, win 199, options [nop,nop,TS val 4294714432 ecr 4294714410], length 0
12:11:25.842799 IP vagrant-ubuntu-trusty-64.33480 > 10.0.0.1.8882: Flags [P.], seq 2407294159:2407294323, ack 2114665125, win 58, options [nop,nop,TS val 4294714451 ecr 4294714432], length 164
12:11:25.852809 IP 10.0.0.1.8882 > vagrant-ubuntu-trusty-64.33480: Flags [.], ack 2407294159, win 202, options [nop,nop,TS val 4294714451 ecr 4294714430], length 0
12:11:25.861597 IP vagrant-ubuntu-trusty-64.33480 > 10.0.0.1.8882: Flags [P.], seq 2407294323:2407294487, ack 2114665125, win 58, options [nop,nop,TS val 4294714470 ecr 4294714451], length 164
12:11:25.873982 IP 10.0.0.1.8882 > vagrant-ubuntu-trusty-64.33480: Flags [.], ack 2407294323, win 204, options [nop,nop,TS val 4294714472 ecr 4294714451], length 0
12:11:25.882779 IP vagrant-ubuntu-trusty-64.33480 > 10.0.0.1.8882: Flags [P.], seq 2407294487:2407294651, ack 2114665125, win 58, options [nop,nop,TS val 4294714491 ecr 4294714472], length 164
12:11:25.893383 IP 10.0.0.1.8882 > vagrant-ubuntu-trusty-64.33480: Flags [.], ack 2407294487, win 206, options [nop,nop,TS val 4294714491 ecr 4294714470], length 0
12:11:25.902389 IP vagrant-ubuntu-trusty-64.33480 > 10.0.0.1.8882: Flags [P.], seq 2407294651:2407294815, ack 2114665125, win 58, options [nop,nop,TS val 4294714511 ecr 4294714491], length 164
12:11:25.913649 IP 10.0.0.1.8882 > vagrant-ubuntu-trusty-64.33480: Flags [.], ack 2407294651, win 208, options [nop,nop,TS val 4294714512 ecr 4294714491], length 0
12:11:25.921550 IP vagrant-ubuntu-trusty-64.33480 > 10.0.0.1.8882: Flags [P.], seq 2407294815:2407294979, ack 2114665125, win 58, options [nop,nop,TS val 4294714530 ecr 4294714512], length 164
12:11:25.935083 IP 10.0.0.1.8882 > vagrant-ubuntu-trusty-64.33480: Flags [.], ack 2407294815, win 210, options [nop,nop,TS val 4294714533 ecr 4294714511], length 0
12:11:25.941598 IP vagrant-ubuntu-trusty-64.33480 > 10.0.0.1.8882: Flags [P.], seq 2407294979:2407295143, ack 2114665125, win 58, options [nop,nop,TS val 4294714550 ecr 4294714533], length 164
12:11:25.954344 IP 10.0.0.1.8882 > vagrant-ubuntu-trusty-64.33480: Flags [.], ack 2407294979, win 212, options [nop,nop,TS val 4294714552 ecr 4294714530], length 0
12:11:25.961566 IP vagrant-ubuntu-trusty-64.33480 > 10.0.0.1.8882: Flags [P.], seq 2407295143:2407295307, ack 2114665125, win 58, options [nop,nop,TS val 4294714570 ecr 4294714552], length 164
12:11:25.978628 IP 10.0.0.1.8882 > vagrant-ubuntu-trusty-64.33480: Flags [.], ack 2407295143, win 214, options [nop,nop,TS val 4294714576 ecr 4294714550], length 0
12:11:25.982760 IP vagrant-ubuntu-trusty-64.33480 > 10.0.0.1.8882: Flags [P.], seq 2407295307:2407295471, ack 2114665125, win 58, options [nop,nop,TS val 4294714591 ecr 4294714576], length 164
12:11:25.996508 IP 10.0.0.1.8882 > vagrant-ubuntu-trusty-64.33480: Flags [.], ack 2407295307, win 216, options [nop,nop,TS val 4294714594 ecr 4294714570], length 0
12:11:26.001745 IP vagrant-ubuntu-trusty-64.33480 > 10.0.0.1.8882: Flags [P.], seq 2407295471:2407295635, ack 2114665125, win 58, options [nop,nop,TS val 4294714610 ecr 4294714594], length 164
12:11:26.019372 IP 10.0.0.1.8882 > vagrant-ubuntu-trusty-64.33480: Flags [.], ack 2407295471, win 218, options [nop,nop,TS val 4294714616 ecr 4294714591], length 0
12:11:26.021637 IP vagrant-ubuntu-trusty-64.33480 > 10.0.0.1.8882: Flags [P.], seq 2407295635:2407295799, ack 2114665125, win 58, options [nop,nop,TS val 4294714630 ecr 4294714616], length 164
12:11:26.037684 IP 10.0.0.1.8882 > vagrant-ubuntu-trusty-64.33480: Flags [.], ack 2407295635, win 220, options [nop,nop,TS val 4294714634 ecr 4294714610], length 0
12:11:26.041636 IP vagrant-ubuntu-trusty-64.33480 > 10.0.0.1.8882: Flags [P.], seq 2407295799:2407295963, ack 2114665125, win 58, options [nop,nop,TS val 4294714650 ecr 4294714634], length 164
12:11:26.057748 IP 10.0.0.1.8882 > vagrant-ubuntu-trusty-64.33480: Flags [.], ack 2407295799, win 222, options [nop,nop,TS val 4294714656 ecr 4294714630], length 0
12:11:26.061671 IP vagrant-ubuntu-trusty-64.33480 > 10.0.0.1.8882: Flags [P.], seq 2407295963:2407296127, ack 2114665125, win 58, options [nop,nop,TS val 4294714670 ecr 4294714656], length 164
12:11:26.077493 IP 10.0.0.1.8882 > vagrant-ubuntu-trusty-64.33480: Flags [.], ack 2407295963, win 225, options [nop,nop,TS val 4294714674 ecr 4294714650], length 0
12:11:26.081668 IP vagrant-ubuntu-trusty-64.33480 > 10.0.0.1.8882: Flags [P.], seq 2407296127:2407296291, ack 2114665125, win 58, options [nop,nop,TS val 4294714690 ecr 4294714674], length 164
12:11:26.097967 IP 10.0.0.1.8882 > vagrant-ubuntu-trusty-64.33480: Flags [.], ack 2407296127, win 227, options [nop,nop,TS val 4294714696 ecr 4294714670], length 0
12:11:26.101659 IP vagrant-ubuntu-trusty-64.33480 > 10.0.0.1.8882: Flags [P.], seq 2407296291:2407296455, ack 2114665125, win 58, options [nop,nop,TS val 4294714710 ecr 4294714696], length 164
12:11:26.115938 IP 10.0.0.1.8882 > vagrant-ubuntu-trusty-64.33480: Flags [.], ack 2407296291, win 229, options [nop,nop,TS val 4294714714 ecr 4294714690], length 0
12:11:26.121548 IP vagrant-ubuntu-trusty-64.33480 > 10.0.0.1.8882: Flags [P.], seq 2407296455:2407296619, ack 2114665125, win 58, options [nop,nop,TS val 4294714730 ecr 4294714714], length 164
12:11:26.138484 IP 10.0.0.1.8882 > vagrant-ubuntu-trusty-64.33480: Flags [.], ack 2407296455, win 231, options [nop,nop,TS val 4294714735 ecr 4294714710], length 0
12:11:26.141615 IP vagrant-ubuntu-trusty-64.33480 > 10.0.0.1.8882: Flags [P.], seq 2407296619:2407296783, ack 2114665125, win 58, options [nop,nop,TS val 4294714750 ecr 4294714735], length 164
12:11:26.155661 IP 10.0.0.1.8882 > vagrant-ubuntu-trusty-64.33480: Flags [.], ack 2407296619, win 233, options [nop,nop,TS val 4294714754 ecr 4294714730], length 0
12:11:26.161606 IP vagrant-ubuntu-trusty-64.33480 > 10.0.0.1.8882: Flags [P.], seq 2407296783:2407296947, ack 2114665125, win 58, options [nop,nop,TS val 4294714770 ecr 4294714754], length 164
12:11:26.178389 IP 10.0.0.1.8882 > vagrant-ubuntu-trusty-64.33480: Flags [.], ack 2407296783, win 235, options [nop,nop,TS val 4294714776 ecr 4294714750], length 0
12:11:26.182530 IP vagrant-ubuntu-trusty-64.33480 > 10.0.0.1.8882: Flags [P.], seq 2407296947:2407297111, ack 2114665125, win 58, options [nop,nop,TS val 4294714790 ecr 4294714776], length 164
12:11:26.195687 IP 10.0.0.1.8882 > vagrant-ubuntu-trusty-64.33480: Flags [.], ack 2407296947, win 237, options [nop,nop,TS val 4294714794 ecr 4294714770], length 0
12:11:26.201606 IP vagrant-ubuntu-trusty-64.33480 > 10.0.0.1.8882: Flags [P.], seq 2407297111:2407297275, ack 2114665125, win 58, options [nop,nop,TS val 4294714810 ecr 4294714794], length 164
12:11:26.217759 IP 10.0.0.1.8882 > vagrant-ubuntu-trusty-64.33480: Flags [.], ack 2407297111, win 239, options [nop,nop,TS val 4294714815 ecr 4294714790], length 0
12:11:26.222255 IP vagrant-ubuntu-trusty-64.33480 > 10.0.0.1.8882: Flags [P.], seq 2407297275:2407297439, ack 2114665125, win 58, options [nop,nop,TS val 4294714830 ecr 4294714815], length 164
12:11:26.235697 IP 10.0.0.1.8882 > vagrant-ubuntu-trusty-64.33480: Flags [.], ack 2407297275, win 241, options [nop,nop,TS val 4294714834 ecr 4294714810], length 0
12:11:26.241614 IP vagrant-ubuntu-trusty-64.33480 > 10.0.0.1.8882: Flags [P.], seq 2407297439:2407297603, ack 2114665125, win 58, options [nop,nop,TS val 4294714850 ecr 4294714834], length 164
12:11:26.260741 IP 10.0.0.1.8882 > vagrant-ubuntu-trusty-64.33480: Flags [.], ack 2407297439, win 243, options [nop,nop,TS val 4294714858 ecr 4294714830], length 0
12:11:26.261581 IP vagrant-ubuntu-trusty-64.33480 > 10.0.0.1.8882: Flags [P.], seq 2407297603:2407297767, ack 2114665125, win 58, options [nop,nop,TS val 4294714870 ecr 4294714858], length 164
12:11:26.278538 IP 10.0.0.1.8882 > vagrant-ubuntu-trusty-64.33480: Flags [.], ack 2407297603, win 245, options [nop,nop,TS val 4294714876 ecr 4294714850], length 0
12:11:26.281726 IP vagrant-ubuntu-trusty-64.33480 > 10.0.0.1.8882: Flags [P.], seq 2407297767:2407297931, ack 2114665125, win 58, options [nop,nop,TS val 4294714890 ecr 4294714876], length 164
12:11:26.299881 IP 10.0.0.1.8882 > vagrant-ubuntu-trusty-64.33480: Flags [.], ack 2407297767, win 248, options [nop,nop,TS val 4294714898 ecr 4294714870], length 0
12:11:26.302702 IP vagrant-ubuntu-trusty-64.33480 > 10.0.0.1.8882: Flags [P.], seq 2407297931:2407298095, ack 2114665125, win 58, options [nop,nop,TS val 4294714911 ecr 4294714898], length 164
12:11:26.322648 IP 10.0.0.1.8882 > vagrant-ubuntu-trusty-64.33480: Flags [.], ack 2407297931, win 250, options [nop,nop,TS val 4294714919 ecr 4294714890], length 0
12:11:26.322849 IP vagrant-ubuntu-trusty-64.33480 > 10.0.0.1.8882: Flags [P.], seq 2407298095:2407298259, ack 2114665125, win 58, options [nop,nop,TS val 4294714931 ecr 4294714898], length 164
12:11:26.339683 IP 10.0.0.1.8882 > vagrant-ubuntu-trusty-64.33480: Flags [.], ack 2407298095, win 252, options [nop,nop,TS val 4294714938 ecr 4294714911], length 0
12:11:26.341708 IP vagrant-ubuntu-trusty-64.33480 > 10.0.0.1.8882: Flags [P.], seq 2407298259:2407298423, ack 2114665125, win 58, options [nop,nop,TS val 4294714950 ecr 4294714938], length 164
12:11:26.361845 IP 10.0.0.1.8882 > vagrant-ubuntu-trusty-64.33480: Flags [.], ack 2407298259, win 254, options [nop,nop,TS val 4294714959 ecr 4294714931], length 0
12:11:26.362009 IP vagrant-ubuntu-trusty-64.33480 > 10.0.0.1.8882: Flags [P.], seq 2407298423:2407298587, ack 2114665125, win 58, options [nop,nop,TS val 4294714970 ecr 4294714938], length 164
12:11:26.379678 IP 10.0.0.1.8882 > vagrant-ubuntu-trusty-64.33480: Flags [.], ack 2407298423, win 256, options [nop,nop,TS val 4294714977 ecr 4294714950], length 0
12:11:26.381630 IP vagrant-ubuntu-trusty-64.33480 > 10.0.0.1.8882: Flags [P.], seq 2407298587:2407298751, ack 2114665125, win 58, options [nop,nop,TS val 4294714990 ecr 4294714977], length 164
12:11:26.400837 IP 10.0.0.1.8882 > vagrant-ubuntu-trusty-64.33480: Flags [.], ack 2407298587, win 258, options [nop,nop,TS val 4294714999 ecr 4294714970], length 0
12:11:26.401607 IP vagrant-ubuntu-trusty-64.33480 > 10.0.0.1.8882: Flags [P.], seq 2407298751:2407298915, ack 2114665125, win 58, options [nop,nop,TS val 4294715010 ecr 4294714999], length 164
12:11:26.419246 IP 10.0.0.1.8882 > vagrant-ubuntu-trusty-64.33480: Flags [.], ack 2407298751, win 260, options [nop,nop,TS val 4294715017 ecr 4294714990], length 0
12:11:26.421569 IP vagrant-ubuntu-trusty-64.33480 > 10.0.0.1.8882: Flags [P.], seq 2407298915:2407299079, ack 2114665125, win 58, options [nop,nop,TS val 4294715030 ecr 4294715017], length 164
12:11:26.440708 IP 10.0.0.1.8882 > vagrant-ubuntu-trusty-64.33480: Flags [.], ack 2407298915, win 262, options [nop,nop,TS val 4294715039 ecr 4294715010], length 0
12:11:26.441649 IP vagrant-ubuntu-trusty-64.33480 > 10.0.0.1.8882: Flags [P.], seq 2407299079:2407299243, ack 2114665125, win 58, options [nop,nop,TS val 4294715050 ecr 4294715039], length 164
12:11:26.460592 IP 10.0.0.1.8882 > vagrant-ubuntu-trusty-64.33480: Flags [.], ack 2407299079, win 264, options [nop,nop,TS val 4294715057 ecr 4294715030], length 0
12:11:26.461729 IP vagrant-ubuntu-trusty-64.33480 > 10.0.0.1.8882: Flags [P.], seq 2407299243:2407299407, ack 2114665125, win 58, options [nop,nop,TS val 4294715070 ecr 4294715057], length 164
12:11:26.480659 IP 10.0.0.1.8882 > vagrant-ubuntu-trusty-64.33480: Flags [.], ack 2407299243, win 266, options [nop,nop,TS val 4294715079 ecr 4294715050], length 0
12:11:26.481578 IP vagrant-ubuntu-trusty-64.33480 > 10.0.0.1.8882: Flags [P.], seq 2407299407:2407299571, ack 2114665125, win 58, options [nop,nop,TS val 4294715090 ecr 4294715079], length 164
12:11:26.498940 IP 10.0.0.1.8882 > vagrant-ubuntu-trusty-64.33480: Flags [.], ack 2407299407, win 269, options [nop,nop,TS val 4294715097 ecr 4294715070], length 0
12:11:26.502039 IP vagrant-ubuntu-trusty-64.33480 > 10.0.0.1.8882: Flags [P.], seq 2407299571:2407299735, ack 2114665125, win 58, options [nop,nop,TS val 4294715110 ecr 4294715097], length 164
12:11:26.520406 IP 10.0.0.1.8882 > vagrant-ubuntu-trusty-64.33480: Flags [.], ack 2407299571, win 271, options [nop,nop,TS val 4294715118 ecr 4294715090], length 0
12:11:26.522966 IP vagrant-ubuntu-trusty-64.33480 > 10.0.0.1.8882: Flags [P.], seq 2407299735:2407299899, ack 2114665125, win 58, options [nop,nop,TS val 4294715131 ecr 4294715118], length 164
12:11:26.541631 IP vagrant-ubuntu-trusty-64.33480 > 10.0.0.1.8882: Flags [P.], seq 2407299899:2407300063, ack 2114665125, win 58, options [nop,nop,TS val 4294715150 ecr 4294715118], length 164
12:11:26.541813 IP 10.0.0.1.8882 > vagrant-ubuntu-trusty-64.33480: Flags [.], ack 2407299735, win 273, options [nop,nop,TS val 4294715140 ecr 4294715110], length 0
12:11:26.561598 IP vagrant-ubuntu-trusty-64.33480 > 10.0.0.1.8882: Flags [P.], seq 2407300063:2407300227, ack 2114665125, win 58, options [nop,nop,TS val 4294715170 ecr 4294715140], length 164
12:11:26.564369 IP 10.0.0.1.8882 > vagrant-ubuntu-trusty-64.33480: Flags [.], ack 2407299899, win 275, options [nop,nop,TS val 4294715162 ecr 4294715131], length 0
12:11:26.581572 IP vagrant-ubuntu-trusty-64.33480 > 10.0.0.1.8882: Flags [P.], seq 2407300227:2407300391, ack 2114665125, win 58, options [nop,nop,TS val 4294715190 ecr 4294715162], length 164
12:11:26.582821 IP 10.0.0.1.8882 > vagrant-ubuntu-trusty-64.33480: Flags [.], ack 2407300063, win 277, options [nop,nop,TS val 4294715180 ecr 4294715150], length 0
12:11:26.601580 IP vagrant-ubuntu-trusty-64.33480 > 10.0.0.1.8882: Flags [P.], seq 2407300391:2407300555, ack 2114665125, win 58, options [nop,nop,TS val 4294715210 ecr 4294715180], length 164
12:11:26.603039 IP 10.0.0.1.8882 > vagrant-ubuntu-trusty-64.33480: Flags [.], ack 2407300227, win 279, options [nop,nop,TS val 4294715201 ecr 4294715170], length 0
12:11:26.621420 IP 10.0.0.1.8882 > vagrant-ubuntu-trusty-64.33480: Flags [.], ack 2407300391, win 281, options [nop,nop,TS val 4294715219 ecr 4294715190], length 0
12:11:26.621654 IP vagrant-ubuntu-trusty-64.33480 > 10.0.0.1.8882: Flags [P.], seq 2407300555:2407300719, ack 2114665125, win 58, options [nop,nop,TS val 4294715230 ecr 4294715219], length 164
12:11:26.641556 IP vagrant-ubuntu-trusty-64.33480 > 10.0.0.1.8882: Flags [P.], seq 2407300719:2407300883, ack 2114665125, win 58, options [nop,nop,TS val 4294715250 ecr 4294715219], length 164
12:11:26.642873 IP 10.0.0.1.8882 > vagrant-ubuntu-trusty-64.33480: Flags [.], ack 2407300555, win 283, options [nop,nop,TS val 4294715241 ecr 4294715210], length 0
12:11:26.663201 IP vagrant-ubuntu-trusty-64.33480 > 10.0.0.1.8882: Flags [P.], seq 2407300883:2407301047, ack 2114665125, win 58, options [nop,nop,TS val 4294715271 ecr 4294715241], length 164
12:11:26.664388 IP 10.0.0.1.8882 > vagrant-ubuntu-trusty-64.33480: Flags [.], ack 2407300719, win 285, options [nop,nop,TS val 4294715262 ecr 4294715230], length 0
