11:19:44.850403 IP 10.0.0.2.56819 > 10.0.0.1.8882: Flags [P.], seq 228227958:228228122, ack 2709335573, win 58, options [nop,nop,TS val 4294787091 ecr 4294787062], length 164
11:19:44.850429 IP 10.0.0.1.8882 > 10.0.0.2.56819: Flags [.], ack 228228122, win 82, options [nop,nop,TS val 4294787102 ecr 4294787091], length 0
11:19:44.870296 IP 10.0.0.2.56819 > 10.0.0.1.8882: Flags [P.], seq 228228122:228228286, ack 2709335573, win 58, options [nop,nop,TS val 4294787112 ecr 4294787081], length 164
11:19:44.870336 IP 10.0.0.1.8882 > 10.0.0.2.56819: Flags [.], ack 228228286, win 84, options [nop,nop,TS val 4294787122 ecr 4294787112], length 0
11:19:44.890501 IP 10.0.0.2.56819 > 10.0.0.1.8882: Flags [P.], seq 228228286:228228450, ack 2709335573, win 58, options [nop,nop,TS val 4294787131 ecr 4294787102], length 164
11:19:44.890530 IP 10.0.0.1.8882 > 10.0.0.2.56819: Flags [.], ack 228228450, win 86, options [nop,nop,TS val 4294787142 ecr 4294787131], length 0
11:19:44.910861 IP 10.0.0.2.56819 > 10.0.0.1.8882: Flags [P.], seq 228228450:228228614, ack 2709335573, win 58, options [nop,nop,TS val 4294787151 ecr 4294787122], length 164
11:19:44.910935 IP 10.0.0.1.8882 > 10.0.0.2.56819: Flags [.], ack 228228614, win 88, options [nop,nop,TS val 4294787162 ecr 4294787151], length 0
11:19:44.930990 IP 10.0.0.2.56819 > 10.0.0.1.8882: Flags [P.], seq 228228614:228228778, ack 2709335573, win 58, options [nop,nop,TS val 4294787171 ecr 4294787142], length 164
11:19:44.931010 IP 10.0.0.1.8882 > 10.0.0.2.56819: Flags [.], ack 228228778, win 91, options [nop,nop,TS val 4294787183 ecr 4294787171], length 0
11:19:44.950749 IP 10.0.0.2.56819 > 10.0.0.1.8882: Flags [P.], seq 228228778:228228942, ack 2709335573, win 58, options [nop,nop,TS val 4294787192 ecr 4294787162], length 164
11:19:44.950785 IP 10.0.0.1.8882 > 10.0.0.2.56819: Flags [.], ack 228228942, win 93, options [nop,nop,TS val 4294787202 ecr 4294787192], length 0
11:19:44.969647 IP 10.0.0.2.56819 > 10.0.0.1.8882: Flags [P.], seq 228228942:228229106, ack 2709335573, win 58, options [nop,nop,TS val 4294787211 ecr 4294787183], length 164
11:19:44.969690 IP 10.0.0.1.8882 > 10.0.0.2.56819: Flags [.], ack 228229106, win 95, options [nop,nop,TS val 4294787221 ecr 4294787211], length 0
11:19:44.990205 IP 10.0.0.2.56819 > 10.0.0.1.8882: Flags [P.], seq 228229106:228229270, ack 2709335573, win 58, options [nop,nop,TS val 4294787231 ecr 4294787202], length 164
11:19:44.990335 IP 10.0.0.1.8882 > 10.0.0.2.56819: Flags [.], ack 228229270, win 97, options [nop,nop,TS val 4294787242 ecr 4294787231], length 0
11:19:45.009718 IP 10.0.0.2.56819 > 10.0.0.1.8882: Flags [P.], seq 228229270:228229434, ack 2709335573, win 58, options [nop,nop,TS val 4294787251 ecr 4294787221], length 164
11:19:45.009776 IP 10.0.0.1.8882 > 10.0.0.2.56819: Flags [.], ack 228229434, win 99, options [nop,nop,TS val 4294787261 ecr 4294787251], length 0
11:19:45.030235 IP 10.0.0.2.56819 > 10.0.0.1.8882: Flags [P.], seq 228229434:228229598, ack 2709335573, win 58, options [nop,nop,TS val 4294787272 ecr 4294787261], length 164
11:19:45.030268 IP 10.0.0.1.8882 > 10.0.0.2.56819: Flags [.], ack 228229598, win 101, options [nop,nop,TS val 4294787282 ecr 4294787272], length 0
11:19:45.049879 IP 10.0.0.2.56819 > 10.0.0.1.8882: Flags [P.], seq 228229598:228229762, ack 2709335573, win 58, options [nop,nop,TS val 4294787291 ecr 4294787261], length 164
11:19:45.049901 IP 10.0.0.1.8882 > 10.0.0.2.56819: Flags [.], ack 228229762, win 103, options [nop,nop,TS val 4294787301 ecr 4294787291], length 0
11:19:45.070138 IP 10.0.0.2.56819 > 10.0.0.1.8882: Flags [P.], seq 228229762:228229926, ack 2709335573, win 58, options [nop,nop,TS val 4294787311 ecr 4294787282], length 164
11:19:45.070170 IP 10.0.0.1.8882 > 10.0.0.2.56819: Flags [.], ack 228229926, win 105, options [nop,nop,TS val 4294787322 ecr 4294787311], length 0
11:19:45.090359 IP 10.0.0.2.56819 > 10.0.0.1.8882: Flags [P.], seq 228229926:228230090, ack 2709335573, win 58, options [nop,nop,TS val 4294787331 ecr 4294787301], length 164
11:19:45.090385 IP 10.0.0.1.8882 > 10.0.0.2.56819: Flags [.], ack 228230090, win 107, options [nop,nop,TS val 4294787342 ecr 4294787331], length 0
11:19:45.109635 IP 10.0.0.2.56819 > 10.0.0.1.8882: Flags [P.], seq 228230090:228230254, ack 2709335573, win 58, options [nop,nop,TS val 4294787351 ecr 4294787322], length 164
11:19:45.109660 IP 10.0.0.1.8882 > 10.0.0.2.56819: Flags [.], ack 228230254, win 109, options [nop,nop,TS val 4294787361 ecr 4294787351], length 0
11:19:45.130053 IP 10.0.0.2.56819 > 10.0.0.1.8882: Flags [P.], seq 228230254:228230418, ack 2709335573, win 58, options [nop,nop,TS val 4294787371 ecr 4294787342], length 164
11:19:45.130081 IP 10.0.0.1.8882 > 10.0.0.2.56819: Flags [.], ack 228230418, win 111, options [nop,nop,TS val 4294787382 ecr 4294787371], length 0
11:19:45.149733 IP 10.0.0.2.56819 > 10.0.0.1.8882: Flags [P.], seq 228230418:228230582, ack 2709335573, win 58, options [nop,nop,TS val 4294787391 ecr 4294787361], length 164
11:19:45.149756 IP 10.0.0.1.8882 > 10.0.0.2.56819: Flags [.], ack 228230582, win 114, options [nop,nop,TS val 4294787401 ecr 4294787391], length 0
11:19:45.169685 IP 10.0.0.2.56819 > 10.0.0.1.8882: Flags [P.], seq 228230582:228230746, ack 2709335573, win 58, options [nop,nop,TS val 4294787411 ecr 4294787382], length 164
11:19:45.169723 IP 10.0.0.1.8882 > 10.0.0.2.56819: Flags [.], ack 228230746, win 116, options [nop,nop,TS val 4294787421 ecr 4294787411], length 0
11:19:45.189715 IP 10.0.0.2.56819 > 10.0.0.1.8882: Flags [P.], seq 228230746:228230910, ack 2709335573, win 58, options [nop,nop,TS val 4294787431 ecr 4294787401], length 164
11:19:45.189734 IP 10.0.0.1.8882 > 10.0.0.2.56819: Flags [.], ack 228230910, win 118, options [nop,nop,TS val 4294787441 ecr 4294787431], length 0
11:19:45.209680 IP 10.0.0.2.56819 > 10.0.0.1.8882: Flags [P.], seq 228230910:228231074, ack 2709335573, win 58, options [nop,nop,TS val 4294787451 ecr 4294787421], length 164
11:19:45.209703 IP 10.0.0.1.8882 > 10.0.0.2.56819: Flags [.], ack 228231074, win 120, options [nop,nop,TS val 4294787461 ecr 4294787451], length 0
11:19:45.229891 IP 10.0.0.2.56819 > 10.0.0.1.8882: Flags [P.], seq 228231074:228231238, ack 2709335573, win 58, options [nop,nop,TS val 4294787471 ecr 4294787441], length 164
11:19:45.229917 IP 10.0.0.1.8882 > 10.0.0.2.56819: Flags [.], ack 228231238, win 122, options [nop,nop,TS val 4294787481 ecr 4294787471], length 0
11:19:45.249758 IP 10.0.0.2.56819 > 10.0.0.1.8882: Flags [P.], seq 228231238:228231402, ack 2709335573, win 58, options [nop,nop,TS val 4294787491 ecr 4294787461], length 164
11:19:45.249780 IP 10.0.0.1.8882 > 10.0.0.2.56819: Flags [.], ack 228231402, win 124, options [nop,nop,TS val 4294787501 ecr 4294787491], length 0
11:19:45.270349 IP 10.0.0.2.56819 > 10.0.0.1.8882: Flags [P.], seq 228231402:228231566, ack 2709335573, win 58, options [nop,nop,TS val 4294787511 ecr 4294787481], length 164
11:19:45.270372 IP 10.0.0.1.8882 > 10.0.0.2.56819: Flags [.], ack 228231566, win 126, options [nop,nop,TS val 4294787522 ecr 4294787511], length 0
11:19:45.289856 IP 10.0.0.2.56819 > 10.0.0.1.8882: Flags [P.], seq 228231566:228231730, ack 2709335573, win 58, options [nop,nop,TS val 4294787531 ecr 4294787501], length 164
11:19:45.289952 IP 10.0.0.1.8882 > 10.0.0.2.56819: Flags [.], ack 228231730, win 128, options [nop,nop,TS val 4294787541 ecr 4294787531], length 0
11:19:45.309561 IP 10.0.0.2.56819 > 10.0.0.1.8882: Flags [P.], seq 228231730:228231894, ack 2709335573, win 58, options [nop,nop,TS val 4294787551 ecr 4294787522], length 164
11:19:45.309588 IP 10.0.0.1.8882 > 10.0.0.2.56819: Flags [.], ack 228231894, win 130, options [nop,nop,TS val 4294787561 ecr 4294787551], length 0
11:19:45.330041 IP 10.0.0.2.56819 > 10.0.0.1.8882: Flags [P.], seq 228231894:228232058, ack 2709335573, win 58, options [nop,nop,TS val 4294787571 ecr 4294787541], length 164
11:19:45.330061 IP 10.0.0.1.8882 > 10.0.0.2.56819: Flags [.], ack 228232058, win 132, options [nop,nop,TS val 4294787582 ecr 4294787571], length 0
11:19:45.350203 IP 10.0.0.2.56819 > 10.0.0.1.8882: Flags [P.], seq 228232058:228232222, ack 2709335573, win 58, options [nop,nop,TS val 4294787591 ecr 4294787561], length 164
11:19:45.350226 IP 10.0.0.1.8882 > 10.0.0.2.56819: Flags [.], ack 228232222, win 135, options [nop,nop,TS val 4294787602 ecr 4294787591], length 0
11:19:45.370537 IP 10.0.0.2.56819 > 10.0.0.1.8882: Flags [P.], seq 228232222:228232386, ack 2709335573, win 58, options [nop,nop,TS val 4294787612 ecr 4294787582], length 164
11:19:45.370583 IP 10.0.0.1.8882 > 10.0.0.2.56819: Flags [.], ack 228232386, win 137, options [nop,nop,TS val 4294787622 ecr 4294787612], length 0
11:19:45.390223 IP 10.0.0.2.56819 > 10.0.0.1.8882: Flags [P.], seq 228232386:228232550, ack 2709335573, win 58, options [nop,nop,TS val 4294787632 ecr 4294787602], length 164
11:19:45.390249 IP 10.0.0.1.8882 > 10.0.0.2.56819: Flags [.], ack 228232550, win 139, options [nop,nop,TS val 4294787642 ecr 4294787632], length 0
11:19:45.409972 IP 10.0.0.2.56819 > 10.0.0.1.8882: Flags [P.], seq 228232550:228232714, ack 2709335573, win 58, options [nop,nop,TS val 4294787651 ecr 4294787622], length 164
11:19:45.409983 IP 10.0.0.1.8882 > 10.0.0.2.56819: Flags [.], ack 228232714, win 141, options [nop,nop,TS val 4294787662 ecr 4294787651], length 0
11:19:45.430586 IP 10.0.0.2.56819 > 10.0.0.1.8882: Flags [P.], seq 228232714:228232878, ack 2709335573, win 58, options [nop,nop,TS val 4294787671 ecr 4294787642], length 164
11:19:45.430615 IP 10.0.0.1.8882 > 10.0.0.2.56819: Flags [.], ack 228232878, win 143, options [nop,nop,TS val 4294787682 ecr 4294787671], length 0
11:19:45.450386 IP 10.0.0.2.56819 > 10.0.0.1.8882: Flags [P.], seq 228232878:228233042, ack 2709335573, win 58, options [nop,nop,TS val 4294787692 ecr 4294787662], length 164
11:19:45.450419 IP 10.0.0.1.8882 > 10.0.0.2.56819: Flags [.], ack 228233042, win 145, options [nop,nop,TS val 4294787702 ecr 4294787692], length 0
11:19:45.469730 IP 10.0.0.2.56819 > 10.0.0.1.8882: Flags [P.], seq 228233042:228233206, ack 2709335573, win 58, options [nop,nop,TS val 4294787711 ecr 4294787682], length 164
11:19:45.469780 IP 10.0.0.1.8882 > 10.0.0.2.56819: Flags [.], ack 228233206, win 147, options [nop,nop,TS val 4294787721 ecr 4294787711], length 0
11:19:45.490018 IP 10.0.0.2.56819 > 10.0.0.1.8882: Flags [P.], seq 228233206:228233370, ack 2709335573, win 58, options [nop,nop,TS val 4294787731 ecr 4294787702], length 164
11:19:45.490051 IP 10.0.0.1.8882 > 10.0.0.2.56819: Flags [.], ack 228233370, win 149, options [nop,nop,TS val 4294787742 ecr 4294787731], length 0
11:19:45.509641 IP 10.0.0.2.56819 > 10.0.0.1.8882: Flags [P.], seq 228233370:228233534, ack 2709335573, win 58, options [nop,nop,TS val 4294787751 ecr 4294787721], length 164
11:19:45.509661 IP 10.0.0.1.8882 > 10.0.0.2.56819: Flags [.], ack 228233534, win 151, options [nop,nop,TS val 4294787761 ecr 4294787751], length 0
11:19:45.529608 IP 10.0.0.2.56819 > 10.0.0.1.8882: Flags [P.], seq 228233534:228233698, ack 2709335573, win 58, options [nop,nop,TS val 4294787771 ecr 4294787742], length 164
11:19:45.529629 IP 10.0.0.1.8882 > 10.0.0.2.56819: Flags [.], ack 228233698, win 153, options [nop,nop,TS val 4294787781 ecr 4294787771], length 0
11:19:45.550087 IP 10.0.0.2.56819 > 10.0.0.1.8882: Flags [P.], seq 228233698:228233862, ack 2709335573, win 58, options [nop,nop,TS val 4294787791 ecr 4294787761], length 164
11:19:45.550112 IP 10.0.0.1.8882 > 10.0.0.2.56819: Flags [.], ack 228233862, win 155, options [nop,nop,TS val 4294787802 ecr 4294787791], length 0
11:19:45.571270 IP 10.0.0.2.56819 > 10.0.0.1.8882: Flags [P.], seq 228233862:228234026, ack 2709335573, win 58, options [nop,nop,TS val 4294787812 ecr 4294787802], length 164
11:19:45.571322 IP 10.0.0.1.8882 > 10.0.0.2.56819: Flags [.], ack 228234026, win 158, options [nop,nop,TS val 4294787823 ecr 4294787812], length 0
11:19:45.590027 IP 10.0.0.2.56819 > 10.0.0.1.8882: Flags [P.], seq 228234026:228234190, ack 2709335573, win 58, options [nop,nop,TS val 4294787831 ecr 4294787802], length 164
11:19:45.590046 IP 10.0.0.1.8882 > 10.0.0.2.56819: Flags [.], ack 228234190, win 160, options [nop,nop,TS val 4294787842 ecr 4294787831], length 0
11:19:45.610225 IP 10.0.0.2.56819 > 10.0.0.1.8882: Flags [P.], seq 228234190:228234354, ack 2709335573, win 58, options [nop,nop,TS val 4294787851 ecr 4294787823], length 164
11:19:45.610243 IP 10.0.0.1.8882 > 10.0.0.2.56819: Flags [.], ack 228234354, win 162, options [nop,nop,TS val 4294787862 ecr 4294787851], length 0
11:19:45.629759 IP 10.0.0.2.56819 > 10.0.0.1.8882: Flags [P.], seq 228234354:228234518, ack 2709335573, win 58, options [nop,nop,TS val 4294787871 ecr 4294787842], length 164
11:19:45.629801 IP 10.0.0.1.8882 > 10.0.0.2.56819: Flags [.], ack 228234518, win 164, options [nop,nop,TS val 4294787881 ecr 4294787871], length 0
11:19:45.649761 IP 10.0.0.2.56819 > 10.0.0.1.8882: Flags [P.], seq 228234518:228234682, ack 2709335573, win 58, options [nop,nop,TS val 4294787891 ecr 4294787862], length 164
11:19:45.649785 IP 10.0.0.1.8882 > 10.0.0.2.56819: Flags [.], ack 228234682, win 166, options [nop,nop,TS val 4294787901 ecr 4294787891], length 0
11:19:45.669616 IP 10.0.0.2.56819 > 10.0.0.1.8882: Flags [P.], seq 228234682:228234846, ack 2709335573, win 58, options [nop,nop,TS val 4294787911 ecr 4294787881], length 164
11:19:45.669722 IP 10.0.0.1.8882 > 10.0.0.2.56819: Flags [.], ack 228234846, win 168, options [nop,nop,TS val 4294787921 ecr 4294787911], length 0
11:19:45.689942 IP 10.0.0.2.56819 > 10.0.0.1.8882: Flags [P.], seq 228234846:228235010, ack 2709335573, win 58, options [nop,nop,TS val 4294787931 ecr 4294787901], length 164
11:19:45.689981 IP 10.0.0.1.8882 > 10.0.0.2.56819: Flags [.], ack 228235010, win 170, options [nop,nop,TS val 4294787941 ecr 4294787931], length 0
11:19:45.710023 IP 10.0.0.2.56819 > 10.0.0.1.8882: Flags [P.], seq 228235010:228235174, ack 2709335573, win 58, options [nop,nop,TS val 4294787951 ecr 4294787921], length 164
11:19:45.710195 IP 10.0.0.1.8882 > 10.0.0.2.56819: Flags [.], ack 228235174, win 172, options [nop,nop,TS val 4294787962 ecr 4294787951], length 0
11:19:45.730254 IP 10.0.0.2.56819 > 10.0.0.1.8882: Flags [P.], seq 228235174:228235338, ack 2709335573, win 58, options [nop,nop,TS val 4294787972 ecr 4294787941], length 164
11:19:45.730273 IP 10.0.0.1.8882 > 10.0.0.2.56819: Flags [.], ack 228235338, win 174, options [nop,nop,TS val 4294787982 ecr 4294787972], length 0
11:19:45.749523 IP 10.0.0.2.56819 > 10.0.0.1.8882: Flags [P.], seq 228235338:228235502, ack 2709335573, win 58, options [nop,nop,TS val 4294787991 ecr 4294787962], length 164
11:19:45.749542 IP 10.0.0.1.8882 > 10.0.0.2.56819: Flags [.], ack 228235502, win 176, options [nop,nop,TS val 4294788001 ecr 4294787991], length 0
11:19:45.770351 IP 10.0.0.2.56819 > 10.0.0.1.8882: Flags [P.], seq 228235502:228235666, ack 2709335573, win 58, options [nop,nop,TS val 4294788011 ecr 4294787982], length 164
11:19:45.770376 IP 10.0.0.1.8882 > 10.0.0.2.56819: Flags [.], ack 228235666, win 178, options [nop,nop,TS val 4294788022 ecr 4294788011], length 0
11:19:45.790293 IP 10.0.0.2.56819 > 10.0.0.1.8882: Flags [P.], seq 228235666:228235830, ack 2709335573, win 58, options [nop,nop,TS val 4294788031 ecr 4294788001], length 164
11:19:45.790330 IP 10.0.0.1.8882 > 10.0.0.2.56819: Flags [.], ack 228235830, win 181, options [nop,nop,TS val 4294788042 ecr 4294788031], length 0
11:19:45.811027 IP 10.0.0.2.56819 > 10.0.0.1.8882: Flags [P.], seq 228235830:228235994, ack 2709335573, win 58, options [nop,nop,TS val 4294788051 ecr 4294788022], length 164
11:19:45.811086 IP 10.0.0.1.8882 > 10.0.0.2.56819: Flags [.], ack 228235994, win 183, options [nop,nop,TS val 4294788063 ecr 4294788051], length 0
11:19:45.831659 IP 10.0.0.2.56819 > 10.0.0.1.8882: Flags [P.], seq 228235994:228236158, ack 2709335573, win 58, options [nop,nop,TS val 4294788073 ecr 4294788042], length 164
11:19:45.831702 IP 10.0.0.1.8882 > 10.0.0.2.56819: Flags [.], ack 228236158, win 185, options [nop,nop,TS val 4294788083 ecr 4294788073], length 0
11:19:45.850318 IP 10.0.0.2.56819 > 10.0.0.1.8882: Flags [P.], seq 228236158:228236322, ack 2709335573, win 58, options [nop,nop,TS val 4294788091 ecr 4294788063], length 164
11:19:45.850349 IP 10.0.0.1.8882 > 10.0.0.2.56819: Flags [.], ack 228236322, win 187, options [nop,nop,TS val 4294788102 ecr 4294788091], length 0
11:19:45.870069 IP 10.0.0.2.56819 > 10.0.0.1.8882: Flags [P.], seq 228236322:228236486, ack 2709335573, win 58, options [nop,nop,TS val 4294788111 ecr 4294788083], length 164
11:19:45.870109 IP 10.0.0.1.8882 > 10.0.0.2.56819: Flags [.], ack 228236486, win 189, options [nop,nop,TS val 4294788122 ecr 4294788111], length 0
11:19:45.889553 IP 10.0.0.2.56819 > 10.0.0.1.8882: Flags [P.], seq 228236486:228236650, ack 2709335573, win 58, options [nop,nop,TS val 4294788131 ecr 4294788102], length 164
11:19:45.889573 IP 10.0.0.1.8882 > 10.0.0.2.56819: Flags [.], ack 228236650, win 191, options [nop,nop,TS val 4294788141 ecr 4294788131], length 0
11:19:45.910501 IP 10.0.0.2.56819 > 10.0.0.1.8882: Flags [P.], seq 228236650:228236814, ack 2709335573, win 58, options [nop,nop,TS val 4294788151 ecr 4294788141], length 164
11:19:45.910518 IP 10.0.0.1.8882 > 10.0.0.2.56819: Flags [.], ack 228236814, win 193, options [nop,nop,TS val 4294788162 ecr 4294788151], length 0
11:19:45.930578 IP 10.0.0.2.56819 > 10.0.0.1.8882: Flags [P.], seq 228236814:228236978, ack 2709335573, win 58, options [nop,nop,TS val 4294788171 ecr 4294788141], length 164
11:19:45.930610 IP 10.0.0.1.8882 > 10.0.0.2.56819: Flags [.], ack 228236978, win 195, options [nop,nop,TS val 4294788182 ecr 4294788171], length 0
11:19:45.949691 IP 10.0.0.2.56819 > 10.0.0.1.8882: Flags [P.], seq 228236978:228237142, ack 2709335573, win 58, options [nop,nop,TS val 4294788191 ecr 4294788162], length 164
11:19:45.949771 IP 10.0.0.1.8882 > 10.0.0.2.56819: Flags [.], ack 228237142, win 197, options [nop,nop,TS val 4294788201 ecr 4294788191], length 0
11:19:45.969716 IP 10.0.0.2.56819 > 10.0.0.1.8882: Flags [P.], seq 228237142:228237306, ack 2709335573, win 58, options [nop,nop,TS val 4294788211 ecr 4294788182], length 164
11:19:45.969759 IP 10.0.0.1.8882 > 10.0.0.2.56819: Flags [.], ack 228237306, win 199, options [nop,nop,TS val 4294788221 ecr 4294788211], length 0
11:19:45.990152 IP 10.0.0.2.56819 > 10.0.0.1.8882: Flags [P.], seq 228237306:228237470, ack 2709335573, win 58, options [nop,nop,TS val 4294788231 ecr 4294788201], length 164
11:19:45.990246 IP 10.0.0.1.8882 > 10.0.0.2.56819: Flags [.], ack 228237470, win 202, options [nop,nop,TS val 4294788242 ecr 4294788231], length 0
11:19:46.009734 IP 10.0.0.2.56819 > 10.0.0.1.8882: Flags [P.], seq 228237470:228237634, ack 2709335573, win 58, options [nop,nop,TS val 4294788251 ecr 4294788221], length 164
11:19:46.009751 IP 10.0.0.1.8882 > 10.0.0.2.56819: Flags [.], ack 228237634, win 204, options [nop,nop,TS val 4294788261 ecr 4294788251], length 0
11:19:46.029727 IP 10.0.0.2.56819 > 10.0.0.1.8882: Flags [P.], seq 228237634:228237798, ack 2709335573, win 58, options [nop,nop,TS val 4294788271 ecr 4294788242], length 164
11:19:46.029748 IP 10.0.0.1.8882 > 10.0.0.2.56819: Flags [.], ack 228237798, win 206, options [nop,nop,TS val 4294788281 ecr 4294788271], length 0
11:19:46.049889 IP 10.0.0.2.56819 > 10.0.0.1.8882: Flags [P.], seq 228237798:228237962, ack 2709335573, win 58, options [nop,nop,TS val 4294788291 ecr 4294788261], length 164
11:19:46.049915 IP 10.0.0.1.8882 > 10.0.0.2.56819: Flags [.], ack 228237962, win 208, options [nop,nop,TS val 4294788301 ecr 4294788291], length 0
11:19:46.069664 IP 10.0.0.2.56819 > 10.0.0.1.8882: Flags [P.], seq 228237962:228238126, ack 2709335573, win 58, options [nop,nop,TS val 4294788311 ecr 4294788281], length 164
11:19:46.069682 IP 10.0.0.1.8882 > 10.0.0.2.56819: Flags [.], ack 228238126, win 210, options [nop,nop,TS val 4294788321 ecr 4294788311], length 0
11:19:46.089818 IP 10.0.0.2.56819 > 10.0.0.1.8882: Flags [P.], seq 228238126:228238290, ack 2709335573, win 58, options [nop,nop,TS val 4294788331 ecr 4294788301], length 164
11:19:46.089856 IP 10.0.0.1.8882 > 10.0.0.2.56819: Flags [.], ack 228238290, win 212, options [nop,nop,TS val 4294788341 ecr 4294788331], length 0
11:19:46.109813 IP 10.0.0.2.56819 > 10.0.0.1.8882: Flags [P.], seq 228238290:228238454, ack 2709335573, win 58, options [nop,nop,TS val 4294788351 ecr 4294788321], length 164
11:19:46.109907 IP 10.0.0.1.8882 > 10.0.0.2.56819: Flags [.], ack 228238454, win 214, options [nop,nop,TS val 4294788361 ecr 4294788351], length 0
11:19:46.129680 IP 10.0.0.2.56819 > 10.0.0.1.8882: Flags [P.], seq 228238454:228238618, ack 2709335573, win 58, options [nop,nop,TS val 4294788371 ecr 4294788341], length 164
11:19:46.129700 IP 10.0.0.1.8882 > 10.0.0.2.56819: Flags [.], ack 228238618, win 216, options [nop,nop,TS val 4294788381 ecr 4294788371], length 0
11:19:46.149735 IP 10.0.0.2.56819 > 10.0.0.1.8882: Flags [P.], seq 228238618:228238782, ack 2709335573, win 58, options [nop,nop,TS val 4294788391 ecr 4294788361], length 164
11:19:46.149748 IP 10.0.0.1.8882 > 10.0.0.2.56819: Flags [.], ack 228238782, win 218, options [nop,nop,TS val 4294788401 ecr 4294788391], length 0
11:19:46.169943 IP 10.0.0.2.56819 > 10.0.0.1.8882: Flags [P.], seq 228238782:228238946, ack 2709335573, win 58, options [nop,nop,TS val 4294788411 ecr 4294788381], length 164
11:19:46.169965 IP 10.0.0.1.8882 > 10.0.0.2.56819: Flags [.], ack 228238946, win 220, options [nop,nop,TS val 4294788421 ecr 4294788411], length 0
11:19:46.189702 IP 10.0.0.2.56819 > 10.0.0.1.8882: Flags [P.], seq 228238946:228239110, ack 2709335573, win 58, options [nop,nop,TS val 4294788431 ecr 4294788401], length 164
11:19:46.190103 IP 10.0.0.1.8882 > 10.0.0.2.56819: Flags [.], ack 228239110, win 222, options [nop,nop,TS val 4294788441 ecr 4294788431], length 0
11:19:46.211065 IP 10.0.0.2.56819 > 10.0.0.1.8882: Flags [P.], seq 228239110:228239274, ack 2709335573, win 58, options [nop,nop,TS val 4294788452 ecr 4294788421], length 164
11:19:46.211082 IP 10.0.0.1.8882 > 10.0.0.2.56819: Flags [.], ack 228239274, win 225, options [nop,nop,TS val 4294788462 ecr 4294788452], length 0
11:19:46.231416 IP 10.0.0.2.56819 > 10.0.0.1.8882: Flags [P.], seq 228239274:228239438, ack 2709335573, win 58, options [nop,nop,TS val 4294788473 ecr 4294788441], length 164
11:19:46.231442 IP 10.0.0.1.8882 > 10.0.0.2.56819: Flags [.], ack 228239438, win 227, options [nop,nop,TS val 4294788483 ecr 4294788473], length 0
11:19:46.268072 IP 10.0.0.2.56819 > 10.0.0.1.8882: Flags [P.], seq 228239438:228239602, ack 2709335573, win 58, options [nop,nop,TS val 4294788491 ecr 4294788462], length 164
11:19:46.268098 IP 10.0.0.1.8882 > 10.0.0.2.56819: Flags [.], ack 228239602, win 229, options [nop,nop,TS val 4294788520 ecr 4294788491], length 0
11:19:46.370154 IP 10.0.0.2.56819 > 10.0.0.1.8882: Flags [P.], seq 228240258:228240422, ack 2709335573, win 58, options [nop,nop,TS val 4294788592 ecr 4294788520], length 164
11:19:46.370173 IP 10.0.0.1.8882 > 10.0.0.2.56819: Flags [.], ack 228239602, win 231, options [nop,nop,TS val 4294788622 ecr 4294788491,nop,nop,sack 1 {228240258:228240422}], length 0
11:19:46.379589 IP 10.0.0.2.56819 > 10.0.0.1.8882: Flags [P.], seq 228240422:228240586, ack 2709335573, win 58, options [nop,nop,TS val 4294788611 ecr 4294788520], length 164
11:19:46.379618 IP 10.0.0.1.8882 > 10.0.0.2.56819: Flags [.], ack 228239602, win 233, options [nop,nop,TS val 4294788631 ecr 4294788491,nop,nop,sack 1 {228240258:228240586}], length 0
11:19:46.401061 IP 10.0.0.2.56819 > 10.0.0.1.8882: Flags [P.], seq 228240586:228240750, ack 2709335573, win 58, options [nop,nop,TS val 4294788631 ecr 4294788520], length 164
11:19:46.401090 IP 10.0.0.1.8882 > 10.0.0.2.56819: Flags [.], ack 228239602, win 235, options [nop,nop,TS val 4294788653 ecr 4294788491,nop,nop,sack 1 {228240258:228240750}], length 0
11:19:46.401063 IP 10.0.0.2.56819 > 10.0.0.1.8882: Flags [P.], seq 228239602:228240258, ack 2709335573, win 58, options [nop,nop,TS val 4294788632 ecr 4294788622], length 656
11:19:46.401097 IP 10.0.0.1.8882 > 10.0.0.2.56819: Flags [.], ack 228240750, win 238, options [nop,nop,TS val 4294788653 ecr 4294788632], length 0
11:19:46.418481 IP 10.0.0.2.56819 > 10.0.0.1.8882: Flags [P.], seq 228240750:228240914, ack 2709335573, win 58, options [nop,nop,TS val 4294788651 ecr 4294788631], length 164
11:19:46.418524 IP 10.0.0.1.8882 > 10.0.0.2.56819: Flags [.], ack 228240914, win 240, options [nop,nop,TS val 4294788670 ecr 4294788651], length 0
11:19:46.449113 IP 10.0.0.2.56819 > 10.0.0.1.8882: Flags [P.], seq 228240914:228241078, ack 2709335573, win 58, options [nop,nop,TS val 4294788671 ecr 4294788653], length 164
11:19:46.449140 IP 10.0.0.1.8882 > 10.0.0.2.56819: Flags [.], ack 228241078, win 243, options [nop,nop,TS val 4294788701 ecr 4294788671], length 0
11:19:46.471893 IP 10.0.0.2.56819 > 10.0.0.1.8882: Flags [P.], seq 228241078:228241242, ack 2709335573, win 58, options [nop,nop,TS val 4294788692 ecr 4294788670], length 164
11:19:46.472237 IP 10.0.0.1.8882 > 10.0.0.2.56819: Flags [.], ack 228241242, win 245, options [nop,nop,TS val 4294788723 ecr 4294788692], length 0
11:19:46.482757 IP 10.0.0.2.56819 > 10.0.0.1.8882: Flags [P.], seq 228241242:228241406, ack 2709335573, win 58, options [nop,nop,TS val 4294788711 ecr 4294788701], length 164
11:19:46.482771 IP 10.0.0.1.8882 > 10.0.0.2.56819: Flags [.], ack 228241406, win 248, options [nop,nop,TS val 4294788734 ecr 4294788711], length 0
11:19:46.489590 IP 10.0.0.2.56819 > 10.0.0.1.8882: Flags [P.], seq 228241406:228241570, ack 2709335573, win 58, options [nop,nop,TS val 4294788731 ecr 4294788701], length 164
11:19:46.489624 IP 10.0.0.1.8882 > 10.0.0.2.56819: Flags [.], ack 228241570, win 250, options [nop,nop,TS val 4294788741 ecr 4294788731], length 0
11:19:46.509739 IP 10.0.0.2.56819 > 10.0.0.1.8882: Flags [P.], seq 228241570:228241734, ack 2709335573, win 58, options [nop,nop,TS val 4294788751 ecr 4294788734], length 164
11:19:46.509753 IP 10.0.0.1.8882 > 10.0.0.2.56819: Flags [.], ack 228241734, win 253, options [nop,nop,TS val 4294788761 ecr 4294788751], length 0
11:19:46.536736 IP 10.0.0.2.56819 > 10.0.0.1.8882: Flags [P.], seq 228241734:228241898, ack 2709335573, win 58, options [nop,nop,TS val 4294788771 ecr 4294788741], length 164
11:19:46.536764 IP 10.0.0.1.8882 > 10.0.0.2.56819: Flags [.], ack 228241898, win 256, options [nop,nop,TS val 4294788788 ecr 4294788771], length 0
11:19:46.556204 IP 10.0.0.2.56819 > 10.0.0.1.8882: Flags [P.], seq 228241898:228242062, ack 2709335573, win 58, options [nop,nop,TS val 4294788790 ecr 4294788761], length 164
11:19:46.556250 IP 10.0.0.1.8882 > 10.0.0.2.56819: Flags [.], ack 228242062, win 258, options [nop,nop,TS val 4294788808 ecr 4294788790], length 0
11:19:46.589639 IP 10.0.0.2.56819 > 10.0.0.1.8882: Flags [P.], seq 228242062:228242226, ack 2709335573, win 58, options [nop,nop,TS val 4294788811 ecr 4294788788], length 164
11:19:46.589668 IP 10.0.0.1.8882 > 10.0.0.2.56819: Flags [.], ack 228242226, win 261, options [nop,nop,TS val 4294788841 ecr 4294788811], length 0
11:19:46.610933 IP 10.0.0.2.56819 > 10.0.0.1.8882: Flags [P.], seq 228242226:228242390, ack 2709335573, win 58, options [nop,nop,TS val 4294788831 ecr 4294788808], length 164
11:19:46.610951 IP 10.0.0.1.8882 > 10.0.0.2.56819: Flags [.], ack 228242390, win 263, options [nop,nop,TS val 4294788862 ecr 4294788831], length 0
11:19:46.631146 IP 10.0.0.2.56819 > 10.0.0.1.8882: Flags [P.], seq 228242390:228242554, ack 2709335573, win 58, options [nop,nop,TS val 4294788851 ecr 4294788808], length 164
11:19:46.631160 IP 10.0.0.1.8882 > 10.0.0.2.56819: Flags [.], ack 228242554, win 266, options [nop,nop,TS val 4294788883 ecr 4294788851], length 0
11:19:46.645409 IP 10.0.0.2.56819 > 10.0.0.1.8882: Flags [P.], seq 228242554:228242718, ack 2709335573, win 58, options [nop,nop,TS val 4294788871 ecr 4294788841], length 164
11:19:46.645428 IP 10.0.0.1.8882 > 10.0.0.2.56819: Flags [.], ack 228242718, win 268, options [nop,nop,TS val 4294788897 ecr 4294788871], length 0
11:19:46.671422 IP 10.0.0.2.56819 > 10.0.0.1.8882: Flags [P.], seq 228242882:228243046, ack 2709335573, win 58, options [nop,nop,TS val 4294788911 ecr 4294788897], length 164
11:19:46.671582 IP 10.0.0.1.8882 > 10.0.0.2.56819: Flags [.], ack 228242718, win 271, options [nop,nop,TS val 4294788923 ecr 4294788871,nop,nop,sack 1 {228242882:228243046}], length 0
11:19:46.691860 IP 10.0.0.2.56819 > 10.0.0.1.8882: Flags [P.], seq 228243046:228243210, ack 2709335573, win 58, options [nop,nop,TS val 4294788931 ecr 4294788897], length 164
11:19:46.691893 IP 10.0.0.1.8882 > 10.0.0.2.56819: Flags [.], ack 228242718, win 273, options [nop,nop,TS val 4294788943 ecr 4294788871,nop,nop,sack 1 {228242882:228243210}], length 0
11:19:46.699577 IP 10.0.0.2.56819 > 10.0.0.1.8882: Flags [P.], seq 228242718:228242882, ack 2709335573, win 58, options [nop,nop,TS val 4294788941 ecr 4294788923], length 164
11:19:46.699601 IP 10.0.0.1.8882 > 10.0.0.2.56819: Flags [.], ack 228243210, win 276, options [nop,nop,TS val 4294788951 ecr 4294788941], length 0
11:19:46.713383 IP 10.0.0.2.56819 > 10.0.0.1.8882: Flags [P.], seq 228243210:228243374, ack 2709335573, win 58, options [nop,nop,TS val 4294788951 ecr 4294788923], length 164
11:19:46.713396 IP 10.0.0.1.8882 > 10.0.0.2.56819: Flags [.], ack 228243374, win 279, options [nop,nop,TS val 4294788965 ecr 4294788951], length 0
11:19:46.735204 IP 10.0.0.2.56819 > 10.0.0.1.8882: Flags [P.], seq 228243374:228243538, ack 2709335573, win 58, options [nop,nop,TS val 4294788971 ecr 4294788951], length 164
11:19:46.735233 IP 10.0.0.1.8882 > 10.0.0.2.56819: Flags [.], ack 228243538, win 281, options [nop,nop,TS val 4294788987 ecr 4294788971], length 0
11:19:46.758541 IP 10.0.0.2.56819 > 10.0.0.1.8882: Flags [P.], seq 228243538:228243702, ack 2709335573, win 58, options [nop,nop,TS val 4294788993 ecr 4294788965], length 164
11:19:46.758781 IP 10.0.0.1.8882 > 10.0.0.2.56819: Flags [.], ack 228243702, win 284, options [nop,nop,TS val 4294789010 ecr 4294788993], length 0
11:19:46.776193 IP 10.0.0.2.56819 > 10.0.0.1.8882: Flags [P.], seq 228243702:228243866, ack 2709335573, win 58, options [nop,nop,TS val 4294789011 ecr 4294788987], length 164
11:19:46.776225 IP 10.0.0.1.8882 > 10.0.0.2.56819: Flags [.], ack 228243866, win 286, options [nop,nop,TS val 4294789028 ecr 4294789011], length 0
11:19:46.794718 IP 10.0.0.2.56819 > 10.0.0.1.8882: Flags [P.], seq 228243866:228244030, ack 2709335573, win 58, options [nop,nop,TS val 4294789032 ecr 4294789010], length 164
11:19:46.794754 IP 10.0.0.1.8882 > 10.0.0.2.56819: Flags [.], ack 228244030, win 289, options [nop,nop,TS val 4294789046 ecr 4294789032], length 0
11:19:46.816156 IP 10.0.0.2.56819 > 10.0.0.1.8882: Flags [P.], seq 228244030:228244194, ack 2709335573, win 58, options [nop,nop,TS val 4294789051 ecr 4294789028], length 164
11:19:46.816186 IP 10.0.0.1.8882 > 10.0.0.2.56819: Flags [.], ack 228244194, win 291, options [nop,nop,TS val 4294789068 ecr 4294789051], length 0
11:19:46.834596 IP 10.0.0.2.56819 > 10.0.0.1.8882: Flags [P.], seq 228244194:228244358, ack 2709335573, win 58, options [nop,nop,TS val 4294789071 ecr 4294789046], length 164
11:19:46.834633 IP 10.0.0.1.8882 > 10.0.0.2.56819: Flags [.], ack 228244358, win 294, options [nop,nop,TS val 4294789086 ecr 4294789071], length 0
11:19:46.856146 IP 10.0.0.2.56819 > 10.0.0.1.8882: Flags [P.], seq 228244358:228244522, ack 2709335573, win 58, options [nop,nop,TS val 4294789091 ecr 4294789068], length 164
11:19:46.856285 IP 10.0.0.1.8882 > 10.0.0.2.56819: Flags [.], ack 228244522, win 297, options [nop,nop,TS val 4294789108 ecr 4294789091], length 0
11:19:46.877553 IP 10.0.0.2.56819 > 10.0.0.1.8882: Flags [P.], seq 228244522:228244686, ack 2709335573, win 58, options [nop,nop,TS val 4294789112 ecr 4294789086], length 164
11:19:46.877566 IP 10.0.0.1.8882 > 10.0.0.2.56819: Flags [.], ack 228244686, win 299, options [nop,nop,TS val 4294789129 ecr 4294789112], length 0
11:19:46.896078 IP 10.0.0.2.56819 > 10.0.0.1.8882: Flags [P.], seq 228244686:228244850, ack 2709335573, win 58, options [nop,nop,TS val 4294789131 ecr 4294789108], length 164
11:19:46.896110 IP 10.0.0.1.8882 > 10.0.0.2.56819: Flags [.], ack 228244850, win 302, options [nop,nop,TS val 4294789148 ecr 4294789131], length 0
11:19:46.914165 IP 10.0.0.2.56819 > 10.0.0.1.8882: Flags [P.], seq 228244850:228245014, ack 2709335573, win 58, options [nop,nop,TS val 4294789151 ecr 4294789129], length 164
11:19:46.914179 IP 10.0.0.1.8882 > 10.0.0.2.56819: Flags [.], ack 228245014, win 304, options [nop,nop,TS val 4294789166 ecr 4294789151], length 0
11:19:46.936518 IP 10.0.0.2.56819 > 10.0.0.1.8882: Flags [P.], seq 228245014:228245178, ack 2709335573, win 58, options [nop,nop,TS val 4294789171 ecr 4294789148], length 164
11:19:46.936540 IP 10.0.0.1.8882 > 10.0.0.2.56819: Flags [.], ack 228245178, win 307, options [nop,nop,TS val 4294789188 ecr 4294789171], length 0
11:19:46.954920 IP 10.0.0.2.56819 > 10.0.0.1.8882: Flags [P.], seq 228245178:228245342, ack 2709335573, win 58, options [nop,nop,TS val 4294789191 ecr 4294789166], length 164
11:19:46.954939 IP 10.0.0.1.8882 > 10.0.0.2.56819: Flags [.], ack 228245342, win 309, options [nop,nop,TS val 4294789206 ecr 4294789191], length 0
11:19:46.977002 IP 10.0.0.2.56819 > 10.0.0.1.8882: Flags [P.], seq 228245342:228245506, ack 2709335573, win 58, options [nop,nop,TS val 4294789211 ecr 4294789188], length 164
11:19:46.977089 IP 10.0.0.1.8882 > 10.0.0.2.56819: Flags [.], ack 228245506, win 312, options [nop,nop,TS val 4294789228 ecr 4294789211], length 0
11:19:47.001036 IP 10.0.0.2.56819 > 10.0.0.1.8882: Flags [P.], seq 228245506:228245670, ack 2709335573, win 58, options [nop,nop,TS val 4294789234 ecr 4294789206], length 164
11:19:47.001062 IP 10.0.0.1.8882 > 10.0.0.2.56819: Flags [.], ack 228245670, win 314, options [nop,nop,TS val 4294789253 ecr 4294789234], length 0
11:19:47.019153 IP 10.0.0.2.56819 > 10.0.0.1.8882: Flags [P.], seq 228245670:228245834, ack 2709335573, win 58, options [nop,nop,TS val 4294789251 ecr 4294789228], length 164
11:19:47.019168 IP 10.0.0.1.8882 > 10.0.0.2.56819: Flags [.], ack 228245834, win 317, options [nop,nop,TS val 4294789271 ecr 4294789251], length 0
11:19:47.037964 IP 10.0.0.2.56819 > 10.0.0.1.8882: Flags [P.], seq 228245834:228245998, ack 2709335573, win 58, options [nop,nop,TS val 4294789271 ecr 4294789253], length 164
11:19:47.038001 IP 10.0.0.1.8882 > 10.0.0.2.56819: Flags [.], ack 228245998, win 320, options [nop,nop,TS val 4294789289 ecr 4294789271], length 0
11:19:47.059136 IP 10.0.0.2.56819 > 10.0.0.1.8882: Flags [P.], seq 228245998:228246162, ack 2709335573, win 58, options [nop,nop,TS val 4294789292 ecr 4294789271], length 164
11:19:47.059165 IP 10.0.0.1.8882 > 10.0.0.2.56819: Flags [.], ack 228246162, win 322, options [nop,nop,TS val 4294789311 ecr 4294789292], length 0
11:19:47.077581 IP 10.0.0.2.56819 > 10.0.0.1.8882: Flags [P.], seq 228246162:228246326, ack 2709335573, win 58, options [nop,nop,TS val 4294789311 ecr 4294789289], length 164
11:19:47.077608 IP 10.0.0.1.8882 > 10.0.0.2.56819: Flags [.], ack 228246326, win 325, options [nop,nop,TS val 4294789329 ecr 4294789311], length 0
11:19:47.099185 IP 10.0.0.2.56819 > 10.0.0.1.8882: Flags [P.], seq 228246326:228246490, ack 2709335573, win 58, options [nop,nop,TS val 4294789331 ecr 4294789311], length 164
11:19:47.099215 IP 10.0.0.1.8882 > 10.0.0.2.56819: Flags [.], ack 228246490, win 327, options [nop,nop,TS val 4294789351 ecr 4294789331], length 0
11:19:47.117801 IP 10.0.0.2.56819 > 10.0.0.1.8882: Flags [P.], seq 228246490:228246654, ack 2709335573, win 58, options [nop,nop,TS val 4294789351 ecr 4294789329], length 164
11:19:47.117830 IP 10.0.0.1.8882 > 10.0.0.2.56819: Flags [.], ack 228246654, win 330, options [nop,nop,TS val 4294789369 ecr 4294789351], length 0
11:19:47.139031 IP 10.0.0.2.56819 > 10.0.0.1.8882: Flags [P.], seq 228246654:228246818, ack 2709335573, win 58, options [nop,nop,TS val 4294789371 ecr 4294789351], length 164
11:19:47.139705 IP 10.0.0.1.8882 > 10.0.0.2.56819: Flags [.], ack 228246818, win 332, options [nop,nop,TS val 4294789391 ecr 4294789371], length 0
11:19:47.178562 IP 10.0.0.2.56819 > 10.0.0.1.8882: Flags [P.], seq 228246818:228246982, ack 2709335573, win 58, options [nop,nop,TS val 4294789391 ecr 4294789369], length 164
11:19:47.178628 IP 10.0.0.1.8882 > 10.0.0.2.56819: Flags [.], ack 228246982, win 335, options [nop,nop,TS val 4294789430 ecr 4294789391], length 0
11:19:47.203933 IP 10.0.0.2.56819 > 10.0.0.1.8882: Flags [P.], seq 228246982:228247146, ack 2709335573, win 58, options [nop,nop,TS val 4294789423 ecr 4294789391], length 164
11:19:47.203972 IP 10.0.0.1.8882 > 10.0.0.2.56819: Flags [.], ack 228247146, win 338, options [nop,nop,TS val 4294789455 ecr 4294789423], length 0
11:19:47.203935 IP 10.0.0.2.56819 > 10.0.0.1.8882: Flags [P.], seq 228247146:228247310, ack 2709335573, win 58, options [nop,nop,TS val 4294789431 ecr 4294789391], length 164
11:19:47.203980 IP 10.0.0.1.8882 > 10.0.0.2.56819: Flags [.], ack 228247310, win 340, options [nop,nop,TS val 4294789455 ecr 4294789431], length 0
11:19:47.219259 IP 10.0.0.2.56819 > 10.0.0.1.8882: Flags [P.], seq 228247310:228247474, ack 2709335573, win 58, options [nop,nop,TS val 4294789451 ecr 4294789430], length 164
11:19:47.219290 IP 10.0.0.1.8882 > 10.0.0.2.56819: Flags [.], ack 228247474, win 343, options [nop,nop,TS val 4294789471 ecr 4294789451], length 0
11:19:47.240570 IP 10.0.0.2.56819 > 10.0.0.1.8882: Flags [P.], seq 228247474:228247638, ack 2709335573, win 58, options [nop,nop,TS val 4294789471 ecr 4294789455], length 164
11:19:47.240622 IP 10.0.0.1.8882 > 10.0.0.2.56819: Flags [.], ack 228247638, win 345, options [nop,nop,TS val 4294789492 ecr 4294789471], length 0
11:19:47.263235 IP 10.0.0.2.56819 > 10.0.0.1.8882: Flags [P.], seq 228247638:228247802, ack 2709335573, win 58, options [nop,nop,TS val 4294789491 ecr 4294789471], length 164
11:19:47.263286 IP 10.0.0.1.8882 > 10.0.0.2.56819: Flags [.], ack 228247802, win 348, options [nop,nop,TS val 4294789515 ecr 4294789491], length 0
11:19:47.280325 IP 10.0.0.2.56819 > 10.0.0.1.8882: Flags [P.], seq 228247802:228247966, ack 2709335573, win 58, options [nop,nop,TS val 4294789511 ecr 4294789492], length 164
11:19:47.280367 IP 10.0.0.1.8882 > 10.0.0.2.56819: Flags [.], ack 228247966, win 350, options [nop,nop,TS val 4294789532 ecr 4294789511], length 0
11:19:47.302550 IP 10.0.0.2.56819 > 10.0.0.1.8882: Flags [P.], seq 228247966:228248130, ack 2709335573, win 58, options [nop,nop,TS val 4294789531 ecr 4294789515], length 164
11:19:47.302587 IP 10.0.0.1.8882 > 10.0.0.2.56819: Flags [.], ack 228248130, win 353, options [nop,nop,TS val 4294789554 ecr 4294789531], length 0
11:19:47.323903 IP 10.0.0.2.56819 > 10.0.0.1.8882: Flags [P.], seq 228248130:228248294, ack 2709335573, win 58, options [nop,nop,TS val 4294789553 ecr 4294789532], length 164
11:19:47.323970 IP 10.0.0.1.8882 > 10.0.0.2.56819: Flags [.], ack 228248294, win 355, options [nop,nop,TS val 4294789576 ecr 4294789553], length 0
11:19:47.342868 IP 10.0.0.2.56819 > 10.0.0.1.8882: Flags [P.], seq 228248294:228248458, ack 2709335573, win 58, options [nop,nop,TS val 4294789571 ecr 4294789554], length 164
11:19:47.342917 IP 10.0.0.1.8882 > 10.0.0.2.56819: Flags [.], ack 228248458, win 358, options [nop,nop,TS val 4294789594 ecr 4294789571], length 0
11:19:47.360699 IP 10.0.0.2.56819 > 10.0.0.1.8882: Flags [P.], seq 228248458:228248622, ack 2709335573, win 58, options [nop,nop,TS val 4294789591 ecr 4294789576], length 164
11:19:47.360742 IP 10.0.0.1.8882 > 10.0.0.2.56819: Flags [.], ack 228248622, win 358, options [nop,nop,TS val 4294789612 ecr 4294789591], length 0
11:19:47.382161 IP 10.0.0.2.56819 > 10.0.0.1.8882: Flags [P.], seq 228248622:228248786, ack 2709335573, win 58, options [nop,nop,TS val 4294789611 ecr 4294789594], length 164
