12:19:18.707497 IP vagrant-ubuntu-trusty-64.47555 > 10.0.0.1.8882: Flags [P.], seq 386551352:386551516, ack 572292655, win 58, options [nop,nop,TS val 4294714318 ecr 4294714288], length 164
12:19:18.707666 IP 10.0.0.1.8882 > vagrant-ubuntu-trusty-64.47555: Flags [.], ack 386551352, win 63, options [nop,nop,TS val 4294714308 ecr 4294714297], length 0
12:19:18.727575 IP vagrant-ubuntu-trusty-64.47555 > 10.0.0.1.8882: Flags [P.], seq 386551516:386551680, ack 572292655, win 58, options [nop,nop,TS val 4294714338 ecr 4294714308], length 164
12:19:18.728952 IP 10.0.0.1.8882 > vagrant-ubuntu-trusty-64.47555: Flags [.], ack 386551516, win 65, options [nop,nop,TS val 4294714329 ecr 4294714318], length 0
12:19:18.747025 IP vagrant-ubuntu-trusty-64.47555 > 10.0.0.1.8882: Flags [P.], seq 386551680:386551844, ack 572292655, win 58, options [nop,nop,TS val 4294714357 ecr 4294714329], length 164
12:19:18.747828 IP 10.0.0.1.8882 > vagrant-ubuntu-trusty-64.47555: Flags [.], ack 386551680, win 68, options [nop,nop,TS val 4294714348 ecr 4294714338], length 0
12:19:18.767849 IP 10.0.0.1.8882 > vagrant-ubuntu-trusty-64.47555: Flags [.], ack 386551844, win 70, options [nop,nop,TS val 4294714367 ecr 4294714357], length 0
12:19:18.767950 IP vagrant-ubuntu-trusty-64.47555 > 10.0.0.1.8882: Flags [P.], seq 386551844:386552008, ack 572292655, win 58, options [nop,nop,TS val 4294714378 ecr 4294714348], length 164
12:19:18.787587 IP vagrant-ubuntu-trusty-64.47555 > 10.0.0.1.8882: Flags [P.], seq 386552008:386552172, ack 572292655, win 58, options [nop,nop,TS val 4294714398 ecr 4294714367], length 164
12:19:18.788872 IP 10.0.0.1.8882 > vagrant-ubuntu-trusty-64.47555: Flags [.], ack 386552008, win 72, options [nop,nop,TS val 4294714388 ecr 4294714378], length 0
12:19:18.807019 IP vagrant-ubuntu-trusty-64.47555 > 10.0.0.1.8882: Flags [P.], seq 386552172:386552336, ack 572292655, win 58, options [nop,nop,TS val 4294714417 ecr 4294714388], length 164
12:19:18.808874 IP 10.0.0.1.8882 > vagrant-ubuntu-trusty-64.47555: Flags [.], ack 386552172, win 74, options [nop,nop,TS val 4294714408 ecr 4294714398], length 0
12:19:18.826971 IP vagrant-ubuntu-trusty-64.47555 > 10.0.0.1.8882: Flags [P.], seq 386552336:386552500, ack 572292655, win 58, options [nop,nop,TS val 4294714437 ecr 4294714408], length 164
12:19:18.828058 IP 10.0.0.1.8882 > vagrant-ubuntu-trusty-64.47555: Flags [.], ack 386552336, win 76, options [nop,nop,TS val 4294714428 ecr 4294714417], length 0
12:19:18.847529 IP vagrant-ubuntu-trusty-64.47555 > 10.0.0.1.8882: Flags [P.], seq 386552500:386552664, ack 572292655, win 58, options [nop,nop,TS val 4294714458 ecr 4294714428], length 164
12:19:18.862451 IP 10.0.0.1.8882 > vagrant-ubuntu-trusty-64.47555: Flags [.], ack 386552500, win 78, options [nop,nop,TS val 4294714461 ecr 4294714437], length 0
12:19:18.867037 IP vagrant-ubuntu-trusty-64.47555 > 10.0.0.1.8882: Flags [P.], seq 386552664:386552828, ack 572292655, win 58, options [nop,nop,TS val 4294714477 ecr 4294714461], length 164
12:19:18.887824 IP vagrant-ubuntu-trusty-64.47555 > 10.0.0.1.8882: Flags [P.], seq 386552828:386552992, ack 572292655, win 58, options [nop,nop,TS val 4294714498 ecr 4294714461], length 164
12:19:18.907624 IP vagrant-ubuntu-trusty-64.47555 > 10.0.0.1.8882: Flags [P.], seq 386552992:386553156, ack 572292655, win 58, options [nop,nop,TS val 4294714518 ecr 4294714461], length 164
12:19:18.919515 IP 10.0.0.1.8882 > vagrant-ubuntu-trusty-64.47555: Flags [.], ack 386552500, win 80, options [nop,nop,TS val 4294714519 ecr 4294714437,nop,nop,sack 1 {386552664:386552828}], length 0
12:19:18.928015 IP vagrant-ubuntu-trusty-64.47555 > 10.0.0.1.8882: Flags [P.], seq 386553156:386553320, ack 572292655, win 58, options [nop,nop,TS val 4294714538 ecr 4294714519], length 164
12:19:18.938018 IP 10.0.0.1.8882 > vagrant-ubuntu-trusty-64.47555: Flags [.], ack 386552500, win 82, options [nop,nop,TS val 4294714538 ecr 4294714437,nop,nop,sack 1 {386552664:386552992}], length 0
12:19:18.947243 IP vagrant-ubuntu-trusty-64.47555 > 10.0.0.1.8882: Flags [P.], seq 386553320:386553484, ack 572292655, win 58, options [nop,nop,TS val 4294714558 ecr 4294714538], length 164
12:19:18.961864 IP 10.0.0.1.8882 > vagrant-ubuntu-trusty-64.47555: Flags [.], ack 386552500, win 84, options [nop,nop,TS val 4294714562 ecr 4294714437,nop,nop,sack 2 {386553156:386553320}{386552664:386552992}], length 0
12:19:18.961947 IP vagrant-ubuntu-trusty-64.47555 > 10.0.0.1.8882: Flags [P.], seq 386552500:386552664, ack 572292655, win 58, options [nop,nop,TS val 4294714572 ecr 4294714562], length 164
12:19:18.961988 IP vagrant-ubuntu-trusty-64.47555 > 10.0.0.1.8882: Flags [P.], seq 386552992:386553156, ack 572292655, win 58, options [nop,nop,TS val 4294714572 ecr 4294714562], length 164
12:19:18.980964 IP 10.0.0.1.8882 > vagrant-ubuntu-trusty-64.47555: Flags [.], ack 386552500, win 86, options [nop,nop,TS val 4294714580 ecr 4294714437,nop,nop,sack 2 {386553156:386553484}{386552664:386552992}], length 0
12:19:18.981034 IP vagrant-ubuntu-trusty-64.47555 > 10.0.0.1.8882: Flags [P.], seq 386553484:386553648, ack 572292655, win 58, options [nop,nop,TS val 4294714591 ecr 4294714580], length 164
12:19:18.987222 IP vagrant-ubuntu-trusty-64.47555 > 10.0.0.1.8882: Flags [P.], seq 386553648:386553812, ack 572292655, win 58, options [nop,nop,TS val 4294714597 ecr 4294714580], length 164
12:19:18.997121 IP 10.0.0.1.8882 > vagrant-ubuntu-trusty-64.47555: Flags [.], ack 386552992, win 88, options [nop,nop,TS val 4294714597 ecr 4294714572,nop,nop,sack 1 {386553156:386553484}], length 0
12:19:18.997125 IP 10.0.0.1.8882 > vagrant-ubuntu-trusty-64.47555: Flags [.], ack 386553484, win 91, options [nop,nop,TS val 4294714597 ecr 4294714572], length 0
12:19:19.007916 IP 10.0.0.1.8882 > vagrant-ubuntu-trusty-64.47555: Flags [.], ack 386553648, win 93, options [nop,nop,TS val 4294714608 ecr 4294714591], length 0
12:19:19.008042 IP vagrant-ubuntu-trusty-64.47555 > 10.0.0.1.8882: Flags [P.], seq 386553812:386553976, ack 572292655, win 58, options [nop,nop,TS val 4294714618 ecr 4294714608], length 164
12:19:19.018838 IP 10.0.0.1.8882 > vagrant-ubuntu-trusty-64.47555: Flags [.], ack 386553812, win 95, options [nop,nop,TS val 4294714618 ecr 4294714597], length 0
12:19:19.027803 IP vagrant-ubuntu-trusty-64.47555 > 10.0.0.1.8882: Flags [P.], seq 386553976:386554140, ack 572292655, win 58, options [nop,nop,TS val 4294714638 ecr 4294714618], length 164
12:19:19.042064 IP 10.0.0.1.8882 > vagrant-ubuntu-trusty-64.47555: Flags [.], ack 386553976, win 97, options [nop,nop,TS val 4294714642 ecr 4294714618], length 0
12:19:19.047113 IP vagrant-ubuntu-trusty-64.47555 > 10.0.0.1.8882: Flags [P.], seq 386554140:386554304, ack 572292655, win 58, options [nop,nop,TS val 4294714657 ecr 4294714642], length 164
12:19:19.068269 IP vagrant-ubuntu-trusty-64.47555 > 10.0.0.1.8882: Flags [P.], seq 386554304:386554468, ack 572292655, win 58, options [nop,nop,TS val 4294714678 ecr 4294714642], length 164
12:19:19.078758 IP 10.0.0.1.8882 > vagrant-ubuntu-trusty-64.47555: Flags [.], ack 386553976, win 99, options [nop,nop,TS val 4294714679 ecr 4294714618,nop,nop,sack 1 {386554140:386554304}], length 0
12:19:19.085227 IP vagrant-ubuntu-trusty-64.47555 > 10.0.0.1.8882: Flags [P.], seq 386553976:386554140, ack 572292655, win 58, options [nop,nop,TS val 4294714696 ecr 4294714679], length 164
12:19:19.087957 IP vagrant-ubuntu-trusty-64.47555 > 10.0.0.1.8882: Flags [P.], seq 386554468:386554632, ack 572292655, win 58, options [nop,nop,TS val 4294714698 ecr 4294714679], length 164
12:19:19.095750 IP 10.0.0.1.8882 > vagrant-ubuntu-trusty-64.47555: Flags [.], ack 386553976, win 101, options [nop,nop,TS val 4294714695 ecr 4294714618,nop,nop,sack 1 {386554140:386554468}], length 0
12:19:19.108037 IP vagrant-ubuntu-trusty-64.47555 > 10.0.0.1.8882: Flags [P.], seq 386554632:386554796, ack 572292655, win 58, options [nop,nop,TS val 4294714718 ecr 4294714695], length 164
12:19:19.110036 IP 10.0.0.1.8882 > vagrant-ubuntu-trusty-64.47555: Flags [.], ack 386554468, win 103, options [nop,nop,TS val 4294714710 ecr 4294714696], length 0
12:19:19.110053 IP 10.0.0.1.8882 > vagrant-ubuntu-trusty-64.47555: Flags [.], ack 386554632, win 105, options [nop,nop,TS val 4294714710 ecr 4294714698], length 0
12:19:19.127059 IP vagrant-ubuntu-trusty-64.47555 > 10.0.0.1.8882: Flags [P.], seq 386554796:386554960, ack 572292655, win 58, options [nop,nop,TS val 4294714737 ecr 4294714710], length 164
12:19:19.146960 IP vagrant-ubuntu-trusty-64.47555 > 10.0.0.1.8882: Flags [P.], seq 386554960:386555124, ack 572292655, win 58, options [nop,nop,TS val 4294714757 ecr 4294714710], length 164
12:19:19.149866 IP 10.0.0.1.8882 > vagrant-ubuntu-trusty-64.47555: Flags [.], ack 386554796, win 107, options [nop,nop,TS val 4294714749 ecr 4294714718], length 0
12:19:19.167064 IP vagrant-ubuntu-trusty-64.47555 > 10.0.0.1.8882: Flags [P.], seq 386555124:386555288, ack 572292655, win 58, options [nop,nop,TS val 4294714777 ecr 4294714749], length 164
12:19:19.170585 IP 10.0.0.1.8882 > vagrant-ubuntu-trusty-64.47555: Flags [.], ack 386554960, win 109, options [nop,nop,TS val 4294714771 ecr 4294714737], length 0
12:19:19.187008 IP vagrant-ubuntu-trusty-64.47555 > 10.0.0.1.8882: Flags [P.], seq 386555288:386555452, ack 572292655, win 58, options [nop,nop,TS val 4294714797 ecr 4294714771], length 164
12:19:19.192894 IP 10.0.0.1.8882 > vagrant-ubuntu-trusty-64.47555: Flags [.], ack 386555124, win 111, options [nop,nop,TS val 4294714792 ecr 4294714757], length 0
12:19:19.207232 IP vagrant-ubuntu-trusty-64.47555 > 10.0.0.1.8882: Flags [P.], seq 386555452:386555616, ack 572292655, win 58, options [nop,nop,TS val 4294714817 ecr 4294714792], length 164
12:19:19.214658 IP 10.0.0.1.8882 > vagrant-ubuntu-trusty-64.47555: Flags [.], ack 386555288, win 114, options [nop,nop,TS val 4294714814 ecr 4294714777], length 0
12:19:19.227016 IP vagrant-ubuntu-trusty-64.47555 > 10.0.0.1.8882: Flags [P.], seq 386555616:386555780, ack 572292655, win 58, options [nop,nop,TS val 4294714837 ecr 4294714814], length 164
12:19:19.235903 IP 10.0.0.1.8882 > vagrant-ubuntu-trusty-64.47555: Flags [.], ack 386555452, win 116, options [nop,nop,TS val 4294714835 ecr 4294714797], length 0
12:19:19.247055 IP vagrant-ubuntu-trusty-64.47555 > 10.0.0.1.8882: Flags [P.], seq 386555780:386555944, ack 572292655, win 58, options [nop,nop,TS val 4294714857 ecr 4294714835], length 164
12:19:19.253174 IP 10.0.0.1.8882 > vagrant-ubuntu-trusty-64.47555: Flags [.], ack 386555616, win 118, options [nop,nop,TS val 4294714853 ecr 4294714817], length 0
12:19:19.267160 IP vagrant-ubuntu-trusty-64.47555 > 10.0.0.1.8882: Flags [P.], seq 386555944:386556108, ack 572292655, win 58, options [nop,nop,TS val 4294714877 ecr 4294714853], length 164
12:19:19.275781 IP 10.0.0.1.8882 > vagrant-ubuntu-trusty-64.47555: Flags [.], ack 386555780, win 120, options [nop,nop,TS val 4294714875 ecr 4294714837], length 0
12:19:19.287060 IP vagrant-ubuntu-trusty-64.47555 > 10.0.0.1.8882: Flags [P.], seq 386556108:386556272, ack 572292655, win 58, options [nop,nop,TS val 4294714897 ecr 4294714875], length 164
12:19:19.293032 IP 10.0.0.1.8882 > vagrant-ubuntu-trusty-64.47555: Flags [.], ack 386555944, win 122, options [nop,nop,TS val 4294714893 ecr 4294714857], length 0
12:19:19.307261 IP vagrant-ubuntu-trusty-64.47555 > 10.0.0.1.8882: Flags [P.], seq 386556272:386556436, ack 572292655, win 58, options [nop,nop,TS val 4294714918 ecr 4294714893], length 164
12:19:19.315714 IP 10.0.0.1.8882 > vagrant-ubuntu-trusty-64.47555: Flags [.], ack 386556108, win 124, options [nop,nop,TS val 4294714915 ecr 4294714877], length 0
12:19:19.326972 IP vagrant-ubuntu-trusty-64.47555 > 10.0.0.1.8882: Flags [P.], seq 386556436:386556600, ack 572292655, win 58, options [nop,nop,TS val 4294714937 ecr 4294714915], length 164
12:19:19.336012 IP 10.0.0.1.8882 > vagrant-ubuntu-trusty-64.47555: Flags [.], ack 386556272, win 126, options [nop,nop,TS val 4294714936 ecr 4294714897], length 0
12:19:19.346992 IP vagrant-ubuntu-trusty-64.47555 > 10.0.0.1.8882: Flags [P.], seq 386556600:386556764, ack 572292655, win 58, options [nop,nop,TS val 4294714957 ecr 4294714936], length 164
12:19:19.355134 IP 10.0.0.1.8882 > vagrant-ubuntu-trusty-64.47555: Flags [.], ack 386556436, win 128, options [nop,nop,TS val 4294714954 ecr 4294714918], length 0
12:19:19.367033 IP vagrant-ubuntu-trusty-64.47555 > 10.0.0.1.8882: Flags [P.], seq 386556764:386556928, ack 572292655, win 58, options [nop,nop,TS val 4294714977 ecr 4294714954], length 164
12:19:19.376991 IP 10.0.0.1.8882 > vagrant-ubuntu-trusty-64.47555: Flags [.], ack 386556600, win 130, options [nop,nop,TS val 4294714976 ecr 4294714937], length 0
12:19:19.387129 IP vagrant-ubuntu-trusty-64.47555 > 10.0.0.1.8882: Flags [P.], seq 386556928:386557092, ack 572292655, win 58, options [nop,nop,TS val 4294714997 ecr 4294714976], length 164
12:19:19.394188 IP 10.0.0.1.8882 > vagrant-ubuntu-trusty-64.47555: Flags [.], ack 386556764, win 132, options [nop,nop,TS val 4294714994 ecr 4294714957], length 0
12:19:19.407154 IP vagrant-ubuntu-trusty-64.47555 > 10.0.0.1.8882: Flags [P.], seq 386557092:386557256, ack 572292655, win 58, options [nop,nop,TS val 4294715017 ecr 4294714994], length 164
12:19:19.417058 IP 10.0.0.1.8882 > vagrant-ubuntu-trusty-64.47555: Flags [.], ack 386556928, win 135, options [nop,nop,TS val 4294715016 ecr 4294714977], length 0
12:19:19.427255 IP vagrant-ubuntu-trusty-64.47555 > 10.0.0.1.8882: Flags [P.], seq 386557256:386557420, ack 572292655, win 58, options [nop,nop,TS val 4294715038 ecr 4294715016], length 164
12:19:19.435124 IP 10.0.0.1.8882 > vagrant-ubuntu-trusty-64.47555: Flags [.], ack 386557092, win 137, options [nop,nop,TS val 4294715034 ecr 4294714997], length 0
12:19:19.447036 IP vagrant-ubuntu-trusty-64.47555 > 10.0.0.1.8882: Flags [P.], seq 386557420:386557584, ack 572292655, win 58, options [nop,nop,TS val 4294715057 ecr 4294715034], length 164
12:19:19.456143 IP 10.0.0.1.8882 > vagrant-ubuntu-trusty-64.47555: Flags [.], ack 386557256, win 139, options [nop,nop,TS val 4294715056 ecr 4294715017], length 0
12:19:19.466993 IP vagrant-ubuntu-trusty-64.47555 > 10.0.0.1.8882: Flags [P.], seq 386557584:386557748, ack 572292655, win 58, options [nop,nop,TS val 4294715077 ecr 4294715056], length 164
12:19:19.474296 IP 10.0.0.1.8882 > vagrant-ubuntu-trusty-64.47555: Flags [.], ack 386557420, win 141, options [nop,nop,TS val 4294715074 ecr 4294715038], length 0
12:19:19.487053 IP vagrant-ubuntu-trusty-64.47555 > 10.0.0.1.8882: Flags [P.], seq 386557748:386557912, ack 572292655, win 58, options [nop,nop,TS val 4294715097 ecr 4294715074], length 164
12:19:19.496010 IP 10.0.0.1.8882 > vagrant-ubuntu-trusty-64.47555: Flags [.], ack 386557584, win 143, options [nop,nop,TS val 4294715094 ecr 4294715057], length 0
12:19:19.506976 IP vagrant-ubuntu-trusty-64.47555 > 10.0.0.1.8882: Flags [P.], seq 386557912:386558076, ack 572292655, win 58, options [nop,nop,TS val 4294715117 ecr 4294715094], length 164
12:19:19.514208 IP 10.0.0.1.8882 > vagrant-ubuntu-trusty-64.47555: Flags [.], ack 386557748, win 145, options [nop,nop,TS val 4294715114 ecr 4294715077], length 0
12:19:19.526972 IP vagrant-ubuntu-trusty-64.47555 > 10.0.0.1.8882: Flags [P.], seq 386558076:386558240, ack 572292655, win 58, options [nop,nop,TS val 4294715137 ecr 4294715114], length 164
12:19:19.536025 IP 10.0.0.1.8882 > vagrant-ubuntu-trusty-64.47555: Flags [.], ack 386557912, win 147, options [nop,nop,TS val 4294715135 ecr 4294715097], length 0
12:19:19.546996 IP vagrant-ubuntu-trusty-64.47555 > 10.0.0.1.8882: Flags [P.], seq 386558240:386558404, ack 572292655, win 58, options [nop,nop,TS val 4294715157 ecr 4294715135], length 164
12:19:19.554095 IP 10.0.0.1.8882 > vagrant-ubuntu-trusty-64.47555: Flags [.], ack 386558076, win 149, options [nop,nop,TS val 4294715154 ecr 4294715117], length 0
12:19:19.565246 IP 10.0.0.1.8882 > vagrant-ubuntu-trusty-64.47555: Flags [.], ack 386558240, win 151, options [nop,nop,TS val 4294715164 ecr 4294715137], length 0
12:19:19.566981 IP vagrant-ubuntu-trusty-64.47555 > 10.0.0.1.8882: Flags [P.], seq 386558404:386558568, ack 572292655, win 58, options [nop,nop,TS val 4294715177 ecr 4294715164], length 164
12:19:19.575583 IP 10.0.0.1.8882 > vagrant-ubuntu-trusty-64.47555: Flags [.], ack 386558404, win 153, options [nop,nop,TS val 4294715175 ecr 4294715157], length 0
12:19:19.587041 IP vagrant-ubuntu-trusty-64.47555 > 10.0.0.1.8882: Flags [P.], seq 386558568:386558732, ack 572292655, win 58, options [nop,nop,TS val 4294715197 ecr 4294715175], length 164
12:19:19.594261 IP 10.0.0.1.8882 > vagrant-ubuntu-trusty-64.47555: Flags [.], ack 386558568, win 155, options [nop,nop,TS val 4294715194 ecr 4294715177], length 0
12:19:19.607078 IP vagrant-ubuntu-trusty-64.47555 > 10.0.0.1.8882: Flags [P.], seq 386558732:386558896, ack 572292655, win 58, options [nop,nop,TS val 4294715217 ecr 4294715194], length 164
12:19:19.611048 IP 10.0.0.1.8882 > vagrant-ubuntu-trusty-64.47555: Flags [.], ack 386558732, win 158, options [nop,nop,TS val 4294715211 ecr 4294715197], length 0
12:19:19.627446 IP vagrant-ubuntu-trusty-64.47555 > 10.0.0.1.8882: Flags [P.], seq 386558896:386559060, ack 572292655, win 58, options [nop,nop,TS val 4294715238 ecr 4294715211], length 164
12:19:19.631814 IP 10.0.0.1.8882 > vagrant-ubuntu-trusty-64.47555: Flags [.], ack 386558896, win 160, options [nop,nop,TS val 4294715231 ecr 4294715217], length 0
12:19:19.647005 IP vagrant-ubuntu-trusty-64.47555 > 10.0.0.1.8882: Flags [P.], seq 386559060:386559224, ack 572292655, win 58, options [nop,nop,TS val 4294715257 ecr 4294715231], length 164
12:19:19.656140 IP 10.0.0.1.8882 > vagrant-ubuntu-trusty-64.47555: Flags [.], ack 386559060, win 162, options [nop,nop,TS val 4294715255 ecr 4294715238], length 0
12:19:19.667013 IP vagrant-ubuntu-trusty-64.47555 > 10.0.0.1.8882: Flags [P.], seq 386559224:386559388, ack 572292655, win 58, options [nop,nop,TS val 4294715277 ecr 4294715255], length 164
12:19:19.673351 IP 10.0.0.1.8882 > vagrant-ubuntu-trusty-64.47555: Flags [.], ack 386559224, win 164, options [nop,nop,TS val 4294715274 ecr 4294715257], length 0
12:19:19.687081 IP vagrant-ubuntu-trusty-64.47555 > 10.0.0.1.8882: Flags [P.], seq 386559388:386559552, ack 572292655, win 58, options [nop,nop,TS val 4294715297 ecr 4294715274], length 164
12:19:19.693204 IP 10.0.0.1.8882 > vagrant-ubuntu-trusty-64.47555: Flags [.], ack 386559388, win 166, options [nop,nop,TS val 4294715292 ecr 4294715277], length 0
12:19:19.707101 IP vagrant-ubuntu-trusty-64.47555 > 10.0.0.1.8882: Flags [P.], seq 386559552:386559716, ack 572292655, win 58, options [nop,nop,TS val 4294715317 ecr 4294715292], length 164
12:19:19.707232 IP 10.0.0.1.8882 > vagrant-ubuntu-trusty-64.47555: Flags [.], ack 386559552, win 168, options [nop,nop,TS val 4294715307 ecr 4294715297], length 0
12:19:19.727079 IP vagrant-ubuntu-trusty-64.47555 > 10.0.0.1.8882: Flags [P.], seq 386559716:386559880, ack 572292655, win 58, options [nop,nop,TS val 4294715337 ecr 4294715307], length 164
12:19:19.728002 IP 10.0.0.1.8882 > vagrant-ubuntu-trusty-64.47555: Flags [.], ack 386559716, win 170, options [nop,nop,TS val 4294715328 ecr 4294715317], length 0
12:19:19.747056 IP vagrant-ubuntu-trusty-64.47555 > 10.0.0.1.8882: Flags [P.], seq 386559880:386560044, ack 572292655, win 58, options [nop,nop,TS val 4294715357 ecr 4294715328], length 164
12:19:19.749144 IP 10.0.0.1.8882 > vagrant-ubuntu-trusty-64.47555: Flags [.], ack 386559880, win 172, options [nop,nop,TS val 4294715348 ecr 4294715337], length 0
12:19:19.767102 IP vagrant-ubuntu-trusty-64.47555 > 10.0.0.1.8882: Flags [P.], seq 386560044:386560208, ack 572292655, win 58, options [nop,nop,TS val 4294715377 ecr 4294715348], length 164
12:19:19.768831 IP 10.0.0.1.8882 > vagrant-ubuntu-trusty-64.47555: Flags [.], ack 386560044, win 174, options [nop,nop,TS val 4294715368 ecr 4294715357], length 0
12:19:19.787126 IP vagrant-ubuntu-trusty-64.47555 > 10.0.0.1.8882: Flags [P.], seq 386560208:386560372, ack 572292655, win 58, options [nop,nop,TS val 4294715397 ecr 4294715368], length 164
12:19:19.787396 IP 10.0.0.1.8882 > vagrant-ubuntu-trusty-64.47555: Flags [.], ack 386560208, win 176, options [nop,nop,TS val 4294715388 ecr 4294715377], length 0
12:19:19.807086 IP vagrant-ubuntu-trusty-64.47555 > 10.0.0.1.8882: Flags [P.], seq 386560372:386560536, ack 572292655, win 58, options [nop,nop,TS val 4294715417 ecr 4294715388], length 164
12:19:19.807274 IP 10.0.0.1.8882 > vagrant-ubuntu-trusty-64.47555: Flags [.], ack 386560372, win 178, options [nop,nop,TS val 4294715408 ecr 4294715397], length 0
12:19:19.827089 IP vagrant-ubuntu-trusty-64.47555 > 10.0.0.1.8882: Flags [P.], seq 386560536:386560700, ack 572292655, win 58, options [nop,nop,TS val 4294715437 ecr 4294715408], length 164
12:19:19.827399 IP 10.0.0.1.8882 > vagrant-ubuntu-trusty-64.47555: Flags [.], ack 386560536, win 181, options [nop,nop,TS val 4294715428 ecr 4294715417], length 0
12:19:19.847744 IP vagrant-ubuntu-trusty-64.47555 > 10.0.0.1.8882: Flags [P.], seq 386560700:386560864, ack 572292655, win 58, options [nop,nop,TS val 4294715458 ecr 4294715428], length 164
12:19:19.858665 IP 10.0.0.1.8882 > vagrant-ubuntu-trusty-64.47555: Flags [.], ack 386560700, win 183, options [nop,nop,TS val 4294715459 ecr 4294715437], length 0
12:19:19.867118 IP vagrant-ubuntu-trusty-64.47555 > 10.0.0.1.8882: Flags [P.], seq 386560864:386561028, ack 572292655, win 58, options [nop,nop,TS val 4294715477 ecr 4294715459], length 164
12:19:19.869302 IP 10.0.0.1.8882 > vagrant-ubuntu-trusty-64.47555: Flags [.], ack 386560864, win 185, options [nop,nop,TS val 4294715469 ecr 4294715458], length 0
12:19:19.887116 IP vagrant-ubuntu-trusty-64.47555 > 10.0.0.1.8882: Flags [P.], seq 386561028:386561192, ack 572292655, win 58, options [nop,nop,TS val 4294715497 ecr 4294715469], length 164
12:19:19.887345 IP 10.0.0.1.8882 > vagrant-ubuntu-trusty-64.47555: Flags [.], ack 386561028, win 187, options [nop,nop,TS val 4294715488 ecr 4294715477], length 0
12:19:19.907294 IP 10.0.0.1.8882 > vagrant-ubuntu-trusty-64.47555: Flags [.], ack 386561192, win 189, options [nop,nop,TS val 4294715507 ecr 4294715497], length 0
12:19:19.907385 IP vagrant-ubuntu-trusty-64.47555 > 10.0.0.1.8882: Flags [P.], seq 386561192:386561356, ack 572292655, win 58, options [nop,nop,TS val 4294715518 ecr 4294715507], length 164
12:19:19.927107 IP vagrant-ubuntu-trusty-64.47555 > 10.0.0.1.8882: Flags [P.], seq 386561356:386561520, ack 572292655, win 58, options [nop,nop,TS val 4294715537 ecr 4294715507], length 164
12:19:19.927516 IP 10.0.0.1.8882 > vagrant-ubuntu-trusty-64.47555: Flags [.], ack 386561356, win 191, options [nop,nop,TS val 4294715528 ecr 4294715518], length 0
12:19:19.947289 IP vagrant-ubuntu-trusty-64.47555 > 10.0.0.1.8882: Flags [P.], seq 386561520:386561684, ack 572292655, win 58, options [nop,nop,TS val 4294715558 ecr 4294715528], length 164
12:19:19.952367 IP 10.0.0.1.8882 > vagrant-ubuntu-trusty-64.47555: Flags [.], ack 386561520, win 193, options [nop,nop,TS val 4294715552 ecr 4294715537], length 0
12:19:19.967471 IP vagrant-ubuntu-trusty-64.47555 > 10.0.0.1.8882: Flags [P.], seq 386561684:386561848, ack 572292655, win 58, options [nop,nop,TS val 4294715578 ecr 4294715552], length 164
12:19:19.968519 IP 10.0.0.1.8882 > vagrant-ubuntu-trusty-64.47555: Flags [.], ack 386561684, win 195, options [nop,nop,TS val 4294715569 ecr 4294715558], length 0
12:19:19.987127 IP vagrant-ubuntu-trusty-64.47555 > 10.0.0.1.8882: Flags [P.], seq 386561848:386562012, ack 572292655, win 58, options [nop,nop,TS val 4294715597 ecr 4294715569], length 164
12:19:19.989135 IP 10.0.0.1.8882 > vagrant-ubuntu-trusty-64.47555: Flags [.], ack 386561848, win 197, options [nop,nop,TS val 4294715588 ecr 4294715578], length 0
12:19:20.007428 IP 10.0.0.1.8882 > vagrant-ubuntu-trusty-64.47555: Flags [.], ack 386562012, win 199, options [nop,nop,TS val 4294715608 ecr 4294715597], length 0
12:19:20.007466 IP vagrant-ubuntu-trusty-64.47555 > 10.0.0.1.8882: Flags [P.], seq 386562012:386562176, ack 572292655, win 58, options [nop,nop,TS val 4294715618 ecr 4294715588], length 164
12:19:20.027109 IP vagrant-ubuntu-trusty-64.47555 > 10.0.0.1.8882: Flags [P.], seq 386562176:386562340, ack 572292655, win 58, options [nop,nop,TS val 4294715637 ecr 4294715608], length 164
12:19:20.029298 IP 10.0.0.1.8882 > vagrant-ubuntu-trusty-64.47555: Flags [.], ack 386562176, win 202, options [nop,nop,TS val 4294715628 ecr 4294715618], length 0
12:19:20.047370 IP vagrant-ubuntu-trusty-64.47555 > 10.0.0.1.8882: Flags [P.], seq 386562340:386562504, ack 572292655, win 58, options [nop,nop,TS val 4294715658 ecr 4294715628], length 164
12:19:20.047631 IP 10.0.0.1.8882 > vagrant-ubuntu-trusty-64.47555: Flags [.], ack 386562340, win 204, options [nop,nop,TS val 4294715648 ecr 4294715637], length 0
12:19:20.067145 IP vagrant-ubuntu-trusty-64.47555 > 10.0.0.1.8882: Flags [P.], seq 386562504:386562668, ack 572292655, win 58, options [nop,nop,TS val 4294715677 ecr 4294715648], length 164
12:19:20.067591 IP 10.0.0.1.8882 > vagrant-ubuntu-trusty-64.47555: Flags [.], ack 386562504, win 206, options [nop,nop,TS val 4294715667 ecr 4294715658], length 0
12:19:20.087138 IP vagrant-ubuntu-trusty-64.47555 > 10.0.0.1.8882: Flags [P.], seq 386562668:386562832, ack 572292655, win 58, options [nop,nop,TS val 4294715697 ecr 4294715667], length 164
12:19:20.087402 IP 10.0.0.1.8882 > vagrant-ubuntu-trusty-64.47555: Flags [.], ack 386562668, win 208, options [nop,nop,TS val 4294715688 ecr 4294715677], length 0
12:19:20.107475 IP 10.0.0.1.8882 > vagrant-ubuntu-trusty-64.47555: Flags [.], ack 386562832, win 210, options [nop,nop,TS val 4294715708 ecr 4294715697], length 0
12:19:20.107634 IP vagrant-ubuntu-trusty-64.47555 > 10.0.0.1.8882: Flags [P.], seq 386562832:386562996, ack 572292655, win 58, options [nop,nop,TS val 4294715718 ecr 4294715708], length 164
12:19:20.126997 IP vagrant-ubuntu-trusty-64.47555 > 10.0.0.1.8882: Flags [P.], seq 386562996:386563160, ack 572292655, win 58, options [nop,nop,TS val 4294715737 ecr 4294715708], length 164
12:19:20.128716 IP 10.0.0.1.8882 > vagrant-ubuntu-trusty-64.47555: Flags [.], ack 386562996, win 212, options [nop,nop,TS val 4294715729 ecr 4294715718], length 0
12:19:20.147153 IP vagrant-ubuntu-trusty-64.47555 > 10.0.0.1.8882: Flags [P.], seq 386563160:386563324, ack 572292655, win 58, options [nop,nop,TS val 4294715757 ecr 4294715729], length 164
12:19:20.148309 IP 10.0.0.1.8882 > vagrant-ubuntu-trusty-64.47555: Flags [.], ack 386563160, win 214, options [nop,nop,TS val 4294715748 ecr 4294715737], length 0
12:19:20.167072 IP vagrant-ubuntu-trusty-64.47555 > 10.0.0.1.8882: Flags [P.], seq 386563324:386563488, ack 572292655, win 58, options [nop,nop,TS val 4294715777 ecr 4294715748], length 164
12:19:20.167409 IP 10.0.0.1.8882 > vagrant-ubuntu-trusty-64.47555: Flags [.], ack 386563324, win 216, options [nop,nop,TS val 4294715768 ecr 4294715757], length 0
12:19:20.187114 IP vagrant-ubuntu-trusty-64.47555 > 10.0.0.1.8882: Flags [P.], seq 386563488:386563652, ack 572292655, win 58, options [nop,nop,TS val 4294715797 ecr 4294715768], length 164
12:19:20.187762 IP 10.0.0.1.8882 > vagrant-ubuntu-trusty-64.47555: Flags [.], ack 386563488, win 218, options [nop,nop,TS val 4294715788 ecr 4294715777], length 0
12:19:20.207659 IP 10.0.0.1.8882 > vagrant-ubuntu-trusty-64.47555: Flags [.], ack 386563652, win 220, options [nop,nop,TS val 4294715808 ecr 4294715797], length 0
12:19:20.207805 IP vagrant-ubuntu-trusty-64.47555 > 10.0.0.1.8882: Flags [P.], seq 386563652:386563816, ack 572292655, win 58, options [nop,nop,TS val 4294715818 ecr 4294715808], length 164
12:19:20.227403 IP vagrant-ubuntu-trusty-64.47555 > 10.0.0.1.8882: Flags [P.], seq 386563816:386563980, ack 572292655, win 58, options [nop,nop,TS val 4294715838 ecr 4294715808], length 164
12:19:20.229089 IP 10.0.0.1.8882 > vagrant-ubuntu-trusty-64.47555: Flags [.], ack 386563816, win 222, options [nop,nop,TS val 4294715828 ecr 4294715818], length 0
12:19:20.247649 IP vagrant-ubuntu-trusty-64.47555 > 10.0.0.1.8882: Flags [P.], seq 386563980:386564144, ack 572292655, win 58, options [nop,nop,TS val 4294715858 ecr 4294715828], length 164
12:19:20.248597 IP 10.0.0.1.8882 > vagrant-ubuntu-trusty-64.47555: Flags [.], ack 386563980, win 225, options [nop,nop,TS val 4294715848 ecr 4294715838], length 0
12:19:20.267643 IP vagrant-ubuntu-trusty-64.47555 > 10.0.0.1.8882: Flags [P.], seq 386564144:386564308, ack 572292655, win 58, options [nop,nop,TS val 4294715878 ecr 4294715848], length 164
12:19:20.268306 IP 10.0.0.1.8882 > vagrant-ubuntu-trusty-64.47555: Flags [.], ack 386564144, win 227, options [nop,nop,TS val 4294715869 ecr 4294715858], length 0
12:19:20.287554 IP vagrant-ubuntu-trusty-64.47555 > 10.0.0.1.8882: Flags [P.], seq 386564308:386564472, ack 572292655, win 58, options [nop,nop,TS val 4294715898 ecr 4294715869], length 164
12:19:20.289327 IP 10.0.0.1.8882 > vagrant-ubuntu-trusty-64.47555: Flags [.], ack 386564308, win 229, options [nop,nop,TS val 4294715889 ecr 4294715878], length 0
12:19:20.307450 IP vagrant-ubuntu-trusty-64.47555 > 10.0.0.1.8882: Flags [P.], seq 386564472:386564636, ack 572292655, win 58, options [nop,nop,TS val 4294715918 ecr 4294715889], length 164
12:19:20.308444 IP 10.0.0.1.8882 > vagrant-ubuntu-trusty-64.47555: Flags [.], ack 386564472, win 231, options [nop,nop,TS val 4294715908 ecr 4294715898], length 0
12:19:20.327641 IP vagrant-ubuntu-trusty-64.47555 > 10.0.0.1.8882: Flags [P.], seq 386564636:386564800, ack 572292655, win 58, options [nop,nop,TS val 4294715938 ecr 4294715908], length 164
12:19:20.327699 IP 10.0.0.1.8882 > vagrant-ubuntu-trusty-64.47555: Flags [.], ack 386564636, win 233, options [nop,nop,TS val 4294715928 ecr 4294715918], length 0
12:19:20.347616 IP vagrant-ubuntu-trusty-64.47555 > 10.0.0.1.8882: Flags [P.], seq 386564800:386564964, ack 572292655, win 58, options [nop,nop,TS val 4294715958 ecr 4294715928], length 164
12:19:20.348741 IP 10.0.0.1.8882 > vagrant-ubuntu-trusty-64.47555: Flags [.], ack 386564800, win 235, options [nop,nop,TS val 4294715949 ecr 4294715938], length 0
12:19:20.367788 IP vagrant-ubuntu-trusty-64.47555 > 10.0.0.1.8882: Flags [P.], seq 386564964:386565128, ack 572292655, win 58, options [nop,nop,TS val 4294715978 ecr 4294715949], length 164
12:19:20.368783 IP 10.0.0.1.8882 > vagrant-ubuntu-trusty-64.47555: Flags [.], ack 386564964, win 237, options [nop,nop,TS val 4294715969 ecr 4294715958], length 0
12:19:20.387701 IP vagrant-ubuntu-trusty-64.47555 > 10.0.0.1.8882: Flags [P.], seq 386565128:386565292, ack 572292655, win 58, options [nop,nop,TS val 4294715998 ecr 4294715969], length 164
12:19:20.390335 IP 10.0.0.1.8882 > vagrant-ubuntu-trusty-64.47555: Flags [.], ack 386565128, win 239, options [nop,nop,TS val 4294715990 ecr 4294715978], length 0
12:19:20.407558 IP vagrant-ubuntu-trusty-64.47555 > 10.0.0.1.8882: Flags [P.], seq 386565292:386565456, ack 572292655, win 58, options [nop,nop,TS val 4294716018 ecr 4294715990], length 164
12:19:20.408782 IP 10.0.0.1.8882 > vagrant-ubuntu-trusty-64.47555: Flags [.], ack 386565292, win 241, options [nop,nop,TS val 4294716009 ecr 4294715998], length 0
12:19:20.427743 IP 10.0.0.1.8882 > vagrant-ubuntu-trusty-64.47555: Flags [.], ack 386565456, win 243, options [nop,nop,TS val 4294716028 ecr 4294716018], length 0
12:19:20.427804 IP vagrant-ubuntu-trusty-64.47555 > 10.0.0.1.8882: Flags [P.], seq 386565456:386565620, ack 572292655, win 58, options [nop,nop,TS val 4294716038 ecr 4294716028], length 164
12:19:20.447571 IP vagrant-ubuntu-trusty-64.47555 > 10.0.0.1.8882: Flags [P.], seq 386565620:386565784, ack 572292655, win 58, options [nop,nop,TS val 4294716058 ecr 4294716028], length 164
12:19:20.448538 IP 10.0.0.1.8882 > vagrant-ubuntu-trusty-64.47555: Flags [.], ack 386565620, win 245, options [nop,nop,TS val 4294716048 ecr 4294716038], length 0
12:19:20.467752 IP vagrant-ubuntu-trusty-64.47555 > 10.0.0.1.8882: Flags [P.], seq 386565784:386565948, ack 572292655, win 58, options [nop,nop,TS val 4294716078 ecr 4294716048], length 164
12:19:20.472394 IP 10.0.0.1.8882 > vagrant-ubuntu-trusty-64.47555: Flags [.], ack 386565784, win 248, options [nop,nop,TS val 4294716072 ecr 4294716058], length 0
12:19:20.486967 IP vagrant-ubuntu-trusty-64.47555 > 10.0.0.1.8882: Flags [P.], seq 386565948:386566112, ack 572292655, win 58, options [nop,nop,TS val 4294716097 ecr 4294716072], length 164
12:19:20.489531 IP 10.0.0.1.8882 > vagrant-ubuntu-trusty-64.47555: Flags [.], ack 386565948, win 250, options [nop,nop,TS val 4294716089 ecr 4294716078], length 0
12:19:20.507498 IP vagrant-ubuntu-trusty-64.47555 > 10.0.0.1.8882: Flags [P.], seq 386566112:386566276, ack 572292655, win 58, options [nop,nop,TS val 4294716118 ecr 4294716089], length 164
12:19:20.508685 IP 10.0.0.1.8882 > vagrant-ubuntu-trusty-64.47555: Flags [.], ack 386566112, win 252, options [nop,nop,TS val 4294716108 ecr 4294716097], length 0
12:19:20.527677 IP vagrant-ubuntu-trusty-64.47555 > 10.0.0.1.8882: Flags [P.], seq 386566276:386566440, ack 572292655, win 58, options [nop,nop,TS val 4294716138 ecr 4294716108], length 164
12:19:20.528610 IP 10.0.0.1.8882 > vagrant-ubuntu-trusty-64.47555: Flags [.], ack 386566276, win 254, options [nop,nop,TS val 4294716128 ecr 4294716118], length 0
12:19:20.547534 IP vagrant-ubuntu-trusty-64.47555 > 10.0.0.1.8882: Flags [P.], seq 386566440:386566604, ack 572292655, win 58, options [nop,nop,TS val 4294716158 ecr 4294716128], length 164
12:19:20.556587 IP 10.0.0.1.8882 > vagrant-ubuntu-trusty-64.47555: Flags [.], ack 386566440, win 256, options [nop,nop,TS val 4294716155 ecr 4294716138], length 0
12:19:20.567039 IP vagrant-ubuntu-trusty-64.47555 > 10.0.0.1.8882: Flags [P.], seq 386566604:386566768, ack 572292655, win 58, options [nop,nop,TS val 4294716177 ecr 4294716155], length 164
12:19:20.568263 IP 10.0.0.1.8882 > vagrant-ubuntu-trusty-64.47555: Flags [.], ack 386566604, win 258, options [nop,nop,TS val 4294716168 ecr 4294716158], length 0
12:19:20.587542 IP vagrant-ubuntu-trusty-64.47555 > 10.0.0.1.8882: Flags [P.], seq 386566768:386566932, ack 572292655, win 58, options [nop,nop,TS val 4294716198 ecr 4294716168], length 164
12:19:20.588558 IP 10.0.0.1.8882 > vagrant-ubuntu-trusty-64.47555: Flags [.], ack 386566768, win 260, options [nop,nop,TS val 4294716188 ecr 4294716177], length 0
12:19:20.607623 IP vagrant-ubuntu-trusty-64.47555 > 10.0.0.1.8882: Flags [P.], seq 386566932:386567096, ack 572292655, win 58, options [nop,nop,TS val 4294716218 ecr 4294716188], length 164
12:19:20.607880 IP 10.0.0.1.8882 > vagrant-ubuntu-trusty-64.47555: Flags [.], ack 386566932, win 262, options [nop,nop,TS val 4294716208 ecr 4294716198], length 0
12:19:20.627858 IP vagrant-ubuntu-trusty-64.47555 > 10.0.0.1.8882: Flags [P.], seq 386567096:386567260, ack 572292655, win 58, options [nop,nop,TS val 4294716238 ecr 4294716208], length 164
12:19:20.629235 IP 10.0.0.1.8882 > vagrant-ubuntu-trusty-64.47555: Flags [.], ack 386567096, win 264, options [nop,nop,TS val 4294716228 ecr 4294716218], length 0
12:19:20.647705 IP vagrant-ubuntu-trusty-64.47555 > 10.0.0.1.8882: Flags [P.], seq 386567260:386567424, ack 572292655, win 58, options [nop,nop,TS val 4294716258 ecr 4294716228], length 164
12:19:20.648618 IP 10.0.0.1.8882 > vagrant-ubuntu-trusty-64.47555: Flags [.], ack 386567260, win 266, options [nop,nop,TS val 4294716248 ecr 4294716238], length 0
12:19:20.667848 IP vagrant-ubuntu-trusty-64.47555 > 10.0.0.1.8882: Flags [P.], seq 386567424:386567588, ack 572292655, win 58, options [nop,nop,TS val 4294716278 ecr 4294716248], length 164
12:19:20.668765 IP 10.0.0.1.8882 > vagrant-ubuntu-trusty-64.47555: Flags [.], ack 386567424, win 269, options [nop,nop,TS val 4294716269 ecr 4294716258], length 0
12:19:20.687639 IP vagrant-ubuntu-trusty-64.47555 > 10.0.0.1.8882: Flags [P.], seq 386567588:386567752, ack 572292655, win 58, options [nop,nop,TS val 4294716298 ecr 4294716269], length 164
12:19:20.688904 IP 10.0.0.1.8882 > vagrant-ubuntu-trusty-64.47555: Flags [.], ack 386567588, win 271, options [nop,nop,TS val 4294716289 ecr 4294716278], length 0
12:19:20.707661 IP vagrant-ubuntu-trusty-64.47555 > 10.0.0.1.8882: Flags [P.], seq 386567752:386567916, ack 572292655, win 58, options [nop,nop,TS val 4294716318 ecr 4294716289], length 164
12:19:20.708795 IP 10.0.0.1.8882 > vagrant-ubuntu-trusty-64.47555: Flags [.], ack 386567752, win 273, options [nop,nop,TS val 4294716309 ecr 4294716298], length 0
12:19:20.727874 IP vagrant-ubuntu-trusty-64.47555 > 10.0.0.1.8882: Flags [P.], seq 386567916:386568080, ack 572292655, win 58, options [nop,nop,TS val 4294716338 ecr 4294716309], length 164
12:19:20.728782 IP 10.0.0.1.8882 > vagrant-ubuntu-trusty-64.47555: Flags [.], ack 386567916, win 275, options [nop,nop,TS val 4294716329 ecr 4294716318], length 0
12:19:20.747649 IP vagrant-ubuntu-trusty-64.47555 > 10.0.0.1.8882: Flags [P.], seq 386568080:386568244, ack 572292655, win 58, options [nop,nop,TS val 4294716358 ecr 4294716329], length 164
12:19:20.748704 IP 10.0.0.1.8882 > vagrant-ubuntu-trusty-64.47555: Flags [.], ack 386568080, win 277, options [nop,nop,TS val 4294716348 ecr 4294716338], length 0
12:19:20.767875 IP vagrant-ubuntu-trusty-64.47555 > 10.0.0.1.8882: Flags [P.], seq 386568244:386568408, ack 572292655, win 58, options [nop,nop,TS val 4294716378 ecr 4294716348], length 164
12:19:20.768693 IP 10.0.0.1.8882 > vagrant-ubuntu-trusty-64.47555: Flags [.], ack 386568244, win 279, options [nop,nop,TS val 4294716369 ecr 4294716358], length 0
12:19:20.787658 IP vagrant-ubuntu-trusty-64.47555 > 10.0.0.1.8882: Flags [P.], seq 386568408:386568572, ack 572292655, win 58, options [nop,nop,TS val 4294716398 ecr 4294716369], length 164
12:19:20.788716 IP 10.0.0.1.8882 > vagrant-ubuntu-trusty-64.47555: Flags [.], ack 386568408, win 281, options [nop,nop,TS val 4294716388 ecr 4294716378], length 0
12:19:20.807579 IP vagrant-ubuntu-trusty-64.47555 > 10.0.0.1.8882: Flags [P.], seq 386568572:386568736, ack 572292655, win 58, options [nop,nop,TS val 4294716418 ecr 4294716388], length 164
12:19:20.808548 IP 10.0.0.1.8882 > vagrant-ubuntu-trusty-64.47555: Flags [.], ack 386568572, win 283, options [nop,nop,TS val 4294716408 ecr 4294716398], length 0
12:19:20.827570 IP vagrant-ubuntu-trusty-64.47555 > 10.0.0.1.8882: Flags [P.], seq 386568736:386568900, ack 572292655, win 58, options [nop,nop,TS val 4294716438 ecr 4294716408], length 164
12:19:20.827921 IP 10.0.0.1.8882 > vagrant-ubuntu-trusty-64.47555: Flags [.], ack 386568736, win 285, options [nop,nop,TS val 4294716428 ecr 4294716418], length 0
12:19:20.847169 IP vagrant-ubuntu-trusty-64.47555 > 10.0.0.1.8882: Flags [P.], seq 386568900:386569064, ack 572292655, win 58, options [nop,nop,TS val 4294716457 ecr 4294716428], length 164
12:19:20.848766 IP 10.0.0.1.8882 > vagrant-ubuntu-trusty-64.47555: Flags [.], ack 386568900, win 287, options [nop,nop,TS val 4294716448 ecr 4294716438], length 0
12:19:20.867162 IP vagrant-ubuntu-trusty-64.47555 > 10.0.0.1.8882: Flags [P.], seq 386569064:386569228, ack 572292655, win 58, options [nop,nop,TS val 4294716477 ecr 4294716448], length 164
12:19:20.868421 IP 10.0.0.1.8882 > vagrant-ubuntu-trusty-64.47555: Flags [.], ack 386569064, win 289, options [nop,nop,TS val 4294716468 ecr 4294716457], length 0
12:19:20.887755 IP 10.0.0.1.8882 > vagrant-ubuntu-trusty-64.47555: Flags [.], ack 386569228, win 292, options [nop,nop,TS val 4294716488 ecr 4294716477], length 0
12:19:20.887802 IP vagrant-ubuntu-trusty-64.47555 > 10.0.0.1.8882: Flags [P.], seq 386569228:386569392, ack 572292655, win 58, options [nop,nop,TS val 4294716498 ecr 4294716468], length 164
12:19:20.907682 IP vagrant-ubuntu-trusty-64.47555 > 10.0.0.1.8882: Flags [P.], seq 386569392:386569556, ack 572292655, win 58, options [nop,nop,TS val 4294716518 ecr 4294716488], length 164
