11:19:44.860049 IP 10.0.0.2.56819 > 10.0.0.1.8882: Flags [P.], seq 228228122:228228286, ack 2709335573, win 58, options [nop,nop,TS val 4294787112 ecr 4294787081], length 164
11:19:44.860658 IP 10.0.0.1.8882 > 10.0.0.2.56819: Flags [.], ack 228228122, win 82, options [nop,nop,TS val 4294787102 ecr 4294787091], length 0
11:19:44.879513 IP 10.0.0.2.56819 > 10.0.0.1.8882: Flags [P.], seq 228228286:228228450, ack 2709335573, win 58, options [nop,nop,TS val 4294787131 ecr 4294787102], length 164
11:19:44.880777 IP 10.0.0.1.8882 > 10.0.0.2.56819: Flags [.], ack 228228286, win 84, options [nop,nop,TS val 4294787122 ecr 4294787112], length 0
11:19:44.899469 IP 10.0.0.2.56819 > 10.0.0.1.8882: Flags [P.], seq 228228450:228228614, ack 2709335573, win 58, options [nop,nop,TS val 4294787151 ecr 4294787122], length 164
11:19:44.900640 IP 10.0.0.1.8882 > 10.0.0.2.56819: Flags [.], ack 228228450, win 86, options [nop,nop,TS val 4294787142 ecr 4294787131], length 0
11:19:44.919554 IP 10.0.0.2.56819 > 10.0.0.1.8882: Flags [P.], seq 228228614:228228778, ack 2709335573, win 58, options [nop,nop,TS val 4294787171 ecr 4294787142], length 164
11:19:44.920993 IP 10.0.0.1.8882 > 10.0.0.2.56819: Flags [.], ack 228228614, win 88, options [nop,nop,TS val 4294787162 ecr 4294787151], length 0
11:19:44.940510 IP 10.0.0.2.56819 > 10.0.0.1.8882: Flags [P.], seq 228228778:228228942, ack 2709335573, win 58, options [nop,nop,TS val 4294787192 ecr 4294787162], length 164
11:19:44.941110 IP 10.0.0.1.8882 > 10.0.0.2.56819: Flags [.], ack 228228778, win 91, options [nop,nop,TS val 4294787183 ecr 4294787171], length 0
11:19:44.959453 IP 10.0.0.2.56819 > 10.0.0.1.8882: Flags [P.], seq 228228942:228229106, ack 2709335573, win 58, options [nop,nop,TS val 4294787211 ecr 4294787183], length 164
11:19:44.960871 IP 10.0.0.1.8882 > 10.0.0.2.56819: Flags [.], ack 228228942, win 93, options [nop,nop,TS val 4294787202 ecr 4294787192], length 0
11:19:44.979821 IP 10.0.0.1.8882 > 10.0.0.2.56819: Flags [.], ack 228229106, win 95, options [nop,nop,TS val 4294787221 ecr 4294787211], length 0
11:19:44.979928 IP 10.0.0.2.56819 > 10.0.0.1.8882: Flags [P.], seq 228229106:228229270, ack 2709335573, win 58, options [nop,nop,TS val 4294787231 ecr 4294787202], length 164
11:19:44.999456 IP 10.0.0.2.56819 > 10.0.0.1.8882: Flags [P.], seq 228229270:228229434, ack 2709335573, win 58, options [nop,nop,TS val 4294787251 ecr 4294787221], length 164
11:19:45.000401 IP 10.0.0.1.8882 > 10.0.0.2.56819: Flags [.], ack 228229270, win 97, options [nop,nop,TS val 4294787242 ecr 4294787231], length 0
11:19:45.019925 IP 10.0.0.1.8882 > 10.0.0.2.56819: Flags [.], ack 228229434, win 99, options [nop,nop,TS val 4294787261 ecr 4294787251], length 0
11:19:45.020044 IP 10.0.0.2.56819 > 10.0.0.1.8882: Flags [P.], seq 228229434:228229598, ack 2709335573, win 58, options [nop,nop,TS val 4294787272 ecr 4294787261], length 164
11:19:45.039469 IP 10.0.0.2.56819 > 10.0.0.1.8882: Flags [P.], seq 228229598:228229762, ack 2709335573, win 58, options [nop,nop,TS val 4294787291 ecr 4294787261], length 164
11:19:45.040411 IP 10.0.0.1.8882 > 10.0.0.2.56819: Flags [.], ack 228229598, win 101, options [nop,nop,TS val 4294787282 ecr 4294787272], length 0
11:19:45.059628 IP 10.0.0.2.56819 > 10.0.0.1.8882: Flags [P.], seq 228229762:228229926, ack 2709335573, win 58, options [nop,nop,TS val 4294787311 ecr 4294787282], length 164
11:19:45.060037 IP 10.0.0.1.8882 > 10.0.0.2.56819: Flags [.], ack 228229762, win 103, options [nop,nop,TS val 4294787301 ecr 4294787291], length 0
11:19:45.079821 IP 10.0.0.2.56819 > 10.0.0.1.8882: Flags [P.], seq 228229926:228230090, ack 2709335573, win 58, options [nop,nop,TS val 4294787331 ecr 4294787301], length 164
11:19:45.080256 IP 10.0.0.1.8882 > 10.0.0.2.56819: Flags [.], ack 228229926, win 105, options [nop,nop,TS val 4294787322 ecr 4294787311], length 0
11:19:45.099484 IP 10.0.0.2.56819 > 10.0.0.1.8882: Flags [P.], seq 228230090:228230254, ack 2709335573, win 58, options [nop,nop,TS val 4294787351 ecr 4294787322], length 164
11:19:45.100532 IP 10.0.0.1.8882 > 10.0.0.2.56819: Flags [.], ack 228230090, win 107, options [nop,nop,TS val 4294787342 ecr 4294787331], length 0
11:19:45.119502 IP 10.0.0.2.56819 > 10.0.0.1.8882: Flags [P.], seq 228230254:228230418, ack 2709335573, win 58, options [nop,nop,TS val 4294787371 ecr 4294787342], length 164
11:19:45.119739 IP 10.0.0.1.8882 > 10.0.0.2.56819: Flags [.], ack 228230254, win 109, options [nop,nop,TS val 4294787361 ecr 4294787351], length 0
11:19:45.139551 IP 10.0.0.2.56819 > 10.0.0.1.8882: Flags [P.], seq 228230418:228230582, ack 2709335573, win 58, options [nop,nop,TS val 4294787391 ecr 4294787361], length 164
11:19:45.140189 IP 10.0.0.1.8882 > 10.0.0.2.56819: Flags [.], ack 228230418, win 111, options [nop,nop,TS val 4294787382 ecr 4294787371], length 0
11:19:45.159480 IP 10.0.0.2.56819 > 10.0.0.1.8882: Flags [P.], seq 228230582:228230746, ack 2709335573, win 58, options [nop,nop,TS val 4294787411 ecr 4294787382], length 164
11:19:45.159877 IP 10.0.0.1.8882 > 10.0.0.2.56819: Flags [.], ack 228230582, win 114, options [nop,nop,TS val 4294787401 ecr 4294787391], length 0
11:19:45.179513 IP 10.0.0.2.56819 > 10.0.0.1.8882: Flags [P.], seq 228230746:228230910, ack 2709335573, win 58, options [nop,nop,TS val 4294787431 ecr 4294787401], length 164
11:19:45.179836 IP 10.0.0.1.8882 > 10.0.0.2.56819: Flags [.], ack 228230746, win 116, options [nop,nop,TS val 4294787421 ecr 4294787411], length 0
11:19:45.199503 IP 10.0.0.2.56819 > 10.0.0.1.8882: Flags [P.], seq 228230910:228231074, ack 2709335573, win 58, options [nop,nop,TS val 4294787451 ecr 4294787421], length 164
11:19:45.199800 IP 10.0.0.1.8882 > 10.0.0.2.56819: Flags [.], ack 228230910, win 118, options [nop,nop,TS val 4294787441 ecr 4294787431], length 0
11:19:45.219410 IP 10.0.0.2.56819 > 10.0.0.1.8882: Flags [P.], seq 228231074:228231238, ack 2709335573, win 58, options [nop,nop,TS val 4294787471 ecr 4294787441], length 164
11:19:45.219932 IP 10.0.0.1.8882 > 10.0.0.2.56819: Flags [.], ack 228231074, win 120, options [nop,nop,TS val 4294787461 ecr 4294787451], length 0
11:19:45.239566 IP 10.0.0.2.56819 > 10.0.0.1.8882: Flags [P.], seq 228231238:228231402, ack 2709335573, win 58, options [nop,nop,TS val 4294787491 ecr 4294787461], length 164
11:19:45.240039 IP 10.0.0.1.8882 > 10.0.0.2.56819: Flags [.], ack 228231238, win 122, options [nop,nop,TS val 4294787481 ecr 4294787471], length 0
11:19:45.259637 IP 10.0.0.2.56819 > 10.0.0.1.8882: Flags [P.], seq 228231402:228231566, ack 2709335573, win 58, options [nop,nop,TS val 4294787511 ecr 4294787481], length 164
11:19:45.259815 IP 10.0.0.1.8882 > 10.0.0.2.56819: Flags [.], ack 228231402, win 124, options [nop,nop,TS val 4294787501 ecr 4294787491], length 0
11:19:45.279707 IP 10.0.0.2.56819 > 10.0.0.1.8882: Flags [P.], seq 228231566:228231730, ack 2709335573, win 58, options [nop,nop,TS val 4294787531 ecr 4294787501], length 164
11:19:45.280452 IP 10.0.0.1.8882 > 10.0.0.2.56819: Flags [.], ack 228231566, win 126, options [nop,nop,TS val 4294787522 ecr 4294787511], length 0
11:19:45.299495 IP 10.0.0.2.56819 > 10.0.0.1.8882: Flags [P.], seq 228231730:228231894, ack 2709335573, win 58, options [nop,nop,TS val 4294787551 ecr 4294787522], length 164
11:19:45.300087 IP 10.0.0.1.8882 > 10.0.0.2.56819: Flags [.], ack 228231730, win 128, options [nop,nop,TS val 4294787541 ecr 4294787531], length 0
11:19:45.319482 IP 10.0.0.2.56819 > 10.0.0.1.8882: Flags [P.], seq 228231894:228232058, ack 2709335573, win 58, options [nop,nop,TS val 4294787571 ecr 4294787541], length 164
11:19:45.319832 IP 10.0.0.1.8882 > 10.0.0.2.56819: Flags [.], ack 228231894, win 130, options [nop,nop,TS val 4294787561 ecr 4294787551], length 0
11:19:45.339532 IP 10.0.0.2.56819 > 10.0.0.1.8882: Flags [P.], seq 228232058:228232222, ack 2709335573, win 58, options [nop,nop,TS val 4294787591 ecr 4294787561], length 164
11:19:45.340201 IP 10.0.0.1.8882 > 10.0.0.2.56819: Flags [.], ack 228232058, win 132, options [nop,nop,TS val 4294787582 ecr 4294787571], length 0
11:19:45.360006 IP 10.0.0.2.56819 > 10.0.0.1.8882: Flags [P.], seq 228232222:228232386, ack 2709335573, win 58, options [nop,nop,TS val 4294787612 ecr 4294787582], length 164
11:19:45.360259 IP 10.0.0.1.8882 > 10.0.0.2.56819: Flags [.], ack 228232222, win 135, options [nop,nop,TS val 4294787602 ecr 4294787591], length 0
11:19:45.380005 IP 10.0.0.2.56819 > 10.0.0.1.8882: Flags [P.], seq 228232386:228232550, ack 2709335573, win 58, options [nop,nop,TS val 4294787632 ecr 4294787602], length 164
11:19:45.380665 IP 10.0.0.1.8882 > 10.0.0.2.56819: Flags [.], ack 228232386, win 137, options [nop,nop,TS val 4294787622 ecr 4294787612], length 0
11:19:45.399828 IP 10.0.0.2.56819 > 10.0.0.1.8882: Flags [P.], seq 228232550:228232714, ack 2709335573, win 58, options [nop,nop,TS val 4294787651 ecr 4294787622], length 164
11:19:45.400418 IP 10.0.0.1.8882 > 10.0.0.2.56819: Flags [.], ack 228232550, win 139, options [nop,nop,TS val 4294787642 ecr 4294787632], length 0
11:19:45.419824 IP 10.0.0.2.56819 > 10.0.0.1.8882: Flags [P.], seq 228232714:228232878, ack 2709335573, win 58, options [nop,nop,TS val 4294787671 ecr 4294787642], length 164
11:19:45.420080 IP 10.0.0.1.8882 > 10.0.0.2.56819: Flags [.], ack 228232714, win 141, options [nop,nop,TS val 4294787662 ecr 4294787651], length 0
11:19:45.440064 IP 10.0.0.2.56819 > 10.0.0.1.8882: Flags [P.], seq 228232878:228233042, ack 2709335573, win 58, options [nop,nop,TS val 4294787692 ecr 4294787662], length 164
11:19:45.440664 IP 10.0.0.1.8882 > 10.0.0.2.56819: Flags [.], ack 228232878, win 143, options [nop,nop,TS val 4294787682 ecr 4294787671], length 0
11:19:45.459457 IP 10.0.0.2.56819 > 10.0.0.1.8882: Flags [P.], seq 228233042:228233206, ack 2709335573, win 58, options [nop,nop,TS val 4294787711 ecr 4294787682], length 164
11:19:45.460492 IP 10.0.0.1.8882 > 10.0.0.2.56819: Flags [.], ack 228233042, win 145, options [nop,nop,TS val 4294787702 ecr 4294787692], length 0
11:19:45.479531 IP 10.0.0.2.56819 > 10.0.0.1.8882: Flags [P.], seq 228233206:228233370, ack 2709335573, win 58, options [nop,nop,TS val 4294787731 ecr 4294787702], length 164
11:19:45.479977 IP 10.0.0.1.8882 > 10.0.0.2.56819: Flags [.], ack 228233206, win 147, options [nop,nop,TS val 4294787721 ecr 4294787711], length 0
11:19:45.499542 IP 10.0.0.2.56819 > 10.0.0.1.8882: Flags [P.], seq 228233370:228233534, ack 2709335573, win 58, options [nop,nop,TS val 4294787751 ecr 4294787721], length 164
11:19:45.500124 IP 10.0.0.1.8882 > 10.0.0.2.56819: Flags [.], ack 228233370, win 149, options [nop,nop,TS val 4294787742 ecr 4294787731], length 0
11:19:45.519433 IP 10.0.0.2.56819 > 10.0.0.1.8882: Flags [P.], seq 228233534:228233698, ack 2709335573, win 58, options [nop,nop,TS val 4294787771 ecr 4294787742], length 164
11:19:45.519913 IP 10.0.0.1.8882 > 10.0.0.2.56819: Flags [.], ack 228233534, win 151, options [nop,nop,TS val 4294787761 ecr 4294787751], length 0
11:19:45.539751 IP 10.0.0.1.8882 > 10.0.0.2.56819: Flags [.], ack 228233698, win 153, options [nop,nop,TS val 4294787781 ecr 4294787771], length 0
11:19:45.539834 IP 10.0.0.2.56819 > 10.0.0.1.8882: Flags [P.], seq 228233698:228233862, ack 2709335573, win 58, options [nop,nop,TS val 4294787791 ecr 4294787761], length 164
11:19:45.560203 IP 10.0.0.1.8882 > 10.0.0.2.56819: Flags [.], ack 228233862, win 155, options [nop,nop,TS val 4294787802 ecr 4294787791], length 0
11:19:45.560786 IP 10.0.0.2.56819 > 10.0.0.1.8882: Flags [P.], seq 228233862:228234026, ack 2709335573, win 58, options [nop,nop,TS val 4294787812 ecr 4294787802], length 164
11:19:45.579780 IP 10.0.0.2.56819 > 10.0.0.1.8882: Flags [P.], seq 228234026:228234190, ack 2709335573, win 58, options [nop,nop,TS val 4294787831 ecr 4294787802], length 164
11:19:45.581377 IP 10.0.0.1.8882 > 10.0.0.2.56819: Flags [.], ack 228234026, win 158, options [nop,nop,TS val 4294787823 ecr 4294787812], length 0
11:19:45.599823 IP 10.0.0.2.56819 > 10.0.0.1.8882: Flags [P.], seq 228234190:228234354, ack 2709335573, win 58, options [nop,nop,TS val 4294787851 ecr 4294787823], length 164
11:19:45.600128 IP 10.0.0.1.8882 > 10.0.0.2.56819: Flags [.], ack 228234190, win 160, options [nop,nop,TS val 4294787842 ecr 4294787831], length 0
11:19:45.619648 IP 10.0.0.2.56819 > 10.0.0.1.8882: Flags [P.], seq 228234354:228234518, ack 2709335573, win 58, options [nop,nop,TS val 4294787871 ecr 4294787842], length 164
11:19:45.620494 IP 10.0.0.1.8882 > 10.0.0.2.56819: Flags [.], ack 228234354, win 162, options [nop,nop,TS val 4294787862 ecr 4294787851], length 0
11:19:45.639639 IP 10.0.0.2.56819 > 10.0.0.1.8882: Flags [P.], seq 228234518:228234682, ack 2709335573, win 58, options [nop,nop,TS val 4294787891 ecr 4294787862], length 164
11:19:45.639915 IP 10.0.0.1.8882 > 10.0.0.2.56819: Flags [.], ack 228234518, win 164, options [nop,nop,TS val 4294787881 ecr 4294787871], length 0
11:19:45.659469 IP 10.0.0.2.56819 > 10.0.0.1.8882: Flags [P.], seq 228234682:228234846, ack 2709335573, win 58, options [nop,nop,TS val 4294787911 ecr 4294787881], length 164
11:19:45.660998 IP 10.0.0.1.8882 > 10.0.0.2.56819: Flags [.], ack 228234682, win 166, options [nop,nop,TS val 4294787901 ecr 4294787891], length 0
11:19:45.679559 IP 10.0.0.2.56819 > 10.0.0.1.8882: Flags [P.], seq 228234846:228235010, ack 2709335573, win 58, options [nop,nop,TS val 4294787931 ecr 4294787901], length 164
11:19:45.679781 IP 10.0.0.1.8882 > 10.0.0.2.56819: Flags [.], ack 228234846, win 168, options [nop,nop,TS val 4294787921 ecr 4294787911], length 0
11:19:45.699585 IP 10.0.0.2.56819 > 10.0.0.1.8882: Flags [P.], seq 228235010:228235174, ack 2709335573, win 58, options [nop,nop,TS val 4294787951 ecr 4294787921], length 164
11:19:45.700318 IP 10.0.0.1.8882 > 10.0.0.2.56819: Flags [.], ack 228235010, win 170, options [nop,nop,TS val 4294787941 ecr 4294787931], length 0
11:19:45.720085 IP 10.0.0.2.56819 > 10.0.0.1.8882: Flags [P.], seq 228235174:228235338, ack 2709335573, win 58, options [nop,nop,TS val 4294787972 ecr 4294787941], length 164
11:19:45.720239 IP 10.0.0.1.8882 > 10.0.0.2.56819: Flags [.], ack 228235174, win 172, options [nop,nop,TS val 4294787962 ecr 4294787951], length 0
11:19:45.739388 IP 10.0.0.2.56819 > 10.0.0.1.8882: Flags [P.], seq 228235338:228235502, ack 2709335573, win 58, options [nop,nop,TS val 4294787991 ecr 4294787962], length 164
11:19:45.740599 IP 10.0.0.1.8882 > 10.0.0.2.56819: Flags [.], ack 228235338, win 174, options [nop,nop,TS val 4294787982 ecr 4294787972], length 0
11:19:45.759720 IP 10.0.0.1.8882 > 10.0.0.2.56819: Flags [.], ack 228235502, win 176, options [nop,nop,TS val 4294788001 ecr 4294787991], length 0
11:19:45.759841 IP 10.0.0.2.56819 > 10.0.0.1.8882: Flags [P.], seq 228235502:228235666, ack 2709335573, win 58, options [nop,nop,TS val 4294788011 ecr 4294787982], length 164
11:19:45.779855 IP 10.0.0.2.56819 > 10.0.0.1.8882: Flags [P.], seq 228235666:228235830, ack 2709335573, win 58, options [nop,nop,TS val 4294788031 ecr 4294788001], length 164
11:19:45.780531 IP 10.0.0.1.8882 > 10.0.0.2.56819: Flags [.], ack 228235666, win 178, options [nop,nop,TS val 4294788022 ecr 4294788011], length 0
11:19:45.799494 IP 10.0.0.2.56819 > 10.0.0.1.8882: Flags [P.], seq 228235830:228235994, ack 2709335573, win 58, options [nop,nop,TS val 4294788051 ecr 4294788022], length 164
11:19:45.800448 IP 10.0.0.1.8882 > 10.0.0.2.56819: Flags [.], ack 228235830, win 181, options [nop,nop,TS val 4294788042 ecr 4294788031], length 0
11:19:45.821513 IP 10.0.0.1.8882 > 10.0.0.2.56819: Flags [.], ack 228235994, win 183, options [nop,nop,TS val 4294788063 ecr 4294788051], length 0
11:19:45.821559 IP 10.0.0.2.56819 > 10.0.0.1.8882: Flags [P.], seq 228235994:228236158, ack 2709335573, win 58, options [nop,nop,TS val 4294788073 ecr 4294788042], length 164
11:19:45.840220 IP 10.0.0.2.56819 > 10.0.0.1.8882: Flags [P.], seq 228236158:228236322, ack 2709335573, win 58, options [nop,nop,TS val 4294788091 ecr 4294788063], length 164
11:19:45.841839 IP 10.0.0.1.8882 > 10.0.0.2.56819: Flags [.], ack 228236158, win 185, options [nop,nop,TS val 4294788083 ecr 4294788073], length 0
11:19:45.859595 IP 10.0.0.2.56819 > 10.0.0.1.8882: Flags [P.], seq 228236322:228236486, ack 2709335573, win 58, options [nop,nop,TS val 4294788111 ecr 4294788083], length 164
11:19:45.860592 IP 10.0.0.1.8882 > 10.0.0.2.56819: Flags [.], ack 228236322, win 187, options [nop,nop,TS val 4294788102 ecr 4294788091], length 0
11:19:45.879413 IP 10.0.0.2.56819 > 10.0.0.1.8882: Flags [P.], seq 228236486:228236650, ack 2709335573, win 58, options [nop,nop,TS val 4294788131 ecr 4294788102], length 164
11:19:45.880164 IP 10.0.0.1.8882 > 10.0.0.2.56819: Flags [.], ack 228236486, win 189, options [nop,nop,TS val 4294788122 ecr 4294788111], length 0
11:19:45.899716 IP 10.0.0.1.8882 > 10.0.0.2.56819: Flags [.], ack 228236650, win 191, options [nop,nop,TS val 4294788141 ecr 4294788131], length 0
11:19:45.899850 IP 10.0.0.2.56819 > 10.0.0.1.8882: Flags [P.], seq 228236650:228236814, ack 2709335573, win 58, options [nop,nop,TS val 4294788151 ecr 4294788141], length 164
11:19:45.919468 IP 10.0.0.2.56819 > 10.0.0.1.8882: Flags [P.], seq 228236814:228236978, ack 2709335573, win 58, options [nop,nop,TS val 4294788171 ecr 4294788141], length 164
11:19:45.920661 IP 10.0.0.1.8882 > 10.0.0.2.56819: Flags [.], ack 228236814, win 193, options [nop,nop,TS val 4294788162 ecr 4294788151], length 0
11:19:45.939637 IP 10.0.0.2.56819 > 10.0.0.1.8882: Flags [P.], seq 228236978:228237142, ack 2709335573, win 58, options [nop,nop,TS val 4294788191 ecr 4294788162], length 164
11:19:45.940768 IP 10.0.0.1.8882 > 10.0.0.2.56819: Flags [.], ack 228236978, win 195, options [nop,nop,TS val 4294788182 ecr 4294788171], length 0
11:19:45.959493 IP 10.0.0.2.56819 > 10.0.0.1.8882: Flags [P.], seq 228237142:228237306, ack 2709335573, win 58, options [nop,nop,TS val 4294788211 ecr 4294788182], length 164
11:19:45.960020 IP 10.0.0.1.8882 > 10.0.0.2.56819: Flags [.], ack 228237142, win 197, options [nop,nop,TS val 4294788201 ecr 4294788191], length 0
11:19:45.979705 IP 10.0.0.2.56819 > 10.0.0.1.8882: Flags [P.], seq 228237306:228237470, ack 2709335573, win 58, options [nop,nop,TS val 4294788231 ecr 4294788201], length 164
11:19:45.979813 IP 10.0.0.1.8882 > 10.0.0.2.56819: Flags [.], ack 228237306, win 199, options [nop,nop,TS val 4294788221 ecr 4294788211], length 0
11:19:45.999612 IP 10.0.0.2.56819 > 10.0.0.1.8882: Flags [P.], seq 228237470:228237634, ack 2709335573, win 58, options [nop,nop,TS val 4294788251 ecr 4294788221], length 164
11:19:46.000632 IP 10.0.0.1.8882 > 10.0.0.2.56819: Flags [.], ack 228237470, win 202, options [nop,nop,TS val 4294788242 ecr 4294788231], length 0
11:19:46.019588 IP 10.0.0.2.56819 > 10.0.0.1.8882: Flags [P.], seq 228237634:228237798, ack 2709335573, win 58, options [nop,nop,TS val 4294788271 ecr 4294788242], length 164
11:19:46.020116 IP 10.0.0.1.8882 > 10.0.0.2.56819: Flags [.], ack 228237634, win 204, options [nop,nop,TS val 4294788261 ecr 4294788251], length 0
11:19:46.039493 IP 10.0.0.2.56819 > 10.0.0.1.8882: Flags [P.], seq 228237798:228237962, ack 2709335573, win 58, options [nop,nop,TS val 4294788291 ecr 4294788261], length 164
11:19:46.039869 IP 10.0.0.1.8882 > 10.0.0.2.56819: Flags [.], ack 228237798, win 206, options [nop,nop,TS val 4294788281 ecr 4294788271], length 0
11:19:46.059608 IP 10.0.0.2.56819 > 10.0.0.1.8882: Flags [P.], seq 228237962:228238126, ack 2709335573, win 58, options [nop,nop,TS val 4294788311 ecr 4294788281], length 164
11:19:46.059984 IP 10.0.0.1.8882 > 10.0.0.2.56819: Flags [.], ack 228237962, win 208, options [nop,nop,TS val 4294788301 ecr 4294788291], length 0
11:19:46.079534 IP 10.0.0.2.56819 > 10.0.0.1.8882: Flags [P.], seq 228238126:228238290, ack 2709335573, win 58, options [nop,nop,TS val 4294788331 ecr 4294788301], length 164
11:19:46.080121 IP 10.0.0.1.8882 > 10.0.0.2.56819: Flags [.], ack 228238126, win 210, options [nop,nop,TS val 4294788321 ecr 4294788311], length 0
11:19:46.099382 IP 10.0.0.2.56819 > 10.0.0.1.8882: Flags [P.], seq 228238290:228238454, ack 2709335573, win 58, options [nop,nop,TS val 4294788351 ecr 4294788321], length 164
11:19:46.100066 IP 10.0.0.1.8882 > 10.0.0.2.56819: Flags [.], ack 228238290, win 212, options [nop,nop,TS val 4294788341 ecr 4294788331], length 0
11:19:46.119546 IP 10.0.0.2.56819 > 10.0.0.1.8882: Flags [P.], seq 228238454:228238618, ack 2709335573, win 58, options [nop,nop,TS val 4294788371 ecr 4294788341], length 164
11:19:46.120039 IP 10.0.0.1.8882 > 10.0.0.2.56819: Flags [.], ack 228238454, win 214, options [nop,nop,TS val 4294788361 ecr 4294788351], length 0
11:19:46.139634 IP 10.0.0.2.56819 > 10.0.0.1.8882: Flags [P.], seq 228238618:228238782, ack 2709335573, win 58, options [nop,nop,TS val 4294788391 ecr 4294788361], length 164
11:19:46.139741 IP 10.0.0.1.8882 > 10.0.0.2.56819: Flags [.], ack 228238618, win 216, options [nop,nop,TS val 4294788381 ecr 4294788371], length 0
11:19:46.159483 IP 10.0.0.2.56819 > 10.0.0.1.8882: Flags [P.], seq 228238782:228238946, ack 2709335573, win 58, options [nop,nop,TS val 4294788411 ecr 4294788381], length 164
11:19:46.159860 IP 10.0.0.1.8882 > 10.0.0.2.56819: Flags [.], ack 228238782, win 218, options [nop,nop,TS val 4294788401 ecr 4294788391], length 0
11:19:46.179557 IP 10.0.0.2.56819 > 10.0.0.1.8882: Flags [P.], seq 228238946:228239110, ack 2709335573, win 58, options [nop,nop,TS val 4294788431 ecr 4294788401], length 164
11:19:46.180235 IP 10.0.0.1.8882 > 10.0.0.2.56819: Flags [.], ack 228238946, win 220, options [nop,nop,TS val 4294788421 ecr 4294788411], length 0
11:19:46.200546 IP 10.0.0.1.8882 > 10.0.0.2.56819: Flags [.], ack 228239110, win 222, options [nop,nop,TS val 4294788441 ecr 4294788431], length 0
11:19:46.200591 IP 10.0.0.2.56819 > 10.0.0.1.8882: Flags [P.], seq 228239110:228239274, ack 2709335573, win 58, options [nop,nop,TS val 4294788452 ecr 4294788421], length 164
11:19:46.221230 IP 10.0.0.1.8882 > 10.0.0.2.56819: Flags [.], ack 228239274, win 225, options [nop,nop,TS val 4294788462 ecr 4294788452], length 0
11:19:46.221267 IP 10.0.0.2.56819 > 10.0.0.1.8882: Flags [P.], seq 228239274:228239438, ack 2709335573, win 58, options [nop,nop,TS val 4294788473 ecr 4294788441], length 164
11:19:46.239490 IP 10.0.0.2.56819 > 10.0.0.1.8882: Flags [P.], seq 228239438:228239602, ack 2709335573, win 58, options [nop,nop,TS val 4294788491 ecr 4294788462], length 164
11:19:46.241846 IP 10.0.0.1.8882 > 10.0.0.2.56819: Flags [.], ack 228239438, win 227, options [nop,nop,TS val 4294788483 ecr 4294788473], length 0
11:19:46.260286 IP 10.0.0.2.56819 > 10.0.0.1.8882: Flags [P.], seq 228239602:228239766, ack 2709335573, win 58, options [nop,nop,TS val 4294788512 ecr 4294788483], length 164
11:19:46.278306 IP 10.0.0.1.8882 > 10.0.0.2.56819: Flags [.], ack 228239602, win 229, options [nop,nop,TS val 4294788520 ecr 4294788491], length 0
11:19:46.279899 IP 10.0.0.2.56819 > 10.0.0.1.8882: Flags [P.], seq 228239766:228239930, ack 2709335573, win 58, options [nop,nop,TS val 4294788531 ecr 4294788520], length 164
11:19:46.299684 IP 10.0.0.2.56819 > 10.0.0.1.8882: Flags [P.], seq 228239930:228240094, ack 2709335573, win 58, options [nop,nop,TS val 4294788551 ecr 4294788520], length 164
11:19:46.319397 IP 10.0.0.2.56819 > 10.0.0.1.8882: Flags [P.], seq 228240094:228240258, ack 2709335573, win 58, options [nop,nop,TS val 4294788571 ecr 4294788520], length 164
11:19:46.340249 IP 10.0.0.2.56819 > 10.0.0.1.8882: Flags [P.], seq 228240258:228240422, ack 2709335573, win 58, options [nop,nop,TS val 4294788592 ecr 4294788520], length 164
11:19:46.359648 IP 10.0.0.2.56819 > 10.0.0.1.8882: Flags [P.], seq 228240422:228240586, ack 2709335573, win 58, options [nop,nop,TS val 4294788611 ecr 4294788520], length 164
11:19:46.379682 IP 10.0.0.2.56819 > 10.0.0.1.8882: Flags [P.], seq 228240586:228240750, ack 2709335573, win 58, options [nop,nop,TS val 4294788631 ecr 4294788520], length 164
11:19:46.380202 IP 10.0.0.1.8882 > 10.0.0.2.56819: Flags [.], ack 228239602, win 231, options [nop,nop,TS val 4294788622 ecr 4294788491,nop,nop,sack 1 {228240258:228240422}], length 0
11:19:46.380297 IP 10.0.0.2.56819 > 10.0.0.1.8882: Flags [P.], seq 228239602:228240258, ack 2709335573, win 58, options [nop,nop,TS val 4294788632 ecr 4294788622], length 656
11:19:46.389859 IP 10.0.0.1.8882 > 10.0.0.2.56819: Flags [.], ack 228239602, win 233, options [nop,nop,TS val 4294788631 ecr 4294788491,nop,nop,sack 1 {228240258:228240586}], length 0
11:19:46.399386 IP 10.0.0.2.56819 > 10.0.0.1.8882: Flags [P.], seq 228240750:228240914, ack 2709335573, win 58, options [nop,nop,TS val 4294788651 ecr 4294788631], length 164
11:19:46.411373 IP 10.0.0.1.8882 > 10.0.0.2.56819: Flags [.], ack 228239602, win 235, options [nop,nop,TS val 4294788653 ecr 4294788491,nop,nop,sack 1 {228240258:228240750}], length 0
11:19:46.411375 IP 10.0.0.1.8882 > 10.0.0.2.56819: Flags [.], ack 228240750, win 238, options [nop,nop,TS val 4294788653 ecr 4294788632], length 0
11:19:46.419396 IP 10.0.0.2.56819 > 10.0.0.1.8882: Flags [P.], seq 228240914:228241078, ack 2709335573, win 58, options [nop,nop,TS val 4294788671 ecr 4294788653], length 164
11:19:46.428582 IP 10.0.0.1.8882 > 10.0.0.2.56819: Flags [.], ack 228240914, win 240, options [nop,nop,TS val 4294788670 ecr 4294788651], length 0
11:19:46.440250 IP 10.0.0.2.56819 > 10.0.0.1.8882: Flags [P.], seq 228241078:228241242, ack 2709335573, win 58, options [nop,nop,TS val 4294788692 ecr 4294788670], length 164
11:19:46.459307 IP 10.0.0.1.8882 > 10.0.0.2.56819: Flags [.], ack 228241078, win 243, options [nop,nop,TS val 4294788701 ecr 4294788671], length 0
11:19:46.459517 IP 10.0.0.2.56819 > 10.0.0.1.8882: Flags [P.], seq 228241242:228241406, ack 2709335573, win 58, options [nop,nop,TS val 4294788711 ecr 4294788701], length 164
11:19:46.479439 IP 10.0.0.2.56819 > 10.0.0.1.8882: Flags [P.], seq 228241406:228241570, ack 2709335573, win 58, options [nop,nop,TS val 4294788731 ecr 4294788701], length 164
11:19:46.482514 IP 10.0.0.1.8882 > 10.0.0.2.56819: Flags [.], ack 228241242, win 245, options [nop,nop,TS val 4294788723 ecr 4294788692], length 0
11:19:46.493030 IP 10.0.0.1.8882 > 10.0.0.2.56819: Flags [.], ack 228241406, win 248, options [nop,nop,TS val 4294788734 ecr 4294788711], length 0
11:19:46.499610 IP 10.0.0.2.56819 > 10.0.0.1.8882: Flags [P.], seq 228241570:228241734, ack 2709335573, win 58, options [nop,nop,TS val 4294788751 ecr 4294788734], length 164
11:19:46.499719 IP 10.0.0.1.8882 > 10.0.0.2.56819: Flags [.], ack 228241570, win 250, options [nop,nop,TS val 4294788741 ecr 4294788731], length 0
11:19:46.519405 IP 10.0.0.2.56819 > 10.0.0.1.8882: Flags [P.], seq 228241734:228241898, ack 2709335573, win 58, options [nop,nop,TS val 4294788771 ecr 4294788741], length 164
11:19:46.519973 IP 10.0.0.1.8882 > 10.0.0.2.56819: Flags [.], ack 228241734, win 253, options [nop,nop,TS val 4294788761 ecr 4294788751], length 0
11:19:46.539407 IP 10.0.0.2.56819 > 10.0.0.1.8882: Flags [P.], seq 228241898:228242062, ack 2709335573, win 58, options [nop,nop,TS val 4294788790 ecr 4294788761], length 164
11:19:46.546859 IP 10.0.0.1.8882 > 10.0.0.2.56819: Flags [.], ack 228241898, win 256, options [nop,nop,TS val 4294788788 ecr 4294788771], length 0
11:19:46.559503 IP 10.0.0.2.56819 > 10.0.0.1.8882: Flags [P.], seq 228242062:228242226, ack 2709335573, win 58, options [nop,nop,TS val 4294788811 ecr 4294788788], length 164
11:19:46.566587 IP 10.0.0.1.8882 > 10.0.0.2.56819: Flags [.], ack 228242062, win 258, options [nop,nop,TS val 4294788808 ecr 4294788790], length 0
11:19:46.579646 IP 10.0.0.2.56819 > 10.0.0.1.8882: Flags [P.], seq 228242226:228242390, ack 2709335573, win 58, options [nop,nop,TS val 4294788831 ecr 4294788808], length 164
11:19:46.599564 IP 10.0.0.2.56819 > 10.0.0.1.8882: Flags [P.], seq 228242390:228242554, ack 2709335573, win 58, options [nop,nop,TS val 4294788851 ecr 4294788808], length 164
11:19:46.599698 IP 10.0.0.1.8882 > 10.0.0.2.56819: Flags [.], ack 228242226, win 261, options [nop,nop,TS val 4294788841 ecr 4294788811], length 0
11:19:46.619661 IP 10.0.0.2.56819 > 10.0.0.1.8882: Flags [P.], seq 228242554:228242718, ack 2709335573, win 58, options [nop,nop,TS val 4294788871 ecr 4294788841], length 164
11:19:46.621025 IP 10.0.0.1.8882 > 10.0.0.2.56819: Flags [.], ack 228242390, win 263, options [nop,nop,TS val 4294788862 ecr 4294788831], length 0
11:19:46.642538 IP 10.0.0.1.8882 > 10.0.0.2.56819: Flags [.], ack 228242554, win 266, options [nop,nop,TS val 4294788883 ecr 4294788851], length 0
11:19:46.642589 IP 10.0.0.2.56819 > 10.0.0.1.8882: Flags [P.], seq 228242718:228242882, ack 2709335573, win 58, options [nop,nop,TS val 4294788894 ecr 4294788862], length 164
11:19:46.655899 IP 10.0.0.1.8882 > 10.0.0.2.56819: Flags [.], ack 228242718, win 268, options [nop,nop,TS val 4294788897 ecr 4294788871], length 0
11:19:46.659375 IP 10.0.0.2.56819 > 10.0.0.1.8882: Flags [P.], seq 228242882:228243046, ack 2709335573, win 58, options [nop,nop,TS val 4294788911 ecr 4294788897], length 164
11:19:46.679703 IP 10.0.0.2.56819 > 10.0.0.1.8882: Flags [P.], seq 228243046:228243210, ack 2709335573, win 58, options [nop,nop,TS val 4294788931 ecr 4294788897], length 164
11:19:46.681750 IP 10.0.0.1.8882 > 10.0.0.2.56819: Flags [.], ack 228242718, win 271, options [nop,nop,TS val 4294788923 ecr 4294788871,nop,nop,sack 1 {228242882:228243046}], length 0
11:19:46.689073 IP 10.0.0.2.56819 > 10.0.0.1.8882: Flags [P.], seq 228242718:228242882, ack 2709335573, win 58, options [nop,nop,TS val 4294788941 ecr 4294788923], length 164
11:19:46.699639 IP 10.0.0.2.56819 > 10.0.0.1.8882: Flags [P.], seq 228243210:228243374, ack 2709335573, win 58, options [nop,nop,TS val 4294788951 ecr 4294788923], length 164
11:19:46.702099 IP 10.0.0.1.8882 > 10.0.0.2.56819: Flags [.], ack 228242718, win 273, options [nop,nop,TS val 4294788943 ecr 4294788871,nop,nop,sack 1 {228242882:228243210}], length 0
11:19:46.709810 IP 10.0.0.1.8882 > 10.0.0.2.56819: Flags [.], ack 228243210, win 276, options [nop,nop,TS val 4294788951 ecr 4294788941], length 0
11:19:46.719404 IP 10.0.0.2.56819 > 10.0.0.1.8882: Flags [P.], seq 228243374:228243538, ack 2709335573, win 58, options [nop,nop,TS val 4294788971 ecr 4294788951], length 164
11:19:46.723435 IP 10.0.0.1.8882 > 10.0.0.2.56819: Flags [.], ack 228243374, win 279, options [nop,nop,TS val 4294788965 ecr 4294788951], length 0
11:19:46.741354 IP 10.0.0.2.56819 > 10.0.0.1.8882: Flags [P.], seq 228243538:228243702, ack 2709335573, win 58, options [nop,nop,TS val 4294788993 ecr 4294788965], length 164
11:19:46.745459 IP 10.0.0.1.8882 > 10.0.0.2.56819: Flags [.], ack 228243538, win 281, options [nop,nop,TS val 4294788987 ecr 4294788971], length 0
11:19:46.759654 IP 10.0.0.2.56819 > 10.0.0.1.8882: Flags [P.], seq 228243702:228243866, ack 2709335573, win 58, options [nop,nop,TS val 4294789011 ecr 4294788987], length 164
11:19:46.769320 IP 10.0.0.1.8882 > 10.0.0.2.56819: Flags [.], ack 228243702, win 284, options [nop,nop,TS val 4294789010 ecr 4294788993], length 0
11:19:46.780590 IP 10.0.0.2.56819 > 10.0.0.1.8882: Flags [P.], seq 228243866:228244030, ack 2709335573, win 58, options [nop,nop,TS val 4294789032 ecr 4294789010], length 164
11:19:46.786487 IP 10.0.0.1.8882 > 10.0.0.2.56819: Flags [.], ack 228243866, win 286, options [nop,nop,TS val 4294789028 ecr 4294789011], length 0
11:19:46.799551 IP 10.0.0.2.56819 > 10.0.0.1.8882: Flags [P.], seq 228244030:228244194, ack 2709335573, win 58, options [nop,nop,TS val 4294789051 ecr 4294789028], length 164
11:19:46.804875 IP 10.0.0.1.8882 > 10.0.0.2.56819: Flags [.], ack 228244030, win 289, options [nop,nop,TS val 4294789046 ecr 4294789032], length 0
11:19:46.819457 IP 10.0.0.2.56819 > 10.0.0.1.8882: Flags [P.], seq 228244194:228244358, ack 2709335573, win 58, options [nop,nop,TS val 4294789071 ecr 4294789046], length 164
11:19:46.826278 IP 10.0.0.1.8882 > 10.0.0.2.56819: Flags [.], ack 228244194, win 291, options [nop,nop,TS val 4294789068 ecr 4294789051], length 0
11:19:46.839583 IP 10.0.0.2.56819 > 10.0.0.1.8882: Flags [P.], seq 228244358:228244522, ack 2709335573, win 58, options [nop,nop,TS val 4294789091 ecr 4294789068], length 164
11:19:46.845242 IP 10.0.0.1.8882 > 10.0.0.2.56819: Flags [.], ack 228244358, win 294, options [nop,nop,TS val 4294789086 ecr 4294789071], length 0
11:19:46.860187 IP 10.0.0.2.56819 > 10.0.0.1.8882: Flags [P.], seq 228244522:228244686, ack 2709335573, win 58, options [nop,nop,TS val 4294789112 ecr 4294789086], length 164
11:19:46.866458 IP 10.0.0.1.8882 > 10.0.0.2.56819: Flags [.], ack 228244522, win 297, options [nop,nop,TS val 4294789108 ecr 4294789091], length 0
11:19:46.879718 IP 10.0.0.2.56819 > 10.0.0.1.8882: Flags [P.], seq 228244686:228244850, ack 2709335573, win 58, options [nop,nop,TS val 4294789131 ecr 4294789108], length 164
11:19:46.887776 IP 10.0.0.1.8882 > 10.0.0.2.56819: Flags [.], ack 228244686, win 299, options [nop,nop,TS val 4294789129 ecr 4294789112], length 0
11:19:46.899371 IP 10.0.0.2.56819 > 10.0.0.1.8882: Flags [P.], seq 228244850:228245014, ack 2709335573, win 58, options [nop,nop,TS val 4294789151 ecr 4294789129], length 164
11:19:46.906341 IP 10.0.0.1.8882 > 10.0.0.2.56819: Flags [.], ack 228244850, win 302, options [nop,nop,TS val 4294789148 ecr 4294789131], length 0
11:19:46.919622 IP 10.0.0.2.56819 > 10.0.0.1.8882: Flags [P.], seq 228245014:228245178, ack 2709335573, win 58, options [nop,nop,TS val 4294789171 ecr 4294789148], length 164
11:19:46.924242 IP 10.0.0.1.8882 > 10.0.0.2.56819: Flags [.], ack 228245014, win 304, options [nop,nop,TS val 4294789166 ecr 4294789151], length 0
11:19:46.939434 IP 10.0.0.2.56819 > 10.0.0.1.8882: Flags [P.], seq 228245178:228245342, ack 2709335573, win 58, options [nop,nop,TS val 4294789191 ecr 4294789166], length 164
11:19:46.946943 IP 10.0.0.1.8882 > 10.0.0.2.56819: Flags [.], ack 228245178, win 307, options [nop,nop,TS val 4294789188 ecr 4294789171], length 0
11:19:46.959500 IP 10.0.0.2.56819 > 10.0.0.1.8882: Flags [P.], seq 228245342:228245506, ack 2709335573, win 58, options [nop,nop,TS val 4294789211 ecr 4294789188], length 164
11:19:46.965133 IP 10.0.0.1.8882 > 10.0.0.2.56819: Flags [.], ack 228245342, win 309, options [nop,nop,TS val 4294789206 ecr 4294789191], length 0
11:19:46.982450 IP 10.0.0.2.56819 > 10.0.0.1.8882: Flags [P.], seq 228245506:228245670, ack 2709335573, win 58, options [nop,nop,TS val 4294789234 ecr 4294789206], length 164
11:19:46.987493 IP 10.0.0.1.8882 > 10.0.0.2.56819: Flags [.], ack 228245506, win 312, options [nop,nop,TS val 4294789228 ecr 4294789211], length 0
11:19:46.999935 IP 10.0.0.2.56819 > 10.0.0.1.8882: Flags [P.], seq 228245670:228245834, ack 2709335573, win 58, options [nop,nop,TS val 4294789251 ecr 4294789228], length 164
11:19:47.011182 IP 10.0.0.1.8882 > 10.0.0.2.56819: Flags [.], ack 228245670, win 314, options [nop,nop,TS val 4294789253 ecr 4294789234], length 0
11:19:47.019770 IP 10.0.0.2.56819 > 10.0.0.1.8882: Flags [P.], seq 228245834:228245998, ack 2709335573, win 58, options [nop,nop,TS val 4294789271 ecr 4294789253], length 164
11:19:47.029228 IP 10.0.0.1.8882 > 10.0.0.2.56819: Flags [.], ack 228245834, win 317, options [nop,nop,TS val 4294789271 ecr 4294789251], length 0
11:19:47.040312 IP 10.0.0.2.56819 > 10.0.0.1.8882: Flags [P.], seq 228245998:228246162, ack 2709335573, win 58, options [nop,nop,TS val 4294789292 ecr 4294789271], length 164
11:19:47.048788 IP 10.0.0.1.8882 > 10.0.0.2.56819: Flags [.], ack 228245998, win 320, options [nop,nop,TS val 4294789289 ecr 4294789271], length 0
11:19:47.059516 IP 10.0.0.2.56819 > 10.0.0.1.8882: Flags [P.], seq 228246162:228246326, ack 2709335573, win 58, options [nop,nop,TS val 4294789311 ecr 4294789289], length 164
11:19:47.069313 IP 10.0.0.1.8882 > 10.0.0.2.56819: Flags [.], ack 228246162, win 322, options [nop,nop,TS val 4294789311 ecr 4294789292], length 0
11:19:47.079522 IP 10.0.0.2.56819 > 10.0.0.1.8882: Flags [P.], seq 228246326:228246490, ack 2709335573, win 58, options [nop,nop,TS val 4294789331 ecr 4294789311], length 164
11:19:47.087694 IP 10.0.0.1.8882 > 10.0.0.2.56819: Flags [.], ack 228246326, win 325, options [nop,nop,TS val 4294789329 ecr 4294789311], length 0
11:19:47.099935 IP 10.0.0.2.56819 > 10.0.0.1.8882: Flags [P.], seq 228246490:228246654, ack 2709335573, win 58, options [nop,nop,TS val 4294789351 ecr 4294789329], length 164
11:19:47.109450 IP 10.0.0.1.8882 > 10.0.0.2.56819: Flags [.], ack 228246490, win 327, options [nop,nop,TS val 4294789351 ecr 4294789331], length 0
11:19:47.119412 IP 10.0.0.2.56819 > 10.0.0.1.8882: Flags [P.], seq 228246654:228246818, ack 2709335573, win 58, options [nop,nop,TS val 4294789371 ecr 4294789351], length 164
11:19:47.127902 IP 10.0.0.1.8882 > 10.0.0.2.56819: Flags [.], ack 228246654, win 330, options [nop,nop,TS val 4294789369 ecr 4294789351], length 0
11:19:47.140112 IP 10.0.0.2.56819 > 10.0.0.1.8882: Flags [P.], seq 228246818:228246982, ack 2709335573, win 58, options [nop,nop,TS val 4294789391 ecr 4294789369], length 164
11:19:47.149762 IP 10.0.0.1.8882 > 10.0.0.2.56819: Flags [.], ack 228246818, win 332, options [nop,nop,TS val 4294789391 ecr 4294789371], length 0
11:19:47.171949 IP 10.0.0.2.56819 > 10.0.0.1.8882: Flags [P.], seq 228246982:228247146, ack 2709335573, win 58, options [nop,nop,TS val 4294789423 ecr 4294789391], length 164
11:19:47.179786 IP 10.0.0.2.56819 > 10.0.0.1.8882: Flags [P.], seq 228247146:228247310, ack 2709335573, win 58, options [nop,nop,TS val 4294789431 ecr 4294789391], length 164
11:19:47.189508 IP 10.0.0.1.8882 > 10.0.0.2.56819: Flags [.], ack 228246982, win 335, options [nop,nop,TS val 4294789430 ecr 4294789391], length 0
11:19:47.199584 IP 10.0.0.2.56819 > 10.0.0.1.8882: Flags [P.], seq 228247310:228247474, ack 2709335573, win 58, options [nop,nop,TS val 4294789451 ecr 4294789430], length 164
11:19:47.214514 IP 10.0.0.1.8882 > 10.0.0.2.56819: Flags [.], ack 228247146, win 338, options [nop,nop,TS val 4294789455 ecr 4294789423], length 0
11:19:47.214516 IP 10.0.0.1.8882 > 10.0.0.2.56819: Flags [.], ack 228247310, win 340, options [nop,nop,TS val 4294789455 ecr 4294789431], length 0
11:19:47.219525 IP 10.0.0.2.56819 > 10.0.0.1.8882: Flags [P.], seq 228247474:228247638, ack 2709335573, win 58, options [nop,nop,TS val 4294789471 ecr 4294789455], length 164
11:19:47.229508 IP 10.0.0.1.8882 > 10.0.0.2.56819: Flags [.], ack 228247474, win 343, options [nop,nop,TS val 4294789471 ecr 4294789451], length 0
11:19:47.239468 IP 10.0.0.2.56819 > 10.0.0.1.8882: Flags [P.], seq 228247638:228247802, ack 2709335573, win 58, options [nop,nop,TS val 4294789491 ecr 4294789471], length 164
11:19:47.251557 IP 10.0.0.1.8882 > 10.0.0.2.56819: Flags [.], ack 228247638, win 345, options [nop,nop,TS val 4294789492 ecr 4294789471], length 0
11:19:47.259619 IP 10.0.0.2.56819 > 10.0.0.1.8882: Flags [P.], seq 228247802:228247966, ack 2709335573, win 58, options [nop,nop,TS val 4294789511 ecr 4294789492], length 164
11:19:47.273351 IP 10.0.0.1.8882 > 10.0.0.2.56819: Flags [.], ack 228247802, win 348, options [nop,nop,TS val 4294789515 ecr 4294789491], length 0
11:19:47.279566 IP 10.0.0.2.56819 > 10.0.0.1.8882: Flags [P.], seq 228247966:228248130, ack 2709335573, win 58, options [nop,nop,TS val 4294789531 ecr 4294789515], length 164
11:19:47.290720 IP 10.0.0.1.8882 > 10.0.0.2.56819: Flags [.], ack 228247966, win 350, options [nop,nop,TS val 4294789532 ecr 4294789511], length 0
11:19:47.301196 IP 10.0.0.2.56819 > 10.0.0.1.8882: Flags [P.], seq 228248130:228248294, ack 2709335573, win 58, options [nop,nop,TS val 4294789553 ecr 4294789532], length 164
11:19:47.313000 IP 10.0.0.1.8882 > 10.0.0.2.56819: Flags [.], ack 228248130, win 353, options [nop,nop,TS val 4294789554 ecr 4294789531], length 0
11:19:47.319833 IP 10.0.0.2.56819 > 10.0.0.1.8882: Flags [P.], seq 228248294:228248458, ack 2709335573, win 58, options [nop,nop,TS val 4294789571 ecr 4294789554], length 164
